"cond-mat/0407075","Guido Pupillo","Guido Pupillo, Carl J. Williams and Nikolay V. Prokof'ev","Effects of finite temperature on the Mott insulator state","6 pages, 5 figures; Final version, published in PRA","Phys. Rev. A 73, 013408 (2006)","10.1103/PhysRevA.73.013408",,"cond-mat.other quant-ph",,"  We investigate the effects of finite temperature on ultracold Bose atoms
confined in an optical lattice plus a parabolic potential in the Mott insulator
state. In particular, we analyze the temperature dependence of the density
distribution of atomic pairs in the lattice, by means of exact Monte-Carlo
simulations. We introduce a simple model that quantitatively accounts for the
computed pair density distributions at low enough temperatures. We suggest that
the temperature dependence of the atomic pair statistics may be used to
estimate the system's temperature at energies of the order of the atoms'
interaction energy.
","[{""version"":""v1"",""created"":""Fri, 2 Jul 2004 17:02:31 GMT""},{""version"":""v2"",""created"":""Thu, 29 Sep 2005 18:31:52 GMT""},{""version"":""v3"",""created"":""Mon, 23 Jan 2006 13:51:31 GMT""}]","2009-11-10"
"cond-mat/0407076","Jonathan Keeling","Jonathan Keeling, P. R. Eastham, M. H. Szymanska and P. B. Littlewood","Polariton condensation with localised excitons and propagating photons","5 pages, 4 figures, Corrected typos, replaced figure 3","Phys. Rev. Lett. 93, 226403 (2004)","10.1103/PhysRevLett.93.226403",,"cond-mat.str-el",,"  We estimate the condensation temperature for microcavity polaritons, allowing
for their internal structure. We consider polaritons formed from localised
excitons in a planar microcavity, using a generalised Dicke model. At low
densities, we find a condensation temperature T_c \propto \rho, as expected for
a gas of structureless polaritons. However, as T_c becomes of the order of the
Rabi splitting, the structure of the polaritons becomes relevant, and the
condensation temperature is that of a B.C.S.-like mean field theory. We also
calculate the excitation spectrum, which is related to observable quantities
such as the luminescence and absorption spectra.
","[{""version"":""v1"",""created"":""Fri, 2 Jul 2004 17:57:51 GMT""},{""version"":""v2"",""created"":""Thu, 11 Nov 2004 10:57:40 GMT""}]","2007-05-23"
"cond-mat/0407077","David Vanderbilt","Armin Antons (1 and 2), J.B. Neaton (1 and 3), Karin M. Rabe (1), and
  David Vanderbilt (1) ((1) Department of Physics and Astronomy, Rutgers
  University, NJ, (2) IFF Juelich, Germany, (3) LBNL, Berkeley, CA)","Tunability of the dielectric response of epitaxially strained SrTiO3
  from first principles","11 pages, with postscript figures embedded. Uses REVTEX and epsf
  macros. Also available at
  http://www.physics.rutgers.edu/~dhv/preprints/ant_srti/index.html",,"10.1103/PhysRevB.71.024102",,"cond-mat.mtrl-sci",,"  The effect of in-plane strain on the nonlinear dielectric properties of
SrTiO3 epitaxial thin films is calculated using density-functional theory
within the local-density approximation. Motivated by recent experiments, the
structure, zone-center phonons, and dielectric properties with and without an
external electric field are evaluated for several misfit strains within +-3% of
the calculated cubic lattice parameter. In these calculations, the in-plane
lattice parameters are fixed, and all remaining structural parameters are
permitted to relax. The presence of an external bias is treated approximately
by applying a force to each ion proportional to the electric field. After
obtaining zero-field ground state structures for various strains, the
zone-center phonon frequencies and Born effective charges are computed,
yielding the zero-field dielectric response. The dielectric response at finite
electric field bias is obtained by computing the field dependence of the
structure and polarization using an approximate technique. The results are
compared with recent experiments and a previous phenomenological theory. The
tunability is found to be strongly dependent on the in-plane lattice parameter,
showing markedly different behavior for tensile and compressive strains. Our
results are expected to be of use for isolating the role of strain in the
tunability of real ultrathin epitaxial films.
","[{""version"":""v1"",""created"":""Fri, 2 Jul 2004 18:22:59 GMT""}]","2009-11-10"
"cond-mat/0407078","Vladimir Kuznetsov","V. I. Kuznetsov and V. A. Tulin","Induction of phase-slip lines in a thin, wide superconducting film by an
  rf electromagnetic field","4 pages, 3 figures, RevTex4. Misprints of the original paper
  corrected. Numeric format(separators)in Figures changed","JETP Letters 61, 1026 (1995) [Russian original: Pis'ma v Zh. Eksp.
  Teor. Fiz. 61, 992 (1995)]",,,"cond-mat.supr-con cond-mat.mes-hall",,"  The appearance of phase-slip lines, induced by an rf field, was observed
experimentally in wide superconducting films in which the destruction of
superconductivity by a dc current is associated with the formation of
phase-slip lines. The characteristics of the separation of the film into
superconducting and nonuniform, isothermal, nonequilibrium regions (phase-slip
lines) under electromagnetic irradiation were studied.
","[{""version"":""v1"",""created"":""Fri, 2 Jul 2004 20:30:46 GMT""},{""version"":""v2"",""created"":""Sat, 17 Jul 2004 21:21:42 GMT""}]","2007-05-23"
"cond-mat/0407079","Marconi Barbosa Dr","Erbe P. Rodrigues, Marconi S. Barbosa and Luciano da F. Costa","A self-referred approach to lacunarity",,,"10.1103/PhysRevE.72.016707",,"cond-mat.stat-mech",,"  This letter describes an approach to lacunarity which adopts the pattern
under analysis as the reference for the sliding window procedure. The
superiority of such a scheme with respect to more traditional methodologies,
especially when dealing with finite-size objects, is established and
illustrated through applications to DLA pattern characterization. It is also
shown that, given the enhanced accuracy and sensitivity of this scheme, the
shape of the window becomes an important parameter, with advantage for circular
windows.
","[{""version"":""v1"",""created"":""Fri, 2 Jul 2004 22:28:26 GMT""}]","2009-11-10"
"cond-mat/0407081","Gonzalo Usaj","Gonzalo Usaj, P. Lustemberg and C. A. Balseiro","Tuning the Non-local Spin-Spin Interaction between Quantum Dots with a
  Magnetic Field","4 pages, 5 figures. Published version","Phys. Rev. Lett. 94, 036803 (2005)","10.1103/PhysRevLett.94.036803",,"cond-mat.mes-hall",,"  We describe a device where the non-local spin-spin interaction between two
quantum dots can be turned on and off and even changed sign with a very small
magnetic field. The setup consists of two quantum dots at the edge of two
two-dimensional electron gases (2DEGs). The quantum dots' spins are coupled
through a RKKY-like interaction mediated by the electrons in the 2DEGs. A small
magnetic field perpendicular to the plane of the 2DEG is used as a tuning
parameter. When the cyclotron radius is commensurate with the interdot
distance, the spin-spin interaction is amplified by a few orders of magnitude.
The sign of the interaction is controlled by finely tuning the magnetic field.
Our setup allows for several dots to be coupled in a linear arrangement and it
is not restricted to nearest-neighbors interaction.
","[{""version"":""v1"",""created"":""Fri, 2 Jul 2004 23:59:01 GMT""},{""version"":""v2"",""created"":""Thu, 17 Feb 2005 21:15:00 GMT""}]","2007-05-23"
"cond-mat/0407082","Pedro Lind","Pedro G. Lind and Jason A.C. Gallas","Inducing periodicity in lattices of chaotic maps with advection","9 pages, 11 figures, to appear in Physica Scripta","Physica Scripta T118, 143-147 (2005)","10.1238/Physica.Topical.118a00143",,"cond-mat.dis-nn",,"  We investigate a lattice of coupled logistic maps where, in addition to the
usual diffusive coupling, an advection term parameterized by an asymmetry in
the coupling is introduced. The advection term induces periodic behavior on a
significant number of non-periodic solutions of the purely diffusive case. Our
results are based on the characteristic exponents for such systems, namely the
mean Lyapunov exponent and the co-moving Lyapunov exponent. In addition, we
study how to deal with more complex phenomena in which the advective velocity
may vary from site to site. In particular, we observe wave-like pulses to
appear and disappear intermittently whenever the advection is spatially
inhomogeneous.
","[{""version"":""v1"",""created"":""Sat, 3 Jul 2004 09:10:05 GMT""}]","2009-11-10"
"cs/0407008","Karthik Narayanaswami","S. Ravichandran and M.N. Karthik","Autogenic Training With Natural Language Processing Modules: A Recent
  Tool For Certain Neuro Cognitive Studies","2 Pages. Proceedings of 11th International Congress on Biological &
  Medical Engineering, Singapore (IEEE-EMBS & IFMBE endorsed)",,,,"cs.AI",,"  Learning to respond to voice-text input involves the subject's ability in
understanding the phonetic and text based contents and his/her ability to
communicate based on his/her experience. The neuro-cognitive facility of the
subject has to support two important domains in order to make the learning
process complete. In many cases, though the understanding is complete, the
response is partial. This is one valid reason why we need to support the
information from the subject with scalable techniques such as Natural Language
Processing (NLP) for abstraction of the contents from the output. This paper
explores the feasibility of using NLP modules interlaced with Neural Networks
to perform the required task in autogenic training related to medical
applications.
","[{""version"":""v1"",""created"":""Fri, 2 Jul 2004 20:15:02 GMT""}]","2007-05-23"
"cs/0407009","Karthik Narayanaswami","M. N. Karthik and Moshe Davis","Search Using N-gram Technique Based Statistical Analysis for Knowledge
  Extraction in Case Based Reasoning Systems","4 Pages. National Level Mathematics & CS Symposium, Chennai
  Mathematical Institute ICS '02, March",,,,"cs.AI cs.IR",,"  Searching techniques for Case Based Reasoning systems involve extensive
methods of elimination. In this paper, we look at a new method of arriving at
the right solution by performing a series of transformations upon the data.
These involve N-gram based comparison and deduction of the input data with the
case data, using Morphemes and Phonemes as the deciding parameters. A similar
technique for eliminating possible errors using a noise removal function is
performed. The error tracking and elimination is performed through a
statistical analysis of obtained data, where the entire data set is analyzed as
sub-categories of various etymological derivatives. A probability analysis for
the closest match is then performed, which yields the final expression. This
final expression is referred to the Case Base. The output is redirected through
an Expert System based on best possible match. The threshold for the match is
customizable, and could be set by the Knowledge-Architect.
","[{""version"":""v1"",""created"":""Fri, 2 Jul 2004 20:22:18 GMT""}]","2007-05-23"
"gr-qc/0407011","Lee Lindblom","Michael Holst, Lee Lindblom, Robert Owen, Harald P. Pfeiffer, Mark A.
  Scheel, and Lawrence E. Kidder","Optimal Constraint Projection for Hyperbolic Evolution Systems","final version with minor changes; 16 pages, 14 figures","Phys.Rev. D70 (2004) 084017","10.1103/PhysRevD.70.084017",,"gr-qc",,"  Techniques are developed for projecting the solutions of symmetric hyperbolic
evolution systems onto the constraint submanifold (the constraint-satisfying
subset of the dynamical field space). These optimal projections map a field
configuration to the ``nearest'' configuration in the constraint submanifold,
where distances between configurations are measured with the natural metric on
the space of dynamical fields. The construction and use of these projections is
illustrated for a new representation of the scalar field equation that exhibits
both bulk and boundary generated constraint violations. Numerical simulations
on a black-hole background show that bulk constraint violations cannot be
controlled by constraint-preserving boundary conditions alone, but are
effectively controlled by constraint projection. Simulations also show that
constraint violations entering through boundaries cannot be controlled by
constraint projection alone, but are controlled by constraint-preserving
boundary conditions. Numerical solutions to the pathological scalar field
system are shown to converge to solutions of a standard representation of the
scalar field equation when constraint projection and constraint-preserving
boundary conditions are used together.
","[{""version"":""v1"",""created"":""Fri, 2 Jul 2004 18:35:49 GMT""},{""version"":""v2"",""created"":""Fri, 2 Jul 2004 23:22:46 GMT""},{""version"":""v3"",""created"":""Tue, 5 Oct 2004 22:36:45 GMT""}]","2009-11-10"
"gr-qc/0407012","Andrea Nerozzi Mr","Christopher Beetle, Marco Bruni, Lior M. Burko and Andrea Nerozzi","Towards a novel wave-extraction method for numerical relativity. I.
  Foundations and initial-value formulation","11 pages, 1 figure","Phys.Rev. D72 (2005) 024013","10.1103/PhysRevD.72.024013",,"gr-qc",,"  The Teukolsky formalism of black hole perturbation theory describes weak
gravitational radiation generated by a mildly dynamical hole near equilibrium.
A particular null tetrad of the background Kerr geometry, due to Kinnersley,
plays a singularly important role within this formalism. In order to apply the
rich physical intuition of Teukolsky's approach to the results of fully
non-linear numerical simulations, one must approximate this Kinnersley tetrad
using raw numerical data, with no a priori knowledge of a background. This
paper addresses this issue by identifying the directions of the tetrad fields
in a quasi-Kinnersley frame. This frame provides a unique, analytic extension
of Kinnersley's definition for the Kerr geometry to a much broader class of
space-times including not only arbitrary perturbations, but also many examples
which differ non-perturbatively from Kerr. This paper establishes concrete
limits delineating this class and outlines a scheme to calculate the
quasi-Kinnersley frame in numerical codes based on the initial-value
formulation of geometrodynamics.
","[{""version"":""v1"",""created"":""Fri, 2 Jul 2004 19:39:39 GMT""},{""version"":""v2"",""created"":""Wed, 11 May 2005 03:42:57 GMT""}]","2009-11-10"
"gr-qc/0407013","Andrea Nerozzi Mr","Andrea Nerozzi, Christopher Beetle, Marco Bruni, Lior M. Burko and
  Denis Pollney","Towards wave extraction in numerical relativity: the quasi-Kinnersley
  frame","13 pages, 3 figures","Phys.Rev. D72 (2005) 024014","10.1103/PhysRevD.72.024014",,"gr-qc",,"  The Newman-Penrose formalism may be used in numerical relativity to extract
coordinate-invariant information about gravitational radiation emitted in
strong-field dynamical scenarios. The main challenge in doing so is to identify
a null tetrad appropriately adapted to the simulated geometry such that
Newman-Penrose quantities computed relative to it have an invariant physical
meaning. In black hole perturbation theory, the Teukolsky formalism uses such
adapted tetrads, those which differ only perturbatively from the background
Kinnersley tetrad. At late times, numerical simulations of astrophysical
processes producing isolated black holes ought to admit descriptions in the
Teukolsky formalism. However, adapted tetrads in this context must be
identified using only the numerically computed metric, since no background Kerr
geometry is known a priori. To do this, this paper introduces the notion of a
quasi-Kinnersley frame. This frame, when space-time is perturbatively close to
Kerr, approximates the background Kinnersley frame. However, it remains
calculable much more generally, in space-times non-perturbatively different
from Kerr. We give an explicit solution for the tetrad transformation which is
required in order to find this frame in a general space-time.
","[{""version"":""v1"",""created"":""Fri, 2 Jul 2004 19:41:41 GMT""},{""version"":""v2"",""created"":""Fri, 15 Jul 2005 16:37:30 GMT""}]","2009-11-10"
"gr-qc/0407014","Stefan Hollands","Stefan Hollands and Robert M. Wald","Conformal Null Infinity Does Not Exist for Radiating Solutions in Odd
  Spacetime Dimensions","Latex, 8 pages, no figures","Class.Quant.Grav. 21 (2004) 5139-5146","10.1088/0264-9381/21/22/008",,"gr-qc",,"  We show that for general relativity in odd spacetime dimensions greater than
4, all components of the unphysical Weyl tensor for arbitrary smooth, compact
spatial support perturbations of Minkowski spacetime fail to be smooth at null
infinity at leading nonvanishing order. This implies that for nearly flat
radiating spacetimes, the non-smoothness of the unphysical metric at null
infinity manifests itself at the same order as it describes deviations from
flatness of the physical metric. Therefore, in odd spacetime dimensions, it
does not appear that conformal null infinity can be in any way useful for
describing radiation.
","[{""version"":""v1"",""created"":""Fri, 2 Jul 2004 21:36:49 GMT""}]","2009-11-10"
"hep-ex/0407010","Avto Kharchilava","Avto Kharchilava (for the CDF and D0 Collaborations)","Searches for the Standard Model Higgs boson at the Tevatron","Presented at XXXIX Rencontres de Moriond: QCD and High Energy
  Hadronic Interactions, La Thuile, Italy, March 28th - April 4th, 2004",,,,"hep-ex hep-ph",,"  Preliminary results obtained by the CDF and D0 Collaborations on the Standard
Model Higgs searches at the Tevatron Run II are discussed. The data that
correspond to an integrated luminosity of > 150/pb are compared to theoretical
expectations. Various final states involving the W and Z bosons production are
examined, and new limits are set on the sigma[W(->enu/munu)H(->bb)] and
sigma[H(->WW(*))] cross sections.
","[{""version"":""v1"",""created"":""Fri, 2 Jul 2004 16:10:45 GMT""}]","2007-05-23"
"hep-lat/0407002","Roberto Frezzotti","R. Frezzotti (INFN - Sez. di Milano and Dip.di Fisica Univ. Milano
  Bicocca), G.C. Rossi (Dip. di Fisica, Univ. Roma Tor Vergata, INFN - Sez. di
  Roma II and NIC/DESY Zeuthen)","Chirally improving Wilson fermions II. Four-quark operators","Replaced with published version in JHEP style: 43 pages, no figures.
  Added few references and discussion on ""critical mass and O(a) improvement""
  as well as on ""tests and numerical issues"" in the Conclusions (sect. 6)","JHEP 0410:070,2004","10.1088/1126-6708/2004/10/070","Bicocca-FT-04-7, ROM2F/2004/12, DESY 04-069","hep-lat",,"  In this paper we discuss how the peculiar properties of twisted lattice QCD
at maximal twist can be employed to set up a consistent computational scheme in
which, despite the explicit breaking of chiral symmetry induced by the presence
of the Wilson and mass terms in the action, it is possible to completely bypass
the problem of wrong chirality and parity mixings in the computation of the
CP-conserving matrix elements of the $\Delta S=1,2$ effective weak Hamiltonian
and at the same time have a positive determinant for non-degenerate quarks as
well as full O($a$) improvement in on-shell quantities with no need of
improving the lattice action and the operators.
","[{""version"":""v1"",""created"":""Fri, 2 Jul 2004 17:21:35 GMT""},{""version"":""v2"",""created"":""Sun, 28 Nov 2004 12:16:19 GMT""}]","2010-02-03"
"hep-ph/0407019","Christophe Grojean","C. Grojean, G. Servant, J. Wells","First-Order Electroweak Phase Transition in the Standard Model with a
  Low Cutoff","5 pages, 4 figures. v2: corrected typos, improved discussion of the
  case lambda<0 and added references. To be published in PRD","Phys.Rev. D71 (2005) 036001","10.1103/PhysRevD.71.036001","Saclay T04/084, MCTP-04-37, ANL-HEP-PR-04-63, EFI-04-23","hep-ph astro-ph hep-th",,"  We study the possibility of a first-order electroweak phase transition (EWPT)
due to a dimension-six operator in the effective Higgs potential. In contrast
with previous attempts to make the EWPT strongly first-order as required by
electroweak baryogenesis, we do not rely on large one-loop thermally generated
cubic Higgs interactions. Instead, we augment the Standard Model (SM) effective
theory with a dimension-six Higgs operator. This addition enables a strong
first-order phase transition to develop even with a Higgs boson mass well above
the current direct limit of 114 GeV. The phi^6 term can be generated for
instance by strong dynamics at the TeV scale or by integrating out heavy
particles like an additional singlet scalar field. We discuss conditions to
comply with electroweak precision constraints, and point out how future
experimental measurements of the Higgs self couplings could test the idea.
","[{""version"":""v1"",""created"":""Fri, 2 Jul 2004 17:14:35 GMT""},{""version"":""v2"",""created"":""Wed, 12 Jan 2005 08:38:41 GMT""}]","2009-11-10"
"hep-ph/0407032","Nikolaos Kidonakis","Nikolaos Kidonakis and Alexander Belyaev","Anomalous tqV couplings and FCNC top quark production","5 pages, 5 figures, presented at the DIS 2004 Workshop, Strbske
  Pleso, Slovakia, 14-18 April, 2004",,,"Cavendish-HEP-04/20, FSU-HEP-040702","hep-ph",,"  We discuss FCNC top quark production via anomalous tqV couplings at the
Tevatron and HERA colliders. We calculate higher-order soft-gluon corrections
to such processes and demonstrate the stabilization of the cross section when
these corrections are included.
","[{""version"":""v1"",""created"":""Fri, 2 Jul 2004 16:22:02 GMT""}]","2007-05-23"
"hep-ph/0407033","Zack Sullivan","Zack Sullivan","Fast Evaluation of CTEQ Parton Distributions in Monte Carlos","13 pgs., uses elsart","Comput.Phys.Commun. 168 (2005) 25-31","10.1016/j.cpc.2004.12.015","FERMILAB-Pub-04/104-T","hep-ph",,"  A few changes to the routines that calculate CTEQ parton distribution
functions allow modern compilers to optimize the evaluations, while having no
quantitative effect on the results. Overall computation time is reduced by a
factor of 4-5 in matrix-element calculations, and by 1.3-2.5 in showering Monte
Carlo event generators. Similar improvements in performance may be expected in
any calculations relying heavily on interpolation or multiple calls to
functions.
","[{""version"":""v1"",""created"":""Fri, 2 Jul 2004 20:05:51 GMT""},{""version"":""v2"",""created"":""Mon, 21 Feb 2005 18:13:06 GMT""}]","2009-11-10"
"hep-ph/0407034","Jesse Thaler","Nima Arkani-Hamed, Hsin-Chia Cheng, Markus Luty and Jesse Thaler","Universal Dynamics of Spontaneous Lorentz Violation and a New
  Spin-Dependent Inverse-Square Law Force","23 pages, 8 figures; v2: revised functional form of spin potential,
  conclusions unchanged; v3: to match JHEP version","JHEP0507:029,2005","10.1088/1126-6708/2005/07/029","HUTP-04/A033","hep-ph hep-th",,"  We study the universal low-energy dynamics associated with the spontaneous
breaking of Lorentz invariance down to spatial rotations. The effective
Lagrangian for the associated Goldstone field can be uniquely determined by the
non-linear realization of a broken time diffeomorphism symmetry, up to some
overall mass scales. It has previously been shown that this symmetry breaking
pattern gives rise to a Higgs phase of gravity, in which gravity is modified in
the infrared. In this paper, we study the effects of direct couplings between
the Goldstone boson and standard model fermions, which necessarily accompany
Lorentz-violating terms in the theory. The leading interaction is the coupling
to the axial vector current, which reduces to spin in the non-relativistic
limit. A spin moving relative to the ""ether"" rest frame will emit Goldstone
Cerenkov radiation. The Goldstone also induces a long-range inverse-square law
force between spin sources with a striking angular dependence, reflecting the
underlying Goldstone shockwaves and providing a smoking gun for this theory. We
discuss the regime of validity of the effective theory describing these
phenomena, and the possibility of probing Lorentz violations through Goldstone
boson signals in a way that is complementary to direct tests in some regions of
parameter space.
","[{""version"":""v1"",""created"":""Fri, 2 Jul 2004 20:08:32 GMT""},{""version"":""v2"",""created"":""Mon, 14 Feb 2005 23:47:00 GMT""},{""version"":""v3"",""created"":""Fri, 2 Sep 2005 14:30:29 GMT""}]","2009-11-10"
"hep-ph/0407035","Konstantin Goulianos","Konstantin Goulianos (The Rockefeller University)","Hadronic Diffraction: Where do we Stand?","17 pages, Presented at Les Rencontres de Physique de la Valle
  d'Aoste, La Thuile, Aosta Valley, Italy, February 29 - March 6, 2004",,,,"hep-ph",,"  Experimental results on hadronic soft and hard diffractive processes are
reviewed with emphasis on aspects of the data that point to the underlying QCD
mechanism for diffraction. Diffractive differential cross sections are shown to
be factorized into two terms, one representing the total cross section at the
reduced energy, corresponding to the rapidity region(s) in which there is
particle production, and another interpreted as the probability of formation of
the rapidity gap(s) characterizing diffraction. By (re)normalizing the term of
gap formation probability to unity, cross sections for single, central, and
multiple rapidity gap soft diffraction, as well as structure functions for hard
diffraction processes, are obtained from the underlying inclusive parton
distribution functions. A unified partonic picture emerges, in which
diffraction appears to be mediated by the exchange of low-x partons subject to
color constraints.
","[{""version"":""v1"",""created"":""Fri, 2 Jul 2004 20:16:25 GMT""}]","2009-09-29"
