"hep-ph/0407037","Mauro Napsuciale","Mauro Napsuciale and Simon Rodriguez","A chiral model for bar{q}q and bar{q}bar{q}qq$ mesons","20 pages, 3 figures","Phys.Rev.D70:094043,2004","10.1103/PhysRevD.70.094043",,"hep-ph",,"  We point out that the spectrum of pseudoscalar and scalar mesons exhibits a
cuasi-degenerate chiral nonet in the energy region around 1.4 GeV whose scalar
component has a slightly inverted spectrum. Based on the empirical linear
rising of the mass of a hadron with the number of constituent quarks which
yields a mass around $1.4 $GeV for tetraquarks, we conjecture that this
cuasi-chiral nonet arises from the mixing of a chiral nonet composed of
tetraquarks with conventional bar{q}q states. We explore this possibility in
the framework of a chiral model assuming a tetraquark chiral nonet around 1.4
GeV with chiral symmetry realized directly. We stress that U_{A}(1)
transformations can distinguish bar{q}q from tetraquark states, although it
cannot distinguish specific dynamics in the later case. We find that the
measured spectrum is consistent with this picture. In general, pseudoscalar
states arise as mainly bar{q}q states but scalar states turn out to be strong
admixtures of bar{q}q and tetraquark states. We work out also the model
predictions for the most relevant couplings and calculate explicitly the strong
decays of the a_{0}(1450) and K_{0}^*(1430) mesons. From the comparison of some
of the predicted couplings with the experimental ones we conclude that
observable for the isovector and isospinor sectors are consistently described
within the model. The proper description of couplings in the isoscalar sectors
would require the introduction of glueball fields which is an important missing
piece in the present model.
","[{""version"":""v1"",""created"":""Fri, 2 Jul 2004 23:21:38 GMT""}]","2008-11-26"
"hep-ph/0407038","Sebastian Sapeta","S. Sapeta","Diffractive production at high energies in the Miettinen-Pumplin model","5 pages, 2 figures, LHC predictions removed, submitted to Phys.Lett.
  B","Phys.Lett. B597 (2004) 352-355","10.1016/j.physletb.2004.07.034",,"hep-ph",,"  The model of soft diffractive dissociation proposed some time ago by
Miettinen and Pumplin is shown to describe correctly the data at FERMILAB
energies. The comparison with Goulianos model of renor malized pomeron flux is
also presented.
","[{""version"":""v1"",""created"":""Sat, 3 Jul 2004 00:03:48 GMT""},{""version"":""v2"",""created"":""Tue, 31 Aug 2004 12:36:15 GMT""}]","2016-09-06"
"hep-ph/0407039","Edward A. Baltz","Edward A. Baltz, Paolo Gondolo","Markov Chain Monte Carlo Exploration of Minimal Supergravity with
  Implications for Dark Matter","16 pages, 4 figures","JHEP 0410:052,2004","10.1088/1126-6708/2004/10/052",,"hep-ph astro-ph",,"  We explore the full parameter space of Minimal Supergravity (mSUGRA),
allowing all four continuous parameters (the scalar mass m_0, the gaugino mass
m_1/2, the trilinear coupling A_0, and the ratio of Higgs vacuum expectation
values tan beta) to vary freely. We apply current accelerator constraints on
sparticle and Higgs masses, and on the b -> s gamma branching ratio, and
discuss the impact of the constraints on g_mu-2. To study dark matter, we apply
the WMAP constraint on the cold dark matter density. We develop Markov Chain
Monte Carlo (MCMC) techniques to explore the parameter regions consistent with
WMAP, finding them to be considerably superior to previously used methods for
exploring supersymmetric parameter spaces. Finally, we study the reach of
current and future direct detection experiments in light of the WMAP
constraint.
","[{""version"":""v1"",""created"":""Sat, 3 Jul 2004 00:50:13 GMT""}]","2011-07-19"
"hep-ph/0407040","Dorota Kotlorz","Dorota Kotlorz, Andrzej Kotlorz","Low-x contribution to the Bjorken sum rule within double logarithmic
  $ln^2x$ approximation","17 pages, 3 figures",,,,"hep-ph",,"  The small-$x$ contributions to the Bjorken sum rule within double logarithmic
$ln^2x$ approximation for different input parametrisations $g_1^{NS}(x,Q_0^2)$
are presented. Analytical solutions of the evolution equations for full and
truncated moments of the unintegrated structure function $f^{NS}(x,Q^2)$ are
used. Theoretical predictions for $\int_{0}^{0.003} g_1^{NS}(x,Q^2=10) dx$ are
compared with the SMC small-$x$ data. Rough estimation of the slope $\lambda$,
controlling the small-$x$ behaviour of $g_1^{NS}\sim x^{-\lambda}$ from the SMC
data is performed. Double logarithmic terms $\sim (\alpha_s ln^2x)^n$ become
leading when $x\to 0$ and imply the singular behaviour of $g_1^{NS}\sim
x^{-0.4}$. This seems to be confirmed by recent experimental SMC and HERMES
data. Advantages of the unified $ln^2x$+LO DGLAP approach and the crucial role
of the running coupling $\alpha_s=\alpha_s(Q^2/z)$ at low-$x$ are also
discussed.
","[{""version"":""v1"",""created"":""Sat, 3 Jul 2004 12:04:51 GMT""}]","2007-05-23"
"hep-ph/0407041","Prasanta Das Kumar","Prasanta Kumar Das","Muon anomaly and a lower bound on higgs mass due to a light stabilized
  radion in the Randall-Sundrum model","Version to be appeared in IJMPA","IJMPA, Vol. 21, No. 26 (2006) 5205-5220","10.1142/S0217751X06033222",,"hep-ph",,"  We investigate the Randall-Sundrum model with a light stabilized radion
(required to fix the size of the extra dimension) in the light of muon
anomalous magnetic moment $a_\mu [= \frac{(g - 2)}{2}]$. Using the recent data
(obtained from the E821 experiment of the BNL collaboration) which differs by
$2.6 \sigma$ from the Standard Model result, we obtain constraints on radion
mass $\mphi$ and radion vev $\vphi$. In the presence of a radion the beta
functions $\beta(\l)$ and $\beta(g_t)$ of higgs quartic coupling ($\l$) and
top-Yukawa coupling ($g_t$) gets modified. We find these modified beta
functions. Using these beta functions together with the anomaly constrained
$\mphi$ and $\vphi$, we obtain lower bound on higgs mass $m_h$. We compare our
result with the present LEP2 bound on $m_h$.
","[{""version"":""v1"",""created"":""Sat, 3 Jul 2004 15:26:49 GMT""},{""version"":""v2"",""created"":""Thu, 12 May 2005 05:51:41 GMT""},{""version"":""v3"",""created"":""Wed, 5 Jul 2006 07:39:17 GMT""},{""version"":""v4"",""created"":""Fri, 1 Dec 2006 18:10:34 GMT""}]","2009-11-10"
"hep-th/0407017","Razvan Teodorescu","R. Teodorescu, E. Bettelheim, O. Agam, A. Zabrodin, P. Wiegmann","Semiclassical evolution of the spectral curve in the normal random
  matrix ensemble as Whitham hierarchy","14 pages","Nucl.Phys. B700 (2004) 521-532","10.1016/j.nuclphysb.2004.08.013",,"hep-th cond-mat.mes-hall math-ph math.MP nlin.SI",,"  We continue the analysis of the spectral curve of the normal random matrix
ensemble, introduced in an earlier paper. Evolution of the full quantum curve
is given in terms of compatibility equations of independent flows. The
semiclassical limit of these flows is expressed through canonical differential
forms of the spectral curve. We also prove that the semiclassical limit of the
evolution equations is equivalent to Whitham hierarchy.
","[{""version"":""v1"",""created"":""Fri, 2 Jul 2004 16:43:55 GMT""}]","2007-05-23"
"hep-th/0407018","Emil Akhmedov","Emil T.Akhmedov (ITEP, Moscow)","Expansion in Feynman Graphs as Simplicial String Theory","Latex, 11pp, Minor mintakes are corrected","JETP Lett.80:218-225,2004; Pisma Zh.Eksp.Teor.Fiz.80:247-254,2004","10.1134/1.1813675","ITEP-TH-21/04","hep-th gr-qc hep-ph",,"  We show that the series expansion of quantum field theory in the Feynman
diagrams can be explicitly mapped on the partition function of the simplicial
string theory -- the theory describing embeddings of the two--dimensional
simplicial complexes into the space--time of the field theory. The summation
over two--dimensional geometries in this theory is obtained from the summation
over the Feynman diagrams and the integration over the Schwinger parameters of
the propagators. We discuss the meaning of the obtained relation and derive the
one--dimensional analog of the simplicial theory on the example of the free
relativistic particle.
","[{""version"":""v1"",""created"":""Fri, 2 Jul 2004 18:05:24 GMT""},{""version"":""v2"",""created"":""Fri, 16 Jul 2004 07:39:55 GMT""},{""version"":""v3"",""created"":""Sun, 22 Aug 2004 08:17:19 GMT""}]","2009-02-06"
"hep-th/0407019","Brendan Foster","Brendan Z. Foster, Ted Jacobson","Quantum field theory on a growing lattice","28 pages, 2 figures; v.2: added comments on defining energy, and
  references","JHEP 0408 (2004) 024","10.1088/1126-6708/2004/08/024",,"hep-th astro-ph gr-qc quant-ph",,"  We construct the classical and canonically quantized theories of a massless
scalar field on a background lattice in which the number of points--and hence
the number of modes--may grow in time. To obtain a well-defined theory certain
restrictions must be imposed on the lattice. Growth-induced particle creation
is studied in a two-dimensional example. The results suggest that local mode
birth of this sort injects too much energy into the vacuum to be a viable model
of cosmological mode birth.
","[{""version"":""v1"",""created"":""Fri, 2 Jul 2004 19:08:15 GMT""},{""version"":""v2"",""created"":""Fri, 6 Aug 2004 14:53:44 GMT""}]","2009-11-10"
"hep-th/0407020","Harold Blas","Harold Blas","Generalized sine-Gordon and massive Thirring models","27 pages, LaTex. Invited paper for Progress in Soliton Research, 2004",,,,"hep-th",,"  We consider the Lagrangian description of the soliton sector of the so-called
affine $\hat{sl}(3)$ Toda model coupled to matter (Dirac) fields (ATM). The
theory is treated as a constrained system in the contexts of the
Faddeev-Jackiw, the symplectic, as well as the master Lagrangian approaches. We
exhibit the master Lagrangian nature of the model from which generalizations of
the sine-Gordon (GSG) or the massive Thirring (GMT) models are derivable. The
GMT model describes $N_{f}=3$ [number of positive roots of $su(3)$] massive
Dirac fermion species with current-current interactions amongst all the U(1)
species currents; on the other hand, the GSG theory corresponds to $N_{b}=2$
[rank of the $su(3)$ Lie algebra] independent Toda fields (bosons) with a
potential given by the sum of three SG cosine terms. The dual description of
the model is further emphasized by providing some on shell relationships
between bilinears of the GMT spinors and the relevant expressions of the GSG
fields. In this way, in the {\bf first part} of the chapter, we exhibit the
strong/weak coupling phases and the (generalized) soliton/particle
correspondences of the model at the classical level. In the {\bf second part}
of the chapter we give a full Lie algebraic formulation of the duality at the
level of the equations of motion written in matrix form. The effective
off-critical $\hat{sl}(3)$ ATM action is written in terms of the
Wess-Zumino-Novikov-Witten (WZNW) action plus some kinetic terms for the
spinors and scalar-spinor interaction terms. Moreover, this theory still
presents a remarkable equivalence between the Noether and topological currents,
describes the soliton sector of the original model and turns out to be the
master Lagrangian describing the GMT and GSG models.
","[{""version"":""v1"",""created"":""Fri, 2 Jul 2004 20:22:06 GMT""}]","2007-05-23"
"hep-th/0407021","Jacek Wosiek","M. Campostrini (1) and J. Wosiek (2) ((1) Pisa University, (2)
  Jagellonian University)","High precision study of the structure of D=4 supersymmetric Yang-Mills
  quantum mechanics","47 pages, 17 figures, version 2: one reference added, acknowledgments
  modified","Nucl.Phys. B703 (2004) 454-498","10.1016/j.nuclphysb.2004.10.022","IFUP-TH 2004/24, TPJU-9/04","hep-th",,"  The spectrum of D=4 supersymmetric Yang-Mills quantum mechanics is computed
with high accuracy in all channels of angular momentum and fermion number.
Localized and non-localized states coexists in certain channels as a
consequence of the supersymmetric interactions with flat valleys. All states
fall into well identifiable supermultiplets providing an explicit realization
of supersymmetry on the spectroscopic level. An accidental degeneracy among
some supermultiplets has been found. Regularized Witten index converges to a
time-independent constant which agrees with earlier calculations.
","[{""version"":""v1"",""created"":""Sat, 3 Jul 2004 15:49:33 GMT""},{""version"":""v2"",""created"":""Wed, 14 Jul 2004 11:07:54 GMT""}]","2009-11-10"
"math/0407025","Thomas W. Mattman","Thomas W. Mattman","Boundary slopes (nearly) bound cyclic slopes","Published by Algebraic and Geometric Topology at
  http://www.maths.warwick.ac.uk/agt/AGTVol5/agt-5-31.abs.html","Algebr. Geom. Topol. 5 (2005) 741-750","10.2140/agt.2005.5.741",,"math.GT",,"  Let r_m and r_M be the least and greatest finite boundary slopes of a
hyperbolic knot K in S^3. We show that any cyclic surgery slopes of K must lie
in the interval (r_m - 1/2, r_M + 1/2).
","[{""version"":""v1"",""created"":""Fri, 2 Jul 2004 17:43:12 GMT""},{""version"":""v2"",""created"":""Tue, 2 Nov 2004 15:22:29 GMT""},{""version"":""v3"",""created"":""Sun, 24 Jul 2005 19:18:17 GMT""}]","2014-10-01"
"math/0407031","Mamuka Jibladze","Hans Joachim Baues, Mamuka Jibladze","Secondary derived functors and the Adams spectral sequence","Reference to math.AT/0407045 added",,,,"math.AT math.CT math.KT",,"  Classical homological algebra takes place in additive categories. In homotopy
theory such additive categories arise as homotopy categories of ``additive
groupoid enriched categories'', in which a secondary analog of homological
algebra can be performed. We introduce secondary chain complexes and secondary
resolutions leading to the concept of secondary derived functors. As a main
result we show that the E_3-term of the Adams spectral sequence can be
expressed as a secondary derived functor. This result can be used to compute
the E_3-term explicitly by an algorithm.
","[{""version"":""v1"",""created"":""Fri, 2 Jul 2004 18:29:17 GMT""},{""version"":""v2"",""created"":""Sat, 3 Jul 2004 17:16:59 GMT""},{""version"":""v3"",""created"":""Tue, 6 Jul 2004 12:40:41 GMT""}]","2007-05-23"
"math/0407032","Riccardo Piergallini","Ivelina Bobtcheva and Riccardo Piergallini","Covering moves and Kirby calculus","Minor corrections. Added reference to the second part of our study of
  4-dimensional 2-handlebodies (arXiv:math.GT/0612806). 68 pages, 87 postscript
  figures, 42 references. LaTeX 2.09 file. Uses: geom.sty epsf.sty",,,,"math.GT",,"  We show that simple coverings of B^4 branched over ribbon surfaces up to
certain local ribbon moves bijectively represent orientable 4-dimensional
2-handlebodies up to handle sliding and addition/deletion of cancelling
handles. As a consequence, we obtain an equivalence theorem for simple
coverings of S^3 branched over links, in terms of local moves. This result
generalizes to coverings of any degree results by the second author and
Apostolakis, concerning respectively the case of degree 3 and 4. We also
provide an extension of our equivalence theorem to possibly non-simple
coverings of S^3 branched over embedded graphs. This work represents the first
part of our study of 4-dimensional 2-handlebodies. In the second part
(arXiv:math.GT/0612806), we factor such bijective correspondence between simple
coverings of B^4 branched over ribbon surfaces and orientable 4-dimensional
2-handlebodies through a map onto the closed morphisms in a universal braided
category freely generated by a Hopf algebra object.
","[{""version"":""v1"",""created"":""Fri, 2 Jul 2004 16:04:44 GMT""},{""version"":""v2"",""created"":""Mon, 5 Jul 2004 14:53:57 GMT""},{""version"":""v3"",""created"":""Tue, 6 Jul 2004 16:02:43 GMT""},{""version"":""v4"",""created"":""Tue, 2 Jan 2007 14:17:01 GMT""}]","2007-05-23"
"math/0407033","Seth Sullivant","Nicholas Eriksson, Kristian Ranestad, Bernd Sturmfels, Seth Sullivant","Phylogenetic Algebraic Geometry","15 pages, 7 figures",,,,"math.AG math.ST q-bio.PE stat.TH",,"  Phylogenetic algebraic geometry is concerned with certain complex projective
algebraic varieties derived from finite trees. Real positive points on these
varieties represent probabilistic models of evolution. For small trees, we
recover classical geometric objects, such as toric and determinantal varieties
and their secant varieties, but larger trees lead to new and largely unexplored
territory. This paper gives a self-contained introduction to this subject and
offers numerous open problems for algebraic geometers.
","[{""version"":""v1"",""created"":""Fri, 2 Jul 2004 16:58:03 GMT""}]","2007-06-13"
"math/0407034","Prakash Belkale","Prakash Belkale, Shrawan Kumar","Eigenvalue problem and a new product in cohomology of flag varieties","49 pages, no figures",,,,"math.AG math.RT",,"  Let G be a connected semisimple complex algebraic group and let P be a
parabolic subgroup. In this paper we define a new (commutative and associative)
product on the cohomology of the homogenous spaces G/P and use this to give a
more efficient solution of the eigenvalue problem and also for the problem of
determining the existence of G-invariants in the tensor product of irreducible
representations of G. On the other hand, we show that this new product is
intimately connected with the Lie algebra cohomology of the nil-radical of P
via some works of Kostant and Kumar. We also initiate a uniform study of the
geometric Horn problem for an arbitrary group $G$ by obtaining two (a priori)
different sets of necessary recursive conditions to determine when a cohomology
product of Schubert classes in
  G/P is non-zero. Hitherto, this was studied largely only for the group
\SL(n).
","[{""version"":""v1"",""created"":""Fri, 2 Jul 2004 18:14:53 GMT""},{""version"":""v2"",""created"":""Fri, 2 Jul 2004 21:16:15 GMT""}]","2016-09-07"
"math/0407035","Alexander Gaifullin","Alexander A. Gaifullin","Local formulae for combinatorial Pontrjagin classes","20 pages, 6 LaTeX pseudofigures, added acknolegements",,,,"math.AT math.CO",,"  By p(|K|) denote the characteristic class of a combinatorial manifold K given
by the polynomial p in Pontrjagin classes of K. We prove that for any
polynomial p there exists a function taking each combinatorial manifold K to a
rational simplicial cycle z(K) such that: (1) the Poincare dual of z(K)
represents the cohomology class p(|K|); (2) a coefficient of each simplex in
the cycle z(K) is determined only by the combinatorial type of the link of this
simplex. We also prove that if a function z satisfies the condition (2), then
this function automatically satisfies the condition (1) for some polynomial p.
We describe explicitly all such functions z for the first Pontrjagin class. We
obtain estimates for denominators of coefficients of simplices in the cycles
z(K).
","[{""version"":""v1"",""created"":""Fri, 2 Jul 2004 19:03:19 GMT""},{""version"":""v2"",""created"":""Wed, 28 Jul 2004 15:46:07 GMT""}]","2007-05-23"
"math/0407036","David Joyner","Daniel Goldstein, Robert M. Guralnick, David Joyner","A Question about Pic(X) as a G-module","12 pages",,,,"math.AG math.GR",,"  Let G be a finite group acting faithfully on an irreducible non-singular
projective curve defined over an algebraically closed field F. Does every
G-invariant divisor class contain a G-invariant divisor? The answer depends
only on G and not on the curve. We answer the same question for degree 0
divisor (classes). We investigate the question for cycles on varieties.
","[{""version"":""v1"",""created"":""Fri, 2 Jul 2004 19:03:34 GMT""}]","2007-05-23"
"math/0407037","Judith Packer","Judith A. Packer","Applications of the work of Stone and von Neumann to wavelets","27 pages, will appear in Contemporary Mathematics Volume edited by R.
  Doran and R. Kadison, minor corrections added",,,,"math.FA math.OA",,"  This survey paper examines the work of J. von Neumann and M.H. Stone as it
relates to the abstract theory of wavelets. In particular, we discuss the
direct integral theory of von Neumann and how it can be applied to
representations of certain discrete groups to study the existence of normalized
tight frames in the setting of Gabor systems and wavelets, via the use of group
representations and von Neumann algebras. Then the extension of Stone's theorem
due to M. Naimark, W. Ambrose and R. Godement is reviewed, and its relationship
to the multiresolution analyses of S. Mallat and Y. Meyer and the generalized
multiresolution analyses of L. Baggett, H. Medina, and K. Merrill. Finally, the
paper ends by discussing some recent work due to the author, Baggett, P.
Jorgensen and Merrill, and its relationship to operator theory.
","[{""version"":""v1"",""created"":""Fri, 2 Jul 2004 19:21:40 GMT""}]","2007-05-23"
"math/0407038","Ramin Takloo-Bighash","Ramin Takloo-Bighash","Spinor L functions, theta correspondence, and Bessel coefficients",,,,,"math.NT",,"  In this paper we prove the entireness of the Spinor L function of certain
generic representations of the group GSp(4) over a totally real field.
","[{""version"":""v1"",""created"":""Fri, 2 Jul 2004 22:43:25 GMT""}]","2007-05-23"
"math/0407039","Dev Sinha","Dev Sinha","Operads and knot spaces","v3. Final (published) version, incorporating referee comments.
  Binomial operad has been renamed choose-two operad","J. Amer. Math. Soc., 19 (2006) No 2, 461-486",,,"math.AT math.QA",,"  We show that the Kontsevich operad, as an operad with multiplication,
provides a model for the Taylor tower of the functor defined by taking the
homotopy fiber of the inclusion of embeddings of an interval in a cube to the
corresponding space of immersions. In developing the Kontsevich operad, we find
an operad structure on the simplicial model for the two-sphere, in the opposite
category to finite sets. Applications of our result include using machinery of
McClure-Smith to produce a little two-disk action on our knot spaces.
","[{""version"":""v1"",""created"":""Sat, 3 Jul 2004 00:03:55 GMT""},{""version"":""v2"",""created"":""Mon, 14 Mar 2005 16:54:48 GMT""},{""version"":""v3"",""created"":""Fri, 23 Feb 2007 18:06:47 GMT""}]","2007-05-23"
"math/0407040","Alexander Isaev","A. V. Isaev, N. G. Kruzhilin","Proper holomorphic maps between Reinhardt domains in ${\bf C}^2$","40 pages",,,,"math.CV",,"  We characterize pairs of bounded Reinhardt domains in $\CC^2$ between which
there exists a proper holomorphic map and find all proper maps that are not
elementary algebraic.
","[{""version"":""v1"",""created"":""Sat, 3 Jul 2004 00:53:37 GMT""},{""version"":""v2"",""created"":""Wed, 25 Aug 2004 04:47:27 GMT""},{""version"":""v3"",""created"":""Thu, 2 Sep 2004 00:02:08 GMT""}]","2007-05-23"
"math/0407041","Olga Lavila-Vidal","Olga Lavila-Vidal","On the diagonals of a Rees algebra","PhDthesis (1999)",,,,"math.AC math.AG",,"  The aim of this work is to study the ring-theoretic properties of the
diagonals of a Rees algebra, which from a geometric point of view are the
homogeneous coordinate rings of embeddings of blow-ups of projective varieties
along a subvariety.
  In Chapter 1 we extend the definitions and results about the biprojective
scheme and the Hilbert polynomial of finitely generated bigraded modules
defined over standard bigraded k-algebras to finitely generated bigraded
S-modules, for S=k[X_1,..., X_n,Y_1,...,Y_r] the polynomial ring bigraded by
deg X_i=(1,0), deg Y_j=(d_j,1), d_j \geq 0. We also relate the shifts in the
bigraded minimal free resolution of any finitely generated bigraded S-module to
its a-invariants.
  In Chapter 2 we are concerned with the diagonal functor in the category of
bigraded S-modules. We compare the local cohomology modules of a finitely
generated bigraded S-module with the local cohomology modules of its diagonals.
  In Chapter 3 we study in detail the Cohen-Macaulay property of the rings
k[(I^e)_c]. Chapter 4 is devoted to study the Gorenstein property of those
rings.
  As a somehow unexpected by-product, the methods used to study the diagonals
of a Rees algebra also allow to study the a-invariants of the powers of an
ideal and their asymptotic properties (Chapters 5 and 6)
","[{""version"":""v1"",""created"":""Sat, 3 Jul 2004 12:18:31 GMT""}]","2007-05-23"
"math/0407042","Gunter M. Ziegler","G\""unter M. Ziegler","Projected Products of Polytopes","8 pages (extended abstract)",,,,"math.MG math.CO",,"  We construct a 2-parameter family of 4-dimensional polytopes with extreme
combinatorial structure: In this family, the ``fatness'' of the f-vector gets
arbitrarily close to 9, the ``complexity'' (given by the flag vector) gets
arbitrarily close to 16.
  The polytopes are obtained from suitable deformed products of even polygons
by a projection to four-space.
","[{""version"":""v1"",""created"":""Sat, 3 Jul 2004 15:37:03 GMT""}]","2007-05-23"
