"astro-ph/0407482","Gaspard Duchene","G. Duchene (1,2), J. Bouvier (2), S. Bontemps (3), P. Andre (4), F.
  Motte (4) ((1) UCLA, (2) Observatoire de Grenoble, (3) Observatoire de
  Bordeaux, (4) CEA Saclay)","Multiple protostellar systems. I. A deep near infrared survey of Taurus
  and Ophiuchus protostellar objects","Accepted for publication in Astronomy & Astrophysics; 16 pages, 3
  embedded figures, 1 JPEG figure",,"10.1051/0004-6361:20041209",,"astro-ph",,"  (Abridged) We performed a deep infrared imaging survey of 63 embedded young
stellar objects (YSOs) located in the Taurus and Ophiuchus clouds to search for
companions. The sample includes Class I and flat infrared spectrum protostellar
objects. We find 17 companions physically bound to 15 YSOs with angular
separations in the range 0.8-10"" (110-1400 AU) and derive a companion star
fraction of 23+/-9 % and 29+/-7 % for embedded YSOs in Taurus and Ophiuchus,
respectively. In spite of different properties of the clouds and especially of
the prestellar cores, the fraction of wide companions, 27+/-6 % for the
combined sample, is identical in the two star-forming regions. This suggests
that the frequency and properties of wide multiple protostellar systems are not
very sensitive to specific initial conditions. Comparing the companion star
fraction of the youngest YSOs still surrounded by extended envelopes to that of
more evolved YSOs, we find evidence for a possible evolution of the fraction of
wide multiple systems, which seems to decrease by a factor of about 2 on a
timescale of about 10^5 yr. Somewhat contrary to model predictions, we do not
find evidence for a sub-clustering of embedded sources at this stage on a scale
of a few 100 AU that could be related to the formation of small-N protostellar
clusters. Possible interpretations for this discrepancy are discussed.
","[{""version"":""v1"",""created"":""Thu, 22 Jul 2004 19:55:25 GMT""},{""version"":""v2"",""created"":""Fri, 23 Jul 2004 17:13:20 GMT""}]","2009-11-10"
"astro-ph/0407484","Ac Fabian","A.C. Fabian (IoA Cambridge UK)","Active Galaxies and Cluster Gas","14 pages, 16 fig, Feb 2004 talk for Phil Trans Roy Soc","Phil.Trans.Roy.Soc.Lond.A363:725-738,2005","10.1098/rsta.2004.1514",,"astro-ph",,"  Two lines of evidence indicate that active galaxies, principally radio
galaxies, have heated the diffuse hot gas in clusters. The first is the general
need for additional heating to explain the steepness of the X-ray
luminosity--temperature relation in clusters, the second is to solve the
cooling flow problem in cluster cores. The inner core of many clusters is
radiating energy as X-rays on a timescale much shorter than its likely age.
Although the temperature in this region drops by a factor of about 3 from that
of the surrounding gas, little evidence is found for gas much cooler than that.
Some form of heating appears to be taking place, probably by energy transported
outward from the central accreting black hole or radio source. How that energy
heats the gas depends on poorly understood transport properties (conductivity
and viscosity) of the intracluster medium. Viscous heating is discussed as a
possibility. Such heating processes have consequences for the truncation of the
luminosity function of massive galaxies.
","[{""version"":""v1"",""created"":""Thu, 22 Jul 2004 16:21:20 GMT""}]","2009-09-17"
"astro-ph/0407485","Shashi Kanbur","S. M. Kanbur and I. Fernando","Period Color and Amplitude Color relations for MACHO project LMC RR
  Lyraes","Sumitted for publication to MNRAS Letters",,"10.1111/j.1745-3933.2005.00025.x",,"astro-ph",,"  In this paper, we analyze period color and amplitude color relations at
minimum, mean and maximum $V$ band light for 6391 RRab stars in the Large
Magellanic Cloud obtained by the MACHO project. Specifically, we find that
color and amplitude are nearly independent of period at minimum light but that
there exists a definite relation between period and color and amplitude and
color at maximum light. These two properties are easily explained by the
application of the Stefan Boltzmann law and the interaction of the photosphere
and hydrogen ionization front at minimum light. When we examine the slope of
the period color relation as a function of phase, we find that the slope varies
significantly with phase and is small for a wide range of phases around minimum
light. This suggests that another factor that needs to be considered when
trying to understand RR Lyrae observed properties is their behavior at
different phases during a pulsation cycle.
","[{""version"":""v1"",""created"":""Thu, 22 Jul 2004 19:05:17 GMT""}]","2009-11-10"
"astro-ph/0407486","Alice Argon","A. L. Argon (1), L. J. Greenhill (1), J. M. Moran (1), M. J. Reid (1),
  K. M. Menten (2), M. Inoue (3) ((1) Harvard-Smithsonian Center for
  Astrophysics, (2) Max-Planck-Institut fuer Radioastronomie, (3) Nobeyama
  Radio Observatory)","The IC133 Water Vapor Maser in the Galaxy M33: A Geometric Distance","Accepted for publication in the Astrophysical Journal","Astrophys.J. 615 (2004) 702-719","10.1086/424731",,"astro-ph",,"  We report on the results of a 14 year long VLBI study of proper motions in
the IC133 H2O maser source in the galaxy M33. The method of Ordered Motion
Parallax was used to model the 3-dimensional structure and dynamics of IC133
and obtain a distance estimate, 800 +/- 180 kpc. Our technique for determining
the distance to M33 is independent of calibrations common to other distance
indicators, such as Cepheid Period-Luminosity relations, and therefore provides
an important check for previous distance determinations.
","[{""version"":""v1"",""created"":""Thu, 22 Jul 2004 19:36:14 GMT""}]","2009-11-10"
"astro-ph/0407487","Eric D. Miller","Eric D. Miller, Renato A. Dupke, Joel N. Bregman (University of
  Michigan)","Hot Baryons in Supercluster Filaments","8 pages, 7 eps figures, contributed talk to appear in ""Planets To
  Cosmology: Essential Science In Hubble's Final Years"", proceedings of the May
  2004 STScI Symposium, ed. M. Livio (Cambridge University Press)",,,,"astro-ph",,"  Most of the baryons in the local universe are ``missing'' in that they are
not in galaxies or in the previously detected gaseous phases. These missing
baryons are predicted to be in a moderately hot phase, 10^5-10^7 K, largely in
the form of giant cosmic filaments that connect the denser virialized clusters
and groups of galaxies. Models show that the highest covering fraction of such
filaments occurs in superclusters. To determine whether such filaments exist,
we have begun a project to search for UV absorption against AGNs projected
behind possible supercluster filaments. Using data from the HST and FUSE
archives along with new observations, we have detected UV absorption within
about 1300 km/s of seven supercluster sightlines out of a sample of eight. The
likelihood of such detections being generated by chance is less than 10^-4.
","[{""version"":""v1"",""created"":""Thu, 22 Jul 2004 20:02:18 GMT""}]","2007-05-23"
"astro-ph/0407489","Yong-Seon Song","Yong-Seon Song (UCHICAGO)","Looking for an extra dimension with tomographic cosmic shear","7 pages, 4 figures, some typos in published version are corrected
  here","Phys.Rev. D71 (2005) 024026","10.1103/PhysRevD.71.024026",,"astro-ph",,"  The cosmic acceleration was discovered in one of the brane-based models. We
are interested in discriminating this model from the dark energy by tomographic
cosmic shear. Growth factors are different in the two models when one adjusts
parameters to get nearly identical H(z). The two models could be distinguished
with independent determinations of both geometrical factors and the growth
factor. We introduce new parameterizations to separate the influence of
geometry and the influence of growth on cosmic shear maps. We find that future
observations will be able to distinguish between both models.
","[{""version"":""v1"",""created"":""Thu, 22 Jul 2004 20:03:47 GMT""},{""version"":""v2"",""created"":""Sun, 25 Jul 2004 18:37:10 GMT""},{""version"":""v3"",""created"":""Wed, 19 Jan 2005 22:53:27 GMT""},{""version"":""v4"",""created"":""Sun, 30 Oct 2005 04:00:39 GMT""}]","2009-11-10"
"astro-ph/0407490","Niel Brandt","W.N. Brandt (Penn State)","X-ray Surveys and Wide-Field Optical/Near-Infrared Imaging with the
  Joint Dark Energy Mission","9 pages, 3 color figures, latex. To appear in the conference
  proceedings of ""Wide Field Imaging from Space"" published in New Astronomy
  Reviews, ed. T. McKay, A. Fruchter, & E. Linder","New Astron.Rev. 49 (2005) 430-435","10.1016/j.newar.2005.08.018",,"astro-ph",,"  I briefly describe a few important scientific issues that could be addressed
effectively via the combination of data from JDEM and X-ray missions. The
topics covered are largely focused on active galactic nuclei (AGN) and include
(1) the selection of AGN via X-ray emission and optical variability, (2)
nuclear outbursts in galaxies due to transient fueling of their supermassive
black holes, (3) moderate-luminosity AGN at high redshift (z > 4) found via
application of ""dropout"" techniques to X-ray sources, and (4) the host-galaxy
morphologies of X-ray selected AGN. I also describe the substantial challenges
to obtaining wide-field X-ray data with sufficient sensitivity to complement
JDEM properly.
","[{""version"":""v1"",""created"":""Thu, 22 Jul 2004 20:06:33 GMT""}]","2009-11-10"
"astro-ph/0407491","You-Hua Chu","Y.-H. Chu (1), R.A. Gruendl (1), C.-H.R. Chen (1), J.S. Lazendic (2),
  and J.R. Dickel (1) ((1) University of Illinois, (2) Harvard-Smithsonian
  Center for Astrophysics)","An Optical and X-ray Examination of Two Radio Supernova Remnant
  Candidates in 30 Doradus","13 pages, 2 figures, accepted for publication in the ApJ, Nov 10,
  2004","Astrophys.J. 615 (2004) 727-731","10.1086/424654",,"astro-ph",,"  The giant HII region 30 Doradus is known for its violent internal motions and
bright diffuse X-ray emission, suggesting the existence of supernova remnants
(SNRs), but no nonthermal radio emission has been detected. Recently, Lazendic
et al. compared the H-alpha/H-beta and radio/H-alpha ratios and suggested two
small radio sources to be nonthermal and thus SNR candidates; however, no
optical or X-ray counterparts were detected. We have used high-resolution
optical images and high-dispersion spectra to examine the morphological,
spectral, and kinematic properties of these two SNR candidates, and still find
no optical evidence supporting their identification as SNRs. We have also
determined the X-ray luminosities of these SNR candidates, and find them 1-3
orders of magnitude lower than those commonly seen in young SNRs. High
extinction can obscure optical and X-ray signatures of an SNR, but would
prohibit the use of a high radio/H-alpha ratio to identify nonthermal radio
emission. We suggest that the SNR candidate MCRX J053831.8-690620 is associated
with a young star forming region; while the radio emission originates from the
obscured star forming region, the observed optical emission is dominated by the
foreground. We suggest that the SNR candidate MCRX J053838.8-690730 is
associated with a dust/molecular cloud, which obscures some optical emission
but not the radio emission.
","[{""version"":""v1"",""created"":""Thu, 22 Jul 2004 20:10:56 GMT""}]","2009-11-10"
"astro-ph/0407492","Erik Rosolowsky","Leo Blitz and Erik Rosolowsky (UC Berkeley)","The Role of Pressure in GMC Formation","4 pages, 1 Figure, Accepted to ApJ Letters","Astrophys.J. 612 (2004) L29-L32","10.1086/424661",,"astro-ph",,"  We examine the hypothesis that hydrostatic pressure alone determines the
ratio of atomic to molecular gas averaged over a particular radius in disk
galaxies. The hypothesis implies that the transition radius, the location where
the ratio is unity, should always occur at the same value of stellar surface
density in all galaxies. We examine data for 28 galaxies and find that the
stellar surface density at the transition radius is indeed constant to 40% at a
value of 120 M_sun/pc^2. If the hypothesis can be confirmed at all radii within
a large range of galaxy types and metallicities, combining it with the observed
constancy of the star formation rate with H_2 surface density may enable a
physically motivated star formation prescription with wide applicability.
","[{""version"":""v1"",""created"":""Thu, 22 Jul 2004 21:30:19 GMT""}]","2009-11-10"
"astro-ph/0407493","Haojing Yan","Haojing Yan and Rogier A. Windhorst","Candidates of z ~ 5.5--7 Galaxies in the HST Ultra Deep Field","accepted for publication in ApJL (submitted March 17 2004, accepted
  July 20 2004)","Astrophys.J.612:L93-L96,2004","10.1086/424690",,"astro-ph",,"  We report results from our $z\simeq 5.5$--7 galaxy search in the HST Ultra
Deep Field (UDF). Using the 400-orbit of ACS data, we found 108 plausible
$5.5\leq z\leq 6.5$ (or $z\simeq 6$ for short) candidates to
$m_{AB}(z_{850})=30.0$ mag. The contamination to the sample, either due to
image artifacts or known types of astronomical objects, is likely negligible.
The inferred surface densities of $z\simeq 6$ galaxies are consistent with our
earlier predictions from $m_{AB}(z_{850})=26.5$ to 28.5 mag. After correcting
for detection incompleteness, the counts of $z\simeq 6$ candidates to
$m_{AB}(z_{850})=29.2$ mag suggests that the faint-end slope of the galaxy
luminosity function (LF) at this redshift is likely between $\alpha=-1.8$ and
-1.9, which is sufficient to account for the entire Lyman photon budget
necessary to complete the reionization of the universe at $z\simeq 6$. We also
searched for $z\simeq 6.5$--7 candidates using the UDF NICMOS data, and have
found four candidates to $J_{110}=27.2$ mag. However, the infrared colors of
three candidates cannot be easily explained by galaxies in this redshift range.
We tentatively derive an upper limit to the cumulative surface density of
galaxies at $z\simeq 7$ of 0.36 per arcmin$^2$ to $J_{110}=26.6$ mag, which
suggest a noticeable drop in the LF amplitude from $z\simeq 6$ to $z\simeq 7$.
","[{""version"":""v1"",""created"":""Thu, 22 Jul 2004 23:08:15 GMT""}]","2009-11-10"
"astro-ph/0407494","Diego F. Torres","Diego F. Torres, Gustavo E. Romero, Felix Mirabel","Neutrinos from microquasars","Talk presented at the V Microquasar Workshop, Beijing, China, June
  5-13, 2004. Proceedings to appear in the Chinese Journal of Astronomy and
  Astrophysics","Chin.J.Astron.Astrophys.5:S133-S138,2005","10.1088/1009-9271/5/S1/133",,"astro-ph",,"  The jets of microquasars with high-mass stellar companions are exposed to the
dense matter field of the stellar wind as well as to the photon densities found
in the surrounding medium. Photopion and proton-proton interactions could then
lead to copious production of neutrinos. In this work, we analyze the hadronic
microquasar model, particularly in what concerns to the neutrino production.
Limits to this kind of models using data from AMANDA-II are established. New
constraints are also imposed upon specific microquasar models based on
photopion processes. These are very restrictive particularly for the case of
SS433, a microquasar for which the presence of accelerated hadrons has been
already inferred from iron X-ray line observations.
","[{""version"":""v1"",""created"":""Fri, 23 Jul 2004 14:59:37 GMT""}]","2014-10-13"
"astro-ph/0407495","Antonino del Popolo","R. Bass, A. Del Popolo","On Bode's law","18 pages. Accepted by IJMP","International Journal of Modern Physics D, Volume 14, Issue 01,
  pp. 153-169 (2005)","10.1142/S0218271805006195",,"astro-ph",,"  In a planetary or satellite system, idealized as n small bodies in initially
coplanar, concentric orbits around a large central body, obeying Newtonian
point-particle mechanics, resonant perturbations will cause dynamical evolution
of the orbital radii except under highly specific mutual relationships, here
derived analytically.
","[{""version"":""v1"",""created"":""Fri, 23 Jul 2004 00:14:07 GMT""}]","2014-02-04"
"astro-ph/0407496","Dmitri Wiebe","D.S. Wiebe, W.D. Watson","Irregular Magnetic Fields and the Far-Infrared Polarimetry of Dust
  Emission from Interstellar Clouds","ApJ, in press","Astrophys.J. 615 (2004) 300-314","10.1086/424033",,"astro-ph",,"  (abridged) The polarized thermal radiation at far infrared and submillimeter
wavelengths from dust grains in interstellar clouds with irregular magnetic
fields is simulated. We show that the polarization properties of quiescent
clouds and of star-forming regions are consistent with Kolmogorov-like
turbulent magnetic fields that are comparable in magnitude to the uniform
component of the magnetic fields. If the beam size is much smaller than the
correlation length $L_{\rm corr}$ of the fields, the calculated percentage
polarization $p$ decreases to an asymptotic value when the number of
correlation lengths $N_{\rm corr}$ through the cloud exceeds a few tens. For
these values of $N_{\rm corr}$, the dispersion in the position angles
$\sigma_\alpha$ is still appreciable--decreasing to only about $20^{\circ}$.
However, when the finite size of a telescope beam is taken into account, the
asymptotic value of $p$ is reached for fewer correlation lengths (smaller
$N_{\rm corr}$) due to averaging over the beam; $\sigma_\alpha$ becames much
smaller and consistent with the observational data. The smoothing of the
polarization properties due to the combined effect of the thickness of the
cloud and the finite size of the beam can be described by a single variable
which we designate as the generalized number of correlation lengths. In
addition, we study various factors that may contribute to the decrease in the
linear polarization percentage with increasing intensity that is observed at
submillimeter and far infrared wavelengths in many, though not in all, dark
clouds (the ""polarization hole"" effect).
","[{""version"":""v1"",""created"":""Fri, 23 Jul 2004 06:41:06 GMT""}]","2009-11-10"
"astro-ph/0407497","Zigao Dai","Z. G. Dai, E. W. Liang, D. Xu (NJU)","Constraining $\Omega_M$ and Dark Energy with Gamma-Ray Bursts","8 pages including 4 figures, to appear in ApJ Letters, typos
  corrected","Astrophys.J. 612 (2004) L101-L104","10.1086/424694",,"astro-ph",,"  An $E_{\gamma,{\rm jet}}\propto {E'_p}^{1.5}$ relationship with a small
scatter for current $\gamma$-ray burst (GRB) data was recently reported, where
$E_{\gamma,{\rm jet}}$ is the beaming-corrected $\gamma$-ray energy and $E'_p$
is the $\nu F_\nu$ peak energy in the local observer frame. By considering this
relationship for a sample of 12 GRBs with known redshift, peak energy, and
break time of afterglow light curves, we constrain the mass density of the
universe and the nature of dark energy. We find that the mass density
$\Omega_M=0.35\pm^{0.15}_{0.15}$ (at the $1\sigma$ confident level) for a flat
universe with a cosmological constant, and the $w$ parameter of an assumed
static dark-energy equation of state $w=-0.84\pm^{0.57}_{0.83}$ ($1\sigma$).
Our results are consistent with those from type Ia supernovae. A larger sample
established by the upcoming {\em Swift} satellite is expected to provide
further constraints.
","[{""version"":""v1"",""created"":""Fri, 23 Jul 2004 07:29:24 GMT""},{""version"":""v2"",""created"":""Sun, 25 Jul 2004 08:10:51 GMT""}]","2016-08-30"
"astro-ph/0407498","Achille A. Nucita","F. De Paolis, G. Ingrosso, A. A. Nucita","A super massive black hole binary in 3C66B: future observational
  perspectives","8 pages, 8 figures, in Press on Astronomy & Astrophysics","Astron.Astrophys. 426 (2004) 379-385","10.1051/0004-6361:20040314",,"astro-ph",,"  Supermassive black hole binaries (SMBHBs) may exist in the centers of
galaxies and active galactic nuclei (AGN) and are expected to be fairly common
in the Universe as a consequence of merging processes between galaxies. The
existence of SMBHBs can be probed by looking for double nuclei in galaxy
centers or, more easily, detecting periodic behavior in the observed radio
light curves. In a recent paper, Sudou et al. \cite{sudou2003} announced the
first direct observation of an SMBHB. Using VLBI observations they found that
the unresolved radio core of the radio galaxy 3C66B shows a well defined
elliptical motion with a period of $1.05\pm 0.03$ yrs, implying the presence of
a couple of massive black holes in the center of the galaxy. In the present
paper we study the astrophysical implications of the existence of such an SMBHB
in 3C66B. In particular we focus on the information that can be obtained from
detecting a signal periodicity either in the $X$-ray and/or $\gamma$-ray light
curves as a consequence of the motion of the black holes. These observations
could be used to extract further information on the physical parameters of the
SMBHB and partially solve the system parameter degeneracy. The detection of the
gravitational wave spectrum emitted by such system may be used to completely
determine the physical parameters of the binary system.
","[{""version"":""v1"",""created"":""Fri, 23 Jul 2004 07:51:18 GMT""}]","2009-11-10"
"astro-ph/0407499","Isabella Prandoni","I. Prandoni, H.R. de Ruiter, P. Parma","Modeling the faint radio population: the nanoJy radio sky","2 pages, 1 figure. To appear in ""Exploring the Cosmic Frontier:
  Astrophysical Instruments for the 21st Century"", proceedings of the
  conference held in Berlin, 18-21 May 2004",,,,"astro-ph",,"  The apparent change in the composition of the parent optical objects of radio
sources around 1 mJy (at 1.4 GHz) is now well established, although there is
still some debate about the relative importance of classical radio galaxies and
star-forming galaxies at sub-mJy levels (see e.g. Gruppioni et al. 1999;
Prandoni et al. 2001b). It is clear, however, that at microJy levels
star-forming galaxies are dominant (see Fomalont et al. 1997; Haarsma et al.
2000). Does this mean that SKA will basically tell us more about the history of
star formation than about the space density (and its cosmological evolution) of
active galactic nuclei? Using current best estimates of luminosity functions
(and their evolution) of various classes of objects, we show that the
increasing dominance of star-forming galaxies below 1 mJy is a natural
consequence of the different luminosity functions, but that this does not at
all mean that star-forming galaxies do necessarily dominate at all sub-mJy flux
levels and all redshifts.
","[{""version"":""v1"",""created"":""Fri, 23 Jul 2004 09:22:33 GMT""}]","2007-05-23"
"astro-ph/0407500","Hongsu Kim","Hongsu Kim, Hyung Mok Lee, Chul H. Lee, Hyun Kyu Lee","Pulsar Magnetosphere : A General Relativistic Treatment","42 pages, 3 figures, Mon. Not. R. Astron. Soc.(MNRAS), in press","Mon.Not.Roy.Astron.Soc. 358 (2005) 998-1018","10.1111/j.1365-2966.2005.08839.x",,"astro-ph gr-qc hep-th",,"  A fully general relativistic description of the pulsar magnetosphere is
provided. To be more concrete, a study of the pulsar magnetosphere is performed
in the context of general relativistic magnetohydrodynamics (MHD) employing the
so-called Grad-Shafranov approach. Not surprisingly, the resulting
Grad-Shafranov equations and all the other related general relativistic MHD
equations turn out to take essentially the same structures as those for the
(rotating) black hole magnetosphere. Other different natures between the two
cases including the structure of singular surfaces of MHD flows in each
magnetosphere are essentially encoded in the different spacetime (metric)
contents. In this way, the pulsar and the black hole magnetospheres can be
described in an unified fashion. Particularly, the direction of poloidal
currents circulating in the neutron star magnetosphere turns out to be the same
as that of currents circulating in the black hole magnetosphere which, in turn,
leads to the pulsar and the black hole spin-downs via the ``magnetic braking''.
","[{""version"":""v1"",""created"":""Fri, 23 Jul 2004 10:50:47 GMT""},{""version"":""v2"",""created"":""Sat, 24 Jul 2004 12:21:21 GMT""},{""version"":""v3"",""created"":""Wed, 19 Jan 2005 11:41:49 GMT""}]","2007-05-23"
"astro-ph/0407501","Abhas Mitra","Abhas Mitra (NRL, BARC, India)","Why the astrophysical Black Hole Candidates are not rotating black holes","Thoroughly revised, new eqs. new ref., new supporting proof, many
  points clarified, physical interpretation included",,,,"astro-ph gr-qc",,"  It is believed that the basic component of the central engine of quasars,
micro-quasars, and energetic Gamma Ray Bursts are the rotating or the Kerr
Black Holes (BH)[1]. But by using a generic property[2-4] of the metric
components of a stationary axisymmertic rotating metric in its standard form},
namely, g_phi \phi = sin^2 theta g_theta theta, where phi is the azimuth angle
and theta is the polar angle measured from the axis of symmetry, we have found
the unexpected and surprising result that (i) in order to have a mass of a Kerr
BH m ge 0, it is necessary that its rotation parameter a=0 and if one insists
for an a ge 0, one must have m le 0! Thus if the suspected Black Hole
candidates with m >0 are really rotating they cannot be BHs at all which is in
agreement with some detailed analysis of recent observations[5-8]. However, if
it is assumed that such objects are strictly non-rotating, they could be
non-rotating Schwarzschild BHs (a=0) with m ge 0 if we ignore the physical
difficulties associated with the existence of such objects. This result calls
for new theoretical efforts to understand a vast range of astrophysical
phenomenon. If one derives the Kerr Metric in a straightforward manner by using
the Backlund transformation, it is seen that a=m sin phi. This relationship
confirms that a=m=0 for Kerr BHs.
","[{""version"":""v1"",""created"":""Fri, 23 Jul 2004 10:56:24 GMT""},{""version"":""v2"",""created"":""Wed, 1 Sep 2004 12:05:18 GMT""}]","2007-05-23"
