"hep-ph/0407282","Alexander Lenz","V.M.Braun and A.Lenz","On the SU(3) Symmetry-Breaking Corrections to Meson Distribution
  Amplitudes","15 pages,4 figures","Phys.Rev. D70 (2004) 074020","10.1103/PhysRevD.70.074020",,"hep-ph",,"  We consider constraints on the momentum fraction of the $K$ and $K^*$ meson
carried by the strange quark that follow from exact operator identities,
similar to those for the divergence of the quark part of the QCD
energy-momentum tensor. The existing QCD sum rule estimates are reanalyzed in
this context. Our conclusions essentially support the constituent quark-model
picture where the momentum fraction is roughly proportional to the constituent
quark mass, but the asymmetry turns out to be smaller compared to the naive
quark model estimates. As a byproduct of this study, we calculate the
SU(3)-breaking quark-antiquark-gluon matrix elements that determine the leading
conformal spin contributions to the asymmetry in twist-four distribution
amplitudes of strange mesons $K$ and $K^*$, and also update the estimate for
the SU(3) breaking for the quark-antiquark-gluon vacuum condensate.
","[{""version"":""v1"",""created"":""Fri, 23 Jul 2004 12:39:29 GMT""}]","2009-11-10"
"hep-th/0407198","Mayer Christoph","Christoph Mayer and Thomas Mohaupt","Domain Walls, Hitchin's Flow Equations and G_2-Manifolds","18 pages, v2: minor improvements in presentation, added two
  references","Class.Quant.Grav.22:379-392,2005","10.1088/0264-9381/22/2/010","FSU-TPI-05/04","hep-th",,"  We construct BPS domain wall solutions of the effective action of type-IIA
string theory compactified on a half-flat six-manifold. The flow equations for
the vector and hypermultiplet scalars are shown to be equivalent to Hitchin's
flow equations, implying that our domain walls can be lifted to solutions of
ten-dimensional type-IIA supergravity. They take the form R^{1,2} x Y_7, where
Y_7 is a G_2-holonomy manifold with boundaries.
","[{""version"":""v1"",""created"":""Thu, 22 Jul 2004 16:45:25 GMT""},{""version"":""v2"",""created"":""Wed, 6 Oct 2004 13:47:01 GMT""}]","2016-09-06"
"hep-th/0407199","Edward Corrigan","E. Corrigan and C. Zambon","Aspects of sine-Gordon solitons, defects and gates","8 pages","J.Phys. A37 (2004) L471","10.1088/0305-4470/37/37/L03",,"hep-th nlin.SI",,"  It was recently noted how the classical sine-Gordon theory can support
discontinuities, or `defects', and yet maintain integrability by preserving
sufficiently many conservation laws. Since soliton number is not preserved by a
defect, a possible application to the construction of logical gates is
suggested.
","[{""version"":""v1"",""created"":""Thu, 22 Jul 2004 17:33:47 GMT""}]","2009-11-10"
"hep-th/0407200","Ido Adam","Ido Adam and Yaron Oz","Gravitational F-terms of N=1 Supersymmetric Gauge Theories","LaTeX2e, 23 pages, 2 figures. Added a reference and converted into
  JHEP style","JHEP 0411:071,2004","10.1088/1126-6708/2004/11/071","TAUP-2776-04","hep-th",,"  We consider four-dimensional N=1 supersymmetric gauge theories in a
supergravity background. We use generalized Konishi anomaly equations and
R-symmetry anomaly to compute the exact perturbative and non-perturbative
gravitational F-terms. We study two types of theories: The first model breaks
supersymmetry dynamically, and the second is based on a $G_2$ gauge group. The
results are compared with the corresponding vector models. We discuss the
diagrammatic expansion of the $G_2$ theory.
","[{""version"":""v1"",""created"":""Thu, 22 Jul 2004 18:31:34 GMT""},{""version"":""v2"",""created"":""Tue, 31 Aug 2004 19:37:12 GMT""}]","2009-09-29"
"hep-th/0407201","Stepanyantz Konstantin","K.V.Stepanyantz","Investigation of the anomaly puzzle in N=1 supersymmetric
  electrodynamics","LaTeX, 22 pages, 1 eps figure","Theor.Math.Phys. 142 (2005) 29-47; Teor.Mat.Fiz. 142 (2005) 37-57","10.1007/s11232-005-0053-6",,"hep-th",,"  Using Schwinger-Dyson equations and Ward identities in N=1 supersymmetric
electrodynamics, regularized by higher derivatives, we find, that it is
possible to calculate some contributions to the two-point Green function of the
gauge field and to the beta-function exactly to all orders of the perturbation
theory. The results are applied for the investigation of the anomaly puzzle in
the considered theory.
","[{""version"":""v1"",""created"":""Thu, 22 Jul 2004 18:59:25 GMT""}]","2016-09-06"
"hep-th/0407202","Eva Silverstein","Eva Silverstein","Counter-intuition and Scalar Masses","11 pages, harvmac big",,,"SLAC-PUB-10569, SU-ITP-04/30","hep-th",,"  The Bousso-Polchinski mechanism for discretely fine-tuning the cosmological
constant favors a large bare negative cosmological constant. I argue (using
generalizations of results of Klebanov and Tseytlin) that a similar mechanism
for fine-tuning the scalar masses to small values favors a large bare negative
(i.e. tachyonic) scalar mass. I comment briefly on the related issue of the
role of low energy supersymmetry in string theory.
","[{""version"":""v1"",""created"":""Thu, 22 Jul 2004 18:43:55 GMT""}]","2007-05-23"
"hep-th/0407203","Hitoshi Nishino","Hitoshi Nishino and Subhash Rajpoot","Supersymmetric Gauged Scale Covariance in Ten and Lower Dimensions","14 pages, no figures","Phys.Lett. B604 (2004) 123-132","10.1016/j.physletb.2004.10.052","CSULB-PA-04-5","hep-th",,"  We present globally supersymmetric models of gauged scale covariance in ten,
six, and four-dimensions. This is an application of a recent similar gauging in
three-dimensions for a massive self-dual vector multiplet. In ten-dimensions,
we couple a single vector multiplet to another vector multiplet, where the
latter gauges the scale covariance of the former. Due to scale covariance, the
system does not have a lagrangian formulation, but has only a set of field
equations, like Type IIB supergravity in ten-dimensions. As by-products, we
construct similar models in six-dimensions with N=(2,0) supersymmetry, and
four-dimensions with N=1 supersymmetry. We finally get a similar model with N=4
supersymmetry in four-dimensions with consistent interactions that have never
been known before. We expect a series of descendant theories in dimensions
lower than ten by dimensional reductions. This result also indicates that
similar mechanisms will work for other vector and scalar multiplets in
space-time lower than ten-dimensions.
","[{""version"":""v1"",""created"":""Fri, 23 Jul 2004 00:46:31 GMT""}]","2009-11-10"
"hep-th/0407204","Alexander Turbiner","Konstantin G. Boreskov, Alexander V. Turbiner, Juan C. Lopez Vieyra","Solvability of the Hamiltonians related to exceptional root spaces:
  rational case","51 pages, LaTeX, few equations added, one reference added, typos
  corrected","Commun.Math.Phys. 260 (2005) 17-44","10.1007/s00220-005-1401-y","ICN-UNAM 04-10","hep-th",,"  Solvability of the rational quantum integrable systems related to exceptional
root spaces $G_2, F_4$ is re-examined and for $E_{6,7,8}$ is established in the
framework of a unified approach. It is shown the Hamiltonians take algebraic
form being written in a certain Weyl-invariant variables. It is demonstrated
that for each Hamiltonian the finite-dimensional invariant subspaces are made
from polynomials and they form an infinite flag. A notion of minimal flag is
introduced and minimal flag for each Hamiltonian is found. Corresponding
eigenvalues are calculated explicitly while the eigenfunctions can be computed
by pure linear algebra means for {\it arbitrary} values of the coupling
constants. The Hamiltonian of each model can be expressed in the algebraic form
as a second degree polynomial in the generators of some infinite-dimensional
but finitely-generated Lie algebra of differential operators, taken in a
finite-dimensional representation.
","[{""version"":""v1"",""created"":""Fri, 23 Jul 2004 08:03:27 GMT""},{""version"":""v2"",""created"":""Thu, 24 Feb 2005 00:00:32 GMT""}]","2009-11-10"
"hep-th/0407205","Luca Sommovigo","Luca Sommovigo and Silvia Vaul\'a","D=4, N=2 Supergravity with Abelian electric and magnetic charges","10 pages LaTex, no figures","Phys.Lett.B602:130-136,2004","10.1016/j.physletb.2004.09.058","DESY-04-132","hep-th",,"  We discuss the relation between standard N=2 supergravity with translational
gauging and N=2 supergravities with scalar-tensor multiplets with massive
tensors and Abelian electric charges. We point out that a symplectic covariant
formulation of N=2 supergravity can be achieved just in the presence of tensor
multiplets. As a consequence one can see that the formulation of the N=2 theory
as it comes from IIB flux compactification, which is included in these models,
is equivalent to a non perturbative phase of standard N=2 supergravity. It is
also shown that the IIB tadpole cancellation condition is imposed by
supersymmetry in four dimensions.
","[{""version"":""v1"",""created"":""Fri, 23 Jul 2004 09:03:06 GMT""},{""version"":""v2"",""created"":""Wed, 8 Sep 2004 16:03:25 GMT""},{""version"":""v3"",""created"":""Fri, 22 Oct 2004 15:20:04 GMT""}]","2008-11-26"
"hep-th/0407206","Masaki Yasue","Masaki Yasue","Strongly Coupled N=1 Supersymmetric SO(N_c) Gauge Theories without
  Magnetic Degrees of Freedom","23 pages, 1 fig, RevTex4, to appear in IJMPA","Int.J.Mod.Phys.A19:4323,2004","10.1142/S0217751X04019871","TOKAI-HEP/TH-0402","hep-th hep-ph",,"  In strongly coupled supersymmetric SO(N_c) gauge theories with N_f-quarks for
N_c-2<=N_f(<=3(N_c-2)/2), their low-energy physics can be described by
Nambu-Goldstone superfields associated with dynamical flavor symmetry breaking,
which should be compared with the absence of flavor symmetry breaking in the
conventional description in terms of magnetic degrees of freedom. The presence
of the flavor symmetry breaking is confirmed by the well-known instanton
effects in SO(N_c) with N_f=N_c-2, which are also described by our proposed
effective superpotential. For N_f>=N_c-1, our effective superpotentials utilize
baryonic configurations as well as mesons composed of two quarks. The baryonic
configurations are supplied by ""diquarks"" made of N_c-1 quarks for N_f=N_c-1
and by baryons composed of N_c quarks for N_c>=N_f. It is argued that our
effective superpotentials exhibit the holomorphic decoupling property, the
anomaly-matching property and correct description of instanton effects in
SO(N_c) when N_f-N_c+2 quarks become massive if N_f>=N_c-1.
","[{""version"":""v1"",""created"":""Fri, 23 Jul 2004 13:34:42 GMT""}]","2011-07-19"
"hep-th/0407207","Jean Dominique Laenge","A. Kirchberg, J.D. Laenge, A. Wipf","From the Dirac Operator to Wess-Zumino Models on Spatial Lattices","39 pages, 3 figures","Annals Phys. 316 (2005) 357-392","10.1016/j.aop.2004.09.002","FSU-TPI 04/04","hep-th",,"  We investigate two-dimensional Wess-Zumino models in the continuum and on
spatial lattices in detail. We show that a non-antisymmetric lattice derivative
not only excludes chiral fermions but in addition introduces supersymmetry
breaking lattice artifacts. We study the nonlocal and antisymmetric SLAC
derivative which allows for chiral fermions without doublers and minimizes
those artifacts. The supercharges of the lattice Wess-Zumino models are
obtained by dimensional reduction of Dirac operators in high-dimensional
spaces. The normalizable zero modes of the models with N=1 and N=2
supersymmetry are counted and constructed in the weak- and strong-coupling
limits. Together with known methods from operator theory this gives us complete
control of the zero mode sector of these theories for arbitrary coupling.
","[{""version"":""v1"",""created"":""Fri, 23 Jul 2004 15:40:04 GMT""}]","2009-11-10"
"math-ph/0407053","Tatiana Elizarova G.","T.G.Elizarova, I.S.Kalachinskaya, Yu.V.Sheretov","Separating Flow Behind a Back-Step. Part I. Quasi-Hydrodynamic Equations
  and Computation of a Laminar Flow","12 pages, 3 figures",,,,"math-ph math.MP",,"  We demonstrate the results of the numerical modelling of a plane
two-dimensional viscous incompressible flow in a channel with a back-step. As a
mathematical model we take equations for a incompressible flow based on the
quasi-hydrodynamic (QHD) equations. We present a phenomenological derivation of
the QHD equations and show a relation of these equations to the Navier-Stokes
system. We test the proposed numerical algorithm by computing of certain
laminar flows
","[{""version"":""v1"",""created"":""Thu, 22 Jul 2004 16:23:04 GMT""}]","2007-05-23"
"math-ph/0407054","Marcella Palese","M. Francaviglia, M. Palese and E. Winterroth (Dept. Math. Univ.
  Torino, Italy)","Generalized Bianchi identities in gauge-natural field theories and the
  curvature of variational principles","12 pages, minor changes, references list updated; presented at XXXVI
  Symposium on Math. Phys., Torun 09/06-12/06/04; v4 to appear in Rep. Math.
  Phys","Rep. Math. Phys. 56(1) (2005) 11--22.","10.1016/S0034-4877(05)80038-2",,"math-ph math.DG math.MP",,"  By resorting to Noether's Second Theorem, we relate the generalized Bianchi
identities for Lagrangian field theories on gauge-natural bundles with the
kernel of the associated gauge-natural Jacobi morphism. A suitable definition
of the curvature of gauge-natural variational principles can be consequently
formulated in terms of the Hamiltonian connection canonically associated with a
generalized Lagrangian obtained by contracting field equations.
","[{""version"":""v1"",""created"":""Fri, 23 Jul 2004 12:38:34 GMT""},{""version"":""v2"",""created"":""Mon, 26 Jul 2004 14:34:51 GMT""},{""version"":""v3"",""created"":""Fri, 17 Dec 2004 13:08:36 GMT""},{""version"":""v4"",""created"":""Wed, 27 Apr 2005 10:48:21 GMT""}]","2009-11-10"
"math/0407390","Frank Schuhmacher","Frank Schuhmacher","Deformation of singularities via $L_\infty$-algebras","7 pages",,,,"math.QA math.CV",,"  This is an addendum to the paper ``Deformation of $L_\infty$-Algebras'' of
the same author. We explain in which way the deformation theory of
$L_\infty$-algebras extends the deformation theory of singularities. We show
that the construction of semi-universal deformations of $L_\infty$-algebras
gives explicit formal semi-universal deformations of isolated singularities.
","[{""version"":""v1"",""created"":""Thu, 22 Jul 2004 16:20:11 GMT""}]","2007-05-23"
"math/0407391","Bernhard Kroetz","Bernhard Kroetz, Gestur Olafsson, Robert Stanton","The image of the heat kernel transform on Riemannian symmetric spaces of
  the noncompact type","Expanded version. Two new sections added in order to clarify two
  remarks in the previous verson. 15 p","IMRN, 2005 (22), 1307-1329",,,"math.CA math.RT",,"  The heat kernel or Bargmann-Segal transform on a noncompact Riemannian
symmetric space X=G/K maps a square integrable function on X to a holomorphic
function on the complex crown. In this article we determine the range of this
transform.
","[{""version"":""v1"",""created"":""Thu, 22 Jul 2004 19:16:23 GMT""},{""version"":""v2"",""created"":""Sun, 22 Aug 2004 18:25:47 GMT""},{""version"":""v3"",""created"":""Sat, 19 Feb 2005 02:58:45 GMT""}]","2007-05-23"
"math/0407392","Rub\'en Vigara","Rub\'en Vigara","A set of moves for Johansson representation of 3-manifolds. An outline","42 pages, 36 figures","Fundamenta Mathematicae 190 (2006), 245-288",,,"math.GT",,"  A Dehn sphere in a closed 3-manifold M is a 2-sphere immersed in M with only
double curve and triple point singularities. The Dehn sphere S fills M if it
defines a cell-decomposition of M. The inverse image in S^{2} of the double
curves of S is the Johansson diagram of S and if S fills M it is possible to
reconstruct M from the diagram. A Johansson representation of M is the
Johansson diagram of a filling Dehn sphere of M. In a recent paper of J. M.
Montesinos it is proved that every closed 3-manifold has a Johansson
representation coming from a nulhomotopic filling Dehn sphere. In this paper a
set of moves for Johansson representations of 3-manifolds is given. In a
forthcoming paper it is proved that this set of moves suffices for relating
different Johansson representations of the same 3-manifold coming from
nulhomotopic filling Dehn spheres. The proof of this result is outlined here.
","[{""version"":""v1"",""created"":""Thu, 22 Jul 2004 20:29:47 GMT""},{""version"":""v2"",""created"":""Fri, 23 Jul 2004 21:08:25 GMT""},{""version"":""v3"",""created"":""Tue, 27 Jul 2004 16:29:44 GMT""}]","2009-09-29"
"math/0407393","Robert Pollack","Robert Pollack","An algebraic version of a theorem of Kurihara",,,,,"math.NT",,"  Let E/Q be an elliptic curve and let p be an odd supersingular prime for E.
In this article, we study the simplest case of Iwasawa theory for elliptic
curves, namely when E(Q) is finite, III(E/Q) has no p-torsion and the Tamagawa
factors for E are all prime to p. Under these hypotheses, we prove that E(Q_n)
is finite and make precise statemens about the size and structure of the
p-power part of III(E/Q_n). Here Q_n is the n-th step in the cyclotomic
Z_p-extension of Q.
","[{""version"":""v1"",""created"":""Thu, 22 Jul 2004 22:07:08 GMT""}]","2007-05-23"
"math/0407394","Xiangdong Xie","Xiangdong Xie","Mostow rigidity for Fuchsian buildings","58 pages",,,,"math.GR math.GT",,"  We show that if a homeomorphism between the ideal boundaries of two Fuchsian
buildings preserves the combinatorial cross ratio almost everywhere, then it
extends to an isomorphism between the Fuchsian buildings. It follows that
Mostow rigidity holds for Fuchsian buildings: if a group acts properly and
cocompactly on two Fuchsian buildings X and Y, then X and Y are equivariantly
isomorphic.
","[{""version"":""v1"",""created"":""Fri, 23 Jul 2004 03:56:13 GMT""}]","2007-05-23"
"math/0407395","Daniel Belti\c{t}?","Daniel Belti\c{t}\u{a}","Integrability of almost complex structures on Banach manifolds","13 pages",,,,"math.DG math.OA",,"  We prove that the classical integrability condition for almost complex
structures on finite-dimensional smooth manifolds also works in infinite
dimensions in the case of almost complex structures that are real analytic on
real analytic Banach manifolds. As an application, we extend some known results
concerning existence of invariant complex structures on homogeneous spaces of
Banach-Lie groups.
","[{""version"":""v1"",""created"":""Fri, 23 Jul 2004 05:21:27 GMT""}]","2007-05-23"
"math/0407396","Alexander Goldenshluger","A. Goldenshluger, A. Tsybakov, A. Zeevi","Optimal change-point estimation from indirect observations","Published at http://dx.doi.org/10.1214/009053605000000750 in the
  Annals of Statistics (http://www.imstat.org/aos/) by the Institute of
  Mathematical Statistics (http://www.imstat.org)","Annals of Statistics 2006, Vol. 34, No. 1, 350-372","10.1214/009053605000000750","IMS-AOS-AOS0068","math.ST stat.TH",,"  We study nonparametric change-point estimation from indirect noisy
observations. Focusing on the white noise convolution model, we consider two
classes of functions that are smooth apart from the change-point. We establish
lower bounds on the minimax risk in estimating the change-point and develop
rate optimal estimation procedures. The results demonstrate that the best
achievable rates of convergence are determined both by smoothness of the
function away from the change-point and by the degree of ill-posedness of the
convolution operator. Optimality is obtained by introducing a new technique
that involves, as a key element, detection of zero crossings of an estimate of
the properly smoothed second derivative of the underlying function.
","[{""version"":""v1"",""created"":""Fri, 23 Jul 2004 05:48:25 GMT""},{""version"":""v2"",""created"":""Thu, 18 May 2006 15:20:46 GMT""}]","2007-06-13"
"math/0407397","Meng Chen","Meng Chen (Fudan University, Shanghai)","A sharp lower bound for the canonical volume of 3-folds of general type","Final version, 22 pages, to appear in Math. Annalen",,,,"math.AG",,"  Let V be a smooth projective 3-fold of general type. Denote by $K^3$, a
rational number, the self-intersection of the canonical sheaf of any minimal
model of V. One defines $K^3$ as the canonical volume of $V$. Assume $p_g\ge
2$. We show that $K^3\ge {1/3}$, which is a sharp lower bound. Then we classify
those V with small $K^3$ up to explicit tructure. We also give some new
examples with $p_g=2$ which have maximal canonical stability index. Finally we
give an application to certain algebraic 4-folds.
","[{""version"":""v1"",""created"":""Fri, 23 Jul 2004 07:14:44 GMT""},{""version"":""v2"",""created"":""Wed, 28 Jul 2004 17:38:51 GMT""},{""version"":""v3"",""created"":""Sun, 1 Aug 2004 11:22:47 GMT""},{""version"":""v4"",""created"":""Mon, 11 Jul 2005 10:02:25 GMT""},{""version"":""v5"",""created"":""Sun, 21 Aug 2005 03:15:01 GMT""}]","2007-05-23"
"math/0407398","Ngo Viet Trung","Maria Evelina Rossi, Ngo Viet Trung and Giuseppe Valla","Castelnuovo-Mumford Regularity and finiteness of Hilbert Functions","13 pages",,,,"math.AC math.AG",,"  The notion of regularity has been used by S. Kleiman in the construction of
bounded families of ideals or sheaves with given Hilbert polynomial, a crucial
point in the construction of Hilbert or Picard scheme. In a related direction,
Kleiman proved that if I is an equidimensional reduced ideal in a polynomial
ring S over an algebraically closed field, then the coefficients of the Hilbert
polynomial of R = S/I can be bounded by the dimension and the multiplicity of
R. Srinivas and Trivedi proved that the corresponding result does not hold for
a local domain. However, they proved that there exist a finite number of
Hilbert functions for a local Cohen-Macaulay ring of given multiplicity and
dimension. The proofs of the above results are very difficult and involve deep
results from Algebraic Geometry.
  The aim of this paper is to introduce a unified approach which gives more
general results and easier proofs of the above mentioned results. This approach
is based on the fact that a class C of standard graded algebras has a finite
number of Hilbert functions if and only if there are upper bounds for the
regularity and the embedding dimension of the members of C.
","[{""version"":""v1"",""created"":""Fri, 23 Jul 2004 08:49:25 GMT""}]","2007-05-23"
"math/0407399","Izu Vaisman","Izu Vaisman","Transitive Courant algebroids","LaTex, 27 pages",,,,"math.DG math.SG",,"  We express any Courant algebroid bracket by means of a metric connection, and
construct a Courant algebroid structure on any orthogonal Whitney sum $E\oplus
C$ where E is a given Courant algebroid and C is a flat, pseudo- Euclidean
vector bundle. Then, we establish the general expression of the bracket of a
transitive Courant algebroid, i.e., a Courant algebroid with a surjective
anchor, and describe a class of transitive Courant algebroids which are Whitney
sums of a Courant subalgebroid with neutral metric and Courant-like bracket and
a pseudo-Euclidean vector bundle with a flat, metric connection. In particular,
this class contains all the transitive Courant algebroids of minimal rank; for
these, the flat term mentioned above is zero. The results extend to regular
Courant algebroids, i.e., Courant algebroids with a constant rank anchor. The
paper ends with miscellaneous remarks and an appendix on Dirac linear spaces.
","[{""version"":""v1"",""created"":""Fri, 23 Jul 2004 09:32:15 GMT""}]","2007-05-23"
"math/0407400","Bardakov Valerij Georgievich","Valerij G. Bardakov","The virtual and universal braids","20 pages, 5 figures",,,,"math.GR math.GT",,"  We study the structure of the virtual braid group. It is shown that the
virtual braid group is a semi--direct product of the virtual pure braid group
and the symmetric group. Also, it is shown that the virtual pure braid group is
a semi--direct product of free groups. From these results we obtain a normal
form of words in the virtual braid group. We introduce the concept of a
universal braid group. This group contains the classical braid group and has as
its quotient groups the singular braid group, virtual braid group, welded braid
group, and classical braid group.
","[{""version"":""v1"",""created"":""Fri, 23 Jul 2004 10:07:54 GMT""}]","2007-05-23"
"math/0407401","Paolo Piazza","Eric Leichtnam and Paolo Piazza","Cut-and-Paste on Foliated Bundles","43 pages. To appear in an AMS Contemporary Math. Proceedings volume
  on ""Spectral Geometry of Manifolds with Boundary"", edited by B.
  Booss-Bavnbek, G. Grubb and K. P. Wojciechowski. For related papers see
  http://www.mat.uniroma1.it/people/piazza/preprint.htm",,,,"math.DG math.KT",,"  We discuss the behaviour of the signature index class of closed foliated
bundles under the operation of cutting and pasting. Along the way we establish
several index theoretic results: we define Atiyah-Patodi-Singer (APS) index
classes for Dirac-type operators on foliated bundles with boundary; we prove a
relative index theorem for the difference of two APS-index classes associated
to different boundary conditions; we prove a gluing formula on closed foliated
bundles that are the union of two foliated bundles with boundary; we establish
a variational formula for APS-index classes of a 1-parameter family of
Dirac-type operators on foliated bundles (this formula involves the
noncommutative spectral flow of the boundary family). All these formulas take
place in the $K$-theory of a suitable cross-product algebra.
  We then apply these results in order to find sufficient conditions ensuring
the equality of the signature index classes of two cut-and-paste equivalent
foliated bundles. We give applications to the question of when the Baum-Connes
higher signatures of closed foliated bundles are cut-and-paste invariant.
","[{""version"":""v1"",""created"":""Fri, 23 Jul 2004 12:50:25 GMT""}]","2016-09-07"
