"gr-qc/0407084","Rafael A. Vera","Rafael A. Vera","A new relativity principle for bodies in different gravitational
  potentials","24 pages, latex, submitted to IJMP, corrected typos and improved
  grammar",,,,"gr-qc",,"  A general principle of non-equivalence for bodies and observers in different
G potentials (GP) was derived from correspondence of the Einstein's equivalence
principle either with optical physics or with gravitational experiments in
which bodies and observers are in different GP. According to it some relative
physical changes occur to any well defined part of an object after a change of
GP.. Such changes cannot be measured by observers travelling with the object
because his instruments change in identical proportions. The same principle was
derived from a new gravitational theory based on a particle model made up of
photons in stationary states. Such model accounts for the inertial and
gravitational properties of matter. This principle is not consistent with both,
the classical hypotheses on the relative invariability of the bodies after a
change of GP and with the G field energy hypothesis. The two kinds of errors
are of the same magnitude and opposite signs. Such errors are cancelled but
only when the two hypotheses are used. This accounts for the good predictions
of general relativity for the classical gravitational tests. The new properties
of the universe derived from the new principle, are radically different from
the classical ones. They are more clearly consistent with the astronomical
observations.
","[{""version"":""v1"",""created"":""Thu, 22 Jul 2004 23:55:02 GMT""},{""version"":""v2"",""created"":""Mon, 2 Aug 2004 17:31:56 GMT""}]","2007-05-23"
"gr-qc/0407085","Takahiro Tanaka","Oriol Pujolas, Takahiro Tanaka","Massless scalar fields and infrared divergences in the inflationary
  brane world","20 pages. References added","JCAP 0412 (2004) 009","10.1088/1475-7516/2004/12/009","YITP-04-38, KUNS-1927","gr-qc hep-th",,"  We study the quantum effects induced by bulk scalar fields in a model with a
de Sitter (dS) brane in a flat bulk (the Vilenkin-Ipser-Sikivie model) in more
than four dimensions. In ordinary dS space, it is well known that the stress
tensor in the dS invariant vacuum for an effectively massless scalar
($m_\eff^2=m^2+\xi {\cal R}=0$ with ${\cal R}$ the Ricci scalar) is infrared
divergent except for the minimally coupled case. The usual procedure to tame
this divergence is to replace the dS invariant vacuum by the Allen Follaci (AF)
vacuum. The resulting stress tensor breaks dS symmetry but is regular.
Similarly, in the brane world context, we find that the dS invariant vacuum
generates $\tmn$ divergent everywhere when the lowest lying mode becomes
massless except for massless minimal coupling case. A simple extension of the
AF vacuum to the present case avoids this global divergence, but $\tmn$ remains
to be divergent along a timelike axis in the bulk. In this case, singularities
also appear along the light cone emanating from the origin in the bulk,
although they are so mild that $\tmn$ stays finite except for non-minimal
coupling cases in four or six dimensions. We discuss implications of these
results for bulk inflaton models. We also study the evolution of the field
perturbations in dS brane world. We find that perturbations grow linearly with
time on the brane, as in the case of ordinary dS space. In the bulk, they are
asymptotically bounded.
","[{""version"":""v1"",""created"":""Fri, 23 Jul 2004 04:12:40 GMT""},{""version"":""v2"",""created"":""Mon, 30 Aug 2004 06:53:29 GMT""},{""version"":""v3"",""created"":""Tue, 12 Oct 2004 02:10:22 GMT""}]","2009-11-10"
"gr-qc/0407086","Peter D'Eath","A.N.St.J.Farley and P.D.D'Eath (Department of Applied Mathematics and
  Theoretical Physics, University of Cambridge)","Scalar--Field Amplitudes in Black--Hole Evaporation","Submitted to Physics Letters B, Friday 23rd July 2004","Phys.Lett. B601 (2004) 184-191","10.1016/j.physletb.2004.09.004",,"gr-qc",,"  We study the quantum-mechanical decay of a Schwarzschild-like black hole into
almost-flat space and weak radiation at a very late time, evaluating quantum
amplitudes (not just probabilities) for transitions from initial to final
states. No information is lost. The model contains gravity and a massless
scalar field. The quantum amplitude to go from given initial to final bosonic
data in a slightly complexified time-interval $T={\tau}{\exp}(-i{\theta})$ at
infinity is approximately $\exp(-I)$, where $I$ is the (complex) Euclidean
action of the classical solution filling in between the boundary data. And in a
locally supersymmetric (supergravity) theory, the amplitude const. exp(-I) is
exact. Dirichlet boundary data for gravity and the scalar field are posed on an
initial spacelike hypersurface extending to spatial infinity, just prior to
collapse, and on a corresponding final spacelike surface, sufficiently far to
the future of the initial surface to catch all the Hawking radiation. In an
averaged sense this radiation has an approximately spherically-symmetric
distribution. If the time-interval $T$ were exactly real, the resulting
`hyperbolic Dirichlet boundary-value problem' would not be well posed. If
instead (`Euclidean strategy'), one takes $T$ complex, as above
($0<\theta{\leq}{\pi}/2$), the field equations become strongly elliptic, with a
unique solution to the classical boundary-value problem. Expanding the bosonic
part of the action to quadratic order in perturbations about the classical
solution gives the quantum amplitude for weak-field final configurations, up to
normalization. Such amplitudes are calculated for weak final scalar fields.
","[{""version"":""v1"",""created"":""Fri, 23 Jul 2004 15:34:46 GMT""},{""version"":""v2"",""created"":""Fri, 7 Oct 2005 14:41:02 GMT""}]","2009-11-10"
"gr-qc/0407087","Mme Marie-Christine Angonin","Philippe Tourrenc, Marie-Christine Angonin-Willaime, Xavier Ovido","Tidal gravitational effects in a satellite","accepted to General Relativity and Gravitation",,"10.1023/B:GERG.0000046181.95611.06",,"gr-qc",,"  Atomic wave interferometers are tied to a telescope pointing towards a
faraway star in a nearly free falling satellite. Such a device is sensitive to
the acceleration and the rotation relatively to the local inertial frame and to
the tidal gravitational effects too. We calculate the rotation of the telescope
due to the aberration and the deflection of the light in the gravitational
field of a central mass (the Earth and Jupiter). Within the framework of a
general parametrized description of the problem, we discuss the contributions
which must be taken into account in order to observe the Lense-Thirring effect.
Using a geometrical model, we consider some perturbations to the idealized
device and we calculate the corresponding effect on the periodic components of
the signal. Some improvements in the knowledge of the gravitational field are
still necessary as well as an increase of the experimental capabilities;
however our conclusions support a reasonable optimism for the future. Finally
we put forward the necessity of a more complete, realistic and powerful model
in order to obtain a definitive conclusion on the feasibility of the experiment
as far as the observation of the Lense-Thirring effect is involved.
","[{""version"":""v1"",""created"":""Fri, 23 Jul 2004 13:58:29 GMT""}]","2009-11-10"
"gr-qc/0407088","Plamen Fiziev","P.P.Fiziev","On the Solutions of Einstein Equations with Massive Point Source","14 pages, latex file, no figures, new essential comments and
  references added",,,"SU-04/07-02","gr-qc",,"  We show that Einstein equations are compatible with the presence of massive
point particles and find corresponding two parameter family of their solutions
which depends on the bare mechanical mass $M_0>0$ and the Keplerian mass
$M<M_0$ of the point source of gravity. The global analytical properties of
these solutions in the complex plane define a unique preferable radial variable
of the problem.
","[{""version"":""v1"",""created"":""Fri, 23 Jul 2004 15:15:47 GMT""},{""version"":""v2"",""created"":""Sat, 24 Jul 2004 11:53:14 GMT""},{""version"":""v3"",""created"":""Thu, 30 Dec 2004 13:18:25 GMT""}]","2007-05-23"
"gr-qc/0407089","Nikolaos Mavromatos","John Ellis (CERN), N.E. Mavromatos (King's Coll. Lon.), D.V.
  Nanopoulos (TAMU) and A. Sakharov (CERN and ETH)","Brany Liouville Inflation","23 pages LATEX, two eps figures incorporated; version accepted for
  publication in NJP","New J.Phys.6:171,2004","10.1088/1367-2630/6/1/171","CERN-PH-TH/2004-134","gr-qc astro-ph hep-ph hep-th",,"  We present a specific model for cosmological inflation driven by the
Liouville field in a non-critical supersymmetric string framework, in which the
departure from criticality is due to open strings stretched between the two
moving Type-II 5-branes. We use WMAP and other data on fluctuations in the
cosmic microwave background to fix parameters of the model, such as the
relative separation and velocity of the 5-branes, respecting also the
constraints imposed by data on light propagation from distant gamma-ray
bursters. The model also suggests a small, relaxing component in the present
vacuum energy that may accommodate the breaking of supersymmetry.
","[{""version"":""v1"",""created"":""Fri, 23 Jul 2004 15:23:17 GMT""},{""version"":""v2"",""created"":""Fri, 30 Jul 2004 09:57:13 GMT""},{""version"":""v3"",""created"":""Thu, 12 Aug 2004 15:58:55 GMT""},{""version"":""v4"",""created"":""Mon, 8 Nov 2004 13:56:55 GMT""}]","2009-09-11"
"hep-lat/0407032","Stefan Olejnik","Jeff Greensite, Stefan Olejnik, Daniel Zwanziger","Center Vortices and the Gribov Horizon","19 pages, 17 EPS figures, RevTeX4; v2: added references, corrected
  caption of fig. 11; v3: new data for higher couplings, clarifications on
  color-Coulomb potential in deconfined phase, version to appear in JHEP","JHEP 0505:070,2005","10.1088/1126-6708/2005/05/070",,"hep-lat hep-ph hep-th",,"  We show how the infinite color-Coulomb energy of color-charged states is
related to enhanced density of near-zero modes of the Faddeev-Popov operator,
and calculate this density numerically for both pure Yang-Mills and gauge-Higgs
systems at zero temperature, and for pure gauge theory in the deconfined phase.
We find that the enhancement of the eigenvalue density is tied to the presence
of percolating center vortex configurations, and that this property disappears
when center vortices are either removed from the lattice configurations, or
cease to percolate. We further demonstrate that thin center vortices have a
special geometrical status in gauge-field configuration space: Thin vortices
are located at conical or wedge singularities on the Gribov horizon. We show
that the Gribov region is itself a convex manifold in lattice configuration
space. The Coulomb gauge condition also has a special status; it is shown to be
an attractive fixed point of a more general gauge condition, interpolating
between the Coulomb and Landau gauges.
","[{""version"":""v1"",""created"":""Fri, 23 Jul 2004 07:53:00 GMT""},{""version"":""v2"",""created"":""Mon, 2 Aug 2004 11:05:32 GMT""},{""version"":""v3"",""created"":""Sun, 8 May 2005 15:49:00 GMT""}]","2010-02-03"
"hep-ph/0407261","Ruben Sandapen","J. R. Forshaw, R. Sandapen and G. Shaw","Low x saturation at HERA ?","8 pages, 4 figures, presented at the 26th
  Montreal-Rochester-Syracuse-Toronto (MRST) conference held at Concordia
  University, Montreal, Canada, 12th-14th May 2004. To appear in the
  proceedings","Int.J.Mod.Phys.A19:5425-5432,2004","10.1142/S0217751X04022669",,"hep-ph",,"  We compare the predictions of two distinct dipole models for inclusive and
exclusive diffractive processes. While only one of these dipole models contains
perturbative saturation dynamics, we show that the predictions of both models
are fully consistent with the available HERA data, indicating no compelling
evidence for saturation at present HERA energies.
","[{""version"":""v1"",""created"":""Thu, 22 Jul 2004 16:41:33 GMT""}]","2008-11-26"
"hep-ph/0407265","Nikolaos Mavromatos","Jean Alexandre (King's Coll. Lon.), K. Farakos (NTUA) and N.E.
  Mavromatos (King's Coll. Lon.)","Anomalous magnetic moment in parity-conserving QED3","27 pages LATEX, three eps figures incorporated","New J.Phys. 7 (2005) 48","10.1088/1367-2630/7/1/048",,"hep-ph cond-mat.str-el hep-th",,"  In this article we derive the anomalous magnetic moment of fermions in
(2+1)-dimensional parity-conserving QED3, in the presence of an externally
applied constant magnetic field. We use a spectral representation of the photon
propagator to avoid infrared divergences. We also discuss the scaling with the
magnetic field intensity in the case of strong external fields, where there is
dynamical mass generation for fermions induced by the magnetic field itself
(magnetic catalysis). The results of this paper may be of relevance to the
physics of high-temperature superconductors.
","[{""version"":""v1"",""created"":""Thu, 22 Jul 2004 16:32:43 GMT""}]","2009-11-10"
"hep-ph/0407269","Albert Villanova del Moral","M. Hirsch, J. C. Romao, J. W. F. Valle, A. Villanova del Moral","Invisible Higgs Boson Decays in Spontaneously Broken R-Parity","24 pages, 10 figures; typos corrected, published version","Phys.Rev.D70:073012,2004","10.1103/PhysRevD.70.073012","IFIC/04-40","hep-ph",,"  The Higgs boson may decay mainly to an invisible mode characterized by
missing energy, instead of the Standard Model channels. This is a generic
feature of many models where neutrino masses arise from the spontaneous
breaking of ungauged lepton number at relatively low scales, such as
spontaneously broken R-parity models. Taking these models as framework, we
reanalyze this striking suggestion in view of the recent data on neutrino
oscillations that indicate non-zero neutrino masses. We show that, despite the
smallness of neutrino masses, the Higgs boson can decay mainly to the invisible
Goldstone boson associated to the spontaneous breaking of lepton number. This
requires a gauge singlet superfield coupling to the electroweak doublet
Higgses, as in the Next to Minimal Supersymmetric Standard Model (NMSSM)
scenario for solving the $\mu$-problem. The search for invisibly decaying Higgs
bosons should be taken into account in the planning of future accelerators,
such as the Large Hadron Collider and the Next Linear Collider.
","[{""version"":""v1"",""created"":""Thu, 22 Jul 2004 16:27:18 GMT""},{""version"":""v2"",""created"":""Tue, 19 Oct 2004 13:43:40 GMT""}]","2009-06-25"
"hep-ph/0407270","Hilmar Forkel","Hilmar Forkel","QCD Vacuum Topology and Glueballs","3 pages, no figures",,"10.1063/1.1843614",,"hep-ph",,"  We outline a comprehensive study of spin-0 glueball properties which, in
particular, keeps track of the topological gluon structure. Specifically, we
implement (semi-hard) topological instanton physics as well as topological
charge screening in the QCD vacuum into the operator product expansion (OPE) of
the glueball correlators. A realistic instanton size distribution and the
(gauge-invariant) renormalization of the instanton contributions are also
implemented. Predictions for 0^{++} and 0^{-+} glueball properties are
presented.
","[{""version"":""v1"",""created"":""Thu, 22 Jul 2004 22:05:55 GMT""}]","2009-11-10"
"hep-ph/0407271","Piyabut Burikham","Piyabut Burikham","Similarity between Kaluza-Klein and Open-string amplitudes in Diphoton
  Production","10 pages, modified references","JHEP0407:053,2004","10.1088/1126-6708/2004/07/053","MADPH-04-1388","hep-ph",,"  We calculate the tree-level open-string amplitudes for the scattering of four
massless particles with diphoton final states. These amplitudes are required to
reproduce those of standard model at the tree level in the low energy limit.
After low energy stringy corrections, we found that they have similar form to
the same processes induced by exchange of the Kaluza-Klein(KK) excitations of
graviton in ADD scenario. Using this similarity, we apply constraints on the KK
mass scale $M_D$ to the string scale $M_S$. The results are consistent with
constraints from the 4-fermion scattering, about $0.6-0.9$ TeV.
","[{""version"":""v1"",""created"":""Thu, 22 Jul 2004 20:15:05 GMT""},{""version"":""v2"",""created"":""Mon, 16 Aug 2004 17:17:48 GMT""}]","2009-11-10"
"hep-ph/0407272","Maciej A. Nowak","Maciej A. Nowak","Status of chiral doublers of heavy-light hadrons in light of recent
  BaBar Cleo, Belle and Selex D_s states","Based on 2004 talks at Meson04, Rencontre de Moriond, Panda Workshop
  and Hanyang Univ. Workshop. A comment on recent D_s(2632) by Selex is added","Int.J.Mod.Phys. A20 (2005) 229-230","10.1142/S0217751X05021397",,"hep-ph",,"  We explain the main idea of the chiral doublers scenario, originating from
simultaneous constraints of chiral symmetry and of heavy quark spin symmetry on
effective theories of heavy-light hadrons. In particular we discuss chiral
doublers for mesons, chiral doublers for excited mesons, chiral doublers for
baryons and chiral doublers for excited baryons. We point out the arguments why
new states D_s(2317) and D_s(2457) might be viewed as chiral doublers of D_s
and D_s^*. Then we comment on non-strange mesons D_0(2308) and D_1'(2427)
observed by Belle and Focus, and on Theta_c(3099) signal observed by H1.
Finally, we point out that very recent discovery by SELEX of D_s(2632), if
confirmed by other experiments and if spin-parity of this state is 1^-, may be
interpreted as a signal for chiral doubler of D_{s1}(2536). Such an
identification implies another narrow, spin-parity 2^- D_s state ca 37 MeV
above the new 1^-, corresponding to chiral partner of D_{s2}.
","[{""version"":""v1"",""created"":""Thu, 22 Jul 2004 20:29:49 GMT""}]","2009-11-10"
"hep-ph/0407273","Maxime Imbeault","Maxime Imbeault","CP Violation in B -> pi K Decays","8 pages, no figure, plain latex, To be published in the proceedings
  of MRST 2004: From Quarks to Cosmology, Concordia University, Montreal, May
  2004, references added","Int.J.Mod.Phys.A19:5485-5492,2004","10.1142/S0217751X04022736","UdeM-GPP-TH-04-124","hep-ph",,"  I briefly review CP violation in the B system, concentrating on B -> pi K
decays. I discuss how to deal with electroweak-penguin contributions to these
decays using flavour SU(3). With these, I show that the entire unitarity
triangle can be extracted from measurements of B -> pi K decays. Finally, I
examine the signals for new physics in these decays and the possibilities for
measuring them.
","[{""version"":""v1"",""created"":""Fri, 23 Jul 2004 00:41:50 GMT""},{""version"":""v2"",""created"":""Mon, 26 Jul 2004 14:49:24 GMT""},{""version"":""v3"",""created"":""Fri, 30 Jul 2004 17:35:15 GMT""}]","2014-11-17"
"hep-ph/0407274","Deog Ki Hong","Deog Ki Hong and Chaejun Song (Pusan National University)","Light Scalar Decay in Diquark Chiral Effective Theory","9pages, 4figures, RevTeX 4",,"10.1142/S0217751X12500510","PNUTP-04/A07","hep-ph nucl-th",,"  We calculate the decay rate of light scalar mesons, using a diquark chiral
effective theory, recently proposed to describe exotic hadrons. In the
effective theory the light scalar mesons are postulated to be bound states of
diquark and anti-diquark. We find our results are in good agreement with
experimental data. The axial couplings of diquarks with pions and kaons are
found to be quite small and the perturbation is reliable. It shows that the
diquark picture captures the correct physics of light scalar mesons.
","[{""version"":""v1"",""created"":""Fri, 23 Jul 2004 07:15:22 GMT""}]","2015-06-25"
"hep-ph/0407275","Krzysztof M. Graczyk","Krzysztof M. Graczyk","Tau polarization in quasielastic charged-current
  neutrino(antineutrino)-nucleus scattering","Accepted for publications in Nucl. Phys. A. 23 pages, 8 figures","Nucl.Phys. A748 (2005) 313-330","10.1016/j.nuclphysa.2004.10.029",,"hep-ph",,"  The quasielastic charged-current (CC) tau neutrino (antineutrino)-nucleus
scattering is considered.
  The dependence of tau polarization on nuclear-structure effects is discussed
in detail.
  The description of the nucleus is based on the Mean-Field Theory (MFT).
  The ground state of nucleus is described using the Relativistic Fermi Gas
model (FG).
  The effective mass is introduced as well as the ring Random Phase
Approximation (RPA) effects are taken into account in the framework of
relativistic meson-nucleon model. The Local Density Approximation (LDA) is used
for the argon nucleus, having in mind possible application to the ICARUS
experiment. The discussion concentrates on the threshold region where the
$\tau^-$ can be unpolarized and the nuclear effects play an important role.
","[{""version"":""v1"",""created"":""Fri, 23 Jul 2004 09:27:10 GMT""},{""version"":""v2"",""created"":""Wed, 3 Nov 2004 13:45:24 GMT""}]","2009-11-10"
"hep-ph/0407276","Elzbieta Nowak","E. Nowak","Nucleon form factors measurements via the radiative return at B-meson
  factories","Presented at DAPHNE 2004: Physics at meson factories, Frascati, 7-11
  June 2004",,,,"hep-ph",,"  The present-day experimental situation concerning nucleon form factors in the
space-like region shows a substantial discrepancy between measurements via the
Rosenbluth method and the recoil polarisation technique.
  More information about nucleon form factors in the time-like region will not
only improve poor experimental knowledge there, but it will also shed light on
the situation in the space-like region. The radiative return method is a
powerful tool to provide that information using data of B- meson factories.
","[{""version"":""v1"",""created"":""Fri, 23 Jul 2004 08:55:52 GMT""}]","2007-05-23"
"hep-ph/0407277","Jaroslaw Nowak","Jan T. Sobczyk, Jaroslaw A. Nowak, Krzysztof M. Graczyk","WroNG -- Wroclaw Neutrino Generator of events for single pion production","6 pages, 13 figures, Presented by J.T. Sobczyk at the 3rd
  International Workshop on Neutrino-Nucleus Interactions in the Few-GeV
  Region, 17-21 March, Gran Sasso(Italy),to appear in the Proceedings",,"10.1016/j.nuclphysbps.2004.11.218",,"hep-ph",,"  We constructed a new Monte Carlo generator of events for neutrino CC single
pion production on free nucleon targets. The code uses dynamical models of the
DIS with the PDFs modified according to the recent JLab data and of the Delta
excitation. A comparison with experimental data was done in three channels for
the total cross sections and for the distributions of events in invariant
hadronic mass.
","[{""version"":""v1"",""created"":""Fri, 23 Jul 2004 09:28:12 GMT""}]","2009-11-10"
"hep-ph/0407278","Yong Zhou","Yong Zhou, Cai-Dian L\""u","Singularities of Feynman amplitude and cutting rules",,,,,"hep-ph",,"  The contents of this manuscript has been moved to hep-ph/0412204.
","[{""version"":""v1"",""created"":""Fri, 23 Jul 2004 10:02:50 GMT""},{""version"":""v2"",""created"":""Wed, 11 Aug 2004 14:28:18 GMT""},{""version"":""v3"",""created"":""Thu, 19 Aug 2004 09:08:57 GMT""},{""version"":""v4"",""created"":""Fri, 17 Dec 2004 02:22:30 GMT""}]","2007-05-23"
"hep-ph/0407279","Kresimir Kumericki","J. O. Eeg, K. Kumericki, I. Picek","On the Singlet Penguin in B --> K eta' decay","5 pages, 3 figures, to appear in Proceedings of 9th Adriatic Meeting","SpringerProc.Phys.98:465-468,2005","10.1007/3-540-26798-0_46",,"hep-ph",,"  New contributions to the short-distance b --> s eta' transition are
considered. They correspond to the quark and gluon content of eta'. Although
substantially larger than the referent QCD anomaly tail, they still cannot
account for the observed eta' enhancement.
","[{""version"":""v1"",""created"":""Fri, 23 Jul 2004 11:01:32 GMT""}]","2015-06-25"
"hep-ph/0407280","Peter Kroll","P. Kroll (Wuppertal University)","Generalized parton distributions and wide-angle exclusive scattering","5 pages, 4 figures using LATEX with npb.sty",,"10.1016/j.nuclphysbps.2004.09.045","W-UB 04-07","hep-ph",,"  The handbag mechanism for wide-angle exlusive scattering reactions is
discussed and compared with other theoretical approaches. Its application to
Compton scattering, meson photoproduction and two-photon annihilations into
pairs of hadrons is reviewed.
","[{""version"":""v1"",""created"":""Fri, 23 Jul 2004 11:28:28 GMT""}]","2009-11-10"
"hep-ph/0407281","Eef van Beveren","Eef van Beveren and George Rupp","Multichannel calculation for Ds* vector states and the Ds(2632)
  resonance","11 pages, 6 figures; v2: Significant improvements for threshold
  behavior, and for the hadronic widths by including additional two-meson
  channels. Misprints in formulas corrected","Phys.Rev.Lett.93:202001,2004","10.1103/PhysRevLett.93.202001",,"hep-ph",,"  We study bound states below threshold and resonances above threshold in the
D0-K+ and Ds-eta systems, using a many-coupled-channel model for non-exotic
meson-meson scattering applied to states with the quantum numbers of c-sbar
quark-antiquark vector mesons. We fit the ground state at 2.112 GeV, whence the
lowest resonances in D0-K+ come out at 2.61, 2.72, 3.03, and 3.08 GeV. The
resonance at 2.61 GeV acquires a width of about 8 MeV, while its partial P-wave
cross section is up to six times larger in Ds-eta than in D0-K+, provided a
mechanism accounting for Okubo-Zweig-Iizuka--forbidden decays is included. The
latter finding is in agreement with the observations of the SELEX collaboration
with respect to the recently reported DsJ(2632) resonance. Therefore, we
conclude that the DsJ(2632) is most probably the first recurrence excitation of
the Ds*(2112) meson.
","[{""version"":""v1"",""created"":""Fri, 23 Jul 2004 11:46:04 GMT""},{""version"":""v2"",""created"":""Wed, 4 Aug 2004 09:26:18 GMT""}]","2008-11-26"
