"cond-mat/0407613","Hiroya Sakurai","H. Sakurai, S. Takenouchi, N. Tsujii, and E. Takayama-Muromachi","Synthesis, Characterization, and Magnetic Properties of gamma-NaxCoO2
  (0.70 < x <0.84)","4 pages (2 figures included) and 2 extra figures (gif), to be
  published in J. Phys. Soc. Jpn. 73 (8) with possible minor revisions",,"10.1143/JPSJ.73.2081",,"cond-mat.mtrl-sci cond-mat.str-el",,"  Powder Na$_{x}$CoO$_{2}$ ($0.70\leq x\leq 0.84$) samples were synthesized and
characterized carefully by X-ray diffraction analysis, inductive-coupled plasma
atomic emission spectroscopy, and redox titration. It was proved that
$\gamma$-Na$_{x}$CoO$_{2}$ is formed only in the narrow range of $0.70\leq
x\leq 0.78$. Nevertheless, the magnetic properties depend strongly on $x$. We
found, for the first time, two characteristic features in the magnetic
susceptibility of Na$_{0.78}$CoO$_{2}$, a sharp peak at $T_{p}=16$ K and an
anomaly at $T_{k}=9$ K, as well as the transition at $T_{c}=22$ K and the broad
maximum at $T_{m}=50$ K which had already been reported. A type of weak
ferromagnetic transition seems to occur at $T_{k}$. The transition at $T_{c}$,
which is believed to be caused by spin density wave formation, was observed
clearly for $x\geq 0.74$ with constant $T_{c}$ and $T_{p}$ independent of $x$.
On the other hand, ferromagnetic moment varies systematically depending on $x$.
These facts suggest the occurrence of a phase separation at the microscopic
level, such as the separation into Na-rich and Na-poor domains due to the
segregation of Na ions. The magnetic phase diagram and transition mechanism
proposed previously should be reconsidered.
","[{""version"":""v1"",""created"":""Fri, 23 Jul 2004 07:22:18 GMT""}]","2009-11-10"
"cond-mat/0407614","Hiroya Sakurai","H. Sakurai, N. Tsujii, and E. Takayama-Muromachi","Thermal and Electrical Properties of gamma-NaxCoO2 (0.70 < x < 0.78)","4 pages (3 figures included) and an extra figure (gif), to be
  published in J. Phys. Soc. Jpn. 73 (9) with possible minor revisions",,"10.1143/JPSJ.73.2393",,"cond-mat.mtrl-sci cond-mat.str-el",,"  We have performed specific heat and electric resistivity measurements of
Na$_{x}$CoO$_{2}$ ($x=0.70$-0.78). Two anomalies have been observed in the
specific heat data for $x=0.78$, corresponding to magnetic transitions at
$T_{c}=22$ K and $T_{k}\simeq 9$ K reported previously. In the electrical
resistivity, a steep decrease at $T_{c}$ and a bending-like variation at
$T_{b}$(=120K for $x=0.78$) have been observed. Moreover, we have investigated
the $x$-dependence of these parameters in detail. The physical properties of
this system are very sensitive to $x$, and the inconsistent results of previous
reports can be explained by a small difference in $x$. Furthermore, for a
higher $x$ value, a phase separation into Na-rich and Na-poor domains occurs as
we previously proposed, while for a lower $x$ value, from characteristic
behaviors of the specific heat and the electrical resistivity at the
low-temperature region, the system is expected to be in the vicinity of the
magnetic instability which virtually exists below $x=0.70$.
","[{""version"":""v1"",""created"":""Fri, 23 Jul 2004 07:32:00 GMT""}]","2009-11-10"
"cond-mat/0407615","Vaclav Janis","V. Janis and L. Zdeborova","Replica trick with real replicas: A way to build in thermodynamic
  homogeneity","6 pages, presented at SPDSA2004 Hayama (Japan), to appear in Progr.
  Theor. Phys","Progr. Theor. Phys. Suppl. 157, 99 (2005)","10.1143/PTPS.157.99",,"cond-mat.dis-nn cond-mat.stat-mech",,"  We use real replicas to investigate stability of thermodynamic homogeneity of
the free energy of the Sherrington-Kirkpatrick (SK) model of spin glasses.
Within the replica trick with the replica symmetric ansatz we show that the
averaged free energy at low temperatures is not thermodynamically homogeneous.
The demand of minimization of the inhomogeneity of thermodynamic potentials
leads in a natural way to the hierarchical solution of the Parisi type.
Conditions for the global thermodynamic homogeneity are derived and evaluated
for the SK and $p$-spin infinite range models.
","[{""version"":""v1"",""created"":""Fri, 23 Jul 2004 07:42:41 GMT""}]","2009-11-10"
"cond-mat/0407616","Hal Tasaki","Hal Tasaki","Low-lying excitations in one-dimensional lattice electron systems","4 pages, no figures. v2: changed the title and added introductory
  part",,,,"cond-mat.str-el",,"  We consider a general one-dimensional tight-binding electron model which has
a period $P$. For any filling factor $\nu$ such that $P\nu$ is non-integral, we
prove that the model in the infinite volume limit has either a symmetry
breaking or a unique ground state with gapless excitations. The proof is based
on the idea of Yamanaka, Oshikawa and Affleck (cond-mat/9701141), who extended
the Lieb-Schultz-Mattis argument to electron systems.
","[{""version"":""v1"",""created"":""Fri, 23 Jul 2004 07:43:28 GMT""},{""version"":""v2"",""created"":""Sat, 21 Aug 2004 15:09:08 GMT""}]","2016-08-31"
"cond-mat/0407617","Christoph Weiss","Dave Boers, Christoph Weiss, Martin Holthaus","Bogoliubov speed of sound for a dilute Bose-Einstein condensate in a 3d
  optical lattice","6 pages, 2 figures, accepted for publication in Europhys. Lett.
  http://www.epletters.ch/","Europhys. Lett. 67, 887 (2004)","10.1209/epl/i2004-10140-7",,"cond-mat.soft",,"  We point out that the velocity of propagation of sound wavepackets in a
Bose-Einstein condensate filling a three-dimensional cubic optical lattice
undergoes a maximum with increasing lattice depth. For a realistic choice of
parameters, the maximum sound velocity in a lattice condensate can exceed the
sound velocity in a homogeneous condensate with the same average density by
30%. The maximum falls into the superfluid regime, and should be observable
under currently achievable laboratory conditions.
","[{""version"":""v1"",""created"":""Fri, 23 Jul 2004 10:10:10 GMT""}]","2007-05-23"
"cond-mat/0407618","Vaclav Janis","V. Janis and J. Kolorenc","Absence of the diffusion pole in the Anderson insulator","REVTeX4, 4 pages, no figures",,,,"cond-mat.dis-nn cond-mat.str-el",,"  We discuss conditions for the existence of the diffusion pole and its
consequences in disordered noninteracting electron systems. Using only
nonperturbative and exact arguments we find against expectations that the
diffusion pole can exist only in the diffusive (metallic) regime. We
demonstrate that the diffusion pole in the Anderson localization phase would
lead to nonexistence of the self-energy and hence to a physically inconsistent
picture. The way how to consistently treat and understand the Anderson
localization transition with vanishing of the diffusion pole is presented.
","[{""version"":""v1"",""created"":""Fri, 23 Jul 2004 09:03:02 GMT""}]","2007-05-23"
"cond-mat/0407620","Yair Srebro","Yair Srebro and Dov Levine","An exactly solvable model for driven dissipative systems","Some further clarifications. No changes in results or conclusions","Phys. Rev. Lett. 93, 240601 (2004)","10.1103/PhysRevLett.93.240601",,"cond-mat.stat-mech",,"  We introduce a solvable stochastic model inspired by granular gases for
driven dissipative systems. We characterize far from equilibrium steady states
of such systems through the non-Boltzmann energy distribution and compare
different measures of effective temperatures. As an example we demonstrate that
fluctuation-dissipation relations hold, however with an effective temperature
differing from the effective temperature defined from the average energy.
","[{""version"":""v1"",""created"":""Fri, 23 Jul 2004 09:28:43 GMT""},{""version"":""v2"",""created"":""Tue, 10 Aug 2004 15:00:04 GMT""},{""version"":""v3"",""created"":""Fri, 20 Aug 2004 18:01:06 GMT""},{""version"":""v4"",""created"":""Wed, 8 Dec 2004 12:01:59 GMT""}]","2007-05-23"
"cond-mat/0407621","Muntsa Guilleumas Dr.","D. M. Jezek, M. Barranco, M. Guilleumas, D. M. Jezek, M. Barranco, M.
  Guilleumas, R. Mayol, and M. Pi","K-Rb Fermi-Bose mixtures: vortical states and sag","Submitted to Phys. Rev. A (on May 2004), 15 pages with 3 figures",,"10.1103/PhysRevA.70.043630",,"cond-mat.soft",,"  We study a confined mixture of bosons and fermions in the quantal degeneracy
regime with attractive boson-fermion interaction. We discuss the effect that
the presence of vortical states and the displacement of the trapping potentials
may have on mixtures near collapse, and investigate the phase stability diagram
of the K-Rb mixture in the mean field approximation supposing in one case that
the trapping potentials felt by bosons and fermions are shifted from each
other, as it happens in the presence of a gravitational sag, and in another
case, assuming that the Bose condensate sustains a vortex state. In both cases,
we have obtained an analytical expression for the fermion effective potential
when the Bose condensate is in the Thomas-Fermi regime, that can be used to
determine the maxima of the fermionic density. We have numerically checked that
the values one obtains for the location of these maxima using the analytical
formulas remain valid up to the critical boson and fermion numbers, above which
the mixture collapses.
","[{""version"":""v1"",""created"":""Fri, 23 Jul 2004 09:30:55 GMT""}]","2009-11-10"
"cond-mat/0407622","Danuta Makowiec","Danuta Makowiec","Cellular automata with majority rule on evolving network","10 pages, 3 figures, ACRI2004 conference paper",,,,"cond-mat.stat-mech cond-mat.dis-nn",,"  The cellular automata discrete dynamical system is considered as the
two-stage process: the majority rule for the change in the automata state and
the rule for the change in topological relations between automata. The
influence of changing topology to the cooperative phenomena, namely
zero-temperature ferromagnetic phase transition, is observed.
","[{""version"":""v1"",""created"":""Fri, 23 Jul 2004 09:38:48 GMT""}]","2007-05-23"
"cond-mat/0407623","Docteur Marc Mezard","O. C. Martin, M. Mezard, O. Rivoire","A frozen glass phase in the multi-index matching problem",,"Physical Review Letters 93 (2004) 217205","10.1103/PhysRevLett.93.217205",,"cond-mat.dis-nn",,"  The multi-index matching is an NP-hard combinatorial optimization problem;
for two indices it reduces to the well understood bipartite matching problem
that belongs to the polynomial complexity class. We use the cavity method to
solve the thermodynamics of the multi-index system with random costs. The phase
diagram is much richer than for the case of the bipartite matching problem: it
shows a finite temperature phase transition to a completely frozen glass phase,
similar to what happens in the random energy model. We derive the critical
temperature, the ground state energy density, and properties of the energy
landscape, and compare the results to numerical studies based on exact analysis
of small systems.
","[{""version"":""v1"",""created"":""Fri, 23 Jul 2004 10:07:38 GMT""}]","2009-11-10"
"cond-mat/0407624","Domenico Giuliano","Domenico Giuliano, Arturo Tagliacozzo","Hamiltonian theory of the strongly-coupled limit of the Kondo problem in
  the overscreened case","22 pages, 1 figure",,"10.1088/0953-8984/16/34/008",,"cond-mat.mes-hall",,"  By properly generalizing Nozie`res' Fermi liquid theory, we construct an
Hamiltonian approach to the scattering of conduction electrons off a spin-1/2
impurity in the ovescreneed Kondo regime, as T -> 0. We derive the S-matrix at
the interacting fixed point, and the corresponding phase shifts, together with
leading energy corrections to the unitary limit. We apply our results to obtain
the low-temperature dependence of the 2-channel Kondo conductance, and we
relate it to possible transport experiments in a Quantum Dot
","[{""version"":""v1"",""created"":""Fri, 23 Jul 2004 10:27:20 GMT""}]","2009-11-10"
"cond-mat/0407625","S. A. Prosandeev","S.A.Prosandeev, U.Waghmare, I.Levin, J.Maslar","First-order Raman spectra of double perovskites AB$'{1/2}B$''{1/2}O3","4 figures, submitted",,"10.1103/PhysRevB.71.214307",,"cond-mat.mtrl-sci cond-mat.dis-nn",,"  First principles computations of Raman intensities were performed for
perovskite-family compound CaAl$_{1/2}$Nb$_{1/2}$O$_3$ (CAN). This compound
features 1:1 (NaCl-type) ordering of Al and Nb superimposed onto the $b^-b^-c+$
octahedral tilting. Raman tensor for CAN was computed using the package for
first-principles computations ABINIT (URL \underline {http://www.abinit.org}).
Computations performed for both untilted cubic ($Fm\bar{3}m$) and tilted
monoclinic ($P2_1/n$) CAN structures showed that the strongest Raman lines are
associated with the ordering of Al and Nb. The computed spectrum agreed
qualitatively with the experimental data measured on powder (CAN is available
in polycrystalline form only). The effect of cation disorder on the Raman
intensities was considered using phenomenological theory of light scattering in
the vicinity of a phase transition. We suggest that, for certain modes, the
corresponding Raman intensities depend primarily on the average long range
order while, for other modes, the intensities are determined by fluctuations of
the order parameter.
","[{""version"":""v1"",""created"":""Fri, 23 Jul 2004 11:59:24 GMT""}]","2009-11-10"
"cond-mat/0407626","Doctorant Francois Ghoulmie","Francois Ghoulmie (LPS, CMAP)","Heterogeneity and feedback in an agent-based market model","This paper has been withdrawn",,"10.1088/0953-8984/17/14/015",,"cond-mat.other",,"  This paper has been withdrawn by the author: it was a too preliminary
version.
","[{""version"":""v1"",""created"":""Fri, 23 Jul 2004 12:07:34 GMT""},{""version"":""v2"",""created"":""Sun, 29 Aug 2004 05:42:17 GMT""},{""version"":""v3"",""created"":""Wed, 1 Dec 2004 15:05:41 GMT""}]","2009-11-10"
"cond-mat/0407627","Krzysztof Goral","Krzysztof Goral, Thorsten Koehler, Keith Burnett","Ramsey interferometry with atoms and molecules: two-body versus
  many-body phenomena","22 pages, 12 eps figures; final version","Phys. Rev. A 71, 023603 (2005)","10.1103/PhysRevA.71.023603",,"cond-mat.other physics.atom-ph quant-ph",,"  We discuss the frequency and visibility of atom-molecule Ramsey fringes
observed in recent experiments by Claussen et al.[Phys. Rev. A 67, 060701
(2003)]. In these experiments a 85Rb Bose-Einstein condensate was exposed to a
sequence of magnetic field pulses on the high field side of the 155 G Feshbach
resonance. The observed oscillation frequencies largely agree with the
theoretically predicted magnetic field dependence of the binding energy of the
highest excited diatomic vibrational state, except for a small region very
close to the singularity of the scattering length. Our analytic treatment of
the experiment, as well as our dynamical simulations, follow the magnitude of
the measured oscillation frequencies as well as the visibilities of the Ramsey
fringes. We show that significant deviations from a purely binary dynamics,
with an associated binding frequency, occur when the spatial extent of the
molecular wave function becomes comparable with the mean distance between the
atoms in the dilute gas. The experiments thus clearly identify the conditions
under which diatomic molecules may be identified as a separate entity of the
gas or, conversely, when the concept of binary physics in a many-body
environment is bound to break down.
","[{""version"":""v1"",""created"":""Fri, 23 Jul 2004 13:08:32 GMT""},{""version"":""v2"",""created"":""Thu, 10 Feb 2005 10:29:29 GMT""}]","2007-05-23"
"cond-mat/0407628","Andr\'e Thiaville","A. Thiaville, Y. Nakatani, J. Miltat and Y Suzuki","Micromagnetic understanding of current-driven domain wall motion in
  patterned nanowires","5 pages, 3 figures, submitted to Europhys. Lett, revised version","Europhys. Lett. 69, 990 (2005)","10.1209/epl/i2004-10452-6",,"cond-mat.mtrl-sci",,"  In order to explain recent experiments reporting a motion of magnetic domain
walls (DW) in nanowires carrying a current, we propose a modification of the
spin transfer torque term in the Landau-Lifchitz-Gilbert equation. We show that
it explains, with reasonable parameters, the measured DW velocities as well as
the variation of DW propagation field under current. We also introduce
coercivity by considering rough wires. This leads to a finite DW propagation
field and finite threshold current for DW propagation, hence we conclude that
threshold currents are extrinsic. Some possible models that support this new
term are discussed.
","[{""version"":""v1"",""created"":""Fri, 23 Jul 2004 13:31:17 GMT""},{""version"":""v2"",""created"":""Wed, 26 Jan 2005 11:16:51 GMT""}]","2015-06-24"
"cond-mat/0407629","Doctorant Francois Ghoulmie","Francois Ghoulmie (LPS, CMAP)","Evolution of heterogeneity in an agent-based market model","This paper has been withdrawn",,,,"cond-mat.other",,"  This paper has been withdrawn by the author: it was a too preliminary
version.
","[{""version"":""v1"",""created"":""Fri, 23 Jul 2004 14:33:46 GMT""},{""version"":""v2"",""created"":""Sun, 29 Aug 2004 05:42:41 GMT""},{""version"":""v3"",""created"":""Wed, 1 Dec 2004 15:13:09 GMT""}]","2007-05-23"
"cond-mat/0407630","Gang Cao","G. Cao, X.N. Lin, L. Balicas, S. Chikara, J.E. Crow and P. Schlottmann","Orbitally-driven Behavior: Mott Transition, Quantum Oscillations and
  Colossal Magnetoresistance in Bilayered Ca3Ru2O7","26 pages and 8 figures",,"10.1088/1367-2630/6/1/159",,"cond-mat.str-el",,"  We report recent transport and thermodynamic experiments over a wide range of
temperatures for the Mott-like system Ca3Ru2O7 at high magnetic fields, B, up
to 30 T. This work reveals a rich and highly anisotropic phase diagram, where
applying B along the a-, b-, and c-axis leads to vastly different behavior. A
fully spin-polarized state via a first order metamagnetic transition is
obtained for B||a, and colossal magnetoresistance is seen for B||b, and quantum
oscillations in the resistivity are observed for B||c, respectively. The
interplay of the lattice, orbital and spin degrees of freedom are believed to
give rise to this strongly anisotropic behavior.
","[{""version"":""v1"",""created"":""Fri, 23 Jul 2004 15:00:15 GMT""}]","2009-11-10"
"cond-mat/0407631","Kevin Stratford","K. Stratford, R. Adhikari, I. Pagonabarraga, and J.-C. Desplat","Lattice Boltzmann for Binary Fluids with Suspended Colloids","10 pages, 4 figures, ICMMES 2004",,"10.1007/s10955-005-8411-1",,"cond-mat.soft",,"  A new description of the binary fluid problem via the lattice Boltzmann
method is presented which highlights the use of the moments in constructing two
equilibrium distribution functions. This offers a number of benefits, including
better isotropy, and a more natural route to the inclusion of multiple
relaxation times for the binary fluid problem. In addition, the implementation
of solid colloidal particles suspended in the binary mixture is addressed,
which extends the solid-fluid boundary conditions for mass and momentum to
include a single conserved compositional order parameter. A number of simple
benchmark problems involving a single particle at or near a fluid-fluid
interface are undertaken and show good agreement with available theoretical or
numerical results.
","[{""version"":""v1"",""created"":""Fri, 23 Jul 2004 15:10:57 GMT""},{""version"":""v2"",""created"":""Wed, 1 Jun 2005 17:17:00 GMT""}]","2009-11-10"
"cond-mat/0407632","Janez Bonca","S. El Shawish, J. Bonca, C.D. Batista, and I. sega","Electron Spin Resonance of SrCu2(BO3)2 at High Magnetic Field","4 pages, 4 b&w figures",,"10.1103/PhysRevB.71.014413",,"cond-mat.other cond-mat.stat-mech",,"  We calculate the electron spin resonance (ESR) spectra of the
quasi-two-dimensional dimer spin liquid SrCu2(BO3)2 as a function of magnetic
field B. Using the standard Lanczos method, we solve a Shastry-Sutherland
Hamiltonian with additional Dzyaloshinsky-Moriya (DM) terms which are crucial
to explain different qualitative aspects of the ESR spectra. In particular, a
nearest-neighbor DM interaction with a non-zero D_z component is required to
explain the low frequency ESR lines for B || c. This suggests that crystal
symmetry is lowered at low temperatures due to a structural phase transition.
","[{""version"":""v1"",""created"":""Fri, 23 Jul 2004 15:13:37 GMT""}]","2009-11-10"
"cs/0407055","Marco Pedicini","M. Pedicini, F. Quaglia","PELCR: Parallel Environment for Optimal Lambda-Calculus Reduction",,,,,"cs.LO cs.DC",,"  In this article we present the implementation of an environment supporting
L\'evy's \emph{optimal reduction} for the $\lambda$-calculus \cite{Lev78} on
parallel (or distributed) computing systems. In a similar approach to Lamping's
one in \cite{Lamping90}, we base our work on a graph reduction technique known
as \emph{directed virtual reduction} \cite{DPR97} which is actually a
restriction of Danos-Regnier virtual reduction \cite{DanosRegnier93}.
  The environment, which we refer to as PELCR (Parallel Environment for optimal
Lambda-Calculus Reduction) relies on a strategy for directed virtual reduction,
namely {\em half combustion}, which we introduce in this article. While
developing PELCR we have adopted both a message aggregation technique, allowing
a reduction of the communication overhead, and a fair policy for distributing
dynamically originated load among processors.
  We also present an experimental study demonstrating the ability of PELCR to
definitely exploit parallelism intrinsic to $\lambda$-terms while performing
the reduction. By the results we show how PELCR allows achieving up to 70/80%
of the ideal speedup on last generation multiprocessor computing systems. As a
last note, the software modules have been developed with the {\tt C} language
and using a standard interface for message passing, i.e. MPI, thus making PELCR
itself a highly portable software package.
","[{""version"":""v1"",""created"":""Thu, 22 Jul 2004 17:52:39 GMT""},{""version"":""v2"",""created"":""Fri, 23 Jul 2004 10:53:21 GMT""}]","2007-05-23"
"cs/0407056","John Watrous","Bill Rosgen and John Watrous","On the hardness of distinguishing mixed-state quantum computations","17 pages",,,,"cs.CC quant-ph",,"  This paper considers the following problem. Two mixed-state quantum circuits
Q and R are given, and the goal is to determine which of two possibilities
holds: (i) Q and R act nearly identically on all possible quantum state inputs,
or (ii) there exists some input state that Q and R transform into almost
perfectly distinguishable outputs. This problem may be viewed as an abstraction
of the following problem: given two physical processes described by sequences
of local interactions, are the processes effectively the same or are they
different? We prove that this problem is a complete promise problem for the
class QIP of problems having quantum interactive proof systems, and is
therefore PSPACE-hard. This is in sharp contrast to the fact that the analogous
problem for classical (probabilistic) circuits is in AM, and for unitary
quantum circuits is in QMA.
","[{""version"":""v1"",""created"":""Thu, 22 Jul 2004 20:45:17 GMT""}]","2007-05-23"
"cs/0407057","Marcus Hutter","Marcus Hutter and Andrej Muchnik","Universal Convergence of Semimeasures on Individual Random Sequences","16 pages","Proc. 15th International Conf. on Algorithmic Learning Theory
  (ALT-2004), pages 234-248",,"IDSIA-14-04","cs.LG cs.AI cs.CC cs.IT math.IT math.PR",,"  Solomonoff's central result on induction is that the posterior of a universal
semimeasure M converges rapidly and with probability 1 to the true sequence
generating posterior mu, if the latter is computable. Hence, M is eligible as a
universal sequence predictor in case of unknown mu. Despite some nearby results
and proofs in the literature, the stronger result of convergence for all
(Martin-Loef) random sequences remained open. Such a convergence result would
be particularly interesting and natural, since randomness can be defined in
terms of M itself. We show that there are universal semimeasures M which do not
converge for all random sequences, i.e. we give a partial negative answer to
the open problem. We also provide a positive answer for some non-universal
semimeasures. We define the incomputable measure D as a mixture over all
computable measures and the enumerable semimeasure W as a mixture over all
enumerable nearly-measures. We show that W converges to D and D to mu on all
random sequences. The Hellinger distance measuring closeness of two
distributions plays a central role.
","[{""version"":""v1"",""created"":""Fri, 23 Jul 2004 12:43:28 GMT""}]","2007-07-16"
