"math/0412144","Zhenghan Wang","J. Michael Dunn, Tobias J. Hagge, Lawrence S. Moss, and Zhenghan Wang","Quantum logic as motivated by quantum computing","To appear in JSL",,,,"math.LO",,"  We explore a connection between quantum logic and quantum computing.
","[{""version"":""v1"",""created"":""Tue, 7 Dec 2004 17:44:44 GMT""}]","2007-05-23"
"math/0412145","Vladlen Timorin","Francesca Aicardi and Vladlen Timorin","On binary quadratic forms with semigroup property","v3: minor changes, referenced added; 28 pages, 1 figure",,,,"math.NT",,"  A quadratic form f is said to have semigroup property if its values at points
of the integer lattice form a semigroup under multiplication. A problem of V.
Arnold is to describe all binary integer quadratic forms with semigroup
property. If there is an integer bilinear map s such that f(s(x,y))=f(x)f(y)
for all vectors x and y from the integer 2-dimensional lattice, then the form f
has semigroup property. We give an explicit description of all pairs (f,s) with
the property stated above. We do not know any other examples of forms with
semigroup property.
","[{""version"":""v1"",""created"":""Tue, 7 Dec 2004 17:44:55 GMT""},{""version"":""v2"",""created"":""Tue, 21 Dec 2004 01:40:17 GMT""},{""version"":""v3"",""created"":""Fri, 18 Nov 2005 23:45:37 GMT""}]","2007-05-23"
"math/0412146","Gerassimos Barbatis","G. Barbatis, A. Tertikas","On a class of Rellich inequalities","15 pages. To appear in J. Comput. Appl. Math",,,,"math.AP math.SP",,"  We prove Rellich and improved Rellich inequalities that involve the distance
function from a hypersurface of codimension $k$, under a certain geometric
assumption. In case the distance is taken from the boundary, that assumption is
the convexity of the domain. We also discuss the best constant of these
inequalities.
","[{""version"":""v1"",""created"":""Tue, 7 Dec 2004 17:50:37 GMT""}]","2007-05-23"
"math/0412147","Peter Shalen","Ben Klaff, Peter B Shalen","The diameter of the set of boundary slopes of a knot","This is the version published by Algebraic & Geometric Topology on 29
  August 2006","Algebr. Geom. Topol. 6 (2006) 1095-1112","10.2140/agt.2006.6.1095",,"math.GT","http://arxiv.org/licenses/nonexclusive-distrib/1.0/","  Let K be a tame knot with irreducible exterior M(K) in a closed, connected,
orientable 3--manifold Sigma such that pi_1(Sigma) is cyclic. If infinity is
not a strict boundary slope, then the diameter of the set of strict boundary
slopes of K, denoted d_K, is a numerical invariant of K. We show that either
(i) d_K >= 2 or (ii) K is a generalized iterated torus knot. The proof combines
results from Culler and Shalen [Comment. Math. Helv. 74 (1999) 530-547] with a
result about the effect of cabling on boundary slopes.
","[{""version"":""v1"",""created"":""Tue, 7 Dec 2004 18:12:05 GMT""},{""version"":""v2"",""created"":""Tue, 21 Apr 2009 11:37:15 GMT""}]","2009-04-21"
"math/0412148","Skip Garibaldi","Skip Garibaldi and Detlev Hoffmann","Totaro's question for G_2, F_4, and E_6","15 pages","Journal of the London Mathematical Society 73 #2 (2006) 325-338","10.1112/S0024610705022489",,"math.AG",,"  In a 2004 paper, Totaro asked whether a G-torsor X that has a zero-cycle of
degree d > 0 will necessarily have a closed etale point of degree dividing d,
where G is a connected algebraic group. This question is closely related to
several conjectures regarding exceptional algebraic groups. Totaro gave a
positive answer to his question in the following cases: G simple, split, and of
type G_2, type F_4, or simply connected of type E_6. We extend the list of
cases where the answer is ""yes"" to all groups of type G_2 and some nonsplit
groups of type F_4 and E_6. No assumption on the characteristic of the base
field is made. The key tool is a lemma regarding linkage of Pfister forms.
","[{""version"":""v1"",""created"":""Tue, 7 Dec 2004 18:26:39 GMT""}]","2009-05-23"
"math/0412149","Kevin Costello","Kevin J. Costello","Topological conformal field theories and Calabi-Yau categories","50 pages, 13 figures. Cosmetic and organisational changes in this
  version. Some references have been added, as has discussion of the non-unital
  case. Results about topology of moduli space now appear in math.GT/0601130.
  Discussion of Deligne-Mumford spaces and the Gromov-Witten potential is
  removed from the introduction of this paper; this now appears in
  math.QA/0509264",,,,"math.QA math.AG",,"  This is the first of two papers which construct a purely algebraic
counterpart to the theory of Gromov-Witten invariants (at all genera). These
Gromov-Witten type invariants depend on a Calabi-Yau A-infinity category, which
plays the role of the target in ordinary Gromov-Witten theory. When we use an
appropriate A-infinity version of the derived category of coherent sheaves on a
Calabi-Yau variety, this constructs the B model at all genera. When the Fukaya
category of a compact symplectic manifold X is used, it is shown, under certain
assumptions, that the usual Gromov-Witten invariants are recovered. The
assumptions are that a good theory of open-closed Gromov-Witten invariants
exists for X, and that the natural map from the Hochschild homology of the
Fukaya category of X to the ordinary homology of X is an isomorphism.
","[{""version"":""v1"",""created"":""Tue, 7 Dec 2004 20:10:25 GMT""},{""version"":""v2"",""created"":""Sun, 12 Dec 2004 17:37:51 GMT""},{""version"":""v3"",""created"":""Mon, 20 Dec 2004 20:39:56 GMT""},{""version"":""v4"",""created"":""Tue, 28 Dec 2004 13:49:02 GMT""},{""version"":""v5"",""created"":""Tue, 1 Feb 2005 19:47:47 GMT""},{""version"":""v6"",""created"":""Tue, 10 Jan 2006 20:21:46 GMT""},{""version"":""v7"",""created"":""Mon, 16 Jan 2006 19:42:22 GMT""}]","2007-05-23"
"math/0412150","Sergey Lysenko","Sergey Lysenko","Geometric Bessel models for GSp_4 and multiplicity one","LaTeX2e, 30 pages, v2: a mistake is corrected",,,,"math.AG math.RT",,"  I this paper, which is a sequel to math.AG/0310361, we study Bessel models of
representations of GSp_4 over a local non archimedian field in the framework of
the geometric Langlands program.
  The Bessel module over the nonramified Hecke algebra of GSp_4 admits a
geometric counterpart, the Bessel category of perverse sheaves on some
ind-algebraic stack. We use it to prove a geometric version of the multiplicity
one for Bessel models. It implies a geometric Casselman-Shalika type formula
for these models. The strategy of the proof is the same as in the paper of
Frenkel, Gaitsgory and Vilonen math.AG/9907133.
  We also propose a geometric framework unifying Whittaker, Waldspurger and
Bessel models.
","[{""version"":""v1"",""created"":""Tue, 7 Dec 2004 19:27:33 GMT""},{""version"":""v2"",""created"":""Fri, 20 May 2005 13:36:19 GMT""}]","2016-09-07"
"math/0412151","Mark A. Stern","Anda Degeratu and Mark Stern","The Positive Mass Conjecture for Non-spin Manifolds","This paper has been withdrawn due to a sign error in proposition 6.5",,,"DUKE-CGTP-04-10","math.DG",,"  We extend Witten's spinor proof of the positive mass theorem to large classes
of complete asymptotically flat non-spin manifolds, including all manifolds of
dimension less than or equal to 11 and all manifolds of dimension less than 26
which admit a codimension 3 immersion in Euclidean space.
","[{""version"":""v1"",""created"":""Tue, 7 Dec 2004 21:34:31 GMT""},{""version"":""v2"",""created"":""Wed, 21 Sep 2005 13:40:56 GMT""}]","2007-05-23"
"math/0412152","Matthieu Willems","Matthieu Willems","K-theorie equivariante des varietes de Bott-Samelson. Application a la
  structure multiplicative de la K-theorie equivariante des varietes de
  drapeaux","38 pages",,,,"math.AG",,"  We construct a basis of the equivariant $K$-theory of Bott towers, and we
describe precisely the multiplicative structure of these algebras. We deduce
similar results for Bott-Samelson varieties. Thanks to the link between flag
varieties and Bott-Samelson varieties, we give a method to compute the
structure constants of the equivariant $K$-theory of flag varieties in the
basis constructed by Kostant and Kumar.
","[{""version"":""v1"",""created"":""Tue, 7 Dec 2004 22:13:05 GMT""}]","2007-05-23"
"math/0412153","Hasan Coskun","Hasan Coskun and Robert A. Gustafson","Well--Poised Macdonald Functions W_lambda and Jackson Coefficients
  omega_lambda On BC_n","29 pages",,,,"math.CO math.QA",,"  The very well--poised elliptic Macdonald functions W_lambda in n independent
variables are defined and their properties are investigated. The W_lambda are
generalized by introducing an extra parameter to the elliptic Jackson
coefficients omega_lambda and their properties are studied. BC_n multivariable
Jackson sums in terms of both W_lambda and omega_lambda functions are proved.
","[{""version"":""v1"",""created"":""Wed, 8 Dec 2004 03:32:28 GMT""}]","2007-05-23"
"math/0412154","Jordan Bell","Leonhard Euler","An analytical exercise","5 pages, seems to be the first translation into English",,,,"math.HO math.CA",,"  This is a translation into English from the original Latin of Leonhard
Euler's Exercitatio analytica, Nova Acta Academiae Scientarum Imperialis
Petropolitinae 8 (1794), 69-72; E664 in the Enestrom index. In it Euler uses
the infinite product identity for sin to prove some properties of the series
for the Riemann zeta function for even n.
","[{""version"":""v1"",""created"":""Wed, 8 Dec 2004 05:19:39 GMT""}]","2007-05-23"
"math/0412155","Nevin Kapur","James Allen Fill, Nevin Kapur, Alois Panholzer","Destruction of very simple trees","20 pages; Version 2 corrects some minor error and fixes a few typos","Algorithmica, 46:3-4 (2006), pp. 345-366","10.1007/s00453-006-0100-1",,"math.PR math.CO",,"  We consider the total cost of cutting down a random rooted tree chosen from a
family of so-called very simple trees (which include ordered trees, $d$-ary
trees, and Cayley trees); these form a subfamily of simply generated trees. At
each stage of the process an edge is chose at random from the tree and cut,
separating the tree into two components. In the one-sided variant of the
process the component not containing the root is discarded, whereas in the
two-sided variant both components are kept. The process ends when no edges
remain for cutting. The cost of cutting an edge from a tree of size $n$ is
assumed to be $n^\alpha$. Using singularity analysis and the method of moments,
we derive the limiting distribution of the total cost accrued in both variants
of this process. A salient feature of the limiting distributions obtained
(after normalizing in a family-specific manner) is that they only depend on
$\alpha$.
","[{""version"":""v1"",""created"":""Wed, 8 Dec 2004 06:54:47 GMT""},{""version"":""v2"",""created"":""Fri, 5 Aug 2005 15:07:11 GMT""}]","2007-05-23"
"math/0412156","Wolfgang Lueck","Wolfgang Lueck","K- and L-theory of the semi-direct product of the discrete 3-dimensional
  Heisenberg group by Z/4","Published by Geometry and Topology at
  http://www.maths.warwick.ac.uk/gt/GTVol9/paper37.abs.html","Geom. Topol. 9 (2005) 1639-1676","10.2140/gt.2005.9.1639",,"math.KT",,"  We compute the group homology, the topological K-theory of the reduced
C^*-algebra, the algebraic K-theory and the algebraic L-theory of the group
ring of the semi-direct product of the three-dimensional discrete Heisenberg
group by Z/4. These computations will follow from the more general treatment of
a certain class of groups G which occur as extensions 1-->K-->G-->Q-->1 of a
torsionfree group K by a group Q which satisfies certain assumptions. The key
ingredients are the Baum-Connes and Farrell-Jones Conjectures and methods from
equivariant algebraic topology.
","[{""version"":""v1"",""created"":""Wed, 8 Dec 2004 07:42:28 GMT""},{""version"":""v2"",""created"":""Sun, 11 Sep 2005 07:07:32 GMT""}]","2014-11-11"
"math/0412157","Frank Swenton","Frank Swenton","Limits and the system of near-numbers","19 pages; in the process of submission",,,,"math.GM",,"  In this paper, we present a comprehensive system for the treatment of the
topic of limits--conceptually, computationally, and formally. The system
addresses fundamental linguistic flaws in the standard presentation of limits,
which attempts to force limit discussion into the language of individual real
numbers and equality. The system of near-numbers properly fit the context of
limits, allowing precise and unambiguous notation in limit computation. More
importantly, the near-numbers are a set of concrete mathematical objects that
provide a scaffold both for building an accurate intuitive understanding of the
limit concept and for connecting that understanding to the formal definition of
the limit.
","[{""version"":""v1"",""created"":""Wed, 8 Dec 2004 09:50:37 GMT""}]","2007-05-23"
"math/0412158","Konstantin Igudesman","Konstantin Igudesman","Dynamics of infinite-multivalued transformations","16 pages, latex",,,,"math.DS",,"  We consider a transformation of a normalized measure space such that the
image of any point is a finite set. We call such transformation
$m$-transformation. In this case the orbit of any point looks like a tree. In
the study of $m$-transformations we are interested in the properties of the
trees.
  An $m$-transformation generates a stochastic kernel and a new measure. Using
these objects, we introduce analogies of some main concept of ergodic theory:
ergodicity, Koopman and Frobenius-Perron operators etc. We prove ergodic
theorems and consider examples. We also indicate possible applications to
fractal geometry and give a generalization of our construction. Some results
which have analogies in the classical ergodic theory we are proved using
standard methods. Other results have no analogies.
","[{""version"":""v1"",""created"":""Wed, 8 Dec 2004 12:46:23 GMT""}]","2007-05-23"
"math/0412159","Frederic Mangolte","Johannes Huisman (LM), Fr\'ed\'eric Mangolte (LM-Savoie)","Every connected sum of lens spaces is a real component of a uniruled
  algebraic variety","Nouvelle version avec deux figures","Annales de l'Institut Fourier 55 (2005) 2475-2487",,,"math.AG",,"  Let M be a connected sum of finitely many lens spaces, and let N be a
connected sum of finitely many copies of S^1xS^2. We show that there is a
uniruled algebraic variety X such that the connected sum M#N of M and N is
diffeomorphic to a connected component of the set of real points X(R) of X. In
particular, any finite connected sum of lens spaces is diffeomorphic to a real
component of a uniruled algebraic variety.
","[{""version"":""v1"",""created"":""Wed, 8 Dec 2004 13:13:09 GMT""},{""version"":""v2"",""created"":""Fri, 18 Mar 2005 17:29:42 GMT""}]","2009-03-31"
"math/0412160","Pierre Germain","Pierre Germain (CMLS Ecole Polytechnique)","Existence globale de solutions d'energie infinie de l'equation de
  Navier-Stokes 2D",,,,,"math.AP",,"  We study in this article the solutions of the Navier-Stokes equations, with
initial data in the closure of the Schwartz class in BMO-1. For such intial
data, we obtain the existence and uniqueness of a global solution, and an
estimate on its norm in BMO-1.
","[{""version"":""v1"",""created"":""Wed, 8 Dec 2004 13:14:41 GMT""}]","2007-05-23"
"math/0412161","Dmitry Kalyuzhny\u{i}-Verbovetzki\u{i}","Dmitry S. Kalyuzhny\u{\i}-Verbovetzki\u{\i}","Carath\'{e}odory interpolation on the non-commutative polydisk","to appear in J. Funct. Anal",,,,"math.FA",,"  The Carath\'{e}odory problem in the $N$-variable non-commutative
Herglotz--Agler class and the Carath\'{e}odory--Fej\'{e}r problem in the
$N$-variable non-commutative Schur--Agler class are posed. It is shown that the
Carath\'{e}odory (resp., Carath\'{e}odory--Fej\'{e}r) problem has a solution if
and only if the non-commutative polynomial with given operator coefficients
(the data of the problem indexed by an admissible set $\Lambda$) takes operator
values with positive semidefinite real part (resp., contractive operator
values) on $N$-tuples of $\Lambda$-jointly nilpotent contractive $n\times n$
matrices, for all $n\in\mathbb{N}$.
","[{""version"":""v1"",""created"":""Wed, 8 Dec 2004 14:24:53 GMT""},{""version"":""v2"",""created"":""Thu, 17 Mar 2005 13:08:16 GMT""}]","2007-05-23"
"math/0412162","Romain Dujardin","Romain Dujardin","Some remarks on the connectivity of Julia sets for 2-dimensional
  diffeomorphisms",,,,,"math.DS math.CV",,"  We explore the connected/disconnected dichotomy for the Julia set of
polynomial automorphisms of C^2. We develop several aspects of the question,
which was first studied by Bedford-Smillie. We introduce a new sufficient
condition for the connectivity of the Julia set, that carries over for certain
H{\'e}non-like and birational maps. We study the structure of disconnected
Julia sets and the associated invariant currents. This provides a simple
approach to some results of Bedford-Smillie, as well as some new corollaries
--the connectedness locus is closed, construction of external rays in the
general case, etc.
  We also prove the following theorem: a hyperbolic polynomial diffeomorphism
of C^2 with connected Julia set must have attracting or repelling orbits. This
is an analogue of a well known result in one dimensional dynamics.
","[{""version"":""v1"",""created"":""Wed, 8 Dec 2004 14:37:24 GMT""}]","2007-05-23"
"math/0412163","Dmitry Kalyuzhny\u{i}-Verbovetzki\u{i}","Dmitry S. Kalyuzhny\u{\i}-Verbovetzki\u{\i}","Multivariable $\rho$-contractions",,,,,"math.FA",,"  We suggest a new version of the notion of $\rho$-dilation ($\rho>0$) of an
$N$-tuple $\mathbf{A}=(A_1,...,A_N)$ of bounded linear operators on a common
Hilbert space. We say that $\mathbf{A}$ belongs to the class $C_{\rho,N}$ if
$\mathbf{A}$ admits a $\rho$-dilation
$\widetilde{\mathbf{A}}=(\widetilde{A}_1,...,\widetilde{A}_N)$ for which
$\zeta\widetilde{\mathbf{A}}:=\zeta_1\widetilde{A}_1+...
+\zeta_N\widetilde{A}_N$ is a unitary operator for each
$\zeta:=(\zeta_1,...,\zeta_N)$ in the unit torus $\mathbb{T}^N$. For N=1 this
class coincides with the class $C_\rho$ of B. Sz.-Nagy and C. Foia\c{s}. We
generalize the known descriptions of $C_{\rho,1}=C_\rho$ to the case of
$C_{\rho,N}, N>1$, using so-called Agler kernels. Also, the notion of operator
radii $w_\rho, \rho>0$, is generalized to the case of $N$-tuples of operators,
and to the case of bounded (in a certain strong sense) holomorphic
operator-valued functions in the open unit polydisk $\mathbb{D}^N$, with
preservation of all the most important their properties. Finally, we show that
for each $\rho>1$ and $N>1$ there exists an $\mathbf{A}=(A_1,...,A_N)\in
C_{\rho,N}$ which is not simultaneously similar to any
$\mathbf{T}=(T_1,...,T_N)\in C_{1,N}$, however if $\mathbf{A}\in C_{\rho,N}$
admits a uniform unitary $\rho$-dilation then $\mathbf{A}$ is simultaneously
similar to some $\mathbf{T}\in C_{1,N}$.
","[{""version"":""v1"",""created"":""Wed, 8 Dec 2004 14:52:30 GMT""}]","2007-05-23"
"math/0412164","Dmitry Kalyuzhny\u{i}-Verbovetzki\u{i}","Dmitry S. Kalyuzhny\u{\i}-Verbovetzki\u{\i}","On the {Bessmertny\u{\i}} Class of Homogeneous Positive Holomorphic
  Functions on a Product of Matrix Halfplanes",,,,,"math.FA",,"  We generalize our earlier results from \cite{K} on the Bessmertny\u{\i} class
of operator-valued functions holomorphic in the open right poly-halfplane which
admit representation as a Schur complement of a block of a linear homogeneous
operator-valued function with positive semidefinite operator coefficients, to
the case of a product of open right matrix halfplanes. Several equivalent
characterizations of this generalized Bessmertny\u{\i} class are presented. In
particular, its intimate connection with the Agler--Schur class of holomorphic
contractive operator-valued functions on the product of matrix unit disks is
established.
","[{""version"":""v1"",""created"":""Wed, 8 Dec 2004 15:03:43 GMT""}]","2007-05-23"
"math/0412165","Dmitry Kalyuzhny\u{i}-Verbovetzki\u{i}","Dmitry S. Kalyuzhny\u{\i}-Verbovetzki\u{\i} and Victor Vinnikov","Non-commutative positive kernels and their matrix evaluations",,,,,"math.FA",,"  We show that a formal power series in $2N$ non-commuting indeterminates is a
positive non-commutative kernel if and only if the kernel on $N$-tuples of
matrices of any size obtained from this series by matrix substitution is
positive. We present two versions of this result related to different classes
of matrix substitutions. In the general case we consider substitutions of
jointly nilpotent $N$-tuples of matrices, and thus the question of convergence
does not arise. In the ``convergent'' case we consider substitutions of
$N$-tuples of matrices from a neighborhood of zero where the series converges.
Moreover, in the first case the result can be improved: the positivity of a
non-commutative kernel is guaranteed by the positivity of its values on the
diagonal, i.e., on pairs of coinciding jointly nilpotent $N$-tuples of
matrices. In particular this yields an analogue of a recent result of Helton on
non-commutative sums-of-squares representations for the class of hereditary
non-commutative polynomials. We show by an example that the improved
formulation does not apply in the ``convergent'' case.
","[{""version"":""v1"",""created"":""Wed, 8 Dec 2004 15:49:16 GMT""}]","2007-05-23"
"nucl-ex/0412011","Aihong Tang","A.H. Tang (for the STAR Collaboration)","Strangelet search at RHIC","Strange Quark Matter 2004 conference proceeding","J.Phys.G31:S1187-S1190,2005","10.1088/0954-3899/31/6/084",,"nucl-ex",,"  Two position sensitive Shower Maximum Detector (SMDs) for Zero-Degree
Calorimeters (ZDCs) were installed by STAR before run 2004 at both upstream and
downstream from the interaction point along the beam axis where particles with
small rigidity are swept away by strong magnetic field. The ZDC-SMDs provides
information about neutral energy deposition as a function of transverse
position in ZDCs. We report the preliminary results of strangelet search from a
triggered data-set sampling 100 million Au+Au collisions at top RHIC energy.
","[{""version"":""v1"",""created"":""Tue, 7 Dec 2004 19:36:05 GMT""}]","2019-08-14"
"nucl-ex/0412012","Joanna Kiryluk","J. Kiryluk (for the STAR Collaboration)","Spin Physics with STAR at RHIC","Prepared for the 32nd International Conference on High Energy Physics
  (ICHEP'04), 6 pages, 4 figures",,"10.1142/9789812702227_0104",,"nucl-ex",,"  STAR collected data in proton-proton collisions at sqrt(s)=200 GeV with
transverse and longitudinal beam polarizations during the initial running
periods in 2002--2004 at the Relativistic Heavy Ion Collider at Brookhaven
National Laboratory. Results on the single transverse spin asymmetries in the
production of high energy forward neutral pions and of forward charged hadrons
will be presented. Data have been obtained for double longitudinal asymmetries
in inclusive jet production in 2003 and 2004. These data provide sensitivity to
the polarization of gluons in the proton. In the future, we aim to determine
the gluon polarization over a wide kinematic range using coincidences of direct
photons and jets. Furthermore, we aim to determine the polarizations of the u,
bar(u), d and bar(d) quarks in the proton by measuring single longitudinal spin
asymmetries in the production of weak bosons at sqrt(s) = 500$ GeV.
","[{""version"":""v1"",""created"":""Wed, 8 Dec 2004 00:49:07 GMT""}]","2019-08-14"
"nucl-ex/0412013","Volker Friese","Volker Friese (for the NA49 collaboration)","Energy dependence of strangeness production","Submitted to J. Phys. G (Proceedings of the 8th International
  Conference on Strangeness in Quark Matter, Cape Town, South Africa, September
  15-20, 2004). 10 pages, 5 eps figures. Uses iopart.cls. Version 2: Slight
  changes according to referee report","J.Phys. G31 (2005) S911-S918","10.1088/0954-3899/31/6/035",,"nucl-ex",,"  We present a summary of strange particle yields measured by the experiment
NA49 in central Pb+Pb collisions in the beam energy range 20-158 AGeV. The
comparison with thermal hadron model results shows that above 30 AGeV, a
strangeness undersaturation parameter gamma_S must be employed to describe the
data. This suggests a change in the strangeness production mechanism at this
energy. We find that the UrQMD transport model in all cases underpredicts the
observed particle yields.
","[{""version"":""v1"",""created"":""Wed, 8 Dec 2004 11:11:14 GMT""},{""version"":""v2"",""created"":""Mon, 31 Jan 2005 14:37:42 GMT""}]","2019-08-14"
