"hep-ph/0412405","Osamu Yasuda","Osamu Yasuda","Degeneracy and strategies of long baseline and reactor experiments","3 pages, 3 sets of figures, uses espcrc2.sty. Talk given at 6th
  International Workshop on Neutrino Factories and Superbeams (NuFact 04),
  Osaka, Japan, 26 Jul - 1 Aug 2004",,"10.1016/j.nuclphysbps.2005.05.049",,"hep-ph",,"  Assuming that the JPARC experiment measures the oscillation probabilities
$P(\nu_\mu\to\nu_e)$ and $P(\bar{\nu}_\mu\to\bar{\nu}_e)$ at $|\Delta
m^2_{31}|L/4E=\pi/2$, I discuss what kind of extra experiment (long baseline or
reactor) can contribute to determination of $\theta_{13}$ and the CP phase
$\delta$.
","[{""version"":""v1"",""created"":""Wed, 29 Dec 2004 09:35:16 GMT""}]","2009-11-10"
"hep-ph/0412406","Alan Kostelecky","Alan Kostelecky","Lorentz Violation and Gravity","9 pages, presented at the Third Meeting on CPT and Lorentz Symmetry,
  Bloomington, Indiana, August 2004",,,"IUHET 477, September 2004","hep-ph",,"  This talk outlines some results for gravitational theories with local Lorentz
violation in the context of the Lorentz- and CPT-violating Standard-Model
Extension.
","[{""version"":""v1"",""created"":""Wed, 29 Dec 2004 11:05:34 GMT""}]","2007-05-23"
"hep-ph/0412407","Ladrem Madjid","M. Ladrem and A. Ait-El-Djoudi","Finite-Size Effects and Scaling for the Thermal QCD Deconfinement Phase
  Transition within the Exact Color-Singlet Partition Function","09 pages, 11 Postscript figures","Eur.Phys.J.C44:257-265,2005","10.1140/epjc/s2005-02357-y",,"hep-ph",,"  We study the finite-size effects for the thermal QCD Deconfinement Phase
Transition (DPT), and use a numerical finite size scaling analysis to extract
the scaling exponents characterizing its scaling behavior when approaching the
thermodynamic limit. For this, we use a simple model of coexistence of hadronic
gas and color-singlet Quark Gluon Plasma (QGP) phases in a finite volume. The
Color-Singlet Partition Function (CSPF) of the QGP cannot be exactly calculated
and is usually derived within the saddle point approximation. When we try to do
calculations with such an approximate CSPF, a problem arises in the limit of
small temperatures and/or volumes (VT3<<1), requiring then additional
approximations if we want to carry out calculations. We propose in this work a
new method for an accurate calculation of any quantity of the finite system,
without explicitly calculating the CSPF itself and without any approximation.
By probing the behavior of some useful thermodynamic response functions on the
hole range of temperature, it turns out that in a finite size system, all
singularities in the thermodynamic limit are smeared out and the transition
point is shifted away. A numerical finite size scaling analysis of the obtained
data allows us to determine the scaling exponents of the QCD DPT. Our results
expressing the equality between their values and the space dimensionality is a
consequence of the singularity characterizing a first order phase transition
and agree very well with the predictions of other FSS theoretical approaches
and with the results of both lattice QCD and Monte Carlo models calculations.
","[{""version"":""v1"",""created"":""Wed, 29 Dec 2004 12:23:57 GMT""}]","2009-01-07"
"hep-ph/0412408","Alexander Studenikin","Alexander Studenikin and Alexei Ternov","Neutrino quantum states and spin light in matter","14 pages in LaTex, a modified version of hep-ph/0410297 (significant
  part of the review matherial has been removed, the photon polarization has
  been accounted for and discussion on the effect of different matter
  compositions has been added), to be published in Phys.Lett.B","Phys.Lett. B608 (2005) 107-114","10.1016/j.physletb.2005.01.002",,"hep-ph",,"  On the basis of the exact solutions of the modified Dirac equation for a
massive neutrino moving in matter we develop the quantum theory of the spin
light of neutrino ($SL\nu$). The expression for the emitted photon energy is
derived as a function of the density of matter for different matter
compositions. The dependence of the photon energy on the helicities of the
initial and final neutrino states is shown explicitly. The rate and radiation
power of the $SL\nu$ in matter are obtained with the emitted photon linear and
circular polarizations being accounted for. The developed quantum approach to
the $SL\nu$ in matter (which is similar to the Furry representation of
electrodynamics) can be used in the studies of other processes with neutrinos
in the presence of matter
","[{""version"":""v1"",""created"":""Wed, 29 Dec 2004 13:55:49 GMT""}]","2009-11-10"
"hep-th/0412313","Tobias Reichenbach","Tobias Reichenbach","Retarded Functions in Noncommutative Theories","12 pages, minor corrections and additions, journal reference added","Phys.Lett. B612 (2005) 275-282","10.1016/j.physletb.2005.02.052","LU-ITP 2004/049","hep-th",,"  The perturbative approach to quantum field theory using retarded functions is
extended to noncommutative theories. Unitarity as well as quantized equations
of motion are studied and seen to cause problems in the case of space-time
noncommutativity. A modified theory is suggested that is unitary and preserves
the classical equations of motion on the quantum level.
","[{""version"":""v1"",""created"":""Tue, 28 Dec 2004 17:29:09 GMT""},{""version"":""v2"",""created"":""Thu, 7 Apr 2005 16:15:30 GMT""}]","2009-11-10"
"hep-th/0412314","Nicolas Boulanger","Nicolas Boulanger","A Weyl-covariant tensor calculus","LaTeX, 10 pages. Minor corrections and a reference added","J.Math.Phys. 46 (2005) 053508","10.1063/1.1896381",,"hep-th",,"  On a (pseudo-) Riemannian manifold of dimension n > 2, the space of tensors
which transform covariantly under Weyl rescalings of the metric is built. This
construction is related to a Weyl-covariant operator D whose commutator [D,D]
gives the conformally invariant Weyl tensor plus the Cotton tensor. So-called
generalized connections and their transformation laws under diffeomorphisms and
Weyl rescalings are also derived. These results are obtained by application of
BRST techniques.
","[{""version"":""v1"",""created"":""Tue, 28 Dec 2004 22:04:50 GMT""},{""version"":""v2"",""created"":""Fri, 14 Jan 2005 18:30:03 GMT""}]","2009-11-10"
"hep-th/0412315","David Shih","Nathan Seiberg, David Shih","Flux Vacua and Branes of the Minimal Superstring","46 pages, 3 figures, new identities for the neutral brane, references
  added, minor changes","JHEP 0501:055,2005","10.1088/1126-6708/2005/01/055","PUPT-2148","hep-th",,"  We analyze exactly the simplest minimal superstring theory, using its dual
matrix model. Its target space is one dimensional (the Liouville direction),
and the background fields include a linear dilaton, a possible tachyon
condensate, and RR flux. The theory has both charged and neutral branes, and
these exhibit new and surprising phenomena. The smooth moduli space of charged
branes has different weakly coupled boundaries in which the branes have
different RR charges. This new duality between branes of different charges
shows that the semiclassical notion of localized charge is not precise in the
quantum theory, and that the charges of these branes can fluctuate.
Correspondingly, the RR flux in some parts of target space can also fluctuate
-- only the net flux at infinity is fixed. We substantiate our physical picture
with a detailed semiclassical analysis of the exact answers. Along the way, we
uncover new subtleties in super-Liouville theory.
","[{""version"":""v1"",""created"":""Wed, 29 Dec 2004 01:10:55 GMT""},{""version"":""v2"",""created"":""Fri, 21 Jan 2005 20:04:44 GMT""}]","2009-11-10"
"hep-th/0412316","Qinghai Wang","Carl M. Bender, Sebastian F. Brandt, Jun-Hua Chen, and Qinghai Wang","The C Operator in PT-Symmetric Quantum Field Theory Transforms as a
  Lorentz Scalar","13 pages, no figure","Phys.Rev. D71 (2005) 065010","10.1103/PhysRevD.71.065010",,"hep-th",,"  A non-Hermitian Hamiltonian has a real positive spectrum and exhibits unitary
time evolution if the Hamiltonian possesses an unbroken PT (space-time
reflection) symmetry. The proof of unitarity requires the construction of a
linear operator called C. It is shown here that C is the complex extension of
the intrinsic parity operator and that the C operator transforms under the
Lorentz group as a scalar.
","[{""version"":""v1"",""created"":""Wed, 29 Dec 2004 03:28:00 GMT""}]","2009-11-10"
"hep-th/0412317","Hongsheng Zhang","Zhang Hongsheng and Guo Zongkuan","Asymmetric brane instantons","This paper is heavily changed in the 2nd version which will appear in
  JHEP. Several references added, two authors joined. Hence it is better to be
  a new paper in arxiv",,,"ITP-CAS/12-2004","hep-th",,"  We investigate all the brane instanton solutions--an Einstein brane
inhabiting at different positions in 5-dimensional negative curvature Einstein
bulk. We construct a brane instanton model consisting of a brane with
asymmetric bulk along two sides of the brane. And the junction condition of the
resulting space-time is analyzed in the frame of induced gravity. In spirits of
quantum gravity of path integral formulism we calculate the Euclidean actions
on three canonical paths and then compare the Euclidean actions of different
instantons per unit 4-volume. We also compare the Euclidean actions per unit
4-volume of instantons consisting of a brane gluing a fixed half with other
halves possessing different cosmological constants.
","[{""version"":""v1"",""created"":""Wed, 29 Dec 2004 11:06:52 GMT""},{""version"":""v2"",""created"":""Fri, 31 Dec 2004 08:14:12 GMT""},{""version"":""v3"",""created"":""Sat, 24 Dec 2011 09:32:13 GMT""}]","2011-12-30"
"math/0412512","Angelo Vistoli","Angelo Vistoli","Notes on Grothendieck topologies, fibered categories and descent theory","114 pages. I have corrected a finite, but extremely high, number of
  errors that have been pointed out to me by various readers. These were mostly
  typos, but a couple were substantial",,,,"math.AG math.CT",,"  This is an introduction to Grothendieck's descent theory, with some stress on
the general machinery of fibered categories and stacks.
","[{""version"":""v1"",""created"":""Tue, 28 Dec 2004 16:28:00 GMT""},{""version"":""v2"",""created"":""Mon, 24 Jan 2005 23:29:51 GMT""},{""version"":""v3"",""created"":""Sun, 16 Oct 2005 08:40:29 GMT""},{""version"":""v4"",""created"":""Thu, 24 May 2007 16:31:12 GMT""}]","2007-06-13"
"math/0412513","Susan G. Williams","Daniel S Silver, Alexander Stoimenow, Susan G Williams","Euclidean Mahler measure and twisted links","This is the version published by Algebraic & Geometric Topology on 7
  April 2006","Algebr. Geom. Topol. 6 (2006) 581-602","10.2140/agt.2006.6.581",,"math.GT","http://arxiv.org/licenses/nonexclusive-distrib/1.0/","  If the twist numbers of a collection of oriented alternating link diagrams
are bounded, then the Alexander polynomials of the corresponding links have
bounded euclidean Mahler measure (see Definition 1.2). The converse assertion
does not hold. Similarly, if a collection of oriented link diagrams, not
necessarily alternating, have bounded twist numbers, then both the Jones
polynomials and a parametrization of the 2-variable Homflypt polynomials of the
corresponding links have bounded Mahler measure.
","[{""version"":""v1"",""created"":""Tue, 28 Dec 2004 18:48:28 GMT""},{""version"":""v2"",""created"":""Wed, 5 Jan 2005 22:43:08 GMT""},{""version"":""v3"",""created"":""Fri, 17 Nov 2006 18:58:02 GMT""},{""version"":""v4"",""created"":""Tue, 10 Mar 2009 11:31:46 GMT""}]","2009-03-10"
"math/0412514","Michele Rossi","Michele Rossi","Geometric Transitions","44 pages","J.Geom.Phys. 56 (2006) 1940-1983","10.1016/j.geomphys.2005.09.005",,"math.AG hep-th math-ph math.MP",,"  The purpose of this paper is to give, on one hand, a mathematical exposition
of the main topological and geometrical properties of geometric transitions, on
the other hand, a quick outline of their principal applications, both in
mathematics and in physics.
","[{""version"":""v1"",""created"":""Tue, 28 Dec 2004 18:55:26 GMT""}]","2015-06-26"
"math/0412515","David Damanik","David Damanik (Caltech)","Verblunsky Coefficients With Coulomb-Type Decay","11 pages","J. Approx. Theory 139 (2006), 257-268",,,"math.SP math.CA",,"  We show that probability measures on the unit circle associated with
Verblunsky coefficients obeying a Coulomb-type decay estimate have no singular
continuous component.
","[{""version"":""v1"",""created"":""Tue, 28 Dec 2004 19:07:44 GMT""}]","2014-12-30"
"math/0412516","Stephen Bigelow","Stephen Bigelow","Homological representations of the Iwahori-Hecke algebra","Published by Geometry and Topology Monographs at
  http://www.maths.warwick.ac.uk/gt/GTMon7/paper16.abs.html","Geom. Topol. Monogr. 7 (2004) 493-507",,,"math.QA math.GT",,"  Representations of the Iwahori-Hecke algebra of type A_{n-1} are equivalent
to representations of the braid group B_n for which the generators satisfy a
certain quadratic relation. We show how to construct such representations from
the natural action of B_n on the homology of configuration spaces of the
punctured disk. We conjecture that all irreducible representations of Hecke_n
can be obtained in this way, even for non-generic values of q.
","[{""version"":""v1"",""created"":""Tue, 28 Dec 2004 20:19:25 GMT""}]","2007-05-23"
"math/0412517","John Etnyre","Tobias Ekholm and John B. Etnyre","Invariants of Knots, Embeddings and Immersions via Contact Geometry","20 pages; 14 figures",,,,"math.GT math.SG",,"  This paper is an overview of the idea of using contact geometry to construct
invariants of immersions and embeddings. In particular, it discusses how to
associate a contact manifold to any manifold and a Legendrian submanifold to an
embedding or immersion. We then discuss recent work that creates invariants of
immersions and embeddings using the Legendrian contact homology of the
associated Legendrian submanifold.
","[{""version"":""v1"",""created"":""Tue, 28 Dec 2004 20:58:02 GMT""}]","2007-05-23"
"math/0412520","Alexander I. Suciu","Stefan Papadima, Alexander I. Suciu","Algebraic invariants for right-angled Artin groups","20 pages; accepted for publication by Math. Annalen","Mathematische Annalen 334 (2006), no. 3, 533-555","10.1007/s00208-005-0704-9",,"math.GR math.AC",,"  A finite simplicial graph \Gamma determines a right-angled Artin group
G_\Gamma, with generators corresponding to the vertices of \Gamma, and with a
relation vw=wv for each pair of adjacent vertices. We compute the lower central
series quotients, the Chen quotients, and the (first) resonance variety of
G_\Gamma, directly from the graph \Gamma.
","[{""version"":""v1"",""created"":""Wed, 29 Dec 2004 03:28:40 GMT""},{""version"":""v2"",""created"":""Fri, 26 Aug 2005 01:46:52 GMT""}]","2007-05-23"
"math/0412521","Mikhail Bondarko","M.V. Bondarko","Finite flat commutative group schemes over complete discrete valuation
  rings III: classification, tangent spaces, and semistable reduction of
  Abelian varieties",,,,,"math.AG",,"  We classify group schemes in terms of their Cartier modules. We also prove
the equivalence of different definitions of the tangent space and the dimension
for these group schemes; in particular, the minimal dimension of a formal group
law that contains $S$ as a closed subgroup is equal to the minimal number of
generators for the affine algebra of $S$. As an application the following
reduction criteria for Abelian varieties are proved. Let $K$ be a mixed
characteristic local field, let its residue field have characteristic $p$, $L$
be a finite extension of $K$, let $\mathfrak{O}_K\subset\mathfrak{O}_L$ be
their rings of integers. Let $e$ be the absolute ramification index of $L$,
$s=[\log_p(pe/(p-1))]$, $e_0$ be the ramification index of $L/K$,
$l=2s+v_p(e_0)+1$. For a finite flat commutative $\mathfrak{O}_L$-group scheme
$H$ we denote the $\mathfrak{O}_L$-dual of the module $J/J^2$ by $TH$. Here $J$
is the augmentation ideal of the affine algebra of $H$. Let $V$ be an
$m$-dimensional Abelian variety over $K$. Suppose that $V$ has semistable
reduction over $L$. \begin{theor} $V$ has semistable reduction over $K$ if and
only if for some group scheme $H$ over $\mathfrak{O}_K$ there exist embeddings
of $H_K$ into $\operatorname{Ker}[p^{l}]_{V,K}$, and of
$(\mathfrak{O}_L/p^l\mathfrak{O}_L)^m$ into $TH_\ol$. \end{theor} This
criterion has a very nice-looking version in the ordinary reduction case.
\begin{theor} $V$ has ordinary reduction over $K$ if and only if for some
$H_K\subset \operatorname{Ker}[p^{l}]_{V,K}$ and $M$ unramified over $K$ we
have $H_M\cong (\mu_{p^{l},M})^m$. Here $\mu$ denotes the group scheme of roots
of unity.\end{theor}
","[{""version"":""v1"",""created"":""Wed, 29 Dec 2004 07:14:35 GMT""},{""version"":""v2"",""created"":""Mon, 28 Mar 2005 05:31:21 GMT""},{""version"":""v3"",""created"":""Fri, 9 Dec 2005 12:14:32 GMT""}]","2007-05-23"
"math/0412522","Ivan Cheltsov","Ivan Cheltsov","On nodal sextic fivefold","10 pages",,,,"math.AG",,"  We prove the birational superrigidity and nonrationality of a hypersurface in
$\mathbb{P}^{6}$ of degree 6 having at most isolated ordinary double points.
","[{""version"":""v1"",""created"":""Wed, 29 Dec 2004 08:43:47 GMT""},{""version"":""v2"",""created"":""Mon, 13 Jun 2005 13:52:20 GMT""},{""version"":""v3"",""created"":""Fri, 25 Nov 2005 12:18:47 GMT""}]","2007-05-23"
"math/0412523","Vassily Iskovskikh","V.A. Iskovskikh","On the Noether--Fano inequalities","The revised version: an erroneous reference in the first version of
  this paper, published in the Proceedings of Fano conference, is corrected",,,,"math.AG",,"  I give a survey of Noether-Fano inequalities in birational geometry, starting
with the original Noether inequality and up to the modern approach of Log
Minimal Model program. The paper is based on my talk at the Fano conference in
Torino in October 2002. This is the revised version: an erroneous reference in
my paper published in the Proceedings of Fano conference is corrected.
","[{""version"":""v1"",""created"":""Wed, 29 Dec 2004 09:14:37 GMT""}]","2007-05-23"
"math/0412524","Mikhail Bondarko","M.V. Bondarko","Finite flat commutative group schemes over complete discrete valuation
  fields: classification, structural results; application to reduction of
  Abelian varieties","A survey of author's results on finite group schemes","St. Petersburg Mathematical Journal, 2007, 18:5, 737-755",,,"math.NT math.AG",,"  This paper is a summary of author's results on finite flat commutative group
schemes. The properties of the generic fibre functor are discussed. A complete
classification of finite local flat commutative group schemes over mixed
characteristic complete discrete valuation rings in terms of their Cartier
modules (defined by Oort) is given. We also state several properties of tangent
space of these schemes. These results are applied to the study of reduction of
Abelian varieties. A finite $p$-adic semistable reduction criterion is
formulated. It looks especially nice in the ordinary reduction case. The plans
of the proofs are described.
","[{""version"":""v1"",""created"":""Wed, 29 Dec 2004 10:07:15 GMT""},{""version"":""v2"",""created"":""Mon, 28 Mar 2005 05:37:33 GMT""},{""version"":""v3"",""created"":""Fri, 9 Dec 2005 12:16:40 GMT""}]","2014-06-17"
"math/0412525","Igor Yu. Potemine","Igor Yu. Potemine","Minimal smooth models of Drinfeld coarse moduli threefolds","15 pages, 9 figures",,,,"math.AG math.NT",,"  We construct minimal smooth models of coarse moduli schemes of rational
Drinfeld modules of rank 4 as well as their smooth compactifications.
","[{""version"":""v1"",""created"":""Wed, 29 Dec 2004 13:30:30 GMT""}]","2007-05-23"
"math/0412526","Dmitri Zaitsev","Wilhelm Kaup and Dmitri Zaitsev","On local CR-transformations of Levi-degenerate group orbits in compact
  Hermitian symmetric spaces",,,,,"math.CV",,"  Let $S$ be a real-analytic hypersurface in $C^n$ or, more generally, a
CR-submanifold in a complex manifold $Z$ of arbitrary CR-codimension. This
paper addresses the question, when a local biholomorphic map between open sets
in $Z$ sending an open piece of $S$ into $S$ extends to a global biholomorphic
self-map of $Z$ preserving $S$. We give answers for a large class of
Levi-degenerate group orbits in compact Hermitian symmetric spaces.
","[{""version"":""v1"",""created"":""Wed, 29 Dec 2004 15:11:09 GMT""}]","2007-05-23"
"nlin/0412071","Xiao jun Liu","Yijun Shao and Yunbo Zeng","The Solutions of the NLS Equations with Self-Consistent Sources","24 pages, 3 figures, to appear in Journal of Physics A: Mathematical
  and General",,"10.1088/0305-4470/38/11/008",,"nlin.SI",,"  We construct the generalized Darboux transformation with arbitrary functions
in time $t$ for the AKNS equation with self-consistent sources (AKNSESCS)
which, in contrast with the Darboux transformation for the AKNS equation,
provides a non-auto-B\""{a}cklund transformation between two AKNSESCSs with
different degrees of sources. The formula for N-times repeated generalized
Darboux transformation is proposed. By reduction the generalized Darboux
transformation with arbitrary functions in time $t$ for the Nonlinear
Schr\""{o}dinger equation with self-consistent sources (NLSESCS) is obtained and
enables us to find the dark soliton, bright soliton and positon solutions for
NLS$^{+}$ESCS and NLS$^{-}$ESCS. The properties of these solution are analyzed.
","[{""version"":""v1"",""created"":""Wed, 29 Dec 2004 08:07:16 GMT""}]","2009-11-10"
"nlin/0412072","Maxim Pavlov","Maxim Pavlov","Gurevich-Zybin system","Corrected typos and misprints",,"10.1088/0305-4470/38/17/008",,"nlin.SI",,"  We present three different linearizable extensions of the Gurevich-Zybin
system. Their general solutions are found by reciprocal transformations. In
this paper we rewrite the Gurevich-Zybin system as a Monge-Ampere equation. By
application of reciprocal transformation this equation is linearized.
Infinitely many local Hamiltonian structures, local Lagrangian representations,
local conservation laws and local commuting flows are found. Moreover, all
commuting flows can be written as Monge-Ampere equations similar to the
Gurevich-Zybin system. The Gurevich-Zybin system describes the formation of a
large scale structures in the Universe. The second harmonic wave generation is
known in nonlinear optics. In this paper we prove that the Gurevich-Zybin
system is equivalent to a degenerate case of the second harmonic generation.
Thus, the Gurevich-Zybin system is recognized as a degenerate first negative
flow of two-component Harry Dym hierarchy up to two Miura type transformations.
A reciprocal transformation between the Gurevich-Zybin system and degenerate
case of the second harmonic generation system is found. A new solution for the
second harmonic generation is presented in implicit form.
","[{""version"":""v1"",""created"":""Wed, 29 Dec 2004 12:41:14 GMT""},{""version"":""v2"",""created"":""Thu, 30 Dec 2004 06:11:29 GMT""},{""version"":""v3"",""created"":""Thu, 6 Jan 2005 08:15:25 GMT""}]","2009-11-10"
"nucl-ex/0412057","Venktesh Singh","Venktesh Singh and Henry T. Wong (for the TEXONO Collaboration)","Recent Results and Status of TEXONO Experiments","11 pages with 10 figures, Presented in International Workshop On
  Astroparticle and High Energy Physics (AHEP - 2003), Spain","J. HEP 053, (2003)",,"PRHEP-AHEP2003/053","nucl-ex",,"  This article reviews the research program and efforts for the TEXONO
Collaboration on neutrino and astro-particle physics. The ``flagship'' program
is on reactor-based neutrino physics at the Kuo-Sheng (KS) Power Plant in
Taiwan. A limit on the neutrino magnetic moment of munuebar < 1.3 times
10^{-10} mub at 90% confidence level was derived from measurements with a high
purity germanium detector. Other physics topics at KS, as well as the various
R&D program, are discussed.
","[{""version"":""v1"",""created"":""Wed, 29 Dec 2004 13:21:38 GMT""}]","2007-05-23"
"nucl-th/0412109","Thomas Luu","T.C. Luu P. Navratil A. Nogga","Applying the Bloch-Horowitz equation to s- and p-shell nuclei","26 pages, 10 figures",,,"LA-UR-04-4790","nucl-th",,"  The Bloch-Horowitz (BH) equation has been successfully applied to calculating
the binding energies of the deuteron and 3H/3He systems. For the three-body
systems, BH was found to be perturbative for certain choices of the harmonic
oscillator (HO) parameter b. We extend upon this work by applying this
formalism to the alpha particle and certain five-, six-, and seven-body nuclei
in the p-shell. Furthermore, we use only the leading order BH term and work in
the smallest allowed included-spaces for each few-body system (0hw and 2hw). We
show how to calculate A-body matrix elements within this formalism. Stationary
solutions are found for all nuclei investigated within this work. The
calculated binding energy of the alpha particle differs by ~1 MeV from
Faddeev-Yakubovsky calculations. However, calculated energies of p-shell nuclei
are underbound, leaving p-shell nuclei that are susceptible to cluster breakup.
Furthermore, convergence is suspect when the size of the included-space is
increased. We attribute this undesirable behavior to lack of a sufficiently
binding mean-field.
","[{""version"":""v1"",""created"":""Tue, 28 Dec 2004 19:55:02 GMT""}]","2007-05-23"
