"cond-mat/0412734","Ofir Alon","Ofir E. Alon, Alexej I. Streltsov, and Lorenz S. Cederbaum","Zoo of quantum phases and excitations of cold bosonic atoms in optical
  lattices","12 pages, 3 figures","Phys. Rev. Lett 95, 030405 (2005)","10.1103/PhysRevLett.95.030405",,"cond-mat.other",,"  Quantum phases and phase transitions of weakly- to strongly-interacting
bosonic atoms in deep to shallow optical lattices are described by a {\it
single multi-orbital mean-field approach in real space}. For weakly-interacting
bosons in 1D, the critical value of the superfluid to Mott insulator (MI)
transition found is in excellent agreement with {\it many-body} treatments of
the Bose-Hubbard model. For strongly-interacting bosons, (i) additional MI
phases appear, for which two (or more) atoms residing in {\it each site}
undergo a Tonks-Girardeau-like transition and localize and (ii) on-site
excitation becomes the excitation lowest in energy. Experimental implications
are discussed.
","[{""version"":""v1"",""created"":""Tue, 28 Dec 2004 16:52:20 GMT""}]","2009-11-10"
"cond-mat/0412736","Anna Kimmel","A.Kimmel, I.Gusenkov","Temperature evolution of the structure of liquid 3d transition metals:
  MD study","7 pages, 4 figures",,,,"cond-mat.mtrl-sci cond-mat.dis-nn",,"  The effective pair potentials of liquid 3d transition metals have been
derived from the experimental diffraction data by means of the inverse
self-consistent method. The obtained potentials provide highly accurate
coincidence of the simulated by means of the molecular dynamics method and the
experimental structural factors at the range of temperatures. The statistical
analysis of Voronoy polyhedra of the simulated systems has indicated the
presence of the temperature range of inhomogeneity, within which the metallic
liquids contain several competitive types of the local order, and out of them
structure of liquid becomes homogeneous.
","[{""version"":""v1"",""created"":""Tue, 28 Dec 2004 20:35:53 GMT""},{""version"":""v2"",""created"":""Wed, 10 Aug 2005 15:29:52 GMT""}]","2007-05-23"
"cond-mat/0412737","Silvia Viola","H. Fort, S. Viola","Spatial patterns and scale freedom in a Prisoner's Dilemma cellular
  automata with Pavlovian strategies","Accepted for publication in JSTAT",,"10.1088/1742-5468/2005/01/P01010",,"cond-mat.stat-mech",,"  A cellular automaton in which cells represent agents playing the Prisoner's
Dilemma (PD) game following the simple ""win-stay, loose-shift"" strategy is
studied. Individuals with binary behavior, such as they can either cooperate
(C) or defect (D), play repeatedly with their neighbors (Von Neumann's and
Moore's neighborhoods). Their utilities in each round of the game are given by
a rescaled payoff matrix described by a single parameter Tau, which measures
the ratio of 'temptation to defect' to 'reward for cooperation'. Depending on
the region of the parameter space Tau, the system self-organizes - after a
transient - into dynamical equilibrium states characterized by different
definite fractions of C agents (2 states for the Von Neumann neighborhood and 4
for Moore neighborhood). For some ranges of Tau the cluster size distributions,
the power spectrums P(f) and the perimeter-area curves follow power-law
scalings. Percolation below threshold is also found for D agent clusters. We
also analyze the asynchronous dynamics version of this model and compare
results.
","[{""version"":""v1"",""created"":""Tue, 28 Dec 2004 20:57:39 GMT""}]","2009-11-10"
"cond-mat/0412738","George Cragg","George E. Cragg and Arthur K. Kerman","A Complex Chemical Potential: Signature of Decay in a Bose-Einstein
  Condensate","4 pages, 1 figure",,"10.1103/PhysRevLett.94.190402",,"cond-mat.other",,"  We explore the zero-temperature statics of an atomic Bose-Einstein condensate
in which a Feshbach resonance creates a coupling to a second condensate
component of quasi-bound molecules. Using a variational procedure to find the
equation of state, the appearance of this binding is manifest in a collapsing
ground state, where only the molecular condensate is present up to some
critical density. Further, an excited state is seen to reproduce the usual
low-density atomic condensate behavior in this system, but the molecular
component is found to produce an underlying decay, quantified by the imaginary
part of the chemical potential. Most importantly, the unique decay rate
dependencies on density ($\sim \rho ^{3/2}$) and on scattering length ($\sim
a^{5/2}$) can be measured in experimental tests of this theory.
","[{""version"":""v1"",""created"":""Wed, 29 Dec 2004 06:10:30 GMT""}]","2009-11-10"
"cond-mat/0412739","Yuekui Sun","Yuekui Sun and Jun Yuan","Determination of fast electron energy dependence of magic angles in
  electron energy loss spectroscopy for anisotropic systems","16 pages, 4 figure",,,,"cond-mat.mtrl-sci",,"  We present an accurate determination of the magic angle conditions at which
the sample-orientation induced fine structure variation is eliminated in the
core-level electron energy loss spectroscopy of anisotropic systems. Our result
paves the way for the application of magic angle electron energy loss
spectroscopy (MAEELS) in material characterization. It also highlights, for the
first time, the importance of the quantum interference effect between
longitudinal and transverse interactions for medium energy fast electrons, and
its connection with the anisotropy of the electron transition.
","[{""version"":""v1"",""created"":""Wed, 29 Dec 2004 06:28:12 GMT""}]","2007-05-23"
"cond-mat/0412740","Valentin Bogomolov","V.N.Bogomolov","Dilute Metals: Superconductivity, Critical Currents, Magnetic Properties","3 pages,1 figures",,,,"cond-mat.supr-con",,"  Properties of oxides are interpreted as a result of existence of the virtual
sublattices formed by the atomic quantum states. An infinite cluster with the
superconductivity of the Bose-Einstein condensate kind can be formed in the
ground state sublattice at certain oxigen atoms concentration in the
effectively diluted system of metal atoms (above the percolation threshold).
Then the electron pairs concentration n/2 can be much less than the metal atoms
concentration N in the oxide. The similar situation takes place in metals with
superconductivity of the BCS type. Above the percolation threshold the
superconductivity Tc may be limited by the magnetic properties of the oxigen
2p4quantum state sublattice. Data on the critical current density allow us to
estimate the electronic pair density n/2 and to obtain an information
concerning the superconductivity nature.
","[{""version"":""v1"",""created"":""Wed, 29 Dec 2004 12:04:38 GMT""},{""version"":""v2"",""created"":""Mon, 21 Feb 2005 13:30:42 GMT""}]","2007-05-23"
"cond-mat/0412741","Dietrich Stauffer","Lotfi Zekri","Frequency dependent effective conductivity of two-dimensional
  metal-dielectric composites","7 pages including all figures, accepted in Int. J. Mod. Phys. C",,"10.1142/S0129183105007662",,"cond-mat.dis-nn",,"  We analyze a random resistor-inductor-capacitor $(RLC)$ lattice model of
2-dimensional metal-insulator composites. The results are compared with
Bruggeman's and Landauer's Effective Medium Approximations where a discrepancy
was observed for some frequency zones. Such a discrepancy is mainly caused by
the strong conductivity fluctuations. Indeed, a two-branches distribution is
observed for low frequencies. We show also by increasing the system size that
at $p_c$ the so-called Drude peak vanishes; it increases for vanishing losses.
","[{""version"":""v1"",""created"":""Wed, 29 Dec 2004 12:31:49 GMT""},{""version"":""v2"",""created"":""Thu, 26 May 2005 08:37:28 GMT""}]","2009-11-10"
"cond-mat/0412742","Nedko Ivanov","N. B. Ivanov and D. Sen","Spin wave analysis of Heisenberg magnets in restricted geometries","A review article, Chapter 4 in: ""Quantum Magnetism"", edited by U.
  Schollwoeck et al. (Springer-Verlag, Berlin Heidelberg, 2004)","Lect. Notes Phys. v. 645, pp. 195-226 (2004)","10.1007/BFb0119594",,"cond-mat.str-el",,"  In the last decade it has been proven that the standard spin wave theory was
able to provide accurate zero-temperature results for a number of
low-dimensional Heisenberg spin systems. In this chapter we introduce the main
ingredients of the spin-wave technique using as a working model the two-leg
mixed-spin ferrimagnetic ladder and the Dyson--Maleev boson formalism up to
second order in the spin-wave interaction. In the remainder, we survey typical
applications in low-space dimensionality as well as some recent modifications
of the theory admitting a quantitative analysis in magnetically disordered
phases. The presented spin-wave results are compared with available numerical
estimates.
","[{""version"":""v1"",""created"":""Wed, 29 Dec 2004 14:50:45 GMT""}]","2009-11-10"
"cs/0412113","Emin Martinian","J. Nicholas Laneman, Emin Martinian, Gregory W. Wornell, John G.
  Apostolopoulos","Source-Channel Diversity for Parallel Channels","48 pages, 14 figures",,,,"cs.IT math.IT",,"  We consider transmitting a source across a pair of independent, non-ergodic
channels with random states (e.g., slow fading channels) so as to minimize the
average distortion. The general problem is unsolved. Hence, we focus on
comparing two commonly used source and channel encoding systems which
correspond to exploiting diversity either at the physical layer through
parallel channel coding or at the application layer through multiple
description source coding.
  For on-off channel models, source coding diversity offers better performance.
For channels with a continuous range of reception quality, we show the reverse
is true. Specifically, we introduce a new figure of merit called the distortion
exponent which measures how fast the average distortion decays with SNR. For
continuous-state models such as additive white Gaussian noise channels with
multiplicative Rayleigh fading, optimal channel coding diversity at the
physical layer is more efficient than source coding diversity at the
application layer in that the former achieves a better distortion exponent.
  Finally, we consider a third decoding architecture: multiple description
encoding with a joint source-channel decoding. We show that this architecture
achieves the same distortion exponent as systems with optimal channel coding
diversity for continuous-state channels, and maintains the the advantages of
multiple description systems for on-off channels. Thus, the multiple
description system with joint decoding achieves the best performance, from
among the three architectures considered, on both continuous-state and on-off
channels.
","[{""version"":""v1"",""created"":""Wed, 29 Dec 2004 01:35:49 GMT""}]","2009-09-29"
"cs/0412114","Pierre Andrews","Martin Rajman and Martin Vesely and Pierre Andrews","State of the Art, Evaluation and Recommendations regarding ""Document
  Processing and Visualization Techniques""","54 pages, Report of Working Group 1 for the European Network of
  Excellence (NoE) in Text Mining and its Applications in Statistics (NEMIS)",,,,"cs.CL",,"  Several Networks of Excellence have been set up in the framework of the
European FP5 research program. Among these Networks of Excellence, the NEMIS
project focuses on the field of Text Mining.
  Within this field, document processing and visualization was identified as
one of the key topics and the WG1 working group was created in the NEMIS
project, to carry out a detailed survey of techniques associated with the text
mining process and to identify the relevant research topics in related research
areas.
  In this document we present the results of this comprehensive survey. The
report includes a description of the current state-of-the-art and practice, a
roadmap for follow-up research in the identified areas, and recommendations for
anticipated technological development in the domain of text mining.
","[{""version"":""v1"",""created"":""Wed, 29 Dec 2004 15:19:03 GMT""}]","2007-05-23"
"gr-qc/0412123","Patrick Sutton","Patrick J. Sutton, Masaki Ando, Patrick Brady, Laura Cadonati,
  Alessandra Di Credico, Stephen Fairhurst, Lee Samuel Finn, Nobuyuki Kanda,
  Erik Katsavounidis, Sergey Klimenko, Albert Lazzarini, Szabolcs Marka, John
  W. C. McNabb, Saikat Ray Majumder, Peter R. Saulson, Hideyuki Tagoshi,
  Hirotaka Takahashi, Ryutaro Takahashi, Daisuke Tatsumi, Yoshiki Tsunesada, S.
  E. Whitcomb","Plans for the LIGO-TAMA Joint Search for Gravitational Wave Bursts","Proceedings of the 8th Gravitational Wave Data Analysis Workshop,
  Milwaukee, WI, USA. 10 pages, 3 figures, documentclass ``iopart''","Class.Quant.Grav.21:S1801-S1807,2004","10.1088/0264-9381/21/20/023","LIGO-P040011-00-R","gr-qc",,"  We describe the plans for a joint search for unmodelled gravitational wave
bursts being carried out by the LIGO and TAMA collaborations using data
collected during February-April 2003. We take a conservative approach to
detection, requiring candidate gravitational wave bursts to be seen in
coincidence by all four interferometers. We focus on some of the complications
of performing this coincidence analysis, in particular the effects of the
different alignments and noise spectra of the interferometers.
","[{""version"":""v1"",""created"":""Tue, 28 Dec 2004 17:40:03 GMT""}]","2008-11-26"
"gr-qc/0412124","Hyun Kyu Lee","V.P. Frolov (1), H.K. Lee (1,2 and 3) ((1) University of Alberta (2)
  KIPAC (3)Hanyang University)","Observable form of pulses emitted from relativistic collapsing objects","13 pages, 10 figures;Typos in equations and refrences are corrected.
  No change in the results and discussions","Phys.Rev. D71 (2005) 044002","10.1103/PhysRevD.71.044002","Aberta-Thy-19-04/SLAC-PUB-10998","gr-qc",,"  In this work, we discuss observable characteristics of the radiation emitted
from a surface of a collapsing object. We study a simplified model in which a
radiation of massless particles has a sharp in time profile and it happens at
the surface at the same moment of comoving time. Since the radiating surface
has finite size the observed radiation will occur during some finite time. Its
redshift and bending angle are affected by the strong gravitational field. We
obtain a simple expression for the observed flux of the radiation as a function
of time. To find an explicit expression for the flux we develop an analytical
approximation for the bending angle and time delay for null rays emitted by a
collapsing surface. In the case of the bending angle this approximation is an
improved version of the earlier proposed Beloborodov-Leahy-approximation. For
rays emitted at $R > 2R_g$ the accuracy of the proposed improved approximations
for the bending angle and time delay is of order (or less) than 2-3%. By using
this approximation we obtain an approximate analytical expression for the
observed flux and study its properties.
","[{""version"":""v1"",""created"":""Tue, 28 Dec 2004 20:47:59 GMT""},{""version"":""v2"",""created"":""Fri, 22 Jul 2005 06:44:23 GMT""}]","2009-11-10"
"gr-qc/0412125","Tae Hoon Lee","Tae Hoon Lee","Cosmic String Spacetime in Dilaton Gravity and Flat Rotation Curves","9 pages, RevTeX4 file","Mod.Phys.Lett. A19 (2004) 2929-2940","10.1142/S0217732304016251",,"gr-qc",,"  In dilaton gravity theories, we consider a string-like topological defect
formed during U(1) gauge symmetry-breaking phase transition in the early
Universe, and far from the cosmic string we have vacuum solutions of the
generalized Einstein equation. We discuss how they can be related to the
flatness of galactic rotation curves.
","[{""version"":""v1"",""created"":""Wed, 29 Dec 2004 14:54:31 GMT""}]","2009-11-10"
"hep-ex/0412074","Daniel Carman","D.S. Carman","Experimental Evidence for the Pentaquark","6 pages, 5 figures, Electron-Nucleus Scattering VIII conference","Eur.Phys.J. A24S1 (2005) 15-20","10.1140/epjad/s2005-05-003-1",,"hep-ex",,"  The present experimental evidence for the existence of light pentaquarks is
reviewed, including both positive and null results. I also discuss the CLAS
experiments at Jefferson Laboratory that are forthcoming in the near future to
address questions regarding existence, mass, width, and other quantum numbers
of these five-quark baryon states.
","[{""version"":""v1"",""created"":""Tue, 28 Dec 2004 16:37:00 GMT""}]","2009-11-10"
"hep-ex/0412076","Victor V. Abramov","V. V. Abramov, P. I. Goncharov, A. Yu. Kalinin, A. V. Khmelnikov, A.
  V. Korablev, Yu .P. Korneev, A. V. Kostritsky, A. N. Krinitsyn, V. I.
  Kryshkin, A. A. Markov, V. V. Talov, L. K. Turchanovich and A. A. Volkov","Single Spin Asymmetry in High Pt Charged Hadron Production off Nuclei at
  40 GeV","7 pages, LaTeX, 4 figures, Presented at the XVII International Baldin
  Seminar on High Energy Physics Problems ""Relativistic Nuclear Physics &
  Quantum Chromodynamics"", Dubna, Russia, September 27 - October 2, 2004",,,,"hep-ex",,"  The single transverse spin asymmetry data for the charged hadron production
in pC and pCu interactions are presented. The measurements have been performed
at FODS-2 experimental setup using 40 GeV/c IHEP polarized proton beam. The
hadron transverse momentum range is from 0.5 GeV/c up to 4 GeV/c. The data
obtained off the nuclear targets are compared with the proton target data
measured earlier with the same experimental setup and with the data of other
experiments.
","[{""version"":""v1"",""created"":""Wed, 29 Dec 2004 15:51:14 GMT""}]","2007-05-23"
"hep-lat/0412043","Andreas S. Kronfeld","Kenneth G. Wilson","The Origins of Lattice Gauge Theory","Lattice2004(plenary), 17 pages; v2 corrects 1 date","Nucl.Phys.Proc.Suppl.140:3-19,2005","10.1016/j.nuclphysbps.2004.11.271",,"hep-lat cond-mat.other hep-ph hep-th physics.hist-ph",,"  An anecdotal account of the author's role in the origins of lattice gauge
theory, prepared for delivery on the thirtieth anniversary of the publication
of ""Confinement of Quarks"" [Phys. Rev. D10 (1974) 2445].
","[{""version"":""v1"",""created"":""Tue, 28 Dec 2004 21:17:52 GMT""},{""version"":""v2"",""created"":""Thu, 24 Feb 2005 18:03:10 GMT""}]","2011-04-11"
"hep-ph/0412396","Raju Venugopalan","Raju Venugopalan","The Color Glass Condensate: A summary of key ideas and recent
  developments","48 pages, 22 figures, lectures at various summer schools; revised
  version with corrected typos and added references",,,,"hep-ph nucl-ex nucl-th",,"  We summarize the theory and phenomenology of the Color Glass Condensate
reviewed previously by E. Iancu and the author in hep-ph/0303204. In addition,
we discuss some of the subsequent developments in the past year both in theory
and in phenomenological applications.
","[{""version"":""v1"",""created"":""Wed, 29 Dec 2004 15:52:45 GMT""},{""version"":""v2"",""created"":""Tue, 11 Jan 2005 15:59:22 GMT""}]","2007-05-23"
"hep-ph/0412398","Da-Xin Zhang","Da-Xin Zhang","Dimension-5 operators in a Gauge Mediated Supersymmetry Breaking Model","9 pages",,,,"hep-ph",,"  We study the novel features in a model with Gauge Mediated Supersymmetry
Breaking. If the messenger fields have positive R-parity, there will be new
sources of flavor violations. We show that the dimension-5 operators will be
quite important. When dressing these operators by wino-loops, the constraints
on them by the present data are given.
","[{""version"":""v1"",""created"":""Tue, 28 Dec 2004 16:11:06 GMT""}]","2007-05-23"
"hep-ph/0412401","Joseph Schechter","Samina S. Masood, Salah Nasri, Joseph Schechter","Leptonic CP violation in a two parameter model","12 pages, 1 figure","Phys.Rev. D71 (2005) 093005","10.1103/PhysRevD.71.093005",,"hep-ph",,"  We further study the ""complementary"" Ansatz, Tr$(M_\nu)$=0, for a prediagonal
light Majorana type neutrino mass matrix. Previously, this was studied for the
CP conserving case and the case where the two Majorana type CP violating phases
were present but the Dirac type CP violating phase was neglected. Here we
employ a simple geometric algorithm which enables us to ""solve"" the Ansatz
including all three CP violating phases. Specifically, given the known neutrino
oscillation data and an assumed two parameter (the third neutrino mass $m_3$
and the Dirac CP phase $\delta$) family of inputs we predict the neutrino
masses and Majorana CP phases. Despite the two parameter ambiguity, interesting
statements emerge.
  There is a characteristic pattern of interconnected masses and CP phases. For
large $m_3$ the three neutrinos are approximately degenerate. The only
possibility for a mass hierarchy is to have $m_3$ smaller than the other two. A
hierarchy with $m_3$ largest is not allowed.
  Small CP violation is possible only near two special values of $m_3$. Also,
the neutrinoless double beta decay parameter is approximately bounded as 0.020
eV $<|m_{ee}|<$ 0.185 eV. As a byproduct of looking at physical amplitudes we
discuss an alternative parameterization of the lepton mixing matrix which
results in simpler formulas. The physical meaning of this parameterization is
explained.
","[{""version"":""v1"",""created"":""Tue, 28 Dec 2004 21:24:33 GMT""}]","2009-11-10"
"hep-ph/0412402","Munshi Golam Mustafa Dr.","Munshi G. Mustafa","Energy Loss of Charm Quarks in the Quark-Gluon Plasma: Collisional vs
  Radiative","14 pages, 6 figures; this version is compiled with various sections
  than the earlier one along with additional discussion, one extra figure (Fig.
  3) and two new curves in Fig. 4 in support of one approximation; revised
  version accepted in Phys. Rev. C","Phys.Rev.C72:014905,2005","10.1103/PhysRevC.72.014905",,"hep-ph nucl-th",,"  Considering the collisional energy loss rates of heavy quarks from hard light
parton interactions the total energy loss of a charm quark for a static medium
has been computed. For the energy range $E\sim (5-10)$ GeV of charm quark, it
is found to be almost same order as that of radiative ones estimated to a first
order opacity expansion. The collisional energy loss will become much more
important for lower energy charm quarks and this feature could be very
interesting for phenomenology of hadrons spectra. Using such collisional energy
loss rates we estimate the momentum loss distribution employing a Fokker-Planck
equation and the total energy loss of a charm quark for an expanding
quark-gluon plasma under conditions resembling the RHIC energies. The
fractional collisional energy loss is found to be suppressed by a factor of 5
as compared to static case and does not depend linearly on the system size. We
also investigate the heavy to light hadrons $D/\pi$ ratio at moderately large
(5-10) GeV/$c$ transverse momenta and comment on its enhancement.
","[{""version"":""v1"",""created"":""Wed, 29 Dec 2004 02:43:37 GMT""},{""version"":""v2"",""created"":""Tue, 24 May 2005 08:43:45 GMT""}]","2008-11-26"
"hep-ph/0412403","Shigeki Matsumoto","Junji Hisano, Shigeki. Matsumoto, Mihoko M. Nojiri, Osamu Saito","Non-Perturbative Effect on Dark Matter Annihilation and Gamma Ray
  Signature from Galactic Center","44 pages, 25 figures, some typos in Sec.V-2 (related to fitting
  functions) corrected","Phys.Rev. D71 (2005) 063528","10.1103/PhysRevD.71.063528",,"hep-ph",,"  Detection of gamma rays from dark matter annihilation in the galactic center
is one of the feasible techniques to search for dark matter. We evaluate the
gamma ray flux in the case that the dark matter has an electroweak SU(2)_L
charge. Such dark matter is realized in the minimal supersymmetric standard
model (MSSM) when the lightest SUSY particle is the Higgsino- or Wino-like
neutralino. When the dark matter is heavy compared to the weak gauge bosons,
the leading-order calculation of the annihilation cross sections in
perturbation breaks down due to a threshold singularity. We take into account
non-perturbative effects by using the non-relativistic effective theory for the
two-body states of the dark matter and its SU(2)_L partner(s), and evaluate
precise cross sections relevant to the gamma ray fluxes. We find that the
annihilation cross sections may be enhanced by several orders of magnitude due
to resonances when the dark matter mass is larger than 1 TeV. Furthermore, the
annihilation cross sections in the MSSM may be changed by factors even when the
mass is about 500 GeV. We also discuss sensitivities to gamma ray signals from
the galactic center in the GLAST satellite detector and the large Air Cerenkov
Telescope arrays.
","[{""version"":""v1"",""created"":""Wed, 29 Dec 2004 07:43:48 GMT""},{""version"":""v2"",""created"":""Mon, 4 Jul 2005 05:59:39 GMT""}]","2009-11-10"
"hep-ph/0412404","Osamu Yasuda","Osamu Yasuda","Parameter degeneracies and new plots in neutrino oscillations","1 page, 2 figures, uses espcrc2.sty. Poster presented at 21st
  International Conference on Neutrino Physics and Astrophysics (Neutrino
  2004), Paris, France, 14-19 Jun 2004",,"10.1016/j.nuclphysbps.2005.01.193",,"hep-ph",,"  It is shown that plots of constant probabilities in the $(\sin^22\theta_{13},
1/s^2_{23})$ plane enable us to see eightfold degeneracy easily. Using this
plot, I discuss how an additional long baseline measurement resolves
degeneracies after the JPARC experiment measures the oscillation probabilities
$P(\nu_\mu\to\nu_e)$ and $P(\bar{\nu}_\mu\to\bar{\nu}_e)$ at $|\Delta
m^2_{31}|L/4E=\pi/2$.
","[{""version"":""v1"",""created"":""Wed, 29 Dec 2004 09:30:27 GMT""}]","2009-11-10"
