"nucl-th/0412110","Debades Bandyopadhyay","Sarmistha Banik, Matthias Hanauske and Debades Bandyopadhyay","Strange matter in rotating compact stars","8 pages, 4 figures; Plenary talk delivered at Strangeness in Quark
  Matter (SQM) 2004 held in Cape Town, South Africa from 15-20 September;
  Accepted for publication in the proceedings in Journal of Physics G","J.Phys. G31 (2005) S841-S848","10.1088/0954-3899/31/6/026",,"nucl-th",,"  We have constructed equations of state involving various exotic forms of
matter with large strangeness fraction such as hyperon matter, Bose-Einstein
condensates of antikaons and strange quark matter. First order phase
transitions from hadronic to antikaon condensed and quark matter are considered
here. The hadronic phase is described by the relativistic field theoretical
model. Later those equations of state are exploited to investigate models of
uniformly rotating compact stars. The effect of rotation on the third family
branch for the equation of state involving only antikaon condensates is
investigated. We also discuss the back bending phenomenon due to a first order
phase transition from $K^-$ condensed to quark matter.
","[{""version"":""v1"",""created"":""Wed, 29 Dec 2004 12:14:17 GMT""}]","2009-11-10"
"physics/0412173","Popov Alexey Y.","A. D. Piliya, A. Yu. Popov, E. N. Tregubova","Electron Bernstein waves in spherical tokamak plasmas with ""magnetic
  wells""","Proc. of 13-th Joint Workshop on ECE and ECRH, N.Novgorod, Russia May
  17-20, 2004, 8 pages, 4 figs",,"10.1088/0741-3335/47/11/011",,"physics.plasm-ph physics.gen-ph",,"  In addition to traditional regimes with monotonously increasing magnetic
field, regimes with ""magnetic wells"" also occur in spherical tokamaks (STs).
The magnetic field profile inversion modifies significantly the whole picture
of the wave propagation and damping. Since the magnetic wells may become quite
common with further improvement of ST performance, analysis of such
configurations is of interest for assessment of EBW plasma heating an CD
perspectives. In this paper the basic features of the EBWs propagation and
damping for the second cyclotron harmonic in a slab model are considered.
","[{""version"":""v1"",""created"":""Tue, 28 Dec 2004 16:05:36 GMT""}]","2015-06-26"
"physics/0412174","Liqiang Wei","Liqiang Wei","Single-Particle Green Function Approach and Correlated Atomic or
  Molecular Orbitals",,,,,"physics.chem-ph cond-mat.other cond-mat.soft physics.atm-clus",,"  In this paper, we propose a generic and systematic approach for study of the
electronic structure for atoms or molecules. In particular, we address the
issue of single particle states, or orbitals, which should be one of the most
important aspects of a quantum many-body theory. We argue that the
single-particle $\it{Green}$ function provides a most general scheme for
generating these single particle states or orbitals. We call them the
$\it{correlated}$ atomic or molecular orbitals to make a distinction from those
determined from $\it{Hartree-Fock}$ equation. We present the calculation of the
single particle properties (i.e., the electron affinities $(EA's)$ and
ionization potentials $(IP's)$) for the $H_{2}O$ molecule using the correlated
molecular orbitals in the context of quantum chemistry with a second-order self
energy. We also calculate the total ground state energy with a single $Slater$
wavefunction determined only from the hole states. Comparisons are made with
available experimental data as well as with those from the $\it{Hartree-Fock}$
or density functional theory $(DFT)$ calculations. We conclude that the
correlated atomic or molecular orbital approach provides a strictest and most
powerful method for studying the single-particle properties of atoms or
molecules. It also gives a better total energy than do the $\it{Hartree-Fock}$
and $\it{DFT}$ even at the single $\it{Slater}$ determinant level. It promises
that a correlation theory based on the correlated atomic or molecular orbitals
will become an approach which possesses the advantages and also overcomes their
shortcomings of current quantum chemistry methods based on either the
conventional quantum many-body theory or the $DFT$.
","[{""version"":""v1"",""created"":""Wed, 29 Dec 2004 02:36:39 GMT""}]","2007-05-23"
"q-bio/0412047","Radhakrishnan Nagarajan","Radhakrishnan Nagarajan, Jane E. Aubin, Charlotte A. Peterson","Modeling Genetic Networks from Clonal Analysis","59 pahes, 11 figures, 3 tables","J Theor Biol. 2004 Oct 7;230(3):359-73","10.1016/j.jtbi.2004.05.008",,"q-bio.MN q-bio.GN",,"  In this report a systematic approach is used to determine the approximate
genetic network and robust dependencies underlying differentiation. The data
considered is in the form of a binary matrix and represent the expression of
the nine genes across the ninety-nine colonies. The report is divided into two
parts: the first part identifies significant pair-wise dependencies from the
given binary matrix using linear correlation and mutual information. A new
method is proposed to determine statistically significant dependencies
estimated using the mutual information measure. In the second, a Bayesian
approach is used to obtain an approximate description (equivalence class) of
network structures. The robustness of linear correlation, mutual information
and the equivalence class of networks is investigated with perturbation and
decreasing colony number. Perturbation of the data was achieved by generating
bootstrap realizations. The results are refined with biological knowledge. It
was found that certain dependencies in the network are immune to perturbation
and decreasing colony number and may represent robust features, inherent in the
differentiation program of osteoblast progenitor cells. The methods to be
discussed are generic in nature and not restricted to the experimental paradigm
addressed in this study.
","[{""version"":""v1"",""created"":""Tue, 28 Dec 2004 20:04:54 GMT""}]","2007-05-23"
"quant-ph/0412208","Jan Perina Jr.","Jan Perina Jr., Concita Sibilia, Daniela Tricca, Mario Bertolotti","Influence of pump-field scattering to nonclassical-light generation in a
  photonic band-gap nonlinear planar waveguide","10 pages, 12 figures","Physical Review A 71, 043813 (2005)",,,"quant-ph",,"  Optical parametric process occurring in a nonlinear planar waveguide can
serve as a source of light with nonclassical properties. Properties of the
generated fields are substantially modified by scattering of the nonlinearly
interacting fields in a photonic band-gap structure inside the waveguide. A
quantum model of linear operator amplitude corrections to amplitude mean-values
provides conditions for an efficient squeezed-light generation as well as
generation of light with sub-Poissonian photon-number statistics. Destructive
influence of phase mismatch of the nonlinear interaction can fully be
compensated using a suitable photonic-band gap structure inside the waveguide.
Also an increase of signal-to-noise ratio of an incident optical field can be
reached in the waveguide.
","[{""version"":""v1"",""created"":""Tue, 28 Dec 2004 18:31:30 GMT""}]","2007-08-16"
"quant-ph/0412209","Walter Philipp","Walter Philipp, Guillaume Adenier, Salvador Barraza-Lopez, Karl Hess","Local computer model emulating the results of the Pan et al. experiment","7 pages, no figures, submitted to Physics Letters A",,,,"quant-ph",,"  It is a widespread current belief that objective local models can not explain
the quantum optics experiment of Pan et al. By presenting a model that operates
on independent computers, we show that this belief is unfounded. Three remote
computers (Alice, Bob and Claire), that never communicate with each other, send
measurement results to a fourth computer that is in charge of collecting the
data and computing correlations. The result obtained by our local simulation is
in better agreement with the ideal quantum result than the Pan et al.
experiment. We also show that the local model presented by Pan et al. that can
not explain the quantum results contains inappropriate reasoning with profound
consequences for the possible results of any local model that uses probability
theory.
","[{""version"":""v1"",""created"":""Tue, 28 Dec 2004 21:45:29 GMT""}]","2007-05-23"
"quant-ph/0412210","Michal Horodecki","Michal Horodecki","Simplifying monotonicity conditions for entanglement measures","4 pages Revtex4","Open Syst. Inf. Dyn. 12, 231 (2005)",,,"quant-ph",,"  We show that for a convex function the following, rather modest conditions,
are equivalent to monotonicity under local operations and classical
communication. The conditions are: 1)invariance under local unitaries, 2)
invariance under adding local ancilla in arbitrary state 3) on mixtures of
states possessing local orthogonal flags the function is equal to its average.
The result holds for multipartite systems. It is intriguing that the obtained
conditions are equalities. The only inequality is hidden in the condition of
convexity.
","[{""version"":""v1"",""created"":""Tue, 28 Dec 2004 22:38:01 GMT""}]","2007-05-23"
