"hep-th/0402074","Dmitry Malyshev V.","Dmitry Malyshev","Non RG logarithms via RG equations","12 pages, 2 figures, LaTeX",,,,"hep-th",,"  We compute complete leading logarithms in $\Phi^4$ theory with the help of
Connes and Kreimer RG equations. These equations are defined in the Lie algebra
dual to the Hopf algebra of graphs. The results are compared with calculations
in parquet approximation. An interpretation of the new RG equations is
discussed.
","[{""version"":""v1"",""created"":""Tue, 10 Feb 2004 02:53:44 GMT""}]","2007-05-23"
"hep-th/0402075","Sami Mohammad","Mohammad R. Garousi, M. Sami, Shinji Tsujikawa","Cosmology from Rolling Massive Scalar Field on the anti-D3 Brane of de
  Sitter Vacua","RevTex4, 15 pages, 5 eps figures, minor clarifications and few
  references added, final version to appear in PRD","Phys.Rev.D70:043536,2004","10.1103/PhysRevD.70.043536","IPM/P-2004/007","hep-th astro-ph gr-qc hep-ph",,"  We investigate a string-inspired scenario associated with a rolling massive
scalar field on D-branes and discuss its cosmological implications. In
particular, we discuss cosmological evolution of the massive scalar field on
the ant-D3 brane of KKLT vacua. Unlike the case of tachyon field, because of
the warp factor of the anti-D3 brane, it is possible to obtain the required
level of amplitude of density perturbations. We study the spectra of scalar and
tensor perturbations generated during the rolling scalar inflation and show
that our scenario satisfies the observational constraint coming from the Cosmic
Microwave Background anisotropies and other observational data. We also
implement the negative cosmological constant arising from the stabilization of
the modulus fields in the KKLT vacua and find that this leads to a successful
reheating in which the energy density of the scalar field effectively scales as
a pressureless dust. The present dark energy can be also explained in our
scenario provided that the potential energy of the massive rolling scalar does
not exactly cancel with the amplitude of the negative cosmological constant at
the potential minimum.
","[{""version"":""v1"",""created"":""Tue, 10 Feb 2004 09:22:08 GMT""},{""version"":""v2"",""created"":""Mon, 19 Apr 2004 16:33:25 GMT""},{""version"":""v3"",""created"":""Wed, 9 Jun 2004 15:31:08 GMT""}]","2014-11-18"
"hep-th/0402076","Francois Englert","Francois Englert, Laurent Houart","From brane dynamics to a Kac-Moody invariant formulation of M-theories","Latex 27 pages, 3 figures. Proceedings of the 27th John Hopkins
  workshop: Goteborg August 2003. Based on hep-th/0307024 and hep-th/0311255.
  Minor modifications in notations, references updated",,,"ULB-TH/04-02","hep-th",,"  Theories of gravity coupled to forms and dilatons may admit as solutions zero
binding energy configurations of intersecting closed extremal branes. In such
configurations, some branes may open on host closed branes. Properties of
extremal branes reveal symmetries of the underlying theory which are well known
in M-theory but transcend supersymmetry. From these properties it is possible
to reconstruct all actions, comprising in particular pure gravity in D
dimensions, the bosonic effective actions of M-theory and of the bosonic
string, which upon dimensional reduction to three dimensions are invariant
under the maximally non-compact simple simply laced Lie groups G. Moreover the
features of extremal branes suggest the existence of a much larger symmetry,
namely the `very-extended' Kac-Moody algebras G+++. This motivates the
construction of explicit non-linear realisations of all simple G+++, which
hopefully contain new degrees of freedom such as those encountered in string
theories. They are defined without a priori reference to space-time and are
proposed as substitutes for original field theoretic models of gravity, forms
and dilatons. From the G+++ invariant theories, all algebraic properties of
extremal branes are recovered from exact solutions, and there are indications
that space-time is hidden in the infinite symmetry structure. The
transformation properties of the exact solutions, which possibly induce new
solutions foreign to conventional theories, put into evidence the general
group-theoretical origin of `dualities' for all G+++. These dualities
apparently do not require an underlying string theory.
","[{""version"":""v1"",""created"":""Tue, 10 Feb 2004 11:24:00 GMT""},{""version"":""v2"",""created"":""Tue, 9 Mar 2004 13:54:52 GMT""}]","2007-05-23"
"hep-th/0402078","Kurt Lechner","Kurt Lechner","Intersecting M2- and M5-branes","11 pages, references and discussions added","Phys.Lett. B589 (2004) 147-154","10.1016/j.physletb.2004.03.056",,"hep-th",,"  If an M2-brane intersects an M5-brane the canonical Wess-Zumino action is
plagued by a Dirac-anomaly, i.e. a non-integer change of the action under a
change of Dirac-brane. We show that this anomaly can be eliminated at the
expense of a gravitational anomaly supported on the intersection manifold.
Eventually we check that the last one is cancelled by the anomaly produced by
the fermions present. This provides a quantum consistency check of these
intersecting configurations.
","[{""version"":""v1"",""created"":""Tue, 10 Feb 2004 12:15:52 GMT""},{""version"":""v2"",""created"":""Wed, 3 Mar 2004 17:05:28 GMT""},{""version"":""v3"",""created"":""Thu, 4 Mar 2004 16:57:25 GMT""}]","2015-06-26"
"hep-th/0402079","Antonio Padilla","Antonio Padilla","Ghost-free braneworld bigravity","Dedicated to the memory of Ian Kogan. Version to appear in Classical
  and Quantum Gravity","Class.Quant.Grav. 21 (2004) 2899-2918","10.1088/0264-9381/21/12/008",,"hep-th astro-ph hep-ph",,"  We consider a generalisation of the DGP model, by adding a second brane with
localised curvature, and allowing for a bulk cosmological constant and brane
tensions. We study radion and graviton fluctuations in detail, enabling us to
check for ghosts and tachyons. By tuning our parameters accordingly, we find
bigravity models that are free from ghosts and tachyons. These models will lead
to large distance modifications of gravity that could be observable in the near
future.
","[{""version"":""v1"",""created"":""Tue, 10 Feb 2004 12:48:04 GMT""},{""version"":""v2"",""created"":""Thu, 18 Mar 2004 15:37:59 GMT""},{""version"":""v3"",""created"":""Mon, 10 May 2004 10:04:42 GMT""}]","2009-11-10"
"math-ph/0402015","Vasilisa Shramchenko","Vasilisa Shramchenko","""Real doubles"" of Hurwitz Frobenius manifolds","44 pages, minor revision","Commun. Math. Phys. 256, 635-680 (2005)","10.1007/s00220-005-1321-x",,"math-ph math.MP",,"  New Frobenius structures on Hurwitz spaces are found. A Hurwitz space is
considered as a real manifold; therefore the number of coordinates is twice as
large as the number of coordinates on Hurwitzs Frobenius manifolds of Dubrovin.
Simple branch points of a ramified covering and their complex conjugates play
the role of canonical coordinates on the constructed Frobenius manifolds.
Corresponding solutions to WDVV equations and G-functions are obtained.
","[{""version"":""v1"",""created"":""Mon, 9 Feb 2004 20:57:43 GMT""},{""version"":""v2"",""created"":""Tue, 10 Feb 2004 02:56:08 GMT""},{""version"":""v3"",""created"":""Thu, 18 Mar 2004 00:32:46 GMT""},{""version"":""v4"",""created"":""Sat, 13 Nov 2004 18:21:23 GMT""}]","2009-11-10"
"math-ph/0402020","Tuncay Aktosun","Tuncay Aktosun, Vassilis G. Papanicolaou, Vassilis Zisis","Inverse scattering on the line for a generalized nonlinear Schroedinger
  equation","20 pages","Inverse Problems vol 20 (2004) 1267-1280","10.1088/0266-5611/20/4/015",,"math-ph math.MP",,"  A one-dimensional generalized nonlinear Schroedinger equation is considered,
and the corresponding inverse scattering problem is analyzed when the potential
is compactly supported and depends on the wave function. The unique recovery of
the potential is established from an appropriate set of scattering data.
","[{""version"":""v1"",""created"":""Tue, 10 Feb 2004 02:05:56 GMT""}]","2007-05-23"
"math-ph/0402021","Tuncay Aktosun","Tuncay Aktosun","Inverse scattering on the line with incomplete scattering data","11 pages, to appear in Contemporary Mathematics","Contemporary Math. vol 362, AMS, Providence, 2004, pp. 1-11",,,"math-ph math.MP",,"  The Schroedinger equation is considered on the line when the potential is
real valued, compactly supported, and square integrable. The nonuniqueness is
analyzed in the recovery of such a potential from the data consisting of the
ratio of a corresponding reflection coefficient to the transmission
coefficient. It is shown that there are a discrete number of potentials
corresponding to the data and that their L^2-norms are related to each other in
a simple manner. All those potentials are identified, and it is shown how an
additional estimate on the L^2-norm in the data can uniquely identify the
corresponding potential. The recovery is illustrated with some explicit
examples.
","[{""version"":""v1"",""created"":""Tue, 10 Feb 2004 02:27:53 GMT""}]","2007-05-23"
"math-ph/0402022","Fabian Brau","Fabian Brau and Francesco Calogero","Lower limit in semiclassical form for the number of bound states in a
  central potential","9 pages","Phys. Lett. A321, 225 (2004)","10.1016/j.physleta.2003.12.034",,"math-ph math.MP quant-ph",,"  We identify a class of potentials for which the semiclassical estimate
$N^{\text{(semi)}}=\frac{1}{\pi}\int_0^\infty dr\sqrt{-V(r)\theta[-V(r)]}$ of
the number $N$ of (S-wave) bound states provides a (rigorous) lower limit:
$N\ge {{N^{\text{(semi)}}}}$, where the double braces denote the integer part.
Higher partial waves can be included via the standard replacement of the
potential $V(r)$ with the effective $\ell$-wave potential
$V_\ell^{\text{(eff)}}(r)=V(r)+\frac{\ell(\ell+1)}{r^2}$. An analogous upper
limit is also provided for a different class of potentials, which is however
quite severely restricted.
","[{""version"":""v1"",""created"":""Tue, 10 Feb 2004 08:01:31 GMT""}]","2009-11-10"
"math-ph/0402023","Fabian Brau","Fabian Brau","On the decrease of the number of bound states with the increase of the
  angular momentum",,"Phys. Lett. A322, 67 (2004)","10.1016/j.physleta.2004.01.005",,"math-ph math.MP quant-ph",,"  For the class of central potentials possessing a finite number of bound
states and for which the second derivative of $r V(r)$ is negative, we prove,
using the supersymmetric quantum mechanics formalism, that an increase of the
angular momentum $\ell$ by one unit yields a decrease of the number of bound
states of at least one unit: $N_{\ell+1}\le N_{\ell}-1$. This property is used
to obtain, for this class of potential, an upper limit on the total number of
bound states which significantly improves previously known results.
","[{""version"":""v1"",""created"":""Tue, 10 Feb 2004 08:06:17 GMT""}]","2009-11-10"
"math-ph/0402024","Simone Calogero","Hakan Andreasson, Simone Calogero, Reinhard Illner","On Blowup for Gain-Term-Only classical and relativistic Boltzmann
  equations","10 pages, 2 figures","Math. Meth. Appl. Sci. 27, 2231--2240 (2004)",,,"math-ph math.MP",,"  We show that deletion of the loss part of the collision term in all
physically relevant versions of the Boltzmann equation, including the
relativistic case, will in general lead to blowup in finite time of a solution
and hence prevent global existence. Our result corrects an error in the proof
given in Ref. [12], where the result was announced for the classical hard
sphere case; here we give a simpler proof which applies much more generally.
","[{""version"":""v1"",""created"":""Tue, 10 Feb 2004 10:38:33 GMT""}]","2011-11-09"
"math-ph/0402025","Jonathan M. Robbins","JM Robbins and M Zyskin","Classification of unit-vector fields in convex polyhedra with tangent
  boundary conditions","21 pages, 2 figures","J.Phys. A37 (2004) 10609-10624; Erratum-ibid. A38 (2005) 7597","10.1088/0305-4470/37/44/010",,"math-ph hep-th math.MP",,"  A unit-vector field n on a convex three-dimensional polyhedron P is tangent
if, on the faces of P, n is tangent to the faces. A homotopy classification of
tangent unit-vector fields continuous away from the vertices of P is given. The
classification is determined by certain invariants, namely edge orientations
(values of n on the edges of P), kink numbers (relative winding numbers of n
between edges on the faces of P), and wrapping numbers (relative degrees of n
on surfaces separating the vertices of P), which are subject to certain sum
rules. Another invariant, the trapped area, is expressed in terms of these. One
motivation for this study comes from liquid crystal physics; tangent
unit-vector fields describe the orientation of liquid crystals in certain
polyhedral cells.
","[{""version"":""v1"",""created"":""Tue, 10 Feb 2004 13:21:01 GMT""}]","2009-11-10"
"math/0402131","Jacob Rasmussen","Jacob A. Rasmussen","Khovanov homology and the slice genus","20 pages, 8 figures",,,,"math.GT math.QA",,"  We use Lee's work on the Khovanov homology to define a knot invariant s. We
show that s(K) is a concordance invariant and that it provides a lower bound
for the slice genus of K. As a corollary, we give a purely combinatorial proof
of the Milnor conjecture.
","[{""version"":""v1"",""created"":""Mon, 9 Feb 2004 18:23:36 GMT""}]","2007-05-23"
"math/0402141","J\'anos Koll\'ar","J\'anos Koll\'ar","Einstein metrics on connected sums of $S^2\times S^3$",,,,,"math.DG math.AG",,"  The aim of this paper is to construct infinitely many families of Einstein
metrics on the connected sums of arbitrary number of copies of $S^2\times S^3$.
We realize these 5-manifolds as total spaces of Seifert bundles over Del Pezzo
orbifolds. A K\""ahler--Einstein metric on the Del Pezzo orbifold is then lifted
to an Einstein metric using the Kobayashi--Boyer--Galicki method.
","[{""version"":""v1"",""created"":""Mon, 9 Feb 2004 16:16:10 GMT""}]","2007-05-23"
"math/0402142","Mario Listing","Mario Listing","Scalar curvature rigidity of almost Hermitian spin manifolds which are
  asymptotically complex hyperbolic","8 pages. submitted to Comm. Anal. Geom",,,,"math.DG",,"  This paper generalizes a rigidity result of complex hyperbolic spaces by M.
Herzlich. We prove that an almost Hermitian spin manifold $(M,g)$ of real
dimension $4n+2$ which is strongly asymptotic to $\hyp{\C}^{2n+1}$ and
satisfies a certain scalar curvature bound must be isometric to the complex
hyperbolic space. The fact that we do not assume $g$ to be K\""ahler reflects in
the inequality for the scalar curvature.
","[{""version"":""v1"",""created"":""Mon, 9 Feb 2004 16:35:34 GMT""},{""version"":""v2"",""created"":""Mon, 26 Apr 2004 17:37:08 GMT""}]","2007-05-23"
"math/0402143","Thomas J. Haines","Ulrich Goertz and Thomas J. Haines","The Jordan-Hoelder series for nearby cycles on some Shimura varieties
  and affine flag varieties","71 pp",,,,"math.AG math.RT",,"  We study the Jordan-Hoelder series for nearby cycles on certain Shimura
varieties and Rapoport-Zink local models, and on finite-dimensional pieces of
Beilinson's deformation of the affine Grassmannian to the affine flag variety
(and their p-adic analogues). We give a formula for the multiplicities of
irreducible constituents in terms of certain cohomology groups, and we also
provide an algorithm to compute multiplicities, in terms of the affine Hecke
algebra.
","[{""version"":""v1"",""created"":""Mon, 9 Feb 2004 16:36:26 GMT""}]","2007-05-23"
"math/0402144","Chazottes","J.-R. Chazottes, L. Ramirez, E. Ugalde","Finite type approximations of Gibbs measures on sofic subshifts","18 pages, no figures","Nonlinearity 18 , 445-463 (2005)","10.1088/0951-7715/18/1/023",,"math.DS",,"  Consider a H\""older continuous potential $\phi$ defined on the full shift
$A^\nn$, where $A$ is a finite alphabet. Let $X\subset A^\nn$ be a specified
sofic subshift. It is well-known that there is a unique Gibbs measure
$\mu_\phi$ on $X$ associated to $\phi$. Besides, there is a natural nested
sequence of subshifts of finite type $(X_m)$ converging to the sofic subshift
$X$. To this sequence we can associate a sequence of Gibbs measures
$(\mu_{\phi}^m)$. In this paper, we prove that these measures weakly converge
at exponential speed to $\mu_\phi$ (in the classical distance metrizing weak
topology). We also establish a strong mixing property (ensuring weak
Bernoullicity) of $\mu_\phi$. Finally, we prove that the measure-theoretic
entropy of $\mu_\phi^m$ converges to the one of $\mu_\phi$ exponentially fast.
We indicate how to extend our results to more general subshifts and potentials.
We stress that we use basic algebraic tools (contractive properties of iterated
matrices) and symbolic dynamics.
","[{""version"":""v1"",""created"":""Mon, 9 Feb 2004 17:05:06 GMT""}]","2009-11-10"
"math/0402145","Christian Kassel","Eli Aljadeff, Christian Kassel","Norm formulas for finite groups and induction from elementary abelian
  subgroups","31 pages. In Section 1 a universal ring and the proof of the
  existence of formulas for any finite group were added","Journal of Algebra 303 (2006), 677-706",,"IRMA 2004/004","math.RA math.GR",,"  It is known that the norm map N_G for a finite group G acting on a ring R is
surjective if and only if for every elementary abelian subgroup E of G the norm
map N_E for E is surjective. Equivalently, there exists an element x_G in R
with N_G(x_G) = 1 if and only for every elementary abelian subgroup E there
exists an element x_E in R such that N_E(x_E) = 1. When the ring R is
noncommutative, it is an open problem to find an explicit formula for x_G in
terms of the elements x_E. In this paper we present a method to solve this
problem for an arbitrary group G and an arbitrary group action on a ring.Using
this method, we obtain a complete solution of the problem for the quaternion
and the dihedral 2-groups,and for a group of order 27. We also show how to
reduce the problem to the class of (almost) extraspecial p-groups.
","[{""version"":""v1"",""created"":""Mon, 9 Feb 2004 17:21:47 GMT""},{""version"":""v2"",""created"":""Thu, 21 Apr 2005 16:16:41 GMT""}]","2010-03-25"
"math/0402146","Sam Payne","Sam Payne","Fujita's very ampleness conjecture for singular toric varieties","15 pages. v2: minor revisions, updated references, added appendix
  with proof of Fujino's Theorem. v3: minor changes, final version, to appear
  in Tohoku Math. J","Tohoku Math. J. (2) 58 (2006), no. 3, 447--459.",,,"math.AG math.CO",,"  We present a self-contained combinatorial approach to Fujita's conjectures in
the toric case. Our main new result is a generalization of Fujita's very
ampleness conjecture for toric varieties with arbitrary singularities. In an
appendix, we use similar methods to give a new proof of an analogous toric
generalization of Fujita's freeness conjecture due to Fujino.
","[{""version"":""v1"",""created"":""Mon, 9 Feb 2004 19:38:12 GMT""},{""version"":""v2"",""created"":""Fri, 26 Mar 2004 17:20:12 GMT""},{""version"":""v3"",""created"":""Tue, 28 Jun 2005 13:47:22 GMT""}]","2007-06-23"
"math/0402147","John W. Milnor","John W. Milnor","On Latt\`es Maps","TeX with 10 PostScript figures",,,"Stony Brook IMS Preprint #2004/01","math.DS math.CV",,"  An exposition of the 1918 paper of Latt\`es, together with its historical
antecedents, and its modern formulations and applications.
","[{""version"":""v1"",""created"":""Mon, 9 Feb 2004 20:36:15 GMT""},{""version"":""v2"",""created"":""Wed, 22 Sep 2004 20:48:37 GMT""}]","2007-05-23"
"math/0402148","Matthias Beck","M. Beck, J. A. De Loera, M. Develin, J. Pfeifle, and R. P. Stanley","Coefficients and Roots of Ehrhart Polynomials","24 pages, 7 figures","Cont. Math. 374 (2005), 15-36",,"AIM 2004-1","math.CO",,"  The Ehrhart polynomial of a convex lattice polytope counts integer points in
integral dilates of the polytope. We present new linear inequalities satisfied
by the coefficients of Ehrhart polynomials and relate them to known
inequalities. We also investigate the roots of Ehrhart polynomials. We prove
that for fixed d, there exists a bounded region of C containing all roots of
Ehrhart polynomials of d-polytopes, and that all real roots of these
polynomials lie in [-d, [d/2]). In contrast, we prove that when the dimension d
is not fixed the positive real roots can be arbitrarily large. We finish with
an experimental investigation of the Ehrhart polynomials of cyclic polytopes
and 0/1-polytopes.
","[{""version"":""v1"",""created"":""Mon, 9 Feb 2004 21:15:12 GMT""}]","2007-05-23"
"math/0402149","Yong-Geun Oh","Yong-Geun Oh","Length minimizing property, Conley-Zehnder index and $C^1$-perturbations
  of Hamiltonian functions","30 pages",,,,"math.SG math.DS",,"  The main purpose of this paper is to study the length minimizing property of
Hamiltonian paths on closed symplectic manifolds $(M,\omega)$ such that there
are no spherical homology class $A \in H_2(M)$ with $$ \omega(A) > 0 \quad
\text{and} \quad -n \leq c_1(A) < 0, $$ which we call {\it very strongly
semi-positive}. We introduce the notion of {\it positively $\mu$-undertwisted}
Hamiltonian paths and prove that any positively undertwisted quasi-autonomous
Hamiltonian path is length minimizing in its homotopy class as long as it has a
fixed maximum and a fixed minimum point that are generically under-twisted.
This class of Hamiltonian can have non-constant large periodic orbits. The
proof uses the chain level Floer theory, spectral invariants of Hamiltonian
diffeomorphisms and the argument involving the thick and thin decomposition of
Floer's moduli space of perturbed Cauchy-Riemann equation. And then based on
this theorem and some closedness of length minimizing property, we relate the
Minimality Conjecture on the very strongly semi-positive symplectic manifolds
to a $C^1$-perturbation problem of Hamiltonian functions on general symplectic
manifolds, which we also formulate here.
","[{""version"":""v1"",""created"":""Tue, 10 Feb 2004 00:20:42 GMT""}]","2007-05-23"
"math/0402150","Miguel Carri\'on \'Alvarez","Miguel Carrion-Alvarez","Variations on a theme of Gelfand and Naimark","LaTeX, 19 pages, no figures, uses packages xypic and amssymb",,,,"math.FA math-ph math.CT math.MP",,"  C*-algebras are widely used in mathematical physics to represent the
observables of physical systems, and are sometimes taken as the starting point
for rigorous formulations of quantum mechanics and classical statistical
mechanics. Nevertheless, in many cases the naive choice of an algebra of
observables does not admit a C*-algebra structure, and some massaging is
necessary. In this paper we investigate what properties of C*-algebras carry
over to more general algebras and what modifications of the Gelfand theory of
normed algebras are necessary. We use category theory as a guide and, by
replacing the ordinary definition of the Gelfand spectrum with a manifestly
functorial definition, we succeed in generalizing the Gelfand-Naimark theorem
to locally convex *-algebras. We also recall a little-known but potentially
very useful generalization of the Stone-Weierstrass theorem to completely
regular, Hausdorff spaces.
","[{""version"":""v1"",""created"":""Tue, 10 Feb 2004 00:25:03 GMT""}]","2007-05-23"
"math/0402151","Kornel Szlachanyi","Kornel Szlachanyi","The double algebraic view of finite quantum groupoids","48 pages, AMS-Latex","J. Algebra 280 (2004) 249-294",,,"math.QA math-ph math.MP",,"  This is an introduction to double algebras which is the structure modelled by
the properties of the convolution product in Hopf algebras, weak Hopf algebras
and in Hopf algebroids. We show that Hopf algebroids with a Frobenius integral
can be characterized as the double algebras in which the two multiplications
satisfy distributivity. We discuss questions of duality, antipode, Maschke
theorem and examples.
","[{""version"":""v1"",""created"":""Tue, 10 Feb 2004 03:19:45 GMT""},{""version"":""v2"",""created"":""Tue, 9 Nov 2004 15:18:41 GMT""}]","2007-05-23"
"math/0402152","Jun-Ichi Okuda","Jun-ichi Okuda and Yoshihiro Takeyama","On relations for the $q$-multiple zeta values","16 pages",,,,"math.QA math.NT",,"  We prove some relations for the $q$-multiple zeta values ($q$MZV). They are
$q$-analogues of the cyclic sum formula, the Ohno relation and the Ohno-Zagier
relation for the multiple zeta values (MZV). We discuss the problem to
determine the dimension of the space spanned by $q$MZV's over $\Q$, and present
an application to MZV.
","[{""version"":""v1"",""created"":""Tue, 10 Feb 2004 05:19:32 GMT""},{""version"":""v2"",""created"":""Fri, 14 Jan 2005 11:16:56 GMT""}]","2007-05-23"
"math/0402153","Anna Pratoussevitch","Anna Pratoussevitch","Traces in Complex Hyperbolic Triangle Groups","22 pages, 1 figure; prop. 11 added, typos corrected; cor. 19 removed
  (not correct)","Geom. Dedicata 111 (2005), 159-185.",,,"math.DG",,"  We present several formulas for the traces of elements in complex hyperbolic
triangle groups generated by complex reflections.
  The space of such groups of fixed signature is of real dimension one. We
parameterise this space by a real invariant alpha of triangles in the complex
hyperbolic plane. The main result of the paper is a formula, which expresses
the trace of an element of the group as a Laurent polynomial in exp(i alpha)
with coefficients independent of alpha and computable using a certain
combinatorial winding number. We also give a recursion formula for these
Laurent polynomials and generalise the trace formulas for the groups generated
by complex mu-reflections.
  We apply these formulas to prove some discreteness and some non-discreteness
results for complex hyperbolic triangle groups.
","[{""version"":""v1"",""created"":""Tue, 10 Feb 2004 10:49:11 GMT""},{""version"":""v2"",""created"":""Fri, 20 Feb 2004 14:08:52 GMT""},{""version"":""v3"",""created"":""Mon, 21 Jun 2004 12:56:31 GMT""}]","2009-05-15"
