"astro-ph/0402200","Hans-Thomas Janka","Hans-Thomas Janka","Neutron Star Formation and Birth Properties","10 pages, 4 figures, high-quality available upon request; to appear
  in ""Young Neutron Stars and Their Environments"" (IAU Symposium 218, ASP
  Conference Proceedings), eds. F. Camilo and B.M. Gaensler",,,"P-MPA1612e","astro-ph",,"  Our current knowledge of neutron star formation, progenitors, and natal
masses, spins, magnetic fields, and space velocities is briefly reviewed from a
theorist's perspective. More observational information is badly needed to
constrain theoretical possibilities.
","[{""version"":""v1"",""created"":""Mon, 9 Feb 2004 17:14:41 GMT""}]","2007-05-23"
"astro-ph/0402201","Ennio Poretti","Ennio Poretti and Marco Beltrame","The use of Petersen diagrams and period ratios in investigating the
  pulsational content of stars in the classical Instability Strip","Invited review presented at the MinySymposium ``Asteroseeismology and
  Stellar Evolution"", JENAM, Budapest, 25-30 August 2003 -- To be published in
  Communications in Asteroseismology Series, 2004",,"10.1553/cia145s53",,"astro-ph",,"  The aspects of the analysis of photometric time-series obtained on
double-mode or multiperiodic pulsating stars are briefly reviewed. In
particular, the ratios between frequencies are used to pin cases revealing
peculiarities. In addition to the Petersen diagrams, we also demonstrated that
the period ratios can detect interesting objects. In particular, new results
are obtained on High--Amplitude Delta Scuti contained in the OGLE-II database.
","[{""version"":""v1"",""created"":""Mon, 9 Feb 2004 17:33:53 GMT""}]","2009-11-10"
"astro-ph/0402202","Olivier Ilbert","O. Ilbert, L. Tresse, S. Arnouts, E. Zucca, S. Bardelli, G. Zamorani,
  C. Adami, A. Cappi, B. Garilli, O. Le Fevre, D. Maccagni, B. Meneux, R.
  Scaramella, M. Scodeggio, G. Vettolani, A. Zanichelli","Bias in the Estimation of Global Luminosity Functions","13 pages, 8 figures, 1 table, accepted for publication in MNRAS","Mon.Not.Roy.Astron.Soc. 351 (2004) 541","10.1111/j.1365-2966.2004.07796.x",,"astro-ph",,"  We discuss a bias present in the calculation of the global luminosity
function
  (LF) which occurs when analysing faint galaxy samples. This effect exists
because of the different spectral energy distributions of galaxies, which are
in turn quantified by the k-corrections. We demonstrate that this bias occurs
because not all galaxy types are visible in the same absolute magnitude range
at a given redshift and it mainly arises at high redshift since it is related
to large k-corrections. We use realistic simulations with observed LFs to
investigate the amplitude of the bias. We also compare our results to the
global LFs derived from Hubble Deep Field-North and -South (HDF) surveys. We
conclude that, as expected, there is no bias in the global LF measured in the
absolute magnitude range where all galaxy types are observable. Beyond this
range the faint-end slope of the global LF can be over/under-estimated
depending on the adopted LF estimator. The effect is larger when the reference
filter in which the global LF is measured, is far from the rest-frame filter in
which galaxies are selected. The fact that LF estimators are differently
affected by this bias implies that the bias is minimal when the different LF
estimators give measurements consistent with one another at the faint-end. For
instance, we show that the estimators are discrepant in the same way both in
the simulated and HDF LFs. This suggests that the HDF LFs are affected by the
presently studied bias. The best solution to avoid this bias is to derive the
global LF in the reference filter closest to the rest-frame selection filter.
","[{""version"":""v1"",""created"":""Mon, 9 Feb 2004 18:38:54 GMT""}]","2016-08-30"
"astro-ph/0402203","Olivier Le Fevre","O. Le F\`evre, G. Vettolani, D. Maccagni, J.P. Picat, and the VVDS
  team","VVDS: early results on LSS distribution to z~1.5","8 pages, 6 figures, to appear in the Proceedings of the ESO/USM/MPE
  Workshop on ""Multiwavelength Mapping of Galaxy Formation and Evolution"", eds.
  R. Bender and A. Renzini",,,,"astro-ph",,"  The VIMOS VLT Deep Survey (VVDS) is an on-going program to map the evolution
of galaxies, large scale structures and AGNs from the redshift measurement of
more than 100000 objects down to a magnitude I_{AB}=24, in combination with a
multi-wavelength dataset from radio to X-rays. We present here the first
results obtained from more than 20000 spectra. Dedicated effort has been
invested to successfuly enter the ``redshift desert'' 1.5<z<3, by producing
high S/N galaxy templates in the rest wavelength domain probed by VIMOS. We
have produced the luminosity function (LF) of galaxies for the first time out
to I_{AB}=24, and the evolution of the LF for each morphological type is
clearly established, indicating that most of the LF evolution is concentrated
in the later types. We present for the first time the 3D spatial distribution
of a well controlled sample of faint galaxies, and show that significant
clustering is detected out to z~1.5
","[{""version"":""v1"",""created"":""Mon, 9 Feb 2004 19:13:06 GMT""}]","2007-05-23"
"astro-ph/0402204","Sharon Toolan","William B. Sparks, Megan Donahue, Andres Jordan, Laura Ferrarese,
  Patrick Cote","X-ray and Optical Filaments in M87","18 pages, 6 figures, 2 tables","Astrophys.J. 607 (2004) 294-301","10.1086/383189",,"astro-ph",,"  We compare a very deep X-ray image of M87, at the center of the Virgo
Cluster, to high-quality optical images of the low excitation emission-line gas
in the same region. There are striking coincidences of detail between the two.
We explore the possiblity that this represents a thermal interaction between
hot gas at 10^7 K and warm gas at 10^4 K. We find two temperatures are present
in the X-ray gas, with the lower more prevelant in the vicinity of the optical
filaments. Electron conduction from the hot phase to the cooler one provides a
quantitatively acceptable energy source for the optical filaments, and we show
additionally that it can do so for the brightest X-ray cluster, Perseus. If
operative, conduction in the presence of gas-rich galaxy mergers, may explain
the presence of ""cool cores"" in clusters of galaxies.
","[{""version"":""v1"",""created"":""Mon, 9 Feb 2004 19:24:11 GMT""}]","2009-11-10"
"astro-ph/0402205","Misty Bentz","Misty C. Bentz (Ohio State U.), Patrick B. Hall (Princeton), Patrick
  S. Osmer (Ohio State U.)","Nitrogen Enriched Quasars in the Sloan Digital Sky Survey First Data
  Release","Submitted to AJ - final refereed version; 18 pages, 5 figures, 3
  tables",,"10.1086/422346",,"astro-ph",,"  The quasar Q0353-383 has long been known to have extremely strong nitrogen
intercombination lines at 1486 and 1750 Angstroms, implying an anomalously high
nitrogen abundance of ~15 times solar. A search for similar nitrogen-rich
quasars in the Sloan Digital Sky Survey First Data Release catalog has yielded
20 candidates, including four with nitrogen emission as strong or stronger than
that seen in Q0353-383. Our results indicate that only about 1 in 1700 of
quasars have nitrogen abundances similar to Q0353-383, while up to 1 in 130 may
be in the process of extreme nitrogen enrichment.
","[{""version"":""v1"",""created"":""Mon, 9 Feb 2004 21:25:40 GMT""},{""version"":""v2"",""created"":""Wed, 12 May 2004 20:24:00 GMT""}]","2009-11-10"
"astro-ph/0402206","Woong-Tae Kim","Ramesh Narayan (1) and Woong-Tae Kim (1,2) ((1) Harvard-Smithsonian
  CfA, (2) Seoul National University, Korea)","Conduction and Turbulent Mixing in Galaxy Clusters","8 pages, 4 figures, to appear in the proceedings of the 6th RESCEU
  International Symposium ""Frontier in Astroparticle Physics and Cosmology""
  (4-7 Nov. 2003, Tokyo)",,,,"astro-ph",,"  We discuss hydrostatic models of galaxy clusters in which heat diffusion
balances radiative cooling. We consider two different sources of diffusion,
thermal conduction and turbulent mixing, parameterized by dimensionless
coefficients, f and alpha_mix, respectively. Models with thermal conduction
give reasonably good fits to the density and temperature profiles of several
cooling flow clusters, but some clusters require unphysically large values of
f>1. Models with turbulent mixing give good fits to all clusters, with
reasonable values of alpha_mix ~ 0.01-0.03. Both types of models are found to
be essentially stable to thermal perturbations. The mixing model reproduces the
observed scalings of various cluster properties with temperature, and also
explains the entropy floor seen in galaxy groups.
","[{""version"":""v1"",""created"":""Mon, 9 Feb 2004 22:02:37 GMT""}]","2007-05-23"
"astro-ph/0402207","Miriam Garcia","Miriam Garcia and Luciana Bianchi","The Effective Temperatures of Hot Stars II. The Early-O Types","Accepted for publication in The Astrophysical Journal. 38 pages
  (including 9 figures and 4 tables)","Astrophys.J. 606 (2004) 497-513","10.1086/383002",,"astro-ph",,"  We derive the stellar parameters of a sample of Galactic early-O type stars
by analysing their UV and Far-UV spectra from FUSE (905-1187A), IUE, HST-STIS
and ORFEUS (1200-2000A). The data have been modeled with spherical,
hydrodynamic, line-blanketed, non-LTE synthetic spectra computed with the
WM-basic code. We obtain effective temperatures ranging from Teff = 41,000 K to
39,000 K for the O3-O4 dwarf stars, and Teff = 37,500 K for the only supergiant
of the sample (O4 If+). Our values are lower than those from previous empirical
calibrations for early-O types by up to 20%. The derived luminosities of the
dwarf stars are also lower by 6 to 12%; however, the luminosity of the
supergiant is in agreement with previous calibrations within the error bars.
Our results extend the trend found for later-O types in a previous work by
Bianchi & Garcia.
","[{""version"":""v1"",""created"":""Mon, 9 Feb 2004 23:12:46 GMT""}]","2009-11-10"
"astro-ph/0402208","Yun Wang","Yun Wang, and Katherine Freese","Probing Dark Energy Using Its Density Instead of Its Equation of State","One color figure showing w_X(z) versus rho_X(z), reconstructed
  model-independently from data. Submitted","Phys.Lett. B632 (2006) 449-452","10.1016/j.physletb.2005.10.083",,"astro-ph hep-ph",,"  The variation of dark energy density with redshift, $\rho_X(z)$, provides a
critical clue to the nature of dark energy. Since $\rho_X(z)$ depends on the
dark energy equation of state $w_X(z)$ through an integral, $\rho_X(z)$ can be
constrained more tightly than $w_X(z)$ given the same observational data. We
demonstrate this explicitly using current type Ia supernova (SN Ia) data [the
Tonry/Barris sample], together with the Cosmic Microwave Background (CMB) shift
parameter from CMB data (WMAP, CBI, and ACBAR), and the large scale structure
(LSS) growth factor from 2dF galaxy survey data. We assume a flat universe, and
use Markov Chain Monte Carlo (MCMC) technique in our analysis. We find that,
while $w_X(z)$ extracted from current data is consistent with a cosmological
constant at 68% C.L., $\rho_X(z)$ (which has far smaller uncertainties) is not.
Our results clearly show the advantage of using $\rho_X(z)$, instead of
$w_X(z)$, to probe dark energy.
","[{""version"":""v1"",""created"":""Mon, 9 Feb 2004 23:50:43 GMT""}]","2009-11-10"
"astro-ph/0402209","Scot Kleinman","S. J. Kleinman, Hugh C. Harris, Daniel J. Eisenstein, James Liebert,
  Atsuko Nitta, Jurek Krzesi\'nski, Jeffrey A. Munn, Conard C. Dahn, Suzanne L.
  Hawley, Jeffrey R. Pier, Gary Schmidt, Nicole M. Silvestri, J. Allyn Smith,
  Paula Szkody, Michael A. Strauss, G. R. Knapp, Matthew J. Collinge, A. S.
  Mukadam, D. Koester, Alan Uomoto, D. J. Schlegel, Scott F. Anderson, J.
  Brinkmann, D. Q. Lamb, Donald P. Schneider, and Donald G. York","A Catalog of Spectroscopically Identified White Dwarf Stars in the First
  Data Release of the Sloan Digital Sky Survey","To be published ApJ, 20May04. 52 pages, 13 figures, 12 tables. Full
  tables are available at the (now-corrected) SDSS DR1 Value-added catalog at
  http://www.sdss.org/dr1/products/value_added/index.html","Astrophys.J. 607 (2004) 426-444","10.1086/383464",,"astro-ph",,"  We present the full spectroscopic white dwarf and hot subdwarf sample from
the SDSS first data release, DR1. We find 2551 white dwarf stars of various
types, 240 hot subdwarf stars, and an additional 144 objects we have identified
as uncertain white dwarf stars. Of the white dwarf stars, 1888 are non-magnetic
DA types and 171, non-magnetic DBs. The remaining (492) objects consist of all
different types of white dwarf stars: DO, DQ, DC, DH, DZ, hybrid stars like
DAB, etc., and those with non-degenerate companions. We fit the DA and DB
spectra with a grid of models to determine the Teff and log(g) for each object.
For all objects, we provide coordinates, proper motions, SDSS photometric
magnitudes, and enough information to retrieve the spectrum/image from the SDSS
public database. This catalog nearly doubles the known sample of
spectroscopically-identified white dwarf stars. In the DR1 imaged area of the
sky, we increase the known sample of white dwarf stars by a factor of 8.5. We
also comment on several particularly interesting objects in this sample.
","[{""version"":""v1"",""created"":""Tue, 10 Feb 2004 01:42:26 GMT""},{""version"":""v2"",""created"":""Thu, 12 Feb 2004 23:07:20 GMT""}]","2016-08-16"
"astro-ph/0402210","Michael Kuhlen","M. Kuhlen (1), L.E. Strigari (2), A.R. Zentner (3,4), J.S. Bullock
  (5,6), & Joel R. Primack (1) ((1) UC Santa Cruz, (2) Ohio State U., (3) CfCP,
  (4) U. Chicago, (5) Harvard, CfA, (6) Hubble Fellow)","Dark Energy and Dark Matter Halos","16 p., 11 fig.; replaced with revised version, accepted for
  publication in MNRAS; corrected error (w=-1.5 halo mass function now agrees
  with Jenkins et al. fitting formula), rewrote several sections, added
  references","Mon.Not.Roy.Astron.Soc.357:387-400,2005","10.1111/j.1365-2966.2005.08663.x/abs/",,"astro-ph",,"  We investigate the effect of dark energy on the density profiles of dark
matter haloes with a suite of cosmological N-body simulations and use our
results to test analytic models. We consider constant equation of state models,
and allow both w>-1 and w<-1. Using five simulations with w ranging from -1.5
to -0.5, and with more than ~1600 well-resolved haloes each, we show that the
halo concentration model of Bullock et al. (2001) accurately predicts the
median concentrations of haloes over the range of w, halo masses, and redshifts
that we are capable of probing. We find that the Bullock et al. (2001) model
works best when halo masses and concentrations are defined relative to an outer
radius set by a cosmology-dependent virial overdensity. For a fixed power
spectrum normalization and fixed-mass haloes, larger values of w lead to higher
concentrations and higher halo central densities, both because collapse occurs
earlier and because haloes have higher virial densities. While precise
predictions of halo densities are quite sensitive to various uncertainties, we
make broad comparisons to galaxy rotation curve data. At fixed power spectrum
normalization (fixed sigma_8), w>-1 quintessence models seem to exacerbate the
central density problem relative to the standard w=-1 model. Meanwhile w<-1
models help to reduce the apparent discrepancy. We confirm that the Jenkins et
al. (2001) halo mass function provides an excellent approximation to the
abundance of haloes in our simulations and extend its region of validity to
include models with w<-1.
","[{""version"":""v1"",""created"":""Tue, 10 Feb 2004 01:57:11 GMT""},{""version"":""v2"",""created"":""Tue, 23 Nov 2004 23:00:25 GMT""}]","2010-12-09"
"astro-ph/0402212","Valery Terebizh","V.Yu.Terebizh","A Wide-Field Corrector at the Prime Focus of a Ritchey-Chretien
  Telescope","16 pages in PDF, including 6 figures and 5 tables","Astron.Lett. 30 (2004) 200-208; Pisma Astron.Zh. 30 (2004) 231-240","10.1134/1.1667867",,"astro-ph",,"  We propose a form of a lens corrector at the prime focus of a hyperboloidal
mirror that provides a flat field of view up to 3 deg diameter at image quality
D_{80} < 0.8 arcsec in integrated (0.32-1.10 mcm) light. The corrector consists
of five lenses made of fused silica. Only spherical surfaces are used, so the
system is capable of achieving better images, if necessary, by aspherizing the
surfaces. The optical system of the corrector is stable in the sense that its
principal features are retained when optimized after significant perturbations
of its parameters. As an example, three versions of the corrector are designed
for the V.M.Blanco 4-m telescope at Cerro Tololo Inter-American Observatory
with 2.12 deg, 2.4 deg, and 3.0 deg fields of view.
","[{""version"":""v1"",""created"":""Tue, 10 Feb 2004 04:57:18 GMT""}]","2014-10-13"
"astro-ph/0402213","Dimitrios Psaltis","Dimitrios Psaltis (University of Arizona)","Measurements of Black Hole Spins and Tests of Strong-Field General
  Relativity","7 pages; to appear in X-Ray Timing 2003: Rossi and Beyond, ed. P.
  Kaaret, F. K. Lamb, & J. H. Swank",,"10.1063/1.1780994",,"astro-ph",,"  Fast variability studies of accreting black holes in the Galaxy offer us a
unique opportunity to measure the spins of black holes and test the
strong-field behavior of general relativity. In this review, I summarize the
arguments often used in attempts of measuring the spins of black holes,
concentrating on their theoretical foundations. I also argue that X-ray studies
of accreting black holes will be able to provide in the future strong
constraints on deviations from general relativity in the strong-field regime.
","[{""version"":""v1"",""created"":""Tue, 10 Feb 2004 05:01:17 GMT""}]","2009-11-10"
"astro-ph/0402214","Akiko Kawachi","A. Kawachi, T. Naito, J.R. Patterson, P.G. Edwards, CANGAROO-II
  Collaboration","A Search for TeV Gamma-ray Emission from the PSR B1259-63/SS2883 Binary
  System with the CANGAROO-II 10-m Telescope","29 pages, 10 figures, accepted by ApJ","Astrophys.J. 607 (2004) 949-958","10.1086/383604",,"astro-ph",,"  Observations of the PSR B1259-63/SS2883 binary system using the CANGAROO-II
Cherenkov telescope are reported. This nearby binary consists of a 48msec radio
pulsar in a highly eccentric orbit around a Be star, and offers a unique
laboratory to investigate the interactions between the outflows of the pulsar
and Be star at various distances. It has been pointed out that the relativistic
pulsar wind and the dense mass outflow of the Be star may result in the
emission of gamma rays up to TeV energies. We have observed the binary in 2000
and 2001, 47 and 157 days after the October 2000 periastron. Upper limits at
the 0.13--0.54 Crab level are obtained. A new model calculation for high-energy
gamma-ray emission from the Be star outflow is introduced and the estimated
gamma-ray flux considering Bremsstrahlung, inverse Compton scattering, and the
decay of neutral pions produced in proton-proton interactions, is found to be
comparable to the upper limits of these observations. Comparing our results
with these model calculations, the mass-outflow parameters of the Be star are
constrained.
","[{""version"":""v1"",""created"":""Tue, 10 Feb 2004 06:30:45 GMT""},{""version"":""v2"",""created"":""Mon, 15 Mar 2004 04:50:40 GMT""}]","2009-11-10"
"astro-ph/0402215","Nanda Rea","Nanda Rea (Univ.Roma2/INAF-OAR), Gian Luca Israel (INAF-OAR), Tiziana
  Di Salvo (Univ.Palermo/UvA), Luciano Burderi (INAF-OAR), Gabriele Cocozza
  (Univ.Roma2)","Timing and spectral changes of the Be X-ray transient EXO 0531-6609.2
  through high and low state","6 pages, 8 figures, A&A","Astron.Astrophys. 421 (2004) 235-239","10.1051/0004-6361:20035685",,"astro-ph",,"  We report on spectral and timing analysis of BeppoSAX data of the 13.6 s
period transient X-ray pulsar EXO 0531-6609.2. Observations were carried out in
March 1997 and October 1998, catching the source during a high and a low
emission state, respectively. Correspondingly, the X-ray luminosity is found at
a level of 4.2x10^37 erg/s and 1.5x10^36 erg/s in the two states. In the high
state the X-ray emission in the energy range 1-100 keV is well fitted by an
absorbed power-law with photon index Gamma ~1.7 plus a blackbody component with
a characteristic temperature of ~3.5 keV. Moreover, we find an evidence of an
iron emission at ~6.8 keV, typical feature in this class of sources but never
revealed before in the EXO 0531-6609.2 spectrum. In the low state an absorbed
power-law with Gamma ~0.4 is sufficient to fit the 1-10 keV data. During
BeppoSAX observations EXO 0531-6609.2 display variations of the pulse profile
with the X-ray flux: it showed single peaked and double peaked profiles in the
low and high state, respectively. Based on these two observations we infer a
spin-up period derivative of -(1.14+/-0.08)x10^-10 s/s. By comparing these with
other period measurements reported in literature we find an alternating spin-up
and spin-down behaviour that correlates well with the X-ray luminosity.
","[{""version"":""v1"",""created"":""Tue, 10 Feb 2004 10:14:00 GMT""},{""version"":""v2"",""created"":""Wed, 11 Feb 2004 11:00:06 GMT""}]","2009-11-10"
"astro-ph/0402216","Hans Boehringer","H. Boehringer, K. Matsushita, E. Churazov, A. Finoguenov, Y. Ikebe","Implications of the central metal abundance peak in cooling core
  clusters of galaxies","5 pages, 4 figures, A&A in press. Astronomy and Astrophysics Letters,
  in press","Astron.Astrophys. 416 (2004) L21","10.1051/0004-6361:20040047",,"astro-ph",,"  Recent XMM-Newton observations of clusters of galaxies have provided detailed
information on the distribution of heavy elements in the central regions of
clusters with cooling cores providing strong evidence that most of these metals
come from recent SN type Ia. In this paper we compile information on the
cumulative mass profiles of iron, the most important metallicity tracer. We
find that long enrichment times (larger than 5 Gyr) are necessary to produce
the central abundance peaks. Classical cooling flows, a strongly convective
intracluster medium, and a complete metal mixing by cluster mergers would
destroy the observed abundance peaks too rapidly. Thus the observations set
strong constraints on cluster evolution models requiring that the cooling cores
in clusters are preserved over very long times. We further conclude from the
observations that the innermost part of the intracluster medium is most
probably dominated by gas originating predominantly from stellar mass loss of
the cD galaxy.
","[{""version"":""v1"",""created"":""Tue, 10 Feb 2004 10:38:07 GMT""}]","2009-11-10"
"astro-ph/0402217","Kazutaka Oka","Kazutaka Oka, Takuya Matsuda, Izumi Hachisu, Henri M.J. Boffin","Numerical Simulation of the Surface Flow on the Companion Star in a
  Close Binary System II. Construction of Doppler maps and application to
  Galactic supersoft X-ray sources","8 pages, 9 figures, Accepted for publication in A&A","Astron.Astrophys. 419 (2004) 277-283","10.1051/0004-6361:20034227",,"astro-ph",,"  We perform three-dimensional numerical simulations of surface flows on the
companion star in a semi-detached binary system and construct the corresponding
Doppler maps. The mass ratio of the binary system, $q=M_2/M_1$, considered here
is $q=0.05, 0.33, 0.5, 1, 2$, and 3. For all cases, we obtain the H-, L1-, and
L2-eddies, as found in our previous work, and confirm that the flow pattern
does not heavily depend on the mass ratio. We propose that this kind of problem
be dubbed ``{\it stellar meteorology}.'' The Doppler maps at the position of
the companion show a structure tilted towards clockwise direction and
presenting deviations from the critical Roche surface due to the L1-eddy and
the L2-eddy on the companion star. We apply our results to the Galactic
supersoft X-ray source RX J0019.8+2156 and try to attribute the low radial
velocity component of the emission lines of He II ${\lambda}4686$ observed
recently to the irradiated spot on the surface of the companion rather than
that of the white dwarf or the accretion disc. Based on the comparison between
the observations and our constructed Doppler map, we estimate the mass of the
companion star in RX J0019.8+2156 to be $\sim 2 M_{\odot}$ assuming the mass of
the white dwarf star to be around $0.6 M_{\odot}$.
","[{""version"":""v1"",""created"":""Tue, 10 Feb 2004 10:50:58 GMT""}]","2009-11-10"
