"physics/0402113","Edward Eyler","D. Tong, S. M. Farooqi, J. Stanojevic, S. Krishnan, Y.P. Zhang, R.
  C\^ot\'e, E. E. Eyler, and P. L. Gould","Local Blockade of Rydberg Excitation in an Ultracold Gas","4 pages, 3 figures",,"10.1103/PhysRevLett.93.063001",,"physics.atom-ph",,"  In the laser excitation of ultracold atoms to Rydberg states, we observe a
dramatic suppression caused by van der Waals interactions. This behavior is
interpreted as a local excitation blockade: Rydberg atoms strongly inhibit
excitation of their neighbors. We measure suppression, relative to isolated
atom excitation, by up to a factor of 6.4. The dependence of this suppression
on both laser irradiance and atomic density are in good agreement with a
mean-field model. These results are an important step towards using ultracold
Rydberg atoms in quantum information processing.
","[{""version"":""v1"",""created"":""Sat, 21 Feb 2004 18:37:22 GMT""}]","2009-11-10"
"quant-ph/0402161","Le-Man Kuang","Lan Zhou and Le-Man Kuang","Proposal for optically realizing quantum game","4 pages, 4 figures","Phys. Lett. A 315 (2003) 426-430","10.1016/S0375-9601(03)01100-9",,"quant-ph",,"  We present a proposal for optically implementing the quantum game of the
two-player quantum prisoner's dilemma involving nonmaximally entangled states
by using beam splitters, phase shifters, cross-Kerr medium, photon detector and
the single-photon representation of quantum bits.
","[{""version"":""v1"",""created"":""Sun, 22 Feb 2004 01:43:39 GMT""}]","2009-11-10"
"quant-ph/0402162","Dominic Meiser","D. Meiser, C. P. Search, P. Meystre","Diffraction of ultra-cold fermions by quantized light fields: Standing
  versus traveling waves",,,"10.1103/PhysRevA.71.013404",,"quant-ph",,"  We study the diffraction of quantum degenerate fermionic atoms off of
quantized light fields in an optical cavity. We compare the case of a linear
cavity with standing wave modes to that of a ring cavity with two
counter-propagating traveling wave modes. It is found that the dynamics of the
atoms strongly depends on the quantization procedure for the cavity field. For
standing waves, no correlations develop between the cavity field and the atoms.
Consequently, standing wave Fock states yield the same results as a classical
standing wave field while coherent states give rise to a collapse and revivals
in the scattering of the atoms. In contrast, for traveling waves the scattering
results in quantum entanglement of the radiation field and the atoms. This
leads to a collapse and revival of the scattering probability even for Fock
states. The Pauli Exclusion Principle manifests itself as an additional
dephasing of the scattering probability.
","[{""version"":""v1"",""created"":""Sun, 22 Feb 2004 01:48:52 GMT""}]","2009-11-10"
"quant-ph/0402163","Debabrata Goswami","Alok Srivastava and Debabrata Goswami","Laser Polarization Effects in Supercontinuum Generation","10 pages, 2 figures, Submitted to Physical Review Letters",,,,"quant-ph",,"  We present experimental evidence of a fourth order process in electric field
in supercontinuum generation. We also show laser induced polarization
preference in the supercontinuum generating media. These results have become
possible through the choice of isotropic and anisotropic samples interacting
with ultrashort laser pulses of changing ellipticity. Laser polarization
emerges as an important control parameter for the highly nonlinear phenomenon
of supercontinuum generation.
","[{""version"":""v1"",""created"":""Sun, 22 Feb 2004 07:09:28 GMT""}]","2007-05-23"
