"astro-ph/0402509","Kevin Luhman","K. L. Luhman (CfA)","A Census of the Chamaeleon I Star-Forming Region","59 pages, 22 figures","Astrophys.J. 602 (2004) 816","10.1086/381146",,"astro-ph",,"  Optical spectroscopy has been obtained for 179 objects that have been
previously identified as possible members of the cluster, that lack either
accurate spectral types or clear evidence of membership, and that are optically
visible (I<18). I have used these spectroscopic data and all other available
constraints to evaluate the spectral classifications and membership status of a
total sample of 288 candidate members of Chamaeleon I that have appeared in
published studies of the cluster. The latest census of Chamaeleon I now
contains 158 members, 8 of which are later than M6 and thus are likely to be
brown dwarfs. I find that many of the objects identified as members of
Chamaeleon I in recent surveys are actually field stars. Meanwhile, 7 of 9
candidates discovered by Carpenter and coworkers are confirmed as members, one
of which is the coolest known member of Chamaeleon I at a spectral type of M8
(~0.03 M_sun). I have estimated extinctions, luminosities, and effective
temperatures for the members and used these data to construct an H-R diagram
for the cluster. Chamaeleon I has a median age of ~2 Myr according to
evolutionary models, and hence is similar in age to IC 348 and is slightly
older than Taurus (~1 Myr). The measurement of an IMF for Chamaeleon I from
this census is not possible because of the disparate methods with which the
known members were originally selected, and must await an unbiased,
magnitude-limited survey of the cluster.
","[{""version"":""v1"",""created"":""Sat, 21 Feb 2004 16:39:41 GMT""}]","2009-11-10"
"astro-ph/0402511","Jean H. Swank","Jean Swank (NASA/GSFC)","Quasi-Periodic Oscillations from Low-Mass X-Ray Binaries with Neutron
  Stars","8 pages, 8 figures, to appear in the proceedings of ""X-Ray Timing
  2003: Rossi and Beyond"", eds. P. Kaaret, F.K. Lamb, & J.H. Swank (Melville,
  NY: AIP)",,"10.1063/1.1781055",,"astro-ph",,"  Before the launch of the Rossi X-ray Timing Explorer (RXTE) it was recognized
that neutron star accretion disks could extend inward to very near the neutron
star surface, and thus be governed by millisecond timescales. Previous missions
lacked the sensitivity to detect them. The kilohertz quasi-periodic
oscillations (QPO) that RXTE discovered are often, but not always, evident in
the X-ray flux. In 8 years RXTE has found kilohertz signals in about a fourth
of 100 low-mass X-ray binaries (LMXB) containing neutron stars. The observed
power spectra have simple dominant features, the two kilohertz oscillations, a
low frequency oscillation, and band-limited white noise. They vary
systematically with changes in other source properties and offer the
possibility of comparison with model predictions. New information from the
millisecond pulsars resolves some questions about the relations of the QPO and
the spin. Coherence, energy spectrum and time lag measurements have indicated
systematic behaviors, which should constrain mechanisms.
","[{""version"":""v1"",""created"":""Sat, 21 Feb 2004 20:24:02 GMT""}]","2009-11-10"
"astro-ph/0402513","Michela Mapelli","M. Mapelli, S. Sigurdsson, M. Colpi, F. R. Ferraro, A. Possenti, R. T.
  Rood, A. Sills and G. Beccari","The contribution of primordial binaries to the blue straggler population
  in 47 Tucanae","5 pages, 3 figures, to appear in ApJL, version enlarged to include
  Table 2","Astrophys.J. 605 (2004) L29-L32","10.1086/386370",,"astro-ph",,"  The recent observation (Ferraro et al. 2003b) of the blue straggler
population in 47 Tucanae gives the first detailed characterization of their
spatial distribution in the cluster over its entire volume. Relative to the
light distribution, blue stragglers appear to be overabundant in the core and
at large radii. The observed surface density profile shows a central peak, a
zone of avoidance and a rise beyond twenty core radii. In light of these
findings we explored the evolution of blue stragglers mimicking their dynamics
in a multi-mass King model for 47 Tucanae. We find that the observed spatial
distribution can not be explained within a purely collisional scenario in which
blue stragglers are generated exclusively in the core through direct mergers.
An excellent fit is obtained if we require that a sizable fraction of blue
stragglers is generated in the peripheral regions of the cluster inside
primordial binaries that evolve in isolation experiencing mass-transfer.
","[{""version"":""v1"",""created"":""Sun, 22 Feb 2004 11:27:10 GMT""}]","2009-11-10"
"astro-ph/0402514","Mikhail Zverev","V. A. Khodel, J. W. Clark, M. Takano, and M. V. Zverev","Phase Transitions in Nucleonic Matter and Neutron-Star Cooling","4 pages, 2 figures. Revised version. Accepted for publication in
  Phys.Rev.Lett","Phys.Rev.Lett.93:151101,2004","10.1103/PhysRevLett.93.151101",,"astro-ph",,"  A new scenario for neutron-star cooling is proposed, based on the
correspondence between pion condensation, occurring in neutron matter due to
critical spin-isospin fluctuations, and the metal-insulator phase transition in
a two-dimensional electron gas. Beyond the threshold density for pion
condensation, where neutron-star matter loses its spatial homogeneity, the
neutron single-particle spectrum acquires an insulating gap that quenches
neutron contributions to neutrino-production reactions and to the star's
specific heat. In the liquid phase at densities below the transition point,
spin-isospin fluctuations are found to play dual roles. On the one hand, they
lead to a multi-sheeted neutron Fermi surface that extends to low momenta,
thereby activating the normally forbidden direct-Urca cooling mechanism; on the
other, they amplify the nodeless $P$-wave neutron superfluid gap while
suppressing $S$-wave pairing. In this picture, lighter stars without a
pion-condensed core experience slow cooling, while enhanced cooling occurs in
heavier stars through direct-Urca emission from a narrow shell of the interior.
","[{""version"":""v1"",""created"":""Sun, 22 Feb 2004 14:27:37 GMT""},{""version"":""v2"",""created"":""Fri, 10 Sep 2004 12:12:52 GMT""}]","2008-11-26"
"astro-ph/0402518","Maura McLaughlin","M. A. McLaughlin, F. Camilo, M. Burgay, N. D'Amico, B. C. Joshi, M.
  Kramer, D. R. Lorimer, A. G. Lyne, R. N. Manchester & A. Possenti","X-Ray Emission from the Double Pulsar System J0737-3039","5 pages, 4 figures, accepted by ApJ Letters","Astrophys.J. 605 (2004) L41-L44","10.1086/392511",,"astro-ph",,"  We report on a 10 ksec observation of the double pulsar system J0737-3039
obtained with the Chandra X-ray Observatory's Advanced CCD Imaging
Spectrometer. We detect the system as a point source with coordinates (J2000)
RA = 07:37:51.23, Decl. = -30:39:40.9, making this the first double neutron
star system to be detected at X-ray energies. Only 77 source counts are
detected. The data are represented satisfactorily by a power-law spectrum with
photon index = 2.9 +/- 0.4. The inferred 0.2-10 keV luminosity is approximately
2e30 erg/s for a distance of 0.5 kpc. We do not detect any significant
variability with orbital phase in these data, which span one full orbit. These
results are consistent with the X-ray emission originating solely from the
magnetosphere of the energetic A pulsar, with an efficiency for conversion of
rotational energy to X-rays in this band of roughly 0.04%, although we cannot
exclude other possibilities.
","[{""version"":""v1"",""created"":""Sun, 22 Feb 2004 10:19:36 GMT""}]","2009-11-10"
"cond-mat/0402543","Bulbul Chakraborty","Satya N. Majumdar, Dibyendu Das, Jane' Kondev and Bulbul Chakraborty","Landau theory of glassy dynamics","4 pages, 2 figures",,"10.1103/PhysRevE.70.060501",,"cond-mat.stat-mech cond-mat.soft",,"  An exact solution of a Landau model of an order-disorder transition with
activated critical dynamics is presented. The model describes a funnel-shaped
topography of the order parameter space in which the number of energy lowering
trajectories rapidly diminishes as the ordered ground-state is approached. This
leads to an asymmetry in the effective transition rates which results in a
non-exponential relaxation of the order-parameter fluctuations and a
Vogel-Fulcher-Tammann divergence of the relaxation times, typical of a glass
transition. We argue that the Landau model provides a general framework for
studying glassy dynamics in a variety of systems.
","[{""version"":""v1"",""created"":""Sat, 21 Feb 2004 20:39:26 GMT""}]","2009-11-10"
"cond-mat/0402544","Ming Yu","C. Leahy, M. Yu, C.S. Jayanthi, and S.Y. Wu","Self-Consistent and Environment-Dependent Hamiltonians for Materials
  Simulations : case Studies on Silicon Structures","40 pages, 5 figures, 5 tables",,,,"cond-mat.mtrl-sci",,"  A reliable semi-empirical Hamiltonian for materials simulations must allow
electron screening and charge redistribution effects. Using the framework of
linear combination of atomic orbitals (LCAO), a self-consistent and
environment-dependent (SCED) Hamiltonian has been constructed for quantum
mechanics based simulations of materials. This Hamiltonian contains
environment-dependent multi-center interaction terms and electron-electron
correlation terms that allow electron screening and charge-redistribution
effects. As a case study, we have developed the SCED/LCAO Hamiltonian for
silicon. The robustness of this Hamiltonian is demonstrated by scrutinizing a
variety of different structures of silicon. In particular, we have studied the
following: (i) the bulk phase diagrams of silicon, (ii) the structure of an
intermediate-size Si71 cluster, (iii) the reconstruction of Si(100) surface,
and (iv) the energy landscape for a silicon monomer adsorbed on the
reconstructed Si(111)-7x7 surface. The success of the silicon SCED/LCAO
Hamiltonian in the above applications, where silicon exists in a variety of
different co-ordinations, is a testament to the predictive power of the scheme.
","[{""version"":""v1"",""created"":""Sat, 21 Feb 2004 20:29:54 GMT""}]","2007-05-23"
"cond-mat/0402545","Arnab Mukherjee","Prasanth P Jose and Biman Bagchi","Relaxation in open one-dimensional systems",,,,,"cond-mat.soft",,"  A new master equation to mimic the dynamics of a collection of interacting
random walkers in an open system is proposed and solved numerically.In this
model, the random walkers interact through excluded volume interaction
(single-file system); and the total number of walkers in the lattice can
fluctuate because of exchange with a bath.In addition, the movement of the
random walkers is biased by an external perturbation. Two models for the latter
are considered: (1) an inverse potential (V $\propto$ 1/r), where r is the
distance between the center of the perturbation and the random walker and (2)
an inverse of sixth power potential ($V \propto 1/r^6 $). The calculated
density of the walkers and the total energy show interesting dynamics. When the
size of the system is comparable to the range of the perturbing field, the
energy relaxation is found to be highly non-exponential. In this range, the
system can show stretched exponential ($ e^{-{(t/\tau_s)}^{\beta}} $) and even
logarithmic time dependence of energy relaxation over a limited range of time.
Introduction of density exchange in the lattice markedly weakens this
non-exponentiality of the relaxation function, irrespective of the nature of
perturbation.
","[{""version"":""v1"",""created"":""Sun, 22 Feb 2004 11:17:51 GMT""}]","2007-05-23"
"cond-mat/0402546","Aviad Frydman","Ido Kanter, Aviad Frydman and Asaf Ater","Utilizing hidden Markov processes as a new tool for experimental physics","4 pages, 4 figures","Europhysics Letters, 69, 798 (2005)","10.1209/epl/i2004-10407-y",,"cond-mat.mes-hall",,"  A hidden Markov process is a well known concept in information theory and is
used for a vast range of applications such as speech recognition and error
correction. We bridge between two disciplines, experimental physics and
advanced algorithms, and propose to use a physically oriented hidden Markov
process as a new tool for analyzing experimental data. This tool enables one to
extract valuable information on physical parameters of complex systems. We
demonstrate the usefulness of this technique on low dimensional electronic
systems which exhibit time dependent resistance noise. This method is expected
to become a standard technique in experimental physics.
","[{""version"":""v1"",""created"":""Sun, 22 Feb 2004 12:59:32 GMT""}]","2015-06-24"
"gr-qc/0402090","Alexander Petrov Nikolaevich","A.N.Petrov","Perturbations in the Einstein theory of gravity: Conserved currents","LATEX, 8 pages","Moscow Univ.Phys.Bull. 59 (2004) 1:24-28;
  Vestn.Mosk.Univ.Fiz.Astron. 1 (2004) 18-22",,,"gr-qc",,"  General relativity in the form where gravitational perturbations together
with other physical fields propagate on an auxiliary background is considered.
With using the Katz-Bi{\v{c}}\'ak-Lynden-Bell technique new conserved currents,
divergences of antisymmetric tensor densities(superpotentials), in an arbitrary
curved spacetime are constructed.
","[{""version"":""v1"",""created"":""Sun, 22 Feb 2004 09:26:19 GMT""}]","2007-05-23"
"hep-ex/0402032","Urs Langenegger","Urs Langenegger (for the BABAR Collaboration)","Inclusive Semileptonic B Decays at BABAR","3 pages, 4 postscript figures, submitted to EPS 2003","Eur.Phys.J.C33:575,2004; Eur.Phys.J.C33:s207-s209,2004","10.1140/epjcd/s2003-03-107-4","BABAR-CONF-03/080, SLAC-PUB-10235","hep-ex",,"  We report updates on two analyses of inclusive semileptonic B decays based on
a dataset of 89 million BB events recorded with the BABAR detector at the Y(4S)
resonance. Events are selected by fully reconstructing the decay of one B meson
and identifying a charged lepton from the decay of the other B meson. In the
first analysis, the measurement of the first and second moment of the hadronic
mass distribution in Cabibbo-favored B ->X_c l nu decays allows for the
determination of the nonperturbative parameters $\bar{\Lambda}$ and $\lambda_1$
of Heavy Quark Effective Theory (HQET) and |Vcb|. In the second analysis, the
hadronic mass distribution is used to measure the inclusive charmless
semileptonic branching fraction and to determine |Vub|.
","[{""version"":""v1"",""created"":""Sun, 22 Feb 2004 01:40:54 GMT""}]","2019-08-14"
"hep-ph/0402224","Nobuhiro Maekawa","Nobuhiro Maekawa","E6 Unification, Large Neutrino Mixings, and SUSY Flavor Problem","8 pages, RevTeX, In Ver.2, refs. and minor corrections","Prog.Theor.Phys. 112 (2004) 639-652","10.1143/PTP.112.639","KUNS-1900","hep-ph",,"  This study indicates that in E6 grand unified theories (GUTs), once a
hierarchical structure of up-quark-type Yukawa couplings is given as a basic
structure of flavor, larger lepton mixings than the quark mixings and milder
down-quark-type (and charged-lepton-type) mass hierarchies than up-quark-type
mass hierarchy can generically be obtained under a few natural assumptions. The
basic flavor structure is compatible with non-Abelian horizontal symmetry,
which can solve the SUSY flavor problem. It is shown that in solving the SUSY
flavor problem, the E6 structure, which realizes bi-large neutrino mixings,
also solves a problem that results from the large neutrino mixing angles.
","[{""version"":""v1"",""created"":""Sun, 22 Feb 2004 05:46:18 GMT""},{""version"":""v2"",""created"":""Mon, 23 Feb 2004 23:19:35 GMT""},{""version"":""v3"",""created"":""Tue, 30 Mar 2004 23:07:26 GMT""}]","2009-11-10"
"hep-ph/0402226","Qing-Hong Cao","Qing-Hong Cao, Shinya Kanemura and C.--P. Yuan","Testing Supersymmetry in $A H^\pm$ Associated Production","4 pages, 1 figure, Contribution to SUSY 2003: Supersymmetry in the
  Desert, held at the University of Arizona,Tucson, AZ, June 5-10, 2003. To
  appear in the Proceedings",,,,"hep-ph",,"  In the Minimal Supersymmetric Standard Model, the masses of the charged Higgs
boson ($H^\pm$) and the CP-odd scalar ($A$) are related by
$M_{H^+}^2=M_A^2+m_W^2$ at the Born level. Because the coupling of
$W^-$-$A$-$H^+$ is fixed by gauge interaction, the Born level production rate
of $q \bar q' \to W^{\pm \ast} \to A H^\pm$ depends only on one supersymmetry
parameter -- the mass ($M_A^{}$) of $A$. We illustrate how to test the mass
relation between $A$ and $H^+$ in case that the signal is found at the LHC. If
the signal is not found, the product of the decay branching ratios of $A$ and
$H^\pm$ predicted by the MSSM is bounded from above as a function of $M_A$.
","[{""version"":""v1"",""created"":""Sat, 21 Feb 2004 21:33:28 GMT""}]","2007-05-23"
"hep-ph/0402227","XiaoHu Mo","P.Wang, X.H.Mo and C.Z.Yuan","Measuring psi(3770) -> Kshort Klong as a test of the S- and D-wave
  mixing of charmonia","4 pages, 1 figure","Phys.Rev.D70:077505,2004","10.1103/PhysRevD.70.077505",,"hep-ph",,"  Adding to the long standing ""rho-pi puzzle"" in psi(3686) and J/psi decays,
recently BES reported the branching ratio of psi(3686) -> Kshort Klong which is
enhanced relative to the pQCD "" 12% rule"" expectation from the branching ratio
of J/psi -> Kshort Klong. If the enhancement is due to the mixing of the S- and
D-wave charmonium states as in the rho-pi case, the newly measured branching
ratio of psi(3686) -> Kshort Klong gives a constraint on the psi(3770) ->
Kshort Klong. It serves as a good test for the scenario of the S- and D-wave
mixing in the psi(3686) and psi(3770).
","[{""version"":""v1"",""created"":""Sun, 22 Feb 2004 03:33:26 GMT""},{""version"":""v2"",""created"":""Fri, 22 Oct 2004 00:59:11 GMT""}]","2008-11-26"
"hep-th/0402164","Andrei Babichenko","A.Babichenko","From S-matrices to the Thermodynamic Bethe Ansatz","minor corrections, references added, to be published in NPB","Nucl.Phys. B697 (2004) 481-512","10.1016/j.nuclphysb.2004.07.008",,"hep-th",,"  We derive the TBA system of equations from the S-matrix describing integrable
massive perturbation of the coset $G_l \times G_m / G_{l+m}$ by the field
$(1,1,adj)$ for all the infinite series of the simple Lie algebras $G=A,B,C,D$.
In the cases A,C, where the full S-matrices are known, the derivation is exact,
while B,D cases dictate some natural assumption about the form of the crossing-
-unitarizing prefactor for any two fundam. reps of the algebras. In all the
cases the derived systems are transformed to the corresponding functional
Y-system and shown to have the correct high temperature (UV) asymptotic in the
ground state, reproducing the correct central charge of the coset. Some
specific particular cases of the considered S-matrices are discussed.
","[{""version"":""v1"",""created"":""Sun, 22 Feb 2004 11:20:05 GMT""},{""version"":""v2"",""created"":""Wed, 7 Jul 2004 07:56:55 GMT""}]","2009-11-10"
"hep-th/0402174","Alex Buchel","Alex Buchel","Gauge theories on hyperbolic spaces and dual wormhole instabilities","29 pages, 2 figures, v2: published version","Phys.Rev. D70 (2004) 066004","10.1103/PhysRevD.70.066004",,"hep-th",,"  We study supergravity duals of strongly coupled four dimensional gauge
theories formulated on compact quotients of hyperbolic spaces. The resulting
background geometries are represented by Euclidean wormholes, which complicates
establishing the precise gauge theory/string theory correspondence dictionary.
These backgrounds suffer from the non-perturbative instabilities arising from
the D3 - anti-D3 pair production in the background four-form potential. We
discuss conditions for suppressing this Schwinger-like instability. We find
that Euclidean wormholes arising in this construction develop a naked
singularity, before they can be stabilized.
","[{""version"":""v1"",""created"":""Sat, 21 Feb 2004 23:02:32 GMT""},{""version"":""v2"",""created"":""Mon, 26 Jul 2004 13:39:55 GMT""}]","2009-11-10"
"math/0402346","Peter Saveliev","Peter Saveliev","Applications of Lefschetz numbers in control theory","The paper has been completely rewritten. 15 pages",,,,"math.OC cs.SY math.AT","http://arxiv.org/licenses/nonexclusive-distrib/1.0/","  We develop some applications of techniques of the Lefschetz coincidence
theory in control theory. The topics are existence of equilibria and their
robustness, controllability and its robustness.
","[{""version"":""v1"",""created"":""Sat, 21 Feb 2004 20:27:13 GMT""},{""version"":""v2"",""created"":""Sun, 23 Jan 2005 20:36:20 GMT""},{""version"":""v3"",""created"":""Thu, 14 Apr 2011 22:57:45 GMT""}]","2011-04-18"
"math/0402347","Henrique Bursztyn","Henrique Bursztyn and Alan Weinstein","Poisson geometry and Morita equivalence","52 pages. Expanded notes from the mini-course taught by A. Weinstein
  at the PQR 2003 Euroschool in Brussels. Revised version, to appear in the
  London Math.Society Lecture Notes series",,,,"math.SG math.DG",,"  These notes discuss various aspect of the ``representation theory'' of
Poisson manifolds, with focus on Morita equivalence and Picard groups. We give
a brief introduction to Poisson geometry (including Dirac and twisted Poisson
structures) and algebraic Morita theory before presenting the geometric Morita
theory of Poisson manifolds. We also point out the connections with the theory
of symplectic groupoids and hamiltonian actions.
","[{""version"":""v1"",""created"":""Sun, 22 Feb 2004 02:01:29 GMT""},{""version"":""v2"",""created"":""Tue, 30 Mar 2004 00:22:06 GMT""}]","2007-05-23"
"math/0402348","Li Guo","Li Guo","Baxter Algebras, Stirling Numbers and Partitions","10 pages","J. Algebra Appl. 4 (2005), 153-164",,,"math.AC math.CO math.NT",,"  Recent developments of Baxter algebras have lead to applications to
combinatorics, number theory and mathematical physics. We relate Baxter
algebras to Stirling numbers of the first kind and the second kind, partitions
and multinomial coefficients. This allows us to apply congruences from number
theory to obtain congruences in Baxter algebras.
","[{""version"":""v1"",""created"":""Sun, 22 Feb 2004 13:15:01 GMT""}]","2007-05-23"
"math/0402350","I. Heckenberger","I. Heckenberger","Finite dimensional rank 2 Nichols algebras of diagonal type I: Examples","Abstract and introduction modified, one example added; Latex2e, 36
  pages, 24 figures",,,,"math.QA",,"  Nichols algebras naturally appear in the classification of finite dimensional
pointed Hopf algebras. Assuming only that the base field has characteristic
zero several new finite dimensional rank 2 Nichols algebras of diagonal type
are listed. Each of them is described in terms of generators and relations. A
Poincar\'e--Birkhoff--Witt basis of all of these Nichols algebras is given and
their dimension is computed. Together with the continuation of this paper this
gives an answer to a question of Andruskiewitsch.
  Key Words: Hopf algebra, Lyndon words, full binary tree
","[{""version"":""v1"",""created"":""Sun, 22 Feb 2004 13:16:43 GMT""},{""version"":""v2"",""created"":""Thu, 1 Apr 2004 17:12:55 GMT""}]","2016-09-07"
"math/0402351","Oliver Redner","Oliver Redner and Michael Baake","Unequal Crossover Dynamics in Discrete and Continuous Time","25 pages, 1 figure; to appear in J. Math. Biol","J. Math. Biol. 49 (2004), 201-226","10.1007/s00285-004-0273-7","ESI Preprint 1281","math.DS q-bio.PE",,"  We analyze a class of models for unequal crossover (UC) of sequences
containing sections with repeated units that may differ in length. In these,
the probability of an `imperfect' alignment, in which the shorter sequence has
d units without a partner in the longer one, scales like q^d as compared to
`perfect' alignments where all these copies are paired. The class is
parameterized by this penalty factor q. An effectively infinite population size
and thus deterministic dynamics is assumed. For the extreme cases q=0 and q=1,
and any initial distribution whose moments satisfy certain conditions, we prove
the convergence to one of the known fixed points, uniquely determined by the
mean copy number, in both discrete and continuous time. For the intermediate
parameter values, the existence of fixed points is shown.
","[{""version"":""v1"",""created"":""Sun, 22 Feb 2004 15:51:42 GMT""}]","2007-05-23"
"physics/0402112","S. Cht. Mavrodiev","S. Cht. Mavrodiev (Institute for Nuclear Research and Nuclear Energy,
  Bulgarian Academy of Sciences, Sofia)","On the Reliability of the Geomagnetic Quake as Short Time Earthquake
  Precursor for Sofia Region- 2002, 2003","19 pages, 20 figures, one table, 500 KB pdf, 22 February, 2004",,"10.5194/nhess-4-433-2004",,"physics.geo-ph physics.ao-ph",,"  The local when earthquake prediction is based on the connection between
geomagnetic quakes and the next incoming minimum or maximum of tidal
gravitational potential. The probability time window for the predicted
earthquake is for the tidal minimum approximately +/-1 day and for the maximum-
+/-2 days. The preliminary statistic estimation on the basis of distribution of
the time difference between occurred and predicted earthquakes for the period
2002- 2003 for Sofia region is given. The possibility for creating a local
when, where earthquake research and prediction NETWORK is based on the accurate
monitoring of the electromagnetic field with special space and time scales
under, on and over the Earth surface. The periodically upgraded information
from seismic hazard maps and other standard geodetic information as well as
other precursory information is essential.
","[{""version"":""v1"",""created"":""Sun, 22 Feb 2004 13:27:43 GMT""}]","2020-11-04"
