"cond-mat/0404553","Takuma Ohashi","Ryota Sato, Takuma Ohashi, Akihisa Koga, Norio Kawakami","Periodic Anderson model with degenerate orbitals: linearized dynamical
  mean field theory approach","7 pages, 10 figures","J. Phys. Soc. Jpn., 73, 1864 (2004)","10.1143/JPSJ.73.1864",,"cond-mat.str-el",,"  We investigate a multi-orbital extension of the periodic Anderson model with
particular emphasis on electron correlations including orbital fluctuations. By
means of a linearized version of the dynamical mean-field theory, we compute
the renormalization factor, the density of states, the spectral gap and the
local correlation functions for a given set of the intra- and inter-orbital
Coulomb interactions as well as the Hund coupling. It is found that when a
certain condition is met for the intra- and inter-orbital interactions for $f$
electrons, orbital fluctuations are enhanced, thereby enlarging the Kondo
insulating gap. This effect is suppressed in the presence of the Hund coupling.
We also clarify how the Kondo insulator is continuously changed to the Mott
insulator when electron correlations among conduction electrons are increased.
","[{""version"":""v1"",""created"":""Thu, 22 Apr 2004 20:10:10 GMT""}]","2009-11-10"
"cond-mat/0404554","Kikuo Harigaya","Kikuo Harigaya (AIST)","Theoretical investigation on electronic properties of topological
  materials: Optical excitations in Moebius conjugated polymers",,"Conference Proceedings: International Conference on Science and
  Technology of Synthetic Metals 2004",,,"cond-mat.mtrl-sci physics.optics quant-ph",,"  Electronic structures and optical excitations in Moebius conjugated polymers
are studied theoretically. Periodic and Moebius boundary conditions are applied
to the tight binding model of poly(para-phenylene), taking into account of the
exciton effects by long-range Coulomb interactions. We first discuss that
oligomers with a few structural units are more effective than polymers, in
order to measure effects of discrete wave numbers which are shift by the
Moebius boundary from those of the periodic boundary. Next, calculations of the
optical absorption spectra are reported. Certain components of the optical
absorption for the electric field perpendicular to the polymer axis mix with
the absorption spectra for the electric filed parallel with the polymer axis.
Therefore, the polarization dependences of electric field of light can detect
whether conjugated polymers have the Moebius boundary or not.
","[{""version"":""v1"",""created"":""Fri, 23 Apr 2004 00:36:50 GMT""}]","2007-05-23"
"cond-mat/0404555","Reinhard Leidl","R. Leidl and W. Selke","Phase diagrams of a classical two-dimensional Heisenberg antiferromagnet
  with single-ion anisotropy","9 pages, 9 figures; final version as accepted by Phys. Rev. B (Fig. 5
  replaced, added remarks in Secs. I, III, and V)","Phys. Rev. B 70, 174425 (2004)","10.1103/PhysRevB.70.174425",,"cond-mat.stat-mech cond-mat.mtrl-sci cond-mat.supr-con",,"  A classical variant of the two-dimensional anisotropic Heisenberg model
reproducing inelastic neutron scattering experiments on La_5 Ca_9 Cu_24 O_41
[M. Matsuda et al., Phys.Rev. B 68, 060406(R) (2003)] is analysed using mostly
Monte Carlo techniques. Phase diagrams with external fields parallel and
perpendicular to the easy axis of the anisotropic interactions are determined,
including antiferromagnetic and spin-flop phases. Mobile spinless defects, or
holes, are found to form stripes which bunch, debunch and break up at a phase
transition. A parallel field can lead to a spin-flop phase.
","[{""version"":""v1"",""created"":""Fri, 23 Apr 2004 01:02:01 GMT""},{""version"":""v2"",""created"":""Mon, 26 Apr 2004 21:36:34 GMT""},{""version"":""v3"",""created"":""Tue, 21 Sep 2004 18:23:48 GMT""}]","2009-11-10"
"cond-mat/0404556","Nobuya Maeshima","Nobuya Maeshima","Tensor Product State Formulation for the Spin 1/2 Antiferromagnetic XXZ
  Model on the Checkerboard Lattice","9 pages, 11 figures","Journal of the Physical Society of Japan 73, 60 (2004)","10.1143/JPSJ.73.60",,"cond-mat.str-el cond-mat.stat-mech",,"  Vertical density matrix algorithm (VDMA), a tensor product state formulation
of the ``higher-dimensional'' density matrix renormalization group, is applied
to the spin 1/2 antiferromagnetic XXZ model on the checkerboard lattice. The
VDMA was, in the preceding study, applied to the transverse field Ising model
on the square lattice and the three-dimensional classical Ising model. In the
present paper, its implementation procedure is modified in order to apply the
VDMA to the XXZ model. Numerical accuracy of the VDMA is investigated for the
XXZ model on the square lattice, which shows that the method gives reliable
results for the ground state energy. In the frustrated region, VDMA results are
compared with a simple calculation based on a magnetically disordered state. It
is found that the weakly frustrated region is in the N\'{e}el ordered phase,
while in the strongly frustrated region the realized phase cannot be identified
clearly by the obtained results.
","[{""version"":""v1"",""created"":""Fri, 23 Apr 2004 01:26:19 GMT""}]","2009-11-10"
"cond-mat/0404558","Rayaprol Sudhindra Dr.","Anjana Dogra, S. Rayaprol, N. A. Shah and D. G. Kuberkar","Effect of Co-Ga paired substitution on superconductivity in YBa2Cu3O7-d","To appear in Mod. Phys. Let. B; PDF file only",,"10.1142/S0217984904007025",,"cond-mat.supr-con",,"  The effect of Co-Ga paired substitution on the superconducting properties of
YBa2Cu3O7-d (Y-123) has been investigated by X-ray diffraction, ac
susceptibility,dc resistivity and oxygen content measurements. We report in
this paper the results of our studies on the paired substitution of a magnetic
and non-magnetic ion at Cu site in Y-123, while keeping the total dopant
concentration fixed. The simultaneous substitution of Co and Ga at Cu site
shows variation in the transition temperature (Tc), oxygen content and hole
concentration as a function of change in the balance of magnetic (Co) and
non-magnetic (Ga) concentration. Orthorhombicity (D), given as (b-a)/a, also
varies as a function of increasing dopant concentration. The variation in Tc
due to Co-Ga substitution is discussed in the light of dopant valency and hole
filling mechanism.
","[{""version"":""v1"",""created"":""Fri, 23 Apr 2004 04:35:36 GMT""}]","2009-11-10"
"cond-mat/0404559","Jeil Jung","J. Jung and P. Garc\'ia-Gonz\'alez and J. E. Alvarellos and R. W.
  Godby","Assessment of density functional approximations: long-range correlations
  and self-interaction effects","7 pages 4 figures. Accepted in PRA","Phys. Rev. A 69, 052501 (2004)","10.1103/PhysRevA.69.052501",,"cond-mat.other cond-mat.mtrl-sci",,"  The complex nature of electron-electron correlations is made manifest in the
very simple but non-trivial problem of two electrons confined within a sphere.
The description of highly non-local correlation and self-interaction effects by
widely used local and semi-local exchange-correlation energy density
functionals is shown to be unsatisfactory in most cases. Even the best such
functionals exhibit significant errors in the Kohn-Sham potentials and density
profiles.
","[{""version"":""v1"",""created"":""Fri, 23 Apr 2004 06:42:04 GMT""}]","2016-08-16"
"cond-mat/0404560","Docteur David Guery-Odelin","J. M. Vogels, T. Lahaye, C. Roos, J. Dalibard, D. Guery-Odelin","How to reach the collisional regime on a magnetically guided atomic beam",,,,,"cond-mat.other",,"  In this paper, we report our progress towards the realization of a continuous
guided atomic beam in the degenerate regime. So far, we have coupled into a
magnetic guide a flux of a few $10^{8}$ atoms/s at 60 cm/s with a propagation
in the guide over more than 2 meters. At this stage, the collision rate is not
high enough to start an efficient forced evaporative cooling. Here we describe
a new approach to reach the collisional regime. It is based on a pulsed feeding
of the magnetic guide at a high repetition rate. The overlap of the packets of
atoms occurs in the guide and leads to a continuous guided beam. We discuss
different ways to increase the collision rate of this beam while keeping the
phase space density constant by shaping the external potential.
","[{""version"":""v1"",""created"":""Fri, 23 Apr 2004 07:38:47 GMT""}]","2007-05-23"
"cond-mat/0404561","Alexander Moskvin","A.S. Moskvin, I.G. Bostrem, A.S. Ovchinnikov","Topological phase separation in 2D hard-core Bose-Hubbard system away
  from half-filling","6 pages, 1 figure","JETP Lett. {\bf 78}, 772 (2003)","10.1134/1.1664002",,"cond-mat.supr-con cond-mat.str-el",,"  We suppose that the doping of the 2D hard-core boson system away from
half-filling may result in the formation of multi-center topological defect
such as charge order (CO) bubble domain(s) with Bose superfluid (BS) and extra
bosons both localized in domain wall(s), or a {\it topological} CO+BS {\it
phase separation}, rather than an uniform mixed CO+BS supersolid phase.
Starting from the classical model we predict the properties of the respective
quantum system. The long-wavelength behavior of the system is believed to
remind that of granular superconductors, CDW materials, Wigner crystals, and
multi-skyrmion system akin in a quantum Hall ferromagnetic state of a 2D
electron gas.
","[{""version"":""v1"",""created"":""Fri, 23 Apr 2004 07:39:27 GMT""}]","2015-06-24"
"cond-mat/0404562","Alexander Moskvin","A.S. Moskvin","Topological phase separation in 2D quantum lattice Bose-Hubbard system
  away from half-filling","12 pages, 6 figures","PRB, 2004","10.1103/PhysRevB.69.214505",,"cond-mat.supr-con cond-mat.str-el",,"  We suppose that the doping of the 2D hard-core boson system away from
half-filling may result in the formation of multi-center topological
inhomogeneity (defect) such as charge order (CO) bubble domain(s) with Bose
superfluid (BS) and extra bosons both localized in domain wall(s), or a {\it
topological} CO+BS {\it phase separation}, rather than an uniform mixed CO+BS
supersolid phase. Starting from the classical model we predict the properties
of the respective quantum system. The long-wavelength behavior of the system is
believed to remind that of granular superconductors, CDW materials, Wigner
crystals, and multi-skyrmion system akin in a quantum Hall ferromagnetic state
of a 2D electron gas. To elucidate the role played by quantum effects and that
of the lattice discreteness we have addressed the simplest nanoscopic
counterpart of the bubble domain in a checkerboard CO phase of 2D hc-BH square
lattice. It is shown that the relative magnitude and symmetry of
multi-component order parameter are mainly determined by the sign of the $nn$
and $nnn$ transfer integrals. In general, the topologically inhomogeneous phase
of the hc-BH system away from the half-filling can exhibit the signatures both
of $s,d$, and $p$ symmetry of the off-diagonal order.
","[{""version"":""v1"",""created"":""Fri, 23 Apr 2004 07:53:03 GMT""}]","2009-11-10"
"cond-mat/0404563","Mark Ruemmeli","Mark. H. Ruemmeli, Ewa Borowiak-Palen, Thomas Gemming, Martin Knupfer,
  Kati Biedermann, Ryszard J. Kalenczuk, Thomas Pichler","On the formation process of silicon carbide nanophases via hydrogenated
  thermally induced templated synthesis","9 pages, 2 Figures",,"10.1007/s00339-004-3048-5",,"cond-mat.mtrl-sci",,"  A thermally induced templated synthesis for SiC nanotubes and nanofibers
using ammonia or nitrogen as a carrier gas, single wall carbon nanotubes
(SWCNT) as templates as well as gaseous Si is presented. The bundles of SWCNT
act as both the carbon source and as a nanoframe from which SiC structuctures
form. Depending on the duration of the thermally induced templated reaction,
for a fixed temperature, carrier gas, and gas pressure, various SiC
nanostructures are obtained. These structures include SiC nanorods coated in C,
SiC nanorods, SiC nanotubes, and SiC nanocrytals. From our analysis using
transmission electron microscopy (TEM) and scanning electron microscopy (SEM),
electron energy-loss spectroscopy (EELS), electron diffraction (EDX), optical
absorption spectroscopy and Raman spectroscopy as probes we prove that H has a
key role on the morphology and stochiometry of the different SiC
nanostructures.
","[{""version"":""v1"",""created"":""Fri, 23 Apr 2004 08:39:48 GMT""}]","2009-11-10"
"cond-mat/0404564","Roman Marto\v{n}\'ak","R. Martonak, D. Donadio and M. Parrinello (Computational Science,
  Department of Chemistry and Applied Biosciences, ETH Zurich, Lugano,
  Switzerland)","Polyamorphism of ice at low temperatures from constant-pressure
  simulations","11 pages, 5 postscript figures. To be published in Physical Review
  Letters",,"10.1103/PhysRevLett.92.225702",,"cond-mat.mtrl-sci cond-mat.stat-mech",,"  We report results of MD simulations of amorphous ice in the pressure range 0
- 22.5 kbar. The high-density amorphous ice (HDA) prepared by compression of Ih
ice at T = 80 K is annealed to T = 170 K at intermediate pressures in order to
generate relaxed states. We confirm the existence of recently observed
phenomena, the very high-density amorphous ice and a continuum of HDA forms. We
suggest that both phenomena have their origin in the evolution of the network
topology of the annealed HDA phase with decreasing volume, resulting at low
temperatures in the metastability of a range of densities.
","[{""version"":""v1"",""created"":""Fri, 23 Apr 2004 08:50:06 GMT""}]","2009-11-10"
"cond-mat/0404565","Hongwei Xiong","Hongwei Xiong, Shujuan Liu, Min Liu, Kelin Gao, Mingsheng Zhan","Condensate fraction of molecules for a spin mixture of ultracold
  fermionic atoms","4 pages, RevTex, 2 figs, E-mail: xionghongwei@wipm.ac.cn A revised
  version according to the comments and suggestions of the referees",,,,"cond-mat.soft cond-mat.stat-mech",,"  The condensate fraction of molecules for ultracold Fermi gases is
investigated for the magnetic field below the Feshbach resonant magnetic field.
Assuming that there is no loss of particles and energy during the adiabatic
magnetic-field sweep, a simple theory is used to interpret the measured
condensate fraction in the experiments by JILA group (Phys. Rev. Lett. 92,
040403 (2004)) and MIT group (Phys. Rev. Lett. 92, 120403 (2004)). Our theory
shows that the condensate fraction of molecules is dependent on the initial
condition of the system and especially on the process of the magnetic-field
sweep.
","[{""version"":""v1"",""created"":""Fri, 23 Apr 2004 09:48:31 GMT""},{""version"":""v2"",""created"":""Wed, 28 Apr 2004 03:40:15 GMT""},{""version"":""v3"",""created"":""Fri, 16 Jul 2004 02:26:56 GMT""}]","2007-05-23"
"cond-mat/0404566","J. J. Garcia-Ripoll","J. J. Garcia-Ripoll, M. A. Martin-Delgado, J. I. Cirac","Implementation of Spin Hamiltonians in Optical Lattices",,"Phys. Rev. Lett. 93, 250405 (2004)","10.1103/PhysRevLett.93.250405",,"cond-mat.str-el quant-ph",,"  We propose an optical lattice setup to investigate spin chains and ladders.
Electric and magnetic fields allow us to vary at will the coupling constants,
producing a variety of quantum phases including the Haldane phase, critical
phases, quantum dimers etc. Numerical simulations are presented showing how
ground states can be prepared adiabatically. We also propose ways to measure a
number of observables, like energy gap, staggered magnetization, end-chain
spins effects, spin correlations and the string order parameter.
","[{""version"":""v1"",""created"":""Fri, 23 Apr 2004 10:11:51 GMT""},{""version"":""v2"",""created"":""Mon, 26 Apr 2004 16:30:17 GMT""}]","2007-05-23"
"cond-mat/0404567","Dmitrii Fil","D. V. Fil, S. I. Shevchenko","Berry phase caused by nondissipative drag of superflow in a Bose qubit","See arXiv:cond-mat/0506229",,,,"cond-mat.soft",,"  A microscopic theory of superfluid drag in a two-component Bose gas is
developed. The drag factor is shown to be proportional to the square root of
the gas parameter. Basing on the similarity between the drag force and vector
potential of magnetic field we propose how the superfluid drag can be used to
detect a Berry phase in a Bose counterpart of the Josephson charge qubit. We
consider a system in which the drag component, situated inside the drive
component, is confined in two half-ring traps separated by two Josephson
barriers. Under cyclic adiabatic change of Josephson coupling parameters and an
asymmetry of two traps a Berry phase is generated. This phase can be observed
though measurements of relative number of atoms in two traps. The Berry phase
depends on the drag factor and its detection can be used for determining the
value of the drag.
","[{""version"":""v1"",""created"":""Fri, 23 Apr 2004 10:33:32 GMT""},{""version"":""v2"",""created"":""Tue, 1 Jun 2004 14:58:09 GMT""},{""version"":""v3"",""created"":""Sat, 7 Dec 2019 16:47:46 GMT""}]","2019-12-10"
"cond-mat/0404569","Jun'ichi Ieda","Jun'ichi Ieda, Takahiko Miyakawa, Miki Wadati","Exact Analysis of Soliton Dynamics in Spinor Bose-Einstein Condensates","4 pages, 2 figures","Phys. Rev. Lett. 93, 194102 (2004)","10.1103/PhysRevLett.93.194102",,"cond-mat.stat-mech cond-mat.soft math-ph math.MP",,"  We propose an integrable model of a multicomponent spinor Bose-Einstein
condensate in one dimension, which allows an exact description of the dynamics
of bright solitons with spin degrees of freedom. We consider specifically an
atomic condensate in the F=1 hyperfine state confined by an optical dipole
trap. When the mean-field interaction is attractive (c_0 < 0) and the
spin-exchange interaction of a spinor condensate is ferromagnetic (c_2 < 0), we
prove that the system possesses a completely integrable point leading to the
existence of multiple bright solitons. By applying results from the inverse
scattering method, we analyze a collision law for two-soliton solutions and
find that the dynamics can be explained in terms of the spin precession.
","[{""version"":""v1"",""created"":""Fri, 23 Apr 2004 12:14:35 GMT""},{""version"":""v2"",""created"":""Thu, 4 Nov 2004 05:31:28 GMT""}]","2009-11-10"
"cond-mat/0404570","Gerald Wigger","G.A. Wigger, C. Beeli, E. Felder, H.R. Ott, A.D. Bianchi and Z. Fisk","Percolation and Colossal Magnetoresistance in Eu-based Hexaborides","4 pages, 5 figures, submitted to PRL",,"10.1103/PhysRevLett.93.147203",,"cond-mat.mtrl-sci cond-mat.str-el",,"  Upon substituting Ca for Eu in the local-moment ferromagnet EuB$_6$, the
Curie temperature $T_C$ decreases substantially with increasing dilution of the
magnetic sublattice and is completely suppressed for $x$ $\leq$ 0.3. The Ca
substitution leads to significant changes of the electronic properties across
the Eu$_x$Ca$_{1-x}$B$_6$ series. Electron microscopy data for $x$ $\approx$
0.27 indicate a phase separation into Eu- and Ca-rich clusters of 5 to 10 nm
diameter, leading to percolation-type phenomena in the electrical transport
properties. The related critical concentration $x_p$ is approximately 0.3. For
$x$ $\approx$ 0.27, we observe colossal negative magnetoresistance effects at
low temperatures, similar in magnitude as those reported for manganese oxides.
","[{""version"":""v1"",""created"":""Fri, 23 Apr 2004 12:06:41 GMT""}]","2009-11-10"
"cond-mat/0404571","Thierry Martin","R. Guyon, T. Jonckheere, V. Mujica, A. Crepieux and T. Martin","Current and noise in a model of an AC-STM molecule-metal junction","13 pages, 8 figures",,,,"cond-mat.mes-hall",,"  The transport properties of a simple model for a finite level structure (a
molecule or a dot) connected to metal electrodes in an alternating current
scanning tunneling microscope (AC-STM) configuration is studied. The finite
level structure is assumed to have strong binding properties with the metallic
substrate, and the bias between the STM tip and the hybrid metal-molecule
interface has both an AC and a DC component. The finite frequency current
response and the zero frequency photo-assisted shot noise are computed using
the Keldysh technique, and examples for a single site molecule (a quantum dot)
and for a two-site molecule are examined. The model may be useful for the
interpretation of recent experiments using an AC-STM for the study of both
conducting and insulating surfaces, where the third harmonic component of the
current is measured. The zero frequency photo-assisted shot noise serves as a
useful diagnosis for analyzing the energy level structure of the molecule. The
present work motivates the need for further analysis of current fluctuations in
electronic molecular transport.
","[{""version"":""v1"",""created"":""Fri, 23 Apr 2004 12:36:20 GMT""}]","2007-05-23"
"cond-mat/0404572","Kazuhiko Minami","Kazuhiko Minami and Masuo Suzuki","Non-Universal Critical Behaviour of Two-Dimensional Ising Systems","17 pages","J. Phys. A 27 (1994) 7301-7311","10.1088/0305-4470/27/22/008",,"cond-mat.stat-mech",,"  Two conditions are derived for Ising models to show non-universal critical
behaviour, namely conditions concerning 1) logarithmic singularity of the
specific heat and 2) degeneracy of the ground state. These conditions are
satisfied with the eight-vertex model, the Ashkin-Teller model, some Ising
models with short- or long-range interactions and even Ising systems without
the translational or the rotational invariance.
","[{""version"":""v1"",""created"":""Fri, 23 Apr 2004 12:47:53 GMT""}]","2009-11-10"
"cond-mat/0404574","Frederic Amblard","F. Amblard, G. Deffuant","The role of network topology on extremism propagation with the Relative
  Agreement opinion dynamics","15 pages, 9 figures",,"10.1016/j.physa.2004.06.102",,"cond-mat.other",,"  In (Deffuant et al., 2002), we proposed a simple model of opinion dynamics,
which we used to simulate the influence of extremists in a population.
Simulations were run without any specific interaction structure and varying the
simulation parameters, we observed different attractors such as predominance of
centrism or of extremism. We even observed in certain conditions, that the
whole population drifts to one extreme of the opinion, even if initially there
are an equal number of extremists at each extreme of the opinion axis. In the
present paper, we study the influence of the social networks on the presence of
such a dynamical behavior. In particular, we use small-world networks with
variable connectivity and randomness of the connections. We find that the drift
to a single extreme appears only beyond a critical level of connectivity, which
decreases when the randomness increases.
","[{""version"":""v1"",""created"":""Fri, 23 Apr 2004 14:44:22 GMT""}]","2015-06-24"
"cond-mat/0404576","Christian Schroll","C. Schroll, Florian Marquardt, C. Bruder","Perturbative corrections to the Gutzwiller mean-field solution of the
  Mott-Hubbard model","10 pages, 10 figues","Phys. Rev. A 70, 053609 (2004)","10.1103/PhysRevA.70.053609",,"cond-mat.soft",,"  We study the Mott-insulator transition of bosonic atoms in optical lattices.
Using perturbation theory, we analyze the deviations from the mean-field
Gutzwiller ansatz, which become appreciable for intermediate values of the
ratio between hopping amplitude and interaction energy. We discuss corrections
to number fluctuations, order parameter, and compressibility. In particular, we
improve the description of the short-range correlations in the one-particle
density matrix. These corrections are important for experimentally observed
expansion patterns, both for bulk lattices and in a confining trap potential.
","[{""version"":""v1"",""created"":""Fri, 23 Apr 2004 15:04:28 GMT""}]","2007-05-23"
"cs/0404048","Francesco Ranzato","Roberto Giacobazzi and Francesco Ranzato","Incompleteness of States w.r.t. Traces in Model Checking",,,,,"cs.LO",,"  Cousot and Cousot introduced and studied a general past/future-time
specification language, called mu*-calculus, featuring a natural time-symmetric
trace-based semantics. The standard state-based semantics of the mu*-calculus
is an abstract interpretation of its trace-based semantics, which turns out to
be incomplete (i.e., trace-incomplete), even for finite systems. As a
consequence, standard state-based model checking of the mu*-calculus is
incomplete w.r.t. trace-based model checking. This paper shows that any
refinement or abstraction of the domain of sets of states induces a
corresponding semantics which is still trace-incomplete for any propositional
fragment of the mu*-calculus. This derives from a number of results, one for
each incomplete logical/temporal connective of the mu*-calculus, that
characterize the structure of models, i.e. transition systems, whose
corresponding state-based semantics of the mu*-calculus is trace-complete.
","[{""version"":""v1"",""created"":""Fri, 23 Apr 2004 08:49:18 GMT""},{""version"":""v2"",""created"":""Wed, 24 Aug 2005 09:34:22 GMT""}]","2007-05-23"
