"hep-ph/0403301","Pengnian Shen","Da-Heng He, Ke Qian, Yi-Bing Ding, Xue-Qian Li and Peng-Nian Shen","Evaluation of Spectra of Baryons Containing Two Heavy Quarks in Bag
  Model","11 pages","Phys.Rev.D70:094004,2004","10.1103/PhysRevD.70.094004",,"hep-ph",,"  In this work, we evaluate the energy spectra of baryons which consist of two
heavy and one light quarks in the MIT bag model. The two heavy quarks
constitute a heavy scalar or axial vector diquark. Concretely, we calculate the
spectra of $|q(QQ')>_{1/2}$ and $|q(QQ')>_{3/2}$ where $Q$ and $Q'$ stand for
$b$ and/or $c$ quarks. Especially, for $|q(bc)>_{1/2}$ there can be a mixing
between $|q(bc)_0>_{1/2}$ and $|q(bc)_1>_{1/2}$ where the subscripts 0 and 1
refer to the spin state of the diquark (bc), the mixing is not calculable in
the framework of quantum mechanics (QM) as the potential model is employed, but
can be evaluated by the quantum field theory (QFT). Our numerical results
indicate that the mixing is sizeable
","[{""version"":""v1"",""created"":""Wed, 31 Mar 2004 11:17:18 GMT""},{""version"":""v2"",""created"":""Mon, 26 Apr 2004 05:10:00 GMT""}]","2016-09-06"
"hep-ph/0403302","Petter Callin","Petter Callin and Finn Ravndal","Higher order corrections to the Newtonian potential in the
  Randall-Sundrum model","12 pages, LaTeX2e with RevTeX4, 3 postscript figures; Minor
  corrections, references updated","Phys.Rev. D70 (2004) 104009","10.1103/PhysRevD.70.104009",,"hep-ph gr-qc",,"  The general formalism for calculating the Newtonian potential in fine-tuned
or critical Randall-Sundrum braneworlds is outlined. It is based on using the
full tensor structure of the graviton propagator. This approach avoids the
brane-bending effect arising from calculating the potential for a point source.
For a single brane, this gives a clear understanding of the disputed overall
factor 4/3 entering the correction. The result can be written on a compact form
which is evaluated to high accuracy for both short and large distances.
","[{""version"":""v1"",""created"":""Wed, 31 Mar 2004 12:13:34 GMT""},{""version"":""v2"",""created"":""Thu, 11 Nov 2004 11:25:09 GMT""}]","2007-05-23"
"hep-ph/0403304","R. Rosenfelder","K. Barro-Bergfl\""odt, R. Rosenfelder and M. Stingl","Worldline Variational Approximation: A New Approach to the Relativistic
  Binding Problem","10 pages, 2 figures, LaTeX, published version","Mod.Phys.Lett. A20 (2005) 2533-2544","10.1142/S0217732305018657","PSI-PR-04-04, MS-TP-04-4","hep-ph hep-th nucl-th",,"  We determine the lowest bound-state pole of the density-density correlator in
the scalar Wick-Cutkosky model where two equal-mass constituents interact via
the exchange of mesons. This is done by employing the worldline representation
of field theory together with a variational approximation as in Feynman's
treatment of the polaron. Unlike traditional methods based on the
Bethe-Salpeter equation, self-energy and vertex corrections are (approximately)
included as are crossed diagrams. Only vacuum-polarization effects of the heavy
particles are neglected. The well-known instability of the model due to
self-energy effects leads to large qualitative and quantitative changes
compared to traditional approaches which neglect them. We determine numerically
the critical coupling constant above which no real solutions of the variational
equations exist anymore and show that it is smaller than in the one-body case
due to an induced instability. The width of the bound state above the critical
coupling is estimated analytically.
","[{""version"":""v1"",""created"":""Wed, 31 Mar 2004 14:56:47 GMT""},{""version"":""v2"",""created"":""Wed, 19 Oct 2005 14:28:46 GMT""}]","2009-11-10"
"hep-th/0403286","Frieder Lenz","Frieder Lenz","Topological Concepts in Gauge Theories","Lecture notes",,"10.1007/978-3-540-31532-2_2",,"hep-th hep-lat hep-ph nucl-th",,"  In these lecture notes, an introduction to topological concepts and methods
in studies of gauge field theories is presented. The three paradigms of
topological objects, the Nielsen-Olesen vortex of the abelian Higgs model, the
't Hooft-Polyakov monopole of the non-abelian Higgs model and the instanton of
Yang-Mills theory, are discussed. The common formal elements in their
construction are emphasized and their different dynamical roles are exposed.
The discussion of applications of topological methods to Quantum Chromodynamics
focuses on confinement. An account is given of various attempts to relate this
phenomenon to topological properties of Yang-Mills theory. The lecture notes
also include an introduction to the underlying concept of homotopy with
applications from various areas of physics.
","[{""version"":""v1"",""created"":""Tue, 30 Mar 2004 17:32:18 GMT""}]","2015-06-26"
"hep-th/0403288","Keshav Dasgupta","Melanie Becker, Keshav Dasgupta, Anke Knauf, Radu Tatar","Geometric Transitions, Flops and Non-Kahler Manifolds: I","Harvmac, 79 pages, 1 .eps figure; v4: Text further expanded with
  additional results, typos corrected and references added","Nucl.Phys. B702 (2004) 207-268","10.1016/j.nuclphysb.2004.09.020","SU-ITP-04/10, UCB-PTH-04/09, LBNL-54768, UMD-PP-04/035","hep-th",,"  We construct a duality cycle which provides a complete supergravity
description of geometric transitions in type II theories via a flop in
M-theory. This cycle connects the different supergravity descriptions before
and after the geometric transitions. Our construction reproduces many of the
known phenomena studied earlier in the literature and allows us to describe
some new and interesting aspects in a simple and elegant fashion. A precise
supergravity description of new torsional manifolds that appear on the type IIA
side with branes and fluxes and the corresponding geometric transition are
obtained. A local description of new G_2 manifolds that are circle fibrations
over non-Kahler manifolds is presented.
","[{""version"":""v1"",""created"":""Tue, 30 Mar 2004 21:20:45 GMT""},{""version"":""v2"",""created"":""Wed, 14 Apr 2004 05:22:33 GMT""},{""version"":""v3"",""created"":""Wed, 15 Sep 2004 19:23:04 GMT""},{""version"":""v4"",""created"":""Fri, 2 Dec 2005 23:29:14 GMT""}]","2009-11-10"
"hep-th/0403291","Yang-Hui Evariste He","Ron Donagi, Yang-Hui He, Burt A. Ovrut, and Rene Reinbacher","Moduli Dependent Spectra of Heterotic Compactifications","11+1 pages, 2 figures, comments added","Phys.Lett.B598:279-284,2004","10.1016/j.physletb.2004.08.010","UPR-1056-T","hep-th math.AG",,"  Explicit methods are presented for computing the cohomology of stable,
holomorphic vector bundles on elliptically fibered Calabi-Yau threefolds. The
complete particle spectrum of the low-energy, four-dimensional theory is
specified by the dimensions of specific cohomology groups. The spectrum is
shown to depend on the choice of vector bundle moduli, jumping up from a
generic minimal result to attain many higher values on subspaces of
co-dimension one or higher in the moduli space. An explicit example is
presented within the context of a heterotic vacuum corresponding to an SU(5)
GUT in four-dimensions.
","[{""version"":""v1"",""created"":""Wed, 31 Mar 2004 00:09:14 GMT""},{""version"":""v2"",""created"":""Sun, 18 Apr 2004 22:48:44 GMT""}]","2010-11-19"
"hep-th/0403293","Tomasz Taylor","Ignatios Antoniadis, Tomasz R. Taylor","Topological Masses From Broken Supersymmetry","33 pages, 5 figures. v2 is the final Nuclear Physics B version
  including an additional reference and some minor corrections","Nucl.Phys.B695:103-131,2004","10.1016/j.nuclphysb.2004.06.025","CERN-PH-TH/2004-60","hep-th hep-ph",,"  We develop a formalism for computing one-loop gravitational corrections to
the effective action of D-branes. In particular, we study bulk to brane
mediation of supersymmetry breaking in models where supersymmetry is broken at
the tree-level in the closed string sector (bulk) by Scherk-Schwarz boundary
conditions, while it is realized on a collection of D-branes in a linear or
non-linear way. We compute the gravitational corrections to the fermion masses
$m_{1/2}$ (gauginos or goldstino) induced from the exchange of closed strings,
which are non-vanishing for world-sheets with Euler characteristic -1 (``genus
3/2'') due to a string diagram with one handle and one hole. We show that the
corrections have a topological origin and that in general, for a small
gravitino mass, the induced mass behaves as $m_{1/2}\propto g^4 m_{3/2}$, with
$g$ the gauge coupling. In generic orbifold compactifications however, this
leading term vanishes as a consequence of cancellations caused by discrete
symmetries, and the remainder is exponentially suppressed by a factor of
$\exp(-1/\alpha'm^2_{3/2})$.
","[{""version"":""v1"",""created"":""Wed, 31 Mar 2004 03:51:56 GMT""},{""version"":""v2"",""created"":""Tue, 15 Jun 2004 22:00:35 GMT""}]","2011-07-19"
"hep-th/0403294","Andrei Smilga","A.V. Smilga (University of Nantes)","Low--dimensional sisters of Seiberg-Witten effective theory","39 pages. A contribution to Ian Kogan memorial volume. Minor
  corrections, a reference added",,"10.1142/9789812775344_0015",,"hep-th",,"  We consider the theories obtained by dimensional reduction to D=1,2,3 of 4D
supersymmetric Yang--Mills theories and calculate there the effective
low-energy lagrangia describing moduli space dynamics -- the low-dimensional
analogs of the Seiberg--Witten effective lagrangian. The effective theories
thus obtained are rather beautiful and interesting from mathematical viewpoint.
In addition, their study allows one to understand better some essential
features of 4D supersymmetric theories, in particular -- the nonrenormalisation
theorems.
","[{""version"":""v1"",""created"":""Wed, 31 Mar 2004 15:59:56 GMT""},{""version"":""v2"",""created"":""Tue, 29 Jun 2004 13:59:36 GMT""}]","2016-11-23"
"hep-th/0403296","Betti Hartmann","Yves Brihaye (Universite de Mons, Belgium) and Betti Hartmann (IUB,
  Germany)","Spherically symmetric solutions of a (4+n)-dimensional
  Einstein-Yang-Mills model with cosmological constant","13 Tex-pages, 2 eps-figures; discussions changed; some points
  clarified","Class.Quant.Grav.22:183-194,2005","10.1088/0264-9381/22/1/012","IUB-TH-043","hep-th",,"  We construct solutions of an Einstein-Yang-Mills system including a
cosmological constant in 4+n space-time dimensions, where the n-dimensional
manifold associated with the extra dimensions is taken to be Ricci flat.
Assuming the matter and metric fields to be independent of the n extra
coordinates, a spherical symmetric Ansatz for the fields leads to a set of
coupled ordinary differential equations. We find that for n > 1 only solutions
with either one non-zero Higgs field or with all Higgs fields constant and zero
gauge fields exist. We give the analytic solutions available in this model.
These are ``embedded'' abelian solutions with a diverging size of the manifold
associated with the extra n dimensions. Depending on the choice of parameters,
these latter solutions either represent naked singularities or they possess a
single horizon.
  We also present solutions of the effective 4-dimensional
Einstein-Yang-Mills-Higgs-dilaton model, where the higher dimensional
cosmological constant induces a Liouville-type potential. The solutions are
non-abelian solutions with diverging Higgs fields, which exist only up to a
maximal value of the cosmological constant.
","[{""version"":""v1"",""created"":""Wed, 31 Mar 2004 08:58:29 GMT""},{""version"":""v2"",""created"":""Thu, 3 Jun 2004 14:40:04 GMT""},{""version"":""v3"",""created"":""Tue, 19 Oct 2004 05:58:43 GMT""}]","2010-11-19"
"hep-th/0403297","Saharian","Aram A. Saharian, Anna S. Kotanjyan","Radiation from an oscillator uniformly moving along the axis of a
  dielectric cylinder","16 pages, 8 EPS figures","Nucl.Instrum.Meth. B226 (2004) 351-364","10.1016/j.nimb.2004.06.036",,"hep-th cond-mat.other",,"  The radiation generated by a charged longitudinal oscillator moving with a
constant drift velocity along the axis of a dielectric cylinder immersed in a
homogeneous medium is investigated. For an arbitrary oscillation law a formula
is derived for the spectral-angular distribution of this radiation. Under the
Cherenkov condition for the dielectric permittivity of the external medium and
oscillator drift velocity this formula contains two summands. The first one
corresponds to the radiation with a continuous spectrum which propagates at the
Cherenkov angle of the external medium. The second one describes the radiation
which has a discrete spectrum for a given angle of propagation. The
corresponding frequencies are multiples of the Doppler-shifted oscillation
frequency. The results of numerical calculations for the angular distribution
of the radiated quanta are presented and they are compared with the
corresponding quantities for the radiation in a homogeneous medium. It is shown
that the presence of the cylinder can increase essentially the radiation
intensity.
","[{""version"":""v1"",""created"":""Wed, 31 Mar 2004 09:14:38 GMT""}]","2015-06-26"
"hep-th/0403298","James Norman","James P. Norman","Casimir effect between anti-de Sitter braneworlds","14 pages, 3 figures, revtex. Typos corrected and references added.
  Minor mistakes in Eq. 48 and Eq. A10 corrected","Phys.Rev. D69 (2004) 125015","10.1103/PhysRevD.69.125015",,"hep-th",,"  We calculate the one-loop effective action of a scalar field with general
mass and coupling to the curvature in the detuned Randall-Sundrum brane world
scenario, where the four-dimensional branes are anti-de Sitter. We make use of
conformal transformations to map the problem to one on the direct product of
the hyperbolic space H^4 and the interval. We also include the cocycle function
for this transformation. This Casimir potential is shown to give a sizable
correction to the classical radion potential for small values of brane
separation.
","[{""version"":""v1"",""created"":""Wed, 31 Mar 2004 14:27:08 GMT""},{""version"":""v2"",""created"":""Thu, 29 Jul 2004 13:23:17 GMT""}]","2009-11-10"
"hep-th/0403299","Ralph Blumenhagen","Ralph Blumenhagen, Timo Weigand","A Note on Partition Functions of Gepner Model Orientifolds","14 pages, TeX (harvmac), refs. added","Phys.Lett. B591 (2004) 161-169","10.1016/j.physletb.2004.04.018","DAMTP-2004-36","hep-th",,"  In this note we generalize the description of simple current extended Gepner
Model orientifolds as presented in hep-th/0401148 to the case of even levels
and non-trivial dressings of the parity transformation. We provide a
comprehensive list of all the important ingredients for the construction of
such orientifolds. Namely we present explicit expressions for the Klein-bottle,
annulus and Moebius strip amplitudes and derive the general tadpole
cancellation conditions. As an example we construct a supersymmetric Pati-Salam
like model.
","[{""version"":""v1"",""created"":""Wed, 31 Mar 2004 15:00:30 GMT""},{""version"":""v2"",""created"":""Mon, 19 Apr 2004 15:04:43 GMT""}]","2009-11-10"
"math-ph/0403062","Nicolae Cotfas","Nicolae Cotfas","On the self-similarities of the Penrose tiling","5 pages, LaTeX2e in IOP Style",,,,"math-ph math.MP",,"  We show that the well known two-dimensional Penrose tiling admits an infinite
number of independent scaling factors and an infinite number of inflation
centers.
","[{""version"":""v1"",""created"":""Wed, 31 Mar 2004 11:13:35 GMT""}]","2007-05-23"
"math-ph/0403063","Jeffrey Schenker","Jeffrey H Schenker","H\""older equicontinuity of the integrated density of states at weak
  disorder","15 Pages, typos corrected, comments and ref. [1] added, theorems 3,4
  combined","Lett. Math. Phys. 70 (2004), 195-209.","10.1007/s11005-004-3757-x",,"math-ph math.MP",,"  H\""older continuity, $|N_\lambda(E)-N_\lambda(E')|\le C |E-E'|^\alpha$, with
a constant $C$ independent of the disorder strength $\lambda$ is proved for the
integrated density of states $N_\lambda(E)$ associated to a discrete random
operator $H = H_o + \lambda V$ consisting of a translation invariant hopping
matrix $H_o$ and i.i.d. single site potentials $V$ with an absolutely
continuous distribution, under a regularity assumption for the hopping term.
","[{""version"":""v1"",""created"":""Wed, 31 Mar 2004 15:11:04 GMT""},{""version"":""v2"",""created"":""Mon, 16 Aug 2004 13:12:48 GMT""}]","2007-05-23"
"math/0403522","Pietro Corvaja","Pietro Corvaja, Umberto Zannier","On the rational approximations to the powers of an algebraic number","12 pages, plain Tex",,,,"math.NT",,"  About fifty years ago Mahler proved that if $\alpha>1$ is rational but not an
integer and if $0<l<1$ then the fractional part of $\alpha^n$ is $>l^n$ apart
from a finite set of integers $n$ depending on $\alpha$ and $l$. Answering
completely a question of Mahler we show that the same conclusion holds for all
algebraic numbers which are not $d$-th roots of Pisot numbers. By related
methods, we also answer a question by Mendes France, characterizing completely
the quadratic irrationals $\alpha$ such that the continued fraction of
$\alpha^n$ has period length tending to infinity.
","[{""version"":""v1"",""created"":""Tue, 30 Mar 2004 16:24:16 GMT""}]","2007-05-23"
"math/0403523","Richard Urz\'ua-Luz Doctor","Rodrigo Bam\'on, Jan Kiwi, Juan Rivera-Letelier, Richard Urz\'ua","On the Topology of Solenoidal Attractors of the Cylinder","30 pages",,,,"math.DS",,"  We study the dynamics of skew product endomorphisms acting on the cylinder
$\cyl$, of the form $$ \tht \mapsto (\ell \theta, \la \theta + \tau (\theta)),
$$ where $ \ell \geq 2$ is an integer, $\la \in (0,1)$ and $\tau: \T \to \R$ is
a continuous function. We are interested on {\it topological} properties of the
global attractor $\Omegalt$ of this map. Given $\ell$ and a Lipschitz function
$\tau$, we show that the attractor set $\Omegalt$ is homeomorphic to a closed
topological annulus for all $\la$ sufficiently close to 1. Moreover, we prove
that $\Omegalt$ is a Jordan curve for at most finitely many $\la \in (0,1)$.
These results rely on a detailed study of iterated ``cohomological'' equations
of the form $\tau = \cL_{\la_1} \mu_1$, $\mu_1 = \cL_{\la_2} \mu_2, >...$,
where $\cL_\la \mu = \mu \circ \ml - \la \mu$ and $\ml: \T \to \T$ denotes the
multiplication by $\ell$ map. We show the following finiteness result: each
Lipschitz function $\tau$ can be written in a canonical way as, $$ \tau =
\cL_{\la_1} \circ ... \circ \cL_{\la_m} \mu, $$ where $m \ge 0$, $\lambda_1,
..., \lambda_m \in (0, 1]$ and the Lipschitz function $\mu$ satisfies $\mu \neq
\cL_\la \rho$ for every continuous function $\rho$ and every $\la \in (0,1]$.
","[{""version"":""v1"",""created"":""Tue, 30 Mar 2004 17:17:25 GMT""}]","2007-05-23"
"math/0403524","Gregory D. Landweber","Gregory D. Landweber (University of Oregon)","Twisted representation rings and Dirac induction","26 pages. Shortened the paper and cleaned up problems with cocycles
  vs. cohomology classes, Proposition 2, and other minor issues","J. Pure Appl. Algebra 206 (2006), no. 1-2, 21-54",,,"math.RT math.KT",,"  Extending ideas of twisted equivariant $K$-theory, we construct twisted
versions of the representation rings for Lie superalgebras and Lie supergroups,
built from projective $\Z_{2}$-graded representations with a given cocycle. We
then investigate the pullback and pushforward maps on these representation
rings (and their completions) associated to homomorphisms of Lie superalgebras
and Lie supergroups.
  As an application, we consider the Lie supergroup $\Pi (T^{*}G)$, obtained by
taking the cotangent bundle of a compact Lie group and reversing the parity of
its fibers. An inclusion $H \hookrightarrow G$ induces a homomorphism from the
twisted representation ring of $\Pi(T^{*}H)$ to the twisted representation ring
of $\Pi(T^{*}G)$, which pulls back via an algebraic version of the Thom
isomorphism to give an additive homomorphism from $K_{H}(\mathrm{pt})$ to
$K_{G}(\mathrm{pt})$ (possibly with twistings). We then show that this
homomorphism is in fact Dirac induction, which takes an $H$-module $U$ to the
$G$-equivariant index of the Dirac operator $\dirac \otimes U$ on the
homogeneous space $G/H$ with values in the homogeneous bundle induced by $U$.
","[{""version"":""v1"",""created"":""Tue, 30 Mar 2004 18:16:23 GMT""},{""version"":""v2"",""created"":""Mon, 25 Oct 2004 20:16:24 GMT""}]","2007-05-23"
"math/0403525","Razvan Veliche","Razvan Veliche","Genus 2 mapping class groups are not Kahler","7 pages, no figures. v2: corrected typos and clarified some
  arguments. To be published in Proc. AMS",,,,"math.AG math.GT",,"  The goal of these notes is to prove that the mapping class groups of a closed
orientable surface of genus two, with punctures, are not K\""ahler
","[{""version"":""v1"",""created"":""Tue, 30 Mar 2004 20:33:51 GMT""},{""version"":""v2"",""created"":""Tue, 7 Mar 2006 18:42:21 GMT""}]","2007-05-23"
"math/0403526","Henning Krause","Henning Krause","The stable derived category of a noetherian scheme","Final version, to appear in Compositio Math.; 38 pages",,,,"math.AG math.RA math.RT",,"  For a noetherian scheme, we introduce its unbounded stable derived category.
This leads to a recollement which reflects the passage from the bounded derived
category of coherent sheaves to the quotient modulo the subcategory of perfect
complexes. Some applications are included, for instance an analogue of maximal
Cohen-Macaulay approximations, a construction of Tate cohomology, and an
extension of the classical Grothendieck duality. In addition, the relevance of
the stable derived category in modular representation theory is indicated.
","[{""version"":""v1"",""created"":""Tue, 30 Mar 2004 21:48:08 GMT""},{""version"":""v2"",""created"":""Wed, 21 Apr 2004 15:53:41 GMT""},{""version"":""v3"",""created"":""Mon, 27 Sep 2004 10:11:18 GMT""}]","2007-05-23"
"math/0403527","Adam S. Sikora","Marta M. Asaeda, Jozef H. Przytycki, Adam S. Sikora","Khovanov homology of links in I-bundles over surfaces","The papers math.QA/0403527 and math.QA/0409414 v.1 are now merged
  together. The final version is available at math.QA/0409414 v.2. To avoid
  duplication of papers, math.QA/0403527 is removed",,,,"math.QA math.GT",,"  The papers math.QA/0403527 and math.QA/0409414 v.1 are now merged together.
The final version is available at math.QA/0409414 v.2. To avoid duplication of
papers, math.QA/0403527 is now removed.
","[{""version"":""v1"",""created"":""Wed, 31 Mar 2004 00:01:32 GMT""},{""version"":""v2"",""created"":""Tue, 21 Sep 2004 20:31:33 GMT""},{""version"":""v3"",""created"":""Tue, 28 Dec 2004 17:18:55 GMT""}]","2007-05-23"
"math/0403528","Nobuhiro Honda","Nobuhiro Honda","Self-dual metrics and twenty-eight bitangents","71 pages. V2; errors corrected. V3; 15 figures added",,,,"math.DG math.AG",,"  We consider self-dual metrics on 3CP^2 of positive scalar curvature admitting
a non-trivial Killing field, but which is not conformally isometric to LeBrun's
metrics. Firstly, we determine defining equations of the twistor spaces of such
self-dual metrics. Next we prove that conversely, the complex threefolds
defined by the equations always become twistor spaces of self-dual metrics on
3CP^2 of the above kind. As a corollary, we determine a global structure of the
moduli spaces of these self-dual metrics; namely we show that the moduli space
is non-empty and isomorphic to R^3/G, where G is an involution of R^3 having
one-dimensional fixed locus. Combined with works of LeBrun, this settles a
moduli problem of self-dual metrics on 3CP^2 of positive scalar curvature
admitting a non-trivial Killing field. In our proof, a key role is played by a
classical result in algebraic geometry that a smooth plane quartic always
possesses twenty-eight bitangents.
","[{""version"":""v1"",""created"":""Wed, 31 Mar 2004 04:01:55 GMT""},{""version"":""v2"",""created"":""Wed, 19 May 2004 08:00:14 GMT""},{""version"":""v3"",""created"":""Wed, 19 Apr 2006 09:05:51 GMT""}]","2007-05-23"
"math/0403531","Susumu Oda","Susumu Oda","On unramified finitely generaed extensions of polynomial rings over a
  field",,,,,"math.AC math.AG",,"  This article has been withdrown by the author.
","[{""version"":""v1"",""created"":""Wed, 31 Mar 2004 05:04:04 GMT""},{""version"":""v2"",""created"":""Sat, 3 Apr 2004 08:49:35 GMT""},{""version"":""v3"",""created"":""Fri, 4 Jun 2004 08:09:23 GMT""},{""version"":""v4"",""created"":""Sun, 13 Jun 2004 22:48:37 GMT""},{""version"":""v5"",""created"":""Wed, 30 Jun 2004 05:12:18 GMT""},{""version"":""v6"",""created"":""Thu, 1 Jul 2004 08:17:38 GMT""},{""version"":""v7"",""created"":""Fri, 2 Jul 2004 04:23:54 GMT""},{""version"":""v8"",""created"":""Mon, 12 Jul 2004 02:38:36 GMT""},{""version"":""v9"",""created"":""Tue, 13 Jul 2004 03:55:19 GMT""}]","2007-05-23"
"math/0403532","Walter van Assche","Kelly Postelmans, Walter Van Assche","Multiple little q-Jacobi polynomials","15 pages","J. Comput. Appl. Math. 178 (2005), 361-375",,,"math.CA",,"  We introduce two kinds of multiple little q-Jacobi polynomials by imposing
orthogonality conditions with respect to r discrete little q-Jacobi measures on
the exponential lattice q^k (k=0,1,2,3,...), where 0 < q < 1. We show that
these multiple little q-Jacobi polynomials have useful q-difference properties,
such as a Rodrigues formula (consisting of a product of r difference
operators). Some properties of the zeros of these polynomials and some
asymptotic properties will be given as well.
","[{""version"":""v1"",""created"":""Wed, 31 Mar 2004 06:12:18 GMT""}]","2013-10-04"
