"cond-mat/0403739","Jing Wang","Jing Wang, Eric Polizzi and Mark Lundstrom","A Three-Dimensional Quantum Simulation of Silicon Nanowire Transistors
  with the Effective-Mass Approximation","38 pages, 11 figures, submitted to Journal of Applied Physics",,"10.1063/1.1769089",,"cond-mat.other",,"  The silicon nanowire transistor (SNWT) is a promising device structure for
future integrated circuits, and simulations will be important for understanding
its device physics and assessing its ultimate performance limits. In this work,
we present a three-dimensional quantum mechanical simulation approach to treat
various SNWTs within the effective-mass approximation. We begin by assuming
ballistic transport, which gives the upper performance limit of the devices.
The use of a mode space approach (either coupled or uncoupled) produces high
computational efficiency that makes our 3D quantum simulator practical for
extensive device simulation and design. Scattering in SNWTs is then treated by
a simple model that uses so-called Buttiker probes, which was previously used
in metal-oxide-semiconductor field effect transistor (MOSFET) simulations.
Using this simple approach, the effects of scattering on both internal device
characteristics and terminal currents can be examined, which enables our
simulator to be used for the exploration of realistic performance limits of
SNWTs.
","[{""version"":""v1"",""created"":""Tue, 30 Mar 2004 21:04:09 GMT""}]","2009-11-10"
"cond-mat/0403740","Martin Z. Bazant","Jaehyuk Choi (MIT Math), Dionisios Margetis (MIT Math), Todd M.
  Squires (Caltech ACM and Physics), and Martin Z. Bazant (MIT Math)","Steady advection-diffusion around finite absorbers in two-dimensional
  potential flows","29 pages, 12 figs (mostly in color)",,"10.1017/S0022112005005008",,"cond-mat.soft cond-mat.stat-mech",,"  We perform an exhaustive study of the simplest, nontrivial problem in
advection-diffusion -- a finite absorber of arbitrary cross section in a steady
two-dimensional potential flow of concentrated fluid. This classical problem
has been studied extensively in the theory of solidification from a flowing
melt, and it also arises in Advection-Diffusion-Limited Aggregation. In both
cases, the fundamental object is the flux to a circular disk, obtained by
conformal mapping from more complicated shapes. We construct the first accurate
numerical solution using an efficient new method, which involves mapping to the
interior of the disk and using a spectral method in polar coordinates. Our
method also combines exact asymptotics and an adaptive mesh to handle boundary
layers. Starting from a well-known integral equation in streamline coordinates,
we also derive new, high-order asymptotic expansions for high and low P\'eclet
numbers ($\Pe$). Remarkably, the `high' $\Pe$ expansion remains accurate even
for such low $\Pe$ as $10^{-3}$. The two expansions overlap well near $\Pe =
0.1$, allowing the construction of an analytical connection formula that is
uniformly accurate for all $\Pe$ and angles on the disk with a maximum relative
error of 1.75%. We also obtain an analytical formula for the Nusselt number
($\Nu$) as a function of the P\'eclet number with a maximum relative error of
0.53% for all possible geometries. Because our finite-plate problem can be
conformally mapped to other geometries, the general problem of two-dimensional
advection-diffusion past an arbitrary finite absorber in a potential flow can
be considered effectively solved.
","[{""version"":""v1"",""created"":""Tue, 30 Mar 2004 21:46:19 GMT""},{""version"":""v2"",""created"":""Mon, 18 Apr 2005 19:47:44 GMT""},{""version"":""v3"",""created"":""Mon, 18 Apr 2005 20:19:58 GMT""}]","2009-11-10"
"cond-mat/0403741","Bing Dong","Bing Dong, Ivana Djuric, H. L. Cui, and X. L. Lei","Time-dependent resonant tunneling for a parallel-coupled double quantum
  dots","8 pages, 5 figures","J. Phys.: Cond. Matter 16, 4303 (2004)","10.1088/0953-8984/16/24/012",,"cond-mat.mes-hall",,"  We derive the quantum rate equations for an Aharonov-Bohm interferometer with
two vertically coupled quantum dots embedded in each of two arms by means of
the nonequilibrium Green's function in the sequential tunneling regime. Basing
on these equations, we investigate time-dependent resonant tunneling under a
small amplitude irradiation and find that the resonant photon-assisted
tunneling peaks in photocurrent demonstrate a combination behavior of Fano and
Lorentzian resonances due to the interference effect between the two pathways
in this parallel configuration, which is controllable by threading the magnetic
flux inside this device.
","[{""version"":""v1"",""created"":""Tue, 30 Mar 2004 21:56:58 GMT""}]","2009-11-10"
"cond-mat/0403742","Gavin Lawes","A.P. Ramirez, G. Lawes, D. Li, M.A. Subramanian","Valence-electron transfer and a metal-insulator transition in a strongly
  correlated perovskite oxide","15 pages, 4 figures, 1 table",,"10.1016/j.ssc.2004.04.014",,"cond-mat.mtrl-sci cond-mat.str-el",,"  We present transport and thermal data for the quadruple-perovskites
MCu3(Ti1-xRux)4O12 where 0 < x < 1. A metal-insulator transition (MIT) occurs
for Ru concentrations x~0.75. At the same time, the Cu2+ antiferromagnetic
state is destroyed and it's magnetic entropy suppressed by Ru on a 1:1 basis.
This implies that each Ru transfers an electron to a Cu ion and thus the MIT
correlates with filling the Cu 3d shell. The Cu spin entropy in this strongly
correlated electron material provides a unique probe among MIT systems.
","[{""version"":""v1"",""created"":""Tue, 30 Mar 2004 23:05:16 GMT""}]","2009-11-10"
"cond-mat/0403743","Tanja Cuk","T. Cuk, A.D. Gromko, Zhe Sun, Z.-X. Shen, D.S. Dessau","Persistence of an Energy Scale in Over-Doped High-Tc Superconductors","7 Pages, 2 Figures; Submitted to Nature as a Brief Communication;
  Note added in reply to cond-mat/0405203",,,,"cond-mat.supr-con",,"  Citing the disappearance of a sharp peak in the electron self-energy,
extracted from optics and angle-resolved photoemission spectroscopy (ARPES)
experiments in deeply over-doped copper-oxide superconductors with Tc of
55-60K, Hwang, Timusk et al. argue that sharp modes, be they phononic or
magnetic in origin, are not important for superconductivity in the cuprates. If
true, this would have been an important progress. We show, however, their
conclusions are unfounded because of the insensitivity of the optics experiment
in studying strongly anisotropic material like the cuprates, and a
misrepresentation of existing ARPES data. In an added note, we refute the claim
by Valla, Timusk et. al. that the doping level of the data presented in the
first part of this comment is lower than reported.
","[{""version"":""v1"",""created"":""Tue, 30 Mar 2004 23:57:50 GMT""},{""version"":""v2"",""created"":""Wed, 26 May 2004 18:50:48 GMT""}]","2007-05-23"
"cond-mat/0403744","Gregory A. Fiete","Gregory A. Fiete and Leon Balents","Green's function for magnetically incoherent interacting electrons in
  one dimension","4 pages, 1 figure, corrected typos","Phys. Rev. Lett. 93, 226401 (2004)","10.1103/PhysRevLett.93.226401","NSF-KITP-04-47","cond-mat.mes-hall cond-mat.str-el",,"  Using a path integral approach and bosonization, we calculate the low energy
asymptotics of the one particle Green's function for a ``magnetically
incoherent'' one dimensional strongly interacting electron gas at temperatures
much greater than the typical exchange energy but much lower than the Fermi
energy. The Green's function exhibits features reminiscent of spin-charge
separation, with exponential spatial decay and scaling behavior with
interaction dependent anomalous exponents inconsistent with any unitary
conformal field theory. We compute the tunneling density of states at low
energies and find that it is a power law in energy with exponent $1/(4g)-1$,
where $g$ is the Luttinger interaction parameter in the charge sector. The
underlying physics is made transparent by the simplicity of the approach. Our
results generalize those of Cheianov and Zvonarev [Phys. Rev. Lett. {\bf 92},
176401 (2004)].
","[{""version"":""v1"",""created"":""Wed, 31 Mar 2004 01:07:59 GMT""},{""version"":""v2"",""created"":""Fri, 2 Apr 2004 23:08:09 GMT""},{""version"":""v3"",""created"":""Sat, 16 Oct 2004 23:10:27 GMT""},{""version"":""v4"",""created"":""Mon, 22 Nov 2004 22:48:55 GMT""}]","2007-05-23"
"cond-mat/0403745","Hyunsuk Hong","H. Hong, Beom Jun Kim, M. Y. Choi, and Hyunggyu Park","Factors that predict better synchronizability on complex networks","to appear in Phys. Rev. E","Phys. Rev. E 69, 067105 (2004)","10.1103/PhysRevE.69.067105",,"cond-mat.stat-mech",,"  While shorter characteristic path length has in general been believed to
enhance synchronizability of a coupled oscillator system on a complex
network,the suppressing tendency of the heterogeneity of the degree
distribution, even for shorter characteristic path length, has also been
reported. To see this, we investigate the effects of various factors such as
the degree, characteristic path length, heterogeneity, and betweenness
centrality on synchronization, and find a consistent trend between the
synchronization and the betweenness centrality. The betweenness centrality is
thus proposed as a good indicator for synchronizability.
","[{""version"":""v1"",""created"":""Wed, 31 Mar 2004 01:44:59 GMT""}]","2009-11-10"
"cond-mat/0403746","David Santiago","Zaira Nazario, David I. Santiago","On Quantum Bosonic Solids and Bosonic Superfluids","24 pages, 2 figures",,,,"cond-mat.soft",,"  We review the nature of superfluid ground states and the universality of
their properties with emphasis to Bose Einstein Condensate systems in atomic
physics. We then study the superfluid Mott transition in such systems. We find
that there could be two types of Mott transitions and phases. One of them was
described long ago and corresponds to suppression of Josephson tunneling within
superfluids sitting at each well. On the other hand, the conditions of optical
lattice BEC experiments are such that either the coherence length is longer
than the interwell separation, or there is too small a number of bosons per
well. This vitiates the existence of a superfluid order parameter within a
well, and therefore of Josephson tunneling between wells. Under such
conditions, there is a transition to a Mott phase which corresponds to
suppression of individual boson tunneling among wells. This last transition is
in general discontinuous and can happen for incommensurate values of bosons per
site. If the coherence length is small enough and the number of bosons per site
large enough, the transition studied in the earlier work will happen.
","[{""version"":""v1"",""created"":""Wed, 31 Mar 2004 02:38:04 GMT""}]","2007-05-23"
"cond-mat/0403747","Yoshihiro Nishiyama","Yoshihiro Nishiyama","Folding of the triangular lattice in a discrete three-dimensional space:
  Density-matrix-renormalization-group study",,"Phys. Rev. E 70, 016101 (2004).","10.1103/PhysRevE.70.016101",,"cond-mat.stat-mech",,"  Folding of the triangular lattice in a discrete three-dimensional space is
investigated numerically. Such ``discrete folding'' has come under through
theoretical investigation, since Bowick and co-worker introduced it as a
simplified model for the crumpling of the phantom polymerized membranes. So
far, it has been analyzed with the hexagon approximation of the cluster
variation method (CVM). However, the possible systematic error of the
approximation was not fully estimated; in fact, it has been known that the
transfer-matrix calculation is limited in the tractable strip widths L \le 6.
Aiming to surmount this limitation, we utilized the density-matrix
renormalization group. Thereby, we succeeded in treating strip widths up to
L=29 which admit reliable extrapolations to the thermodynamic limit. Our data
indicate an onset of a discontinuous crumpling transition with the latent heat
substantially larger than the CVM estimate. It is even larger than the latent
heat of the planar (two dimensional) folding, as first noticed by the preceding
CVM study. That is, contrary to our naive expectation, the discontinuous
character of the transition is even promoted by the enlargement of the
embedding-space dimensions. We also calculated the folding entropy, which
appears to lie within the best analytical bound obtained previously via
combinatorics arguments.
","[{""version"":""v1"",""created"":""Wed, 31 Mar 2004 02:40:37 GMT""}]","2009-11-10"
"cond-mat/0403748","Frederic Carlier","F. Carlier, V.M. Akulin","Quantum interference in nanofractals and its optical manifestation","19 pages, 6 figures","Phys. Rev. B, 69(11), 115433 (2004)","10.1103/PhysRevB.69.115433",,"cond-mat.dis-nn",,"  We consider quantum interferences of ballistic electrons propagating inside
fractal structures with nanometric size of their arms. We use a scaling
argument to calculate the density of states of free electrons confined in a
simple model fractal. We show how the fractal dimension governs the density of
states and optical properties of fractal structures in the RF-IR region. We
discuss the effect of disorder on the density of states along with the
possibility of experimental observation.
","[{""version"":""v1"",""created"":""Wed, 31 Mar 2004 08:32:50 GMT""}]","2009-11-10"
"cond-mat/0403749","Liangshan Chen","Liang-Shan Chen, Chao-Hsien Kuo, Zhen Ye","Acoustic imaging and collimating by slabs of sonic crystals made from
  arrays of rigid cylinders in air","11 pages, 5 figures","Appl. Phys. Letts. 85, 1072-1074 (2004)","10.1063/1.1781351",,"cond-mat.mtrl-sci",,"  We show some new properties of the acoustic propagation in two-dimensional
sonic crystals, formed by parallel rigid cylinders placed in air. The
transmission through slabs of sonic crystals and the associated band structures
are considered. It is shown that within partial bandgaps, the waves tend to be
collimated or guided into the direction in which the propagation is allowed.
Such a feature also prevails in the situations in which deaf bands appear. We
show that within the partial bandgaps, a stable imaging effect can be obtained
for flat sonic crystal slabs, in analogy to the cases with photonic crystals.
","[{""version"":""v1"",""created"":""Wed, 31 Mar 2004 08:37:13 GMT""}]","2009-11-10"
"cond-mat/0403750","David Carpentier","Josef Schriefl (ITF, CNRS), Maxime Clusel (CNRS), David Carpentier
  (CNRS), Pascal Degiovanni (CNRS)","Nonstationary dephasing of two level systems",,"Europhysics Letters 69 (2005) 156","10.1209/epl/i2004-10324-1",,"cond-mat.mes-hall",,"  We investigate the influence of nonstationary 1/f^mu noise, produced by
interacting defects, on a quantum two-level system. Adopting a simple
phenomenological model for this noise we describe exactly the corresponding
dephasing in various regimes. The nonstationarity and pronounced non-Gaussian
features of this noise induce new anomalous dephasing scenarii. Beyond a
history-dependent critical coupling strength the dephasing time exhibits a
strong dependence on the age of the noise and the decay of coherence is not
exponential.
","[{""version"":""v1"",""created"":""Wed, 31 Mar 2004 08:41:11 GMT""},{""version"":""v2"",""created"":""Tue, 11 Jan 2005 13:25:27 GMT""}]","2009-11-10"
"cond-mat/0403751","Andrei Mishchenko S.","A. S. Mishchenko (1and 2) and N. Nagaosa (1 and 3) ((1) CREST JST, (2)
  RRC ""Kurchatov Institute"", (3) CREST The University of Tokyo)","Polaron in t-J model","4 pages, 4 figures","Phys. Rev. Lett., vol. 93, 036402 (2004)","10.1103/PhysRevLett.93.036402",,"cond-mat.str-el cond-mat.supr-con",,"  We present numeric results for ground state and angle resolved photoemission
spectra (ARPES) for single hole in t-J model coupled to optical phonons. The
systematic-error free diagrammatic Monte Carlo is employed where the Feynman
graphs for the Matsubara Green function in imaginary time are summed up
completely with respect to phonons variables, while magnetic variables are
subjected to non-crossing approximation. We obtain that at electron-phonon
coupling constants relevant for high Tc cuprates the polaron undergoes
self-trapping crossover to strong coupling limit and theoretical ARPES
demonstrate features observed in experiment: a broad peak in the bottom of the
spectra has momentum dependence which coincides with that of hole in pure t-J
model.
","[{""version"":""v1"",""created"":""Wed, 31 Mar 2004 09:21:40 GMT""}]","2009-11-10"
"cond-mat/0403752","Somendra M. Bhattacharjee","Rajeev Kapri, Somendra M. Bhattacharjee and Flavio Seno","Complete Phase Diagram of DNA Unzipping: Eye, Y-fork and triple point","4 pages, 4 figures; revised version: misprints corrected. References
  corrected/added. To appear in Physical Review Letters","Physical Review Letters 93, 248102 (2004)","10.1103/PhysRevLett.93.248102",,"cond-mat.soft cond-mat.stat-mech physics.bio-ph q-bio.BM",,"  We study the unzipping of double stranded DNA (dsDNA) by applying a pulling
force at a fraction $s$ $(0 \le s \le 1)$ from the anchored end. From exact
analytical and numerical results, the complete phase diagram is presented. The
phase diagram shows a strong ensemble dependence for various values of $s$. In
addition, we show the existence of an ``eye'' phase and a triple point.
","[{""version"":""v1"",""created"":""Wed, 31 Mar 2004 09:01:30 GMT""},{""version"":""v2"",""created"":""Mon, 8 Nov 2004 15:27:30 GMT""}]","2009-11-10"
"cond-mat/0403753","Yann Gallais","Y. Gallais, A. Sacuto, T. P. Devereaux and D. Colson","Interplay between the pseudogap and superconductivity in HgBa$_2$CuO$_4$
  single crystals","4 pages, 4 figures","Phys. Rev. B 71, 012506 (2005)","10.1103/PhysRevB.71.012506",,"cond-mat.supr-con cond-mat.str-el",,"  We report a doping dependant Electronic Raman Scattering (ERS) study of
HgBa$_2$CuO$_{4+\delta}$ (Hg-1201) single crystals. We investigate the dynamics
of the antinodal and nodal quasiparticles. We show that the dynamical response
of the antinodal quasiparticles is strongly reduced towards the underdoped
regime in both the normal and superconducting states. When probing the nodal
quasiparticles, we are able to distinguish between the energy scale of the
pseudogap and that of the superconducting gap. A simple model relating the
suppression of the dynamical response of the antinodal quasiparticles to
fluctuations related to a competing phase is proposed.
","[{""version"":""v1"",""created"":""Wed, 31 Mar 2004 10:14:18 GMT""},{""version"":""v2"",""created"":""Sun, 16 Jan 2005 21:50:45 GMT""}]","2009-11-10"
"cond-mat/0403754","Eduard Vives","Francisco-Jose Perez-Reche, Eduard Vives","Spanning avalanches in the three-dimensional Gaussian Random Field Ising
  Model with metastable dynamics: field dependence and geometrical properties","16 pages, 17 figures",,"10.1103/PhysRevB.70.214422",,"cond-mat.dis-nn cond-mat.stat-mech",,"  Spanning avalanches in the 3D Gaussian Random Field Ising Model (3D-GRFIM)
with metastable dynamics at T=0 have been studied. Statistical analysis of the
field values for which avalanches occur has enabled a Finite-Size Scaling (FSS)
study of the avalanche density to be performed. Furthermore, direct measurement
of the geometrical properties of the avalanches has confirmed an earlier
hypothesis that several kinds of spanning avalanches with two different fractal
dimensions coexist at the critical point. We finally compare the phase diagram
of the 3D-GRFIM with metastable dynamics with the same model in equilibrium at
T=0.
","[{""version"":""v1"",""created"":""Wed, 31 Mar 2004 10:40:21 GMT""}]","2009-11-10"
"cond-mat/0403755","Biao-Bing Jin","B.B.Jin, T. Dahm, C. Iniotakis, A.I.Gubin, Eun-Mi Choi, Hyun Jung Kim,
  Sung-Ik Lee, W.N.Kang, S.F.Wang, Y.L.Zhou, A.V.Pogrebnyakov, J.M.Redwing,
  X.X.Xi, and N. Klein","Correlation of microwave surface impedance of MgB_2 thin film with
  material parameters and a temperature niche for microwave applications","9 pages, 4 figures, submitted to Applied Physics Letters",,,,"cond-mat.supr-con",,"  Two issues related to the microwave surface impedance Z_s of MgB_2 thin film
are discussed in this Letter, both being significant for potential microwave
applications. At first, a correlation between Zs and Alpha = Xi/l was found,
where Xi is the coherence length, and l is the mean free path. The surface
resistance Rs decreases with Alpha at moderate and large values of Alpha and
saturates when Alpha approaches one. The values of the penetration depth at
zero temperature Lamda(0) for different films could be well fitted by Lamda_L
(1+Alpha)^(1/2), yielding a London penetration depth Lamda_L of 33.6 nm. The
second issue is to find a temperature niche for possible microwave
applications. Between 10K and 15K, our best MgB_2 films possess the lowest Rs
values compared with other superconductors such as NbN, Nb3Sn and the
high-temperature superconductor YBCO.
","[{""version"":""v1"",""created"":""Wed, 31 Mar 2004 14:33:13 GMT""}]","2007-05-23"
"cond-mat/0403756","David Quigley","D. Quigley, M.I.J Probert","Langevin Dynamics in Constant Pressure Extended Systems",,"J. Chem. Phys. 120 (24) pp 11432-11442 (2004)","10.1063/1.1755657",,"cond-mat.other cond-mat.stat-mech",,"  The advantages of performing Langevin Dynamics in extended systems are
discussed. A simple Langevin Dynamics scheme for producing the canonical
ensemble is reviewed, and is then extended to the Hoover ensemble. We show that
the resulting equations of motion generate the isobaric-isothermal ensemble.
The Parrinello-Rahman ensemble is then discussed and we show that despite the
presence of intrinsic probability gradients in this system, a Langevin Dynamics
approach samples the extended phase space in the correct fashion. The
implementation of these methods in the ab-initio plane wave density functional
theory (DFT) code CASTEP [M. D. Segall, P. L. D. Lindan, M. J. Probert, C. J.
Pickard, P. J. Hasnip, S. J. Clarke and M.C. Payne, J. Phys.: Cond. Matt. (11),
2717 (2003)] is demonstrated.
","[{""version"":""v1"",""created"":""Wed, 31 Mar 2004 12:21:35 GMT""},{""version"":""v2"",""created"":""Tue, 28 Dec 2004 14:01:00 GMT""}]","2009-11-10"
"cond-mat/0403757","Hector Vucetich","G. Puccini (Instituto de Neurociencias, Universidad Miguel
  Hern\'andez, Spain) S. Perez Bergliaffa (CBPF, Brasil) H. Vucetich
  (Observatorio Astron\'omico, Universidad Nacional de La Plata, Argentina)","Axiomatic Foundations of Thermostatics","22 pages, LaTeX, Published version","Nuovo Cimento, 117B (2002) 155",,,"cond-mat.stat-mech",,"  A realistic and objective axiomatic formulation of Thermostatics for
composite systems is presented. The main feature of our axiomatics is that it
is free of empirical definitions. In particular, the basic concepts of the
theory, such as those of entropy, heat and temperature, are characterized only
by the axiomatic basis and the theorems derived from it. We also show that the
concept of (quasi)static process does not belong to the body of Thermostatics.
","[{""version"":""v1"",""created"":""Wed, 31 Mar 2004 11:42:14 GMT""}]","2007-05-23"
"cond-mat/0403758","Slawek  spiekar","S.Piekarski","On the Debye Effect in a Semiconductor and an Electrolyte","15 pages, no figures",,,,"cond-mat.mtrl-sci",,"  It is shown that the standard expression for the diffusive flux in a
semiconductor can be transformed to the flux from the Einstein-Smoluchowski
equation after making use of the ""Einstein identities"". Later, it is possible
to use a transformation introduced in: S. Piekarski: ""On the modified Fick law
and its potential applications"" (J.Tech.Phys.,44,2,125-131,2003). In this
formalism, it is possible to formulate simple models of a semiconductor and an
electrolyte and to obtain the alternative description of a Debye effect (by the
Debye effect we mean here the screening of the point particle potential). Final
results are compared with the standard analysis.
","[{""version"":""v1"",""created"":""Wed, 31 Mar 2004 12:50:24 GMT""},{""version"":""v2"",""created"":""Fri, 2 Apr 2004 09:21:54 GMT""}]","2007-05-23"
"cond-mat/0403759","Peter Schmitteckert","Peter Schmitteckert","Nonequilibrium electron transport using the density matrix
  renormalization group",,,"10.1103/PhysRevB.70.121302",,"cond-mat.str-el cond-mat.mes-hall",,"  We extended the Density Matrix Renormalization Group method to study the real
time dynamics of interacting one dimensional spinless Fermi systems by applying
the full time evolution operator to an initial state. As an example we describe
the propagation of a density excitation in an interacting clean system and the
transport through an interacting nano structure.
","[{""version"":""v1"",""created"":""Wed, 31 Mar 2004 12:29:28 GMT""}]","2009-11-10"
"cond-mat/0403761","Abby Tan Mr","Sergei Fedotov and Abby Tan","Long memory stochastic volatility in option pricing",,,,,"cond-mat.other q-fin.PR",,"  The aim of this paper is to present a simple stochastic model that accounts
for the effects of a long-memory in volatility on option pricing. The starting
point is the stochastic Black-Scholes equation involving volatility with
long-range dependence. We consider the option price as a sum of classical
Black-Scholes price and random deviation describing the risk from the random
volatility. By using the fact the option price and random volatility change on
different time scales, we find the asymptotic equation for the derivation
involving fractional Brownian motion. The solution to this equation allows us
to find the pricing bands for options.
","[{""version"":""v1"",""created"":""Wed, 31 Mar 2004 14:28:37 GMT""},{""version"":""v2"",""created"":""Tue, 6 Apr 2004 10:19:17 GMT""},{""version"":""v3"",""created"":""Fri, 24 Sep 2004 14:38:13 GMT""}]","2008-12-02"
