"cond-mat/0411677","M. L. Rosinberg","F. Detcheverry, M. L. Rosinberg, and G. Tarjus","Metastable states and T=0 hysteresis in the random-field Ising model on
  random graphs","22 pages, 10 figures Manuscript revised to clarify a few points.
  Final version to appear in EPJ B",,"10.1140/epjb/e2005-00132-5",,"cond-mat.dis-nn",,"  We study the ferromagnetic random-field Ising model on random graphs of fixed
connectivity z (Bethe lattice) in the presence of an external magnetic field
$H$. We compute the number of single-spin-flip stable configurations with a
given magnetization m and study the connection between the distribution of
these metastable states in the H-m plane (focusing on the region where the
number is exponentially large) and the shape of the saturation hysteresis loop
obtained by cycling the field between $-\infty$ and $+\infty$ at T=0. The
annealed complexity $\Sigma_A(m,H)$ is calculated for z=2,3,4 and the quenched
complexity $\Sigma_Q(m,H)$ for z=2. We prove explicitly for z=2 that the
contour $\Sigma_Q(m,H)=0$ coincides with the saturation loop. On the other
hand, we show that $\Sigma_A(m,H)$ is irrelevant for describing, even
qualitatively, the observable hysteresis properties of the system.
","[{""version"":""v1"",""created"":""Fri, 26 Nov 2004 18:10:38 GMT""},{""version"":""v2"",""created"":""Fri, 25 Feb 2005 15:01:07 GMT""}]","2009-11-10"
"cond-mat/0411678","Stefano Giovanazzi","Stefano Giovanazzi and Duncan H J O'Dell","Instabilities and the roton spectrum of a quasi-1D Bose-Einstein
  condensed gas with dipole-dipole interactions","7 pages, 6 figures. Special Issue: ""Ultracold Polar Molecules:
  Formation and Collisions""","The European Physical Journal D 31, 439 (2004)","10.1140/epjd/e2004-00146-7",,"cond-mat.other",,"  We point out the possibility of having a roton-type excitation spectrum in a
quasi-1D Bose-Einstein condensate with dipole-dipole interactions. Normally
such a system is quite unstable due to the attractive portion of the dipolar
interaction. However, by reversing the sign of the dipolar interaction using
either a rotating magnetic field or a laser with circular polarization, a
stable cigar-shaped configuration can be achieved whose spectrum contains a
`roton' minimum analogous to that found in helium II. Dipolar gases also offer
the exciting prospect to tune the depth of this `roton' minimum by directly
controlling the interparticle interaction strength. When the minimum touches
the zero-energy axis the system is once again unstable, possibly to the
formation of a density wave.
","[{""version"":""v1"",""created"":""Fri, 26 Nov 2004 19:23:38 GMT""}]","2007-05-23"
"cond-mat/0411679","Sergey Dickmann","S. Dickmann","Bound States in a Quantized Hall Ferromagnet","8 pages","JETP Letters 81, 112-116 (2005)","10.1134/1.1898001",,"cond-mat.mes-hall",,"  We report on a study of the quasielectron-quasihole and skyrmion-antiskyrmion
bound states in the $\nu=1$ quantum Hall regime. The short range attraction
potential is assumed to be determined by a point magnetic impurity. The
calculations are performed within the strong field approximation when the
binding energy and the characteristic electron-electron interaction energy are
smaller than the Landau level spacing. The Excitonic Representation technique
is used in that case.
","[{""version"":""v1"",""created"":""Fri, 26 Nov 2004 20:18:03 GMT""},{""version"":""v2"",""created"":""Mon, 20 Dec 2004 14:09:17 GMT""},{""version"":""v3"",""created"":""Tue, 21 Dec 2004 11:41:37 GMT""},{""version"":""v4"",""created"":""Tue, 11 Jan 2005 10:45:53 GMT""}]","2009-11-10"
"cond-mat/0411681","Egor Babaev","Egor Babaev and J. Martin Speight","Semi-Meissner state and neither type-I nor type-II superconductivity in
  multicomponent systems","in print in Phys. Rev. B Rapid Communications. v2: presentation is
  made more accessible for a general reader. Latest updates and links to
  related papers are available at the home page of one of the authors:
  http://people.ccmr.cornell.edu/~egor/","Phys.Rev. B72 (2005) 180502","10.1103/PhysRevB.72.180502",,"cond-mat.supr-con hep-ph hep-th",,"  Traditionally, superconductors are categorized as type-I or type-II. Type-I
superconductors support only Meissner and normal states, while type-II
superconductors form magnetic vortices in sufficiently strong applied magnetic
fields. Recently there has been much interest in superconducting systems with
several species of condensates, in fields ranging from Condensed Matter to High
Energy Physics. Here we show that the type-I/type-II classification is
insufficient for such multicomponent superconductors. We obtain solutions
representing thermodynamically stable vortices with properties falling outside
the usual type-I/type-II dichotomy, in that they have the following features:
(i) Pippard electrodynamics, (ii) interaction potential with long-range
attractive and short-range repulsive parts, (iii) for an n-quantum vortex, a
non-monotonic ratio E(n)/n where E(n) is the energy per unit length, (iv)
energetic preference for non-axisymmetric vortex states, ""vortex molecules"".
Consequently, these superconductors exhibit an emerging first order transition
into a ""semi-Meissner"" state, an inhomogeneous state comprising a mixture of
domains of two-component Meissner state and vortex clusters.
","[{""version"":""v1"",""created"":""Sat, 27 Nov 2004 14:47:55 GMT""},{""version"":""v2"",""created"":""Tue, 4 Oct 2005 11:58:24 GMT""}]","2016-08-31"
"cond-mat/0411682","Jairo Rolim Lopes de Almeida","M.O.Hase, J.R.L.de Almeida, and S.R.Salinas","Replica-symmetric solutions of a dilute Ising ferromagnet in a random
  field",,"Eur. Phys. J. B 47, 245 (2005)","10.1140/epjb/e2005-00313-2",,"cond-mat.dis-nn",,"  We use the replica method in order to obtain an expression for the
variational free energy of an Ising ferromagnet on a Viana-Bray lattice in the
presence of random external fields. Introducing a global order parameter, in
the replica-symmetric context, the problem is reduced to the analysis of the
solutions of a nonlinear integral equation. At zero temperature, and under some
restrictions on the form of the random fields, we are able to perform a
detailed analysis of stability of the replica-symmetric solutions. In contrast
to the behaviour of the Sherrington-Kirkpatrick model for a spin glass in a
uniform field, the paramagnetic solution is fully stable in a sufficiently
large random field.
","[{""version"":""v1"",""created"":""Fri, 26 Nov 2004 22:45:25 GMT""},{""version"":""v2"",""created"":""Mon, 18 Jul 2005 19:00:57 GMT""},{""version"":""v3"",""created"":""Tue, 11 Oct 2005 23:26:20 GMT""},{""version"":""v4"",""created"":""Thu, 20 Apr 2006 18:26:37 GMT""}]","2009-11-10"
"cond-mat/0411683","Yuri Serebrennikov","Yuri A. Serebrennikov","Geometric spin dephasing of carriers with strong spin-orbit coupling",,,,,"cond-mat.mes-hall cond-mat.mtrl-sci",,"  It has been shown that the geometric Berry-phase shift acquired by the
components of the light hole (LH) spinor during an adiabatic collision is equal
to the angular distance traveled by the wave vector. For LH, geometric
dephasing leads to equality between angular and crystal momentum relaxation
time. I will show that the same mechanism is completely ineffective for heavy
and split-off holes in bulk crystals, and in electron QSLs in spherical
nanostructures. This non-model result suggests that these carriers may be
considered as the stern candidates for implementation of dissipationless spin
currents (Spin Hall effect) and fault-tolerant qubits.
","[{""version"":""v1"",""created"":""Sat, 27 Nov 2004 03:01:23 GMT""}]","2007-05-23"
"cond-mat/0411684","Anita Mehta","Anita Mehta","From ageing to immortality: cluster growth in stirred colloidal
  solutions","4 pages, 3 figures",,,,"cond-mat.soft cond-mat.stat-mech",,"  This model describes cluster aggregation in a stirred colloidal solution
Interacting clusters compete for growth in this 'winner-takes-all' model; for
finite assemblies, the largest cluster always wins, i.e. there is a uniform
sediment. In mean-field, the model exhibits glassy dynamics, with two
well-separated time scales, corresponding to individual and collective
behaviour; the survival probability of a cluster eventually falls off according
to a universal law $(\ln t)^{-1/2}$. In finite dimensions, the glassiness is
enhanced: the dynamics manifests both {\it ageing} and metastability, where
pattern formation is manifested in each metastable state by a fraction of {\it
immortal} clusters.
","[{""version"":""v1"",""created"":""Sat, 27 Nov 2004 05:26:54 GMT""}]","2007-06-13"
"cond-mat/0411685","Jikeun Seo","S.H. Kim, J. Barthel, H.L. Meyerheim, and J. Kirschner, Jikeun Seo,
  J.-S. Kim","Effect of hydrogen on the atomic structure of Pd(001)","6 pages, 5figures",,,,"cond-mat.other cond-mat.mtrl-sci",,"  The atomic structures of clean and hydrogen-adsorbed Pd(001) are investigated
by low energy electron diffraction (LEED) I/V analysis. Clean Pd(001) shows
little surface relaxation in sharp contrast to previous reports.
  Adsorbing 1 monolayer of hydrogen on Pd(001), we observe sizable expansion of
the interlayer spacing of the first two surface layers, $d_{12}$ by 4.7% of the
corresponding one of bulk Pd. Both experimental observations are in excellent
agreement with the predictions of recent {\it ab initio} calculations. A series
of experiments with varying coverages of hydrogen adsorbed on Pd(001), reveals
that $d_{12}$ monotonically increases with the increasing coverage. Such an
observation strongly supports the contention that the previous observation of
expanded $d_{12}$ in clean Pd(001) results from contamination of the surface by
residual hydrogen.
","[{""version"":""v1"",""created"":""Sat, 27 Nov 2004 07:08:24 GMT""}]","2007-05-23"
"cond-mat/0411686","Eiji Nakano","E. Nakano and H. Yabu","Density waves in quasi-one-dimensional atomic gas mixture of boson and
  two-component fermion","13 pages, 6 figures, revised","Phys. Rev. A 72, 043602 (2005)","10.1103/PhysRevA.72.043602",,"cond-mat.other",,"  We study the density-wave states of quasi-one-dimensional atomic gas mixture
of one- and two-component boson and fermion using the mean-field approximation.
Owing to the Peierls instability in the quasi-one-dimensional fermion system,
the ground state of the system shows the fermion density wave and the periodic
Bose-Einstein condensation induced by the boson-fermion interatomic
interaction. For the two-component fermions, two density waves appear in these
components, and the phase difference between them distinguishes two types of
ground states, the in-phase and the out-phase density-waves. In this paper, a
self-consistent method in the mean-field approximation is presented to treat
the density-wave states in boson-fermion mixture with two-component fermions.
  From the analysis of the effective potential and the interaction energies
calculated by this method, the density-waves are shown to appear in the ground
state, which are in-phase or out-phase depending on the strength of the
inter-fermion interaction. It is also shown that the periodic Bose-Einstein
condensate coexists with the in-phase density-wave of fermions, but, in the
case of the out-phase one, only the uniform condensate appears. The phase
diagram of the system is given for the effective coupling constants.
","[{""version"":""v1"",""created"":""Sat, 27 Nov 2004 07:34:23 GMT""},{""version"":""v2"",""created"":""Mon, 31 Jan 2005 10:25:03 GMT""},{""version"":""v3"",""created"":""Tue, 1 Feb 2005 15:19:45 GMT""}]","2009-11-10"
"cond-mat/0411687","Maria J. Ruiz-Montero","J. Javier Brey, M.I. Garcia de Soria, P. Maynar and M.J. Ruiz-Montero","Scaling and universality of critical fluctuations in granular gases",,,"10.1103/PhysRevLett.94.098001",,"cond-mat.stat-mech",,"  The global energy fluctuations of a low density gas granular gas in the
homogeneous cooling state near its clustering instability are studied by means
of molecular dynamics simulations. The relative dispersion of the fluctuations
is shown to exhibit a power-law divergent behavior. Moreover, the probability
distribution of the fluctuations presents data collapse as the system
approaches the instability, for different values of the inelasticity. The
function describing the collapse turns out to be the same as the one found in
several molecular equilibrium and non-equilibrium systems, except for the
change in the sign of the fluctuations.
","[{""version"":""v1"",""created"":""Sat, 27 Nov 2004 11:36:08 GMT""}]","2009-11-10"
"cond-mat/0411688","Dominic Vella","Dominic Vella, L. Mahadevan","The 'Cheerios effect'","10 pages, 12 figures. (Typos in eqs 7 and 8 corrected)","Am. J. Phys., 73 (9), pp. 817-825 (2005)","10.1119/1.1898523",,"cond-mat.soft physics.flu-dyn",,"  Objects that float at the interface between a liquid and a gas interact
because of interfacial deformation and the effect of gravity. We highlight the
crucial role of buoyancy in this interaction, which, for small particles,
prevails over the capillary suction that is often assumed to be the dominant
effect. We emphasize this point using a simple classroom demonstration, and
then derive the physical conditions leading to mutual attraction or repulsion.
We also quantify the force of interaction in some particular instances and
present a simple dynamical model of this interaction. The results obtained from
this model are then validated by comparison to experimental results for the
mutual attraction of two identical spherical particles. We conclude by looking
at some of the applications of the effect that can be found in the natural and
manmade worlds.
","[{""version"":""v1"",""created"":""Sat, 27 Nov 2004 11:47:17 GMT""},{""version"":""v2"",""created"":""Sat, 20 Aug 2005 07:24:15 GMT""},{""version"":""v3"",""created"":""Mon, 25 Jun 2007 07:45:14 GMT""}]","2007-06-25"
"cond-mat/0411689","Wang Zhi Yong","Z. Y. Wang, C. D. Xiong and B. Chen","A Theoretical Investigation of Relativistic Spintronics","12 pages",,,,"cond-mat.other",,"  Spintronics directly based on relativistic quantum mechanics is called as
relativistic spintronics, which involves the study of active control and
manipulation of 4D spin-tensor degrees of freedom via the electromagnetic field
tensor. For future potential electronic devices with smaller size, the study of
relativistic spintronics would be valuable. In this paper, we try to establish
a general theoretical basis for relativistic spintronics, from which we have:
1) in relativistic spintronics, there have more plentiful contents for
relativistic effects, e.g. the usual 3D spatial spin-orbit coupling is extended
to the 4D spin-orbit-tensor coupling; 2) via the spin and like-spin degrees of
freedom we can simultaneously make use of electric and magnetic field strengths
to orientate an electron; 3) not only the spin quantum states of a moving
electron but also those of a motionless electron can be affected by some
particular electrostatic fields.
","[{""version"":""v1"",""created"":""Sat, 27 Nov 2004 12:38:28 GMT""}]","2007-05-23"
"cond-mat/0411691","Massimo Macucci","P. Marconcini, M. Macucci, G. Iannaccone, B. Pellegrini, G. Marola","Analysis of shot noise suppression in mesoscopic cavities in a magnetic
  field","5 pages, 3 figures, contents changed (final version)","Europhysics Letters, vol. 73 (4), 574 (2006)","10.1209/epl/i2005-10444-0",,"cond-mat.mes-hall",,"  We present a numerical investigation of shot noise suppression in mesoscopic
cavities and an intuitive semiclassical explanation of the behavior observed in
the presence of an orthogonal magnetic field. In particular, we conclude that
the decrease of shot noise for increasing magnetic field is the result of the
interplay between the diameter of classical cyclotron orbits and the width of
the apertures defining the cavity. Good agreement with published experimental
results is obtained, without the need of introducing fitting parameters.
","[{""version"":""v1"",""created"":""Sat, 27 Nov 2004 13:55:18 GMT""},{""version"":""v2"",""created"":""Mon, 19 Sep 2005 19:17:54 GMT""},{""version"":""v3"",""created"":""Tue, 7 Mar 2006 13:09:20 GMT""}]","2009-11-10"
"cond-mat/0411692","Stanislav Pavlov","I. G. Lang, L. I. Korovin and S. T. Pavlov","Wave Functions and Energies of Magnetopolarons in Semiconductor Quantum
  Wells","7 pages, 2 figures",,"10.1134/1.2045366",,"cond-mat.mes-hall",,"  The classification of magnetopolarons in semiconductor quantum wells (QW) is
represented. Magnetopolarons appear due to the Johnson - Larsen effect. The
wave functions of usual and combined magnetopolarons are obtained by the
diodanalization of the Schrodinger equation.
","[{""version"":""v1"",""created"":""Sat, 27 Nov 2004 15:07:54 GMT""}]","2009-11-10"
"cs/0411095","Christian Lavault","Christian Lavault (LIPN)","Embeddings into the Pancake Interconnection Network","Article paru en 2002 dans Parallel Processing Letters","Parallel Processing Letters 12, 3-4 (2002) 297-310",,,"cs.DC cs.DM cs.DS",,"  Owing to its nice properties, the pancake is one of the Cayley graphs that
were proposed as alternatives to the hypercube for interconnecting processors
in parallel computers. In this paper, we present embeddings of rings, grids and
hypercubes into the pancake with constant dilation and congestion. We also
extend the results to similar efficient embeddings into the star graph.
","[{""version"":""v1"",""created"":""Fri, 26 Nov 2004 20:13:10 GMT""}]","2007-05-23"
"gr-qc/0411127","Francois Limousin","Francois Limousin (LUTH), Dorota Gondek-Rosinska (LUTH, CAMK), Eric
  Gourgoulhon (LUTH)","Last orbits of binary strange quark stars","11 pages, 10 figures, improved conclusion and figures, references
  added, accepted for publication in Phys. Rev. D","Phys.Rev.D71:064012,2005","10.1103/PhysRevD.71.064012",,"gr-qc astro-ph",,"  We present the first relativistic calculations of the final phase of inspiral
of a binary system consisting of two stars built predominantely of strange
quark matter (strange quark stars). We study the precoalescing stage within the
Isenberg-Wilson-Mathews approximation of general relativity using a multidomain
spectral method. A hydrodynamical treatment is performed under the assumption
that the flow is either rigidly rotating or irrotational, taking into account
the finite density at the stellar surface -- a distinctive feature with respect
to the neutron star case. The gravitational-radiation driven evolution of the
binary system is approximated by a sequence of quasi-equilibrium configurations
at fixed baryon number and decreasing separation. We find that the innermost
stable circular orbit (ISCO) is given by an orbital instability both for
synchronized and irrotational systems. This constrasts with neutron stars for
which the ISCO is given by the mass-shedding limit in the irrotational case.
The gravitational wave frequency at the ISCO, which marks the end of the
inspiral phase, is found to be 1400 Hz for two irrotational 1.35 Msol strange
stars and for the MIT bag model of strange matter with massless quarks and a
bag constant B=60 MeV/fm^3. Detailed comparisons with binary neutrons star
models, as well as with third order Post-Newtonian point-mass binaries are
given.
","[{""version"":""v1"",""created"":""Fri, 26 Nov 2004 20:15:22 GMT""},{""version"":""v2"",""created"":""Mon, 21 Mar 2005 10:15:26 GMT""}]","2014-11-17"
"gr-qc/0411128","Joachim Moortgat","Joachim Moortgat, Jan Kuijpers","Gravitational wave interactions with magnetized plasmas","4 pages. Proceedings of the NATO Advanced Study Institute on the
  Electromagnetic Spectrum of Neutron Stars, Marmaris, Turkey, June 2004",,,,"gr-qc astro-ph",,"  Gravitational waves (GWs) propagating through a uniformly magnetized plasma
interact directly with the magnetic field and excite magnetohydrodynamic (MHD)
waves with both electromagnetic and matter components. We study this process
for arbitrary geometry in the MHD approximation and find that all three
fundamental MHD modes -- slow and fast magnetosonic, and Alfven -- are excited
depending on both the polarization of the GW and the orientation of the ambient
magnetic field. The latter two modes can interact coherently with the GW
resulting in damping of the GW and linear growth of the plasma waves.
","[{""version"":""v1"",""created"":""Fri, 26 Nov 2004 22:39:52 GMT""}]","2007-05-23"
"hep-lat/0411035","Bartolome Alles","B. Alles (INFN Pisa), M. D'Elia (Genova), A. Di Giacomo (Pisa)","Analyticity in theta on the lattice and the large volume limit of the
  topological susceptibility","15 pages, corrected typos, added 1 reference, minor changes in text","Phys.Rev.D71:034503,2005","10.1103/PhysRevD.71.034503","IFUP-TH 37/04","hep-lat hep-ph hep-th",,"  Non-analyticity of QCD with a \theta term at \theta=0 may signal a
spontaneous breaking of both parity and time reversal invariance. We address
this issue by investigating the large volume limit of the topological
susceptibility $\chi$ in pure SU(3) gauge theory. We obtain an upper bound for
the symmetry breaking order parameter <Q> and, as a byproduct, the value
\chi=(173.4(+/- 0.5)(+/- 1.2)(+1.1 / -0.2) MeV)^4 at \beta=6 (a approx= 0.1
fermi). The errors are the statistical error from our data, the one derived
from the value used for \Lambda_L and an estimate of the systematic error
respectively.
","[{""version"":""v1"",""created"":""Fri, 26 Nov 2004 17:06:43 GMT""},{""version"":""v2"",""created"":""Fri, 4 Feb 2005 08:07:51 GMT""}]","2008-11-26"
"hep-ph/0411347","Christian Fischer","C. S. Fischer and R. Alkofer","Dynamical Chiral Symmetry Breaking in Landau gauge QCD","4 pages, 2 figures, talk given by C.F. at 6th Conference on Quark
  Confinement and the Hadron Spectrum, Villasimius, Sardinia, Italy, 21-25 Sep
  2004","AIPConf.Proc.756:275-277,2005","10.1063/1.1920965","UNITU-THEP-16/2004, IPPP/04/75, DCPT/04/150","hep-ph",,"  We summarise results for the propagators of Landau gauge QCD from the Green's
functions approach and lattice calculations. The nonperturbative solutions for
the ghost, gluon and quark propagators from a coupled set of Dyson-Schwinger
equations agree almost quantitatively with corresponding lattice results.
Similar unquenching effects are found in both approaches. The dynamically
generated quark masses are close to `phenomenological' values. The chiral
condensate is found to be large.
","[{""version"":""v1"",""created"":""Fri, 26 Nov 2004 16:57:09 GMT""}]","2008-11-26"
"hep-ph/0411348","V. A. Yerokhin","V. A. Yerokhin, P. Indelicato, and V. M. Shabaev","Two-loop self-energy contribution to the Lamb shift in H-like ions",,"Phys.Rev. A71 (2005) 040101","10.1103/PhysRevA.71.040101",,"hep-ph",,"  The two-loop self-energy correction is evaluated to all orders in Z\alpha for
the ground-state Lamb shift of H-like ions with Z >= 10, where Z is the nuclear
charge number and \alpha is the fine structure constant. The results obtained
are compared with the analytical values for the Z\alpha-expansion coefficients.
An extrapolation of the all-order numerical results to Z=1 is presented and
implications of our calculation for the hydrogen Lamb shift are discussed.
","[{""version"":""v1"",""created"":""Fri, 26 Nov 2004 17:07:03 GMT""}]","2009-11-10"
"hep-ph/0411349","Ricardo Gonzalez Felipe","R. Gonzalez Felipe","Natural braneworld inflation and baryogenesis","12 pages, 2 figures; comments added, references updated. Final
  version to appear in Phys. Lett. B","Phys.Lett. B618 (2005) 7-13","10.1016/j.physletb.2005.05.055",,"hep-ph",,"  In natural inflation models, the inflaton is a pseudo Nambu-Goldstone boson
and the flatness of the potential is protected by shift symmetries. In this
framework, a successful inflation requires the global symmetry to be
spontaneously broken at a scale close to the Planck mass. Such a high value of
the spontaneous breaking scale may not be legitimate in an effective field
theory. On the other hand, if natural inflation occurs during the
nonconventional high-energy era in braneworld cosmology, the conditions for the
inflaton slow rolling can be eased and the spontaneous breaking scale can be
lowered to values below the Planck scale. We examine the observational
constraints on this scenario and study the possibility that the baryon
asymmetry of the universe is generated by the decay of the pseudo
Nambu-Goldstone boson during the reheating era.
","[{""version"":""v1"",""created"":""Fri, 26 Nov 2004 20:05:27 GMT""},{""version"":""v2"",""created"":""Sun, 29 May 2005 20:44:27 GMT""}]","2009-11-10"
"hep-ph/0411350","Eiji Nakano","E. Nakano and T. Tatsumi","Chiral symmetry and density wave in quark matter","14 pages, 10 figures, sec.3-C was extensively revised","Phys.Rev.D71:114006,2005","10.1103/PhysRevD.71.114006",,"hep-ph",,"  A density wave in quark matter is discussed at finite temperature, which
occurs along with the chiral condensation, and is described by a dual standing
wave in scalar and pseudo-scalar condensates on the chiral circle. The
mechanism is quite similar to that for the spin density wave suggested by
Overhauser, and entirely reflects many-body effects. It is found that the
chiral condensed phase with the density wave develops at a high-density region
just outside the usual chiral-transition line in phase diagram. A magnetic
property of the density wave is also elucidated.
","[{""version"":""v1"",""created"":""Sat, 27 Nov 2004 05:24:59 GMT""},{""version"":""v2"",""created"":""Sat, 8 Jan 2005 17:32:42 GMT""},{""version"":""v3"",""created"":""Wed, 12 Jan 2005 14:11:27 GMT""},{""version"":""v4"",""created"":""Fri, 14 Jan 2005 15:10:08 GMT""},{""version"":""v5"",""created"":""Sat, 21 May 2005 07:26:51 GMT""}]","2011-07-19"
