"hep-ph/0411351","Pyungwon Ko","P. Ko (KAIST)","B physics and Supersymmetry","Plenary talk at SUSY04, to appear in the proceeding; references added","J.Korean Phys.Soc. 45 (2004) S410-S416",,"KAIST-TH 2004/20","hep-ph",,"  In SUSY models, it is still possible to have large signals even if the
current data on $K$ and $B$ systems are consistent with the CKM paradigm for
flavor mixing and CP violation. I first discuss $b\to d$ and $b\to s$
transitions including time-dependent CP asymmetries in $B_d \to \phi K_s$, and
usefulness of $B_s \to \mu^+ \mu^-$ to distinguish various SUSY breaking
mechanisms. Then I will discuss some possible connections between B physics and
cosmology: (i) B physics and electroweak baryogenesis within SUSY models, and
(ii) the correlation between the neutralino dark matter scattering and $B (B_s
\to \mu^+ \mu^-)$.
","[{""version"":""v1"",""created"":""Sat, 27 Nov 2004 05:28:09 GMT""},{""version"":""v2"",""created"":""Tue, 18 Jan 2005 11:34:29 GMT""}]","2007-05-23"
"hep-ph/0411352","Seung Woo Ham","S.W. Ham, Y.S. Jeong, and S.K. Oh","Electroweak phase transition in an extension of the standard model with
  a real Higgs singlet","25 pages, 12 figures","J.Phys.G31:857-872,2005","10.1088/0954-3899/31/8/017",,"hep-ph",,"  The Higgs potential of the standard model with an additional real Higgs
singlet is studied in order to examine if it may allow the strongly first order
electroweak phase transition. It is found that there are parameter values for
which this model at the one-loop level with finite temperature effect may allow
the desired phase transition. Those parameter values also predict that the
masses of the neutral scalar Higgs bosons of the model are consistent with the
present experimental bound, and that their productions in $e^+e^-$ collisions
may be searched at the proposed ILC with $\sqrt s$ = 500 GeV in the near
future.
","[{""version"":""v1"",""created"":""Sat, 27 Nov 2004 05:34:08 GMT""},{""version"":""v2"",""created"":""Wed, 25 May 2005 06:27:50 GMT""}]","2011-08-23"
"hep-ph/0411353","Eiji Nakano","E. Nakano, T. Suzuki and H. Yabu","Colour-SU(3)-Ginzburg-Landau Effective Potential for Order Parameter
  with $3 \times 3$ Symmetry II : A Complete Classification of Phase Diagrams","14 pages, 11 figures",,,,"hep-ph",,"  Phase structure is studied for a system which has symmetry group SU(3) and is
described by SU(3)-${\bf 3 \times 3}$ order parameter. The study is rested on
SU(3)-Ginzburg-Landau effective potential constructed as a preliminary.
","[{""version"":""v1"",""created"":""Sat, 27 Nov 2004 07:19:14 GMT""}]","2007-05-23"
"hep-ph/0411354","Eibun Senaha","Shinya Kanemura, Yasuhiro Okada, Eibun Senaha","Electroweak baryogenesis and quantum corrections to the triple Higgs
  boson coupling","10pages, 1figure","Phys.Lett. B606 (2005) 361-366","10.1016/j.physletb.2004.12.004","OU-HET 503, KEK-TH-998","hep-ph",,"  A phenomenological consequence of electroweak baryogenesis is studied in
connection with the Higgs physics. In a two Higgs double model, the first order
phase transition can be strong enough to allow the electroweak baryogenesis due
to the effect of extra Higgs bosons. We investigate the quantum correction to
the triple coupling of the lightest Higgs boson in such a scenario, and find
that the condition of the strong first order phase transition necessarily leads
to the deviation of at least 10 percent from the standard model prediction.
Such magnitude of the deviation can be identified in future $e^+e^-$ linear
collider experiments. We also discuss the minimal supersymmetric standard model
with the light stop scenario, and point out that a sizable correction appears
in the triple coupling for successful electroweak baryogenesis.
","[{""version"":""v1"",""created"":""Sat, 27 Nov 2004 11:07:39 GMT""}]","2009-11-10"
"hep-ph/0411356","Taeko Matsuura","K. Iida, T. Matsuura, M. Tachibana, and T. Hatsuda","Thermal Phase Transitions and Gapless Quark Spectra in Quark Matter at
  High Density","15 pages, 6 figures","Phys.Rev. D71 (2005) 054003","10.1103/PhysRevD.71.054003",,"hep-ph",,"  Thermal color superconducting phase transitions in three-flavor quark matter
at high baryon density are investigated in the Ginzburg-Landau (GL) approach.
We constructed the GL potential near the boundary with a normal phase by taking
into account nonzero quark masses, electric charge neutrality, and color charge
neutrality. We found that the density of states averaged over paired quarks
plays a crucial role in determining the phases near the boundary. By performing
a weak coupling calculation of the parameters characterizing the GL potential
terms of second order in the pairing gap, we show that three successive
second-order phase transitions take place as the temperature increases: a
modified color-flavor locked phase (ud, ds, and us pairings) -> a ``dSC'' phase
(ud and ds pairings) -> an isoscalar pairing phase (ud pairing) -> a normal
phase (no pairing). The Meissner masses of the gluons and the number of gapless
quark modes are also studied analytically in each of these phases.
","[{""version"":""v1"",""created"":""Sat, 27 Nov 2004 13:42:53 GMT""}]","2009-11-10"
"hep-th/0411238","James Sparks","Dario Martelli, James Sparks","Toric Geometry, Sasaki-Einstein Manifolds and a New Infinite Class of
  AdS/CFT Duals","54 pages, 5 figures; minor changes; further minor changes, ref [8]
  added - published version; eqns 1.3, 1.4 removed","Commun.Math.Phys. 262 (2006) 51-89","10.1007/s00220-005-1425-3","CERN-PH-TH/2004-222, HUTP-04/A0046","hep-th math.DG",,"  Recently an infinite family of explicit Sasaki-Einstein metrics Y^{p,q} on
S^2 x S^3 has been discovered, where p and q are two coprime positive integers,
with q<p. These give rise to a corresponding family of Calabi-Yau cones, which
moreover are toric. Aided by several recent results in toric geometry, we show
that these are Kahler quotients C^4//U(1), namely the vacua of gauged linear
sigma models with charges (p,p,-p+q,-p-q), thereby generalising the conifold,
which is p=1,q=0. We present the corresponding toric diagrams and show that
these may be embedded in the toric diagram for the orbifold C^3/Z_{p+1}xZ_{p+1}
for all q<p with fixed p. We hence find that the Y^{p,q} manifolds are AdS/CFT
dual to an infinite class of N=1 superconformal field theories arising as IR
fixed points of toric quiver gauge theories with gauge group SU(N)^{2p}. As a
non-trivial example, we show that Y^{2,1} is an explicit irregular
Sasaki-Einstein metric on the horizon of the complex cone over the first del
Pezzo surface. The dual quiver gauge theory has already been constructed for
this case and hence we can predict the exact central charge of this theory at
its IR fixed point using the AdS/CFT correspondence. The value we obtain is a
quadratic irrational number and, remarkably, agrees with a recent purely field
theoretic calculation using a-maximisation.
","[{""version"":""v1"",""created"":""Fri, 26 Nov 2004 19:45:27 GMT""},{""version"":""v2"",""created"":""Sun, 28 Nov 2004 20:48:42 GMT""},{""version"":""v3"",""created"":""Fri, 3 Dec 2004 19:55:51 GMT""},{""version"":""v4"",""created"":""Fri, 18 Mar 2005 16:42:22 GMT""},{""version"":""v5"",""created"":""Fri, 4 Aug 2006 16:34:37 GMT""}]","2009-11-10"
"hep-th/0411246","Henning Samtleben","J.F. Morales, H. Samtleben","Higher spin holography for SYM in d dimensions","14 pages","Phys.Lett. B607 (2005) 286-293","10.1016/j.physletb.2004.12.031","CERN-TH/2004-234, DESY 04-229","hep-th",,"  We derive the spectrum of gauge invariant operators for maximally
supersymmetric Yang-Mills theories in d dimensions. After subtracting the tower
of BPS multiplets, states are shown to fall into long multiplets of a hidden
SO(10,2) symmetry dressed by thirty-two supercharges. Their primaries organize
into a universal, i.e. d-independent pattern. The results are in perfect
agreement with those following from (naive) KK reduction of type II strings on
the warped AdS x S near-horizon geometry of Dp-branes.
","[{""version"":""v1"",""created"":""Fri, 26 Nov 2004 16:21:55 GMT""}]","2009-11-10"
"hep-th/0411248","Everton Murilo Carvalho Abreu","E. M. C. Abreu, R. Menezes and C. Wotzasek","On the Lorentz symmetry of the noncommutative chiral bosons","Revtex file, 9 pages. Final version to appear in Physical Review D","Phys.Rev. D71 (2005) 065004","10.1103/PhysRevD.71.065004",,"hep-th",,"  We study issues of Lorentz violation symmetry in the context of the recently
proposed theory of noncommutative fields \cite{CCGM}, using the soldering
formalism. To this end a noncommutative chiral-boson with a deformed algebra
\cite{DGMJ}, used to study these notions in D=2, is properly generalized. We
verify, also for this larger group of theories that, although the structure of
the Lorentz group is preserved, the velocity of light is scaled by a function
of the deformation parameter, as recently claimed. However, we found a sub-set
of models where the velocity of propagation is maintained in spite of the
presence of the deformed algebra. Effects of a preferred-frame of reference
manifest by the presence of birefringence were also studied in the chiral boson
framework leading to the scalar sector of the extended Standard Model recently
proposed.
","[{""version"":""v1"",""created"":""Fri, 26 Nov 2004 17:08:05 GMT""},{""version"":""v2"",""created"":""Wed, 19 Jan 2005 14:23:00 GMT""},{""version"":""v3"",""created"":""Mon, 7 Mar 2005 14:33:00 GMT""}]","2009-11-10"
"hep-th/0411249","Francesco Bigazzi","M. Bertolini, F. Bigazzi, A. L. Cotrone","New checks and subtleties for AdS/CFT and a-maximization","Latex, 16 pagex, 2 figures; v2, comments and a reference added; v3,
  typos corrected","JHEP 0412 (2004) 024","10.1088/1126-6708/2004/12/024","SISSA-89/2004/EP LPTHE-04-31 CPHT-RR063.1104","hep-th",,"  We provide a cross-check of AdS/CFT and a-charge maximization for a four
dimensional $N$=1 SCFT with irrational R-charges. The gauge theory is the low
energy effective theory of N D3-branes at the tip of the complex cone over the
first del Pezzo surface. By carefully taking into account the subtle issue of
flavor symmetry breaking at the fixed point, we show, using a-maximization,
that this theory has in fact irrational central charge and R-charges. Our
results perfectly match with those inherited from the recently discovered
supergravity dual background. Along analogous lines, we make novel predictions
for the still unknown AdS dual of the quiver theory for the second del Pezzo
surface. This should flow to a SCFT with irrational charges, too. All of our
results differ from previous findings in the literature and outline interesting
subtleties in a-maximization and AdS/CFT techniques overlooked in the past.
","[{""version"":""v1"",""created"":""Fri, 26 Nov 2004 18:03:09 GMT""},{""version"":""v2"",""created"":""Fri, 3 Dec 2004 14:56:33 GMT""},{""version"":""v3"",""created"":""Fri, 13 May 2005 10:34:01 GMT""}]","2009-11-10"
"hep-th/0411251","R. Cartas-Fuentevilla","R. Cartas-Fuentevilla","Wilson loops and topological phases in closed string theory","7 pages","Int.J.Theor.Phys. 45 (2006) 1659-1666","10.1007/s10773-006-9088-1",,"hep-th",,"  Using covariant phase space formulations for the natural topological
invariants associated with the world-surface in closed string theory, we find
that certain Wilson loops defined on the world-surface and that preserve
topological invariance, correspond to wave functionals for the vacuum state
with zero energy. The differences and similarities with the 2-dimensional QED
proposed by Schwinger early are discussed.
","[{""version"":""v1"",""created"":""Sat, 27 Nov 2004 01:39:50 GMT""}]","2015-06-26"
"hep-th/0411252","Falk Bruckmann","Falk Bruckmann","On the zero of the fermion zero mode","6 pages, 3 figures in 5 parts","Phys.Rev. D71 (2005) 101701","10.1103/PhysRevD.71.101701",,"hep-th hep-lat hep-ph",,"  We argue that the fermionic zero mode in non-trivial gauge field backgrounds
must have a zero. We demonstrate this explicitly for calorons where its
location is related to a constituent monopole. Furthermore a topological
reasoning for the existence of the zero is given which therefore will be
present for any non-trivial configuration. We propose the use of this property
in particular for lattice simulations in order to uncover the topological
content of a configuration.
","[{""version"":""v1"",""created"":""Sat, 27 Nov 2004 12:23:34 GMT""}]","2009-11-10"
"math-ph/0411079","Jose Fernandez-Nu?ez","J. Fernandez Nunez, W. Garcia Fuertes, A. M. Perelomov","Some results on the eigenfunctions of the quantum trigonometric
  Calogero-Sutherland model related to the Lie algebra E6","17 pages, no figures",,"10.1063/1.1933088",,"math-ph math.MP math.RT nlin.SI",,"  The quantum trigonometric Calogero-Sutherland models related to Lie algebras
admit a parametrization in which the dynamical variables are the characters of
the fundamental representations of the algebra. We develop here this approach
for the case of the exceptional Lie algebra E6.
","[{""version"":""v1"",""created"":""Fri, 26 Nov 2004 16:34:43 GMT""}]","2009-11-10"
"math/0411596","Pavel Chigansky","P. Chigansky","Stability of the nonlinear filter for slowly switching Markov chains","the final version","Stochastic Process. Appl., 116 (2006) 8, pp 1185--1194",,,"math.PR math.DS",,"  Exponential stability of the nonlinear filtering equation is revisited, when
the signal is a finite state Markov chain. An asymptotic upper bound for the
filtering error due to incorrect initial condition is derived in the case of
slowly switching signal.
","[{""version"":""v1"",""created"":""Fri, 26 Nov 2004 16:11:31 GMT""},{""version"":""v2"",""created"":""Wed, 2 Feb 2005 10:21:03 GMT""},{""version"":""v3"",""created"":""Mon, 17 Jul 2006 08:34:18 GMT""}]","2007-05-23"
"math/0411599","Ivana Alexandrova","Ivana Alexandrova","Structure of the Short Range Amplitude for General Scattering Relations","21 pages, 1 figure",,,,"math.AP",,"  We consider scattering by short range perturbations of the semi-classical
Laplacian. We prove that when a polynomial bound on the resolvent holds, the
scattering amplitude is a semi-classical Fourier integral operator associated
to the scattering relation. Compared to previous work, we allow the scattering
relation to have more general structure.
","[{""version"":""v1"",""created"":""Fri, 26 Nov 2004 17:07:11 GMT""}]","2007-05-23"
"math/0411600","Ronald van Luijk","Ronald van Luijk (UC Berkeley)","A K3 surface associated to certain integral matrices with integral
  eigenvalues","21 pages, Latex. Changed some typos, definition 5.5, part of the
  proof of proposition 6.1, and added a reference. Submitted a version with a
  few more changes suggested by a referee to the Canadian Mathematical Bulletin",,,,"math.AG math.NT",,"  In this article we will show that there are infinitely many symmetric,
integral 3 x 3 matrices, with zeros on the diagonal, whose eigenvalues are all
integral. We will do this by proving that the rational points on a certain
non-Kummer, singular K3 surface are dense. We will also compute the entire
Neron-Severi group of this surface and find all low degree curves on it.
","[{""version"":""v1"",""created"":""Fri, 26 Nov 2004 17:23:58 GMT""},{""version"":""v2"",""created"":""Sat, 11 Jun 2005 07:41:23 GMT""}]","2007-05-23"
"math/0411601","Ivan Smith","Paul Seidel, Ivan Smith","The symplectic topology of Ramanujam's surface","22 pages, 2 figures. Version 2 has referee's clarifications, this
  version to appear in Comment. Math. Helv",,,,"math.SG math.AG",,"  Ramanujam's surface M is a contractible affine algebraic surface which is not
homeomorphic to the affine plane. For any m>1 the product M^m is diffeomorphic
to Euclidean space R^{4m}. We show that, for every m>0, M^m cannot be
symplectically embedded into a subcritical Stein manifold. This gives the first
examples of exotic symplectic structures on Euclidean space which are convex at
infinity. It follows that any exhausting plurisubharmonic Morse function on M^m
has at least three critical points, answering a question of Eliashberg. The
heart of the argument involves showing a particular Lagrangian torus L inside M
cannot be displaced from itself by any Hamiltonian isotopy, via a careful study
of pseudoholomorphic discs with boundary on L.
","[{""version"":""v1"",""created"":""Fri, 26 Nov 2004 18:14:29 GMT""},{""version"":""v2"",""created"":""Tue, 28 Jun 2005 15:34:41 GMT""}]","2007-05-23"
"math/0411602","Firas Rassoul-Agha","F. Rassoul-Agha and T. Seppalainen","An almost sure invariance principle for random walks in a space-time
  random environment",,"Probab. Th. Rel. Fields, 133(3), 299 - 314 (2005)","10.1007/s00440-004-0424-1",,"math.PR math-ph math.MP",,"  We consider a discrete time random walk in a space-time i.i.d. random
environment. We use a martingale approach to show that the walk is diffusive in
almost every fixed environment. We improve on existing results by proving an
invariance principle and considering environments with an annealed $L^2$ drift.
We also state an a.s. invariance principle for random walks in general random
environments whose hypothesis requires a subdiffusive bound on the variance of
the quenched mean, under an ergodic invariant measure for the environment
chain.
","[{""version"":""v1"",""created"":""Fri, 26 Nov 2004 18:22:40 GMT""}]","2007-05-23"
"math/0411603","Firas Rassoul-Agha","F. Rassoul-Agha and T. Seppalainen","An Almost Sure Invariance Principle for Additive Functionals of Markov
  Chains","Just added MSC-classification to the previous version","Statist. Probab. Lett. 78 (2008), 854-860",,,"math.PR",,"  We prove an invariance principle (functional central limit theorem) for a
vector-valued additive functional of a Markov chain for almost every starting
point with respect to an ergodic equilibrium distribution. The hypothesis is a
moment bound on the resolvent.
","[{""version"":""v1"",""created"":""Fri, 26 Nov 2004 18:30:53 GMT""},{""version"":""v2"",""created"":""Wed, 19 Oct 2005 00:06:34 GMT""}]","2011-10-20"
"math/0411604","Edward Crane","Edward Crane","Mean Value Conjectures for Rational Maps","9 pages",,,,"math.CV",,"  Let p be a polynomial in one complex variable. Smale's mean value conjecture
estimates |p'(z)| in terms of the gradient of a chord from (z, p(z)) to some
stationary point on the graph of $p$. The conjecture does not immediately
generalise to rational maps since its formulation is invariant under the group
of affine maps, not the full Mobius group. Here we give two possible
generalisations to rational maps, both of which are Mobius invariant. In both
cases we prove a version with a weaker constant, in parallel to the situation
for Smale's mean value conjecture. Finally, we discuss some candidate extremal
rational maps, namely rational maps all of whose critical points are fixed
points.
","[{""version"":""v1"",""created"":""Fri, 26 Nov 2004 19:25:53 GMT""}]","2007-05-23"
"math/0411605","Goulnara N. Arzhantseva","Goulnara Arzhantseva, Victor Guba, Mark Sapir","Metrics on diagram groups and uniform embeddings in a Hilbert space","20 pages, Theorem 1.13 and Lemma 3.7. are new",,,,"math.GR math.GT",,"  We give first examples of finitely generated groups having an intermediate,
with values in (0,1), Hilbert space compression (which is a numerical parameter
measuring the distortion required to embed a metric space into Hilbert space).
These groups include certain diagram groups. In particular, we show that the
Hilbert space compression of Richard Thompson's group $F$ is equal to 1/2, the
Hilbert space compression of the restricted wreath product $Z\wr Z$ is between
1/2 and 3/4, and the Hilbert space compression of $Z\wr (Z\wr Z)$ is between 0
and 1/2. In general, we find a relationship between the growth of $H$ and the
Hilbert space compression of $Z\wr H$.
","[{""version"":""v1"",""created"":""Fri, 26 Nov 2004 19:41:10 GMT""},{""version"":""v2"",""created"":""Sat, 27 Nov 2004 19:07:45 GMT""},{""version"":""v3"",""created"":""Tue, 30 Nov 2004 12:38:34 GMT""},{""version"":""v4"",""created"":""Tue, 19 Apr 2005 08:52:33 GMT""}]","2007-05-23"
"math/0411606","Ronald van Luijk","Ronald van Luijk (UC Berkeley)","An elliptic K3 surface associated to Heron triangles","35 pages, Latex",,,,"math.AG math.NT",,"  A rational triangle is a triangle with rational sides and rational area. A
Heron triangle is a triangle with integral sides and integral area. In this
article we will show that there exist infinitely many rational
parametrizations, in terms of s, of rational triangles with perimeter 2s(s+1)
and area s(s^2-1). As a corollary, there exist arbitrarily many Heron triangles
with all the same area and the same perimeter. The proof uses an elliptic K3
surface Y. Its Picard number is computed to be 18 after we prove that the
Neron-Severi group of Y injects naturally into the Neron-Severi group of the
reduction of Y at a prime of good reduction. We also give some constructions of
elliptic surfaces and prove that under mild conditions a cubic surface in
projective three-space can be given the structure of an elliptic surface by
cutting it with the family of hyperplanes through a given line L. Some of these
constructions were already known but appear to have lacked proof in the
literature until now.
","[{""version"":""v1"",""created"":""Fri, 26 Nov 2004 21:10:38 GMT""}]","2007-05-23"
"math/0411607","Terence C. Tao","Camil Muscalu, Jill Pipher, Terence Tao, Christoph Thiele","Multi-parameter paraproducts","13 pages, no figures, submitted, Revista Math",,,,"math.CA",,"  We prove that the classical Coifman-Meyer theorem holds on any polydisc
$\T^d$ of arbitrary dimension $d\geq 1$.
","[{""version"":""v1"",""created"":""Sat, 27 Nov 2004 00:30:50 GMT""}]","2007-05-23"
"math/0411609","Giovanni Landi","Ludwik Dabrowski, Giovanni Landi, Andrzej Sitarz, Walter van
  Suijlekom, Joseph C. Varilly","The Dirac operator on SU_q(2)","v2: minor changes; to appear in CMP","Commun.Math.Phys. 259 (2005) 729-759","10.1007/s00220-005-1383-9",,"math.QA",,"  We construct a 3^+ summable spectral triple (A(SU_q(2)),H,D) over the quantum
group SU_q(2) which is equivariant with respect to a left and a right action of
U_q(su(2)). The geometry is isospectral to the classical case since the
spectrum of the operator D is the same as that of the usual Dirac operator on
the 3-dimensional round sphere. The presence of an equivariant real structure J
demands a modification in the axiomatic framework of spectral geometry, whereby
the commutant and first-order properties need be satisfied only modulo
infinitesimals of arbitrary high order.
","[{""version"":""v1"",""created"":""Sat, 27 Nov 2004 11:00:38 GMT""},{""version"":""v2"",""created"":""Thu, 3 Feb 2005 08:53:30 GMT""}]","2009-11-10"
"math/0411610","Anders Bj\""orner","Anders Bj\""orner and Jonathan David Farley","Chain polynomials of distributive lattices are 75 % unimodal","6 pages",,,,"math.CO",,"  It is shown that the numbers $c_i$ of chains of length $i$ in the proper part
$L\setminus\{0,1\}$ of a distributive lattice $L$ of length $\ell +2$ satisfy
the inequalities $$c_0<...<c_{\lfloor{\ell /2}\rfloor} \quad{and}\quad
c_{\lfloor{3 \ell /4}\rfloor}>...>c_{\ell}.$$ This proves 75 % of the
inequalities implied by the Neggers unimodality conjecture.
","[{""version"":""v1"",""created"":""Sat, 27 Nov 2004 14:03:18 GMT""}]","2007-05-23"
"math/0411611","Joel Merker","Joel Merker","On removable singularities for CR functions in higher codimension","28 pages, 0 figure","Internat. Math. Res. Notices 1997, no. 1, 21--56",,"Prepublication, LMENS, 1997","math.CV",,"  We establish the holomorphic wedge extendability of CR functions, defined on
an everywhere locally minimal generic submanifold M of C^n and having
singularities contained in a submanifold N of codimension 1, 2 or 3, assuming
some transversality conditions about the relative disposition of N with respect
to the complex tangent bundle to M. The statements hold in arbitrary
codimension and are obtained by applying the theory of normal deformations of
analytic discs, due to A.E. Tumanov in 1994 and also the FBI propagation of
singularities phenomenon enjoyed by CR functions, due to J.-M. Trepreau in
1990. Related results in the hypersurface case were obtained simultaneously by
B. Joricke in 1992-96 and by E. Porten in his thesis (1996).
","[{""version"":""v1"",""created"":""Sat, 27 Nov 2004 14:25:23 GMT""}]","2007-05-23"
