"astro-ph/0409341","Carlo Luciano Bianco","R. Ruffini, C.L. Bianco, P. Chardonnet, F. Fraschetti, S.-S. Xue","The EMBH model in GRB 991216 and GRB 980425","8 pages, 3 figures, in the Proceedings of the ""Third Rome Workshop on
  Gamma-Ray Bursts in the Afterglow Era"", 17-20 September 2002, M. Feroci, F.
  Frontera, N. Masetti, L. Piro (editors)","ASP Conf.Ser.312:349-356,2004",,,"astro-ph",,"  This is a summary of the two talks presented at the Rome GRB meeting by C.L.
Bianco and R. Ruffini. It is shown that by respecting the Relative Space-Time
Transformation (RSTT) paradigm and the Interpretation of the Burst Structure
(IBS) paradigm, important inferences are possible: a) in the new physics
occurring in the energy sources of GRBs, b) on the structure of the bursts and
c) on the composition of the interstellar matter surrounding the source.
","[{""version"":""v1"",""created"":""Tue, 14 Sep 2004 16:11:18 GMT""}]","2011-07-19"
"astro-ph/0409342","Matthias Stehle","M.Stehle (1 and 2), P.A. Mazzali (3 and 1), S. Benetti (4), W.
  Hillebrandt (1) ((1) Max Planck Institut fuer Astrophysik, Garching, Germany,
  (2) Universitaets Sternwarte Muenchen, Germany, (3) INAF, Osservatorio di
  Trieste, Italy, (4) INAF, Osservatorio di Padova, Italy)","Abundance stratification in Type Ia supernovae - I. The case of SN
  2002bo","13 pages; changed content; accepted version","Mon.Not.Roy.Astron.Soc. 360 (2005) 1231-1243","10.1111/j.1365-2966.2005.09116.x",,"astro-ph",,"  The abundance stratification in the ejecta of the normal Type Ia supernova
2002bo is derived by fitting a series of spectra obtained at close time
intervals. A Monte Carlo code, modified to include abundance stratification, is
used to compute synthetic spectra at 13 epochs in the photospheric phase,
starting 13d before B maximum. A description of the abundance distribution
above 7600 km/s is thus obtained. Abundances in deeper layers, down to zero
velocity, are derived from models of two nebular-phase spectra. Elements
synthesized in different stages of burning are significantly, but not
completely, mixed in the ejecta. A total 56Ni mass of 0.52M_sun is derived.
Evidence for intermediate-mass elements at high velocities (> 18 000 km/s) is
found, most clearly in Si II 6355A, in Ca II H&K, and in the Ca II infrared
triplet. Carbon lines are not seen at any velocity, with possible implications
for the progenitor/explosion scenario. A synthetic bolometric light curve
computed using the inferred abundance distribution is in very good agreement
with the observed one, providing an independent check. In particular, the fast
rise of the light curve is reproduced very well. This is due to outward mixing
of 56Ni, which is clearly well determined by the spectroscopic modelling.
","[{""version"":""v1"",""created"":""Tue, 14 Sep 2004 16:51:21 GMT""},{""version"":""v2"",""created"":""Fri, 17 Dec 2004 09:45:02 GMT""},{""version"":""v3"",""created"":""Fri, 12 Aug 2005 11:18:42 GMT""}]","2009-11-10"
"astro-ph/0409343","Kazuya Hachisuka","K. Hachisuka (1), A. Brunthaler (2,1), Y. Hagiwara (3), K. M. Menten
  (1), H. Imai (4), M. Miyoshi (5), T. Sasao (6) ((1)MPIfR, (2)JIVE, (3)ASTRON,
  (4) Kagoshima University, (5)NAOJ, (6) Ajou University)","Distance of W3(OH) by VLBI annual parallax measurement","Proceedings of the 7th European VLBI Network Symposium (October 12-15
  2004, Toledo, Spain), eds. Bachiller, R., Colomer, F., Desmurs, J. F., & de
  Vicente, P., 4 pages, 4 figures, needs evn2004.cls",,,,"astro-ph",,"  The most powerful tool for measuring distances within our Galaxy is the
annual parallax. We carried out phase-referencing VLBI observations of H$_{2}$O
masers in the star forming region W3(OH) with respect to the extragalactic
continuum source ICRF 0244+624 to measure their absolute proper motions. The
measured annual parallax is 0.484 $\pm$ 0.004 milli-arcseconds which
corresponds to a distance of 2.07^{+0.01}_{-0.02}$ kpc from the sun. This
distance is consistent with photometric and kinematic distances from previous
observations.
","[{""version"":""v1"",""created"":""Tue, 14 Sep 2004 17:30:05 GMT""}]","2007-05-23"
"astro-ph/0409344","Sergei Popov B.","S.B. Popov (Sternberg Astronomical Institute, Universita di Padova)","Close by Compact Objects and Recent Supernovae in the Solar Vicinity","12 pages, proceedings of the International School of Cosmic Ray
  Astrophysics, 14th Course: ""Neutrinos and Explosive Events in the Universe""",,,,"astro-ph",,"  I discuss young close-by compact objects, recent supernovae in the solar
neighbourhood, and point to their connection with cosmic ray studies.
Especially the role of the Gould Belt is underlined.
","[{""version"":""v1"",""created"":""Tue, 14 Sep 2004 18:10:51 GMT""}]","2007-05-23"
"astro-ph/0409345","Liese van Zee","L. van Zee (Indiana), E. D. Skillman (Minnesota), and M. P. Haynes
  (Cornell)","Rotationally Supported Virgo Cluster Dwarf Elliptical Galaxies: Stripped
  Dwarf Irregular Galaxies?","33 pages, 8 figures (1 color). Published in AJ","Astron.J. 128 (2004) 121","10.1086/421368",,"astro-ph",,"  New observations of 16 dwarf elliptical galaxies in the Virgo Cluster
indicate that at least seven dEs have significant velocity gradients along
their optical major axis, with typical rotation amplitudes of 20-30 km/s. Of
the remaining nine galaxies in this sample, 6 have velocity gradients less than
20 km/s kpc^{-1} while the other 3 observations had too low of a
signal--to--noise ratio to determine an accurate velocity gradient. Typical
velocity dispersions for these galaxies are ~44 +/- 5 km/s, indicating that
rotation can be a significant component of the stellar dynamics of Virgo dEs.
When corrected for the limited spatial extent of the spectral data, the
rotation amplitudes of the rotating dEs are comparable to those of similar
brightness dIs. Evidence for a relationship between the rotation amplitude and
galaxy luminosity is found, and, in fact, agrees well with the Tully-Fisher
relation. The similarity in the scaling relations of dIs and dEs implies that
it is unlikely that dEs evolve from significantly more luminous galaxies. These
observations reaffirm the possibility that some cluster dwarf elliptical
galaxies may be formed when the neutral gaseous medium is stripped from dwarf
irregular galaxies in the cluster environment. We hypothesize that several
different mechanisms are involved in the creation of the overall population of
dE galaxies, and that stripping of infalling dIs may be the dominant process in
the creation of dEs in clusters like Virgo.
","[{""version"":""v1"",""created"":""Tue, 14 Sep 2004 17:58:14 GMT""}]","2009-11-10"
"astro-ph/0409346","Liese van Zee","L. van Zee (Indiana), E. J. Barton (Arizona), and E. D. Skillman
  (Minnesota)","Stellar Populations of Dwarf Elliptical Galaxies: UBVRI Photometry of
  Dwarf Elliptical Galaxies in the Virgo Cluster","37 pages, 8 figures (2 color). Accepted to AJ (scheduled for Dec.
  2004)",,"10.1086/425530",,"astro-ph",,"  We present UBVRI surface photometry for 16 dwarf elliptical galaxies in the
Virgo Cluster with previously measured kinematic properties. The global optical
colors are red, with median values for the sample of 0.24 +/- 0.03 in (U-B),
0.77 +/- 0.02 in (B-V), and 1.02 +/- 0.03 in (V-I). We recover the well known
color-magnitude relation for cluster galaxies, but find no significant
difference in dominant stellar population between rotating and non-rotating
dwarf elliptical galaxies; the average age of the dominant stellar population
is 5-7 Gyr in all 16 galaxies in this sample. Analysis of optical spectra
confirm these age estimates and indicate Fe and Mg abundances in the range of
1/20th to 1/3 of solar, as expected for low luminosity galaxies. Based on Lick
indices and simple stellar population models, the derived [alpha/Fe] ratios are
sub-solar to solar, indicating a more gradual chemical enrichment history for
dEs as compared to giant elliptical galaxies in the Virgo Cluster. These
observations confirm the marked difference in stellar population and stellar
distribution between dwarf and giant elliptical galaxies and further
substantiate the need for alternative evolutionary scenarios for the lowest
mass cluster galaxies. We argue that it is likely that several different
physical mechanisms played a significant role in the production of the Virgo
cluster dE galaxies including in situ formation, infall of dEs that were once
part of Local Group analogs, and transformation of dwarf irregular galaxies by
the cluster environment. The observations support the hypothesis that a large
fraction of the Virgo cluster dEs are formed by ram pressure stripping of gas
from infalling dIs.
","[{""version"":""v1"",""created"":""Tue, 14 Sep 2004 18:06:42 GMT""}]","2009-11-10"
"astro-ph/0409347","Jorge Melendez","Jorge Melendez (1,3) & Ivan Ramirez (2,3) ((1)Caltech, USA;
  (2)UT-Austin, USA; (3)UNMSM-SPACE, Peru)","Spectroscopic Equilibrium of Iron in Metal-Rich Dwarfs","Proceedings, Cosmic Abundances as Records of Stellar Evolution and
  Nucleosynthesis, in honor of Dr. David Lambert's 65th birthday, June 17-19,
  2004. ASP Conference Series. Edited by F. N. Bash & T. G. Barnes",,,,"astro-ph",,"  We analyze twenty five nearby metal-rich G and late-F dwarfs in order to
verify whether the spectroscopic equilibrium (LTE) of iron lines satisfy the
observational constraints imposed by the Infrared Flux Method (angular
diameters) and Hipparcos parallaxes. The atmospheric parameters derived from
iron lines (assuming LTE and employing 1D Kurucz model atmospheres) do not
satisfy simultaneously both observational constraints, probably because
classical modeling fails to reproduce the detailed line formation of FeI lines.
","[{""version"":""v1"",""created"":""Tue, 14 Sep 2004 18:21:12 GMT""}]","2007-05-23"
"astro-ph/0409348","Chris Jackson","C.B. Jackson, J. Taruna, S.L. Pouliot, B.W. Ellison, D.D. Lee and J.
  Piekarewicz","Compact objects for everyone: I. White dwarf stars","18 pages and 3 figures. Discussion now limited to the physics of
  white-dwarf stars","European Journal of Physics 26, 695 (2005)","10.1088/0143-0807/26/5/003",,"astro-ph nucl-th physics.ed-ph",,"  Based upon previous discussions on the structure of compact stars geared
towards undergraduate physics students, a real experiment involving two
upper-level undergraduate physics students, a beginning physics graduate, and
two advanced graduate students was conducted. A recent addition to the physics
curriculum at Florida State University, ""The Physics of Stars"", sparked quite a
few students' interests in the subject matter involving stellar structure.
This, coupled with ""Stars and Statistical Physics"" by Balian and Blaizot and
""Neutron Stars for Undergraduates"" by Silbar and Reddy, is the cornerstone of
this small research group who tackled solving the structure equations for
compact objects in the Summer of 2004. Through the use of a simple
finite-difference algorithm coupled to Microsoft Excel and Maple, solutions to
the equations for stellar structure are presented in the Newtonian regime
appropriate to the physics of white dwarf stars.
","[{""version"":""v1"",""created"":""Tue, 14 Sep 2004 18:43:46 GMT""},{""version"":""v2"",""created"":""Tue, 19 Jul 2005 13:56:11 GMT""}]","2009-11-10"
"astro-ph/0409349","David Boyd","David Boyd","Detection and measurement in the V-band of the white dwarf spin period
  in the January 2004 outburst of DO (YY) Draconis","To be published in Journal of the British Astronomical Association, 4
  pages, 9 figures","J.Br.Astron.Assoc. 115 (2005) 25-28",,,"astro-ph",,"  A modulation in the V-band with period 527.84+/-1.81 sec and amplitude 0.023
magnitude, attributable to the spin of the magnetic white dwarf primary star,
has been detected in 7.5 hours of V-band CCD photometry data recorded during
the January 2004 outburst of the DQ Her type dwarf nova DO (YY) Draconis. This
measurement is consistent with previous results for the white dwarf spin period
based on X-ray and UV observations made with the Hubble Space Telescope, ROSAT
and the Rossi X-ray Timing Explorer and appears to be the first independent
determination of the spin period in the V-band. It is consistent with previous
V-band observations in not showing a significant signal at the first harmonic
of the spin period as seen in X-ray and UV data. Light output in the V-band
peaks only once per rotation of the white dwarf rather than twice as seen in
X-rays and UV. Concurrent observation at optical and X-ray wavelengths is
needed to establish whether these two modulation behaviours occur at the same
time during the outburst and to investigate the phase relationship between
them. A coordinated observing campaign at a future outburst would help to
advance our understanding of this system.
","[{""version"":""v1"",""created"":""Tue, 14 Sep 2004 19:20:42 GMT""}]","2007-05-23"
"astro-ph/0409350","John J. Eldridge","J. J. Eldridge and C. A. Tout","Modelling the progenitors of Core-Collapse Supernovae","4 pages, 2 figures, for the conference 1604-2004 Supernovae as
  Cosmological Lighthouses",,,,"astro-ph",,"  We present details of our investigation of the progenitors to core-collapse
supernovae. We discuss observations and the theory of the lowest-mass stars to
explode as supernovae.
","[{""version"":""v1"",""created"":""Tue, 14 Sep 2004 20:00:13 GMT""}]","2007-05-23"
"astro-ph/0409351","Cindy Tam","C. R. Tam (1), V. M. Kaspi (1), M. H. van Kerkwijk (2), M. Durant (2)
  ((1) McGill University, (2) University of Toronto)","Correlated Infrared and X-ray Flux Changes Following the 2002 June
  Outburst of the Anomalous X-ray Pulsar 1E 2259+586","11 pages, 1 figure, accepted for publication in ApJL; minor wording
  changes, added observation program IDs, improved figure resolution","Astrophys.J. 617 (2004) L53-L56","10.1086/426963",,"astro-ph",,"  We present the results of a near-infrared monitoring program of the Anomalous
X-ray Pulsar 1E 2259+586, performed at the Gemini Observatory. This program
began three days after the pulsar's 2002 June outburst, and spans ~1.5 years.
We find that after an initial increase associated with the outburst, the
near-infrared flux decreased continually and reached the pre-burst quiescent
level after about one year. We compare both the near-infrared flux enhancement
and its decay to those of the X-ray afterglow, and find them to be remarkably
consistent. Fitting simple power laws to the RXTE pulsed flux and near-infrared
data for t>1 day post-burst, we find the following decay indices:
alpha=-0.21+/-0.01 (X-ray), alpha=-0.21+/-0.02 (near-infrared), where flux is a
function of time such that F is proportional to t^alpha. This suggests that the
enhanced infrared and X-ray fluxes have a physical link post-outburst, most
likely from the neutron-star magnetosphere.
","[{""version"":""v1"",""created"":""Tue, 14 Sep 2004 20:03:38 GMT""},{""version"":""v2"",""created"":""Mon, 25 Oct 2004 23:50:26 GMT""}]","2009-11-10"
"astro-ph/0409352","Montse Villar-Martin","Montse Villar-Martin, Miguel Cervino, Rosa Gonzalez Delgado (IAA-CSIC,
  Spain)","Nebular and stellar properties of a metal poor HII galaxy at z=3.36","12 pages, 1 figure. Accepted for publication in MNRAS",,"10.1111/j.1365-2966.2004.08395.x",,"astro-ph",,"  We have characterized the physical properties (electron temperature, density,
metallicity) of the ionized gas and the ionizing population (age, metallicity,
presence of WR stars) in the Lynx arc at z=3.36. This is a low metallicity
(~10% solar) HII galaxy which is undergoing a burst of star formation of <5 Myr
age. One possible scenario that explains the emission line spectrum of the Lynx
arc, the large strength of the nitrogen lines and the HeII emission is that the
object has experienced a merger event that has triggered a burst of star
formation. WR stars have formed that contribute to a fast enrichment of the ISM
and its overabundance of nitrogen.
","[{""version"":""v1"",""created"":""Tue, 14 Sep 2004 20:36:14 GMT""}]","2009-11-10"
"astro-ph/0409353","Richard Henriksen","R. N. Henriksen","Coarse-graining the distribution function of cold dark matter II","MNRAS, in press",,"10.1111/j.1365-2966.2004.08397.x",,"astro-ph",,"  We study analytically the coarse and fine-grained distribution function
established by the self-similar infall of collisionless matter. We find this
function explicitly for isotropic and spherically symmetric systems in terms of
cosmological initial conditions. The coarse-grained function is structureless
and steady but the familiar phase space sheet sub-structure is recovered in the
fine-grained limit. By breaking the self-similarity of the halo infall we are
able to argue for a central density flattening. In addition there will be an
edge steepening. The best fitting analytic density function is likely to be
provided by a high order polytrope fit smoothly to an outer power law of index
-3 for isolated systems. There may be a transition to a -4 power law in the
outer regions of tidally truncated systems.
  We find a progressive central flattening that is expected to end either in
the non-singular isothermal sphere, or in non-singular metastable polytropic
cores. Therefore a collisionless system may pass through a family of polytropes
of increasing order, finally approaching the limit of the non-singular
isothermal sphere, if the `violent' collective relaxation is frequently
re-excited by `merger' events. Our results suggest that no physics beyond that
of the moderate collective relaxation often known as `violent relaxation' (due
we think to wave-particle scattering) is necessary to explain the nature of
dark matter density profiles.
","[{""version"":""v1"",""created"":""Tue, 14 Sep 2004 20:40:28 GMT""}]","2009-11-10"
"astro-ph/0409354","Dayton Jones","D. L. Jones (JPL, Caltech)","Spacecraft Tracking with the SKA","6 pages, 4 figures, to appear in ""Science with the Square Kilometer
  Array"", eds. C. Carilli and S. Rawlings, New Astronomy Reviews (Elsevier:
  Amsterdam)",,"10.1016/j.newar.2004.09.021",,"astro-ph",,"  The possibility of using the SKA for occasional support of scientific space
missions should be considered, along with all other science goals, in the
design of the array. The benefits of higher data rates from distant spacecraft
during high priority, short duration mission phases can be dramatic, while the
technical requirements on the SKA to allow this capability are very few. The
most fundamental requirement is coverage of the primary downlink frequencies
for deep space missions. Additional benefits can result from real-time high
precision angular position measurements of spacecraft. Such measurements allow
spacecraft navigation with reduced errors and reduced risk, but require at
least some long (thousands of km) baselines.
","[{""version"":""v1"",""created"":""Tue, 14 Sep 2004 21:35:21 GMT""}]","2009-11-10"
"astro-ph/0409355","Gardini Alessandro","A. Gardini (1) and P. M. Ricker (1) (Dept. of Astronomy, University of
  Illinois at Urbana-Champaign)","Simulations of Hot Bubbles in the ICM","13 pages, no figures. Accepted for publication in Modern Physics
  Letters A","Mod.Phys.Lett. A19 (2004) 2317-2330","10.1142/S0217732304015610",,"astro-ph",,"  We review the general properties of the intracluster medium (ICM) in clusters
that host a cooling flow, and in particular the effects on the ICM of the
injection of hot plasma by a powerful active galactic nucleus (AGN). It is
observed that, in some cases, the hot plasma produces cavities in the ICM that
finally detach and rise, perhaps buoyantly. The gas dynamics induced by the
rising bubbles can help explain the absence of a cooled gas component in
clusters with a cooling flow. This scenario is explored using numerical
simulations.
","[{""version"":""v1"",""created"":""Wed, 15 Sep 2004 04:58:58 GMT""}]","2009-11-10"
"astro-ph/0409356","Vladimir Karas","M. Dovciak, V. Karas, G. Matt","Polarization signatures of strong gravity in AGN accretion discs","Accepted for publication in MNRAS; 6 pages, 3 figures","Mon.Not.Roy.Astron.Soc. 355 (2004) 1005-1009","10.1111/j.1365-2966.2004.08396.x",,"astro-ph",,"  The effects of strong gravity on the polarization of the Compton reflection
from an X-ray illuminated accretion disc are studied. The gravitational field
of a rotating black hole influences Stokes parameters of the radiation along
the propagation to a distant observer. Assuming the lamp-post model, the degree
and the angle of polarization are examined as functions of the observer's
inclination angle, of the height of the primary source and of the inner radius
of the disc emitting region. It is shown that polarimetry can provide essential
information on the properties of black holes sources, and it is argued that
time variation of the polarization angle is a strong signature of general
relativity effects. The expected polarization degree and angle should be
detectable by new generation polarimeters, like the one planned for the Xeus
mission.
","[{""version"":""v1"",""created"":""Wed, 15 Sep 2004 06:06:44 GMT""}]","2007-05-23"
"astro-ph/0409358","Marco Bondi","M. Bondi, G. Brunetti, A. Comastri, G. Setti","Anisotropic inverse Compton emission in the radio galaxy 3C 265","5 pages, 6 figures, to be published as a Letter on Monthly Notices of
  the Royal Astronomical Society",,"10.1111/j.1365-2966.2004.08398.x",,"astro-ph",,"  We present the results from a Chandra observation of the powerful radio
galaxy 3C 265. We detect X-ray emission from the nucleus, the radio hotspots
and lobes. In particular, the lobe X-ray emission is well explained as
anisotropic inverse Compton scattering of the nuclear photons by the
relativistic electrons in the radio lobes; the comparison between radio
synchrotron and IC emission yields a magnetic field strength a factor about 2
lower than that calculated under minimum energy conditions. The X-ray spectrum
of the nucleus is consistent with that of a powerful, strongly absorbed quasar
and the X-ray emission of the south-eastern hotspot can be successfully
reproduced by a combination of synchro-self Compton and inverse Compton
emission assuming a magnetic field slightly lower than equipartition.
","[{""version"":""v1"",""created"":""Wed, 15 Sep 2004 08:36:04 GMT""}]","2009-11-10"
"astro-ph/0409360","Rob Fender","R.P. Fender (Amsterdam), T.M. Belloni (INAF, Brera), E. Gallo
  (Amsterdam)","Towards a unified model for black hole X-ray binary jets","Accepted for publication in MNRAS","Mon.Not.Roy.Astron.Soc.355:1105-1118,2004","10.1111/j.1365-2966.2004.08384.x",,"astro-ph",,"  We present a unified semi-quantitative model for the disc-jet coupling in
black hole X-ray binary systems. We argue that during the rising phase of a
black hole transient outburst the steady jet known to be associated with the
canonical 'low/hard' state persists while the X-ray spectrum initially softens.
Subsequently, the jet becomes unstable and an optically thin radio outburst is
always associated with the soft X-ray peak at the end of this phase of
softening. This peak corresponds to a 'soft very high state' or 'steep power
law' state. Softer X-ray states are not associated with 'core' radio emission.
We further demonstrate quantitatively that the transient jets associated with
these optically thin events are considerably more relativistic than those in
the 'low/hard' X-ray state. This in turn implies that as the disc makes its
collapse inwards the jet Lorentz factor rapidly increases, resulting in an
internal shock in the outflow, which is the cause of the observed optically
thin radio emission. In addition, we estimate the jet power for a number of
such transient events as a function of X-ray luminosity, and find them to be
comparable to an extrapolation of the functions estimated for the 'low/hard'
state jets. Finally, we attempt to fit these results together into a coherent
semi-quantitative model for the disc-jet coupling in all black hole X-ray
binary systems (abridged).
","[{""version"":""v1"",""created"":""Wed, 15 Sep 2004 09:10:32 GMT""}]","2009-11-10"
"astro-ph/0409361","Mathieu de Naurois","Mathieu de Naurois","High Energy Gamma Rays","Invited talk at the XXIV Physics in Collisions Conference (PIC04),
  Boston, USA, June 2004, 10 pages, LaTeX, 13 eps figures. PSN TUET07",,,,"astro-ph",,"  The Very High Energy Gamma Ray Astronomy (VHE) is a rapidly evolving branch
of modern astronomy, which covers the range from about 50 GeV to several tens
of TeV from the ground. In the past years, the second generation instruments
firmly established a growing and varied list of sources including plerions,
supernova remnants and active galactic nuclei, and started to study some
fundamental questions such as the origin of cosmic rays or the emission
mechanisms of the active galactic nuclei.
  New results now include the first VHE unidentified sources as well as more
puzzling sources such as the Galactic center. The arrival of new generation
instruments (HESS, CANGAROO III, VERITAS, MAGIC) already gives a impressive
look at the near future. Here we attempt to summarize the current status of the
field. We briefly describe the instruments and analysis techniques, and give an
outlook on the sources detected sofar.
","[{""version"":""v1"",""created"":""Wed, 15 Sep 2004 10:27:54 GMT""}]","2007-05-23"
