"hep-ph/0409167","Mei Huang","Mei Huang","Color Superconductivity at Moderate Baryon Density","62 pages, 18 figures, references added, the revised version will
  appear in Int. J. Mod. Phys. E","Int.J.Mod.Phys. E14 (2005) 675","10.1142/S0218301305003491",,"hep-ph",,"  This article focuses on the two-flavor color superconducting phase at
moderate baryon density. In order to simultaneously investigate the chiral
phase transition and the color superconducting phase transition, the
Nambu-Gorkov formalism is extended to treat the quark-antiquark and diquark
condensates on an equal footing. The competition between the chiral condensate
and the diquark condensate is analyzed. The cold dense charge neutral
two-flavor quark system is investigated in detail. Under the local charge
neutrality condition, the ground state of two-flavor quark matter is sensitive
to the coupling strength in the diquark channel. When the diquark coupling
strength is around the value obtained from the Fierz transformation or from
fitting the vacuum bayron mass, the ground state of charge neutral two-flavor
quark matter is in a thermal stable gapless 2SC (g2SC) phase. The unusual
properties at zero as well as nonzero temperatures and the chromomagnetic
properties of the g2SC phase are reviewed. Under the global charge neutrality
condition, assuming the surface tension is negligible, the mixed phase composed
of the regular 2SC phase and normal quark matter is more favorable than the
g2SC phase. A hybrid nonstrange neutron star is constructed.
","[{""version"":""v1"",""created"":""Tue, 14 Sep 2004 21:46:23 GMT""},{""version"":""v2"",""created"":""Thu, 4 Nov 2004 06:24:57 GMT""}]","2019-07-24"
"hep-ph/0409168","Robert L. Jaffe","Frank Wilczek","Diquarks as Inspiration and as Objects","15 pages, 1 figure. Solicited contribution to the Ian Kogan memorial
  volume, ed. M. Shifman. v2: several typos corrected",,"10.1142/9789812775344_0007","MIT-CTP-3529","hep-ph nucl-th",,"  It is plausible that several of the most profound aspects of low-energy QCD
dynamics are connected to diquark correlations, including: paucity of exotics
(which is the foundation of the quark model and of traditional nuclear
physics), similarity of mesons and baryons, color superconductivity at high
density, hyperfine splittings, $\Delta I = 1/2$ rule, and some striking
features of structure and fragmentation functions. After a brief overview of
these issues, I discuss how diquarks can be studied in isolation, both
phenomenologically and numerically, and present approximate mass differences
for diquarks with different quantum numbers. The mass-loaded generalization of
the Chew-Frautschi formula provides an essential tool.
","[{""version"":""v1"",""created"":""Tue, 14 Sep 2004 22:02:43 GMT""},{""version"":""v2"",""created"":""Fri, 17 Sep 2004 11:05:19 GMT""}]","2016-11-23"
"hep-ph/0409169","Jens Erler","Jens Erler and Michael J. Ramsey-Musolf","Weak mixing angle at low energies","21 pages; 1 figure and some references added, some changes in text;
  final version as published","Phys.Rev. D72 (2005) 073003","10.1103/PhysRevD.72.073003","FT-2004-03, Caltech MAP-300","hep-ph hep-ex",,"  We determine the weak mixing angle in the MS-bar scheme at energy scales
relevant for present and future low energy electroweak measurements. We relate
the renormalization group evolution of the weak mixing angle to the
corresponding evolution of the QED coupling and include higher-order terms in
alpha_s and alpha that had not been treated in previous analyses. We also
up-date the analysis of non-perturbative hadronic contributions and argue that
the associated uncertainty is small compared to anticipated experimental
errors. The resulting value of the low-energy weak mixing angle is sin^2
theta_W (0) = 0.23867 +- 0.00016.
","[{""version"":""v1"",""created"":""Tue, 14 Sep 2004 22:52:04 GMT""},{""version"":""v2"",""created"":""Sat, 27 Jan 2007 20:16:24 GMT""}]","2009-11-10"
"hep-ph/0409170","Osamu Seto","Nobuchika Okada and Osamu Seto","The Effect of Extra Dimension on Dark Matter","4 pages, no figure, Prepared for 12th International Conference on
  Supersymmetry and Unification of Fundamental Interactions (SUSY 04), Tsukuba,
  Japan, 17-23 Jun 2004",,,,"hep-ph astro-ph",,"  We investigate the thermal relic density of a cold dark matter in the brane
world cosmology. Since the expansion law in a high energy regime is modified
from the one in the standard cosmology, if the dark matter decouples in such a
high energy regime its relic number density is affected by this modified
expansion law. We derive analytic formulas for the number density of the dark
matter. It is found that the resultant relic density is characterized by the
``transition temperature'' at which the modified expansion law in the brane
world cosmology is connecting with the standard one, and can be considerably
enhanced compared to that in the standard cosmology, if the transition
temperature is low enough. The implication to the neutralino dark matter also
is mentioned.
","[{""version"":""v1"",""created"":""Wed, 15 Sep 2004 02:58:50 GMT""}]","2007-05-23"
"hep-ph/0409171","Michio Hashimoto","Michio Hashimoto, Masaharu Tanabashi, Koichi Yamawaki","Top mode standard model and extra dimensions","4 pages, Talk given by M.H. at the 12th International Conference on
  Supersymmetry and Unification of Fundamental Interactions (SUSY 2004), June
  17-23, 2004, Tsukuba, Japan",,,,"hep-ph",,"  We perform the most attractive channel (MAC) analysis in the top mode
standard model with TeV-scale extra dimensions, where the standard model gauge
bosons and the third generation of quarks and leptons are put in D(=6,8,...)
dimensions. In order to make the scenario viable, only the attractive force of
the top condensate should exceed the critical coupling, while other channels
such as the bottom and tau condensates should not. It turns out that the top
condensate can be the MAC for D=8, whereas the tau condensation is favored for
D=6. On the basis of the renormalization group equations for the top Yukawa and
Higgs quartic couplings, we predict masses of the top quark and the Higgs boson
for D=8 as m_t=172-175 GeV and m_H=176-188 GeV, respectively.
","[{""version"":""v1"",""created"":""Wed, 15 Sep 2004 05:18:24 GMT""}]","2007-05-23"
"hep-ph/0409172","Motoi Endo","Motoi Endo","New Constraint on Squark Flavor Mixing from 199Hg EDM","4 pages, 1 figures, to appear in the proceedings of SUSY 2004: The
  12th International Conference on Supersymmetry and Unification of Fundamental
  Interactions, held at Epochal Tsukuba, Tsukuba, Japan, June 17-23, 2004",,,,"hep-ph",,"  We obtain a new constraint on the CP-violating flavor mixing between the
left-handed top scalar quark (\tilde{t}_L) and charm scalar quark
(\tilde{c}_L), by considering a chargino loop contribution to chromo-electric
dipole moment of strange quark, which is limited by the electric dipole moment
of the neutron and atoms. It is found that the flavor mixing should be
suppressed to the level of {\cal O}(0.1) for the CP phase of order unity.
Although it is much stronger than the known constraint from the chargino loop
contribution to b \to s \gamma, the moderate constraint we obtain here is
argued to leave room for sizable supersymmetric contribution to the CP
asymmetry in B_d^0 \to \phi K^0.
","[{""version"":""v1"",""created"":""Wed, 15 Sep 2004 07:08:21 GMT""}]","2007-05-23"
"hep-ph/0409173","Satoshi Mishima","Satoshi Mishima","Supersymmetric Contributions to the B -> phi K Decays in the PQCD
  Approach","4 pages, 2 figures, to appear in the proceedings of the 12th
  International Conference on Supersymmetry and Unification of Fundamental
  Interactions (SUSY 2004), Tsukuba, Japan, June 17-23, 2004",,,,"hep-ph",,"  We study the effects of supersymmetric contribution on both the B_d -> phi
K^0 and B^\pm -> phi K^\pm modes using the perturbative QCD approach. We
estimate the deviation of mixing-induced and direct CP asymmetries and discuss
the strong-phase dependence of them.
","[{""version"":""v1"",""created"":""Wed, 15 Sep 2004 10:57:01 GMT""}]","2007-05-23"
"hep-ph/0409174","Alessandro Bacchetta","Alessandro Bacchetta (Regensburg U.), Marco Radici (Pavia U.)","Dihadron interference fragmentation functions in proton-proton
  collisions","12 pages, 1 figure. Eq. (11) modified","Phys.Rev. D70 (2004) 094032","10.1103/PhysRevD.70.094032",,"hep-ph hep-ex",,"  We study the production of hadron pairs in proton-proton collisions,
selecting pairs with large total transverse momentum with respect to the beam,
and small relative transverse momentum, i.e., belonging to a single jet with
large transverse momentum. We describe the process in terms of dihadron
fragmentation functions. We consider the production of one pair in polarized
collisions (with one transversely polarized proton) and the production of two
pairs in unpolarized collisions. In the first case, we discuss how to observe
the quark transversity distribution in connection with a specific class of
dihadron fragmentation functions, named interference fragmentation functions.
In the second case, we suggest how to determine the latter and also how to
observe linearly polarized gluons.
","[{""version"":""v1"",""created"":""Wed, 15 Sep 2004 10:20:17 GMT""},{""version"":""v2"",""created"":""Fri, 19 Nov 2004 14:51:37 GMT""}]","2016-09-06"
"hep-ph/0409175","Andrei Leonidov","A.V. Leonidov","Color Glass Condensate in High Energy QCD","Proceedings of ""QUARKS 2004"", May 2004, Pushkinskie Gory, Russia, to
  appear",,,"FIAN/TD-10/04; ITEP-TH-36/04","hep-ph",,"  A brief review of major theoretical aspects of color glass condensate physics
is given.
","[{""version"":""v1"",""created"":""Wed, 15 Sep 2004 09:02:04 GMT""},{""version"":""v2"",""created"":""Wed, 29 Dec 2004 10:44:34 GMT""}]","2007-05-23"
"hep-ph/0409177","Anders Tranberg","Alejandro Arrizabalaga, Jan Smit and Anders Tranberg","Tachyonic preheating using 2PI-1/N dynamics and the classical
  approximation","32 pages, 21 figures. Published version: Some details added, section
  added, references added, conclusions unchanged","JHEP0410:017,2004","10.1088/1126-6708/2004/10/017","ITFA-2004-35","hep-ph",,"  We study the process of tachyonic preheating using approximative quantum
equations of motion derived from the 2PI effective action. The O(N) scalar
(Higgs) field is assumed to experience a fast quench which is represented by an
instantaneous flip of the sign of the mass parameter. The equations of motion
are solved numerically on the lattice, and the Hartree and 1/N-NLO
approximations are compared to the classical approximation. Classical dynamics
is expected to be valid, since the occupation numbers can rise to large values
during tachyonic preheating. We find that the classical approximation performs
excellently at short and intermediate times, even for couplings in the larger
region currently allowed for the SM Higgs. This is reassuring, since all
previous numerical studies of tachyonic preheating and baryogenesis during
tachyonic preheating have used classical dynamics. We also compare different
initializations for the classical simulations.
","[{""version"":""v1"",""created"":""Wed, 15 Sep 2004 11:18:57 GMT""},{""version"":""v2"",""created"":""Sat, 27 Nov 2004 13:23:13 GMT""}]","2008-11-26"
"hep-ph/0409178","V. M. Strakhovenko","V. Strakhovenko, X. Artru, R. Chehab, and M. Chevallier","Generation of circularly polarized photons for a linear collider
  polarized positron source","16 pages, 6 figures","Nucl.Instrum.Meth. A547 (2005) 320-333","10.1016/j.nima.2005.03.168",,"hep-ph physics.acc-ph",,"  Various methods of obtaining longitudinally polarized positrons for future
linear colliders are reviewed. Special attention is paid to the schemes using
circularly polarized high-energy photons for positron production. Most
effectively such photons are obtained from electrons passing through a helical
undulator or colliding with a circularly polarized laser wave. Spectrum and
polarization of radiation emitted during helical motion of electrons are
considered in detail. A new simple presentation of known formulas is used to
account for the influence of the wave intensity, of the electron-beam angular
divergence, of the collimation of radiation, and of the lateral and temporal
profiles of the laser bunch on the radiation properties.
","[{""version"":""v1"",""created"":""Wed, 15 Sep 2004 12:03:39 GMT""}]","2009-11-10"
"hep-ph/0409179","Marcelo Gleiser","Marcelo Gleiser and Rafael Howell","Resonant Nucleation","5 pages, 5 figures, uses revtex4. Final version accepted for
  publication in Physical Review Letters. Text and figures have been edited","Phys.Rev.Lett.94:151601,2005","10.1103/PhysRevLett.94.151601",,"hep-ph cond-mat.stat-mech",,"  We investigate the role played by fast quenching on the decay of metastable
(or false vacuum) states. Instead of the exponentially-slow decay rate per unit
volume, $\Gamma_{\rm HN} \sim \exp[-E_b/k_BT]$ ($E_b$ is the free energy of the
critical bubble), predicted by Homogeneous Nucleation theory, we show that
under fast enough quenching the decay rate is a power law $\Gamma_{\rm RN} \sim
[E_b/k_BT]^{-B}$, where $B$ is weakly sensitive to the temperature. For a range
of parameters, large-amplitude oscillations about the metastable state trigger
the resonant emergence of coherent subcritical configurations. Decay mechanisms
for different $E_b$ are proposed and illustrated in a (2+1)-dimensional scalar
field model.
","[{""version"":""v1"",""created"":""Wed, 15 Sep 2004 13:03:45 GMT""},{""version"":""v2"",""created"":""Wed, 16 Mar 2005 17:21:46 GMT""}]","2011-07-19"
"hep-ph/0409180","Ryutin Roman","V.A. Petrov, R.A. Ryutin, A.E. Sobol (IHEP, Protvino) and J.-P.
  Guillaud (LAPP, Annecy)","EDDE Monte Carlo event generator","LaTeX, 7 pages, 3 figures",,,,"hep-ph",,"  EDDE is a Monte Carlo event generator, under construction, for different
Exclusive Double Diffractive Events. The program is based on the extended
Regge-eikonal approach for ""soft"" processes. Standard Model and its extensions
are used for ""hard"" fusion processes. An interface to PYTHIA, CMSJET and CMKIN
is provided.
","[{""version"":""v1"",""created"":""Wed, 15 Sep 2004 13:11:03 GMT""},{""version"":""v2"",""created"":""Mon, 26 Sep 2005 13:09:56 GMT""}]","2007-05-23"
"hep-ph/0409182","Dong-Won Jung","Dong-Won Jung","Neutrino Oscillations and Collider Test of the R-parity Violating mSUGRA
  Model","To appear in the proceedings of 'SUSY 2004'",,,,"hep-ph",,"  We study the R-parity violating minimal supergravity models accounting for
the observed neutrino masses and mixing, which can be tested in future collider
experiments. The bi-large mixing can be explained by allowing five dominant
tri-linear couplings $ \lambda'_{1,2,3}$ and $\lambda_{1,2}$. The desired ratio
of the atmospheric and solar neutrino mass-squared differences can be obtained
in a very limited parameter space where the tree-level contribution is tuned to
be suppressed. In this allowed region, we quantify the correlation between the
three neutrino mixing angles and the tri-linear R-parity violating couplings.
Such a prediction on the couplings can be tested in the next linear colliders
by observing the branching ratios of the lightest supersymmetric particle
(LSP). For the stau or the neutralino LSP, the ratio $|\lambda_1|^2:
|\lambda_2|^2: |\lambda_1|^2 + |\lambda_2|^2$ can be measured by establishing
$Br(e\nu): Br(\mu\nu) : Br(\tau\nu)$ or $Br(\nu e^\pm \tau^\mp):
Br(\nu\mu^\pm\tau^\mp) : Br(\nu\tau^\pm\tau^\mp)$, respectively. The
information on the couplings $\lambda'_i$ can be drawn by measuring $Br(l_i t
\bar{b}) \propto |\lambda'_i|^2$ if the neutralino LSP is heavier than the top
quark.
","[{""version"":""v1"",""created"":""Wed, 15 Sep 2004 14:54:38 GMT""}]","2007-05-23"
"hep-ph/0409184","Szabolcs Borsanyi","Szabolcs Borsanyi","Thermal features far from equilibrium: Prethermalization","LaTeX, 5 pages. Contribution to the Proceedings of 6th Conference on
  Strong and Electroweak Matter 2004 (SEWM04), Helsinki, Finland, 16-19 Jun
  2004",,"10.1142/9789812702159_0031",,"hep-ph",,"  The phenomenon of prethermalization and the subsequent steps of
thermalization are analyzed in the framework of the chiral quark model. We
solve the quantum equations of motion of the field theory derived from the 2PI
effective action and study the time scales of equilibration. We find that
already after a 0.6 fm/c long period of time some equilibrium features appear,
even though the system is still far from equilibrium. This might be an
ingredient for understanding the success of ideal hydrodynamic description.
","[{""version"":""v1"",""created"":""Wed, 15 Sep 2004 15:42:42 GMT""}]","2017-08-23"
"hep-th/0409132","Fernando Marchesano","Fernando Marchesano and Gary Shiu","Building MSSM Flux Vacua","33 pages, 1 figure. Minor corrections","JHEP0411:041,2004","10.1088/1126-6708/2004/11/041","MAD-TH-04-9","hep-th hep-ph",,"  We construct N=1 and N=0 chiral four-dimensional vacua of flux
compactification in Type IIB string theory. These vacua have the common
features that they are free of tadpole instabilities (both NSNS and RR) even
for models with N=0 supersymmetry. In addition, the dilaton/complex structure
moduli are stabilised and the supergravity background metric is warped. We
present an example in which the low energy spectrum contains the MSSM spectrum
with three generations of chiral matter. In the N=0 models, the background
fluxes which stabilise the moduli also induce soft supersymmetry breaking terms
in the gauge and chiral sectors of the theory, while satisfying the equation of
motion. We also discuss some phenomenological features of these three
generation MSSM flux vacua. Our techniques apply to other closed string
backgrounds as well and, in fact, also allow to find new N=1 D-brane models
which were believed not to exist. Finally, we discuss in detail the consistency
conditions of these flux compactifications. Cancellation of K-theory charges
puts additional constraints on the consistency of the models, which render some
chiral D-brane models in the literature inconsistent.
","[{""version"":""v1"",""created"":""Tue, 14 Sep 2004 17:19:02 GMT""},{""version"":""v2"",""created"":""Thu, 14 Oct 2004 08:35:45 GMT""},{""version"":""v3"",""created"":""Tue, 19 Jul 2005 00:42:41 GMT""}]","2008-11-26"
"hep-th/0409133","Juan Maldacena","Igor R. Klebanov and Juan M. Maldacena","Superconformal Gauge Theories and Non-Critical Superstrings","16 pages, 1 figure v4: Minor changes","Int.J.Mod.Phys. A19 (2004) 5003-5016","10.1142/S0217751X04020865","PUPT-2135","hep-th",,"  We consider effective actions for six-dimensional non-critical superstrings.
We show that the addition of $N$ units of R-R flux and of $N_f$ space-time
filling D5-branes produces $AdS_5 \times S^1$ solutions with curvature
comparable to the string scale. These solutions have the right structure to be
dual to ${\cal N}=1$ supersymmetric SU(N) gauge theories with $N_f$ flavors. We
further suggest bounds on the mass-squared of tachyonic fields in this
background that should restrict the theory to the conformal window.
","[{""version"":""v1"",""created"":""Tue, 14 Sep 2004 18:33:47 GMT""},{""version"":""v2"",""created"":""Tue, 5 Oct 2004 13:23:45 GMT""},{""version"":""v3"",""created"":""Thu, 14 Oct 2004 13:24:18 GMT""},{""version"":""v4"",""created"":""Thu, 9 Dec 2004 14:35:24 GMT""}]","2009-11-10"
"hep-th/0409134","Marco A. RegoMonteiro","V. B. Bezerra and M. A. Rego-Monteiro","Some boundary effects in quantum field theory","12 pages, Latex","Phys.Rev. D70 (2004) 065018","10.1103/PhysRevD.70.065018",,"hep-th",,"  We have constructed a quantum field theory in a finite box, with periodic
boundary conditions, using the hypothesis that particles living in a finite box
are created and/or annihilated by the creation and/or annihilation operators,
respectively, of a quantum harmonic oscillator on a circle. An expression for
the effective coupling constant is obtained showing explicitly its dependence
on the dimension of the box.
","[{""version"":""v1"",""created"":""Tue, 14 Sep 2004 18:09:23 GMT""}]","2009-11-10"
"hep-th/0409147","Niklas Beisert","Niklas Beisert","Higher-Loop Integrability in N=4 Gauge Theory","13 pages, Talk given at Strings 2004, Paris, 28 June - 2 July, v2:
  reference added","Comptes Rendus Physique 5:1039-1048,2004","10.1016/j.crhy.2004.09.011","AEI 2004-069","hep-th",,"  The dilatation operator measures scaling dimensions of local operator in a
conformal field theory. Algebraic methods of constructing the dilatation
operator in four-dimensional N=4 gauge theory are reviewed. These led to the
discovery of novel integrable spin chain models in the planar limit. Making use
of Bethe ansaetze, a superficial discrepancy in the AdS/CFT correspondence was
found, we discuss this issue and give a possible resolution.
","[{""version"":""v1"",""created"":""Tue, 14 Sep 2004 16:25:38 GMT""},{""version"":""v2"",""created"":""Thu, 28 Oct 2004 03:44:41 GMT""}]","2011-03-23"
"hep-th/0409148","Atish Dabholkar","Atish Dabholkar","Exact Counting of Black Hole Microstates","4 pages, latex, minor changes","Phys.Rev.Lett. 94 (2005) 241301","10.1103/PhysRevLett.94.241301","TIFR/TH/04-23, SU-ITP-04-36","hep-th",,"  The exact entropy of two-charge supersymmetric black holes in N=4 string
theories is computed to all orders using Wald's formula and the supersymmetric
attractor equations with an effective action that includes the relevant higher
curvature terms. Classically, these black holes have zero area but the
attractor equations are still applicable at the quantum level. The quantum
corrected macroscopic entropy agrees precisely with the microscopic counting
for an infinite tower of fundamental string states to all orders in an
asymptotic expansion.
","[{""version"":""v1"",""created"":""Tue, 14 Sep 2004 17:44:53 GMT""},{""version"":""v2"",""created"":""Wed, 16 Feb 2005 17:46:51 GMT""}]","2009-11-10"
"hep-th/0409149","Edward Witten","Chris Beasley and Edward Witten","New Instanton Effects In Supersymmetric QCD","40 pp","JHEP 0501:056,2005","10.1088/1126-6708/2005/01/056",,"hep-th",,"  In supersymmetric QCD with SU(N_c) gauge group and N_f flavors, it is known
that instantons generate a superpotential if N_f=N_c-1 and deform the moduli
space of vacua if N_f=N_c. But the role of instantons has been unclear for
N_f>N_c. In this paper, we demonstrate that for N_f>N_c, on the moduli space of
vacua, instantons generate a more subtle chiral operator containing (for
example) non-derivative interactions of 2(N_f-N_c)+4 fermions. Upon giving
masses to some flavors, one can integrate out some fermions and recover the
standard results for N_f=N_c and N_f=N_c-1. For N_f=N_c, our analysis gives, in
a sense, a more systematic way to demonstrate that instantons deform the
complex structure of the moduli space of vacua.
","[{""version"":""v1"",""created"":""Tue, 14 Sep 2004 19:17:10 GMT""}]","2010-04-07"
"hep-th/0409150","Mokhtar Hassaine","Eloy Ay\'on-Beato and Mokhtar Hassa\""ine","pp Waves of Conformal Gravity with Self-Interacting Source","6 pages, minor changes, accepted in Ann. Phys","Annals Phys. 317 (2005) 175-181","10.1016/j.aop.2004.11.006","CECS-PHY-04-14","hep-th gr-qc",,"  Recently, Deser, Jackiw and Pi have shown that three-dimensional conformal
gravity with a source given by a conformally coupled scalar field admits pp
wave solutions. In this letter, we consider this model with a self-interacting
potential preserving the conformal structure. A pp wave geometry is also
supported by this system and, we show that this model is equivalent to
topologically massive gravity with a cosmological constant whose value is given
in terms of the potential strength.
","[{""version"":""v1"",""created"":""Tue, 14 Sep 2004 19:14:29 GMT""},{""version"":""v2"",""created"":""Mon, 22 Nov 2004 20:53:53 GMT""}]","2016-08-16"
"hep-th/0409151","Tonnis ter Veldhuis","T.E. Clark, Muneto Nitta and T. ter Veldhuis","Non-BPS Brane Dynamics And Dual Tensor Gauge Theory","15 pages, no figures","Phys.Rev. D70 (2004) 125011","10.1103/PhysRevD.70.125011",,"hep-th",,"  The action for the long wavelength oscillations of a non-BPS p=3 brane
embedded in N=1, D=5 superspace is determined by means of the coset method. The
D=4 world volume Nambu-Goldstone boson of broken translation invariance and the
two D=4 world volume Weyl spinor Goldstinos of the completely broken
supersymmetry describe the excitations of the brane into the broken space and
superspace directions. The resulting action is an invariant synthesis of the
Akulov-Volkov and Nambu-Goto actions. The D=4 antisymmetric tensor gauge theory
action dual to the p=3 brane action is determined.
","[{""version"":""v1"",""created"":""Wed, 15 Sep 2004 04:14:04 GMT""}]","2007-05-23"
"hep-th/0409152","Minoru Eto","Minoru Eto, Nobuhito Maru and Norisuke Sakai","Non-BPS walls and their stability in 5d SUSY theory","4 pages, contribution to SUSY2004 Proceedings, some typos corrected",,,,"hep-th",,"  We review recent work (hep-th/0404114) on non-BPS domain walls in $5d$ SUSY
theory. An exact solution of non-BPS multi-walls is found in supersymmetric
massive T*(CP1) model in five dimensions. The non-BPS multi-wall solution is
found to have no tachyon. The N=1 supersymmetry preserved on the
four-dimensional world volume of one wall is broken by the coexistence of the
other wall. The supersymmetry breaking is exponentially suppressed as the
distance between the walls increases.
","[{""version"":""v1"",""created"":""Wed, 15 Sep 2004 04:26:15 GMT""}]","2007-05-23"
