"cond-mat/0409481","Alfonso Romano","Julius Ranninger and Alfonso Romano","Resonant pairing isotope effect in polaronic systems","7 pages, 6 figures, enlarged discussion on the limits of validity of
  the model, to be published in Phys. Rev. B","Phys. Rev. B 71, 184520 (2005)","10.1103/PhysRevB.71.184520",,"cond-mat.supr-con",,"  The intermediate coupling regime in polaronic systems, situated between the
adiabatic and the anti-adiabatic limit, is characterized by resonant pairing
between quasi-free electrons which is induced by an exchange interaction with
localized bipolarons. The onset of this resonant pairing takes place below a
characteristic temperature T* and is manifest in the opening of a pseudogap in
the density of states of the electrons. The variation of T* is examined here as
a function of (i) the typical frequency \omega_0 of the local lattice modes,
which determines the binding energy of the bipolarons, and (ii) the doping,
which amounts to a relative change of the bipolaron concentration n_B to that
of the free electrons n_F. We concentrate on a doping regime, where small
changes in doping give rise to a large change in T*, which is the case when n_B
is small (< 0.1 per site). For finite values of n_B we find negative and
practically doping independent values of the isotope coefficient \alpha^* which
characterizes the formation of resonating electron pairs. Upon decreasing the
total particle density such that n_B becomes exponentially small, we find a
rapid change in sign of \alpha^*. This is related to the fact that the system
approaches a state which is more BCS-like, where electron pairing occurs via
virtual excitations into bipolaronic states and where T* coincides with the
onset of superconductivity.
","[{""version"":""v1"",""created"":""Sat, 18 Sep 2004 10:42:00 GMT""},{""version"":""v2"",""created"":""Thu, 7 Apr 2005 13:25:25 GMT""}]","2009-11-10"
"cond-mat/0409482","Yan Chen","J. Y. Gan, Yan Chen, Z. B. Su, and F. C. Zhang","Gossamer Superconductivity near Antiferromagnetic Mott Insulator in
  Layered Organic Conductors","5 pages, 3 figures","Phys. Rev. Lett. 94, 067005 (2005).","10.1103/PhysRevLett.94.067005",,"cond-mat.supr-con",,"  Layered organic superconductors are on the verge of the Mott insulator. We
use Gutzwiller variational method to study a Hubbard model including a spin
exchange coupling term. The ground state is found to be a Gossamer
superconductor at small on-site Coulomb repulsion U and an antiferromagnetic
Mott insulator at large U, separated by a first order phase transition. Our
theory is qualitatively consistent with major experiments reported in organic
superconductors.
","[{""version"":""v1"",""created"":""Sat, 18 Sep 2004 10:56:55 GMT""}]","2009-11-10"
"cond-mat/0409483","Alexander Kordyuk","A. A. Kordyuk, S. V. Borisenko, A. Koitzsch, J. Fink, M. Knupfer, H.
  Berger","Self-consistent self-energy analysis of photoemission data","7 pages, 6 figures, revtex4","Phys. Rev. B 71, 214513 (2005) (Appendix)","10.1103/PhysRevB.71.214513",,"cond-mat.str-el cond-mat.supr-con",,"  Here we present the details of a self-consistent procedure of the
photoemission data analysis within the self-energy approach introduced in Ref.1
(cond-mat/0405696). We derive the relations of the quasiparticle self-energy
with the parameters provided by photoemission spectra, demonstrate
self-consistency of the Kramers-Kronig procedure and its robustness in
determination of the bare dispersion, examine the possible influence of a
particle-hole asymmetry, discuss the necessity of a clear definition of the
""kink"", and demonstrate the applicability of the developed approach for a
couple of samples.
","[{""version"":""v1"",""created"":""Sat, 18 Sep 2004 10:53:47 GMT""}]","2007-05-23"
"cond-mat/0409484","Serge Galam","Serge Galam","Unifying Local Dynamics in Two-State Spin Systems","12 pages, 2 figures",,,,"cond-mat.dis-nn",,"  We present a new two-state {+-} opinion dynamics model which defines a
general frame to include all local dynamics in two-state spin systems. Agents
evolve by probabilistic local rules. In each update, groups of various sizes k
are formed according to some probability distribution {a_k}. Given a specific
group with an initial (j) agents sharing opinion {+} and (k-j) agents opinion
{-}, all k members adopt opinion {+} with a probability m_{k,j} and opinion {-}
with (1-m_{k,j}). A very rich and new spectrum of dynamics is obtained. The
final opinion is a polarization along the initial majority, along the initial
minority or a perfect consensus with an equality of opinions as function of the
parameters {a_k, m_{k,j}}. In last case, two regimes exist, monotonic and
dampened oscillatory. The transition from polarization to consensus dynamics
occurs for values of the parameters which reproduce exactly the Voter model. A
scheme is presented to express any local update in terms of a specific set
{a_k, m_{k,j}}. Most existing opinion models are exhibited at particular
limits.
","[{""version"":""v1"",""created"":""Sat, 18 Sep 2004 13:50:40 GMT""}]","2007-05-23"
"cs/0409034","Adam Slagell","Paul Stanton","Securing Data in Storage: A Review of Current Research","22 pages, 4 figures, 3 tables",,,,"cs.OS cs.CR",,"  Protecting data from malicious computer users continues to grow in
importance. Whether preventing unauthorized access to personal photographs,
ensuring compliance with federal regulations, or ensuring the integrity of
corporate secrets, all applications require increased security to protect data
from talented intruders. Specifically, as more and more files are preserved on
disk the requirement to provide secure storage has increased in importance.
This paper presents a survey of techniques for securely storing data, including
theoretical approaches, prototype systems, and existing systems currently
available. Due to the wide variety of potential solutions available and the
variety of techniques to arrive at a particular solution, it is important to
review the entire field prior to selecting an implementation that satisfies
particular requirements. This paper provides an overview of the prominent
characteristics of several systems to provide a foundation for making an
informed decision. Initially, the paper establishes a set of criteria for
evaluating a storage solution based on confidentiality, integrity,
availability, and performance. Then, using these criteria, the paper explains
the relevant characteristics of select storage systems and provides a
comparison of the major differences.
","[{""version"":""v1"",""created"":""Fri, 17 Sep 2004 21:51:24 GMT""}]","2007-05-23"
"gr-qc/0409067","Yury F. Pirogov","Yu. F. Pirogov","Space-time revisited","8 pages. Report presented at the 13th Intern. Seminar on High Energy
  Physics ""Quarks-2004"", Pushkinskie Gory, Russia, May 24-30, 2004",,,,"gr-qc astro-ph hep-ph",,"  The metric space-time is revised as a priori existing. It is substituted by
the world continuum endowed only with the affine connection. The metric,
accompanied by the tensor Goldstone boson, is to emerge during the spontaneous
breaking of the global affine symmetry. Implications for gravity and the
Universe are indicated.
","[{""version"":""v1"",""created"":""Fri, 17 Sep 2004 18:25:23 GMT""}]","2007-05-23"
"gr-qc/0409068","Dan Vollick n","Dan N. Vollick","On the Dirac field in the Palatini form of 1/R gravity","6 pages, LaTeX","Phys.Rev. D71 (2005) 044020","10.1103/PhysRevD.71.044020",,"gr-qc astro-ph hep-th",,"  In recent papers (astro-ph/0306630, gr-qc/0312041) I have argued that the
observed cosmological acceleration can be accounted for by the inclusion of a
1/R term in the gravitational action in the Palatini formalism. Subsequently,
Flanagan (astro-ph/0308111, gr-qc/0403063) argued that this theory is
equivalent to a scalar-tensor theory which produces corrections to the standard
model that are ruled out experimentally.
  In this article I examine the Dirac field coupled to 1/R gravity. The Dirac
action contains the connection which was taken to be the Christoffel symbol,
not an independent quantity, in the papers by Flanagan. Since the metric and
connection are taken to be independent in the Palatini approach it is natural
to allow the connection that appears in the Dirac action to be an independent
quantity. This is the approach that is taken in this paper. The resulting
theory is very different and much more complicated than the one discussed in
Flanagan's papers.
","[{""version"":""v1"",""created"":""Fri, 17 Sep 2004 22:04:03 GMT""}]","2009-11-10"
"gr-qc/0409069","Paola Zizzi","Paola A. Zizzi","A Minimal Model for Quantum Gravity","11 pages, 4 figures, Contributed paper at DICE 2004, 1-4 September
  2004, Piombino, Italy minor changes, misprints corrected","Mod.Phys.Lett. A20 (2005) 645-653","10.1142/S021773230501683X",,"gr-qc hep-th quant-ph",,"  We argue that the model of a quantum computer with N qubits on a quantum
space background, which is a fuzzy sphere with n=2^N elementary cells, can be
viewed as the minimal model for Quantum Gravity. In fact, it is discrete, has
no free parameters, is Lorentz invariant, naturally realizes the Holographic
Principle, and defines a subset of punctures of spin networks' edges of Loop
Quantum Gravity labelled by spins j=2^(N-1)-1/2. In this model, the discrete
area spectrum of the cells, which is not equally spaced, is given in units of
the minimal area of Loop Quantum Gravity (for j=1/2), and provides a discrete
emission spectrum for quantum black holes. When the black hole emits one string
of N bits encoded in one of the n cells, its horizon area decreases of an
amount equal to the area of one cell.
","[{""version"":""v1"",""created"":""Sat, 18 Sep 2004 03:45:19 GMT""},{""version"":""v2"",""created"":""Sat, 29 Jan 2005 18:40:31 GMT""}]","2009-11-10"
"hep-lat/0409111","Gilberto Colangelo","Gilberto Colangelo","Finite volume effects in chiral perturbation theory","Talk presented at Lattice2004(plenary), 7 pages, 4 figures",,"10.1016/j.nuclphysbps.2004.11.195",,"hep-lat",,"  There has recently been an intense activity in the study of finite volume
effects by means of chiral perturbation theory. In this contribution I review
recent work in this field both for the epsilon-- (Mpi L \lesssim 1) and the
p--regime (Mpi L \gg 1). For the latter I emphasize the importance of going
beyond leading order calculations in chiral perturbation theory and the
usefulness of asymptotic formulae a la L""uscher used in combination with CHPT.
","[{""version"":""v1"",""created"":""Fri, 17 Sep 2004 16:48:41 GMT""}]","2009-11-10"
"hep-lat/0409112","Kieran Holland","K. Holland","Triviality and the Higgs mass lower bound","Plenary talk presented at Lattice2004(plenary), Fermilab, June 21-26,
  2004; 7 pages, 10 figures",,"10.1016/j.nuclphysbps.2004.11.293",,"hep-lat hep-ph",,"  In the minimal Standard Model, it is commonly believed that the Higgs mass
cannot be too small, otherwise Top quark dynamics makes the Higgs potential
unstable. Although this Higgs mass lower bound is relevant for current
phenomenology, we show that the Higgs vacuum instability in fact does not exist
and only appears when treating incorrectly the cut-off in the renormalization
of a trivial theory. We also demonstrate how to calculate correctly the
regulator-dependent Higgs mass lower bound.
","[{""version"":""v1"",""created"":""Fri, 17 Sep 2004 17:50:30 GMT""}]","2009-11-10"
"hep-lat/0409113","John Laiho","Jack Laiho","Quenching effects in strong penguin contributions to
  $\epsilon'/\epsilon$","3 pages, talk presented at Lattice2004(weak), Fermilab, June 21-26,
  2004",,"10.1016/j.nuclphysbps.2004.11.278",,"hep-lat",,"  Quenching effects in strong penguin matrix elements are investigated. A
lattice determination of $\alpha_q^{NS}$, the constant that appears in the
quenched ChPT relevant for the lattice analysis of $K\to\pi\pi$ matrix
elements, shows that this constant is large. The original RBC analysis of $Q_6$
matrix elements is revisited in light of this result. Also, the numerical
effects of choosing the singlet Golterman-Pallante method of quenching $Q_6$ is
investigated.
","[{""version"":""v1"",""created"":""Fri, 17 Sep 2004 19:31:25 GMT""}]","2009-11-10"
"hep-lat/0409114","Yasumichi Aoki","Yasumichi Aoki (for the RBC collaboration)","Nucleon Decay Matrix Elements with N_f=0 and 2 Domain-Wall Quarks","Talk presented at Lattice2004(weak), 3 pages, 2 figures",,,"WUB-04-11","hep-lat hep-ph",,"  The nucleon decay matrix elements of three-quark operators are calculated
with domain-wall fermions. Operators are renormalized non-perturbatively to
match the MS bar (NDR) scheme at NLO. Quenched simulation studies involve both
direct measurement of the matrix elements and the chiral Lagrangian parameters,
alpha and beta. We also report on the dynamical quark effects on these
parameters.
","[{""version"":""v1"",""created"":""Fri, 17 Sep 2004 22:33:37 GMT""}]","2019-08-14"
"hep-lat/0409115","Meifeng Lin","Meifeng Lin","Rough Gauge Fields, Smearing and Domain Wall Fermions","3 pages, 2 figures. Talk presented at Lattice2004(chiral), Fermilab,
  June 21-26, 2004","Nucl.Phys.Proc.Suppl.140:692,2005","10.1016/j.nuclphysbps.2004.11.308",,"hep-lat",,"  At a fixed lattice spacing, as determined by say m_\rho, adding additional
fermion flavors to a dynamical simulation produces rougher gauge field
configurations at the lattice scale. For domain wall fermions, these rough
configurations lead to larger residual chiral symmetry breaking and larger
values for the residual masses, m_{res}. We discuss ongoing attempts to reduce
chiral symmetry breaking for N_f = 3 dynamical domain wall fermion simulations
by different smoothing choices for the gauge fields.
","[{""version"":""v1"",""created"":""Fri, 17 Sep 2004 22:41:02 GMT""}]","2009-11-13"
"hep-lat/0409116","Masataka Okamoto","M. Okamoto, C. Aubin, C. Bernard, C. DeTar, M. Di Pierro, A.X.
  El-Khadra, Steven Gottlieb, E.B. Gregory, U.M. Heller, J. Hetrick, A.S.
  Kronfeld, P.B. Mackenzie, D.P. Menscher, M. Nobes, M.B. Oktay, J. Osborn,
  J.N. Simone, R. Sugar, D. Toussaint, H.D. Trottier","Semileptonic D->pi/K and B->pi/D decays in 2+1 flavor lattice QCD","Talk presented at Lattice2004(heavy); 3 pages, 3 figures","Nucl.Phys.Proc.Suppl.140:461-463,2005","10.1016/j.nuclphysbps.2004.11.151","FERMILAB-CONF-04-224-T","hep-lat",,"  We present results for form factors of semileptonic decays of $D$ and $B$
mesons in 2+1 flavor lattice QCD using the MILC gauge configurations. With an
improved staggered action for light quarks, we successfully reduce the
systematic error from the chiral extrapolation. The results for $D$ decays are
in agreement with experimental ones. The results for B decays are preliminary.
Combining our results with experimental branching ratios, we then obtain the
CKM matrix elements $|V_{cd}|$, $|V_{cs}|$, $|V_{cb}|$ and $|V_{ub}|$. We also
check CKM unitarity, for the first time, using only lattice QCD as the
theoretical input.
","[{""version"":""v1"",""created"":""Sat, 18 Sep 2004 01:26:07 GMT""}]","2008-11-26"
"hep-lat/0409117","Shinji Takeda","CP-PACS Collaboration: S. Takeda, S. Aoki, M. Fukugita, K-I. Ishikawa,
  N. Ishizuka, Y. Iwasaki, K. Kanaya, T. Kaneko, Y. Kuramashi, M. Okawa, Y.
  Taniguchi, A. Ukawa, T. Yoshi\'e","A scaling study of the step scaling function of quenched QCD with
  improved gauge actions","3 pages. Parallel talk presented at Lattice2004(improved), Fermilab,
  June 21-26, 2004",,,"UTHEP-496, UTCCS-P-7","hep-lat",,"  We study the scaling behavior of the step scaling function for SU(3) gauge
theory, employing the Iwasaki gauge action and the Luescher-Weisz gauge action.
In particular, we test the choice of boundary counter terms and apply a
perturbative procedure for removal of lattice artifacts for the simulation
results in the extrapolation procedure. We confirm the universality of the step
scaling functions at both weak and strong coupling regions. We also measure the
low energy scale ratio with the Iwasaki action, and confirm its universality.
","[{""version"":""v1"",""created"":""Sat, 18 Sep 2004 07:00:12 GMT""}]","2012-08-27"
"hep-ph/0409214","Dumitru Ghilencea","D.M. Ghilencea","Higher Derivative Operators as loop counterterms in one-dimensional
  field theory orbifolds","19 pages, LaTeX; one paragraph added in section 3","JHEP0503:009,2005","10.1088/1126-6708/2005/03/009","DAMTP-2004-78","hep-ph hep-th",,"  Using a 5D N=1 supersymmetric toy-model compactified on S_1/(Z_2 x Z_2'),
with a ``brane-localised'' superpotential, it is shown that higher (dimension)
derivative operators are generated as one-loop counterterms to the (mass)^2 of
the zero-mode scalar field, to ensure the quantum consistency of the model.
Such operators are just a result of the compactification and integration of the
bulk modes. They are relevant for the UV momentum scale dependence of the
(mass)^2 of the zero-mode scalar field, regarded as a Higgs field in more
realistic models. While suppressed for a small compactification radius R, these
operators can affect the predictive power of models with a large value for R. A
general method is also provided for a careful evaluation of infinite sums of 4D
divergent loop-integrals (of Feynman diagrams) present in field theory
orbifolds. With minimal changes, this method can be applied to specific
orbifold models for a simple evaluation of their radiative corrections and the
overall divergences.
","[{""version"":""v1"",""created"":""Fri, 17 Sep 2004 16:03:02 GMT""},{""version"":""v2"",""created"":""Sat, 2 Oct 2004 13:44:48 GMT""},{""version"":""v3"",""created"":""Tue, 1 Feb 2005 16:12:27 GMT""},{""version"":""v4"",""created"":""Mon, 28 Feb 2005 16:41:00 GMT""}]","2008-11-26"
"hep-ph/0409216","J. Lorenzo Diaz-Cruz","J. Lorenzo Diaz-Cruz","Tracing the Gauge Origin of Yukawa and Higgs Parameters Beyond the
  Standard Model","12 pages, 1 table, references added","Mod.Phys.Lett.A20:2397-2408,2005","10.1142/S0217732305017949","CAPCyR-BUAP-02-04","hep-ph",,"  We discuss possible realizations of the hypothesis that all the fundamental
interactions of the elementary particles should be of gauge type, including the
Yukawa and Higgs ones. In the minimal SUSY extension of the standard model,
where the quartic Higgs couplings are ``gauged'' through the D-terms, it is
also possible to generate radiatively the Yukawa matrices for the light
generations, thus expressing them as functions of gauge couplings. The program
can also be applied to the SUSY LR model, where the possibility to induce
radiatively the mixing angles, can help to make viable the parity solution to
the strong CP problem. The superpotential of the model still includes some
non-gauge couplings, namely, the Yukawa for the third generation and the
trilinear terms involving the Higgs bi-doublet and two pairs of doublets.
Additional progress to relate these parameters to gauge couplings, can be made
by embedding the LR model within a SUSY model SU(4)_WxU(1)_{B-L} in five
dimensions, where the Higgs bi-doublet is identified as the extra component of
the 5D gauge field.
","[{""version"":""v1"",""created"":""Fri, 17 Sep 2004 19:11:31 GMT""},{""version"":""v2"",""created"":""Thu, 7 Oct 2004 00:55:55 GMT""}]","2009-11-10"
"hep-ph/0409217","Kazuo Tsushima","K. Tsushima (IFT-UNESP and Mackenzie Presbiteriana University, Brazil,
  and NCTS at Taipei, Taiwan), K. Saito (Tokyo University of Science, Japan),
  F.M. Steffens (IFT-UNESP and Mackenzie Presbiteriana University, Brazil)","Effect of bound nucleon internal structure change on nuclear structure
  functions","12 pages, 4 figures, to be published in PLB. Effect of Fermimotion is
  included. Accordingly, 4 figures as well as the text were modified","Phys.Lett.B612:5-12,2005","10.1016/j.physletb.2005.02.056",,"hep-ph nucl-th",,"  Effect of bound nucleon internal structure change on nuclear structure
functions is investigated based on local quark-hadron duality. The bound
nucleon structure functions calculated for charged-lepton and (anti)neutrino
scattering are all enhanced in symmetric nuclear matter at large Bjorken-$x$
($x \agt 0.85$) relative to those in a free nucleon. This implies that a part
of the enhancement observed in the nuclear structure function $F_2$ (in the
resonance region) at large Bjorken-$x$ (the EMC effect) is due to the effect of
the bound nucleon internal structure change. However, the $x$ dependence for
the charged-lepton and (anti)neutrino scattering is different. The former
[latter] is enhanced [quenched] in the region $0.8 \alt x \alt 0.9$ [$0.7 \alt
x \alt 0.85$] due to the difference of the contribution from axial vector form
factor. Because of these differences charge symmetry breaking in parton
distributions will be enhanced in nuclei.
","[{""version"":""v1"",""created"":""Fri, 17 Sep 2004 19:12:02 GMT""},{""version"":""v2"",""created"":""Thu, 24 Feb 2005 02:29:42 GMT""}]","2014-11-18"
"hep-ph/0409218","Arhrib Abdesslam","Abdesslam Arhrib (FST Tanger)","Higgs bosons decay into bottom-strange in two Higgs Doublets Models","16 pages, Latex, 6 eps figures, more numerics, conclusion slightly
  modified in 2HDMII. Version to be published in PLB","Phys.Lett. B612 (2005) 263-274","10.1016/j.physletb.2005.03.001","preprint LPHEP-04-03","hep-ph",,"  We analyze the decays $\{h^0,H^0,A^0\}\to \bar{s}b$ within two Higgs Doublet
Models with Natural Flavor Conservation (2HDM) type I and II. It is found that
the Higgs bosons decay into bottom-strange can lead to a branching ratio in the
range $10^{-5}\to 10^{-3}$ for small $\tan\beta \approx 0.1\to 0.5$ and rather
light charged Higgs in the 2HDM type I. When $\tan\beta \ga 1$, one can easily
reach a branching ratio of the order $10^{-5}$. In 2HDM type II, without
imposing $b\to s\gamma$ constraint, the situation is the same as in 2HDM type
I. If $b\to s\gamma$ constraint on charged Higgs mass ($M_{H\pm}\geq 350$ GeV)
is imposed, we obtain $Br(h^0 \to \bar{s}b)$ in the range $10^{-5}$--$10^{-6}$.
A comparison between the rates of $h^0\to \bar{s}b$ and $h^0\to \gamma \gamma$
is made. It is found that in the fermiophobic scenario, $h^0\to \gamma \gamma$
is still the dominant decay mode.
","[{""version"":""v1"",""created"":""Fri, 17 Sep 2004 20:04:29 GMT""},{""version"":""v2"",""created"":""Wed, 9 Mar 2005 11:48:33 GMT""}]","2009-11-10"
"hep-ph/0409220","Alexander Nesterenko","A.V. Nesterenko and J. Papavassiliou","The QCD analytic effective charge and its dependence on the pion mass","Talk given at Eighth Workshop on Nonperturbative QCD, 7 - 11 June
  2004, Paris, France; 6 pages, 2 EPS figures","Int.J.Mod.Phys. A20 (2005) 4622-4627","10.1142/S0217751X05028296",,"hep-ph hep-th",,"  A new model for the QCD analytic running coupling, which incorporates the
effects due to the $\pi$ meson mass, is proposed. The properties of this
invariant charge in spacelike and timelike regions are examined. Its main
distinctive features are a finite infrared limiting value, which depends on the
pion mass, and the ""plateau-like"" behavior in the deep infrared domain of the
timelike region.
","[{""version"":""v1"",""created"":""Sat, 18 Sep 2004 09:04:18 GMT""}]","2007-05-23"
"hep-ph/0409221","Yu Feng Zhou","Yue-Liang Wu and Yu-Feng Zhou","Implications of Charmless B Decays with Large Direct CP Violation","4 pages, 1 figure, 1 table, results updated with the latest data.
  conclusions unchanged. Refence added. published version","Phys.Rev.D71:021701,2005","10.1103/PhysRevD.71.021701","DO-TH 04/10","hep-ph hep-ex",,"  Based on the most recent data in charmless B decays including the very
recently reported large direct CP violations, it is shown that the weak phase
gamma can well be extracted without two-fold ambiguity even only from two decay
modes pi^+pi^- and pi^+K^-, and its value is remarkably consistent with the
global standard model fit at a compatible accuracy. A fit to all the pi pi, pi
K data favor both large electroweak penguin and color-suppressed tree amplitude
with large strong phases. It is demonstrated that the inclusion of small
SU(3)symmetry breaking effects of strong phases and the inelastic rescattering
effects can well improve the consistency of the data, while both effects may
not be sufficient to arrive at a small electroweak penguin amplitude in the
standard model. It is of interest to notice that large or small electroweak
penguin amplitude becomes a testable prediction as they lead to significantly
different predictions for the direct CP violations for pi^0 pi^0, pi^0 K^0
modes. Clearly, precise measurements on charmless B decays will provide a
window for probing new physics.
","[{""version"":""v1"",""created"":""Sat, 18 Sep 2004 13:33:49 GMT""},{""version"":""v2"",""created"":""Mon, 27 Sep 2004 11:00:46 GMT""},{""version"":""v3"",""created"":""Tue, 11 Jan 2005 13:18:39 GMT""},{""version"":""v4"",""created"":""Mon, 31 Jan 2005 15:30:36 GMT""}]","2008-11-26"
