"astro-ph/0409447","Kurtis A. Williams","Kurtis A. Williams, M. Bolte, and Detlev Koester","An empirical initial-final mass relation from hot, massive white dwarfs
  in NGC 2168 (M35)","14 pages, 3 figures. Accepted for publication in the Astrophysical
  Journal Letters. Contains some acknowledgements not in accepted version (for
  space reasons), otherwise identical to accepted version","Astrophys.J. 615 (2004) L49-L52","10.1086/425995",,"astro-ph",,"  The relation between the zero-age main sequence mass of a star and its
white-dwarf remnant (the initial-final mass relation) is a powerful tool for
exploration of mass loss processes during stellar evolution. We present an
empirical derivation of the initial-final mass relation based on spectroscopic
analysis of seven massive white dwarfs in NGC 2168 (M35). Using an internally
consistent data set, we show that the resultant white dwarf mass increases
monotonically with progenitor mass for masses greater than 4 solar masses, one
of the first open clusters to show this trend. We also find two massive white
dwarfs foreground to the cluster that are otherwise consistent with cluster
membership. These white dwarfs can be explained as former cluster members
moving steadily away from the cluster at speeds of <~0.5 km/s since their
formation and may provide the first direct evidence of the loss of white dwarfs
from open clusters. Based on these data alone, we constrain the upper mass
limit of WD progenitors to be >=5.8 solar masses at the 90% confidence level
for a cluster age of 150 Myr.
","[{""version"":""v1"",""created"":""Fri, 17 Sep 2004 21:08:34 GMT""}]","2009-11-10"
"astro-ph/0409448","Brian Keeney","Brian A. Keeney (1), Emmanuel Momjian (2), John T. Stocke (1), Chris
  L. Carilli (3), Jason Tumlinson (4) ((1) CASA, Univ. of Colorado, (2) NAIC,
  Arecibo, (3) NRAO, (4) Univ. of Chicago)","Absorption Line Study of Halo Gas in NGC 3067 Toward the Background
  Quasar 3C 232","30 pages, 6 figures, ApJ submitted","Astrophys.J. 622 (2005) 267-278","10.1086/427899",,"astro-ph",,"  We present new H I 21 cm absorption data and ultraviolet spectroscopy from
HST/STIS of the QSO/galaxy pair 3C 232/NGC 3067. The QSO sightline lies near
the minor axis and 1.8 arcmin (11 kpc) above the plane of NGC 3067, a nearby
luminous (cz = 1465 km/s, L = 0.5L*) starburst galaxy with a moderate star
formation rate of 1.4 Solar masses per year. The UV spectra show that the Si IV
and C IV doublets have the same three velocity components at cz = 1369, 1417,
and 1530 km/s found in Ca II H & K, Na I D, Mg I, Mg II, and Fe II, implying
that the low and high ionization gas are both found in three distinct absorbing
clouds (only the strongest component at 1420 km/s is detected in H I 21 cm).
The new Lyman alpha observation allows the first measurements of the spin and
kinetic temperatures of halo gas: T_s = 435 +/- 140 K and T_k/T_s ~ 1. However,
while a standard photoionization model can explain the low ions, the C IV and
Si IV are explained more easily as collisionally-ionized boundary layers of the
photoionized clouds. Due to their small inferred space velocity offsets (-260,
-130, and +170 km/s) relative to the nucleus of NGC 3067 and the spatial
coincidence of low and high ionization gas, we propose that these absorbers are
analogous to Galactic high velocity clouds (HVCs). A comparison of the NGC 3067
clouds and Galactic HVCs finds similar H I column densities, kinematics,
metallicities, spin temperatures, and inferred sizes. We find no compelling
evidence that any halo gas along this sightline is escaping the gravitational
potential of NGC 3067, despite its modest starburst.
","[{""version"":""v1"",""created"":""Fri, 17 Sep 2004 22:04:59 GMT""}]","2009-11-10"
"astro-ph/0409449","Eduardo Martin","Eduardo L. Mart\'in, Antonio Magazz\`u, Xavier Delfosse, Robert D.
  Mathieu","The pre-main sequence spectroscopic binary UZ Tau East: improved orbital
  parameters and accretion phase dependence","accepted for publication in A&A","Astron.Astrophys. 429 (2005) 939-943","10.1051/0004-6361:20041724",,"astro-ph",,"  We present radial-velocity measurements obtained using high- and
intermediate-resolution spectroscopic observations of the classical T Tauri
star UZ Tau East obtained from 1994 to 1996. We also provide measurements of
H$\alpha$ equivalent widths and optical veiling. Combining our radial-velocity
data with those recently reported by Prato et al. (2002), we improve the
orbital elements for this spectroscopic binary. The orbital period is
18.979$\pm$0.007 days and the eccentricity is e=0.14. We find variability in
the H$_\alpha$ emission and veiling, signposts of accretion, but at periastron
passage the accretion is not as clearly enhanced as in the case of the binary
DQ Tau. The difference in the behaviour of these two binaries is consistent
with the hydrodynamical models of accretion from circumbinary disks because UZ
Tau East has lower eccentricity than DQ Tau. It seems that enhanced periastron
accretion may occur only in systems with very high eccentricity (e$>$0.5).
","[{""version"":""v1"",""created"":""Sat, 18 Sep 2004 01:57:52 GMT""}]","2009-11-10"
"astro-ph/0409450","Eduardo Martin","Eduardo L. Martin, Antonio Magazzu, Ramon J. Garcia Lopez, Sofia
  Randich, and David Barrado y Navascues","On the potassium-rotation connection in late-type Alpha Persei stars","accepted for publication in A&A","Astron.Astrophys. 429 (2005) 1051-1055","10.1051/0004-6361:20041629",,"astro-ph",,"  We present measurements of the \ion{K}{i} $\lambda 7699$ line from spectra of
19 late-type members of the $\alpha$Persei cluster obtained with the
Intermediate Dispersion Spectrograph at the Isaac Newton Telescope. These stars
span a narrow range of $T_\mathrm{eff}$, from 5091 K to 4771 K, and a wide
range of $v \sin i$ values (9 $\mathrm{km s}^{-1}$--170 $\mathrm{km s}^{-1}$).
We find empirically that larger rotational broadening increases the equivalent
width of \ion{K}{i} $\lambda 7699$ linearly for $v \sin i$ values from 15
$\mathrm{km s}^{-1}$ to 75 $\mathrm{km s}^{-1}$. This correlation breaks down
for $v \sin i >$ 75 $\mathrm{km s}^{-1}$. After correction for this effect, we
show that the potassium line equivalent widths do not correlate with $v \sin
i$.}
","[{""version"":""v1"",""created"":""Sat, 18 Sep 2004 02:11:21 GMT""}]","2009-11-10"
"astro-ph/0409451","Ana Pelinson","Reuven Opher, Ana Pelinson","Decay of the vacuum energy into CMB photons",,"Mon.Not.Roy.Astron.Soc. 362 (2005) 167-170","10.1111/j.1365-2966.2005.09279.x",,"astro-ph",,"  We examine the possibility of the decay of the vacuum energy into cosmic
microwave background (CMB) photons. It is shown that observations of the
primordial density fluctuation spectrum put strong limits on the possible decay
rate. When photon creation due to the vacuum energy decay takes place, the
standard linear temperature dependence, T(z)=T_0(1+z), where T_0 is the present
CMB temperature, is modified. The decay is described by a generic temperature
dependence, T(z)=T_0(1+z)^{1-\beta}, of the CMB photons. A strong limit on the
maximum value of the decay rate is obtained by placing a maximum value on the
\beta parameter: \beta_{max}\approx 3\times 10^{-3}.
","[{""version"":""v1"",""created"":""Sat, 18 Sep 2004 02:12:18 GMT""},{""version"":""v2"",""created"":""Fri, 2 Sep 2005 19:15:11 GMT""}]","2009-11-10"
"cond-mat/0409463","Frank Lechermann","Frank Lechermann, Silke Biermann, Antoine Georges","Importance of interorbital charge transfers for the metal-to-insulator
  transition of BaVS$_3$","improved discussion, new figure, added references","Phys. Rev. Lett. 94, 166402 (2005)","10.1103/PhysRevLett.94.166402",,"cond-mat.str-el cond-mat.mtrl-sci",,"  The underlying mechanism of the metal-to-insulator transition (MIT) in
BaVS$_3$ is investigated, using dynamical mean-field theory in combination with
density functional theory. It is shown that correlation effects are responsible
for a strong charge redistribution, which lowers the occupancy of the broader
\a1g band in favor of the narrower $E_g$ bands. This resolves several
discrepancies between band theory and the experimental findings, such as the
observed value of the charge-density wave ordering vector associated with the
MIT, and the presence of local moments in the metallic phase.
","[{""version"":""v1"",""created"":""Fri, 17 Sep 2004 16:02:54 GMT""},{""version"":""v2"",""created"":""Tue, 14 Dec 2004 11:26:00 GMT""}]","2009-11-10"
"cond-mat/0409464","Yan Li","Yan Li, Slava V.Rotkin and Umberto Ravaioli","Metal-Semiconductor Transition in Armchair Carbon Nanotubes by Symmetry
  Breaking","3 pages, 3 figures, published on APL","Appl. Phys. Lett., 85, 4178 (2004)","10.1063/1.1811792",,"cond-mat.mtrl-sci cond-mat.mes-hall",,"  The electronic band structure of armchair carbon nanotubes may be
considerably modified by potentials with angular dependence. Different angular
modes V_q ~ cos(q*theta) have been studied within a tight-binding scheme. Using
symmetry arguments, we demonstrate a bandgap opening in these metallic
nanotubes when certain selection rules are satisfied for both potential and
nanotube structure. We estimate the bandgap opening as a function of both the
external potential strength and the nanotube radius and suggest an effective
mechanism of metal-semiconductor transition by combination of different forms
of perturbations.
","[{""version"":""v1"",""created"":""Fri, 17 Sep 2004 17:41:03 GMT""},{""version"":""v2"",""created"":""Wed, 16 Nov 2005 23:27:39 GMT""}]","2007-05-23"
"cond-mat/0409465","Daniel ben-Avraham","Erik M. Bollt and Daniel ben-Avraham","What is Special about Diffusion on Scale-Free Nets?","References added","New J. Phys. 7, 26 (2005)",,,"cond-mat.dis-nn",,"  We study diffusion (random walks) on recursive scale-free graphs, and
contrast the results to similar studies in other analytically soluble media.
This allows us to identify ways in which diffusion in scale-free graphs is
special. Most notably, scale-free architecture results in a faster transit time
between existing nodes, when the network grows in size; and walks emanating
from the most connected nodes are recurrent, despite the network's infinite
dimension. We also find that other attributes of the graph, besides its
scale-free distribution, have a strong influence on the nature of diffusion.
","[{""version"":""v1"",""created"":""Fri, 17 Sep 2004 17:17:50 GMT""},{""version"":""v2"",""created"":""Tue, 19 Oct 2004 02:30:50 GMT""}]","2007-05-23"
"cond-mat/0409466","Jens Kunstmann","Jens Kunstmann, Alexander Quandt","Nanotubular Boron-Carbon Heterojunctions","7 pages, 5 figures, accepted by J. Chem Phys","J. Chem. Phys. 121(21), 10680 (2004)","10.1063/1.1814073",,"cond-mat.mtrl-sci",,"  Linear nanotubular boron-carbon heterojunctions are systematically
constructed and studied with the help of ab initio total energy calculations.
The structural compatibility of the two classes of materials is shown, and a
simple recipe that determines all types of stable linear junctions is
illustrated in some detail. Our results also suggest the compatibility of
various technologically interesting types of nanotubular materials, leading to
novel types of nanotubular compound materials, and pointing out the possibility
of wiring nanotubular devices within heterogeneous nanotubular networks.
","[{""version"":""v1"",""created"":""Fri, 17 Sep 2004 17:42:46 GMT""}]","2007-05-23"
"cond-mat/0409467","Dwaipayan Chakrabarti","Dwaipayan Chakrabarti and Biman Bagchi","Frequency dependent heat capacity within a kinetic model of glassy
  dynamics","10 pages, 10 figures",,"10.1063/1.1829251",,"cond-mat.soft",,"  There has been renewed interest in the frequency dependent specific heat of
supercooled liquids in recent years with computer simulation studies exploring
the whole frequency range of relaxation. The simulation studies can thus
supplement the existing experimental results to provide an insight into the
energy landscape dynamics. We here investigate a kinetic model of cooperative
dynamics within the landscape paradigm for the dynamic heat capacity behavior.
In this picture, the beta-process is modeled as a thermally activated event in
a two-level system and the alpha-process is described as a beta-relaxation
mediated cooperative transition in a double well. The model provides a
description of the activated hopping in the energy landscape in close relation
with the cooperative nature of the hopping event. For suitable choice of
parameters, the model predicts a frequency dependent heat capacity that
reflects the two-step relaxation behavior. Although experimentally obtained
specific heat spectra of supercooled liquids till date could not capture the
two-step relaxation behavior, this has been observed in a computer simulation
study by Scheidler et. al. [Phys. Rev. B 63, 104204 (2001)]. The temperature
dependence of the position of the low-frequency peak, due to the
alpha-relaxation, shows a non-Arrhenius behavior as observed experimentally by
Birge and Nagel [Phys. Rev. Lett. 54, 2674 (1985)]. The shape of the alpha-peak
is, however, found to be temperature independent, in agreement with the
simulation result. The high-frequency peak appears with considerably larger
amplitude than the alpha-peak. We attempt a plausible reason for this
observation that is in contrast with the general feature revealed by the
dielectric spectroscopy.
","[{""version"":""v1"",""created"":""Fri, 17 Sep 2004 17:54:47 GMT""}]","2009-11-10"
"cond-mat/0409468","Frank Julicher","Thomas Risler, Jacques Prost, Frank Julicher","Universal Critical Behavior of Noisy Coupled Oscillators","10 pages, 1 figure","Phys. Rev. Lett. 93 (17), 175702 (2004)","10.1103/PhysRevLett.93.175702",,"cond-mat.stat-mech physics.bio-ph",,"  We study the universal thermodynamic properties of systems consisting of many
coupled oscillators operating in the vicinity of a homogeneous oscillating
instability. In the thermodynamic limit, the Hopf bifurcation is a dynamic
critical point far from equilibrium described by a statistical field theory. We
perform a perturbative renormalization group study, and show that at the
critical point a generic relation between correlation and response functions
appears. At the same time the fluctuation-dissipation relation is strongly
violated.
","[{""version"":""v1"",""created"":""Fri, 17 Sep 2004 18:06:07 GMT""}]","2011-09-22"
"cond-mat/0409469","Daniel Podolsky","Daniel Podolsky, Ehud Altman, Timofey Rostunov, and Eugene Demler","Competition between Triplet Superconductivity and Antiferromagnetism in
  Quasi One-Dimensional Electron Systems","35 pages, 19 figures","Phys. Rev. B 70, 224503 (2004)","10.1103/PhysRevB.70.224503",,"cond-mat.str-el cond-mat.supr-con",,"  We investigate the competition between antiferromagnetism and triplet
superconductivity in quasi one-dimensional electron systems. We show that the
two order parameters can be unified using a SO(4) symmetry and demonstrate the
existence of such symmetry in one dimensional Luttinger liquids of interacting
electrons. We argue that approximate SO(4) symmetry remains valid even when
interchain hopping is strong enough to turn the system into a strongly
anisotropic Fermi liquid. For unitary triplet superconductors SO(4) symmetry
requires a first order transition between antiferromagnetic and superconducting
phases. Analysis of thermal fluctuations shows that the transition between the
normal and the superconducting phases is weakly first order, and the normal to
antiferromagnet phase boundary has a tricritical point, with the transition
being first order in the vicinity of the superconducting phase. We propose that
this phase diagram explains coexistence regions between the superconducting and
the antiferromagnetic phases, and between the antiferromagnetic and the normal
phases observed in (TMTSF)$_2$PF$_6$. For non-unitary triplet superconductors
the SO(4) symmetry predicts the existence of a mixed phase of
antiferromagnetism and superconductivity. We discuss experimental tests of the
SO(4) symmetry in neutron scattering and tunneling experiments.
","[{""version"":""v1"",""created"":""Fri, 17 Sep 2004 20:05:08 GMT""}]","2009-11-10"
"cond-mat/0409471","Bruno Barboza Uchoa","B. Uchoa, G. G. Cabrera, and A. H. Castro Neto","Nodal liquid and s-wave superconductivity in transition metal
  dichalcogenides","23 pages, 16 figures. Published version","Phys. Rev. B 71, 184509 (2005)","10.1103/PhysRevB.71.184509",,"cond-mat.supr-con cond-mat.str-el",,"  We explore the physical properties of a unified microscopic theory for the
coexistence of superconductivity and charge density waves in two-dimensional
transition metal dichalcogenides. In the case of particle-hole symmetry the
elementary particles are Dirac fermions at the nodes of the charge density wave
gap. When particle-hole symmetry is broken electron (hole) pockets are formed
around the Fermi surface. The superconducting ground state emerges from the
pairing of nodal quasi-particles mediated by acoustic phonons via a
piezoelectric coupling. We calculate several properties in the s-wave
superconducting phase, including specific heat, ultra-sound absorption, nuclear
magnetic relaxation, thermal, and optical conductivities. In the case with
particle-hole symmetry, the specific heat jump at the transition deviates
strongly from ordinary superconductors. The nuclear magnetic response shows an
anomalous anisotropy due to the broken time-reversal symmetry of the
superconducting gap, induced by the triple charge density wave state. The loss
of lattice inversion symmetry in the charge density wave phase leads to
anomalous coherence factors in the optical conductivity and to the appearance
of an absorption edge at the optical gap energy. Furthermore, optical and
thermal conductivities display anomalous peaks in the infrared when
particle-hole symmetry is broken.
","[{""version"":""v1"",""created"":""Fri, 17 Sep 2004 20:50:37 GMT""},{""version"":""v2"",""created"":""Wed, 22 Dec 2004 12:47:08 GMT""},{""version"":""v3"",""created"":""Mon, 16 May 2005 13:14:04 GMT""},{""version"":""v4"",""created"":""Mon, 24 Jul 2006 18:32:01 GMT""}]","2009-11-10"
"cond-mat/0409473","Andrzej Drzewinski","Andrzej Drzewinski, J. M. J. van Leeuwen","Scaling in the Rubinstein-Duke Model for Reptation","4 Pages RevTeX and 3 PostScript figures included",,,,"cond-mat.stat-mech",,"  We consider an arbitrarily charged polymer driven by a weak field through a
gel according to the rules of the Rubinstein-Duke model. The probability
distribution in the stationary state is related to that of the model in which
only the head is charged. Thereby drift velocity, diffusion constant and
orientation of any charged polymers are expressed in terms of those of the
central model. Mapping the problem on a random walk of a tagged particle along
a one-dimenional chain, leads to a unified scaling expression for the local
orientation. It provides also an elucidation of the role of corrections to
scaling.
","[{""version"":""v1"",""created"":""Fri, 17 Sep 2004 21:10:38 GMT""}]","2007-05-23"
"cond-mat/0409475","Ruostekoski","Lorenzo Isella and Janne Ruostekoski","Nonadiabatic dynamics of a Bose-Einstein condensate in an optical
  lattice","4 pages","Phys. Rev. A 72 (2005) 011601(R)","10.1103/PhysRevA.72.011601",,"cond-mat.stat-mech quant-ph",,"  We study the nonequilibrium dynamics of a Bose-Einstein condensate which is
split in a harmonic trap by turning up a periodic optical lattice potential. We
evaluate the dynamical evolution of the phase coherence along the lattice and
the number fluctuations in individual lattice sites within the stochastic
truncated Wigner approximation when several atoms occupy each site. We show
that the saturation of the number squeezing at high lattice strengths, which
was observed in recent experiments by Orzel et. al., can be explained by the
nonadiabaticity of the splitting.
","[{""version"":""v1"",""created"":""Fri, 17 Sep 2004 22:57:29 GMT""},{""version"":""v2"",""created"":""Mon, 4 Jul 2005 15:21:43 GMT""}]","2016-08-31"
"cond-mat/0409476","Emmanuel I. Rashba","Emmanuel I. Rashba","Sum rules for spin-Hall conductivity cancelation","4 pages, 1 figure",,"10.1103/PhysRevB.70.201309",,"cond-mat.mes-hall",,"  It has been shown recently that the universal dc spin conductivity of
two-dimensional electrons with a Rashba spin-orbit interaction is canceled by
vertex corrections in a weak scattering regime. We prove that the zero bulk
spin conductivity is an intrinsic property of the free-electron Hamiltonian and
scattering is merely a tool to reveal this property in terms of the
diagrammatic technique. When Zeeman energy is neglected, the zero dc
conductivity persists in a magnetic field. Spin conductivity increases
resonantly at the cyclotron frequency and then decays towards the universal
value.
","[{""version"":""v1"",""created"":""Sat, 18 Sep 2004 00:54:53 GMT""}]","2009-11-10"
"cond-mat/0409477","Kenji Ishii","K. Ishii, K. Tsutsui, Y. Endoh, T. Tohyama, K. Kuzushita, T. Inami, K.
  Ohwada, S. Maekawa, T. Masui, S. Tajima, Y. Murakami, J. Mizuki","Mott gap excitations in twin-free YBa2Cu3O7-d (Tc = 93 K) studied by
  RIXS",,"Phys. Rev. Lett. 94, 187002 (2005)","10.1103/PhysRevLett.94.187002",,"cond-mat.str-el",,"  Mott gap excitations in the high-Tc superconductor of the optimal doped
YBa2Cu3O7-d (Tc = 93 K) have been studied by the resonant inelastic x-ray
scattering method. Anisotropic spectra in the ab-plane are observed in a
twin-free crystal. The excitation from the one-dimensional CuO chain is
enhanced at 2 eV near the zone boundary of the b* direction, while the
excitation from the CuO2 plane is broad at 1.5-4 eV and almost independent of
the momentum transfer. Theoretical calculation based on the one-dimensional and
two-dimensional Hubbard model reproduces the observed spectra by taking the
different parameters of the on-site Coulomb energy. The fact of the Mott gap of
the CuO chain site is much smaller than that of CuO2 plane site is observed for
the first time.
","[{""version"":""v1"",""created"":""Sat, 18 Sep 2004 00:57:41 GMT""}]","2007-05-23"
"cond-mat/0409478","Fatkhulla Abdullaev","F. Kh. Abdullaev and J. Garnier","Collective oscillations of one-dimensional Bose-Einstein gas in a
  time-varying trap potential and atomic scattering length","16 pages, 7 figures",,"10.1103/PhysRevA.70.053604",,"cond-mat.other cond-mat.soft",,"  The collective oscillations of 1D repulsive Bose gas with external harmonic
confinement in two different regimes are studied. The first regime is the mean
field regime when the density is high. The second regime is the Tonks-Girardeau
regime when the density is low. We investigate the resonances under periodic
modulations of the trap potential and the effective nonlinearity. Modulations
of the effective nonlinear coefficient result from modulations of the atomic
scattering length by the Feshbach resonance method or variations of the
transverse trap frequency. In the mean field regime we predict the bistability
in the nonlinear oscillations of the condensate. In the Tonks-Girardeau regime
the resonance has the character of a linear parametric resonance. In the case
of rapid strong modulations of the nonlinear coefficient we find analytical
expressions for the nonlinearity managed soliton width and the frequency of the
slow secondary oscillations near the fixed point.
","[{""version"":""v1"",""created"":""Sat, 18 Sep 2004 03:11:30 GMT""}]","2009-11-10"
"cond-mat/0409479","Fatkhulla Abdullaev","J. Garnier, F. Kh. Abdullaev","Symmetry breaking induced by random fluctuations for Bose-Einstein
  condensates in a double-well trap","12 pages, 6 figures",,"10.1103/PhysRevA.71.033603",,"cond-mat.other cond-mat.soft",,"  This paper is devoted to the study of the dynamics of two weakly-coupled
Bose-Einstein condensates confined in a double-well trap and perturbed by
random external forces. Energy diffusion due to random forcing allows the
system to visit symmetry-breaking states when the number of atoms exceeds a
threshold value. The energy distribution evolves to a stationary distribution
which depends on the initial state of the condensate only through the total
number of atoms. This loss of memory of the initial conditions allows a simple
and complete description of the stationary dynamics of the condensate which
randomly visits symmetric and symmetry-breaking states.
","[{""version"":""v1"",""created"":""Sat, 18 Sep 2004 04:46:45 GMT""}]","2009-11-10"
"cond-mat/0409480","Jiulin Du","Jiulin Du","The nonextensive parameter and Tsallis distribution for self-gravitating
  systems","10 pages, 26 references","Europhys. Lett. 67: 893-899, 2004","10.1209/epl/i2004-10145-2",,"cond-mat.stat-mech astro-ph",,"  The properties of the nonextensive parameter q and the Tsallis distribution
for self-gravitating systems are studied. A mathematical expression of q is
deduced based on the generalized Boltzmann equation, the q-H theorem and the
generalized Maxwellian q-velocity distribution in the framework of Tsallis
statistics. We obtain a clear understanding of the physics of q different from
unity with regard to the temperature gradient and the gravitational potential
of the self-gravitating systems. It is suggested that the Tsallis statistics
could be statistics suitable for describing the nonequilibrium systems with
inhomogeneous temperature and the long-range interactions.
","[{""version"":""v1"",""created"":""Sat, 18 Sep 2004 06:49:54 GMT""}]","2015-08-10"
