"astro-ph/0409452","Parijat Thakur Thakur Dr.","H. B. Ann and Parijat Thakur","Formation of Nuclear Spirals in Barred Galaxies","38 pages, 10 figures, accepted for publication in ApJ","Astrophys.J. 620 (2005) 197-209","10.1086/426008",,"astro-ph",,"  We have performed smoothed particle hydrodynamics (SPH) simulations for the
response of the gaseous disk to the imposed moderately strong non-axisymmetric
potentials. The model galaxies are composed of the three stellar components
(disk, bulge and bar) and two dark ones (supermassive black hole and halo)
whose gravitational potentials are assumed to be invariant in time in the frame
corotating with the bar. We found that the torques alone generated by the
moderately strong bar that gives the maximum of tangential-to-radial force
ratio as $(F_{Tan}/F_{Rad})_{max}= 0.3$ are not sufficient to drive the gas
particles close to the center due to the barrier imposed by the inner Lindblad
resonances (ILRs). In order to transport the gas particles towards the nucleus
($r<100$ pc), a central supermassive black hole (SMBH) and high sound speed of
the gas are required to be present. The former is required to remove the inner
inner Lindblad resonance (IILR) that prevents gas inflow close to the nucleus,
while the latter provides favourable conditions for the gas particles to lose
their angular momentum and to spiral in. Our models that have no IILR show the
trailing nuclear spirals whose innermost parts reach close to the center in a
curling way when the gas sound speed is $ c_{s} \gtrsim 15$ km s$^{-1}$. They
resemble the symmetric two-armed nuclear spirals observed in the central
kiloparsec of spiral galaxies. We found that the symmetric two-armed nuclear
spirals are formed by the hydrodynamic spiral shocks caused by the
gravitational torque of the bar in the presence of a central SMBH that can
remove IILR when the sound speed of gas is high enough to drive a large amount
of gas inflow deep inside the ILR. However, the detailed morphology of nuclear
spirals depends on the sound speed of gas.
","[{""version"":""v1"",""created"":""Sun, 19 Sep 2004 08:19:53 GMT""},{""version"":""v2"",""created"":""Thu, 23 Sep 2004 12:14:45 GMT""}]","2009-11-10"
"astro-ph/0409453","Leonid Ksenofontov","H.J. Voelk, E.G. Berezhko, L.T. Ksenofontov","Magnetic Field Amplification in Tycho and other Shell-type Supernova
  Remnants","13 pages, 8 figures, accepted for publication in A&A","Astron.Astrophys.433:229-240,2005","10.1051/0004-6361:20042015",,"astro-ph",,"  It is shown that amplification of the magnetic field in supernova remnants
(SNRs) occurs in all six objects where morphological measurements are presently
available in the hard X-ray continuum at several keV. For the three
archetypical objects (SN 1006, Cas A and Tycho's SNR) to which nonlinear
time-dependent acceleration theory has been successfully applied up to now, the
global theoretical and the local observational field strengths agree very well,
suggesting in addition that all young SNRs exhibit the amplification effect as
a result of very efficient acceleration of nuclear cosmic rays (CRs) at the
outer shock. Since this appears to be empirically the case, we may reverse the
argument and consider field amplification as a measure of nuclear CR
acceleration and it has indeed been argued that acceleration in the amplified
fields allows the CR spectrum from SNRs to reach the knee in the spectrum or,
in special objects, even beyond. The above results are furthermore used to
investigate the time evolution of field amplification in young SNRs. Although
the uncertainties in the data do not allow precise conclusions regarding this
point, they rather clearly show that the ratio of the magnetic field energy
density and the kinetic energy density of gas flow into the shock is of the
order of a few percent if the shock speed is high enough V_s > 10^3 km/s, and
this ratio remains nearly constant during the SNR evolution. The escape of the
highest energy nuclear particles from their sources becomes progressively
important with age, reducing also the cutoff in the \pi^0 -decay gamma-ray
emission spectrum with time after the end of the sweep-up phase. Simultaneously
the leptonic gamma-ray channels will gain in relative importance with
increasing age of the sources.
","[{""version"":""v1"",""created"":""Sun, 19 Sep 2004 04:04:35 GMT""},{""version"":""v2"",""created"":""Tue, 7 Dec 2004 08:58:50 GMT""}]","2008-11-26"
"astro-ph/0409454","Mark R. Krumholz","Mark R. Krumholz (Physics Department, UC Berkeley), Christopher F.
  McKee (Physics and Astronomy Departments, UC Berkeley), and Richard I. Klein
  (Astronomy Department, UC Berkeley, and Lawrence Livermore National
  Laboratory)","Bondi Accretion in the Presence of Vorticity","34 pages, 10 figures, accepted for publication in ApJ","Astrophys.J. 618 (2005) 757-768","10.1086/426051",,"astro-ph",,"  The classical Bondi-Hoyle formula gives the accretion rate onto a point
particle of a gas with a uniform density and velocity. However, the Bondi-Hoyle
problem considers only gas with no net vorticity, while in a real astrophysical
situation accreting gas invariably has at least a small amount of vorticity. We
therefore consider the related case of accretion of gas with constant
vorticity, for the cases of both small and large vorticity. We confirm the
findings of earlier two dimensional simulations that even a small amount of
vorticity can substantially change both the accretion rate and the morphology
of the gas flow lines. We show that in three dimensions the resulting flow
field is non-axisymmetric and time dependent. The reduction in accretion rate
is due to an accumulation of circulation near the accreting particle. Using a
combination of simulations and analytic treatment, we provide an approximate
formula for the accretion rate of gas onto a point particle as a function of
the vorticity of the surrounding gas.
","[{""version"":""v1"",""created"":""Sun, 19 Sep 2004 05:05:07 GMT""}]","2009-11-10"
"astro-ph/0409455","Yasuyuki Watabe","Yasuyuki Watabe, Masayuki Umemura","Obscuration of Active Galactic Nuclei by Circumnuclear Starbursts","10 pages, 8 figure, accepted for publication in ApJ; Fig. 3 and Fig .
  7 are available at http://www.rccp.tsukuba.ac.jp/Astro/watabe/","Astrophys.J. 618 (2005) 649-656","10.1086/426111",,"astro-ph",,"  We examine the possibility of the active galactic nucleus (AGN) obscuration
by dusty gas clouds that spurt out from circumnuclear starburst regions. For
the purpose, the dynamical evolution of gas clouds is pursued, including the
effects of radiation forces by an AGN as well as a starburst. Here, we solve
the radiative transfer equations for clouds, taking into consideration the
growth of clouds by inelastic cloud-cloud collisions and the resultant change
in optical depth. As a result, it is shown that if the starburst is more
luminous than the AGN, gas clouds are distributed extensively above a galactic
disk with the assistance of radiation pressure from the starburst. The total
covering factor of gas clouds reaches a maximum of around 20%. After several
$10^{7}$yr, gas clouds with larger optical depth form by cloud-cloud collisions
and thereafter the clouds fall back due to weakened radiation pressure. The
larger clouds undergo runaway growth and are eventually distributed around the
equatorial plane on the inner sides of circumnuclear starburst regions. These
clouds have an optical depth of several tens. The result is qualitatively
consistent with the putative tendency that Seyfert 2 galaxies appear more
frequently associated with starbursts than Seyfert 1s. On the other hand, if
the AGN luminosity overwhelms that of the starburst, almost all clouds are
ejected from the galaxy due to the radiation pressure from the AGN, resulting
in the formation of a quasar-like object. The origin of obscuration of AGNs is
discussed with relevant observations.
","[{""version"":""v1"",""created"":""Sun, 19 Sep 2004 06:42:26 GMT""}]","2009-11-10"
"astro-ph/0409456","Plamen Fiziev","P. P. Fiziev","Novel Geometrical Models of Relativistic Stars. I. The General Scheme","12 pages, latex file, 1 figure",,,"SU THPH 0409-01","astro-ph",,"  In a series of articles we describe a novel class of geometrical models of
relativistic stars. Our approach to the static spherically symmetric solutions
of Einstein equations is based on a careful physical analysis of radial gauge
conditions. It brings us to a two parameter family of relativistic stars
without stiff functional dependence between the stelar radius and stelar mass.
It turns out that within this family there do exist relativistic stars with
arbitrary large mass, which are to have arbitrary small radius and arbitrary
small luminosity. In addition, point particle idealization, as a limiting case
of bodies with finite dimension, becomes possible in GR, much like in Newton
gravity.
","[{""version"":""v1"",""created"":""Sun, 19 Sep 2004 12:23:32 GMT""}]","2007-05-23"
"astro-ph/0409457","Nikolai Voshchinnikov","N.V. Voshchinnikov, V.B. Il'in, Th. Henning","Modelling the optical properties of composite and porous interstellar
  grains","12 pages, 16 figures, Astronomy & Astrophysics (accepted)","Astron.Astrophys. 429 (2005) 371-381","10.1051/0004-6361:200400081",,"astro-ph",,"  There are indications that interstellar and interplanetary dust grains have
an inhomogeneous and fluffy structure. We investigate different methods to
describe light scattering by such composite particles. Both a model of layered
particles and discrete dipole calculations for particles with Rayleigh and
non-Rayleigh inclusions are used. The calculations demonstrate that porosity is
a key parameter for determining light scattering. We find that the optical
properties of the layered particles depend on the number and position of layers
if the number of layers is small ($\la 15$). For a larger number of layers the
scattering characteristics become independent of the layer sequence. The
optical properties of particles with inclusions depend on the size of
inclusions provided the porosity is large. The scattering characteristics of
very porous particles with inclusions of different sizes are found to be close
to those of multi-layered spheres. We compare the results of these calculations
with the predictions of the effective medium theories (EMT) which are often
used in astronomy as a tool to calculate the optical properties of composite
particles. The results of our analysis show that the internal structure of
grains (layers versus inclusions) only slightly affects the optics of particles
provided the porosity does not exceed 50%. It is also demonstrated that in this
case the optical properties of composite grains calculated with EMT agree with
the results of the exact method for layered particles. For larger porosity, the
standard EMT rules (i.e., Garnett and Bruggeman rules) give reliable results
for particles with Rayleigh inclusions only.
","[{""version"":""v1"",""created"":""Sun, 19 Sep 2004 13:00:15 GMT""}]","2009-11-10"
"cond-mat/0409472","Nikolay Prokof'ev","Nikolay Prokof'ev and Boris Svistunov","On the Supersolid State of Matter","4 figures, 4 pages",,"10.1103/PhysRevLett.94.155302",,"cond-mat.stat-mech cond-mat.supr-con",,"  We prove that the necessary condition for a solid to be also a superfluid is
to have zero-point vacancies, or interstitial atoms, or both, as an integral
part of the ground state. As a consequence, superfluidity is not possible in
commensurate solids which break continuous translation symmetry. We discuss
recent experiment by Kim and Chan [Nature, {\bf 427}, 225 (2004)] in the
context of this theorem, question its bulk supersolid interpretation, and offer
an alternative explanation in terms of superfluid helium interfaces.
","[{""version"":""v1"",""created"":""Sat, 18 Sep 2004 20:01:15 GMT""},{""version"":""v2"",""created"":""Tue, 23 Nov 2004 22:42:27 GMT""}]","2009-11-10"
"cond-mat/0409485","Robin C. Ball","R. C. Ball","Fermions without fermi fields","4 pages, submitted to PRL 18 Sept 2004; typos in equation (3)
  corrected 29 Sept 2004 - thanks to DR Daniels; this version as resubmitted to
  PRL 4 Aug 05 and accepted 6 Sept 05","Phys.Rev.Lett. 95 (2005) 176407","10.1103/PhysRevLett.95.176407",,"cond-mat.str-el",,"  It is shown that an arbitrary Fermion hopping hamiltonian can be represented
by a system with no fermion fields, generalising earlier results by M. Levin &
X.G. Wen [Phys Rev B 67, 245316 (2003)]. All the operators in the hamiltonian
of resulting description obey the principle of locality, that operators
associated with different sites commute, despite the system having excitations
obeying Fermi statistics. Whilst extra conserved degrees of freedom are
introduced, they are all locally identified in the representation obtained. The
same methods apply to Majorana (half) fermions, which for cartesian lattices
mitigate the Fermion Doubling Problem. The generality of these results suggests
that the observation of Fermion excitations in nature does not demand that
anticommuting Fermion fields are fundamental.
","[{""version"":""v1"",""created"":""Sat, 18 Sep 2004 22:14:40 GMT""},{""version"":""v2"",""created"":""Wed, 29 Sep 2004 18:52:59 GMT""},{""version"":""v3"",""created"":""Thu, 8 Sep 2005 14:16:32 GMT""}]","2009-11-10"
"cond-mat/0409486","Mohammad Reza Rahimi Tabar","M. Sadegh Movahed, M. Saadat, M. Reza Rahimi Tabar","The O(n) Model in the $n\to 0$ Limit (self-avoiding-walks) and
  Logarithmic Conformal Field Theory","13 pages, latex","Nucl.Phys. B707 (2005) 405-420","10.1016/j.nuclphysb.2004.11.038",,"cond-mat.dis-nn hep-th",,"  We consider the O(n) theory in the $n \to 0$ limit. We show that the theory
is described by logarithmic conformal field theory, and that the correlation
functions have logarithmic singularities. The explicit forms of the two-,
three- and four-point correlation functions of the scaling fields and the
corresponding logarithmic partners are derived.
","[{""version"":""v1"",""created"":""Sun, 19 Sep 2004 06:53:43 GMT""}]","2009-11-10"
"cond-mat/0409487","S\'ergio Morelh\~ao L.","S\'ergio L. Morelh\~ao, Luis H. Avanci, Stefan Kycia","Automatic physical phasing X-ray crystallography","Presented at the 4th Conference on Synchrotron Radiation in Materials
  Science, Grenoble, France, August 23-25, 2004",,,,"cond-mat.mtrl-sci",,"  Phase invariants are important pieces of information about the atomic
structures of crystals. There are several mathematical methods in X-ray
crystallography to estimate phase invariants. The multi-wave diffraction
phenomenon offers a unique opportunity of physically measuring phase
invariants. In this work, the underneath principals for developing an automatic
procedure to extract accurate phase-invariant values are described. A general
systematic procedure is demonstrated, in practice, by analyzing intensity data
from a KDP crystal.
","[{""version"":""v1"",""created"":""Sun, 19 Sep 2004 12:01:03 GMT""}]","2007-05-23"
"cond-mat/0409488","Stefan Mashkevich","E. Pashitskii (Inst. of Physics, Kiev), S. Vilchynskyy (Kiev
  University)","Study of the temperature dependence of single-particle and pair coherent
  condensate densities for a Bose liquid with a ""depleted"" single-particle
  Bose-Einstein condensate (BEC) at $T \neq 0$","11 pages, 2 figures, LaTeX 2e",,,,"cond-mat.other",,"  We study the temperature dependence of single-particle and pair coherent
condensate densities for a Bose liquid with a ""depleted"" single-particle
Bose-Einstein condensate (BEC) at $T \neq 0$. Our investigations were based on
the field-theoretical Green's functions. On the basis of the use of empirical
data about the speeds of the first and second sounds is described superfluid
state at $T \neq 0$. It is studied the structure of superfluid state taking
into account appearance with the different from zero temperatures of normal
component and taking into account the branch of the second sound, whose speed
approaches zero at $T \to T_\lambda$. The bare interaction between bosons was
chosen in the form of a repulsive Azis potential, the Fourier component of
which was an oscillatory and sign-varying function of the momentum. The
obtained temperature dependence of single-particle and pair coherent condensate
and total densities has a good agreement with experiment data.
","[{""version"":""v1"",""created"":""Sun, 19 Sep 2004 15:23:15 GMT""}]","2007-05-23"
"cs/0409035","David P. Chassin","Ning Lu, Z. Todd Taylor, David P. Chassin, Ross T. Guttromson, R.
  Scott Studham","Parallel Computing Environments and Methods for Power Distribution
  System Simulation","7 pages, 4 figures, 6 tables, submitted to HICSS-38",,,,"cs.DC cs.CE cs.MA cs.PF",,"  The development of cost-effective highperformance parallel computing on
multi-processor supercomputers makes it attractive to port excessively time
consuming simulation software from personal computers (PC) to super computes.
The power distribution system simulator (PDSS) takes a bottom-up approach and
simulates load at the appliance level, where detailed thermal models for
appliances are used. This approach works well for a small power distribution
system consisting of a few thousand appliances. When the number of appliances
increases, the simulation uses up the PC memory and its runtime increases to a
point where the approach is no longer feasible to model a practical large power
distribution system. This paper presents an effort made to port a PC-based
power distribution system simulator to a 128-processor shared-memory
supercomputer. The paper offers an overview of the parallel computing
environment and a description of the modification made to the PDSS model. The
performance of the PDSS running on a standalone PC and on the supercomputer is
compared. Future research direction of utilizing parallel computing in the
power distribution system simulation is also addressed.
","[{""version"":""v1"",""created"":""Sat, 18 Sep 2004 17:09:26 GMT""}]","2007-05-23"
"cs/0409036","Manoj Kumar","Sunder Lal and Manoj Kumar","A Directed Signature Scheme and its Applications","9 Pages, No figures. Presented in the National Conference on
  Information Security, New Delhi- India, Jan-2003",,,,"cs.CR",,"  This paper presents a directed signature scheme with the property that the
signature can be verified only with the help of signer or signature receiver.
We also propose its applications to share verification of signatures and to
threshold cryptosystems.
","[{""version"":""v1"",""created"":""Sun, 19 Sep 2004 03:12:02 GMT""}]","2007-05-23"
"cs/0409037","Mark Dumay","Mark Dumay","Business Processes: The Theoretical Impact of Process Thinking on
  Information Systems Development","22 pages",,,,"cs.OH",,"  This paper investigates two aspects of process thinking that affect the
success rate of IT projects. These two aspects are the changes in the structure
of organizations and the epistemology of Information Systems Development.
Firstly, the conception of business processes within the management of
organizations increases the structural complexity of Information Systems,
because existing systems have to be integrated into a coherent cross-functional
architecture. Secondly, process thinking leads to a particular view of
organizations that ultimately has a negative effect on the support of
Information Systems. As an illustration of process thinking, the Business
Process Reengineering movement adheres to a technocratic management perspective
of organizations. Particularly this conception of organization views people as
mechanisms to realize certain organizational goals. As a result of this view
stakeholders are confronted with the implemented systems, rather than consulted
about the scope and functionality of those systems. Therefore, both aspects of
process thinking have a negative impact on the success of IT projects. The
problem of structural complexity is an area that is addressed by Enterprise
Application Integration, and mainly requires technical solutions. However, the
problems associated with the conception of organization require a different,
markedly non-technical, perspective. Several directions are discussed to
overcome some limitations of process thinking, but these directions are merely
small pointers. If truly effective and useful Information Systems are to be
acquired, IT practitioners and scientists require a completely different
mindset.
","[{""version"":""v1"",""created"":""Sun, 19 Sep 2004 09:56:24 GMT""}]","2007-05-23"
"gr-qc/0409070","Hamid Reza Sepangi","S. Jalalzadeh, B. Vakili and H. R. Sepangi","On extra forces from large extra dimensions","9 pages, no figuers","Phys.Scripta76:122-126,2007","10.1088/0031-8949/76/2/002",,"gr-qc hep-th",,"  The motion of a classical test particle moving on a 4-dimensional brane
embedded in an $n$-dimensional bulk is studied in which the brane is allowed to
fluctuate along the extra dimensions. It is shown that these fluctuations
produce three different forces acting on the particle, all stemming from the
effects of extra dimensions. Interpretations are then offered to describe the
origin of these forces and a relationship between the 4 and $n$-dimensional
mass of the particle is obtained by introducing charges associated with large
extra dimensions.
","[{""version"":""v1"",""created"":""Sun, 19 Sep 2004 08:30:00 GMT""},{""version"":""v2"",""created"":""Tue, 2 Nov 2004 09:29:19 GMT""},{""version"":""v3"",""created"":""Sun, 1 Jul 2007 06:17:53 GMT""}]","2008-11-26"
"hep-lat/0409118","Richard C. Brower","Richard C. Brower, Hartmut Neff and Kostas Orginos","Mobius Fermions: Improved Domain Wall Chiral Fermions","3 pages, 1 figure","Nucl.Phys.Proc.Suppl.140:686-688,2005","10.1016/j.nuclphysbps.2004.11.180",,"hep-lat",,"  A new class of domain wall fermions is defined that interpolates between
Shamir's and Bori\c{c}i's form without increasing the number of Dirac
applications per CG iteration. This class represents a full (real) M\""obius
transformation of the Wilson kernel. Simulations on quenched Wilson lattices
with $\beta = 6.0$ show that the number of lattice sites ($L_s$) in the fifth
dimension can be reduced by a factor of 2 or more at fixed value of chiral
symmetry violations measured by the residual mass ($m_{res}$).
","[{""version"":""v1"",""created"":""Sun, 19 Sep 2004 03:18:32 GMT""}]","2011-04-11"
"hep-lat/0409119","Robert G. Edwards","Robert G. Edwards (for the Lattice Hadron Physics Collaboration)","Electromagnetic Hadronic Form-Factors","3 pages, 5 figures, Lattice2004(spectrum)","Nucl.Phys.Proc.Suppl.140:290-292,2005","10.1016/j.nuclphysbps.2004.11.337","JLAB-THY-05-3","hep-lat",,"  We present a calculation of the nucleon electromagnetic form-factors as well
as the pion and rho to pion transition form-factors in a hybrid calculation
with domain wall valence quarks and improved staggered (Asqtad) sea quarks.
","[{""version"":""v1"",""created"":""Sat, 18 Sep 2004 19:50:40 GMT""}]","2019-08-14"
"hep-lat/0409120","Richard C. Brower","Richard C. Brower","Chiral Extension of Lattice Gauge Theory","Lattice2003 3 pages, 1 figure","Nucl.Phys.Proc.Suppl. 129 (2004) 901-903","10.1016/S0920-5632(03)02748-8",,"hep-lat",,"  Two approaches are presented to coupling explicit Goldstone modes to $N_f$
flavors of massless quarks preserving exact $SU(N_f) \times SU(N_f)$ chiral
symmetry on the lattice. The first approach is a generalization a chiral
extension to QCD (aka XQCD) proposed by Brower, Shen and Tan consistent with
the Ginsparg-Wilson relation. The second approach based on the Callan,Coleman,
Wess and Zumino coset construction has a real determinant atzero quark axial
coupling, $g_A = 0$.
","[{""version"":""v1"",""created"":""Sat, 18 Sep 2004 20:06:14 GMT""}]","2009-11-10"
"hep-lat/0409121","Noriyoshi Ishii","N. Ishii (Tokyo Inst. Tech.), T. Doi (RIKEN BNL), H. Iida (Tokyo Inst.
  Tech.), M. Oka (Tokyo Inst. Tech.), F. Okiharu (Nihon Univ.), H. Suganuma
  (Tokyo Inst. Tech.)","Penta-Quark Anti-Decuplet in Anisotropic Lattice QCD","Lattice2004(spectrum), A talk presented at Lattice 2004 (The XXII
  International Symposium on Lattice Field Theory), Fermi National Accelerator
  Laboratory, USA, 21-26 June 2004",,"10.1016/j.nuclphysbps.2004.11.296",,"hep-lat",,"  The penta-quark(5Q) Theta^+(1540) is studied in anisotropic lattice QCD with
renormalized anisotropy a_s/a_t=4 for a high-precision measurement. Both the
positive and the negative parity 5Q baryons are studied using a non-NK type
interpolating field with I=0 and J=1/2. After the chiral extrapolation, the
lowest positive parity state is found at m_{Theta}\simeq 2.25 GeV, which is too
heavy to be identified with Theta^+(1540). In the negative parity channel, the
lowest energy state is found at m_{Theta}\simeq 1.75 GeV. Although it is rather
close to the empirical value, it is considered to be an NK scattering state
rather than a localized resonance state.
","[{""version"":""v1"",""created"":""Sun, 19 Sep 2004 09:31:24 GMT""}]","2009-11-10"
"hep-lat/0409123","Oliver Baer","Oliver Baer","Chiral perturbation theory at non-zero lattice spacing","14 pages, 2 figures. Talk presented at Lattice2004(plenary),
  Fermilab, June 21-26, 2004. Version 2: Typos corrected",,"10.1016/j.nuclphysbps.2004.12.045",,"hep-lat",,"  A review of chiral perturbation theory for lattice QCD at non-zero lattice
spacing is given.
","[{""version"":""v1"",""created"":""Sun, 19 Sep 2004 09:41:29 GMT""},{""version"":""v2"",""created"":""Mon, 18 Oct 2004 09:05:08 GMT""}]","2009-11-10"
