"hep-ph/0409222","Gilberto Colangelo","B. Ananthanarayan, I. Caprini, G. Colangelo, J. Gasser and H.
  Leutwyler","Scalar form factors of light mesons","13 pages, 2 figures. v2: minor changes - version to appear on Phys.
  Lett. B. v3: Published version. Values of the measured K-pi radii corrected","Phys.Lett. B602 (2004) 218-225","10.1016/j.physletb.2004.10.005","IISc-CHEP-12/04","hep-ph",,"  The scalar radius of the pion plays an important role in CHPT, because it is
related to one of the basic effective coupling constants, viz. the one which
controls the quark mass dependence of F_pi at one loop. In a recent paper,
Yndurain derives a {\it robust lower bound} for this radius, which disagrees
with earlier determinations. We show that such a bound does not exist: the
""derivation"" relies on an incorrect claim. Moreover, we discuss the physics of
the form factors associated with the operators \ubar u, \dbar d and \sbar s and
show that their structure in the vicinity of the K \Kbar threshold is quite
different. Finally, we draw attention to the fact that the new data on the
slope of the scalar K_l3 form factor confirm a recent, remarkably sharp
theoretical prediction.
","[{""version"":""v1"",""created"":""Sat, 18 Sep 2004 20:23:14 GMT""},{""version"":""v2"",""created"":""Wed, 6 Oct 2004 08:57:38 GMT""},{""version"":""v3"",""created"":""Thu, 13 Jan 2005 14:40:53 GMT""}]","2009-11-10"
"hep-ph/0409223","Michio Hashimoto","Michio Hashimoto, Deog Ki Hong","Topcolor breaking through boundary conditions","12 pages, 2 figures. Version to be published in Physical Review D.
  Typos corrected","Phys.Rev. D71 (2005) 056004","10.1103/PhysRevD.71.056004","PNUTP-04-A09, MIT-CTP-3540","hep-ph hep-th",,"  The nontrivial boundary conditions (BC's) for the Topcolor breaking are
investigated in the context of the TeV-scale extra dimension scenario. In the
gauge symmetry breaking mechanism via the BC's we do not need to incorporate a
dynamical mechanism for the Topcolor breaking into the model. Moreover, the
Topcolor breaking can be realized without introducing explicitly a (composite)
scalar field. We present a six dimensional model where the top and bottom
quarks in the bulk have the Topcolor charge while the other quarks in the bulk
do not. We also put the electroweak gauge interaction in the six dimensional
bulk. The bottom quark condensation is naturally suppressed owing to the
power-like running of the bulk U(1)_Y interaction, so that only the top
condensation is expected to take place. We explore such a possibility based on
the ladder Schwinger-Dyson equation and show the cutoff to make the model
viable.
","[{""version"":""v1"",""created"":""Sat, 18 Sep 2004 22:26:19 GMT""},{""version"":""v2"",""created"":""Tue, 15 Feb 2005 00:24:48 GMT""},{""version"":""v3"",""created"":""Thu, 10 Mar 2005 22:15:33 GMT""}]","2009-11-10"
"hep-ph/0409224","Srubabati Goswami","Srubabati Goswami, Abhijit Bandyopadhyay, Sandhya Choubey","Global Analysis of Neutrino Oscillation","Talk given by S. Goswami at 21st International Conference on Neutrino
  Physics and Astrophysics (Neutrino 2004), Paris, France, 14-19 Jun 2004","Nucl.Phys.Proc.Suppl.143:121-128,2005","10.1016/j.nuclphysbps.2005.01.096",,"hep-ph",,"  We present the constraints on neutrino oscillation parameters $\Delta
m^2_{\odot}$ and $\theta_{\odot}$ governing the solar neutrino oscillations
from two generation analysis of solar and KamLAND data. We include the latest
766.3 ton year KamLAND data in our analysis. We also present the allowed values
of parameters $\Delta m^2_{atm}$ and $\sin^2\theta_{atm}$ from two generation
oscillation analysis of SuperKamiokande atmospheric and K2K data. For both
cases we discuss the precision achieved in the present set of experiments and
also how the precision can be improved in future. We also obtain the bounds on
$\theta_{13}$ from three generation analysis of global oscillation data. We
emphasise on the roles played by different data sets in constraining the
allowed parameter ranges.
","[{""version"":""v1"",""created"":""Sun, 19 Sep 2004 13:29:59 GMT""}]","2014-11-18"
"hep-ph/0409225","Srubabati Goswami","Srubabati Goswami, Raghavan Rangarajan, K. Agashe, A. Bandyopadhyay,
  K. Bhattacharya, B. Brahmachari, C. Burgess, E.J. Chun, D. Choudhury,
  P.K.Das, A. Dighe, R. Godbole, N. Gupta, M. Kaplinghat, D. Indumathi, J.
  Forshaw, Y.Y. Keum, B. Layek, D. Majumdar, N. Mahajan, P. Mehta, R.N.
  Mohapatra, N. Mondal, S. More, Y. Nir, S. Pakvasa, M.K. Parida, M. Ravikumar,
  G. Rajasekaran, P. Ramadevi, S.D. Rindani, D.P. Roy, P. Roy, N. Sahu, A.
  Samanta, Y. Shadmi, A.M. Srivastava, S. Uma Sankar, R. Vaidya, U. Yajnik","Working Group Report: Neutrino and Astroparticle Physics","Prepared for the 8th Workshop on High-Energy Physics Phenomenology
  (WHEPP-8), IIT Mumbai, India, 5-16 Jan 2004","Pramana63:1391-1406,2004","10.1007/BF02704904",,"hep-ph",,"  This is the report of neutrino and astroparticle physics working group at
WHEPP-8. We present the discussions carried out during the workshop on selected
topics in the above fields and also indicate progress made subsequently. The
neutrino physics subgroup studied the possibilites of constraining neutrino
masses, mixing and CPT violation in lepton sector from future experiments.
Neutrino mass models in the context of abelian horizontal symmetries, warped
extra dimensions and in presence of triplet Higgs were studied. Effect of
threshold corrections on radiative magnification of mixing angles was
investigated. The astroparticle physics subgroup focused on how various
particle physics inputs affect the CMBR fluctuation spectrum, and on brane
cosmology. This report also contains an introduction on how to use the publicly
available code CMBFAST to calculate the CMBR fluctuations.
","[{""version"":""v1"",""created"":""Sun, 19 Sep 2004 14:12:17 GMT""}]","2008-11-26"
"hep-th/0409193","Akihiro Murayama","S.Ichinose and A.Murayama","A New Mechanism for Radius Stabilization in Warped Supersymmetry","13 pages, 4 figures","Phys.Lett. B625 (2005) 106-116","10.1016/j.physletb.2005.07.067",,"hep-th",,"  A new mechanism for the radius stabilization is proposed in a 5D
super-Yang-Mills model in the warped background of ${AdS}_5$. Dominant 1-loop
contribution to the supersymmetric 4D effective potential is estimated to
depend on the radion. The minimization of the effective potential incorporating
the tree potential and a Fayet-Iliopoulos $D$-term for the gauge group U(1)
reveals an interesting case that the radius is stabilized at a length
corresponding to an intermediate mass scale $10^{11-13}$ GeV.
","[{""version"":""v1"",""created"":""Sun, 19 Sep 2004 07:07:56 GMT""},{""version"":""v2"",""created"":""Wed, 29 Sep 2004 08:16:27 GMT""},{""version"":""v3"",""created"":""Tue, 15 Feb 2005 11:35:54 GMT""},{""version"":""v4"",""created"":""Thu, 2 Jun 2005 10:14:21 GMT""},{""version"":""v5"",""created"":""Thu, 7 Jul 2005 02:11:36 GMT""}]","2009-11-10"
"math-ph/0409041","Luc Frappat","L. Frappat and A. Sciarrino","Hyperbolic Kac-Moody superalgebras",,,"10.1063/1.1851605","LAPTH-1068/04 and DSF-TH-28/04","math-ph math.MP",,"  We present a classification of the hyperbolic Kac-Moody (HKM) superalgebras.
The HKM superalgebras of rank larger or equal than 3 are finite in number (213)
and limited in rank (6). The Dynkin-Kac diagrams and the corresponding simple
root systems are determined. We also discuss a class of singular
sub(super)algebras obtained by a folding procedure.
","[{""version"":""v1"",""created"":""Sat, 18 Sep 2004 18:59:13 GMT""}]","2009-11-10"
"math-ph/0409042","Daoud Mohammed mdaoud","M. Daoud","Extended Voros product in the coherent states framework",,"Phys. Lett. A, 309 (2003) 167","10.1016/S0375-9601(03)00017-3",,"math-ph math.MP",,"  Using coherent states of the Weyl-Heisenberg algebra $h_N$, extended Voros
products and Moyal brakets are derived.
  The covariance of Voros product under canonical transformations is discussed.
Star product related to Barut-Girardello coherent states of the Lie algebra
$su(1,1)$ is also considered. The star eigenvalue problem of singular harmonic
osillator is investigated.
","[{""version"":""v1"",""created"":""Sat, 18 Sep 2004 19:25:55 GMT""}]","2009-11-10"
"math-ph/0409043","Daoud Mohammed mdaoud","M. Daoud","Generalized intelligent states of the su(N) algebra",,"Phys. Lett. A, 329 (2004) 318","10.1016/j.physleta.2004.07.016",,"math-ph math.MP",,"  Schr\"" odinger-Robertson uncertainty relation is minimized for the quadrature
components of Weyl generators of the algebra $su(N)$. This is done by
determining explicit Fock-Bargamann representation of the $su(N)$ coherent
states and the differential realizations of the elements of $su(N)$.
  New classes of coherent and squeezed states are explicitly derived.
","[{""version"":""v1"",""created"":""Sat, 18 Sep 2004 19:32:04 GMT""}]","2009-11-10"
"math-ph/0409044","Daoud Mohammed mdaoud","M. Daoud","Photon-added coherent states for exactly solvable Hamiltonians",,"Phys. Lett. A, 305 (2002) 135","10.1016/S0375-9601(02)01441-X",,"math-ph math.MP",,"  Photon-added Gazeau-Klauder and Klauder-Perelomov coherent states are
investigated. Application to P\""oschl-Teller potentials is given.
","[{""version"":""v1"",""created"":""Sat, 18 Sep 2004 19:36:32 GMT""}]","2009-11-10"
"math-ph/0409045","Daoud Mohammed mdaoud","M. Daoud","Analytic representations based on su(3) coherent states and Robertson
  intelligent states",,"Journal of Mathematical Physics, 45 (2004) 3435","10.1063/1.1777794",,"math-ph math.MP",,"  Robertson intelligent states which minimize the Schr\"" odinger-Robertson
uncertainty relation are constructed as eigenstates of a linear combination of
Weyl generators of the $su(3)$ algebra. The construction is based on the
analytic representations of $su(3)$ coherent states. New classes of coherent
and squeezed states are explicitly derived.
","[{""version"":""v1"",""created"":""Sat, 18 Sep 2004 19:42:39 GMT""}]","2015-06-26"
"math-ph/0409047","Alexander G. Ramm","S.Gutman, A.G.Ramm","Modified Rayleigh Conjecture method for multidimensional obstacle
  scattering problems","10pp",,,,"math-ph math.MP",,"  The Rayleigh conjecture on the representation of the scattered field in the
exterior of an obstacle $D$ is widely used in applications. However this
conjecture is false for some obstacles. AGR introduced the Modified Rayleigh
Conjecture (MRC), and in this paper we present successful numerical algorithms
based on the MRC for various 2D and 3D obstacle scattering problems. The 3D
obstacles include a cube and an ellipsoid. The MRC method is easy to implement
for both simple and complex geometries. It is shown to be a viable alternative
for other obstacle scattering methods.
","[{""version"":""v1"",""created"":""Sat, 18 Sep 2004 23:16:01 GMT""}]","2007-05-23"
"math/0409321","Carl Yerger Jr.","Nathaniel G. Watson, Carl R. Yerger","Cover pebbling numbers and bounds for certain families of graphs","10 pages, 1 figure, submitted to Discrete Mathematics",,,,"math.CO",,"  Given a configuration of pebbles on the vertices of a graph, a pebbling move
is defined by removing two pebbles from some vertex and placing one pebble on
an adjacent vertex. The cover pebbling number of a graph, gamma(G), is the
smallest number of pebbles such that through a sequence of pebbling moves, a
pebble can eventually be placed on every vertex simultaneously, no matter how
the pebbles are initially distributed. The cover pebbling number for complete
multipartite graphs and wheel graphs is determined. We also prove a sharp bound
for gamma(G) given the diameter and number of vertices of G.
","[{""version"":""v1"",""created"":""Sat, 18 Sep 2004 17:40:40 GMT""}]","2007-05-23"
"math/0409322","Bert van Geemen","Elisa Dardanelli and Bert van Geemen","Hessians and the moduli space of cubic surfaces","20 pages",,,,"math.AG",,"  The Hessian of a general cubic surface is a nodal quartic surface, hence its
desingularisation is a K3 surface. We determine the transcendental lattice of
the Hessian K3 surface for various cubic surfaces (with nodes and/or Eckardt
points for example). Classical invariant theory shows that the moduli space of
cubic surfaces is a weighted projective space. We describe the singular locus
and some other subvarieties of the moduli space.
","[{""version"":""v1"",""created"":""Sat, 18 Sep 2004 18:05:34 GMT""}]","2007-05-23"
"math/0409323","Seunghyun Seo","Seunghyun Seo (Brandeis University)","A combinatorial proof of Postnikov's identity and a generalized
  enumeration of labeled trees","9 pages, 3 figures (use PSTricks)",,,,"math.CO",,"  In this paper, we give a simple combinatorial explanation of a formula of A.
Postnikov relating bicolored rooted trees to bicolored binary trees. We also
present generalized formulas for the number of labeled k-ary trees, rooted
labeled trees, and labeled plane trees.
","[{""version"":""v1"",""created"":""Sat, 18 Sep 2004 18:46:56 GMT""}]","2007-05-23"
"math/0409324","Alexander G. Ramm","I. Boikov, A.G. Ramm","Optimal with respect to accuracy algorithms for calculation of
  multidimensional weakly singular integrals and applications to calculations
  of capacitances of conductors of arbitrary shapes","45pp","Acta Applicandae Math. 79 (2003)281-326",,,"math.NA",,"  Cubature formulas, asymptotically optimal with respect to accuracy, are
derived for calculating multidimensional weakly singular integrals. They are
used for developing a universal code for calculating capacitances of conductors
of arbitrary shapes.
","[{""version"":""v1"",""created"":""Sat, 18 Sep 2004 23:37:32 GMT""}]","2007-05-23"
"math/0409325","Alexander G. Ramm","A.G.Ramm","Global convergence for ill-posed equations with monotone operators: the
  dynamical systems method",,"J.Phys A, 36, (2003), L249-L254","10.1088/0305-4470/36/16/102",,"math.DS",,"  Consider an operator equation $F(u)=0$ in a real Hilbert space.
  Let us call this equation ill-posed if the operator
  $F'(u)$ is not boundedly invertible, and well-posed otherwise.
  If $F$ is monotone $C^2_{loc}(H)$ operator, then we construct a Cauchy
problem, which has the following properties:
  1) it has a global solution for an arbitrary initial data,
  2) this solution tends to a limit as time tends to infinity,
  3) the limit is the minimum norm solution to the equation $F(u)=0$.
  Example of applications to linear ill-posed operator equation is given.
","[{""version"":""v1"",""created"":""Sat, 18 Sep 2004 23:48:13 GMT""}]","2016-09-07"
"math/0409326","Alexander G. Ramm","A.G.Ramm","Dynamical Systems Method for ill-posed equations with monotone operators",,,"10.1016/j.cnsns.2003.07.002",,"math.FA",,"  Consider an operator equation (*) $B(u)-f=0$ in a real Hilbert space.
  Let us call this equation ill-posed if the operator $B'(u)$ is not boundedly
invertible, and well-posed otherwise. The DSM (dynamical systems method) for
solving equation (*) consists of a construction of a Cauchy problem, which has
the following properties:
  1) it has a global solution for an arbitrary initial data,
  2) this solution tends to a limit as time tends to infinity,
  3) the limit is the minimal-norm solution to the equation $B(u)=f$.
  A global convergence theorem is proved for DSM for equation (*) with monotone
$C_{loc}^2$ operators $B$.
","[{""version"":""v1"",""created"":""Sun, 19 Sep 2004 00:01:26 GMT""}]","2009-11-10"
"math/0409327","Michael Goldberg","Michael Goldberg","Dispersive Bounds for the three-dimensional Schrodinger equation with
  almost critical potentials","17 pages","Geom. Funct. Anal., 16, no. 3 (2006), 517-536.","10.1007/s00039-006-0568-5",,"math.AP",,"  We prove a dispersive estimate for the time-independent Schrodinger operator
H = -\Delta + V in three dimensions. The potential V(x) is assumed to lie in
the intersection L^p(R^3) \cap L^q(R^3), p < 3/2 < q, and also to satisfy a
generic zero-energy spectral condition. This class, which includes potentials
that have pointwise decay |V(x)| < C(1+|x|)^{-2-\epsilon}, is nearly critical
with respect to the natural scaling of the Laplacian. No additional regularity,
decay, or positivity of V is assumed.
","[{""version"":""v1"",""created"":""Sun, 19 Sep 2004 05:04:09 GMT""}]","2007-05-23"
"math/0409329","Inna Scherbak","I. Scherbak","Intersections of Schubert varieties and highest weight vectors in tensor
  products of sl_{N+1}-representations","Introduction and Section 5.2 revised; in Section 6.2 calculation of
  the determinant added; references updated",,,,"math.RT math.AG",,"  There is a correspondence between highest weight vectors in the tensor
product of finite-dimensional irreducible sl(N+1)-modules marked by distinct
complex numbers, on the one hand, and elements of the intersection of the
Schubert varieties taken with respect to the osculating flags of the normal
rational curve at the points corresponding to these complex numbers, on the
other hand. The highest weight vectors are the Bethe vectors of the sl(N+1)
Gaudin model and the elements are the (N+1)-dimensional non-degenerate planes
in the vector space of complex polynomials.
  In the present paper we exploit this correspondence in order to calculate
Bethe vectors is the tensor product of two irreducible finite-dimensional
sl(N+1)-representations. We find the Bethe vector in the case when one of the
two representations is a symmetric power of the standard one. The idea is to
look for the intersection of Schubert varieties related to a Bethe vector. We
present explicitly a basis of the corresponding (N+1)-dimensional plane in the
space of polynomials.
","[{""version"":""v1"",""created"":""Sun, 19 Sep 2004 14:47:55 GMT""},{""version"":""v2"",""created"":""Wed, 17 Nov 2004 13:23:41 GMT""},{""version"":""v3"",""created"":""Thu, 7 Jul 2005 20:18:58 GMT""}]","2007-05-23"
"math/0409330","Stephen Semmes","Stephen Semmes","Potpourri, 3","latex-2e, 13 pages",,,,"math.CA",,"  These notes are connected to a ""potpourri"" topics class and deal with some
special cases of norms of various objects which arise in classical analysis.
","[{""version"":""v1"",""created"":""Sun, 19 Sep 2004 12:50:53 GMT""}]","2007-05-23"
"nlin/0409034","Sergei Sakovich","Anton Sakovich, Sergei Sakovich","The short pulse equation is integrable","7 pages","J. Phys. Soc. Jpn. 74 (2005) 239-241","10.1143/JPSJ.74.239",,"nlin.SI math-ph math.AP math.MP physics.optics",,"  We prove that the Schafer-Wayne short pulse equation (SPE) which describes
the propagation of ultra-short optical pulses in nonlinear media is integrable.
First, we discover a Lax pair of the SPE which turns out to be of the
Wadati-Konno-Ichikawa type. Second, we construct a chain of transformations
which relates the SPE with the sine-Gordon equation.
","[{""version"":""v1"",""created"":""Sun, 19 Sep 2004 11:52:25 GMT""}]","2007-05-23"
"nlin/0409035","David P. Chassin","Landis D. Kannberg, David P. Chassin, John G. DeSteese, Steve G.
  Hauser, Michael C. Kintner-Meyer, Robert G. Pratt, Lawrence A. Schienbein, W.
  Michael Warwick","GridWiseTM: The Benefits of a Transformed Energy System","41 pages, report to US Department of Energy on economic impact of
  transformations to US energy infrastructure",,,"PNNL-14396","nlin.AO",,"  The demand for electricity is expected to continue its historical growth
trend far into the future and particularly over the 20-year projection period
discussed in this report. To meet this growth with traditional approaches will
require added generation, transmission, and distribution, costing up to $1.4
billion/GW ($1,400/kW in year 2000 dollars) on the utility side of the meter.
The amount of capacity needed in each of these categories must supply peak
demand and provide a reserve margin to protect against outages and other
contingencies. The nameplate capacity of many power system components is
typically utilized for only a few hundred hours per year. Thus, traditional
approaches to maintaining the adequacy of the nation's power generation and
delivery system are characterized by lower than desirable asset utilization,
particularly for assets located near the end-user.
","[{""version"":""v1"",""created"":""Sat, 18 Sep 2004 16:52:44 GMT""}]","2007-05-23"
"nlin/0409036","David P. Chassin","David P. Chassin, Zhenyu Huang, Matthew K. Donnelly, Candee Hassler,
  Enrique Ramirez, Cody Ray","Estimation of the WECC System Inertia Using Observed Frequency
  Transients","2 pages, 2 figures, submitted to Power Engineering Review Letters",,,,"nlin.CD",,"  Computer models being developed to understand the interaction between
demand-response technology, power system deregulation and market transformation
depend in part on understanding the relationship between system frequency and
load-control. Frequency, load, and plant outage events data collected over the
last several years have permitted analysis to determine the Western Electricity
Coordination Council (WECC) system's inertia during each event. This data was
used to evaluate the relationship of system inertia to total load, which is
used to model system response to load curtailment programs in next generation
power system simulations.
","[{""version"":""v1"",""created"":""Sat, 18 Sep 2004 17:03:10 GMT""},{""version"":""v2"",""created"":""Tue, 28 Dec 2004 18:10:51 GMT""}]","2007-05-23"
"nlin/0409037","David P. Chassin","David P. Chassin, Joel M. Malard","The Equilibrium Dynamics of Thermostatic End-use Load Diversity as a
  Function of Demand","9 pages, 6 figures, prereview manuscript (unsolved problem in fig. 6)",,,,"nlin.SI nlin.AO nlin.CD",,"  A recently developed state-of-the-art agent-based simulation of power
distribution systems is capable of modeling the thermal and demand response
behavior of many thousands of thermostatic end-use loads. It computes the total
power consumed by electric power customers when responding to real-time prices.
Investigation of the initialization transients has led to a more precise
understanding of the relationship between the end-use state probability of
thermostatic loads, end-use demand, and load diversity.
","[{""version"":""v1"",""created"":""Sat, 18 Sep 2004 17:19:30 GMT""}]","2007-05-23"
"nlin/0409038","David P. Chassin","Ning Lu, David P. Chassin, Steve E. Widergren","Modeling Uncertainties in Aggregated Thermostatically Controlled Loads
  Using a State Queueing Model","9 pages, 19 figures, accepted to IEEE Transactions on Power Systems",,"10.1109/TPWRS.2005.846072",,"nlin.CD nlin.AO",,"  To study the impacts of price responsive demand on the electric power system
requires better load models. This paper discusses the modeling of uncertainties
in aggregated thermostatically controlled loads using a state queueing (SQ)
model. The cycling times of thermostatically controlled appliances (TCAs) vary
with the TCA types and sizes, as well as the ambient temperatures. The random
consumption of consumers, which shortens or prolongs a specific TCA cycling
period, introduces another degree of uncertainty. By modifying the state
transition matrix, these random factors can be taken into account in a discrete
SQ model. The impacts of considering load diversity in the SQ model while
simulating TCA setpoint response are also studied.
","[{""version"":""v1"",""created"":""Sun, 19 Sep 2004 05:13:06 GMT""}]","2016-11-17"
"nlin/0409039","Shuji Ishihara","Shuji Ishihara and Kunihiko Kaeko","Magic number 7 $\pm$ 2 in networks of threshold dynamics","6 pages, 5 figures",,"10.1103/PhysRevLett.94.058102",,"nlin.CD",,"  Information processing by random feed-forward networks consisting of units
with sigmoidal input-output response is studied by focusing on the dependence
of its outputs on the number of parallel paths M. It is found that the system
leads to a combination of on/off outputs when $M \lesssim 7$, while for $M
\gtrsim 7$, chaotic dynamics arises, resulting in a continuous distribution of
outputs. This universality of the critical number $M \sim 7$ is explained by
combinatorial explosion, i.e., dominance of factorial over exponential
increase. Relevance of the result to the psychological magic number $7 \pm 2$
is briefly discussed.
","[{""version"":""v1"",""created"":""Sun, 19 Sep 2004 07:47:08 GMT""}]","2009-11-10"
"physics/0409089","Alexander Pukhov","A.Pukhov, S.Gordienko, S.Kiselev, I.Kostyukov","The Bubble regime of laser-plasma acceleration: monoenergetic electrons
  and the scalability","accepted for publication in Plasma Physics and Controlled Fusion,
  2004",,"10.1088/0741-3335/46/12B/016",,"physics.plasm-ph physics.acc-ph",,"  The Bubble regime of electron acceleration in ultra-relativistic laser plasma
is considered. It has been shown that the bubble can produce ultra-short dense
bunches of electrons with quasi-monoenergetic energy spectra. The first
experiment in this regime done at LOA has confirmed the peaked electron
spectrum (J. Faure, et al., {\it submitted}, 2004). The generated electron
bunch may have density an order of magnitude higher than that of the background
plasma. The bubble is able to guide the laser pulse over many Rayleigh lengths,
thus no preformed plasma channel is needed for high-energy particle
acceleration in the bubble regime. In the present work we discuss a simple
analytical model for the bubble fields as well as the scaling laws.
","[{""version"":""v1"",""created"":""Sun, 19 Sep 2004 10:36:08 GMT""}]","2009-11-10"
