"quant-ph/0409122","Jianwu Wu","Jian-wu Wu, Chun-wen Li, Re-bing Wu","Quantum Fourier Transform in a Decoherence-Free Subspace","7 pages, 6 figures",,,,"quant-ph",,"  Quantum Fourier transform is of primary importance in many quantum
algorithms. In order to eliminate the destructive effects of decoherence
induced by couplings between the quantum system and its environment, we propose
a robust scheme for quantum Fourier transform over the intrinsic
decoherence-free subspaces. The scheme is then applied to the circuit design of
quantum Fourier transform over quantum networks under collective decoherence.
The encoding efficiency and possible improvements are also discussed.
","[{""version"":""v1"",""created"":""Sun, 19 Sep 2004 03:38:55 GMT""}]","2007-05-23"
"quant-ph/0409124","Jan Werschnik","I. Serban, J. Werschnik, E.K.U. Gross","Optimal control of time-dependent targets","less typos","Phys. Rev. A 71, 053810 (2005)","10.1103/PhysRevA.71.053810",,"quant-ph",,"  In this work, we investigate how and to which extent a quantum system can be
driven along a prescribed path in Hilbert space by a suitably shaped laser
pulse. To calculate the optimal, i.e., the variationally best pulse, a properly
defined functional is maximized. This leads to a monotonically convergent
algorithm which is computationally not more expensive than the standard
optimal-control techniques to push a system, without specifying the path, from
a given initial to a given final state. The method is successfully applied to
drive the time-dependent density along a given trajectory in real space and to
control the time-dependent occupation numbers of a two-level system and of a
one-dimensional model for the hydrogen atom.
","[{""version"":""v1"",""created"":""Sat, 18 Sep 2004 17:33:33 GMT""},{""version"":""v2"",""created"":""Tue, 8 Feb 2005 09:17:25 GMT""},{""version"":""v3"",""created"":""Mon, 18 Apr 2005 17:01:49 GMT""}]","2007-05-23"
"quant-ph/0409125","Dominique Unruh","Dominique Unruh","Simulatable security for quantum protocols","Added proof of combination lemma; added comparison to the model of
  Ben-Or, Mayers; minor corrections",,,,"quant-ph cs.CR",,"  The notion of simulatable security (reactive simulatability, universal
composability) is a powerful tool for allowing the modular design of
cryptographic protocols (composition of protocols) and showing the security of
a given protocol embedded in a larger one. Recently, these methods have
received much attention in the quantum cryptographic community.
  We give a short introduction to simulatable security in general and proceed
by sketching the many different definitional choices together with their
advantages and disadvantages.
  Based on the reactive simulatability modelling of Backes, Pfitzmann and
Waidner we then develop a quantum security model. By following the BPW
modelling as closely as possible, we show that composable quantum security
definitions for quantum protocols can strongly profit from their classical
counterparts, since most of the definitional choices in the modelling are
independent of the underlying machine model.
  In particular, we give a proof for the simple composition theorem in our
framework.
","[{""version"":""v1"",""created"":""Sat, 18 Sep 2004 19:26:47 GMT""},{""version"":""v2"",""created"":""Wed, 17 Nov 2004 12:33:00 GMT""}]","2018-02-13"
