"cond-mat/0405238","Pablo de la Mora","Pablo de la Mora, Miguel Castro and Gustavo Tavizon","Anisotropic normal-state properties of the MgB2 superconductor",,"J. Phys.: Condens. Matter 17 (2005) 965-978","10.1088/0953-8984/17/6/014",,"cond-mat.supr-con",,"  Based on the experimentally found existence of two gaps in MgB2 (one gap
associated to the boron sigma-states and the other to the boron pi-states), the
different contributions to the transport properties, electrical conductivity
and Hall coefficient, were studied using the full potential-linearized
augmented plane wave method and the generalized gradient approximation. MgB2
doping was analyzed in the rigid band approximation. This permitted the study
of the partial substitution of magnesium for aluminium (Mg1-xAlxB2) as well as
other substitutions such as AB2 (A=Be, Zr, Nb and Ta). The sigma-bands (boron
sigma-states), which are associated to the large superconducting gap, are very
anisotropic at EF, while the pi-bands have very little anisotropic character.
In (Mg1-xAlxB2) Tc diminishes with Al content, the other compounds are not
superconductors. In this work it was found that with electron doping, such as
Al substitution, the sigma-band conductivity decreases and the corresponding
bands become less anisotropic. sigma-band contribution for BeB2 and ScB2 at EF
is very small and the anisotropy is much lower. For Zr, Nb and Ta there are no
sigma-bands at EF. These results give a connection between superconductivity
and the character of the sigma-band; band conductivity and band anisotropy.
This gives a plausible explanation for the diminution of Tc with different
doping of MgB2.
","[{""version"":""v1"",""created"":""Tue, 11 May 2004 23:52:27 GMT""}]","2007-05-23"
"cond-mat/0405241","Bridget Ingham","B. Ingham (Victoria University of Wellington, Wellington, New
  Zealand), S.V. Chong and J.L. Tallon (Industrial Research Limited, Lower
  Hutt, New Zealand)","Layered tungsten oxide-based organic/inorganic hybrid materials I:
  Infrared and Raman study","7 pages, 5 figures",,,,"cond-mat.soft",,"  Tungsten oxide-organic layered hybrid materials have been studied by infrared
and Raman spectroscopy, and demonstrate a difference in bonding nature as the
length of the interlayer organic `spacer' molecule is increased.
Ethylenediamine-tungsten oxide clearly displays a lack of terminal -NH3+
ammonium groups which appear in hybrids with longer alkane molecules, thus
indicating that the longer chains are bound by electrostatic interactions as
well as or in place of the hydrogen bonding that must be present in the shorter
chain ethylenediamine hybrids. The presence of organic molecules between the
tungsten oxide layers, compared with the layered tungstic acid H2WO4, shows a
decrease in the apical W=O bond strength, as might be expected from the
aforementioned electrostatic interaction.
","[{""version"":""v1"",""created"":""Wed, 12 May 2004 03:23:28 GMT""},{""version"":""v2"",""created"":""Wed, 12 May 2004 21:50:19 GMT""}]","2007-05-23"
"cond-mat/0405242","Chi-Hang Lam","Chi-Hang Lam","Fluid Invasion in Porous Media: Viscous Gradient Percolation","to appear in Phys. Rev. Lett",,"10.1103/PhysRevLett.92.254503",,"cond-mat.stat-mech cond-mat.soft",,"  We suggest that the dynamics of stable viscous invasion fronts in porous
media depends on the volume capacitance of the media. At high volume
capacitance, our network simulations provide numerical evidence of a scaling
relation between the front width and its velocity. In the low volume
capacitance regime, we derive a new effective scaling supported by network
simulations and is in agreement with previous experiments on imbibition in
paper and collections of glass beads.
","[{""version"":""v1"",""created"":""Wed, 12 May 2004 03:24:15 GMT""}]","2009-11-10"
"cond-mat/0405243","Sutapa Mukherji","Sutapa Mukherji (Indian Institute of Technology, Kanpur)","Driven diffusive system with non-local perturbations","11 pages, 2 figures","J. Phys. A 37, 51-61 (2004)","10.1088/0305-4470/37/1/003",,"cond-mat.stat-mech",,"  We investigate the impact of non-local perturbations on driven diffusive
systems. Two different problems are considered here. In one case, we introduce
a non-local particle conservation along the direction of the drive and in
another case, we incorporate a long-range temporal correlation in the noise
present in the equation of motion. The effect of these perturbations on the
anisotropy exponent or on the scaling of the two-point correlation function is
studied using renormalization group analysis.
","[{""version"":""v1"",""created"":""Wed, 12 May 2004 05:46:19 GMT""}]","2009-11-10"
"cond-mat/0405244","Liu C.-J.","C.-J. Liu, C.-Y. Liao, L.-C. Huang, C.-H. Su, S. Neeleshwar, and Y.-Y.
  Chen","A novel route to phase formation of cobalt oxyhydrates using KMnO4 as an
  oxidizing agent","10 pages, 3 figures","Physica C 416, 43-46 (2004).","10.1016/j.physc.2004.09.005",,"cond-mat.supr-con cond-mat.mtrl-sci",,"  We have first succeefully synthesized the sodium cobalt oxyhydrate
superconductors using KMnO4 as a de-intercalating and oxidizing agent. It is a
novel route to form the superconductive phase of NaxCoO2.yH2O without resorting
to the commonly used Br2/CH3CN solution. The role of the KMnO4 is to
de-intercalate the Na+ from the parent compound Na0.7CoO2 and oxidize the Co
ion as a result. The higher molar ratio of KMnO4 relative to the sodium content
tends to remove more Na+ from the parent compound and results in a slight
expansion of the c-axis in the unit cell. The superconducting transition
temperature is 4.6-3.8 K for samples treated by the aqueous KMnO4 solution with
the molar ratio of KMnO4 relative to the sodium content in the range of 0.3 and
2.29.
","[{""version"":""v1"",""created"":""Wed, 12 May 2004 06:18:47 GMT""}]","2009-11-10"
"cond-mat/0405245","Geoffroy Lumay","G. Lumay and N. Vandewalle","Compaction of anisotropic granular materials : experiments and
  simulations","5 pages, 10 figures",,"10.1103/PhysRevE.70.051314",,"cond-mat.stat-mech",,"  We present both experimental and numerical investigations of compaction in
granular materials composed of rods. As a function of the aspect ratio of the
particles, we have observed large variations of the asymptotic packing volume
fraction in vertical tubes. The relevant parameter is the ratio between the rod
length $\ell$ and the tube diameter $D$. Even the compaction dynamics remains
unchanged for various particle lengths, a 3d/2d phase transition for grain
orientations is observed for $\ell/D = 1$. A toy model for the compaction of
needles on a lattice is also proposed. This toy model gives a complementary
view of our experimental results and leads to behaviors similar to experimental
ones.
","[{""version"":""v1"",""created"":""Wed, 12 May 2004 06:34:46 GMT""}]","2009-11-10"
"cond-mat/0405246","Igor Yanson","I. K. Yanson","Phonon structure in point-contact spectra of MgB$_2$","6 pages, 6 figures. Proc. NATO Advanced Research Workshop on New
  Challenges in Superconductivity, January 2004, Miami, USA",,,,"cond-mat.supr-con cond-mat.mtrl-sci",,"  In strong-coupling superconductors with a short electron mean free path the
self-energy effects in the superconducting order parameter play a major role in
the phonon manifestation of the point-contact spectra at above-gap energies. We
compare the expressions for the nonlinear conductivity of tunnel, ballistic,
and diffusive point-contacts and show that these expression are similar and
correspond to the measurements of the phonon structure in the point-contact
spectra for the $\pi$-band of MgB$_{2}$.
","[{""version"":""v1"",""created"":""Wed, 12 May 2004 08:37:26 GMT""}]","2007-05-23"
"cond-mat/0405247","Ulrich S. Schwarz","T. Erdmann, U. S. Schwarz (MPI Colloids and Interfaces, Germany)","Stochastic dynamics of adhesion clusters under shared constant force and
  with rebinding","Revtex, 29 pages, 23 postscript figures included (some with reduced
  image quality)","J. Chem. Phys. 121: 8997-9017 (2004)","10.1063/1.1805496",,"cond-mat.soft cond-mat.mtrl-sci",,"  Single receptor-ligand bonds have finite lifetimes, so that biological
systems can dynamically react to changes in their environment. In cell
adhesion, adhesion bonds usually act cooperatively in adhesion clusters.
Outside the cellular context, adhesion clusters can be probed quantitatively by
attaching receptors and ligands to opposing surfaces. Here we present a
detailed theoretical analysis of the stochastic dynamics of a cluster of
parallel bonds under shared constant loading and with rebinding. Analytical
solutions for the appropriate one-step master equation are presented for
special cases, while the general case is treated with exact stochastic
simulations. If the completely dissociated state is modeled as an absorbing
boundary, mean cluster lifetime is finite and can be calculated exactly. We
also present a detailed analysis of fluctuation effects and discuss various
approximations to the full stochastic description.
","[{""version"":""v1"",""created"":""Wed, 12 May 2004 08:58:56 GMT""}]","2007-05-23"
"cond-mat/0405248","Emmanuel Trizac","R. Agra, F. van Wijland, E. Trizac (Orsay University)","Theory of orientational ordering in colloidal molecular crystals","4 pages, to appear in Phys. Rev. Lett","Phys. Rev. Lett. 93, 018304 (2004).","10.1103/PhysRevLett.93.018304",,"cond-mat.stat-mech cond-mat.soft",,"  Freezing of charged colloids on square or triangular two-dimensional periodic
substrates has been recently shown to realize a rich variety of orientational
orders. We propose a theoretical framework to analyze the corresponding
structures. A fundamental ingredient is that a non spherical charged object in
an electrolyte creates a screened electrostatic potential that is anisotropic
at any distance. Our approach is in excellent agreement with the known
experimental and numerical results, and explains in simple terms the reentrant
orientational melting observed in these so called colloidal molecular crystals.
We also investigate the case of a rectangular periodic substrate and predict an
unusual phase transition between orientationnaly ordered states, as the aspect
ratio of the unit cell is changed.
","[{""version"":""v1"",""created"":""Wed, 12 May 2004 09:24:39 GMT""}]","2009-11-10"
"cond-mat/0405249","Tomasz Srokowski","T. Srokowski and A. Kaminska","Stochastic equation for a jumping process with long-time correlations","7 pages, 5 Postscript figures","Phys. Rev. E 70, 051102 (2004)","10.1103/PhysRevE.70.051102",,"cond-mat.stat-mech",,"  A jumping process, defined in terms of jump size distribution and waiting
time distribution, is presented. The jumping rate depends on the process value.
The process, which is Markovian and stationary, relaxes to an equilibrium and
is characterized by the power-law autocorrelation function. Therefore, it can
serve as a model of the 1/f noise as well as a model of the stochastic force in
the generalized Langevin equation. This equation is solved for the noise
correlations 1/t; the resulting velocity distribution has sharply falling
tails. The system preserves the memory about the initial condition for a very
long time.
","[{""version"":""v1"",""created"":""Wed, 12 May 2004 09:58:00 GMT""}]","2015-07-20"
"cond-mat/0405250","Elvira M. Gonz\'alez","E. M. Gonzalez, A. Dominguez-Folgueras, F. J. Palomares, R. Escudero,
  J. E. Villegas, J. M. Gonzalez, J. Ferrer, F. Guinea and J. L. Vicent","Spin polarized current and Andreev transmission in planar
  superconducting-ferromagnetic Nb-Ni junctions",,,,,"cond-mat.supr-con",,"  We have measured and modeled, using three different approaches, the tunneling
current in a Nb/NbxOy/Ni planar tunnel junction. The experimental data could be
fitted and the correct current polarization could be extracted using a simple
quasiclassical model, even in the absence of an applied magnetic field. We also
discuss the microscopic structure of the barrier.
","[{""version"":""v1"",""created"":""Wed, 12 May 2004 10:13:03 GMT""}]","2007-05-23"
"cond-mat/0405251","Francesco d'Ovidio","Silvia De Monte, Francesco d'Ovidio, Hugues Chat\'e, Erik Mosekilde","Noise-induced macroscopic bifurcations in globally-coupled chaotic units","Phys. Rev. Lett., accepted",,"10.1103/PhysRevLett.92.254101",,"cond-mat.stat-mech",,"  Large populations of globally-coupled identical maps subjected to independent
additive noise are shown to undergo qualitative changes as the features of the
stochastic process are varied. We show that for strong coupling, the collective
dynamics can be described in terms of a few effective macroscopic degrees of
freedom, whose deterministic equations of motion are systematically derived
through an order parameter expansion.
","[{""version"":""v1"",""created"":""Wed, 12 May 2004 10:35:19 GMT""}]","2009-11-10"
"cond-mat/0405252","Andres Santos","Andres Santos, Antonio Astillero","System of elastic hard spheres which mimics the transport properties of
  a granular gas","20 pages; 6 figures; change of title; few minor changes; accepted for
  publication in PRE","Phys. Rev. E 72, 031308-1-19 (2005).","10.1103/PhysRevE.72.031308","10.1103/PhysRevE.72.031308","cond-mat.stat-mech cond-mat.soft",,"  The prototype model of a fluidized granular system is a gas of inelastic hard
spheres (IHS) with a constant coefficient of normal restitution $\alpha$. Using
a kinetic theory description we investigate the two basic ingredients that a
model of elastic hard spheres (EHS) must have in order to mimic the most
relevant transport properties of the underlying IHS gas. First, the EHS gas is
assumed to be subject to the action of an effective drag force with a friction
constant equal to half the cooling rate of the IHS gas, the latter being
evaluated in the local equilibrium approximation for simplicity. Second, the
collision rate of the EHS gas is reduced by a factor $(1+\alpha)/2$, relative
to that of the IHS gas. Comparison between the respective Navier-Stokes
transport coefficients shows that the EHS model reproduces almost perfectly the
self-diffusion coefficient and reasonably well the two transport coefficients
defining the heat flux, the shear viscosity being reproduced within a deviation
less than 14% (for $\alpha\geq 0.5$). Moreover, the EHS model is seen to agree
with the fundamental collision integrals of inelastic mixtures and dense gases.
The approximate equivalence between IHS and EHS is used to propose kinetic
models for inelastic collisions as simple extensions of known kinetic models
for elastic collisions
","[{""version"":""v1"",""created"":""Wed, 12 May 2004 12:01:48 GMT""},{""version"":""v2"",""created"":""Tue, 30 Aug 2005 15:19:20 GMT""}]","2009-11-10"
"cond-mat/0405253","Francesco Zonta","B. Marcone, E. Orlandini, A. L. Stella and F. Zonta","What is the length of a knot in a polymer?","9 pages, 5 Postscript figures","J. Phys. A: Math. Gen. 38 (2005) L15-L21","10.1088/0305-4470/38/1/L03",,"cond-mat.stat-mech",,"  We give statistical definitions of the length, l, of a loose prime knot tied
into a long, fluctuating ring macromolecule. Monte Carlo results for the
equilibrium, good solvent regime show that < l > ~ N^t, where N is the ring
length and t ~ 0.75 is independent of the knot topology. In the collapsed
regime below the theta temperature, length determinations based on the entropic
competition of different knots within the same ring show delocalization (t~1).
","[{""version"":""v1"",""created"":""Wed, 12 May 2004 10:38:40 GMT""},{""version"":""v2"",""created"":""Thu, 13 May 2004 08:17:08 GMT""},{""version"":""v3"",""created"":""Tue, 11 Jan 2005 14:03:42 GMT""}]","2009-11-10"
"cond-mat/0405254","Pierfrancesco Buonsante","Pierfrancesco Buonsante (1) and Alessandro Vezzani (2) ((1)
  Politecnico di Torino, (2) Universita' degli Studi di Parma)","Phase Diagram for Ultracold Bosons in Optical Lattices and Superlattices","8 pages, 6 figures, submitted to Phys. Rev. A","Phys. Rev. A 70, 033608 (2004)","10.1103/PhysRevA.70.033608",,"cond-mat.soft cond-mat.stat-mech",,"  We present an analytic description of the finite-temperature phase diagram of
the Bose-Hubbard model, successfully describing the physics of cold bosonic
atoms trapped in optical lattices and superlattices. Based on a standard
statistical mechanics approach, we provide the exact expression for the
boundary between the superfluid and the normal fluid by solving the
self-consistency equations involved in the mean-field approximation to the
Bose-Hubbard model. The zero-temperature limit of such result supplies an
analytic expression for the Mott lobes of superlattices, characterized by a
critical fractional filling.
","[{""version"":""v1"",""created"":""Wed, 12 May 2004 10:47:06 GMT""},{""version"":""v2"",""created"":""Mon, 4 Oct 2004 09:08:32 GMT""}]","2007-05-23"
"cond-mat/0405255","Aleksey Drozdov","A.D. Drozdov, M. Gottlieb (Ben-Gurion University of the Negev, Israel)","Networks of self-avoiding chains and Ogden-type constitutive equations
  for elastomers","37 pages, 13 figures",,,,"cond-mat.mtrl-sci",,"  An expression is derived for the strain energy of a polymer chain under an
arbitrary three-dimensional deformation with finite strains. For a Gaussian
chain, this expression is reduced to the conventional Moony--Rivlin
constitutive law, while for non-Gaussian chains it implies novel constitutive
relations. Based on the three-chain approximation, explicit formulas are
developed for the strain energy of a chain modeled as a self-avoiding random
walk. In the case of self-avoiding chains with stretched-exponential
distribution function of end-to-end vectors, the strain energy density of a
network is described by the Ogden law with only two material constants. For the
des Cloizeaux distribution function, the constitutive equation involves three
adjustable parameters. The governing equations are verified by fitting
observations on uniaxial tension, uniaxial compression and biaxial tension of
elastomers. Good agreement is demonstrated between the experimental data and
the results of numerical analysis. An analytical formula is derived for the
ratio of the Young's modulus of a self-avoiding chain to that of a Gaussian
chain. It is found that the elastic modulus per chain in the Ogden network
exceeds that in a Gaussian network by a factor of three, whereas the elastic
modulus of a chain with the generalized stretched exponential distribution
function equals about half of the modulus of a Gaussian chain.
","[{""version"":""v1"",""created"":""Wed, 12 May 2004 11:21:27 GMT""}]","2007-05-23"
"cond-mat/0405256","Mikhail Kalinin","M. I. Kalinin","On the completeness of describing an equilibrium canonical ensemble
  using a pair distribution function","10 pages, no figures",,,"IGC-PFUR-03/04","cond-mat.stat-mech",,"  It is shown that in equilibrium a canonical ensemble of particles with
two-particle interaction the Gibbs distribution function may be expressed
uniquely through a pair distribution function. It means, that for given values
of the particle number $N$, volume $V$, and temperature $T$, the pair
distribution function contains as many information about the system as a full
Gibbs distribution. The latter is represented as a series expansion in the pair
distribution function. A recurrence relation system is constructed, which
allows all terms of this expansion to be calculated successively.
","[{""version"":""v1"",""created"":""Wed, 12 May 2004 12:08:07 GMT""}]","2007-05-23"
"cond-mat/0405257","Marco Bartolozzi","M. Bartolozzi, D. B. Leinweber, A. W. Thomas","Self-Organized Criticality and Stock Market Dynamics: an Empirical Study","16 pages, 13 figures. In press: Physica A","Physica A350:451-465,2005","10.1016/j.physa.2004.11.061",,"cond-mat.other q-fin.ST",,"  The Stock Market is a complex self-interacting system, characterized by an
intermittent behaviour. Periods of high activity alternate with periods of
relative calm. In the present work we investigate empirically about the
possibility that the market is in a self-organized critical state (SOC). A
wavelet transform method is used in order to separate high activity periods,
related to the avalanches of sandpile models, from quiescent.
  A statistical analysis of the filtered data show a power law behaviour in the
avalanche size, duration and laminar times. The memory process, implied by the
power law distribution, of the laminar times is not consistent with classical
conservative models for self-organized criticality. We argue that a
``near-SOC'' state or a time dependence in the driver, which may be chaotic,
can explain this behaviour.
","[{""version"":""v1"",""created"":""Wed, 12 May 2004 13:04:54 GMT""},{""version"":""v2"",""created"":""Mon, 22 Nov 2004 22:37:53 GMT""}]","2016-08-31"
"cond-mat/0405258","Bing-Hong Wang","Tao Zhou, Bing-Hong Wang, P. -M. Hui and K. -P. Chan","Integer Networks","3 pages, 4 figures","Physica A 367: 613-618 (2006)","10.1016/j.physa.2005.11.011",,"cond-mat.stat-mech",,"  Inspired by Pythagoras's belief that numbers are the absolute reality, we
obtain some demonstrational results about topological properties of integer
networks, in which the vertices represent integers and two vertices are
neighbors if and only if there exists a divisibility relation between them. We
strictly prove that the diameter of networks has a constant upper bound
independent to the network size $N$, which is completely different from the
extensively studied real-life networks with their average distance increasing
logarithmically to $N$ as $L\sim \texttt{ln}N$ or $L\sim \texttt{lnln}N$.
Further more, the integer networks is high clustered, with clustered
coefficient $C\approx 0.34$, and display power-law degree distribution of
exponent $\gamma\approx 2.4$.
","[{""version"":""v1"",""created"":""Wed, 12 May 2004 12:46:16 GMT""},{""version"":""v2"",""created"":""Wed, 23 Jun 2004 09:27:12 GMT""},{""version"":""v3"",""created"":""Tue, 29 Mar 2005 15:34:35 GMT""},{""version"":""v4"",""created"":""Fri, 15 Apr 2005 11:48:46 GMT""}]","2007-05-23"
"cond-mat/0405259","Francesca Maria Marchetti","F. M. Marchetti, B. D. Simons, and P. B. Littlewood","Condensation of Cavity Polaritons in a Disordered Environment","17 pages, 9 eps figures; published version","Phys. Rev. B 70, 155327 (2004)","10.1103/PhysRevB.70.155327",,"cond-mat.mes-hall",,"  A model for direct two band excitons in a disordered quantum well coupled to
light in a cavity is investigated. In the limit in which the exciton density is
high, we assess the impact of weak `pair-breaking' disorder on the feasibility
of condensation of cavity polaritons. The mean-field phase diagram shows a
`lower density' region, where the condensate is dominated by electronic
excitations and where disorder tends to close the condensate and quench
coherence. Increasing the density of excitations in the system, partially due
to the screening of Coulomb interaction, the excitations contributing to the
condensate become mainly photon-like and coherence is reestablished for any
value of disorder. In contrast, in the photon dominated region of the phase
diagram, the energy gap of the quasi-particle spectrum still closes when the
disorder strength is increased. Above mean-field, thermal, quantum and
fluctuations induced by disorder are considered and the spectrum of the
collective excitations is evaluated. In particular, it is shown that the angle
resolved photon intensity exhibits an abrupt change in its behaviour, going
from the condensed to the non-condensed region.
","[{""version"":""v1"",""created"":""Wed, 12 May 2004 15:54:34 GMT""},{""version"":""v2"",""created"":""Fri, 29 Oct 2004 10:49:54 GMT""}]","2007-05-23"
"cs/0405038","Riccardo Pucella","Riccardo Pucella","Deductive Algorithmic Knowledge","28 pages. A preliminary version of this paper appeared in the
  Proceedings of the 8th International Symposium on Artificial Intelligence and
  Mathematics, AI&M 22-2004, 2004","Journal of Logic and Computation 16 (2), pp. 287-309, 2006",,,"cs.AI cs.LO",,"  The framework of algorithmic knowledge assumes that agents use algorithms to
compute the facts they explicitly know. In many cases of interest, a deductive
system, rather than a particular algorithm, captures the formal reasoning used
by the agents to compute what they explicitly know. We introduce a logic for
reasoning about both implicit and explicit knowledge with the latter defined
with respect to a deductive system formalizing a logical theory for agents. The
highly structured nature of deductive systems leads to very natural
axiomatizations of the resulting logic when interpreted over any fixed
deductive system. The decision problem for the logic, in the presence of a
single agent, is NP-complete in general, no harder than propositional logic. It
remains NP-complete when we fix a deductive system that is decidable in
nondeterministic polynomial time. These results extend in a straightforward way
to multiple agents.
","[{""version"":""v1"",""created"":""Tue, 11 May 2004 18:01:39 GMT""},{""version"":""v2"",""created"":""Fri, 17 Jun 2005 02:43:07 GMT""},{""version"":""v3"",""created"":""Wed, 18 Jan 2006 19:08:22 GMT""}]","2007-05-23"
