"math/0405203","Kai Zehmisch","Kai Zehmisch","Strong fillability and the Weinstein conjecture","16 pages, latex2e, no figures, This third version coincides with the
  second one up to the following generalisation: The Weinstein conjecture holds
  true for the positively oriented Brieskorn homology spheres
  $\Sigma(2,3,6n-1)$, $n\geq2$",,,,"math.SG math.GT",,"  Extending work of Chen, we prove the Weinstein conjecture in dimension three
for strongly fillable contact structures with either non-vanishing first Chern
class or with strong and exact filling having non-trivial canonical bundle.
This implies the Weinstein conjecture for certain Stein fillable contact
structures obtained by the Eliashberg-Gompf construction.For example we prove
the Weinstein conjecture for the Brieskorn homology spheres $\Sigma(2,3,6n-1)$,
$n\geq2$, oriented as the boundary of the corresponding Milnor fibre.
Furthermore, for tight contact structures on odd lens spaces, non-contractible
closed Reeb orbits are found.
","[{""version"":""v1"",""created"":""Tue, 11 May 2004 20:59:19 GMT""},{""version"":""v2"",""created"":""Sat, 22 May 2004 18:54:08 GMT""},{""version"":""v3"",""created"":""Fri, 8 Apr 2005 16:48:58 GMT""}]","2007-05-23"
"math/0405204","Jim Bryan","Jim Bryan, Rahul Pandharipande","On the rigidity of stable maps to Calabi-Yau threefolds","This is the version published by Geometry & Topology Monographs on 22
  April 2006","Geom. Topol. Monogr. 8 (2006) 97-104","10.2140/gtm.2006.8.97",,"math.AG","http://arxiv.org/licenses/nonexclusive-distrib/1.0/","  If X is a nonsingular curve in a Calabi--Yau threefold Y whose normal bundle
N_{X/Y} is a generic semistable bundle, are the local Gromov-Witten invariants
of X well defined? For X of genus two or higher, the issues are subtle. We will
formulate a precise line of inquiry and present some results, some positive and
some negative.
","[{""version"":""v1"",""created"":""Tue, 11 May 2004 22:08:14 GMT""},{""version"":""v2"",""created"":""Fri, 13 Mar 2009 10:36:57 GMT""}]","2009-03-13"
"math/0405205","Franz W. Kamber","Steven B. Bradlow, James F. Glazebrook and Franz W. Kamber","Dimensional reduction of the perturbed Hermitian-Einstein equation","13 pages","Proc. in Global Analysis, Diff. Geometry and Lie Algebras, Balkan
  Geometry Press, Bucharest 2001, pp. 43-62",,,"math.DG",,"  Given a Kaehlerian holomorphic fiber bundle whose fiber is a compact
homogeneous Kaehler manifold, we describe the perturbed Hermitian-Einstein
equations relative to certain holomorphic vector bundles. With respect to
special metrics on the holomorphic bundles, there is a dimensional reduction
procedure which reduces these equations to a system of equations on the base,
known as the twisted coupled vortex equations.
","[{""version"":""v1"",""created"":""Wed, 12 May 2004 06:05:22 GMT""}]","2007-05-23"
"math/0405206","Florentin Smarandache","Florentin Smarandache","A Method of Solving a Dophantine Equation of Second Degree with N
  Variables","11 pages","""Gaceta Matematica,"" Madrid, 2a Serie, Volumen 1, Numero 2, 1988,
  151-157; translated to Spanish by Francisco Bellot Rosado as <Un metodo de
  resolucion de la ecuacion diofantica $ax^2 - by^2 + c = 0$>",,,"math.GM",,"  First, we consider the equation $ax^2 - by^2 + c = 0$, with $a,b \in N*$ and
$c \in Z*$, which is a generalization of Pell's equation. Here, we show that:
if this equation has an integer solution and $ab$ is not a perfect square, then
it has infinitely many integer solutions; in this case we find a closed
expression for $(x_{n}, y_{n})$, the general positive integer solution, by an
original method. More, we generalize it for a Diophantine equation of second
degree and with n variables of the form: $\sum_{i=1}^{n} a_{i}x_{i}^{2} = b$.
","[{""version"":""v1"",""created"":""Wed, 12 May 2004 00:18:21 GMT""}]","2007-05-23"
"math/0405207","S. A. Belbas","S. A. Belbas, W. H. Schmidt","Optimal Control of Volterra Equations with Impulses",,,,,"math.OC",,"  We consider an optimal control problem for a system governed by a Volterra
integral equation with impulsive terms. The impulses act on both the state and
the control; the control consists of switchings at discrete times. The cost
functional includes both, an integrated cost rate (continuous part) and
switching costs at the discrete impulse times (discrete part). We prove
necessary optimality conditions of a form analogous to a discrete maximum
principle. For the particular case of a system governed by impulsive ordinary
differential equations, we obtain an impulsive maximum principle as a special
case of the necessary optimality conditions for impulsive Volterra equations.
","[{""version"":""v1"",""created"":""Wed, 12 May 2004 01:28:35 GMT""}]","2007-05-23"
"math/0405208","Russell Luke","D. Russell Luke","Relaxed Averaged Alternating Reflections for Diffraction Imaging","13 pages, 19 figures","Inverse Problems 21:37-50(2005)","10.1088/0266-5611/21/1/004",,"math.OC math-ph math.MP physics.optics",,"  We report on progress in algorithms for iterative phase retrieval. The theory
of convex optimization is used to develop and to gain insight into counterparts
for the nonconvex problem of phase retrieval. We propose a relaxation of
averaged alternating reflectors and determine the fixed point set of the
related operator in the convex case. A numerical study supports our theoretical
observations and demonstrates the effectiveness of the algorithm compared to
the current state of the art.
","[{""version"":""v1"",""created"":""Wed, 12 May 2004 03:57:28 GMT""}]","2009-11-10"
"math/0405209","Payman Kassaei","Payman L Kassaei","A Gluing Lemma And Overconvergent Modular Forms",,,,,"math.NT",,"  We prove a gluing lemma for sections of line bundles on a rigid analytic
variety. We apply the lemma, in conjunction with a result of Buzzard's, to give
a proof of (a generalization) of Coleman's theorem which states that
overconvergent modular forms of small slope are classical. The proof is
""geometric"" in nature, and is suitable for generalization to other PEL Shimura
varieties.
","[{""version"":""v1"",""created"":""Wed, 12 May 2004 02:23:56 GMT""},{""version"":""v2"",""created"":""Mon, 7 Jun 2004 20:02:12 GMT""},{""version"":""v3"",""created"":""Tue, 17 Jan 2006 05:49:18 GMT""}]","2007-05-23"
"math/0405210","Michael Falk","Michael Falk","The line geometry of resonance varieties","30 pages, three figures. Revision includes expanded intro. section,
  streamlined treatment of neighborly graphs, sufficient condition for
  existence of generic points",,,,"math.CO math.AG",,"  Let R^1(A,R) be the degree-one resonance variety over a field R of a
hyperplane arrangement A. We give a geometric description of R^1(A,R) in terms
of projective line complexes. The projective image of R^1(A,R) is a union of
ruled varieties, parametrized by neighborly partitions of subarrangements of A.
The underlying line complexes are intersections of special Schubert varieties,
easily described in terms of the corresponding partition. We generalize the
definition and decomposition of R^1(A,R) to arbitrary commutative rings, and
point out the anomalies that arise. In general the decomposition is
parametrized by neighborly graphs, which need not induce neighborly partitions
of subarrangements of A.
  We use this approach to show that the resonance variety of the Hessian
arrangement over a field of characteristic three has a nonlinear component, a
cubic threefold with interesting line structure. This answers a question of A.
Suciu. We show that Suciu's deleted B_3 arrangement has resonance components
over Z_2 that intersect nontrivially. We also exhibit resonant weights over Z_4
supported on the deleted B_3, which has no neighborly partitions. The modular
resonant weights on the deleted B_3 exponentiate to points on the complex torus
which lie on, and determine, the translated 1-torus in the first characteristic
variety.
","[{""version"":""v1"",""created"":""Wed, 12 May 2004 05:54:45 GMT""},{""version"":""v2"",""created"":""Mon, 27 Sep 2004 23:11:05 GMT""}]","2007-05-23"
"math/0405211","S. K. Roushon","S.K. Roushon","The Farrell-Jones isomorphism conjecture for 3-manifold groups","35 pages, 1 figure (.eps file), AMS Latex file, final version.
  accepted for publication in K-theory","J. K-Theory 1 (2008) 49-82","10.1017/is007011012jkt005",,"math.KT math.GT",,"  We show that the Fibered Isomorphism Conjecture (FIC) of Farrell and Jones
corresponding to the stable topological pseudoisotopy functor is true for the
fundamental groups of a large class of 3-manifolds. We also prove that if the
FIC is true for irreducible 3-manifold groups then it is true for all
3-manifold groups. In fact, this follows from a more general result we prove
here, namely we show that if the FIC is true for each vertex group of a graph
of groups with trivial edge groups then the FIC is true for the fundamental
group of the graph of groups. This result is part of a program to prove FIC for
the fundamental group of a graph of groups where all the vertex and edge groups
satisfy FIC. A consequence of the first result gives a partial solution to a
problem in the problem list of R. Kirby. We also deduce that the FIC is true
for a class of virtually PD_3-groups.
  Another main aspect of this article is to prove the FIC for all Haken
3-manifold groups assuming that the FIC is true for B-groups. By definition a
B-group contains a finite index subgroup isomorphic to the fundamental group of
a compact irreducible 3-manifold with incompressible nonempty boundary so that
each boundary component is of genus \geq 2. We also prove the FIC for a large
class of B-groups and moreover, using a recent result of L.E. Jones we show
that the surjective part of the FIC is true for any B-group.
","[{""version"":""v1"",""created"":""Wed, 12 May 2004 05:26:58 GMT""},{""version"":""v2"",""created"":""Thu, 24 Jun 2004 07:46:38 GMT""},{""version"":""v3"",""created"":""Fri, 18 Mar 2005 10:42:06 GMT""},{""version"":""v4"",""created"":""Thu, 30 Mar 2006 14:28:36 GMT""}]","2011-03-03"
"math/0405213","Ngo Viet Trung","Craig Huneke and Ngo Viet Trung","On the core of ideals","20 pages, to appear in Compositio Math",,,,"math.AC",,"  Our focus in this paper is in effective computation of the core core(I) of an
ideal I which is defined to be the intersection of all minimal reductions of I.
The first main result is a closed formula for the graded core(m) of the maximal
graded ideal m of an arbitrary standard graded algebra A over a field k. This
formula allows us to study basic properties of the graded core and to construct
counter-examples to some open questions on the core of ideals in a local ring.
For instance, we can show that in general, core(m \otimes E) \neq
core(m)\otimes E, where E is a field extension of k. From this it follows that
the equation core(I R') = core(I)R' does not hold for an arbitrary flat local
homomorphism R \to R' of Cohen-Macaulay local rings. The second main result
proves the formulae core(I)= (J^r:I^r)I = (J^r:I^r)J = J^{r+1}:I^r for any
equimultiple ideal I in a Cohen-Macaulay ring R with with characteristic zero
residue field, where J is a minimal reduction of I and r is its reduction
number. This result has been obtained independently by Polini-Ulrich and
Hyry-Smith in the one-dimensional case or when R is a Gorenstein ring.
Moreover, we can prove that core(I) = IK, where K is the conductor of R in the
blowing-up ring at I.
","[{""version"":""v1"",""created"":""Wed, 12 May 2004 07:02:04 GMT""}]","2007-05-23"
"math/0405214","Ngo Viet Trung","Huy Tai Ha and Ngo Viet Trung","Asymptotic behaviour of arithmetically Cohen-Macaulay blow-ups","21 pages, to appear in Trans. Amer. Math. Soc",,,,"math.AC math.AG",,"  This paper addresses problems related to the existence of arithmetic
Macaulayfications of projective schemes. Let Y be the blow-up of a projective
scheme X = Proj R along the ideal sheaf of I \subset R. It is known that there
are embeddings Y \cong Proj k[(I^e)_c] for c \ge d(I)e + 1, where d(I) denotes
the maximal generating degree of I, and that there exists a Cohen-Macaulay ring
of the form k[(I^e)_c] if and only if H^0(Y,O_Y) = k, H^i(Y,O_Y) = 0 for i =
1,...,dim Y-1, Y is equidimensional and Cohen-Macaulay. Cutkosky and Herzog
asked when there is a linear bound on c and e ensuring that k[(I^e)_c] is a
Cohen-Macaulay ring. We obtain a surprising compelte answer to this question,
namely, that under the above conditions, there are well determined invariants a
and b such that k[(I^e)_c] is Cohen-Macaulay for all c > d(I)e + a and e > b.
Our approach is based on recent results on the asymptotic linearity of the
Castelnuovo-Mumford regularity of ideal powers. We also investigate the
existence of a Cohen-Macaulay Rees algebra of the form R[(I^e)_ct] (which
provides an arithmetic Macaulayfication for X). If R has negative a*-invariant,
we prove that such a Cohen-Macaulay Rees algebra exists if and only if f_*O_Y =
O_X, R^i f*O_Y = 0 for i > 0, Y is equidimensional and Cohen-Macaulay.
Especially, these conditions imply the Cohen-Macaulayness of R[(I^e)_ct] for
all c > d(I)e + a and e > b. The above results can be applied to obtain several
new classes of Cohen-Macaulay algebras.
","[{""version"":""v1"",""created"":""Wed, 12 May 2004 07:11:48 GMT""}]","2007-05-23"
"math/0405215","Werner Georg Nowak","E. Kraetzel, W.G. Nowak","Effektive Abschaetzungen fuer den Gitterrest gewisser ebener und
  dreidimensionaler Bereiche",,"Monatsh. Math. 146 (2005), 21-35",,,"math.NT",,"  Effective estimates for the lattice point discrepancy of certain planar and
three-dimensional domains. This paper provides estimates, with explicit
constants, for the lattice point discrepancy of o-symmetric ellipse discs and
ellipsoids in three-dimensional Euclidean space, as well as of
three-dimensional convex bodies which are invariant under rotations around one
coordinate axis and have a smooth boundary of finite nonzero Gaussian curvature
throughout.
","[{""version"":""v1"",""created"":""Wed, 12 May 2004 07:34:06 GMT""}]","2007-05-23"
"math/0405217","Piotr Pucha{\l}a","Piotr Pucha{\l}a","Continuous version of the Choquet Integral Reperesentation Theorem","9 pages, minor historical, editorial and bibliographical changes;
  version as appeared in the journal","Studia Math. 168 (1), 2005, 15-24",,,"math.FA",,"  The Choquet - Bishop - de Leeuw theorem states that each element of a compact
convex subset of a locally convex topological Hausdorff space is a barycenter
of a probability measure supported by the set of extreme points of that set. By
the Edgar - Mankiewicz result this remains true for nonempty closed bounded and
convex set provided it has Radon - Nikodym property. In the paper it is shown,
that Choquet - type theorem holds also for ""moving"" sets: they are values of a
certain multifunction. Namely, the existence of a suitable weak* continuous
family of probability measures ""almost representing"" points of such sets is
proven. Both compact and noncompact cases are considered. The continuous
versions of the Krein - Milman theorem are obtained as corollaries.
","[{""version"":""v1"",""created"":""Wed, 12 May 2004 08:27:47 GMT""},{""version"":""v2"",""created"":""Tue, 5 Apr 2005 11:59:10 GMT""}]","2007-05-23"
"math/0405218","Janyska Josef","Josef Jany\v{s}ka","Higher order reduction theorems for classical connections and natural
  (0,2)-tensor fields on the cotangent bundle",,,,,"math.DG",,"  We generalize reduction theorems for classical connections to operators with
values in $k$-th order natural bundles. Using the first reduction theorem in
order two we classify all (0,2)-tensor fields on the cotangent bundle of a
manifold with a linear (non-symmetric) connection.
","[{""version"":""v1"",""created"":""Wed, 12 May 2004 08:29:28 GMT""}]","2007-05-23"
"math/0405219","Joerg Winkelmann","Joerg Winkelmann","An Example related to Brody's theorem","LaTex, 16 pages, 3 figures",,,"Prepublication de l'Institut Elie Cartan 2004/06","math.CV",,"  We discuss an example related to the method of Brody. The example is an open
subset of a compact complex torus which is covered by entire curves, but not by
Brody curves.
","[{""version"":""v1"",""created"":""Wed, 12 May 2004 10:48:31 GMT""}]","2007-05-23"
"math/0405220","Yann Bugeaud","Yann Bugeaud, Maurice Mignotte, Samir Siksek","Classical and modular approaches to exponential Diophantine equations
  II. The Lebesgue-Nagell equation","49 pages",,,,"math.NT",,"  We solve completely the Lebesgue-Nagell equation x^2+D=y^n, in integers x, y,
n>2, for D in the range 1 =< D =< 100.
","[{""version"":""v1"",""created"":""Wed, 12 May 2004 12:00:45 GMT""}]","2007-05-23"
"math/0405221","Ivan Cheltsov","Ivan Cheltsov","On factoriality of nodal threefolds","28 pages, in the last version we change the introduction",,,,"math.AG",,"  We prove the $\mathbb{Q}$-factoriality of a nodal hypersurface in
$\mathbb{P}^{4}$ of degree $n$ with at most ${\frac{(n-1)^{2}}{4}}$ nodes and
the $\mathbb{Q}$-factoriality of a double cover of $\mathbb{P}^{3}$ branched
over a nodal surface of degree $2r$ with at most ${\frac{(2r-1)r}{3}}$ nodes.
","[{""version"":""v1"",""created"":""Wed, 12 May 2004 12:31:42 GMT""},{""version"":""v2"",""created"":""Mon, 18 Oct 2004 11:59:35 GMT""}]","2007-05-23"
"math/0405222","Alessandra Faggionato","A.Bovier, A.Faggionato","Spectral characterisation of ageing: the REM-like trap model","33 pages, 2 figures",,,,"math.PR cond-mat.dis-nn",,"  We review the ageing phenomenon in the context of simplest trap model,
Bouchaud's REM-like trap model from a spectral theoretic point of view. We show
that the generator of the dynamics of this model can be diagonalised exactly.
Using this result, we derive closed expressions for correlation functions in
terms of complex contour integrals that permit an easy investigation into their
large time asymptotics in the thermodynamic limit. We also give a `grand
canonical' representation of the model in terms of the Markov process on a
Poisson point process . In this context we analyse the dynamics on various time
scales.
","[{""version"":""v1"",""created"":""Wed, 12 May 2004 12:43:17 GMT""}]","2007-05-23"
"math/0405223","Stefan Schroeer","Stefan Schroeer","Topological methods for complex-analytic Brauer groups","20 pages, minor corrections, to appear in Topology","Topology 44 (2005), no. 5, 875--894",,,"math.AG",,"  Using methods from algebraic topology and group cohomology, I pursue
Grothendieck's question on equality of geometric and cohomological Brauer
groups in the context of complex-analytic spaces. The main result is that
equality holds under suitable assumptions on the fundamental group and the
Pontrjagin dual of the second homotopy group. I apply this to Lie groups, Hopf
manifolds, and complex-analytic surfaces.
","[{""version"":""v1"",""created"":""Wed, 12 May 2004 13:44:46 GMT""},{""version"":""v2"",""created"":""Thu, 3 Feb 2005 16:55:09 GMT""},{""version"":""v3"",""created"":""Tue, 8 Feb 2005 10:44:23 GMT""}]","2007-05-23"
"math/0405224","Damien Ferte","D. Ferte","Weyl chamber flow on irreducible quotients of products of PSL(2,R)","18 pages, 2 figures",,,,"math.DS",,"  We study the topological dynamics of the action of the diagonal subgroup on
quotients Gamma\PSL(2,R)*PSL(2,R), where Gamma is an irreducible lattice.
Closed orbits are described and a set of points of dense orbit is explicitly
given. Such properties are expressed using the Furstenberg boundary of the
symmetric space H*H.
","[{""version"":""v1"",""created"":""Wed, 12 May 2004 14:29:00 GMT""}]","2007-05-23"
"math/0405225","Cormac Walsh","Marianne Akian, Stephane Gaubert, Cormac Walsh","Discrete max-plus spectral theory","25 pages, 7 figures. ESI preprint","Appears in ""Idempotent Mathematics and Mathematical Physics"", G.L.
  Litvinov and V.P. Maslov, Eds, vol. 377 of Contemporary Mathematics, pp.
  53--77, AMS, 2005.",,"1485","math.SP math.OC",,"  We develop a max-plus spectral theory for infinite matrices. We introduce
recurrence and tightness conditions, under which many results of the finite
dimensional theory, concerning the representation of eigenvectors and the
asymptotic behavior of powers of matrices, carry over. We also announce more
general representation results for eigenvectors, which are obtained by
introducing a max-plus analogue of the Martin boundary.
","[{""version"":""v1"",""created"":""Wed, 12 May 2004 14:59:02 GMT""}]","2007-05-23"
"nlin/0405026","John Wanderer","Victor Yakhot, John Wanderer","A Cross-Over in the Enstrophy Decay in Two-Dimensional Turbulence in a
  Finite Box","11 pages, 7 figures",,"10.1103/PhysRevLett.93.154502",,"nlin.CD",,"  The numerical simulation of two-dimensional decaying turbulence in a large
but finite box presented in this paper uncovered two physically different
regimes of enstrophy decay. During the initial stage, the enstrophy, generated
by a random Gaussian initial condition, decays as t^{-gamma} with gamma
approximately 0.7-0.8. After that, the flow undergoes a transition to a gas or
fluid composed of distinct vortices. Simultaneously, the magnitude of the decay
exponent crosses over to gamma approximately 0.4. An exact relation for the
total number of vortices, N(t), in terms of the mean circulation of an
individual vortex is derived. A theory predicting that N(t) is proportional to
t^{-xi} and the magnitudes of exponents gamma=2/5 and xi=4/5 is presented and
the possibility of an additional very late-time cross-over to gamma=1/3 and
xi=2/3 is also discussed.
","[{""version"":""v1"",""created"":""Tue, 11 May 2004 19:09:10 GMT""}]","2009-11-10"
"nlin/0405027","Leonardo Trujillo","L. Trujillo, J. J. Suarez, J. A. Gonzalez","Random maps in physical systems","7 pages, 5 figures, EPL style. To appear in Europhysics Letters",,"10.1209/epl/i2004-10023-y",,"nlin.CD nlin.SI",,"  We show that functions of type $X_n = P[Z^n]$, where $P[t]$ is a periodic
function and $Z$ is a generic real number, can produce sequences such that any
string of values $X_{s}, X_{s+1}, ...,X_{s+m}$ is deterministically independent
of past and future values. There are no correlations between any values of the
sequence. We show that this kind of dynamics can be generated using a recently
constructed optical device composed of several Mach--Zehnder interferometers.
Quasiperiodic signals can be transformed into random dynamics using nonlinear
circuits. We present the results of real experiments with nonlinear circuits
that simulate exponential and sine functions.
","[{""version"":""v1"",""created"":""Tue, 11 May 2004 21:18:19 GMT""}]","2009-11-10"
"nlin/0405028","Manuel Manas","Manuel Manas","S-functions, reductions and hodograph solutions of the r-th
  dispersionless modified KP and Dym hierarchies","35 pages, uses AMS-Latex, Hyperref, Geometry, Array and Babel
  packages",,"10.1088/0305-4470/37/46/007",,"nlin.SI math-ph math.AP math.MP",,"  We introduce an S-function formulation for the recently found r-th
dispersionless modified KP and r-th dispersionless Dym hierarchies, giving also
a connection of these $S$-functions with the Orlov functions of the
hierarchies. Then, we discuss a reduction scheme for the hierarchies that
together with the $S$-function formulation leads to hodograph systems for the
associated solutions. We consider also the connection of these reductions with
those of the dispersionless KP hierarchy and with hydrodynamic type systems. In
particular, for the 1-component and 2-component reduction we derive, for both
hierarchies, ample sets of examples of explicit solutions.
","[{""version"":""v1"",""created"":""Wed, 12 May 2004 00:10:01 GMT""}]","2009-11-10"
"nlin/0405029","Guy Katriel","Guy Katriel","Rotating waves in the Theta model for a ring of synaptically connected
  neurons","minor corrections",,,,"nlin.PS nlin.AO q-bio.NC",,"  We study rotating waves in the Theta model for a ring of
synaptically-interacting neurons. We prove that when the neurons are
oscillatory, at least one rotating wave always exists. In the case of excitable
neurons, we prove that no travelling waves exist when the synaptic coupling is
weak, and at least two rotating waves, a `fast' one and a `slow' one, exist
when the synaptic coupling is sufficiently strong. We derive explicit upper and
lower bounds for the `critical' coupling strength as well as for wave
velocities. We also study the special case of uniform coupling, in which
complete analytical results on the rotating waves can be achieved.
","[{""version"":""v1"",""created"":""Wed, 12 May 2004 09:01:16 GMT""},{""version"":""v2"",""created"":""Fri, 14 May 2004 12:20:20 GMT""},{""version"":""v3"",""created"":""Thu, 3 Jun 2004 12:04:09 GMT""}]","2007-05-23"
"nlin/0405030","Won-Ho Kye","Dae-Sic Lee, Won-Ho Kye, Sunghwan Rim, Tae-Yoon Kwon, and Chil-Min Kim","Generalized Phase Synchronization in unidirectionally coupled chaotic
  oscillators","4 pages, 5 figures","Phys. Rev. E 67, 045201(R) (2003)","10.1103/PhysRevE.67.045201",,"nlin.CD",,"  We investigate phase synchronization between two identical or detuned
response oscillators coupled to a slightly different drive oscillator. Our
result is that phase synchronization can occur between response oscillators
when they are driven by correlated (but not identical) inputs from the drive
oscillator. We call this phenomenon Generalized Phase Synchronization (GPS) and
clarify its characteristics using Lyapunov exponents and phase difference
plots.
","[{""version"":""v1"",""created"":""Wed, 12 May 2004 09:07:48 GMT""}]","2009-11-10"
