"math/0405428","Louis H. Kauffman","Roger Fenn, Louis H. Kauffman and Vassily O. Manturov","Virtual Knot Theory --Unsolved Problems","33 pages, 7 figures, LaTeX document",,,,"math.GT math.AT",,"  This paper is an introduction to the theory of virtual knots and links and it
gives a list of unsolved problems in this subject.
","[{""version"":""v1"",""created"":""Sat, 22 May 2004 15:27:06 GMT""},{""version"":""v2"",""created"":""Mon, 25 Apr 2005 01:08:00 GMT""},{""version"":""v3"",""created"":""Fri, 13 May 2005 07:10:35 GMT""},{""version"":""v4"",""created"":""Sat, 14 May 2005 07:16:43 GMT""},{""version"":""v5"",""created"":""Wed, 1 Jun 2005 06:46:29 GMT""},{""version"":""v6"",""created"":""Sat, 4 Jun 2005 05:48:52 GMT""},{""version"":""v7"",""created"":""Thu, 16 Jun 2005 07:33:15 GMT""},{""version"":""v8"",""created"":""Fri, 17 Jun 2005 09:14:56 GMT""}]","2007-05-23"
"nlin/0405051","Bruce Fabijonas","Bruce R. Fabijonas and Darryl D. Holm","Euler-Poincare formulation and elliptic instability for nth-gradient
  fluids","17 pages, 5 figures (low quality), each in several parts","J. Phys. A 37 (2004) 7609-7623","10.1088/0305-4470/37/30/015",,"nlin.CD",,"  The energy of an $n^{th}-$gradient fluid depends on its Eulerian velocity
gradients of order $n$. A variational principle is introduced for the dynamics
of $n^{th}-$gradient fluids and their properties are reviewed in the context of
Noether's theorem. The stability properties of Craik-Criminale solutions for
first and second gradient fluids are examined.
","[{""version"":""v1"",""created"":""Fri, 21 May 2004 18:07:06 GMT""}]","2007-05-23"
"nlin/0405052","Grzegorz Litak","Grzegorz Litak, Rodolfo Taccani, Krzysztof Urbanowicz, Janusz A.
  Holyst, Miroslaw Wendeker, Alessandro Giadrossi","Estimation of a Noise Level Using Coarse-Grained Entropy of Experimental
  Time Series of Internal Pressure in a Combustion Engine","12 pages, 6 figures",,"10.1016/j.chaos.2004.06.057",,"nlin.CD",,"  We report our results on non-periodic experimental time series of pressure in
a single cylinder spark ignition engine. The experiments were performed for
different levels of loading. We estimate the noise level in internal pressure
calculating the coarse-grained entropy from variations of maximal pressures in
successive cycles. The results show that the dynamics of the combustion is a
nonlinear multidimensional process mediated by noise. Our results show that so
defined level of noise in internal pressure is not monotonous function of
loading.
","[{""version"":""v1"",""created"":""Sat, 22 May 2004 09:02:28 GMT""}]","2015-06-26"
"nucl-th/0405064","David H. Hardtke","David Hardtke and Thomas J. Humanic","Can hadronic rescattering explain the ""jet quenching"" at RHIC?","6 pages, 6 figures, submitted to Phys. Rev. C","Phys.Rev.C71:034906,2005; Erratum-ibid.C71:039903,2006","10.1103/PhysRevC.71.034906 10.1103/PhysRevC.71.039903",,"nucl-th",,"  Recent RHIC data have shown novel nuclear modifications of moderate to high
pt particle production in central Au+Au collisions, including a suppression of
hadron production and a disappearance of back-to-back hadron pairs. In this
paper, we investigate whether final-state hadronic interactions of the jet
fragments can reproduce the RHIC data. We find that hadronic rescattering can
account for the disappearance of back-to-back hadron pairs, but cannot
reproduce other features of the RHIC data.
","[{""version"":""v1"",""created"":""Fri, 21 May 2004 21:40:09 GMT""}]","2014-11-18"
"physics/0405118","Andrei Volotka","A. V. Volotka, V. M. Shabaev, G. Plunien, and G. Soff","Zemach and magnetic radius of the proton from the hyperfine splitting in
  hydrogen",,"Eur.Phys.J. D33 (2005) 23-27","10.1140/epjd/e2005-00025-9",,"physics.atom-ph",,"  The current status of the determination of corrections to the hyperfine
splitting of the ground state in hydrogen is considered. Improved calculations
are provided taking into account the most recent value for the proton charge
radius. Comparing experimental data with predictions for the hyperfine
splitting, the Zemach radius of the proton is deduced to be $1.045(16)$ fm.
Employing exponential parametrizations for the electromagnetic form factors we
determine the magnetic radius of the proton to be $0.778(29)$ fm. Both values
are compared with the corresponding ones derived from the data obtained in
electron-proton scattering experiments and the data extracted from a rescaled
difference between the hyperfine splittings in hydrogen and muonium.
","[{""version"":""v1"",""created"":""Fri, 21 May 2004 16:51:52 GMT""},{""version"":""v2"",""created"":""Thu, 27 Jan 2005 12:29:41 GMT""}]","2009-11-10"
"physics/0405119","Domenico Salerno","D. Salerno, O. Jedrkiewicz, J. Trull, G. Valiulis,, Antonio Picozzi
  and P. Di Trapani","Noise-seeded spatio-temporal modulation instability in normal dispersion","4 pages, 3 figures",,"10.1103/PhysRevE.70.065603",,"physics.optics",,"  In optical second harmonic generation with normal dispersion, the virtually
infinite bandwidth of the unbounded, hyperbolic, modulational instability leads
to quenching of spatial multi-soliton formation and to the occurrence of a
catastrophic spatio-temporal break-up when an extended beam is let to interact
with an extremely weak external noise with coherence time much shorter than
that of the pump.
","[{""version"":""v1"",""created"":""Fri, 21 May 2004 17:24:14 GMT""}]","2009-11-10"
"quant-ph/0405125","Valentin Zagrebnov","Joseph V. Pule, Andre Verbeure and Valentin A. Zagrebnov","Models for Equilibrium BEC Superradiance","9 pages",,"10.1007/s10955-004-2007-z",,"quant-ph",,"  Motivated by recent experiments with superradiant Bose-Einstein Condensate
(BEC) we consider simple microscopic models describing rigorously the
interference of the two cooperative phenomena, BEC and radiation, in
thermodynamic equilibrium. Our resuts in equilibrium confirm the presence of
the observed superradiant light scattering from BEC: (a) the equilibrium
superradiance exists only below a certain transition temperature; (b) there is
superradiance and matter-wave (BEC) enhancement due to the coherent coupling
between light and matter.
","[{""version"":""v1"",""created"":""Fri, 21 May 2004 16:23:39 GMT""}]","2009-11-10"
"quant-ph/0405129","Dr Arun K. Pati","A. K. Pati and A. K. Rajagopal","Inconsistencies of the Adiabatic Theorem and the Berry Phase","Latex, 4 + pages, No figures, Resolution of the MS inconsistency
  given inquant-ph/0404022 and much more, This version now expanded to 6 pages",,,,"quant-ph",,"  The adiabatic theorem states that if we prepare a quantum system in one of
the instantaneous eigenstates then the quantum number is an adiabatic invariant
and the state at a later time is equivalent to the instantaneous eigenstate at
that time apart from phase factors. Recently, Marzlin and Sanders have pointed
out that this could lead to apparent violation of unitarity. We resolve the
Marzlin-Sanders inconsistency within the quantum adiabatic theorem. Yet, our
resolution points to another inconsistency, namely, that the cyclic as well as
non-cyclic adiabatic Berry phases may vanish under strict adiabatic condition.
We resolve this inconsistency and develop an unitary operator decomposition
method to argue for the validity of the adiabatic approximation.
","[{""version"":""v1"",""created"":""Fri, 21 May 2004 16:09:00 GMT""},{""version"":""v2"",""created"":""Fri, 13 May 2005 16:01:21 GMT""}]","2007-05-23"
"quant-ph/0405130","Heng Fan","Heng Fan, Seth Lloyd","Entanglement of eta-pairing state with off-diagonal long-range order","4 pages, 4 eps figures","J.Phys.A38, (2005) 5285.","10.1088/0305-4470/38/23/014",,"quant-ph cond-mat.other",,"  Off-diagonal long-range order (ODLRO) is a quantum phenomenon not describable
in classical mechanical terms. It is believed to be one characteristic of
superconductivity. The quantum state constructed by eta-pairing which
demonstrates ODLRO is an eigenstate of the three-dimensional Hubbard model.
Entanglement is a key concept of the quantum information processing and has no
classical counterpart. We study the entanglement property of eta-pairing
quantum state. The concurrence is a well-known measure of quantum entanglement.
We show that the concurrence of entanglement between one-site and the rest
sites is exactly the correlation function of the ODLRO for the eta-pairing
state in the thermodynamic limit. So, when the eta-pairing state is entangled,
it demonstrates ODLRO and is thus in superconducting phase, if it is a
separable state, there is no ODLRO. In the thermodynamic limit, the
entanglement between M-site and other sites of the eta-pairing state does not
vanish. Other types of ODLRO of eta-pairing state are presented. We show that
the behavior of the ODLRO correlation functions is equivalent to that of the
entanglement of the eta-pairing state. The scaling of the entropy of the
entanglement for the eta-pairing state is studied.
","[{""version"":""v1"",""created"":""Sat, 22 May 2004 00:01:10 GMT""}]","2009-11-10"
"quant-ph/0405131","Tao Hong","Tao Hong, Michael W. Jack, Makoto Yamashita","On-demand single-photon state generation via nonlinear absorption","5 pages, 2 figures, to appear in PRA. To be published in PRA",,"10.1103/PhysRevA.70.013814",,"quant-ph",,"  We propose a method for producing on-demand single-photon states based on
collision-induced exchanges of photons and unbalanced linear absorption between
two single-mode light fields. These two effects result in an effective
nonlinear absorption of photons in one of the modes, which can lead to single
photon states. A quantum nonlinear attenuator based on such a mechanism can
absorb photons in a normal input light pulse and terminate the absorption at a
single-photon state. Because the output light pulses containing single photons
preserve the properties of the input pulses, we expect this method to be a
means for building a highly controllable single photon source.
","[{""version"":""v1"",""created"":""Sat, 22 May 2004 05:08:24 GMT""}]","2009-11-10"
"quant-ph/0405132","Tao Hong","Tao Hong","Spatial weak-light solitons in an electro-magnetically induced nonlinear
  waveguide","5 pages, 5 figures. Phys. Rev. Lett. 90, 183901 (2003)",,,,"quant-ph",,"  We show that a weak probe light beam can form spatial solitons in an
electro-magnetically induced transparency (EIT) medium composed of four-level
atoms and a coupling light field. We find that the coupling light beam can
induce a highly controllable nonlinear waveguide and exert very strong effects
on the dynamical behavior of the solitons. Hence, in the EIT medium, it is not
only possible to produce spatial solitons at very low light intensities but
also simultaneously control these solitons by using the coupling-light-induced
nonlinear waveguide.
","[{""version"":""v1"",""created"":""Sat, 22 May 2004 05:43:23 GMT""}]","2007-05-23"
