"cond-mat/0405500","Christopher Tymczak","C. J. Tymczak, Val\'ery T. Weber, Eric Schwegler, Matt Challacombe","Linear scaling computation of the Fock matrix. VIII. Periodic boundaries
  for exact exchange at the $\Gamma$-point","7 pages 3 figures",,"10.1063/1.1869470","LA-UR 03-9043","cond-mat.mtrl-sci",,"  A translationally invariant formulation of the Hartree-Fock (HF)
$\Gamma$-point approximation is presented. This formulation is achieved through
introduction of the Minimum Image Convention (MIC) at the level of primitive
two-electron integrals, and implemented in a periodic version of the ONX
algorithm [J. Chem. Phys, {\bf 106} 9708 (1997)] for linear scaling computation
of the exchange matrix. Convergence of the HF-MIC $\Gamma$-point model to the
HF ${\bf k}$-space limit is demonstrated for fully periodic magnesium oxide,
ice and diamond. Computation of the diamond lattice constant using the HF-MIC
model together with the hybrid PBE0 density functional [Theochem, {\bf 493} 145
(1999)] yields $a_0=3.569$\AA with the 6-21G* basis set and a $3\times3\times3$
supercell. Linear scaling computation of the HF-MIC exchange matrix is
demonstrated for diamond and ice in the condensed phase
","[{""version"":""v1"",""created"":""Fri, 21 May 2004 18:02:51 GMT""}]","2016-08-16"
"cond-mat/0405522","Krzysztof Byczuk","K. Byczuk, C. Janowitz, R. Manzke, J. Spalek, and W. Wojcik","Luttinger liquid phenomenology and angle resolved photoemission for
  single layer $\chem{Bi_2Sr_{2-x}La_xCuO_{6+\delta}}$ high--temperature
  superconductor","7 pages, 3 figures, EPL style","Europhys. Lett. 67, 1011 (2004)","10.1209/epl/i2004-10158-9",,"cond-mat.str-el",,"  Recently observed splitting in angular resolved photoemission spectroscopy
(ARPES) on $\chem{Bi_2Sr_{2-x}La_xCuO_{6+\delta}}$ high--temperature
superconductor (Janowitz C. {\it et al.}, {\it Europhys. Lett.}, {\bf 60}
(2002) 615) is interpreted within the phenomenological Luttinger--liquid
framework, in which both the non--Fermi liquid scaling exponent of the spectral
function and the spin--charge separation are introduced. The anomalous Green
function with adjustable parameters fits very well to the Fermi edge and the
low--energy part of ARPES along the $\Gamma-M$ line in the Brillouin zone. In
contrast to one--dimensional models with Luttinger--liquid behavior we find
that both the anomalous scaling $\alpha$ and the parameter $\delta$ describing
the spin--charge separation are momentum dependent. The higher--energy part of
the spectra is not accounted for by this simple Luttinger--liquid form of the
Green function. In this energy regime additional scattering processes are
plausible to produce the experimentally observed wide incoherent background,
which diminishes as the inverse of the energy.
","[{""version"":""v1"",""created"":""Fri, 21 May 2004 16:08:00 GMT""}]","2009-11-10"
"cond-mat/0405523","Gilles Montambaux","Gilles Montambaux and Eric Akkermans","Non-exponential relaxations in disordered conductors","6 pages, LaTeX, 1 eps figure, contribution to the proceedings of the
  XXXIXth Moriond conference, La Thuile, Italy, January 2004",,,,"cond-mat.mes-hall cond-mat.dis-nn",,"  We show that, in low dimensional conductors, the quasiparticle decay and the
relaxation of the phase are not exponential processes. In quasi-one dimension,
they scale as $e^{- (t/\tau_N)^{3/2}}$ where the characteristic time
$\tau_{in}$, identical for both processes, is a power $T^{2/3}$ of the
temperature. This result implies a distribution of relaxation times.
","[{""version"":""v1"",""created"":""Fri, 21 May 2004 16:11:49 GMT""}]","2007-05-23"
"cond-mat/0405524","Hong-Yi Chen","Hong-Yi Chen and C.S. Ting","LDOS modulations in cuprate superconductors with competing AF order: the
  temperature effect",,,,,"cond-mat.supr-con",,"  Based upon a phenomenological $t-t'-U-V$ model and using Bogoliubov-de Gennes
equations, we found that near the optimal doping $\delta=0.15$ at low
temperature ($T$), only the pure d-wave superconductivity (dSC) prevails and
the antiferromagnetic (AF) order is completely suppressed. However, at higher
$T$ the AF order with stripe modulation and the accompanying charge density
wave (CDW) emerge, and they could exist even above the superconducting
transition temperature. This implies that the existence of the CDW depends
critically on the presence of the AF order, not so much on the dSC. The LDOS
(local density of states) image indicates that the stripe modulation has an
energy independent spacing of $5a/4a$ spreading over a $24a \times 48a$
lattice, corresponding to an average periodicity $4.8a$. This result may be
relevant to the recent STM experiment [Vershinin $et al.$, Science {\bf 303},
1995 (2004)].
","[{""version"":""v1"",""created"":""Fri, 21 May 2004 16:15:56 GMT""}]","2007-05-23"
"cond-mat/0405525","David DiVincenzo","D. P. DiVincenzo (IBM) and D. Loss (Basel)","Rigorous Born Approximation and beyond for the Spin-Boson Model","Greatly extended version of short paper cond-mat/0304118.
  Accompanying Mathematica notebook fop5.nb, available in Source, is an
  essential part of this work; it gives full details of the fourth-order Born
  calculation summarized in the text. fop5.nb is prepared in arXiv style
  (available from Wolfram Research)",,"10.1103/PhysRevB.71.035318",,"cond-mat.mes-hall quant-ph",,"  Within the lowest-order Born approximation, we present an exact calculation
of the time dynamics of the spin-boson model in the ohmic regime. We observe
non-Markovian effects at zero temperature that scale with the system-bath
coupling strength and cause qualitative changes in the evolution of coherence
at intermediate times of order of the oscillation period. These changes could
significantly affect the performance of these systems as qubits. In the biased
case, we find a prompt loss of coherence at these intermediate times, whose
decay rate is set by $\sqrt{\alpha}$, where $\alpha$ is the coupling strength
to the environment. We also explore the calculation of the next order Born
approximation: we show that, at the expense of very large computational
complexity, interesting physical quantities can be rigorously computed at
fourth order using computer algebra, presented completely in an accompanying
Mathematica file. We compute the $O(\alpha)$ corrections to the long time
behavior of the system density matrix; the result is identical to the reduced
density matrix of the equilibrium state to the same order in $\alpha$. All
these calculations indicate precision experimental tests that could confirm or
refute the validity of the spin-boson model in a variety of systems.
","[{""version"":""v1"",""created"":""Fri, 21 May 2004 17:14:41 GMT""}]","2009-11-10"
"cond-mat/0405526","Ameenah Alahmadi N.","Ameenah N. Al-Ahmadi, Sergio E. Ulloa","Coherent State Monitoring in Quantum Dots",,,"10.1103/PhysRevB.70.201302",,"cond-mat.other",,"  We study the dynamics of excitonic states in dimer and trimer arrangements of
colloidal quantum dots using a density matrix approach. The dots are coupled
via a dipole-dipole interaction akin to the F\""orster mechanism. Coherent
oscillations of tuned donor dots are shown to appear as plateaus in the
acceptor dot, and therefore in its optical response. This behavior provides one
with an interesting and unique handle to monitor the quantum state of the
dimer, an ""eavesdroping arrangement."" A trimer cluster in a symmetrical loop
shows steady states in a shorter characteristic time than the typical radiative
lifetime of the dots. Breaking the symmetry of the loop results again in
damping oscillatory states in the donor dots and plateaus in the
eavesdropping/acceptor dot. The use of realistic parameters allows direct
comparison with recent experiments and indicates that coherent state monitoring
is possible in real experiments.
","[{""version"":""v1"",""created"":""Fri, 21 May 2004 18:02:52 GMT""}]","2009-11-10"
"cond-mat/0405527","H\'ector V\'azquez","H. Vazquez (1), R. Oszwaldowski (1), P. Pou (1), J. Ortega (1), R.
  Perez (1), F. Flores (1), A. Kahn (2) ((1) Departamento de Fisica Teorica de
  la Materia Condensada, Universidad Autonoma de Madrid, Spain, (2) Department
  of Electrical Engineering, Princeton University, USA)","Dipole formation at metal/PTCDA interfaces: Role of the Charge
  Neutrality Level","6 pages","Europhys. Lett., 65 (6), pp. 802-808 (2004),
  http://www.edpsciences.org/articles/epl/abs/2004/06/epl8070/epl8070.html","10.1209/epl/i2003-10131-2",,"cond-mat.mtrl-sci",,"  The formation of a metal/PTCDA (3, 4, 9, 10-perylenetetracarboxylic
dianhydride) interface barrier is analyzed using weak-chemisorption theory. The
electronic structure of the uncoupled PTCDA molecule and of the metal surface
is calculated. Then, the induced density of interface states is obtained as a
function of these two electronic structures and the interaction between both
systems. This induced density of states is found to be large enough (even if
the metal/PTCDA interaction is weak) for the definition of a Charge Neutrality
Level for PTCDA, located 2.45 eV above the highest occupied molecular orbital.
We conclude that the metal/PTCDA interface molecular level alignment is due to
the electrostatic dipole created by the charge transfer between the two solids.
","[{""version"":""v1"",""created"":""Fri, 21 May 2004 17:45:21 GMT""}]","2007-05-23"
"cond-mat/0405528","Igor Zutic","Igor Zutic, Jaroslav Fabian and S. Das Sarma","Spintronics: Fundamentals and applications","invited review, 36 figures, 900+ references; minor stylistic changes
  from the published version","Rev. Mod. Phys. 76, 323-410 (2004)","10.1103/RevModPhys.76.323",,"cond-mat.other",,"  Spintronics, or spin electronics, involves the study of active control and
manipulation of spin degrees of freedom in solid-state systems. This article
reviews the current status of this subject, including both recent advances and
well-established results. The primary focus is on the basic physical principles
underlying the generation of carrier spin polarization, spin dynamics, and
spin-polarized transport in semiconductors and metals. Spin transport differs
from charge transport in that spin is a nonconserved quantity in solids due to
spin-orbit and hyperfine coupling. The authors discuss in detail spin
decoherence mechanisms in metals and semiconductors. Various theories of spin
injection and spin-polarized transport are applied to hybrid structures
relevant to spin-based devices and fundamental studies of materials properties.
Experimental work is reviewed with the emphasis on projected applications, in
which external electric and magnetic fields and illumination by light will be
used to control spin and charge dynamics to create new functionalities not
feasible or ineffective with conventional electronics.
","[{""version"":""v1"",""created"":""Fri, 21 May 2004 17:50:37 GMT""}]","2009-11-10"
"cond-mat/0405529","J. T. Devreese","S. N. Klimin (1,2), V. M. Fomin (1,2), F. Brosens (1), J. T. Devreese
  (1) ((1) TFVS, Universiteit Antwerpen, (2) FSM, Universitatea de Stat din
  Moldova)","Ground state and optical conductivity of interacting polarons in a
  quantum dot","33 pages, 9 figures, E-mail addresses: jozef.devreese@ua.ac.be,
  fons.brosens@ua.ac.be, vladimir.fomin@ua.ac.be, sergei.klimin@ua.ac.be,
  accepted for Phys. Rev. B",,"10.1103/PhysRevB.69.235324","TFVS-2004-4","cond-mat.mes-hall",,"  The ground-state energy, the addition energies and the optical absorption
spectra are derived for interacting polarons in parabolic quantum dots in three
and two dimensions. A path integral formalism for identical particles is used
in order to take into account the fermion statistics. The approach is applied
to both closed-shell and open-shell systems of interacting polarons. Using a
generalization of the Jensen-Feynman variational principle, the ground-state
energy of a confined N-polaron system is analyzed as a function of N and of the
electron-phonon coupling constant. As distinct from the few-electron systems
without the electron-phonon interaction, three types of spin polarization are
possible for the ground state of the few-polaron systems: (i) a spin-polarized
state, (ii) a state where the spin is determined by Hund's rule, (iii) a state
with the minimal possible spin. A transition from a state fulfilling Hund's
rule, to a spin-polarized state occurs when decreasing the electron density. In
the strong-coupling limit, the system of interacting polarons turns into a
state with the minimal possible spin. These transitions should be
experimentally observable in the optical absorption spectra of quantum dots.
","[{""version"":""v1"",""created"":""Fri, 21 May 2004 18:15:18 GMT""}]","2009-11-10"
"cond-mat/0405530","Thomas A. Pasquini Jr","Thomas A. Pasquini, Yong-Il Shin, Christian Sanner, Michele Saba,
  Andre Schirotzek, David E. Pritchard and Wolfgang Ketterle","Quantum reflection of atoms from a solid surface at normal incidence","To appear in Phys. Rev. Lett. (December 2004)5 pages, 4 figures",,"10.1103/PhysRevLett.93.223201",,"cond-mat.other",,"  We observed quantum reflection of ultracold atoms from the attractive
potential of a solid surface. Extremely dilute Bose-Einstein condensates of
^{23}Na, with peak density 10^{11}-10^{12}atoms/cm^3, confined in a weak
gravito-magnetic trap were normally incident on a silicon surface. Reflection
probabilities of up to 20 % were observed for incident velocities of 1-8 mm/s.
The velocity dependence agrees qualitatively with the prediction for quantum
reflection from the attractive Casimir-Polder potential. Atoms confined in a
harmonic trap divided in half by a solid surface exhibited extended lifetime
due to quantum reflection from the surface, implying a reflection probability
above 50 %.
","[{""version"":""v1"",""created"":""Fri, 21 May 2004 20:40:22 GMT""},{""version"":""v2"",""created"":""Wed, 17 Nov 2004 18:08:22 GMT""}]","2009-11-10"
"cond-mat/0405531","Markus Kindermann","M. Kindermann","Correlations of spin currents through a quantum dot induced by the Kondo
  effect","4 pages, 2 figures","Phys. Rev. B 71, 165332 (2005)","10.1103/PhysRevB.71.165332",,"cond-mat.mes-hall",,"  We study correlations of spin currents flowing through a Coulomb blockaded
quantum dot. While vanishing for elastic co-tunneling, these correlations
develop as the quantum dot enters the Kondo regime. They are a manifestation of
Kondo physics in quantum dots. We demonstrate that the spin current correlator
is non-perturbative in the Kondo coupling.
","[{""version"":""v1"",""created"":""Fri, 21 May 2004 22:12:11 GMT""}]","2009-11-10"
"cond-mat/0405532","Adam Wasserman","Morrel H. Cohen and Adam Wasserman","N-representability and stationarity in time-dependent density functional
  theory","9 pages, 0 figures, Phys. Rev. A accepted. Introduction was expanded,
  subsections reorganized, appendix and new references added",,"10.1103/PhysRevA.71.032515",,"cond-mat.other cond-mat.mtrl-sci",,"  To construct an N-representable time-dependent density-functional theory, a
generalization to the time domain of the Levy-Lieb (LL) constrained search
algorithm is required. That the action is only stationary in the Dirac-Frenkel
variational principle eliminates the possibility of basing the search on the
action itself. Instead, we use the norm of the partial functional derivative of
the action in the Hilbert space of the wave functions in place of the energy of
the LL search. The electron densities entering the formalism are
$N$-representable, and the resulting universal action functional has a unique
stationary point in the density at that corresponding to the solution of the
Schr\""{o}dinger equation. The original Runge-Gross (RG) formulation is subsumed
within the new formalism. Concerns in the literature about the meaning of the
functional derivatives and the internal consistency of the RG formulation are
allayed by clarifying the nature of the functional derivatives entering the
formalism.
","[{""version"":""v1"",""created"":""Fri, 21 May 2004 21:54:19 GMT""},{""version"":""v2"",""created"":""Thu, 20 Jan 2005 00:23:55 GMT""}]","2009-11-10"
"cond-mat/0405533","Alexei Akolzin","Alexei Akolzin and Richard L. Weaver","Generalized Berry Conjecture and mode correlations in chaotic plates","5 pages, 1 figure",,"10.1103/PhysRevE.70.046212",,"cond-mat.dis-nn",,"  We consider a modification of the Berry Conjecture for eigenmode statistics
in wave-bearing systems. The eigenmode correlator is conjectured to be
proportional to the imaginary part of the Green's function. The generalization
is applicable not only to scalar waves in the interior of homogeneous isotropic
systems where the correlator is a Bessel function, but to arbitrary points of
heterogeneous systems as well. In view of recent experimental measurements,
expressions for the intensity correlator in chaotic plates are derived.
","[{""version"":""v1"",""created"":""Fri, 21 May 2004 23:08:42 GMT""}]","2009-11-10"
"cond-mat/0405534","Pablo Hurtado","P.I. Hurtado, P.L. Garrido, J. Marro","Theoretical Characterization of the Interface in a Nonequilibrium
  Lattice System","10 pages, 7 figures, submitted to Phys. Rev","Phys. Rev. B 70, 245409 (2004)","10.1103/PhysRevB.70.245409",,"cond-mat.stat-mech cond-mat.soft",,"  The influence of nonequilibrium bulk conditions on the properties of the
interfaces exhibited by a kinetic Ising--like model system with nonequilibrium
steady states is studied. The system is maintained out of equilibrium by
perturbing the familiar spin--flip dynamics at temperature T with
completely--random flips; one may interpret these as ideally simulating some
(dynamic) impurities. We find evidence that, in the present case, the
nonequilibrium mechanism adds to the basic thermal one resulting on a
renormalization of microscopic parameters such as the probability of
interfacial broken bonds. On this assumption, we develop theory for the
nonequilibrium ""surface tension"", which happens to show a non--monotonous
behavior with a maximum at some finite T. It ensues, in full agreement with
Monte Carlo simulations, that interface fluctuations differ qualitatively from
the equilibrium case, e.g., the interface remains rough at zero--T. We discuss
on some consequences of these facts for nucleation theory, and make some
explicit predictions concerning the nonequilibrium droplet structure.
","[{""version"":""v1"",""created"":""Sat, 22 May 2004 14:04:21 GMT""},{""version"":""v2"",""created"":""Mon, 20 Sep 2004 18:24:23 GMT""}]","2009-11-10"
"cs/0405075","Xiaochu Qi","Xiaochu Qi","Reduction Strategies in Lambda Term Normalization and their Effects on
  Heap Usage","This is a modified version of the master's thesis of Xiaochu Qi",,,,"cs.PL",,"  Higher-order representations of objects such as programs, proofs, formulas
and types have become important to many symbolic computation tasks. Systems
that support such representations usually depend on the implementation of an
intensional view of the terms of some variant of the typed lambda-calculus.
Various notations have been proposed for lambda-terms to explicitly treat
substitutions as basis for realizing such implementations. There are, however,
several choices in the actual reduction strategies. The most common strategy
utilizes such notations only implicitly via an incremental use of environments.
This approach does not allow the smaller substitution steps to be intermingled
with other operations of interest on lambda-terms. However, a naive strategy
explicitly using such notations can also be costly: each use of the
substitution propagation rules causes the creation of a new structure on the
heap that is often discarded in the immediately following step. There is thus a
tradeoff between these two approaches. This thesis describes the actual
realization of the two approaches, discusses their tradeoffs based on this and,
finally, offers an amalgamated approach that utilizes recursion in rewrite rule
application but also suspends substitution operations where necessary.
","[{""version"":""v1"",""created"":""Sat, 22 May 2004 07:21:02 GMT""}]","2007-05-23"
"cs/0405076","Jiang Qiu","Chiaki Sakama, Katsumi Inoue","An Abductive Framework For Computing Knowledge Base Updates","Appeared in Theory and Practice of Logic Programming, vol. 3, no. 6,
  2003","Theory and Practice of Logic Programming, vol. 3, no. 6, 2003",,,"cs.DB",,"  This paper introduces an abductive framework for updating knowledge bases
represented by extended disjunctive programs. We first provide a simple
transformation from abductive programs to update programs which are logic
programs specifying changes on abductive hypotheses. Then, extended abduction,
which was introduced by the same authors as a generalization of traditional
abduction, is computed by the answer sets of update programs. Next, different
types of updates, view updates and theory updates are characterized by
abductive programs and computed by update programs. The task of consistency
restoration is also realized as special cases of these updates. Each update
problem is comparatively assessed from the computational complexity viewpoint.
The result of this paper provides a uniform framework for different types of
knowledge base updates, and each update is computed using existing procedures
of logic programming.
","[{""version"":""v1"",""created"":""Sat, 22 May 2004 10:30:35 GMT""}]","2007-05-23"
"gr-qc/0405116","Nora Breton","Nora Breton","Smarr's formula for black holes with non-linear electrodynamics","10 pages, 3 figures.Contribution to the Festscrift of Prof. A. Garcia","Gen.Rel.Grav.37:643-650,2005","10.1007/s10714-005-0051-x",,"gr-qc",,"  It is known that for nonlinear electrodynamics the First Law of Black Hole
Mechanics holds, however the Smarr's formula for the total mass does not. In
this contribution we discuss the point and determine the corresponding
expressions for the Bardeen black hole solution that represents a nonlinear
magnetic monopole. The same is done for the regular black hole solution derived
by Ayon-Beato and Garcia, showing that in the case that variations of the
electric charge are involved, the Smarr's formula does not longer is valid.
","[{""version"":""v1"",""created"":""Fri, 21 May 2004 17:53:34 GMT""}]","2011-07-19"
"gr-qc/0405117","Ghazal Geshnizjani","Ghazal Geshnizjani, Niayesh Afshordi","Coarse-Grained Back Reaction in Single Scalar Field Driven Inflation","6 pages, 1 figure","JCAP 0501 (2005) 011","10.1088/1475-7516/2005/01/011",,"gr-qc astro-ph hep-ph hep-th",,"  We introduce a self-consistent stochastic coarse-graining method, which
includes both metric and scalar field fluctuations, to investigate the back
reaction of long wavelength perturbations in single-scalar driven inflation, up
to the second (one loop) order. We demonstrate that, although back reaction
cannot be significant during the last 70 e-foldings of inflation with a smooth
potential, there exist non-smooth inflaton potentials which allow significant
back reaction, and are also consistent with cosmological observations. Such
non-smooth potentials may lead to the generation of massive primordial black
holes, which could be further used to constrain/verify these models.
","[{""version"":""v1"",""created"":""Fri, 21 May 2004 20:12:14 GMT""}]","2009-08-29"
"hep-lat/0405021","Joel Giedt","Joel Giedt","Deconstruction, 2d lattice super-Yang-Mills, and the dynamical lattice
  spacing","25 pages, 6 figures",,,,"hep-lat",,"  We study expectation values related to the dynamical lattice spacing that
occurs in the recent 2d lattice super-Yang-Mills constructions of Cohen et al.
[hep-lat/0307012]. The corresponding observable in the fully-quenched ensemble
would appear to indicate a difficulty with the proposed continuum limit.
However, we find that the same observable in the phase-quenched ensemble takes
a very different, perhaps encouraging, average value. Unfortunately, we are not
able to obtain results for the full theory, due to the nearly flat distribution
of the complex phase of the fermion determinant in the phase-quenched ensemble.
","[{""version"":""v1"",""created"":""Fri, 21 May 2004 20:31:28 GMT""}]","2007-05-23"
"hep-ph/0405211","Brian C. Tiburzi","B. C. Tiburzi","Double distributions: Loose ends","4 pages, 0 figures, RevTex 4, Brief Report","Phys.Rev. D70 (2004) 057504","10.1103/PhysRevD.70.057504","NT-UW 04-09","hep-ph nucl-th",,"  We point out that double distributions need not vanish at their boundary.
Boundary terms do not change the ambiguity inherent in defining double
distributions; instead, boundary conditions must be satisfied in order to
switch between different decompositions. We analyze both the spin zero and spin
one-half cases.
","[{""version"":""v1"",""created"":""Fri, 21 May 2004 18:06:20 GMT""}]","2009-11-10"
"hep-ph/0405212","Nikolaos Kidonakis","Nikolaos Kidonakis and Ramona Vogt","Beauty and Charm Production in Fixed Target Experiments","7 pages, 4 figures, presented at the DIS 2004 Workshop, Strbske
  Pleso, Slovakia, 14-18 April, 2004",,,"Cavendish-HEP-04/16, LBNL-55137","hep-ph",,"  We present calculations of NNLO threshold corrections for beauty and charm
production in pi- p and pp interactions at fixed-target experiments.
","[{""version"":""v1"",""created"":""Fri, 21 May 2004 18:10:13 GMT""}]","2007-05-23"
