"astro-ph/0405424","Svetlana Jorstad","Svetlana Jorstad and Alan Marscher","The Highly Relativistic Kiloparsec-Scale Jet of the Gamma-Ray Quasar
  0827+243","28 pages with 9 figures. Revised version corrects eq. A1 & A4 (which
  incorrectly divided by 4pi) and entries in tables. Minor changes are made in
  the text. submitted to ApJ","Astrophys.J. 614 (2004) 615-625","10.1086/423800",,"astro-ph",,"  We present Chandra X-ray (0.2-8 keV) and Very Large Array radio (15 and 5
GHz) images of the $\gamma$-ray bright, superluminal quasar 0827+243. The X-ray
jet bends sharply--by ~90 deg., presumably amplified by projection effects--5''
from the core. Only extremely weak radio emission is detected between the
nuclear region and the bend. The X-ray continuum spectrum of the combined
emission of the knots is rather flat, with a slope of $-0.4\pm 0.2$, while the
5-15 GHz spectra are steeper for knots detected in the radio. These
characteristics, as well as non-detection of the jet in the optical band by the
Hubble Space Telescope, pose challenges to models for the spectral energy
distributions (SEDs) of the jet features. The SEDs could arise from pure
synchrotron emission from either a single or dual population of relativistic
electrons only if the minimum electron energy per unit mass $\gamma_{\min}
\gtrsim 1000$. Alternatively, the X-ray emission could result from inverse
Compton scattering of the Cosmic Microwave Background photons by electrons with
Lorentz factors as low as $\gamma \sim 15$. In all models, the bulk Lorentz
factor of the jet flow $\Gamma\gtrsim 20$ found on parsec scales must continue
without substantial deceleration out to 800 kpc (deprojected) from the nucleus.
Deceleration does appear to occur at and beyond the sharp bend, such that the
flow could be only mildly relativistic at the end of the jet.
","[{""version"":""v1"",""created"":""Fri, 21 May 2004 16:03:37 GMT""},{""version"":""v2"",""created"":""Tue, 25 May 2004 23:35:36 GMT""}]","2009-11-10"
"astro-ph/0405425","Elizabeth L. Blanton","Elizabeth L. Blanton (1), Craig L. Sarazin (1), Brian R. McNamara (2),
  and T. E. Clarke (1) ((1) University of Virginia, (2) Ohio University)","Chandra Observation of the Central Region of the Cooling Flow Cluster
  Abell 262: A Radio Source that is a Shadow of its Former Self?","Astrophysical Journal, in press; 9 pages, 8 figures","Astrophys.J. 612 (2004) 817-824","10.1086/422677",,"astro-ph",,"  We present a Chandra observation of the cooling flow cluster Abell 262.
Spectral fits show that the intracluster medium (ICM) in A262 cools by a factor
of three from 2.7 keV to 0.9 keV at the cluster center. A mass deposition rate
of Mdot = 19 +6/-5 Msun/yr is measured. Complex structure is found in the very
inner regions of the cluster, including knots of emission and a clear deficit
of emission to the east of the cluster center. The bright X-ray structures are
located in the same regions as optical line emission, indicating that cooling
to low temperatures has occurred in these regions. The X-ray deficit is
spatially coincident with the eastern radio lobe associated with the active
galactic nucleus hosted by the central cD galaxy. The region surrounding the
X-ray hole is cool, and shows no evidence that it has been strongly shocked.
This joins the ranks of other cooling flow clusters with Chandra-detected
bubbles blown by central radio sources. This source is different than the other
well-known cases, in that the radio source is orders of magnitude less luminous
and has produced a much smaller bubble. Comparing the energy output of the
radio source with the luminosity of the cooling gas shows that energy
transferred to the ICM from the radio source is insufficient to offset the
cooling flow unless the radio source is currently experiencing a less powerful
than average outburst, and was more powerful in the past.
","[{""version"":""v1"",""created"":""Fri, 21 May 2004 16:25:36 GMT""}]","2009-11-10"
"astro-ph/0405426","Ulrich Heber","U. Heber and H. Edelmannn (Dr. Remeis-Sternwarte, University of
  Erlangen-Nuernberg, Bmaberg, Germany)","Atmospheric parameters and abundances of sdB stars","To appear in ""Extreme Horizontal Branch Stars and Related Objects"",
  Astrophysics and Space Science, Kluver Academic Publishers, edited by P.F.L.
  Maxted",,"10.1023/B:ASTR.0000044342.79287.fc",,"astro-ph",,"  We summarize recent results of quantitative spectral analyses using NLTE and
metal line-blanketed LTE model atmospheres. Temperatures and gravities derived
for hundreds of sdB stars are now available and allow us to investigate
systematic uncertainties of teff, log g scales and to test the theory of
stellar evolution and pulsations. Surface abundance patterns of about two dozen
sdB stars are surprisingly homogenous. In particular the iron abundance is
almost solar for most sdBs. We highlight one iron deficient and three super
metal-rich sdBs, a challenge to diffusion theory. SdB stars are slowly rotating
stars unless they are in close binary systems which is hard to understand if
the sdB stars were formed in merger events. The only exception is the pulsator
PG 1605+072 rotating at v sin i = 39km/s. Signatures of stellar winds from sdB
stars have possibly been found.
","[{""version"":""v1"",""created"":""Fri, 21 May 2004 17:38:11 GMT""}]","2009-11-10"
"astro-ph/0405427","Adam Burrows","Adam Burrows","Understanding Core-Collapse Supernovae","to be published in the proceedings of the Twelfth Workshop on
  ""Nuclear Astrophysics,"" a Tribute to an Explosive Astrophysicist, Wolfgang
  Hillebrandt, on the occasion of his 60th Birthday, held at the Ringberg
  Castle, Lake Tegernsee, Germany, March 22 - 27, 2004, eds. E. Muller and
  H.-Th. Janka",,,,"astro-ph",,"  I summarize, in the form of an extended abstract, the ongoing efforts at the
University of Arizona (and in collaboration) to understand core-collapse
supernovae theoretically. Included are short discussions of 1D (SESAME) and 2D
(VULCAN/2D) codes and results, as well as discussions of the possible role of
rotation. Highlighted are recent developments in multi-dimensional radiation
hydrodynamics and the essential physics of the neutrino-driven mechanism.
","[{""version"":""v1"",""created"":""Fri, 21 May 2004 17:45:18 GMT""}]","2007-05-23"
"astro-ph/0405428","Paolo Creminelli","Paolo Creminelli and Matias Zaldarriaga","CMB 3-point functions generated by non-linearities at recombination","16 pages, 4 figures. Expanded introduction of sec.2. Published
  version","Phys.Rev. D70 (2004) 083532","10.1103/PhysRevD.70.083532","HUTP-A023","astro-ph",,"  We study the 3-point functions generated at recombination in the squeezed
triangle limit, when one mode has a wavelength much larger than the other two
and is outside the horizon. The presence of the long wavelength mode cannot
change the physics inside the horizon but modifies how a late time observer
sees the anisotropies. The effect of the long wavelength mode can be divided
into a redefinition of time and spatial scales, a Shapiro time delay and
gravitational lensing. The separation is gauge dependent but helps develop
intuition. We show that the resulting 3-point function corresponds to an f_NL <
1 and that its shape is different from that created by the f_NL (or local)
model.
","[{""version"":""v1"",""created"":""Fri, 21 May 2004 18:13:29 GMT""},{""version"":""v2"",""created"":""Sun, 23 May 2004 15:16:19 GMT""},{""version"":""v3"",""created"":""Wed, 15 Sep 2004 14:37:47 GMT""}]","2016-08-30"
"astro-ph/0405429","Mario G. Abadi","Julio F. Navarro, Mario G. Abadi and Matthias Steinmetz","Tidal Torques and the Orientation of Nearby Disk Galaxies","5 pages, 2 figures, accepted for publication in ApJL","Astrophys.J. 613 (2004) L41-L44","10.1086/424902",,"astro-ph",,"  We use numerical simulations to investigate the orientation of the angular
momentum axis of disk galaxies relative to their surrounding large scale
structure. We find that this is closely related to the spatial configuration at
turnaround of the material destined to form the galaxy, which is often part of
a coherent two-dimensional slab criss-crossed by filaments. The rotation axis
is found to align very well with the intermediate principal axis of the inertia
momentum tensor at this time. This orientation is approximately preserved
during the ensuing collapse, so that the rotation axis of the resulting disk
ends up lying on the plane traced by the protogalactic material at turnaround.
This suggests a tendency for disks to align themselves so that their rotation
axis is perpendicular to the minor axis of the structure defined by surrounding
matter. One example of this trend is provided by our own Galaxy, where the
Galactic plane is almost at right angles with the supergalactic plane (SGP)
drawn by nearby galaxies; indeed, the SGP latitude of the North Galactic Pole
is just 6 degrees. We have searched for a similar signature in catalogs of
nearby disk galaxies, and find a significant excess of edge-on spirals (for
which the orientation of the disk rotation axis may be determined
unambiguously) highly inclined relative to the SGP. This result supports the
view that disk galaxies acquire their angular momentum as a consequence of
early tidal torques acting during the expansion phase of the protogalactic
material.
","[{""version"":""v1"",""created"":""Fri, 21 May 2004 19:22:55 GMT""},{""version"":""v2"",""created"":""Mon, 9 Aug 2004 17:36:59 GMT""}]","2009-11-10"
"astro-ph/0405430","Ana Pelinson","Reuven Opher, Ana Pelinson","Studying the decay of the vacuum energy with the observed density
  fluctuation spectrum","RevTeX4, 4 pages. Accepted for publication in Phys. Rev. D","Phys.Rev. D70 (2004) 063529","10.1103/PhysRevD.70.063529",,"astro-ph",,"  One of the major problems in cosmology today is to explain the observed
acceleration of the universe. The present observational data are consistent
with the simplest solution to this problem, which is based on the vacuum
energy. A decaying vacuum energy is a very attractive solution. It could link
the value of the present vacuum energy, that is accelerating the universe
today, with the value that created the inflationary epoch in the past. We
investigate here models that suggest that the vacuum energy decays into cold
dark matter (CDM) and show that the density fluctuation spectrum obtained from
the cosmic microwave background (CMB) data together with large galaxy surveys
(e.g., the Sloan Digital Sky Survey), puts strong limits on the rate of decay
of the vacuum energy. CDM produced by a decaying vacuum energy would dilute the
density fluctuation spectrum, created in the primordial universe and observed
with large galaxy surveys at low redshifts. Our results indicate that the decay
rate of the vacuum energy into CDM is extremely small.
","[{""version"":""v1"",""created"":""Fri, 21 May 2004 19:24:16 GMT""},{""version"":""v2"",""created"":""Wed, 8 Sep 2004 19:36:02 GMT""}]","2009-11-10"
"astro-ph/0405431","Edo Berger","E. Berger, S.R. Kulkarni (Caltech), D.A. Frail (NRAO)","The Non-Relativistic Evolution of GRBs 980703 and 970508:
  Beaming-Independent Calorimetry","Submitted to ApJ; 13 pages, 6 figures, 1 table; high-resolution
  figures can be found at: http://www.astro.caltech.edu/~ejb/NR/","Astrophys.J. 612 (2004) 966-973","10.1086/422809",,"astro-ph",,"  We use the Sedov-Taylor self-similar solution to model the radio emission
from the gamma-ray bursts (GRBs) 980703 and 970508, when the blastwave has
decelerated to non-relativistic velocities. This approach allows us to infer
the energy independent of jet collimation. We find that for GRB 980703 the
kinetic energy at the time of the transition to non-relativistic evolution,
t_NR ~ 40 d, is E_ST ~ (1-6)e51 erg. For GRB 970508 we find E_ST ~ 3e51 erg at
t_NR ~ 100 d, nearly an order of magnitude higher than the energy derived in
Frail, Waxman and Kulkarni (2000). This is due primarily to revised
cosmological parameters and partly to the maximum likelihood fit we use here.
Taking into account radiative losses prior to t_NR, the inferred energies agree
well with those derived from the early, relativistic evolution of the
afterglow. Thus, the analysis presented here provides a robust,
geometry-independent confirmation that the energy scale of cosmological GRBs is
about 5e51 erg, and additionally shows that the central engine in these two
bursts did not produce a significant amount of energy in mildly relativistic
ejecta at late time. Furthermore, a comparison to the prompt energy release
reveals a wide dispersion in the gamma-ray efficiency, strengthening our
growing understanding that E_gamma is a not a reliable proxy for the total
energy.
","[{""version"":""v1"",""created"":""Sat, 22 May 2004 01:03:36 GMT""}]","2009-11-10"
"astro-ph/0405433","Felix Mirabel","I.F. Mirabel","Microquasar-AGN-GRB Connections","Invited review presented at the Fifth INTEGRAL Science Workshop. 9
  pages, 6 figures",,,,"astro-ph",,"  I review the progress made on the physics of black hole systems in the
context of the analogy between AGN and microquasars that was proposed one
decade ago. If the emerging empirical correlations between the observational
properties of stellar and supermassive black holes will become more robust, we
will use them to determine the mass and spin of black holes, independently of
theoretical models. Microquasars are fossils of sources of Gamma-ray bursts
(GRBs) of long duration, and their kinematics provides observational clues on
the physics of collapsars. If jets in GRBs, microquasars and AGN are due to a
unique universal magnetohydrodynamic mechanism, synergy between the research on
these three different classes of cosmic objects will lead to further progress
in black hole physics and astrophysics.
  The potential contributions with INTEGRAL in this field of research are also
discussed. It is shown that the Galactic Plane Survey (GPS) with INTEGRAL is
unraveling new extragalactic sources of hard x-rays behind the Milky Way, as
well as new black hole high-mass binaries that were hidden by large columns of
gas and dust.
","[{""version"":""v1"",""created"":""Fri, 21 May 2004 20:11:20 GMT""}]","2007-05-23"
"astro-ph/0405434","Matthias Hoeft","M. Hoeft, M. Brueggen","Feedback in AGN heating of galaxy clusters","12 pages, 6 figures, submitted to ApJ","Astrophys.J. 617 (2004) 896-902","10.1086/425411",,"astro-ph",,"  One of the challenges that models of AGN heating of the intracluster medium
(ICM) face, is the question how the mechanical luminosity of the AGN is tuned
to the radiative losses of the ICM. Here we implement a simple 1D model of a
feedback mechanism that links the luminosity of the AGN to the accretion rate.
We demonstrate how this simple feedback mechanism leads to a quasi-steady state
for a broad range of parameters. Moreover, within this feedback model, we
investigate the effect of thermal conduction and find that its relative
importance depends strongly on the cluster mass.
","[{""version"":""v1"",""created"":""Fri, 21 May 2004 21:13:30 GMT""}]","2009-11-10"
"astro-ph/0405435","Junzhi Wang","Junzhi Wang, Qizhou Zhang, Zhong Wang, Paul T. P. Ho, Giovanni G.
  Fazio, Yuefang Wu","Warm molecular gas in galaxy-galaxy merger NGC6090","Accepted by ApJL","Astrophys.J. 616 (2004) L67-L70","10.1086/422681",,"astro-ph",,"  We present observations of the CO 2-1 and 3-2 transitions toward the merging
galaxies of NGC6090 with the Submillimeter Array (SMA) (The Submillimeter Array
(SMA) is a joint project between the Smithsonian Astrophysical Observatory and
the Academia Sinica Institute of Astronomy and Astrophysics, and is funded by
the Smithsonian Institution and the Academia Sinica.). The high resolution CO
data reveal three gas concentrations. The main component is peaking in the
overlap region between the two galaxies, where the near-IR a nd radio continuum
emission are weak. The CO 2-1 emission from the face-on galaxy NGC6090E is
somewhat stronger than that from the edge-o n galaxy NGC6090W.
  The CO 3-2 emission peaks in the overlap region, similar to the CO 2-1
emission . More than 50% of the CO 3-2 emission arises from the 2$''$ (1.2 kpc)
area of the overlap region. There appears to be CO 3-2 emission toward the
nuclear region and the north-west arm of NGC6090E, while no CO 3-2 emission is
detected toward NGC6090W. Unlike the CO gas, most of the radio continuum
emission comes from NGC6090E. The strong CO emission, together with the weak
radio continuum emission, suggests that star formation in the overlap region
has not proceeded long enoug h to produce significant numbers of supernovae
which would be detectable due to their radio continuum emission.
","[{""version"":""v1"",""created"":""Fri, 21 May 2004 21:35:58 GMT""}]","2009-11-10"
"astro-ph/0405436","Duncan K. Galloway","D. K. Galloway (1), J. L. Sokoloski (2) ((1) MIT, (2) SAO)","An X-Ray Jet from a White Dwarf - Detection of the Collimated Outflow
  from CH Cygni with Chandra","4 & a bit pages, 4 figures, accepted by ApJL; uses emulateapj.cls and
  revtex4. Minor changes following referees report, & shortened to meet page
  limit","Astrophys.J. 613 (2004) L61-L64","10.1086/424925",,"astro-ph",,"  Most symbiotic stars consist of a white dwarf accreting material from the
wind of a red giant. An increasing number of these objects have been found to
produce jets. Analysis of archival Chandra data of the symbiotic system CH
Cygni reveals faint extended emission to the south, aligned with the optical
and radio jets seen in earlier HST and VLA observations. CH Cygni thus contains
only the second known white dwarf with an X-ray jet, after R Aquarii. The
X-rays from symbiotic-star jets appear to be produced when jet material is
shock-heated following collision with surrounding gas, as with the outflows
from some protostellar objects and bipolar planetary nebulae.
","[{""version"":""v1"",""created"":""Fri, 21 May 2004 21:56:58 GMT""},{""version"":""v2"",""created"":""Mon, 9 Aug 2004 20:56:59 GMT""}]","2009-11-10"
"astro-ph/0405437","Helio J. Rocha-Pinto","Helio J. Rocha-Pinto, Steven R. Majewski, M. F. Skrutskie, Jeffrey D.
  Crane and Richard J. Patterson","Exploring Halo Substructure with Giant Stars: A diffuse star cloud or
  tidal debris around the Milky Way in Triangulum-Andromeda","14 pages, 4 figures, 1 table","Astrophys.J. 615 (2004) 732-737","10.1086/424585",,"astro-ph",,"  We report here the discovery of an apparent excess of 2MASS M giant
candidates with dereddened 0.85 < J-K_S < 1.2 spanning a considerably large
area of the celestial sphere between, at least, $100\degr < l < 150\degr$ and
$-20\degr > b > -40\degr$, and covering most of the constellations of
Triangulum and Andromeda. This structure does not seem to be preferentially
distributed around a clear core, but rather lies in a tenuous, clumpy
cloud-like structure tens of kiloparsecs away. The reduced proper-motion
diagram as well as spectroscopy of a subsample shows these excess stars to be
real giants, not contaminating dwarfs. Radial velocity measurements indicate
among those M giants the presence of a coherent kinematical structure with a
velocity dispersion $\sigma < 17$ km s$^{-1}$. Our findings support the
existence of a quite dispersed stellar structure around the Milky Way that, due
to its coreless and sparse distribution, could be part of a tidal stream or a
new kind of satellite galaxy.
","[{""version"":""v1"",""created"":""Fri, 21 May 2004 22:04:09 GMT""}]","2009-11-10"
"astro-ph/0405438","Derek Homeier","Derek Homeier, France Allard, Peter H. Hauschildt, Travis S. Barman,
  Andreas Schweitzer, and Edward A. Baron","Spectral Properties of Brown Dwarfs and Hot Jupiters","12 pages, 6 figures, Review to be published in ""High Resolution
  Infrared Spectroscopy in Astronomy"", Proceedings of the ESO Workshop Held in
  Garching, Germany, 18-21 Nov., 2003, eds. H.U. Kaeufl, R. Siebenmorgen, & A.
  Moorwood, ESO Astrophysics Symposia
  http://www.eso.org/gen-fac/meetings/ekstasy2003/",,"10.1007/10995082_74",,"astro-ph",,"  Brown dwarfs bridge the gap between the stellar and planetary mass regimes.
Evolving from conditions very similar to the lowest-mass stars, the atmospheres
of older brown dwarfs closely resemble those expected in close-in extrasolar
giant planets, and with cooler BDs still being discovered, more and more
approach the properties of gas giants at wider separation. Interpreting the
spectra of BDs is therefore a crucial step towards understanding and predicting
the spectral and thermal properties of EGPs.
  Essential properties of substellar atmospheres are massive molecular
line-blanketing and the condensation of species with decreasing Teff, changing
the chemical equilibrium composition and causing absorption from dust grains.
More complex details involve the distribution of dust clouds over the surface
giving rise to temporal variability, and possible deviations from chemical
equilibrium conditions. In the case of close-in EGPs and some BDs in binary
systems, the effect of irradiation from the primary significantly affects the
spectral properties and thermal evolution.
","[{""version"":""v1"",""created"":""Fri, 21 May 2004 23:35:35 GMT""}]","2009-11-10"
"astro-ph/0405439","Daisuke Kawata","Hyun-chul Lee (1,2), Brad K. Gibson (1), Chris Flynn (1,3), Daisuke
  Kawata (1), Michael A. Beasley (1,4) ((1) Swinburne, (2) Yonsei, (3) Tuorla,
  (4) UC Santa Cruz)","Is the Initial Mass Function of Low Surface Brightness Galaxies
  Dominated by Low Mass Stars?","6 pages, 5 figures, accepted for publication in MNRAS","Mon.Not.Roy.Astron.Soc. 353 (2004) 113","10.1111/j.1365-2966.2004.08049.x",,"astro-ph",,"  The rotation curves of low surface brightness (LSB) galaxies suggest that
they possess significantly higher mass-to-light (M/L) ratios than their high
surface brightness counterparts, indicating that LSB galaxies may be dark
matter dominated. This interpretation is hampered by the difficulty of
disentangling the disc and dark halo contributions from the disc dynamics of
LSB galaxies. Recently, Fuchs (2002) has attempted such a disentanglement using
spiral arm density wave and swing amplification theory, allowing an independent
measurement of the disc mass; this work suggests that LSB discs are
significantly more massive than previously believed. This would considerably
reduce the amount of matter required in the dark halos in fitting the rotation
curves. Interestingly, the high mass-to-light ratios derived for the discs
appear inconsistent with standard stellar population synthesis models. In this
paper, we investigate whether the high M/L ratios for the Fuchs LSB discs might
be understood by adopting a very ``bottom heavy'' initial mass function (IMF).
We find that an IMF with a power law exponent of around alpha=3.85 (compared to
the standard Salpeter IMF, alpha=2.35) is sufficient to explain the unusually
high M/L ratios of the Fuchs sample. Within the context of the models, the blue
colours ((B-R)_0 < 1.0) of the sample galaxies result from being metal-poor
([Fe/H] = -1.5 ~ -1.0) and having undergone recent (~1-3 Gyr ago) star
formation.
","[{""version"":""v1"",""created"":""Sat, 22 May 2004 02:04:40 GMT""}]","2009-11-10"
"astro-ph/0405440","Michael Feast","Michael Feast","The Current Status of Primary Distance Indicators","9 pages, to appear in, Nearby Large-Scale Structures and the Zone of
  Avoidance, ed.A.P Fairall and P.Woudt, ASP Conf.Ser",,,,"astro-ph",,"  A review is given of the current status of the primary distance indicators.
The relevance of these indicators for determining the local expansion rate and
the age of globular clusters is briefly outlined.
","[{""version"":""v1"",""created"":""Sat, 22 May 2004 13:16:03 GMT""}]","2007-05-23"
"cond-mat/0405491","H\'ector V\'azquez","H. Vazquez (1), F. Flores (1), R. Oszwaldowski (1 and 2), J. Ortega
  (1), R. Perez (1), A. Kahn (3) ((1) Departamento de Fisica Teorica de la
  Materia Condensada, Universidad Autonoma de Madrid, Spain, (2) Instytut
  Fizyki Mikolaja Kopernika, Torun, Poland, (3) Department of Electrical
  Engineering, Princeton University, USA.)","Barrier formation at metal/organic interfaces: dipole formation and the
  Charge Neutrality Level","7 pages, Proceedings of ICFSI-9, Madrid, Spain (September 2003),
  special issue of Applied Surface Science (in press)",,"10.1016/j.apsusc.2004.05.084",,"cond-mat.mtrl-sci",,"  The barrier formation for metal/organic semiconductor interfaces is analyzed
within the Induced Density of Interface States (IDIS) model. Using weak
chemisorption theory, we calculate the induced density of states in the organic
energy gap and show that it is high enough to control the barrier formation. We
calculate the Charge Neutrality Levels of several organic molecules (PTCDA,
PTCBI and CBP) and the interface Fermi level for their contact with a Au(111)
surface. We find an excellent agreement with the experimental evidence and
conclude that the barrier formation is due to the charge transfer between the
metal and the states induced in the organic energy gap.
","[{""version"":""v1"",""created"":""Fri, 21 May 2004 18:20:19 GMT""}]","2009-11-10"
"cond-mat/0405494","Su Yi","S. Yi, L. You, and H. Pu","Quantum phases of dipolar spinor condensates","4 pages, 3 figures",,"10.1103/PhysRevLett.93.040403",,"cond-mat.soft",,"  We study the zero-temperature ground state structure of a spin-1 condensate
with magnetic dipole-dipole interactions. We show that the dipolar interactions
break the rotational symmetry of the Hamiltonian and induce new quantum phases.
Different phases can be reached by tuning the effective strength of the dipolar
interactions via modifying the trapping geometry. The experimental feasibility
of detecting these phases is investigated. The spin-mixing dynamics is also
studied.
","[{""version"":""v1"",""created"":""Fri, 21 May 2004 18:32:52 GMT""}]","2009-11-10"
