"hep-ph/0405213","Sergei Demidov Vladimirovich","S. V. Demidov, D. S. Gorbunov","LHC prospects in searches for neutral scalars in pp\to\gamma\gamma+jet:
  SM Higgs boson, radion, sgoldstino","15 pages, 4 figures, 5 tables","Phys.Atom.Nucl. 69 (2006) 712-720","10.1134/S1063778806040156",,"hep-ph",,"  At hadron colliders the $\gamma\gamma+jet$ channel provides larger
signal-to-background ratio in comparison with inclusive $\gamma\gamma$ channel
in hunting for scalars uncharged under the SM gauge group. At NLO in QCD
perturbation theory we evaluate selfconsistently the signal significance for
the SM Higgs boson production in $\gamma\gamma+jet$ channel at LHC. Three-body
final state kinematics allows for refined cuts. The adjustment of these cuts
increases the signal significance upto the level of inclusive channel. Applying
a justified simple rescaling procedure to the results obtained for SM Higgs
boson, we estimate the LHC prospects in searches for radion and sgoldstino in
$\gamma\gamma+jet$ channel. We have found that this channel is comparable with
$\gamma\gamma$ channel in searches for new physics and deserves further
detailed investigations.
","[{""version"":""v1"",""created"":""Fri, 21 May 2004 18:35:45 GMT""}]","2015-06-25"
"hep-ph/0405214","Michael E. Peskin","Yasaman Farzan and Michael E. Peskin","The Contribution from Neutrino Yukawa Couplings to Lepton Electric
  Dipole Moments","34 pages, 9 figures; w. proof corrections for Phys. Rev. D, 3 refs.
  added","Phys.Rev.D70:095001,2004","10.1103/PhysRevD.70.095001","SLAC-PUB-10440","hep-ph",,"  To explain the observed neutrino masses through the seesaw mechanism, a
supersymmetric generalization of the Standard Model should include heavy
right-handed neutrino supermultiplets. Then the neutrino Yukawa couplings can
induce CP violation in the lepton sector. In this paper, we compute the
contribution of these CP violating terms to lepton electric dipole moments. We
introduce a new formalism that makes use of supersymmetry to expose the GIM
cancellations. In the region of small tan beta, we find a different result from
that given previously by Ellis, Hisano, Raidal, and Shimizu. We confirm the
structure found by this group, but with a much smaller overall coefficient. In
the region of large tan beta, we recompute the leading term that has been
identified by Masina and confirm her result.We discuss the implications of
these results for constraints on the neutrino Yukawa couplings.
","[{""version"":""v1"",""created"":""Fri, 21 May 2004 19:21:32 GMT""},{""version"":""v2"",""created"":""Wed, 27 Oct 2004 21:59:01 GMT""}]","2009-07-07"
"hep-ph/0405216","Dam Thanh Son","D.T.Son (INT), A.R.Zhitnitsky (UBC)","Quantum Anomalies in Dense Matter","4 pages","Phys.Rev. D70 (2004) 074018","10.1103/PhysRevD.70.074018","INT-PUB 04-13","hep-ph nucl-th",,"  We consider the effects of quantum anomalies involving the baryon current for
high-density matter. In the effective Lagrangian, the anomaly terms describe
the interaction of three light fields: the electromagnetic photons A_mu,
neutral light Nambu-Goldstone bosons (pi, eta, eta'), and the superfluid
phonon. The anomaly induced interactions lead to a number of interesting
phenomena which may have phenomenological consequences observable in neutron
stars.
","[{""version"":""v1"",""created"":""Fri, 21 May 2004 20:52:06 GMT""}]","2007-05-23"
"hep-ph/0405217","Chang Ho Hyun","H-J. Lee, C. H. Hyun, C.-H. Lee, H.-Ch. Kim","$\Delta S=0$ Effective Weak Chiral Lagrangian from the Instanton Vacuum","Final version accepted for publication in Eur. Phys. J. C","Eur.Phys.J.C45:451-457,2006","10.1140/epjc/s2005-02442-3","PNU-NURI-05/2004, PNU-NTG-04/2004","hep-ph nucl-th",,"  We investigate the $\Delta S=0$ effective chiral Lagrangian from the
instanton vacuum. Based on the $\Delta S=0$ effective weak Hamiltonian from the
operator product expansion and renormalization group equations, we derive the
strangeness-conserving effective weak chiral Lagrangian from the instanton
vacuum to order ${\cal O}(p^2)$ and the next-to-leading order in the $1/N_c$
expansion at the quark level. We find that the quark condensate and a dynamical
term which arise from the QCD and electroweak penguin operators appear in the
next-to-leading order in the $1/N_c$ expansion for the $\Delta S =0$ effective
weak chiral Lagrangian, while they are in the leading order terms in the
$\Delta S = 1$ case. Three different types of the form factors are employed and
we find that the dependence on the different choices of the form factor is
rather insensitive. The low-energy constants of the Gasser-Leutwyler type are
determined and discussed in the chiral limit.
","[{""version"":""v1"",""created"":""Sat, 22 May 2004 07:06:37 GMT""},{""version"":""v2"",""created"":""Fri, 4 Nov 2005 04:26:46 GMT""}]","2009-01-07"
"hep-ph/0405218","Steen Hannestad","Steen Hannestad (SDU, Nordita), Laura Mersini-Houghton (UNC-Chapel
  Hill)","A First Glimpse of String Theory in the Sky?","14 pages, 7 figures, Revtex, typos corrected and references added","Phys.Rev. D71 (2005) 123504","10.1103/PhysRevD.71.123504",,"hep-ph astro-ph hep-th",,"  We propose a new method for identifying new physics imprints on present
observational data in cosmology whereby signatures of string theory are clearly
distinguished from imprints of possible features on the inflaton potential. Our
method relies on the cross-correlations spectra of cosmic shear from large
scale structure (LSS) with the CMB temperature anisotropies and E-mode
polarization, by using the following properties: inflationary cosmology
provides only one source term for all CMB spectra and LSS which highly
constrains any deviations from the standard predictions; string theory can add
new non-inflationary channels to the source of perturbations as well as modify
clustering properties at large scales. Discrepancies in the source terms of
correlations and clustering properties provide the evidence for new physics.
Models of single-field inflation with a feature are disfavored even with
present data. Upcoming WMAP results and future data from weak lensing of LSS
will further improve our ability to probe new physics in this manner and could
open the first direct window to string theory.
","[{""version"":""v1"",""created"":""Sat, 22 May 2004 12:41:04 GMT""},{""version"":""v2"",""created"":""Tue, 1 Jun 2004 20:05:38 GMT""}]","2009-11-10"
"hep-th/0405182","Jose Francisco Gomes","J.F. Gomes, G.M. Sotkov and A.H. Zimerman","Solitons with Isospin","Latex 36 pages","Nucl.Phys. B714 (2005) 179-216","10.1016/j.nuclphysb.2005.02.024",,"hep-th math-ph math.MP nlin.SI",,"  We study the symmetries of the soliton spectrum of a pair of T-dual
integrable models, invariant under global $SL(2)_q\otimes U(1)$
transformations. They represent an integrable perturbation of the reduced
Gepner parafermions, based on certain gauged SL(3) - WZW model. Their
(semiclassical) topological soliton solutions, carrying isospin and belonging
to the root of unity representations of q-deformed $SU(2)_q$ - algebra are
obtained. We derive the semiclassical particle spectrum of these models, which
is further used to prove their T-duality properties.
","[{""version"":""v1"",""created"":""Fri, 21 May 2004 17:21:47 GMT""},{""version"":""v2"",""created"":""Thu, 30 Dec 2004 12:10:03 GMT""}]","2009-11-10"
"hep-th/0405187","Joshua Lapan","Morten Ernebjerg, Joanna L. Karczmarek and Joshua M. Lapan","Collective Field Description of Matrix Cosmologies","16 pages, 1 figure. v2: Typos corrected, JHEP style","JHEP0409:065,2004","10.1088/1126-6708/2004/09/065",,"hep-th",,"  We study the Das-Jevicki collective field description of arbitrary classical
solutions in the c=1 matrix model, which are believed to describe nontrivial
spacetime backgrounds in 2d string theory. Our analysis naturally includes the
case of a Fermi droplet cosmology: a finite size droplet of Fermi fluid, made
up of a finite number of eigenvalues. We analyze properties of the coordinates
in which the metric in the collective field theory is trivial, and comment on
the form of the interaction terms in these coordinates.
","[{""version"":""v1"",""created"":""Fri, 21 May 2004 20:18:56 GMT""},{""version"":""v2"",""created"":""Fri, 3 Sep 2004 22:07:47 GMT""}]","2008-11-26"
"hep-th/0405188","John Morris","J.R. Morris","Fermionic and Bosonic Stabilizing Effects for Type I and Type II
  Dimension Bubbles","17 pages, no figs; to appear in Phys.Rev.D","Phys.Rev. D70 (2004) 025007","10.1103/PhysRevD.70.025007",,"hep-th gr-qc hep-ph",,"  We consider two types of ""dimension bubbles"", which are viewed as 4d
nontopological solitons that emerge from a 5d theory with a compact extra
dimension. The size of the extra dimension varies rapidly within the domain
wall of the soliton. We consider the cases of type I (II) bubbles where the
size of the extra dimension inside the bubble is much larger (smaller) than
outside. Type I bubbles with thin domain walls can be stabilized by the
entrapment of various particle modes whose masses become much smaller inside
than outside the bubble. This is demonstrated here for the cases of scalar
bosons, fermions, and massive vector bosons, including both Kaluza-Klein zero
modes and Kaluza-Klein excitation modes. Type II bubbles expel massive particle
modes but both types can be stabilized by photons. Plasma filled bubbles
containing a variety of massless or nearly massless radiation modes may exist
as long-lived metastable states. Furthermore, in contrast to the case with a
""gravitational bag"", the metric for a fluid-filled dimension bubble does not
exhibit a naked singularity at the bubble's center.
","[{""version"":""v1"",""created"":""Fri, 21 May 2004 20:21:05 GMT""}]","2009-11-10"
"hep-th/0405189","Leonard Susskind","Leonard Susskind","Supersymmetry Breaking in the Anthropic Landscape","An important modification based on conversations with M. Douglas. The
  conclusion is greatly strengthened. Low energy susy is strongly disfavored",,"10.1142/9789812775344_0040",,"hep-th",,"  In this paper I attempt to address a serious criticism of the ``Anthropic
Landscape"" and ""Discretuum"" approach to cosmology, leveled by Banks, Dine and
Gorbatov. I argue that in this new and unfamiliar setting, the gauge Hierarchy
may not favor low energy supersymmetry. In a added note some considerations of
Douglas which substantially strengthen the argument are explained.
","[{""version"":""v1"",""created"":""Fri, 21 May 2004 22:03:36 GMT""},{""version"":""v2"",""created"":""Wed, 26 May 2004 18:18:06 GMT""},{""version"":""v3"",""created"":""Fri, 11 Jun 2004 20:06:08 GMT""}]","2016-11-23"
"hep-th/0405190","Patrick J. Fox","Michael Dine, Patrick J. Fox and Elie Gorbatov","Catastrophic Decays of Compactified Space-Times","Typos corrected, references added","JHEP 0409:037,2004","10.1088/1126-6708/2004/09/037","SCIPP-2004/16","hep-th",,"  Witten long ago pointed out that the simplest Kaluza-Klein theory, without
supersymmetry, is subject to a catastrophic instability. There are a variety of
string theories which are potentially subject to these instabilities. Here we
explore a number of questions: how generic are these instabilities? what
happens when a potential is generated on the moduli space? in the presence of
supersymmetry breaking, is there still a distinction between supersymmetric and
non-supersymmetric states?
","[{""version"":""v1"",""created"":""Sat, 22 May 2004 01:19:23 GMT""},{""version"":""v2"",""created"":""Fri, 28 May 2004 19:18:09 GMT""}]","2014-11-18"
"hep-th/0405191","Takashi Tamaki","Takashi Tamaki and Hidefumi Nomura","The universal area spectrum in single-horizon black holes","5 pages, 1 figure, references and comments added","Phys.Rev. D70 (2004) 044041","10.1103/PhysRevD.70.044041","KUNS-1921","hep-th gr-qc",,"  We investigate highly damped quasinormal mode of single-horizon black holes
motivated by its relation to the loop quantum gravity. Using the WKB
approximation, we show that the real part of the frequency approaches the value
$T_{\rm H}\ln 3$ for dilatonic black hole as conjectured by Medved et al. and
Padmanabhan. It is surprising since the area specrtum of the black hole
determined by the Bohr's correspondence principle completely agrees with that
of Schwarzschild black hole for any values of the electromagnetic charge or the
dilaton coupling. We discuss its generality for single-horizon black holes and
the meaning in the loop quantum gravity.
","[{""version"":""v1"",""created"":""Sat, 22 May 2004 03:40:32 GMT""},{""version"":""v2"",""created"":""Sun, 30 May 2004 08:37:19 GMT""},{""version"":""v3"",""created"":""Wed, 16 Jun 2004 05:44:39 GMT""}]","2009-11-10"
"hep-th/0405194","Keisuke Ohashi","Youichi Isozumi, Muneto Nitta, Keisuke Ohashi and Norisuke Sakai","Non-Abelian Walls in Supersymmetric Gauge Theories","62 pages, 17 figures, the final version in PRD","Phys.Rev. D70 (2004) 125014","10.1103/PhysRevD.70.125014","TIT/HEP-524","hep-th hep-ph math.DG",,"  The Bogomol'nyi-Prasad-Sommerfield (BPS) multi-wall solutions are constructed
in supersymmetric U(N_C) gauge theories in five dimensions with N_F(>N_C)
hypermultiplets in the fundamental representation. Exact solutions are obtained
with full generic moduli for infinite gauge coupling and with partial moduli
for finite gauge coupling. The generic wall solutions require nontrivial
configurations for either gauge fields or off-diagonal components of adjoint
scalars depending on the gauge. Effective theories of moduli fields are
constructed as world-volume gauge theories. Nambu-Goldstone and
quasi-Nambu-Goldstone scalars are distinguished and worked out. Total moduli
space of the BPS non-Abelian walls including all topological sectors is found
to be the complex Grassmann manifold SU(N_F) / [SU(N_C) x SU(N_F-N_C) x U(1)]
endowed with a deformed metric.
","[{""version"":""v1"",""created"":""Sat, 22 May 2004 12:21:46 GMT""},{""version"":""v2"",""created"":""Fri, 4 Mar 2005 07:30:10 GMT""}]","2007-05-23"
"hep-th/0405196","Denis Dalmazi","D. Dalmazi","The static potential in QED$_3$ with non-minimal coupling","19 pages and 7 figures","Phys.Rev. D70 (2004) 065021","10.1103/PhysRevD.70.065021",,"hep-th",,"  Here we study the effect of the non-minimal coupling $j^{\mu}\eps
\partial^{\nu} A^{\alpha} $ on the static potential in multiflavor QED$_3$.
Both cases of four and two components fermions are studied separately at
leading order in the $1/N $ expansion. Although a non-local Chern-Simons term
appears, in the four components case the photon is still massless leading to a
confining logarithmic potential similar to the classical one. In the two
components case, as expected, the parity breaking fermion mass term generates a
traditional Chern-Simons term which makes the photon massive and we have a
screening potential which vanishes at large inter-charge distance. The extra
non-minimal couplings have no important influence on the static potential at
large inter-charge distances. However, interesting effects show up at finite
distances. In particular, for strong enough non-minimal coupling we may have a
new massive pole in the photon propagator while in the opposite limit there may
be no poles at all in the irreducible case. We also found that, in general, the
non-minimal couplings lead to a finite range {\bf repulsive} force between
charges of opposite signs.
","[{""version"":""v1"",""created"":""Sat, 22 May 2004 14:12:58 GMT""}]","2009-11-10"
"math-ph/0405055","Gerardo Iovane","Gerardo Iovane, Francesca Passarella","Saint-Venant's principle in dynamical porous thermoelastic media with
  memory for heat flux","18 pages, accepted on Journal of Thermal Stresses",,,,"math-ph math.MP",,"  In the present paper, we study a linear thermoelastic porous material with a
constitutive equation for heat flux with memory. An approximated theory of
thermodynamics is presented for this model and a maximal pseudo free energy is
determined. We use this energy to study the spatial behaviour of the
thermodynamic processes in porous materials. We obtain the domain of influence
theorem and establish the spatial decay estimates inside of the domain of
influence. Further, we prove a uniqueness theorem valid for finite or infinite
body. The body is free of any kind of a priori assumptions concerning the
behaviour of solutions at infinity.
","[{""version"":""v1"",""created"":""Fri, 21 May 2004 17:43:26 GMT""}]","2007-05-23"
"math-ph/0405056","Gerardo Iovane","G.Iovane, P.Giordano, E.Laserra","Fantappie's group as an extension of special relativity on Cantorian
  space-time","14 pages, accepted in Chaos, Solitons and Fractals","ChaosSolitonsFractals22:975-983,2004","10.1016/j.chaos.2004.04.019",,"math-ph math.MP",,"  In this paper we will analyze the Fantappie group and its properties in
connection with Cantorian space-time. Our attention will be focused on the
possibility of extending special relativity. The cosmological consequences of
such extension appear relevant, since thanks to the Fantappie group, the model
of the Big Bang and that of stationary state become compatible. In particular,
if we abandon the idea of the existence of only one time gauge, since we do not
see the whole Universe but only a projection, the two models become compatible.
In the end we will see the effects of the projective fractal geometry also on
the galactic and extra-galactic dynamics.
","[{""version"":""v1"",""created"":""Fri, 21 May 2004 17:55:01 GMT""}]","2008-11-26"
"math/0405401","David Sherman","David Sherman","Variations on Kuratowski's 14-set theorem","11 pages",,,,"math.GN math-ph math.MP",,"  Kuratowski's 14-set theorem says that in a topological space, 14 is the
maximum possible number of distinct sets which can be generated from a fixed
set by taking closures and complements. In this article we consider the
analogous questions for any possible subcollection of the operations {closure,
complement, interior, intersection, union}, and any number of initially given
sets. We use the algebraic ""topological calculus"" to full advantage.
","[{""version"":""v1"",""created"":""Fri, 21 May 2004 18:28:32 GMT""}]","2007-05-23"
"math/0405419","Rade T. Zivaljevic","Rade T. Zivaljevic","WI-posets, graph complexes and Z_2-equivalences",,,,,"math.CO math.AT",,"  We introduce WI-posets as intermediate objects in the study of Z_2-homotopy
types of graph complexes. It turns out that (almost) all graph complexes
associated to a graph can be viewed as avatars of the same object, as long as
their Z_2-homotopy types are concerned. Among the applications are a proof that
each finite, free Z_2-complex is a graph complex and an evaluation of
Z_2-homotopy types of complexes Ind(C_n) of independence sets in a cycle C_n.
The main tools used in the paper are Quillen fiber theorem and Bredon criterion
for Z_2-equivalence of Z_2-complexes.
","[{""version"":""v1"",""created"":""Fri, 21 May 2004 17:12:44 GMT""}]","2007-05-23"
"math/0405420","Giovanni Gallavotti","Guido Gentile Giovanni Gallavotti","Degenerate elliptic resonances",,,,"FM 06-04","math.DS",,"  Quasi-periodic motions on invariant tori of an integrable system of dimension
smaller than half the phase space dimension may continue to exists after small
perturbations. The parametric equations of the invariant tori can often be
computed as formal power series in the perturbation parameter and can be given
a meaning via resummations. Here we prove that, for a class of elliptic tori, a
resummation algorithm can be devised and proved to be convergent, thus
extending to such lower-dimensional invariant tori the methods employed to
prove convergence of the Lindstedt series either for the maximal (i.e. KAM)
tori or for the hyperbolic lower-dimensional invariant tori.
","[{""version"":""v1"",""created"":""Fri, 21 May 2004 17:12:43 GMT""}]","2007-05-23"
"math/0405421","Sung Yil Yoon","Sung Yil Yoon","A lower bound to the action dimension of a group","Published by Algebraic and Geometric Topology at
  http://www.maths.warwick.ac.uk/agt/AGTVol4/agt-4-15.abs.html","Algebr. Geom. Topol. 4 (2004) 273-296","10.2140/agt.2004.4.273",,"math.GR",,"  The action dimension of a discrete group G, actdim(G), is defined to be the
smallest integer m such that G admits a properly discontinuous action on a
contractible m-manifold. If no such m exists, we define actdim(G) = infty.
Bestvina, Kapovich, and Kleiner used Van Kampen's theory of embedding
obstruction to provide a lower bound to the action dimension of a group. In
this article, another lower bound to the action dimension of a group is
obtained by extending their work, and the action dimensions of the fundamental
groups of certain manifolds are found by computing this new lower bound.
","[{""version"":""v1"",""created"":""Fri, 21 May 2004 17:55:32 GMT""}]","2014-10-01"
"math/0405422","Tara S. Holm","Megumi Harada, Tara S. Holm","The equivariant cohomology of hypertoric varieties and their real loci","27 pages, 10 figures",,,,"math.DG math.SG",,"  Let M be a Hamiltonian T space with a proper moment map, bounded below in
some component. In this setting, we give a combinatorial description of the
T-equivariant cohomology of M, extending results of Goresky, Kottwitz and
MacPherson and techniques of Tolman and Weitsman. Moreover, when M is equipped
with an antisymplectic involution \sigma anticommuting with the action of T, we
also extend to this noncompact setting the ``mod 2'' versions of these results
to the real locus Q:= M^\sigma of M. We give applications of these results to
the theory of hypertoric varieties.
","[{""version"":""v1"",""created"":""Fri, 21 May 2004 20:57:25 GMT""}]","2007-05-23"
"math/0405423","Petros Hadjicostas","Petros Hadjicostas (Texas Tech University)","A conjecture-generalization of Sondow's formula","2 pages",,,,"math.NT",,"  An easy generalization of Beukers' integrals allows us to conjecture a double
integral formula involving the zeta and the gamma functions. A special case of
this formula is Sondow's double integral formula for Euler's constant gamma.
","[{""version"":""v1"",""created"":""Fri, 21 May 2004 21:50:22 GMT""}]","2007-05-23"
"math/0405424","Guillermo Moreno","Guillermo Moreno","The Exponential Map on the Cayley-Dickson algebras","17 pages",,,,"math.QA math.AT",,"  we study the exponential map for A_n = R^2^n, the Cayley_Dickson algebras for
n bigher than 1,wich generalize the Complex exponential map to
Quaternions,Octonions and so forth. As application,we show that the self-map of
the unit sphere in A_n, S^(2^n)-1,given by taking k-powers has topological
degree k for k an integer number,from this we derive a suitable ""Fundamental
theorem of algebra"" for A_n for n bigher than 1.
","[{""version"":""v1"",""created"":""Fri, 21 May 2004 22:27:06 GMT""}]","2007-05-23"
"math/0405425","James P. Crutchfield","Nihat Ay and James P. Crutchfield","Reductions of Hidden Information Sources","12 pages, 4 figures; 30 citations; Updates at
  http://www.santafe.edu/~cmg",,"10.1007/s10955-005-6797-4","Santa Fe Institute Working Paper 04-05-011","math.PR math.ST stat.TH",,"  In all but special circumstances, measurements of time-dependent processes
reflect internal structures and correlations only indirectly. Building
predictive models of such hidden information sources requires discovering, in
some way, the internal states and mechanisms. Unfortunately, there are often
many possible models that are observationally equivalent. Here we show that the
situation is not as arbitrary as one would think. We show that generators of
hidden stochastic processes can be reduced to a minimal form and compare this
reduced representation to that provided by computational mechanics--the
epsilon-machine. On the way to developing deeper, measure-theoretic foundations
for the latter, we introduce a new two-step reduction process. The first step
(internal-event reduction) produces the smallest observationally equivalent
sigma-algebra and the second (internal-state reduction) removes sigma-algebra
components that are redundant for optimal prediction. For several classes of
stochastic dynamical systems these reductions produce representations that are
equivalent to epsilon-machines.
","[{""version"":""v1"",""created"":""Fri, 21 May 2004 22:53:09 GMT""}]","2009-11-10"
"math/0405426","Teruyoshi Yoshida","Teruyoshi Yoshida","Abelian etale coverings of modular curves over local fields","13 pages",,,,"math.NT math.AG",,"  We relate a part of the abelian etale fundamental group of curves over local
fields to the component group of the Neron model of the jacobian. We apply the
result to the modular curve X_0(p)/Q_p to show that the unramified abelian
covering X_1(p) over X_0(p) (Shimura covering) uses up all the possible
ramification over the special fiber of X_0(p).
","[{""version"":""v1"",""created"":""Sat, 22 May 2004 08:28:29 GMT""}]","2007-05-23"
"math/0405427","Gerard van der Geer","Gilberto Bini and Gerard van der Geer","The Euler characteristic of local systems on the moduli of genus 3
  hyperelliptic curves","12 pages, Latex; Table 5 corrected",,,,"math.AG",,"  For a partition $lambda=\{lambda_1 \geq \lambda_2 \geq \lambda_3 \}$ of
non-negative integers, we calculate the Euler characteristic of the local
system $V_{\lambda}$ on the moduli space of genus 3 hyperelliptic curves using
a suitable stratification. For some $\lambda$ of low degree, we make a guess
for the motivic Euler characteristic of $V_{\lambda}$ using counting of curves
over finite fields.
","[{""version"":""v1"",""created"":""Sat, 22 May 2004 10:11:44 GMT""},{""version"":""v2"",""created"":""Thu, 1 Jul 2004 09:20:08 GMT""}]","2007-05-23"
