"cond-mat/0406063","Thomas Ludwig","T. Ludwig, Ya. M. Blanter and A. D. Mirlin","Nonequilibrium mesoscopic conductance fluctuations","14 pages, 4 figures. Fig.2 and one more appendix added, accepted for
  publication in PRB","PRB 70, 235315 (2004)","10.1103/PhysRevB.70.235315",,"cond-mat.mes-hall",,"  We investigate the amplitude of mesoscopic fluctuations of the differential
conductance of a metallic wire at arbitrary bias voltage V. For non-interacting
electrons, the variance <delta g^2> increases with V. The asymptotic large-V
behavior is <delta g^2> \sim V/V_c (where eV_c=D/L^2 is the Thouless energy),
in agreement with the earlier prediction by Larkin and Khmelnitskii. We find,
however, that this asymptotics has a very small numerical prefactor and sets in
at very large V/V_c only, which strongly complicates its experimental
observation. This high-voltage behavior is preceded by a crossover regime,
V/V_c \lesssim 30, where the conductance variance increases by a factor \sim 3
as compared to its value in the regime of universal conductance fluctuations
(i.e., at V->0). We further analyze the effect of dephasing due to the
electron-electron scattering on <delta g^2> at high voltages. With the Coulomb
interaction taken into account, the amplitude of conductance fluctuations
becomes a non-monotonic function of V. Specifically, <delta g^2> drops as 1/V
for voltages V >> gV_c, where g is the dimensionless conductance. In this
regime, the conductance fluctuations are dominated by quantum-coherent regions
of the wire adjacent to the reservoirs.
","[{""version"":""v1"",""created"":""Wed, 2 Jun 2004 20:01:18 GMT""},{""version"":""v2"",""created"":""Mon, 15 Nov 2004 18:36:23 GMT""}]","2009-11-10"
"cond-mat/0406065","Jose Daniel Munoz","L. E. Olmos and J.D. Munoz (Physics Department, National University of
  Colombia)","A Cellular Automaton Model for the Traffic Flow in Bogota","14 pages and 13 figures (gzipped tar file). Submitted to
  Int.J.Mod.Phys.C. Minor changes, specially at references and typoes, plus a
  clearer summary of the CA rules",,"10.1142/S0129183104006819","SSF-UN-0303","cond-mat.stat-mech",,"  In this work we propose a car cellular automaton model that reproduces the
experimental behavior of traffic flows in Bogot\'a. Our model includes three
elements: hysteresis between the acceleration and brake gaps, a delay time in
the acceleration, and an instantaneous brake. The parameters of our model were
obtained from direct measurements inside a car on motorways in Bogot\'a. Next,
we simulated with this model the flux-density fundamental diagram for a
single-lane traffic road and compared it with experimental data. Our
simulations are in very good agreement with the experimental measurements, not
just in the shape of the fundamental diagram, but also in the numerical values
for both the road capacity and the density of maximal flux. Our model
reproduces, too, the qualitative behavior of shock waves. In addition, our work
identifies the periodic boundary conditions as the source of false peaks in the
fundamental diagram, when short roads are simulated, that have been also found
in previous works. The phase transition between free and congested traffic is
also investigated by computing both the relaxation time and the order
parameter. Our work shows how different the traffic behavior from one city to
another can be, and how important is to determine the model parameters for each
city.
","[{""version"":""v1"",""created"":""Wed, 2 Jun 2004 20:41:46 GMT""},{""version"":""v2"",""created"":""Tue, 22 Jun 2004 18:38:23 GMT""}]","2009-11-10"
"cond-mat/0406066","T. Senthil","T. Senthil and Patrick A. Lee","Cuprates as doped U(1) spin liquids","11 pages, 7 figures","Phys. Rev. B 71, 174515 (2005)","10.1103/PhysRevB.71.174515",,"cond-mat.str-el cond-mat.supr-con",,"  We explore theoretically the notion that the underdoped cuprates may be
viewed as doped U(1) spin liquid Mott insulators. We pursue a conceptually
clear version of this idea that naturally incorporates several aspects of the
phenomenology of the cuprates. We argue that the low doping region may be
fruitfully discussed in terms of the universal physics associated with a
chemical potential tuned Mott transition between a U(1) spin liquid insulator
and a d-wave superconductor. A precise characterization of the deconfinement in
the U(1) spin liquid is provided by the emergence of a conserved gauge flux.
This extra conservation law should hold at least approximately in the
underdoped materials. Experiments that could possibly detect this conserved
gauge flux are proposed.
","[{""version"":""v1"",""created"":""Wed, 2 Jun 2004 20:10:34 GMT""}]","2009-11-10"
"cond-mat/0406067","James P. Eisenstein","I.B. Spielman, M. Kellogg, J.P. Eisenstein, L.N. Pfeiffer, and K.W.
  West","Onset of Interlayer Phase Coherence in a Bilayer Two-Dimensional
  Electron System: Effect of Layer Density Imbalance","4 pages, 3 figures",,"10.1103/PhysRevB.70.081303",,"cond-mat.mes-hall",,"  Tunneling and Coulomb drag are sensitive probes of spontaneous interlayer
phase coherence in bilayer two-dimensional electron systems at total Landau
level filling factor $\nu_T = 1$. We find that the phase boundary between the
interlayer phase coherent state and the weakly-coupled compressible phase moves
to larger layer separations as the electron density distribution in the bilayer
is imbalanced. The critical layer separation increases quadratically with layer
density difference.
","[{""version"":""v1"",""created"":""Wed, 2 Jun 2004 20:34:14 GMT""}]","2009-11-10"
"cond-mat/0406068","Gregory A. Fiete","Gregory A. Fiete, Gergely Zarand, Boldizsar Janko, Pawel Redlinski,
  and C. Pascu Moca","Positional Disorder, Spin-Orbit Coupling and Frustration in GaMnAs","17 Pages, 13 Figures","Phys. Rev. B 71, 115202 (2005)","10.1103/PhysRevB.71.115202","NSF-KITP-04-73","cond-mat.mtrl-sci",,"  We study the magnetic properties of metallic GaMnAs. We calculate the
effective RKKY interaction between Mn spins using several realistic models for
the valence band structure of GaAs. We also study the effect of positional
disorder of the Mn on the magnetic properties. We find that the interaction
between two Mn spins is anisotropic due to spin-orbit coupling within both the
so-called spherical approximation and in the more realistic six band model. The
spherical approximation strongly overestimates this anistropy, especially for
short distances between Mn ions. Using the obtained effective Hamiltonian we
carry out Monte Carlo simulations of finite and zero temperature magnetization
and find that, due to orientational frustration of the spins, non-collinear
states appear in both valence band approximations for disordered, uncorrelated
Mn impurities in the small concentration regime. Introducing correlations among
the substitutional Mn positions or increasing the Mn concentration leads to an
increase in the remnant magnetization at zero temperature and an almost fully
polarized ferromagnetic state.
","[{""version"":""v1"",""created"":""Wed, 2 Jun 2004 22:32:32 GMT""}]","2007-05-23"
"cond-mat/0406070","G\'abor Cs\'anyi","G\'abor Cs\'anyi, Bal\'azs Szendr\""oi","The fractal/small-world dichotomy in real-world networks","15 pages, 7 figures",,"10.1103/PhysRevE.70.016122",,"cond-mat.stat-mech cond-mat.dis-nn",,"  We draw attention to a clear dichotomy between small-world networks
exhibiting exponential neighborhood growth, and fractal-like networks where
neighborhoods grow according to a power law. This distinction is observed in a
number of real-world networks, and is related to the degree correlations and
geographical constraints. We conclude by pointing out that the status of human
social networks in this dichotomy is far from clear.
","[{""version"":""v1"",""created"":""Thu, 3 Jun 2004 06:24:31 GMT""}]","2009-11-10"
"cond-mat/0406071","Evgeny Kravtsov","E. Kravtsov, R. Brucas, B. Hjorvarsson, A. Hoser, A. Nefedov, F. Radu,
  A. Remhof, S. Wilkins","Proximity effect of vanadium on spin-density-wave magnetism in Cr films","7 figures",,"10.1103/PhysRevB.70.054425",,"cond-mat.mtrl-sci",,"  The spin-density wave (SDW) state in thin chromium films is well known to be
strongly affected by proximity effects from neighboring layers. To date the
main attention has been given to effects arising from exchange interactions at
interfaces. In the present work we report on combined neutron and synchrotron
scattering studies of proximity effects in Cr/V films where the boundary
condition is due to the hybridization of Cr with paramagnetic V at the
interface. We find that the V/Cr interface has a strong and long-range effect
on the polarization, period, and the N\'{e}el temperature of the SDW in rather
thick Cr films. This unusually strong effect is unexpected and not predicted by
theory.
","[{""version"":""v1"",""created"":""Thu, 3 Jun 2004 08:08:52 GMT""}]","2009-11-10"
"cond-mat/0406073","Severian Gvasaliya Dr","S.N. Gvasaliya, B. Roessli, D. Sheptyakov, S.G. Lushnikov, T.A.
  Shaplygina","Neutron scattering study of PbMg$_{1/3}$Ta$_{2/3}$O$_3$ and
  BaMg$_{1/3}$Ta$_{2/3}$O$_3$ complex perovskites",,"Eur. Phys. J. B 40 (2004) 235.","10.1140/epjb/e2004-00276-8",,"cond-mat.mtrl-sci cond-mat.dis-nn",,"  Neutron scattering investigations were carried out in
PbMg$_{1/3}$Ta$_{2/3}$O$_3$ and BaMg$_{1/3}$Ta$_{2/3}$O$_3$ complex
perovskites. The crystal structure of both compounds does not show any phase
transition in the temperature range 1.5 -- 730 K. Whereas the temperature
dependence of the lattice parameter of BaMg$_{1/3}$Ta$_{2/3}$O$_3$ follows the
classical expectations, the lattice parameter of relaxor ferroelectric
PbMg$_{1/3}$Ta$_{2/3}$O$_3$ exhibits anomalies. One of these anomalies is
observed in the same temperature range as the peak in the dielectric
susceptibility. We find that in PbMg$_{1/3}$Ta$_{2/3}$O$_3$, lead ions are
displaced from the ideal positions in the perovskite structure at all
temperatures. Consequently short-range order is present. This induces strong
diffuse scattering with an anisotropic shape in wavevector space. The
temperature dependences of the diffuse neutron scattering intensity and of the
amplitude of the lead displacements are similar.
","[{""version"":""v1"",""created"":""Thu, 3 Jun 2004 08:40:56 GMT""}]","2007-05-23"
"cond-mat/0406074","Fakher Assaad","F. F. Assaad","Phase diagram of the half-filled two-dimensional SU(N)
  Hubbard-Heisenberg model: a quantum Monte Carlo study","10 pages, 12 figures",,"10.1103/PhysRevB.71.075103","NSF-KITP-04-60","cond-mat.str-el",,"  We investigate the phase diagram of the half-filled SU(N) Hubbard-Heisenberg
model with hopping t, exchange J and Hubbard U, on a square lattice. In the
large-N limit, and as a function of decreasing values of t/J, the model shows a
transition from a d-density wave state to a spin dimerized insulator. A similar
behavior is observed at N=6 whereas at N=2 a spin density wave insulating
ground state is stabilized. The N=4 model, has a d-density wave ground state at
large values of t/J which as a function of decreasing values of t/J becomes
unstable to an insulating state with no apparent lattice and spin broken
symmetries. In this state, the staggered spin-spin correlations decay as a
power-law,resulting in gapless spin excitations at q = (pi,pi). Furthermore,
low lying spin modes with small spectral weight are apparent around the wave
vectors q = (0,pi) and q = (pi,0). This gapless spin liquid state is equally
found in the SU(4) Heisenberg model in the self-adjoint antisymmetric
representation. An interpretation of this state in terms of a pi-flux phase is
offered. Our results stem from projective (T=0) quantum Monte-Carlo simulations
on lattice sizes ranging up to 24 X 24.
","[{""version"":""v1"",""created"":""Thu, 3 Jun 2004 08:42:51 GMT""}]","2009-11-10"
"cond-mat/0406075","Raul Toral","Juan J. Cerda, Tomas Sintes and Raul Toral","A Monte-Carlo and Self-Consistent Field calculations of encapsulated
  spherical polymer brushes","14 pages including 8 figures",,,,"cond-mat.soft",,"  We present the results of extensive numerical self-consistent field (SCF) and
3-dimensional off-lattice Monte Carlo (MC) studies of a spherical brush
confined into a spherical cavity. The monomer density profile and the cavity
pressure have been measured in systems where curvature of the cavity has an
important effect on the polymer brush conformation. A direct comparison between
the SCF and MC methods reveals the SCF calculation to be a valuable alternative
to MC simulations in the case of free and softly compressed brushes. In the
case of strongly compressed systems we have proposed an extension of the Flory
theory for polymer solutions, whose predictions are found to be in good
agreement with the MC simulations and has the advantage of being
computationally inexpensive. In the range of high compressions, we have found
the monomer volume fraction $v$ to follow a scale relationship with the cavity
pressure $P$, $P \sim v^\alpha$. SCF calculations give $\alpha=2.15 \pm 0.05$,
close to {\em des Cloiseaux law ($\alpha=9/4$)}, whereas MC simulations lead to
$\alpha=2.73 \pm 0.04$. We conclude that the higher value of $\alpha$ obtained
with MC comes from the monomer density correlations not included in the SCF
formalism.
","[{""version"":""v1"",""created"":""Thu, 3 Jun 2004 08:47:02 GMT""}]","2007-05-23"
"cond-mat/0406076","Peter Falloon","Peter E. Falloon, Rodolfo A. Jalabert, Dietmar Weinmann, and Robert L.
  Stamps","A Circuit Model for Domain Walls in Ferromagnetic Nanowires: Application
  to Conductance and Spin Transfer Torques","10 pages, 5 figures; submitted to Physical Review B","Phys. Rev. B 70, 174424 (2004)","10.1103/PhysRevB.70.174424",,"cond-mat.mes-hall",,"  We present a circuit model to describe the electron transport through a
domain wall in a ferromagnetic nanowire. The domain wall is treated as a
coherent 4-terminal device with incoming and outgoing channels of spin up and
down and the spin-dependent scattering in the vicinity of the wall is modelled
using classical resistances. We derive the conductance of the circuit in terms
of general conductance parameters for a domain wall. We then calculate these
conductance parameters for the case of ballistic transport through the domain
wall, and obtain a simple formula for the domain wall magnetoresistance which
gives a result consistent with recent experiments. The spin transfer torque
exerted on a domain wall by a spin-polarized current is calculated using the
circuit model and an estimate of the speed of the resulting wall motion is
made.
","[{""version"":""v1"",""created"":""Thu, 3 Jun 2004 09:20:41 GMT""}]","2007-05-23"
"cond-mat/0406077","Liu C.-J.","C.-J. Liu, T.-W. Wu, L.-S. Hsu, C.-J. Su, C.-C. Wang, F.-S. Shieu","Transport properties of spiral carbon nanofiber mats containing Pd metal
  clusters using Pd2(dba)3 as catalyst","22 pages, 7 figures","Carbon, 42, 2625-2630 (2004)",,,"cond-mat.dis-nn",,"  We have grown spiral carbon nanofibers containing Pd metal clusters using the
Pd2(dba)3 catalyzed decomposition of gaseous acetylene on molecular sieves
(AlPO4-5) support. The microstructure and composition of the spiral carbon
nanofibers were examined by the powder x-ray diffractometer and transmission
electron microscope. The conductivity of the mat in the temperature range from
14 to 250 K could be described by the form of exp[-(T-1/4)]. The thermopower
shows a remarkably linear behavior down to 40 K, reminiscent of some conducting
polymers. The sign change of the thermopower suggests there exists more than
one type of charge carrier, which could be ascribed to the different types of
nanotube with various sizes of radius. The transport behavior of spiral carbon
nanofibers containing Pd metal clusters will be discussed in the framework of
the heterogeneous model.
","[{""version"":""v1"",""created"":""Thu, 3 Jun 2004 09:48:45 GMT""}]","2007-05-23"
"cond-mat/0406078","Liu C.-J.","C.-J. Liu, C.-S. Sheu, T.-W. Wu, L.-C. Huang, F. H. Hsu, H. D.Yang, G.
  V. M. Williams, and Chia-Jung C. Liu","Magnetothermopower and Magnetoresistivity of RuSr2Gd1-xLaxCu2O8 (x=0,
  0.1)","21 pages, 6 figures","PRB, 71, 014502 (2005)","10.1103/PhysRevB.71.014502",,"cond-mat.dis-nn cond-mat.supr-con",,"  We report measurements of magnetothermopower and magnetoresistivity as a
function of temperature on RuSr2Gd1-xLaxCu2O8 (x = 0, 0.1). The normal-state
thermopower shows a dramatic decrease after applying a magnetic field of 5 T,
whereas the resistivity shows only a small change after applying the same
field. Our results suggest that RuO2 layers are conducting and the magnetic
field induced decrease of the overall thermopower is caused by the decrease of
partial thermopower decrease associated with the spin entropy decrease of the
carriers in the RuO2 layers.
","[{""version"":""v1"",""created"":""Thu, 3 Jun 2004 09:54:48 GMT""},{""version"":""v2"",""created"":""Fri, 4 Feb 2005 03:06:30 GMT""}]","2009-11-10"
"cond-mat/0406079","Sergio Ciuchi","G. Rastelli and S. Ciuchi","Wigner crystallization in a polarizable medium","24 pages, 13 figures v1.3","Phys. Rev. B 71, 184303 (2005)","10.1103/PhysRevB.71.184303",,"cond-mat.str-el cond-mat.mes-hall cond-mat.supr-con quant-ph",,"  We present a variational study of the 2D and 3D Wigner crystal phase of large
polarons. The method generalizes that introduced by S. Fratini,P.\
Qu{\'{e}}merais [Mod. Phys. Lett. B {\bf 12} 1003 (1998)]. We take into account
the Wigner crystal normal modes rather than a single mean frequency in the
minimization procedure of the variational free energy. We calculate the
renormalized modes of the crystal as well as the charge polarization
correlation function and polaron radius. The solid phase boundaries are
determined via a Lindemann criterion, suitably generalized to take into account
the classical-to-quantum cross-over.
  In the weak electron-phonon coupling limit, the Wigner crystal parameters are
renormalized by the electron-phonon interaction leading to a stabilization of
the solid phase for low polarizability of the medium. Conversely, at
intermediate and strong coupling, the behavior of the system depends strongly
on the polarizability of the medium.
  For weakly polarizable media, a density crossover occurs inside the solid
phase when the renormalized plasma frequency approaches the phonon frequency.
At low density, we have a renormalized polaron Wigner crystal, while at higher
densities the electron-phonon interaction is weakened irrespective of the {\it
bare} electron-phonon coupling.
  For strongly polarizable media, the system behaves as a Lorentz lattice of
dipoles. The abrupt softening of the internal polaronic frequency predicted by
Fratini and Quemerais is observed near the actual melting point only at very
strong coupling, leading to a possible liquid polaronic phase for a wider range
of parameters.
","[{""version"":""v1"",""created"":""Thu, 3 Jun 2004 11:08:44 GMT""},{""version"":""v2"",""created"":""Tue, 15 Jun 2004 10:17:41 GMT""},{""version"":""v3"",""created"":""Fri, 25 Jun 2004 10:38:19 GMT""},{""version"":""v4"",""created"":""Tue, 15 Feb 2005 11:59:05 GMT""}]","2008-11-17"
"cond-mat/0406080","Hans Behringer","Michel Pleimling, Hans Behringer, Alfred Huller","Microcanonical scaling in small systems","8 pages, 3 figures included, to appear in Physics Letters A","Phys. Lett. A 328, 432-436 (2004)","10.1016/j.physleta.2004.06.046",,"cond-mat.stat-mech",,"  A microcanonical finite-size scaling ansatz is discussed. It exploits the
existence of a well-defined transition point for systems of finite size in the
microcanonical ensemble. The best data collapse obtained for small systems
yields values for the critical exponents in good agreement with other
approaches. The exact location of the infinite system critical point is not
needed when extracting critical exponents from the microcanonical finite-size
scaling theory.
","[{""version"":""v1"",""created"":""Thu, 3 Jun 2004 11:56:54 GMT""}]","2009-11-10"
"cond-mat/0406081","Hendrik Reich","Hendrik Reich and Matthias Schmidt","Replica Density Functional Study of One-Dimensional Hard Core Fluids in
  Porous Media","22 pages, 11 figures, to be published in JSP",,"10.1023/B:JOSS.0000041752.55138.0a",,"cond-mat.stat-mech",,"  A binary quenched-annealed hard core mixture is considered in one dimension
in order to model fluid adsorbates in narrow channels filled with a random
matrix. Two different density functional approaches are employed to calculate
adsorbate bulk properties and interface structure at matrix surfaces. The first
approach uses Percus' functional for the annealed component and an explicit
averaging over matrix configurations; this provides numerically exact results
for the bulk partition coefficient and for inhomogeneous density profiles. The
second approach is based on a quenched-annealed density functional whose
results we find to approximate very well those of the former over the full
range of possible densities. Furthermore we give a derivation of the underlying
replica density functional theory.
","[{""version"":""v1"",""created"":""Thu, 3 Jun 2004 11:58:54 GMT""}]","2009-11-10"
"cond-mat/0406082","Pinaki Majumdar","Sanjeev Kumar, Pinaki Majumdar","The Travelling Cluster Approximation for Strong Correlation Models of
  Lattice Fermions Coupled to Classical Fields","9 pages, two column revtex, 11 figures",,,,"cond-mat.str-el",,"  We suggest and implement a new Monte Carlo strategy for correlated models
involving fermions strongly coupled to classical degrees of freedom, with
accurate handling of quenched disorder as well. Current methods iteratively
diagonalise the full Hamiltonian for a system of N sites with computation time
tau_N proportional to N^4. This limits achievable sizes to N \sim 100. In our
method the energy cost of a Monte Carlo update is computed from the Hamiltonian
of a cluster, of size N_c, constructed around the reference site, and embedded
in the larger system. As MC steps sweep over the system, the cluster
Hamiltonian also moves, being reconstructed at each site where an update is
attempted. In this method tau_{N,N_c} is proportional to NN_c^3. Our results
are obviously exact when N_c=N, and converge quickly to this asymptote with
increasing N_c. The accuracy improves in systems where the effective disorder
seen by the fermions is large. We provide results of preliminary calculations
on the Holstein model and the Double Exchange model. The `locality' of the
energy cost, as evidenced by our results, suggests that several important but
inaccessible problems can now be handled with control.
","[{""version"":""v1"",""created"":""Thu, 3 Jun 2004 12:55:48 GMT""}]","2007-05-23"
"cond-mat/0406083","Pinaki Majumdar","B. Poornachandra Sekhar, Sanjeev Kumar, Pinaki Majumdar","The Many Electron Ground State of the Adiabatic Holstein Model in Two
  and Three Dimensions","Final version","Europhys. Lett. vol 68, 564 (2004)","10.1209/epl/i2004-10226-2",,"cond-mat.str-el",,"  We present the complete ground state phase diagram of the Holstein model in
two and three dimension considering the phonon variables to be classical. We
first establish the overall structure of the phase diagram by using exact
diagonalisation based Monte Carlo (ED-MC) on small lattices and then use a new
``travelling cluster'' approximation (TCA) for annealing the phonon degrees of
freedom on large lattices. The phases that emerge include a Fermi liquid (FL),
with no lattice distortions, an insulating polaron liquid (PL) at strong
coupling, and a charge ordered insulating (COI) phase around half- filling. The
COI phase is separated from the Fermi liquid by a regime of phase coexistence
whose width grows with increasing electron-phonon coupling. We provide results
on the electronic density of states, the COI order parameter, and the spatial
organisation of polaronic states, for arbitrary density and electron-phonon
coupling. The results highlight the crucial role of spatial correlations in
this strong coupling problem.
","[{""version"":""v1"",""created"":""Thu, 3 Jun 2004 13:00:08 GMT""},{""version"":""v2"",""created"":""Sun, 17 Apr 2005 06:44:55 GMT""}]","2009-11-10"
"cond-mat/0406084","Pinaki Majumdar","Sanjeev Kumar, Pinaki Majumdar","Singular Effect of Disorder on Electronic Transport in Strong Coupling
  Electron-Phonon Systems","Final version","Phys. Rev. Lett. vol 94, 136601 (2005)","10.1103/PhysRevLett.94.136601",,"cond-mat.str-el",,"  We solve the disordered Holstein model in three dimensions considering the
phonon variables to be classical. After mapping out the phases of the `clean'
strong coupling problem, we focus on the effect of disorder at strong
electron-phonon (EP) coupling. The presence of even weak disorder (i)
enormously enhances the resistivity (\rho) at T=0, simultaneously suppressing
the density of states at the Fermi level, (ii) suppresses the temperature
dependent increase of \rho, and (iii) leads to a regime with d\rho/dT <0. We
locate the origin of these anomalies in the disorder induced tendency towards
polaron formation, and the associated suppression in effective carrier density
and mobility. These results, explicitly at `metallic' density, are of direct
relevance to disordered EP materials like covalent semiconductors, the
manganites, and to anomalous transport in the A-15 compounds.
","[{""version"":""v1"",""created"":""Thu, 3 Jun 2004 13:03:22 GMT""},{""version"":""v2"",""created"":""Wed, 9 Mar 2005 12:42:47 GMT""},{""version"":""v3"",""created"":""Sun, 17 Apr 2005 06:40:13 GMT""}]","2009-11-10"
