"math/0401210","Hao Fang","Hao Fang (CIMS, Nyu)","On a multi-particle Moser-Trudinger Inequality",,,,,"math.DG math.AP",,"  We verify a conjecture of Gillet-Soul\'{e}. We prove that the determinant of
the Laplacian on a line bundle over $\mathbb{CP}^{1}$ is always bounded from
above. This can also be viewed as a multi-particle generalization of the
Moser-Trudinger Inequality. Furthermore, we conjecture that this functional
achieves its maximum at the canonical metric. We give some evidence for this
conjecture, as well as links to other fields of analysis.
","[{""version"":""v1"",""created"":""Fri, 16 Jan 2004 22:00:31 GMT""}]","2007-05-23"
"math/0401211","Lewis Bowen","Lewis Bowen","An Isometry Between Measure Homology and Singular Homology","This paper has been withdrawn due to an error. A correct proof was
  obtained by Clara Loeh in her thesis. See: math.AT/0504103.",,,,"math.GT",,"  In Thurston's notes, he gives two different definitions of the Gromov norm
(also called simplicial volume) of a manifold and states that they are equal
but does not prove it. Gromov proves it in the special case of hyperbolic
manifolds as a consequence of his proof that simplicial volume is proportional
to volume. We give a proof for all differentiable manifolds.
  This version corrects a few typos in an earlier version and formally proves
the theorem for differentiable manifolds rather than locally finite simplicial
complexes (but very few actual changes have been made).
","[{""version"":""v1"",""created"":""Sat, 17 Jan 2004 04:40:59 GMT""},{""version"":""v2"",""created"":""Sat, 7 Feb 2004 20:15:12 GMT""},{""version"":""v3"",""created"":""Mon, 15 Mar 2010 02:04:23 GMT""}]","2010-03-16"
"math/0401212","Paul Seidel","Paul Seidel","Exact Lagrangian submanifolds of $T^*S^n$ and the graded Kronecker
  quiver",,,,,"math.SG",,"  This short and fairly informal note is an attempt to explain how methods of
homological algebra may be brought to bear on problems in symplectic geometry.
We do this by looking at a familiar sample question, which is that of the
topology of Lagrangian submanifolds in the cotangent bundle of the sphere.
","[{""version"":""v1"",""created"":""Sat, 17 Jan 2004 05:01:00 GMT""}]","2016-09-07"
"math/0401213","Joerg Winkelmann","Joerg Winkelmann","A Lie Group without universal covering","LaTeX, 2 pages. Revised version. A small, but crucial mistake in the
  formula defining the group structure needed to be corrected",,,,"math.GR",,"  We present an example of a disconnected Lie group for which there is no
universal covering (as Lie group).
","[{""version"":""v1"",""created"":""Sat, 17 Jan 2004 15:08:29 GMT""},{""version"":""v2"",""created"":""Sun, 25 Jan 2004 21:33:34 GMT""}]","2007-05-23"
"math/0401214","Xiao-Wu Chen","Xiao-Wu Chen, Hua-Lin Huang, Pu Zhang","Dual Gabriel Theorem with applications","23 pages","Science in China, Series A Mathematics, (2006) Vol. 49 (1), 9-26.",,,"math.RT math.RA",,"  We introduce the quiver of a bicomodule over a cosemisimple coalgebra.
Applying this to the coradical $C_0$ of an arbitrary coalgebra $C$, we give an
alternative definition of the Gabriel quiver of $C$, and then show that it
coincides with the known $\operatorname {Ext}$ quiver of $C$ and the link
quiver of $C$. The dual Gabriel theorem for a coalgebra with separable
coradical is obtained, which generalizes the corresponding result for a pointed
coalgebra. We also give a new description of $C_1$ of any coalgebra $C$, which
can be regarded as a generalization of the first part of the well-known
Taft-Wilson Theorem for pointed coalgebras. As applications, we give a
characterization of locally finite coalgebras via their Gabriel quivers, and a
property of the Gabriel quiver of a quasi-coFrobenius coalgebra.
","[{""version"":""v1"",""created"":""Sat, 17 Jan 2004 15:21:43 GMT""},{""version"":""v2"",""created"":""Thu, 22 Jan 2004 09:58:56 GMT""},{""version"":""v3"",""created"":""Tue, 28 Dec 2004 03:11:54 GMT""}]","2007-05-23"
"nlin/0401022","Gemunu H. Gunaratne","S. Hu, D. I. Goldman, D. J. Kouri, D. K. Hoffman, H. L. Swinney, G. H.
  Gunaratne","Stages of Relaxation of Patterns and the Role of Stochasticity on the
  Final Stage","20 pages, 10 figures",,,,"nlin.PS",,"  The disorder function formalism [Gunaratne et.al., Phys. Rev. E, {\bf 57},
5146 (1998)]^M is used to show that pattern relaxation in an experiment on a
vibrated layer of brass beads^M occurs in three distinct stages. During stage
I, all lengthscales associated with ^M moments of the disorder grow at a single
universal rate, given by $L(t) \sim t^{0.5}$. In stage II, pattern evolution is
non-universal and includes a range of growth indices. Relaxation in the final
stage is characterized by a single, non-universal index. We use analysis of
patterns from the Swift-Hohenberg equation to argue that mechanisms that
underlie the observed pattern evolution are linear spatio-temporal dynamics
(stage I), non-linear saturation (stage II), and stochasticity (stage III)
","[{""version"":""v1"",""created"":""Fri, 16 Jan 2004 19:48:04 GMT""}]","2007-05-23"
"nlin/0401023","Mason A. Porter","Mason A. Porter, P. G. Kevrekidis, and B. A. Malomed","Resonant and Non-Resonant Modulated Amplitude Waves for Binary
  Bose-Einstein Condensates in Optical Lattices","16 pages, 4 figures (some of which have multiple parts), to appear in
  Physica D; streamlined paper; added some references and discussion concerning
  experimental realizations of this work; higher-resolution copies of a couple
  figures are available on the version of the document downloadable from
  http://www.math.gatech.edu/~mason/",,"10.1016/j.physd.2004.05.002",,"nlin.CD cond-mat.soft nlin.PS physics.atom-ph",,"  We consider a system of two Gross-Pitaevskii (GP) equations, in the presence
of an optical-lattice (OL) potential, coupled by both nonlinear and linear
terms. This system describes a Bose-Einstein condensate (BEC) composed of two
different spin states of the same atomic species, which interact linearly
through a resonant electromagnetic field. In the absence of the OL, we find
plane-wave solutions and examine their stability. In the presence of the OL, we
derive a system of amplitude equations for spatially modulated states which are
coupled to the periodic potential through the lowest-order subharmonic
resonance. We determine this averaged system's equilibria, which represent
spatially periodic solutions, and subsequently examine the stability of the
corresponding solutions with direct simulations of the coupled GP equations. We
find that symmetric (equal-amplitude) and asymmetric (unequal-amplitude)
dual-mode resonant states are, respectively, stable and unstable. The unstable
states generate periodic oscillations between the two condensate components,
which is possible only because of the linear coupling between them. We also
find four-mode states, but they are always unstable. Finally, we briefly
consider ternary (three-component) condensates.
","[{""version"":""v1"",""created"":""Fri, 16 Jan 2004 22:49:26 GMT""},{""version"":""v2"",""created"":""Tue, 30 Mar 2004 21:17:06 GMT""},{""version"":""v3"",""created"":""Tue, 4 May 2004 16:48:28 GMT""}]","2009-11-10"
"nucl-ex/0401019","Frank Maas","A4 Collaboration: F. E. Maas (1), P. Achenbach (1), K. Aulenbacher
  (1), S. Baunack (1), L. Capozza (1), J. Diefenbach (1), K. Grimm (1), Y. Imai
  (1), T. Hammel (1), D. von Harrach (1), E.-M. Kabuss (1), R. Kothe (1), J. H.
  Lee (1), A. Lorente (1), A. Lopes Ginja (1), L. Nungesser (1), E. Schilling
  (1), G. Stephan (1), C. Weinrich (1), I. Altarev (2), J. Arvieux (3), B.
  Collin (3), R. Frascaria (3), M. Guidal (3), R. Kunne (3), D. Marchand (3),
  M. Morlet (3), S. Ong (3), J. van de Wiele (3), S. Kowalski (4), B. Plaster
  (4), R. Suleiman (4), S. Taylor (4)","Measurement of Strange Quark Contributions to the Nucleon's Form Factors
  at Q^2=0.230 (GeV/c)^2","5 pages, 3 figures, submitted to Phys. Rev. Letters on Dec 11, 2003","Phys.Rev.Lett.93:022002,2004","10.1103/PhysRevLett.93.022002",,"nucl-ex",,"  We report on a measurement of the parity-violating asymmetry in the
scattering of longitudinally polarized electrons on unpolarized protons at a
$Q^2$ of 0.230 (GeV/c)^2 and a scattering angle of \theta_e = 30^o - 40^o.
Using a large acceptance fast PbF_2 calorimeter with a solid angle of
\Delta\Omega = 0.62 sr the A4 experiment is the first parity violation
experiment to count individual scattering events. The measured asymmetry is
A_{phys} =(-5.44 +- 0.54_{stat} +- 0.27_{\rm sys}) 10^{-6}. The Standard Model
expectation assuming no strangeness contributions to the vector form factors is
$A_0=(-6.30 +- 0.43) 10^{-6}$. The difference is a direct measurement of the
strangeness contribution to the vector form factors of the proton. The
extracted value is G^s_E + 0.225 G^s_M = 0.039 +- 0.034 or F^s_1 + 0.130 F^s_2
= 0.032 +- 0.028.
","[{""version"":""v1"",""created"":""Fri, 16 Jan 2004 16:57:02 GMT""}]","2008-11-26"
"nucl-th/0401036","Nicolas Michel","N. Michel, W. Nazarewicz, M. Ploszajczak, and J. Rotureau","Gamow Shell-Model Description of Weakly Bound and Unbound Nuclear States","13 pages, 2 figures, presented by N. Michel at the XXVII Symposium On
  Nuclear Physics, Taxco, Guerrero, Mexico, January 5-8 2004","Rev. Mex. Fis., Vol. 50, Suppl. 2, (2004) 74","10.1140/epjad/i2005-06-136-7",,"nucl-th",,"  Recently, the shell model in the complex k-plane (the so-called Gamow Shell
Model) has been formulated using a complex Berggren ensemble representing bound
single-particle states, single-particle resonances, and non-resonant continuum
states. In this framework, we shall discuss binding energies and energy spectra
of neutron-rich helium and lithium isotopes. The single-particle basis used is
that of the Hartree-Fock potential generated self-consistently by the
finite-range residual interaction.
","[{""version"":""v1"",""created"":""Fri, 16 Jan 2004 20:14:48 GMT""},{""version"":""v2"",""created"":""Sun, 18 Jan 2004 23:44:25 GMT""}]","2015-06-26"
"nucl-th/0401037","Ariel Chernomoretz","A. Chernomoretz, F. Gulminelli, M. J. Ison, C. O. Dorso","Enhancement of kinetic energy fluctuations due to expansion","6 pages, 4 figures","Phys.Rev. C69 (2004) 034610","10.1103/PhysRevC.69.034610",,"nucl-th",,"  Global equilibrium fragmentation inside a freeze out constraining volume is a
working hypothesis widely used in nuclear fragmentation statistical models. In
the framework of classical Lennard Jones molecular dynamics, we study how the
relaxation of the fixed volume constraint affects the posterior evolution of
microscopic correlations, and how a non-confined fragmentation scenario is
established. A study of the dynamical evolution of the relative kinetic energy
fluctuations was also performed. We found that asymptotic measurements of such
observable can be related to the number of decaying channels available to the
system at fragmentation time.
","[{""version"":""v1"",""created"":""Fri, 16 Jan 2004 23:24:27 GMT""}]","2009-11-10"
"physics/0401077","Michael C. Parker","Michael C. Parker (1), Stuart D. Walker (2) ((1) Fujitsu Laboratories
  of Europe Ltd., (2) University of Essex)","Is Computation Reversible?","8 pages, 2 figures",,,,"physics.class-ph physics.gen-ph",,"  Recent investigations into the physical nature of information and fundamental
limits to information transmission have revealed questions such as the
possibility of superluminal data transfer or not; and whether reversible
computation (information processing) is feasible. In some respects these
uncertainties stem from the determination of whether information is inherent in
points of non-analyticity (discontinuities) or smoother functions. The close
relationship between information and entropy is also well known, e.g.
Brillouin's concept of negentropy (negative entropy) as a measure for
information. Since the leading edge of a step-discontinuity propagates in any
dispersive medium at the speed of light in vacuum as a precursor to the main
body of the dispersed pulse, we propose in this paper to treat information as
being intrinsic to points of non-analyticity (discontinuities). This allows us
to construct a theory addressing these dilemmas in a fashion consistent with
causality, and the fundamental laws of thermodynamics. A consequence of our
proposition is that the movement of information is always associated with the
dissipation of heat, and therefore that the concept of reversible classical
computation is not tenable.
","[{""version"":""v1"",""created"":""Fri, 16 Jan 2004 17:03:25 GMT""}]","2007-05-23"
"physics/0401078","Francisco J. Beron-Vera","F. J. Beron-Vera, M. J. Olascoaga and J. Zavala-Garay","Linear waves and baroclinic instability in an inhomogeneous-density
  layered primitive-equation ocean model","To appear in ICTAM04 Abstract Book and CD-ROM Proceedings, ISBN
  83-89687-01-1, IPPT PAN, Warsaw",,,,"physics.ao-ph",,"  We consider a multilayer generalization of Ripa's inhomogeneous-density
single-layer primitive-equation model. In addition to vary arbitrarily in
horizontal position and time, the horizontal velocity and buoyancy fields are
allowed to vary linearly with depth within each layer of the model. Preliminary
results on linear waves and baroclinic instability suggest that a configuration
involving a few layers may set the basis for a quite accurate and numerically
efficient ocean model.
","[{""version"":""v1"",""created"":""Fri, 16 Jan 2004 18:23:10 GMT""},{""version"":""v2"",""created"":""Fri, 11 Jun 2004 19:11:17 GMT""}]","2007-05-23"
"physics/0401079","Todd M. Squires","Todd M. Squires","Optimizing the vertebrate vestibular semicircular canal: could we
  balance any better?","4 pages, 3 figures",,"10.1103/PhysRevLett.93.198106",,"physics.flu-dyn physics.bio-ph q-bio.TO",,"  The fluid-filled semicircular canals (SCCs) of the vestibular system are used
by all vertebrates to sense angular rotation. Despite masses spanning seven
decades, all mammalian SCCs are nearly the same size. We propose that the SCC
represents a sensory organ that evolution has `optimally designed'. Four
geometric parameters are used to characterize the SCC, and `building materials'
of given physical properties are assumed. Identifying physical and
physiological constraints on SCC operation, we find that the most sensitive SCC
has dimensions consistent with available data.
","[{""version"":""v1"",""created"":""Fri, 16 Jan 2004 21:42:10 GMT""},{""version"":""v2"",""created"":""Wed, 12 May 2004 17:11:23 GMT""}]","2009-11-10"
"physics/0401080","Ilya Shkrob","Myran C. Sauer, R. A. Crowell, Ilya A. Shkrob (ANL)","Electron Photodetachment from Aqueous Anions. I. Quantum Yields for
  Generation of Hydrated Electron by 193 and 248 nm Laser Photoexcitation of
  Miscellaneous Inorganic Anions","41 page, 6 figures; supplement: 3 pages, 12 figures; to be submitted
  to J. Phys. Chem. A",,"10.1021/jp049722t",,"physics.chem-ph",,"  Time resolved transient absorption spectroscopy has been used to determine
quantum yields for electron photodetachment in 193 nm and (where possible) 248
nm laser excitation of miscellaneous aqueous anions, including
hexacyanoferrate(II), sulfate, sulfite, halide anions (Cl-, Br-, and I-),
pseudohalide anions (OH-, HS-, CNS-), and several common inorganic anions for
which no quantum yields have been reported heretofore: SO3=, NO2-, NO3-, ClO3-
and ClO4-. Molar extinction coefficients for these anions and photoproducts of
electron detachment from these anions at the excitation wavelengths were also
determined. These results are discussed in the context of recent ultrafast
kinetic studies and compared with the previous data obtained by product
analyses. We suggest using electron photodetachment from the aqueous halide and
pseudohalide anions as actinometric standard for time-resolved studies of
aqueous photosystems in the UV.
","[{""version"":""v1"",""created"":""Fri, 16 Jan 2004 23:00:54 GMT""}]","2016-09-28"
"physics/0401081","Christian Buth","Christian Buth, Robin Santra, Lorenz S. Cederbaum","Non-Hermitian Rayleigh-Schroedinger Perturbation Theory","10 pages, 1 figure, RevTeX4.2, erratum added","Phys. Rev. A 69, 032505 (2004) [9 pages]","10.1103/PhysRevA.69.032505",,"physics.chem-ph physics.atom-ph","http://arxiv.org/licenses/nonexclusive-distrib/1.0/","  We devise a non-Hermitian Rayleigh-Schroedinger perturbation theory for the
single- and the multireference case to tackle both the many-body problem and
the decay problem encountered, for example, in the study of electronic
resonances in molecules. A complex absorbing potential (CAP) is employed to
facilitate a treatment of resonance states that is similar to the
well-established bound-state techniques. For the perturbative approach, the
full CAP-Schroedinger Hamiltonian, in suitable representation, is partitioned
according to the Epstein-Nesbet scheme. The equations we derive in the
framework of the single-reference perturbation theory turn out to be identical
to those obtained by a time-dependent treatment in Wigner-Weisskopf theory. The
multireference perturbation theory is studied for a model problem and is shown
to be an efficient and accurate method. Algorithmic aspects of the integration
of the perturbation theories into existing ab initio programs are discussed,
and the simplicity of their implementation is elucidated.
","[{""version"":""v1"",""created"":""Sat, 17 Jan 2004 13:12:39 GMT""},{""version"":""v2"",""created"":""Sun, 8 Jan 2023 18:28:54 GMT""}]","2023-01-10"
"q-bio/0401022","Yisroel Brumer","Yisroel Brumer and Eugene I. Shakhnovich","A Selective Advantage for Conservative Viruses","4 pages, 2 figures",,"10.1103/PhysRevE.71.031903",,"q-bio.PE cond-mat.soft",,"  In this letter we study the full semi-conservative treatment of a model for
the co-evolution of a virus and an adaptive immune system. Regions of viability
are calculated for both conservatively and semi-conservatively replicating
viruses interacting with a realistic semi-conservatively replicating immune
system. The conservative virus is found to have a selective advantage in the
form of an ability to survive in regions with a wider range of mutation rates
than its semi-conservative counterpart. This may help explain the existence of
a rich range of viruses with conservatively replicating genomes, a trait which
is found nowhere else in nature.
","[{""version"":""v1"",""created"":""Fri, 16 Jan 2004 18:12:39 GMT""}]","2009-11-10"
"q-bio/0401023","Roger Guimera","J. Camacho, R. Guimera, D. B. Stouffer, and L. A. N. Amaral","Quantitative patterns in the structure of model and empirical food webs","39 pages, 20 figures",,,,"q-bio.PE",,"  We analyze the properties of model food webs and of fifteen community food
webs from a variety of environments. We first perform a theoretical analysis of
the niche model of Williams and Martinez. We derive analytical expressions for
the distributions of species' number of prey, number of predators, and total
number of trophic links and find that they follow universal functional forms.
We also derive expressions for a number of other biologically relevant
parameters, including the fraction of top, intermediate, basal, and cannibal
species, the standard deviations of generality and vulnerability, the
correlation coefficient between species' number of prey and number of
predators, and assortativity. We show that our findings are robust under rather
general conditions. We then use our analytical predictions as a guide to the
analysis of fifteen of the most complete empirical food webs available. We
uncover quantitative unifying patterns that describe the properties of the
model food webs and most of the trophic webs considered. Our results support a
strong new hypothesis that the empirical distributions of number of prey and
number of predators follow universal functional forms that, without free
parameters, match our analytical predictions. Further, we find that the
empirically observed correlation coefficient, assortativity, and fraction of
cannibal species are consistent with our analytical expressions and simulations
of the niche model. Finally, we show that the average distance between nodes
and the average clustering coefficient show a high degree of regularity for
both the empirical data and simulations of the niche model. Our findings
suggest that statistical physics concepts such as scaling and universality may
be useful in the description of natural ecosystems.
","[{""version"":""v1"",""created"":""Fri, 16 Jan 2004 23:11:04 GMT""}]","2007-05-23"
"q-bio/0401024","Thimo Rohlf","Thimo Rohlf and Stefan Bornholdt","Morphogenesis by coupled regulatory networks","13 pages revTex, 17 figures (2 color)",,,,"q-bio.MN cond-mat.dis-nn cond-mat.stat-mech",,"  Based on a recently proposed non-equilibrium mechanism for spatial pattern
formation [cond-mat/0312366] we study how morphogenesis can be controlled by
locally coupled discrete dynamical networks, similar to gene regulation
networks of cells in a developing multicellular organism. As an example we
study the developmental problem of domain formation and proportion regulation
in the presence of noise and cell flow. We find that networks that solve this
task exhibit a hierarchical structure of information processing and are of
similar complexity as developmental circuits of living cells. A further focus
of this paper is a detailed study of noise-induced dynamics, which is a major
ingredient of the control dynamics in the developmental network model. A master
equation for domain boundary readjustments is formulated and solved for the
continuum limit. Evidence for a first order phase transition in equilibrium
domain size at vanishing noise is given by finite size scaling. A second order
phase transition at increased cell flow is studied in a mean field
approximation. Finally, we discuss potential applications.
","[{""version"":""v1"",""created"":""Fri, 16 Jan 2004 23:12:38 GMT""}]","2007-05-23"
"quant-ph/0401092","Boris Samsonov","Boris F Samsonov and Javier Negro","Darboux transformations of the Jaynes-Cummings Hamiltonian","15 pages","J. Phys. A: Math. Gen. 37 (2004) 10115-10127","10.1088/0305-4470/37/43/007",,"quant-ph",,"  A detailed analysis of matrix Darboux transformations under the condition
that the derivative of the superpotential be self-adjoint is given. As a
onsequence, a class of the symmetries associated to Schr\""odinger matrix
Hamiltonians is characterized. The applications are oriented towards the
Jaynes-Cummings eigenvalue problem, so that exactly solvable $2\times 2$ matrix
Hamiltonians of the Jaynes-Cummings type are obtained. It is also established
that the Jaynes-Cummings Hamiltonian is a quadratic function of a Dirac-type
Hamiltonian.
","[{""version"":""v1"",""created"":""Fri, 16 Jan 2004 18:00:25 GMT""}]","2009-11-10"
"quant-ph/0401093","Boris Samsonov","Boris F. Samsonov","Darboux transformations of coherent states of the time-dependent
  singular oscillator","13 pages","J. Phys. A: Math. Gen. 37 (2004) 10273-10286","10.1088/0305-4470/37/43/017",,"quant-ph",,"  Darboux transformation of both Barut-Girardello and Perelomov coherent states
for the time-dependent singular oscillator is studied. In both cases the
measure that realizes the resolution of the identity operator in terms of
coherent states is found and corresponding holomorphic representation is
constructed. For the particular case of a free particle moving with a fixed
value of the angular momentum equal to two it is shown that Barut-Giriardello
coherent states are more localized at the initial time moment while the
Perelomov coherent states are more stable with respect to time evolution. It is
also illustrated that Darboux transformation may keep unchanged this different
time behavior.
","[{""version"":""v1"",""created"":""Fri, 16 Jan 2004 18:00:38 GMT""}]","2009-11-10"
"quant-ph/0401094","Sonia Schirmer","Allan I Solomon and Sonia G Schirmer","Dissipative Quantum Control","Contribution to Proceedings of \emph{ICCSUR 8} held in Puebla,
  Mexico, July 2003, based on talk presented by Allan Solomon (ca 8 pages,
  latex, 1 latex figure, 2 pdf figures converted to eps, appear to cause some
  trouble)","In Proceedings ICCSUR 8: 8th Int'l Conference on Squeezed States
  and Uncertainty relations, ISBN 1-58949-040-1 (Rinton Press, NJ, USA, 2003),
  pp 393-399",,,"quant-ph",,"  Nature, in the form of dissipation, inevitably intervenes in our efforts to
control a quantum system. In this talk we show that although we cannot, in
general, compensate for dissipation by coherent control of the system, such
effects are not always counterproductive; for example, the transformation from
a thermal (mixed) state to a cold condensed (pure state) can only be achieved
by non-unitary effects such as population and phase relaxation.
","[{""version"":""v1"",""created"":""Fri, 16 Jan 2004 21:57:52 GMT""}]","2007-05-23"
