"cond-mat/0401309","Serguei Brazovskii","Serguei Brazovskii","Summary for Theory of the Ferroelectric Phase in Organic Conductors in
  Relation to Experiments","To be published in J. de Physique IV, Proceedings of ISCOM-2003,
  http://www.univ-angers.fr/asso/iscom2003",,,,"cond-mat.str-el",,"  Mysterious high temperature structureless transitions in (TMTTF)2X compounds
have been discovered in mid 80's (Coulon, Lawersanne,vet al), but left
unexplained and abandoned, together with other warnings from structural effects
(Moret, Pouget, et al), with dramatic consequences for the whole field.
Recently their nature has been identified as the ferroelectricity (Nad,
Monceau, et al) and, more generally, the charge disproportionation (Brown, et
al). New phenomena unify an unusual variety of concepts: ferroelectricity of
good conductors, structural instability towards Mott- Hubbard state, Wigner
crystallization in a dense electronic system, ordered 4kF density wave,
richness of physics of solitons, interplay of structural and electronic
symmetries. The ferroelectric state gives rise to several types of solitons
carrying electronic charge, a noninteger charge, spin or both spin and charge
in special cases. They are clearly observed via conductivity, electric and
magnetic susceptibilities. Solitons are challenging for optics where they
already seem to determine the pseudogap in absorption. Various features also
appear, or are expected, from collective electronic and coupled electron-phonon
modes. REFERENCES: cond-mat/0012237 cond-mat/0304076 cond-mat/0304483
cond-mat/0306006
","[{""version"":""v1"",""created"":""Sat, 17 Jan 2004 10:12:22 GMT""},{""version"":""v2"",""created"":""Wed, 21 Jan 2004 10:01:50 GMT""}]","2007-05-23"
"cond-mat/0401310","Andre Krzywicki","Z. Burda, J. Jurkiewicz, A. Krzywicki","Perturbing General Uncorrelated Networks","7 pages, 7 eps figures, 2-column revtex format, references added","Phys. Rev. E 70, 026106 (2004)","10.1103/PhysRevE.70.026106","LPT-Orsay 04/03","cond-mat.dis-nn",,"  This paper is a direct continuation of an earlier work, where we studied
Erd\""os-R\'enyi random graphs perturbed by an interaction Hamiltonian favouring
the formation of short cycles. Here, we generalize these results. We keep the
same interaction Hamiltonian but let it act on general graphs with uncorrelated
nodes and an arbitrary given degree distribution. It is shown that the results
obtained for Erd\""os-R\'enyi graphs are generic, at the qualitative level.
However, scale-free graphs are an exception to this general rule and exhibit a
singular behaviour, studied thoroughly in this paper, both analytically and
numerically.
","[{""version"":""v1"",""created"":""Sat, 17 Jan 2004 13:51:51 GMT""},{""version"":""v2"",""created"":""Fri, 27 Aug 2004 10:09:09 GMT""}]","2009-11-10"
"gr-qc/0401076","Matthew D. Duez","Matthew D. Duez, Stuart L. Shapiro, and Hwei-Jang Yo (University of
  Illinois)","Relativistic Hydrodynamic Evolutions with Black Hole Excision","17 pages, 14 figures, submitted to PRD","Phys.Rev. D69 (2004) 104016","10.1103/PhysRevD.69.104016",,"gr-qc astro-ph",,"  We present a numerical code designed to study astrophysical phenomena
involving dynamical spacetimes containing black holes in the presence of
relativistic hydrodynamic matter. We present evolutions of the collapse of a
fluid star from the onset of collapse to the settling of the resulting black
hole to a final stationary state. In order to evolve stably after the black
hole forms, we excise a region inside the hole before a singularity is
encountered. This excision region is introduced after the appearance of an
apparent horizon, but while a significant amount of matter remains outside the
hole. We test our code by evolving accurately a vacuum Schwarzschild black
hole, a relativistic Bondi accretion flow onto a black hole, Oppenheimer-Snyder
dust collapse, and the collapse of nonrotating and rotating stars. These
systems are tracked reliably for hundreds of M following excision, where M is
the mass of the black hole. We perform these tests both in axisymmetry and in
full 3+1 dimensions. We then apply our code to study the effect of the stellar
spin parameter J/M^2 on the final outcome of gravitational collapse of rapidly
rotating n = 1 polytropes. We find that a black hole forms only if J/M^2<1, in
agreement with previous simulations. When J/M^2>1, the collapsing star forms a
torus which fragments into nonaxisymmetric clumps, capable of generating
appreciable ``splash'' gravitational radiation.
","[{""version"":""v1"",""created"":""Fri, 16 Jan 2004 21:19:36 GMT""}]","2009-11-10"
"gr-qc/0401077","Jian Qi Shen","Jian Qi Shen","Comoving suppression mechanism and cosmological constant problem","4 pages, Latex",,,,"gr-qc",,"  In this paper, we assume that the observer is fixed in a comoving frame of
reference with $g_{00}=\frac{\lambda}{\Lambda}$, where $\lambda$ and $\Lambda$
denote the comoving parameter and the cosmological constant, respectively. By
using the {\it comoving suppression mechanism} and {\it Mach's principle} (the
latter of which is used to determine the comoving parameter $\lambda$), we
calculate the vacuum energy density of quantum fluctuation field in the
above-mentioned comoving frame of reference. It is shown that in such a
comoving frame of reference, the cosmological constant will greatly decrease by
many orders of magnitude (if Mach's principle is applied to this calculation,
then it will be shown that $\Lambda$ is reduced by about 120 orders of
magnitude). Additionally, we briefly discuss the related topics such as the
varying observed speed of light ($\frac{{\rm d}c}{{\rm d}t}={\mathcal
O}(10^{-9}{\rm m/s}^{2})$) and the mystery of anomalous acceleration ($\sim
10^{-9}{\rm m/s}^{2}$) acquired by the Pioneer 10/11, Galileo and Ulysses
spacecrafts.
","[{""version"":""v1"",""created"":""Sat, 17 Jan 2004 09:08:17 GMT""}]","2007-05-23"
"gr-qc/0401078","Sun Myong Kim","Sung Ku Kim, Sun Myong Kim, Chaiho Rim, Jae Hyung Yee","Propagation of Light in Doubly Special Relativity","11 pages, LaTeX","J.Korean Phys.Soc. 45 (2004) 1435-1440",,,"gr-qc hep-th",,"  In an attempt to clarify what is the velocity of a particle in doubly special
relativity, we solve Maxwell's equations invariant under the position-space
nonlinear Lorentz transformation proposed by Kimberly, Magueijo, and Medeiros.
We show that only the amplitude of the Maxwell wave, not the phase, is affected
by the nonlinearity of the transformation. Thus, although the Maxwell wave
appears to have infinitely large energy near the Planck time, the wave velocity
is the same as the conventional light velocity. Surprisingly, the velocity of
the Maxwell wave is not the same as the maximum signal velocity determined by
the null geodesic condition, which is infinitely large near the Planck time and
monotonically decreases in time to the conventional light velocity when time
approaches infinity. This implies that, depending on the position of the
particle in question, the light cone determined by Maxwell's equations may be
inside or outside the null cone determined by the null geodesic equation, which
may lead to the causality problem.
","[{""version"":""v1"",""created"":""Sat, 17 Jan 2004 10:49:18 GMT""},{""version"":""v2"",""created"":""Wed, 12 May 2004 12:36:41 GMT""},{""version"":""v3"",""created"":""Tue, 7 Dec 2004 01:17:54 GMT""}]","2007-05-23"
"hep-ex/0401028","Haleh Hadavand","B. Aubert, et al, BABAR Collaboration","Measurement of the B^+/B^0 Production Ratio from the Upsilon(4S) Meson
  using B^+ -> J/psi K^+ and B^0 -> J/psi K^{0}_{S} Decays","8 pages, 2 figures, submitted to Phys. Rev. D (Rapid Communications)","Phys.Rev.D69:071101,2004","10.1103/PhysRevD.69.071101","PUB-03/046","hep-ex",,"  We report a measurement of the production ratio of charged and neutral B
mesons from Upsilon(4S) decays based on the ratio of efficiency-corrected
yields for the charmonium modes J/psi K^+ and J/psi K^{0}_{S} with 81.9 fb^-1
of data collected with the BABAR detector on the Upsilon(4S) resonance at
10.580 GeV. We find a value of 1.006 +/- 0.036 (stat) +/- 0.031 (sys) for the
ratio R^{+/0}=Gamma(Upsilon(4S) -> B^+ B^-)/Gamma(Upsilon(4S)->B^0 B^0bar).
","[{""version"":""v1"",""created"":""Fri, 16 Jan 2004 23:33:15 GMT""}]","2008-11-26"
"hep-ph/0401122","Boris Levchenko","B. B. Levchenko","Kinematic selection criteria in a new resonance searches: Application to
  pentaquark states","11 pages, 5 figures, 1 table","Advances in High Energy Physics,Vol. 2012 (2012), Article ID
  502179","10.1155/2012/502179","SINP-MSU-2006-12/811","hep-ph",,"  In this note I recall some features of two-body decay kinematics which can be
effectively applied, in particular, in experimental searches for pentaquark
states.
","[{""version"":""v1"",""created"":""Fri, 16 Jan 2004 19:09:43 GMT""},{""version"":""v2"",""created"":""Sat, 17 Jan 2004 14:17:33 GMT""}]","2012-08-08"
"hep-ph/0401123","M. E. Carrington","M.E. Carrington","The 4PI Effective Action for \phi^4 Theory","13 pages","Eur.Phys.J. C35 (2004) 383-392",,,"hep-ph",,"  We work with $\phi^4$ theory and study the 4PI effective action at 3-loop
order. We discuss the relationship between the equations of motion obtained by
taking functional derivatives of the effective action with respect to the
variational parameters, and the Schwinger-Dyson (SD) equations. We show that
the equation obtained by differentiating with respect to the 2-point function
is identical to the SD equation for the 2-point function; differentiating with
respect to the 3-point function reproduces the SD equation for the 3-point
function, up to 1-loop order; and differentiating with respect to the 4-point
function reproduces the SD equation for the 4-point function, at the tree
level. These results establish a connection between two techniques for
performing non-equilibrium calculations, and provide a starting place for a
study of the gauge dependence of quantities derived from an $n$PI effective
action.
","[{""version"":""v1"",""created"":""Fri, 16 Jan 2004 20:26:28 GMT""}]","2007-05-23"
"hep-ph/0401124","Ralf Lehnert","Ralf Lehnert","The Lorentz-violating Standard-Model Extension","Invited talk presented at BEYOND 03, Castle Ringberg, Tegernsee,
  Germany, June 2003",,,,"hep-ph",,"  Quantum-gravity effects are expected to be suppressed by the Planck mass. For
experimental progress it is therefore important to identify potential
signatures from Planck-scale physics that are amenable to ultrahigh-precision
tests. It is argued that minuscule violations of Lorentz and CPT symmetry are
candidate signals. In addition, theoretical and experimental aspects of the
Standard-Model Extension, which describes the emergent low-energy effects, are
discussed.
","[{""version"":""v1"",""created"":""Fri, 16 Jan 2004 21:20:54 GMT""}]","2007-05-23"
"hep-ph/0401125","Pierre-Hugues Beauchemin","G. Azuelos, P.-H. Beauchemin and C.P. Burgess","Phenomenological Constraints on Extra-Dimensional Scalars",,"J.Phys.G31:1-20,2005","10.1088/0954-3899/31/1/001",,"hep-ph",,"  We examine whether the ATLAS detector has sensitivity to extra-dimensional
scalars (as opposed to components of higher-dimensional tensors which look like
4D scalars), in scenarios having the extra-dimensional Planck scale in the TeV
range and $n \ge 2$ nonwarped extra dimensions. Such scalars appear as partners
of the graviton in virtually all higher-dimensional supersymmetric theories.
Using the scalar's lowest-dimensional effective couplings to quarks and gluons,
we compute the rate for the production of a hard jet together with missing
energy. We find a nontrivial range of graviscalar couplings to which ATLAS
could be sensitive, with experiments being more sensitive to couplings to
gluons than to quarks. Graviscalar emission increases the missing-energy signal
by adding to graviton production, and so complicates the inference of the
extra-dimensional Planck scale from an observed rate. Because graviscalar
differential cross sections resemble those for gravitons, it is unlikely that
these can be experimentally distinguished from one another should a missing
energy signal be observed.
","[{""version"":""v1"",""created"":""Fri, 16 Jan 2004 21:50:51 GMT""}]","2008-11-26"
"hep-ph/0401126","Frank Wilczek","Frank Wilczek","A Constructive Critique of the Three Standard Systems","13 pages, 7 figures; Concluding talk at the Praha-ASI Conference on
  LHC Physics, Prague, July 2003, to be published in the Proceedings","Czech.J.Phys. 54 (2004) A415-A427",,"MIT-CTP-3466","hep-ph",,"  This is a broad and in part unconventional review of our current knowledge of
fundamental physics, emphasizing the potential for advances the LHC will open
up.
","[{""version"":""v1"",""created"":""Sat, 17 Jan 2004 02:23:04 GMT""}]","2007-05-23"
"hep-ph/0401129","Lianshou Liu","Liu Lianshou and Fu Jinghua","A Comparison of different measures for dynamical event-mean transverse
  momentum fluctuation","4 pages, 3 figures",,,,"hep-ph",,"  Various measures for the dynamical event-mean transverse momentum fluctuation
are compared with the real dynamical fluctuation using a Monte Carlo model. The
variance calculated from the G-moments can reproduce the dynamical variance
well, while those obtained through subtraction procedures are approximate
measures for not very low multiplicity. The Phi_pt can also serve as an
approximate measure after divided by the square root of mean multiplicity.
","[{""version"":""v1"",""created"":""Sat, 17 Jan 2004 00:27:48 GMT""}]","2007-05-23"
"hep-ph/0401130","Szymanowski Lech dr","I.V. Anikin, B. Pire, L. Szymanowski, O.V. Teryaev, S. Wallon","Deep electroproduction of exotic hybrid mesons","4 pages LATEX, added some comments and refs.,version to appear in
  Phys. Rev. D","Phys.Rev. D70 (2004) 011501","10.1103/PhysRevD.70.011501",,"hep-ph",,"  We evaluate the leading order amplitude for the deep exclusive
electroproduction of an exotic hybrid meson in the Bjorken regime. We show
that, contrary to naive expectation, this amplitude factorizes at the twist 2
level and thus scales like usual meson electroproduction when the virtual
photon and the hybrid meson are longitidinally polarized. Exotic hybrid mesons
may thus be studied in electroproduction experiments at JLAB, HERA (HERMES) or
CERN (COMPASS).
","[{""version"":""v1"",""created"":""Sat, 17 Jan 2004 13:59:24 GMT""},{""version"":""v2"",""created"":""Thu, 20 May 2004 15:03:25 GMT""}]","2009-11-10"
"hep-th/0401113","Hartmut Wachter","Hartmut Wachter","q-Exponentials on quantum spaces","34 pages, Latex, more detailed introduction, 2-dim. case included,
  major modifications to improve clarity, appendix with proofs, notations etc.
  added, references added, typos corrected, some parts of appendices skipped","Eur.Phys.J.C37:379-389,2004","10.1140/epjc/s2004-01999-5",,"hep-th",,"  We present explicit formulae for q-exponentials on quantum spaces which could
be of particular importance in physics, i.e. the q-deformed Minkowski-space and
the q-deformed Euclidean space with two, three or four dimensions. Furthermore,
these formulae can be viewed as 2-, 3- or 4-dimensional analogues of the
well-known q-exponential function.
","[{""version"":""v1"",""created"":""Fri, 16 Jan 2004 18:29:41 GMT""},{""version"":""v2"",""created"":""Wed, 19 May 2004 12:55:07 GMT""},{""version"":""v3"",""created"":""Mon, 4 Oct 2004 09:46:40 GMT""}]","2011-09-13"
"hep-th/0401114","Richard Garavuso","Richard S. Garavuso","SO(10) heterotic M-theory vacua","9 pages. Invited talk presented at the String Phenomenology 2003
  Workshop, IPPP, Durham UK, 29 July - 4 August 2003",,,"OUTP-04-03P","hep-th hep-ph",,"  This talk adapts the available formalism to study a class of heterotic
M-theory vacua with SO(10) grand unification group. Compactification to four
dimensions with N = 1 supersymmetry is achieved on a torus fibered Calabi-Yau
3-fold Z = X / tau_{X} with first homotopy group pi_{1}(Z) = Z_{2}. Here X is
an elliptically fibered Calabi-Yau 3-fold which admits two global sections and
\tau_{X} is a freely acting involution on X. The vacua in this class have net
number of three generations of chiral fermions in the observable sector and may
contain M5-branes in the bulk space which wrap holomorphic curves in Z. Vacua
with nonvanishing and vanishing instanton charges in the observable sector are
considered. The latter case corresponds to potentially viable matter Yukawa
couplings. Since pi_{1}(Z) = Z_{2}, the grand unification group can be broken
with Z_{2} Wilson lines.
  The motivation is to use the above formalism to extend realistic
free-fermionic models to the nonperturbative regime. The correspondence between
these models and Z_{2} x Z_{2} orbifold compactification of the weakly coupled
10-dimensional heterotic string identifies associated Calabi-Yau 3-folds which
possess the structure of the above Z and X. A nonperturbative extension of the
top quark Yukawa coupling is discussed.
","[{""version"":""v1"",""created"":""Fri, 16 Jan 2004 20:04:46 GMT""},{""version"":""v2"",""created"":""Tue, 20 Jan 2004 13:05:19 GMT""}]","2007-05-23"
"hep-th/0401115","Samir Mathur","Samir D. Mathur","Where are the states of a black hole?","7 pages, 2 figures, LaTeX (Talk given at `Quantum Theory and
  Symmetries', Cincinnati, September 2003)",,"10.1142/9789812702340_0019","OHSTPY-HEP-T-04-001","hep-th gr-qc",,"  We argue that bound states of branes have a size that is of the same order as
the horizon radius of the corresponding black hole. Thus the interior of a
black hole is not `empty space with a central singularity', and Hawking
radiation can pick up information from the degrees of freedom of the hole.
","[{""version"":""v1"",""created"":""Fri, 16 Jan 2004 20:41:53 GMT""}]","2017-08-23"
"hep-th/0401117","Kimball A. Milton","Kimball A. Milton","Finite Casimir Energies in Renormalizable Quantum Field Theory","20 pages, 2 ps figures, uses ws-procs975x65.cls Invited talk given at
  Marcel Grossmann X, Rio de Janeiro,July 2003",,"10.1142/9789812704030_0063",,"hep-th quant-ph",,"  Quantum vacuum energy has been known to have observable consequences since
1948 when Casimir calculated the force of attraction between parallel uncharged
plates, a phenomenon confirmed experimentally with ever increasing precision.
Casimir himself suggested that a similar attractive self-stress existed for a
conducting spherical shell, but Boyer obtained a repulsive stress. Other
geometries and higher dimensions have been considered over the years. Local
effects, and divergences associated with surfaces and edges have been
investigated by several authors. Quite recently, Graham et al. have re-examined
such calculations, using conventional techniques of perturbative quantum field
theory to remove divergences, and have suggested that previous self-stress
results may be suspect. Here we show that most of the examples considered in
their work are misleading; in particular, it is well-known that in two
dimensions a circular boundary has a divergence in the Casimir energy for
massless fields, while for general dimension $D$ not equal to an even integer
the corresponding Casimir energy arising from massless fields interior and
exterior to a hyperspherical shell is finite. It has also long been recognized
that the Casimir energy for massive fields is divergent for curved boundaries.
These conclusions are reinforced by a calculation of the relevant leading
Feynman diagram in $D$ dimensions. Divergences do occur in third order, as has
been recognized for many years, but this logarithmic divergence is of
questionable relevance to real shells.
","[{""version"":""v1"",""created"":""Sat, 17 Jan 2004 00:26:52 GMT""}]","2016-11-09"
"math/0401192","Joseph Gubeladze","Joseph Gubeladze and Zaza Mushkudiani","Commutator automorphisms of formal power series rings","to appear in Proc. Amer. Math. Soc",,,,"math.AC math.KT",,"  For a big class of commutative rings R every continuous R-automorphism of
R[[X_1,...,X_n]] with the identity linear part is in the commutator subgroup of
Aut(R[[X_1,...,X_n]]). An explicit bound for the number of the involved
commutators and a K-theoretic interpretation of this result are provided.
","[{""version"":""v1"",""created"":""Fri, 16 Jan 2004 20:49:40 GMT""},{""version"":""v2"",""created"":""Fri, 16 Jan 2004 22:41:20 GMT""},{""version"":""v3"",""created"":""Mon, 13 Sep 2004 01:17:58 GMT""},{""version"":""v4"",""created"":""Wed, 2 Mar 2005 01:13:12 GMT""}]","2007-05-23"
"math/0401206","Judith Beumer","Antonios Zagaris, Hans G. Kaper, and Tasso J. Kaper","Fast and Slow Dynamics for the Computational Singular Perturbation
  Method","33 pages",,,"Preprint ANL/MCS-P1114-0104","math.DS math.CA",,"  The Computational Singular Perturbation (CSP) method of Lam and Goussis is an
iterative method to reduce the dimensionality of systems of ordinary
differential equations with multiple time scales. In [J. Nonlin. Sci., to
appear], the authors showed that each iteration of the CSP algorithm improves
the approximation of the slow manifold by one order. In this paper, it is shown
that the CSP method simultaneously approximates the tangent spaces to the fast
fibers along which solutions relax to the slow manifold. Again, each iteration
adds one order of accuracy. In some studies, the output of the CSP algorithm is
postprocessed by linearly projecting initial data onto the slow manifold along
these approximate tangent spaces. These projections, in turn, also become
successively more accurate.
","[{""version"":""v1"",""created"":""Fri, 16 Jan 2004 17:37:05 GMT""}]","2016-09-07"
"math/0401207","Tigran Tchrakian","A.Chakrabarti","A nested sequence of projectors and corresponding braid matrices $\hat
  R(\theta)$: (1) Odd dimensions","latex file, 32 pages",,"10.1063/1.1900291",,"math.QA",,"  A basis of $N^2$ projectors, each an ${N^2}\times{N^2}$ matrix with constant
elements, is implemented to construct a class of braid matrices
$\hat{R}(\theta)$, $\theta$ being the spectral parameter. Only odd values of
$N$ are considered here. Our ansatz for the projectors $P_{\alpha}$ appearing
in the spectral decomposition of $\hat{R}(\theta)$ leads to exponentials
$exp(m_{\alpha}\theta)$ as the coefficient of $P_{\alpha}$. The sums and
differences of such exponentials on the diagonal and the antidiagonal
respectively provide the $(2N^2 -1)$ nonzero elements of $\hat{R}(\theta)$. One
element at the center is normalized to unity. A class of supplementary
constraints imposed by the braid equation leaves ${1/2}(N+3)(N-1)$ free
parameters $m_{\alpha}$. The diagonalizer of $\hat{R}(\theta)$ is presented for
all $N$. Transfer matrices $t(\theta)$ and $L(\theta)$ operators corresponding
to our $\hat{R}(\theta)$ are studied. Our diagonalizer signals specific
combinations of the components of the operators that lead to a quadratic
algebra of $N^2$ constant $N\times N$ matrices. The $\theta$-dependence factors
out for such combinations. $\hat R(\theta)$ is developed in a power series in
$\theta$. The basic difference arising for even dimensions is made explicit.
Some special features of our $\hat{R}(\theta)$ are discussed in a concluding
section.
","[{""version"":""v1"",""created"":""Fri, 16 Jan 2004 17:51:39 GMT""}]","2009-11-10"
"math/0401208","Christina Goldschmidt","Christina Goldschmidt","Critical random hypergraphs: The emergence of a giant set of
  identifiable vertices","Published at http://dx.doi.org/10.1214/009117904000000847 in the
  Annals of Probability (http://www.imstat.org/aop/) by the Institute of
  Mathematical Statistics (http://www.imstat.org)","Annals of Probability 2005, Vol. 33, No. 4, 1573-1600","10.1214/009117904000000847","IMS-AOP-AOP0028","math.PR math.CO",,"  We consider a model for random hypergraphs with identifiability, an analogue
of connectedness. This model has a phase transition in the proportion of
identifiable vertices when the underlying random graph becomes critical. The
phase transition takes various forms, depending on the values of the parameters
controlling the different types of hyperedges. It may be continuous as in a
random graph. (In fact, when there are no higher-order edges, it is exactly the
emergence of the giant component.) In this case, there is a sequence of
possible sizes of ``components'' (including but not restricted to N^{2/3}).
Alternatively, the phase transition may be discontinuous. We are particularly
interested in the nature of the discontinuous phase transition and are able to
exhibit precise asymptotics. Our method extends a result of Aldous [Ann.
Probab. 25 (1997) 812-854] on component sizes in a random graph.
","[{""version"":""v1"",""created"":""Fri, 16 Jan 2004 20:42:21 GMT""},{""version"":""v2"",""created"":""Tue, 24 Feb 2004 10:28:27 GMT""},{""version"":""v3"",""created"":""Tue, 30 Aug 2005 08:20:36 GMT""}]","2007-05-23"
"math/0401209","Michael Larsen","Bo-Hae Im and Michael Larsen","Realizing Rational Representations in Mordell-Weil Groups","This is a major revision, with a new coauthor and a changed title.
  The part of the paper dealing with integral structures had a gap, so it has
  been removed. The rational part has been extended. A new section, using
  Heegner point methods, has been added. Formerly 9 pages, now 8 pages",,,,"math.NT math.GR","http://arxiv.org/licenses/nonexclusive-distrib/1.0/","  Let G be a finite group and V a finite-dimensional rational G-representation.
We ask whether there exists a finite Galois extension L/K of number fields with
Galois group G, an elliptic curve E/K, and a G-submodule of E(L) tensor Q
isomorphic to V.
","[{""version"":""v1"",""created"":""Fri, 16 Jan 2004 20:00:59 GMT""},{""version"":""v2"",""created"":""Wed, 10 Feb 2010 13:52:03 GMT""}]","2010-02-10"
