"cond-mat/0401596","Takashi Hotta","Takashi Hotta, Elbio Dagotto","Orbital Ordering, New Phases, and Stripe Formation in Doped Layered
  Nickelates","Revtex, 4 pages, 3 figures","Phys. Rev. Lett. 92, 227201 (2004)","10.1103/PhysRevLett.92.227201",,"cond-mat.str-el",,"  Ground-state properties of layered nickelates are investigated based on the
orbital-degenerate Hubbard model coupled with lattice distortions, by using
umerical techniques. The N\'eel state composed of spin S=1 ions is confirmed in
the undoped limit x=0. At x=1/2, novel antiferromagnetic states, called CE- and
E-type phases, are found by increasing the Hund's coupling. (3 x^2 - r^2 / 3
y^2 - r^2)-type orbital ordering is predicted to occur in a checkerboard-type
charge-ordered state. At x=1/3, both Coulombic and phononic interactions are
found to be important, since the former stabilizes the spin stripe, while the
latter leads to the striped charge-order.
","[{""version"":""v1"",""created"":""Thu, 29 Jan 2004 04:45:01 GMT""}]","2009-11-10"
"cond-mat/0401597","Kenichi Sasaki","K. Sasaki, Y. Kawazoe, and R. Saito","Fractional flux periodicity of a twisted planar square lattice","4 pages, 2 figures, corrected typos (v3)","Phys.Lett. A329 (2004) 148-154","10.1016/j.physleta.2004.06.093",,"cond-mat.mes-hall cond-mat.supr-con hep-th",,"  We present fractional flux periodicity in the ground state of planar systems
made of a square lattice whose boundary is compacted into a torus. The
ground-state energy shows a fractional period of the fundamental unit of
magnetic flux depending on the twist around the torus axis.
","[{""version"":""v1"",""created"":""Thu, 29 Jan 2004 09:11:43 GMT""},{""version"":""v2"",""created"":""Tue, 17 Feb 2004 08:39:47 GMT""},{""version"":""v3"",""created"":""Wed, 3 Mar 2004 02:30:16 GMT""}]","2009-11-10"
"cond-mat/0401598","Naoki Masuda Dr.","Naoki Masuda, Norio Konno, Kazuyuki Aihara","Transmission of severe acute respiratory syndrome in dynamical
  small-world networks","4 figures","Physical Review E, 69, 031917 (2004)","10.1103/PhysRevE.69.031917",,"cond-mat.other q-bio.PE",,"  The outbreak of severe acute respiratory syndrome (SARS) is still threatening
the world because of a possible resurgence. In the current situation that
effective medical treatments such as antiviral drugs are not discovered yet,
dynamical features of the epidemics should be clarified for establishing
strategies for tracing, quarantine, isolation, and regulating social behavior
of the public at appropriate costs. Here we propose a network model for SARS
epidemics and discuss why superspreaders emerged and why SARS spread especially
in hospitals, which were key factors of the recent outbreak. We suggest that
superspreaders are biologically contagious patients, and they may amplify the
spreads by going to potentially contagious places such as hospitals. To avoid
mass transmission in hospitals, it may be a good measure to treat suspected
cases without hospitalizing them. Finally, we indicate that SARS probably
propagates in small-world networks associated with human contacts and that the
biological nature of individuals and social group properties are factors more
important than the heterogeneous rates of social contacts among individuals.
This is in marked contrast with epidemics of sexually transmitted diseases or
computer viruses to which scale-free network models often apply.
","[{""version"":""v1"",""created"":""Thu, 29 Jan 2004 06:51:53 GMT""},{""version"":""v2"",""created"":""Thu, 20 May 2004 11:46:31 GMT""},{""version"":""v3"",""created"":""Fri, 16 Jul 2004 00:19:22 GMT""}]","2007-05-23"
"cond-mat/0401599","Sudhindra","Kausik Sengupta, S. Rayaprol, E.V. Sampathkumaran, Th. Doert and
  J.P.F. Jemetio","Magnetic and transport anomalies in the compounds, RCuAs2 (R= Pr, Nd,
  Sm, Gd, Tb, Dy, Ho, and Er)","Accepted for publication in Physica B (Elsevier)",,"10.1016/j.physb.2004.01.152",,"cond-mat.mtrl-sci cond-mat.str-el",,"  The results of dc magnetization, heat capacity, electrical resistivity (rho)
and magnetoresistance measurements are reported in detail for the compounds,
RCuAs2 for R= Pr, Nd, Sm, Gd, Tb, Dy, Ho, and Er, crystallizing in HfCuSi2-type
tetragonal structure, with the aim of bringing out anomalies among 'normal'
(that is, other than Ce and Yb) rare-earths. The results establish that all
these compounds order antiferromagnetically at low temperatures with deviations
from de Gennes scaling. Isothermal magnetization (M) data below respective Neel
temperatures (TN) reveal the existence of field-induced metamagnetic-like
transitions for most of the compounds (except R= Sm and Gd), whereas in Sm and
Gd compounds M varies essentially linearly with magnetic field. With respect to
the rho behavior, there appears to be a subtle difference in the temperature
dependence beyond 50 K between Sm on the one hand and the rest on the other. In
addition, the unexpected rho(T) minimum reported recently for R = Sm, Gd, Tb
and Dy in the paramagnetic state (around 20 to 30 K) is essentially absent for
R = Ho and Er. The results overall reveal that the normal rare-earths in this
series present an interesting situation in magnetism, warranting a new
theoretical approach to describe the transport behavior in the paramagnetic
state particularly in the vicinity of TN.
","[{""version"":""v1"",""created"":""Thu, 29 Jan 2004 09:03:36 GMT""}]","2009-11-10"
"cond-mat/0401600","Alex Hansen","Jean Schmittbuhl, Alex Hansen and G. George Batrouni","Reply to Comment on ""Roughness of Interfacial Crack Fronts:
  Stress-Weighted Percolation in the Damage Zone""",,"Phys. Rev. Lett. 92, 049602 (2004)","10.1103/PhysRevLett.92.049602",,"cond-mat.stat-mech",,"  This is the reply to a Comment by Alava and Zapperi (cond-mat/0401568) on
Schmittbuhl, Hansen and Batrouni, PRL, 90, 045505 (2003).
","[{""version"":""v1"",""created"":""Thu, 29 Jan 2004 10:04:51 GMT""}]","2009-11-10"
"cond-mat/0401601","Akira Sekiyama","A. Sekiyama, H. Fujiwara, A. Higashiya, S. Imada, H. Kuwahara, Y.
  Tokura, S. Suga","Driving mechanisms behind the various phases in manganese perovskites
  revealed by Mn 2p resonance photoemission","4 pages, 2 figures",,,,"cond-mat.str-el",,"  Unusual temperature and doping dependence of the Mn 3d spectral functions of
manganese perovskites Nd1-xSrxMnO3 has been revealed by the high-resolution Mn
2p-3d resonance photoemission. The temperature-dependent spectra cannot be
explained by any theoretical model currently under debate, while showing
evidence for a microscopic and dynamic phase segregation. The experimental
results strongly suggest that the competition of both the dynamical and static
Jahn-Teller effects with ferromagnetic ordering at high and low temperatures,
respectively, is responsible for the actual electronic states.
","[{""version"":""v1"",""created"":""Thu, 29 Jan 2004 10:14:29 GMT""}]","2007-05-23"
"cond-mat/0401602","Marco Tarzia","M. Nicodemi, A. Coniglio, A. de Candia, A. Fierro, M. Pica Ciamarra,
  M. Tarzia","Statistical Mechanics of jamming and segregation in granular media","Contribution to the volume ""Unifying Concepts in Granular Media and
  Glasses"", edt.s A. Coniglio, A. Fierro, H. J. Herrmann and M. Nicodemi",,,,"cond-mat.stat-mech cond-mat.dis-nn",,"  In the framework of schematic hard spheres lattice models we discuss Edwards'
Statistical Mechanics approach to granular media. As this approach appears to
hold here to a very good approximation, by analytical calculations of Edwards'
partition function at a mean field level we derive the system phase diagram and
show that ``jamming'' corresponds to a phase transition from a ``fluid'' to a
``glassy'' phase, observed when crystallization is avoided. The nature of such
a ``glassy'' phase turns out to be the same found in mean field models for
glass formers. In the same context, we also briefly discuss mixing/segregation
phenomena of binary mixtures: the presence of fluid-crystal phase transitions
drives segregation as a form of phase separation and, within a given phase,
gravity can also induce a kind of ``vertical'' segregation, usually not
associated to phase transitions.
","[{""version"":""v1"",""created"":""Thu, 29 Jan 2004 10:44:14 GMT""}]","2007-05-23"
"cond-mat/0401603","Ilya V. Tokatly","I. V. Tokatly","Bose-representation for a strongly coupled nonequilibrim fermionic
  superfluid in a time-dependent trap","RevTeX 4, 6 pages, 2 eps figures","Phys. Rev. A 70, 043601 (2004)","10.1103/PhysRevA.70.043601",,"cond-mat.other",,"  Using the functional integral formulation of a nonequilibrium quantum
many-body theory we develop a regular description of a Fermi system with a
strong attractive interaction in the presence of an external time-dependent
potential. In the strong coupling limit this fermionic system is equivalent to
a noequilibrium dilute Bose gas of diatomic molecules. We also consider a
nonequilibrim strongly coupled Bardeen-Cooper-Schrieffer (BCS) theory and show
that it reduces to the full nonlinear time-dependent Gross-Pitaevski (GP)
equation, which determines an evolution of the condensate wave function.
","[{""version"":""v1"",""created"":""Thu, 29 Jan 2004 11:13:56 GMT""}]","2009-11-10"
"cond-mat/0401604","Rachid Darradi","R. Darradi, J. Richter and S.E. Krueger","Influence of Ising-anisotropy on the zero-temperature phase transition
  in the square lattice spin-1/2 J-J' model","8 pages, 4 figures","Journal of Physics: Condensed Matter, Volume 16, Number 15, 21
  April 2004, p. 2681-2687","10.1088/0953-8984/16/15/019",,"cond-mat.str-el",,"  We use a variational mean-field like approach, the coupled cluster method
(CCM) and exact diagonalization to investigate the ground-state order-disorder
transition for the square lattice spin-half XXZ model with two different
nearest-neighbor couplings $J$ and $J'$. Increasing $J' > J$ the model shows in
the isotropic Heisenberg limit a second-order transition from semi-classical
N\'eel order to a quantum paramagnetic phase with enhanced local dimer
correlations on the $J'$ bonds at about $J'_{c} \sim 2.5 ... 3 J$. This
transition is driven by the quantum competition between $J'$ and $J$.
Increasing the anisotropy parameter $\Delta> 1$ we diminish the quantum
fluctuations and thus the degree of competition. As a result the transition
point $J'_{c}$ is shifted to larger values. We find indications for a linear
increase of $J'_{c}$ with $\Delta $, i.e. the transition disappears in the
Ising limit $\Delta \to \infty$.
","[{""version"":""v1"",""created"":""Thu, 29 Jan 2004 11:30:09 GMT""},{""version"":""v2"",""created"":""Thu, 3 Jun 2004 07:58:34 GMT""},{""version"":""v3"",""created"":""Wed, 27 Oct 2004 12:21:36 GMT""}]","2009-11-10"
"cond-mat/0401606","Timo Nachtrab","T. Nachtrab, D. Koelle, R. Kleiner, C. Bernhard, C. T. Lin","Intrinsic Josephson Effects in the Magnetic Superconductor RuSr2GdCu2O8","4 pages, 5 figures, to appear in Phys. Rev. Lett",,"10.1103/PhysRevLett.92.117001",,"cond-mat.supr-con cond-mat.str-el",,"  We have measured interlayer current transport in small sized RuSr2GdCu2O8
single crystals. We find a clear intrinsic Josephson effect showing that the
material acts as a natural
superconductor-insulator-ferromagnet-insulator-superconductor superlattice. So
far, we detected no unconventional behavior due to the magnetism of the RuO2
layers.
","[{""version"":""v1"",""created"":""Thu, 29 Jan 2004 14:22:36 GMT""}]","2009-11-10"
"cond-mat/0401607","Gopalan Srinivasan","G. Srinivasan","Review on Giant Magnetoelectric effects in Oxide
  ferromagnetic/ferroelectric Layered Structures","9 pages, 13 figures",,,,"cond-mat.mtrl-sci",,"  The synthesis of layered ferrite-lead titanate zirconate (PZT) and lanthanum
nanganite-PZT and the observation of giant magneto-electric interactions are
discussed. The ferrites used in our studies included pure and Zn substituted
cobalt-, nickel- and lithium ferrites. Ferromagnetic manganites used included
both calcium and strontium substituted systems. The samples were prepared from
10-40 mm thick films obtained by tape-casting. Our studies showed strong ME
coupling in manganite-PZT and cobalt zinc ferrite-PZT, and a giant ME effect in
nickel zinc ferrite-PZT. We found evidence for Zn assisted enhancement in ME
coefficients that were attributed to low anisotropy and high permeability that
resulted in favorable magneto-mechanical coupling in the composites.
","[{""version"":""v1"",""created"":""Thu, 29 Jan 2004 14:31:59 GMT""}]","2007-05-23"
"cond-mat/0401608","Voislav Golo","V.L.Golo, Vl.N.Salnikov, K.V.Shaitan","Harmonic oscillators in the Nos\'e - Hoover thermostat","7 pages, 4 figures",,"10.1103/PhysRevE.70.046130",,"cond-mat.other",,"  We study the dynamics of an ensemble of non-interacting harmonic oscillators
in a nonlinear dissipative environment described by the Nos\'e - Hoover model.
Using numerical simulation we find the histogram for total energy, which agrees
with the analysis of the Nos\'e - Hoover equations effected with the method of
averaging. The histogram does not correspond to Gibbs' canonical distribution.
We have found oscillations at frequency proportional to $\sqrt{\alpha/m}$,
$\alpha$ the dissipative parameter of thermostat and $m$ the characteristic
mass of particle, about the stationary state corresponding to equilibrium. The
oscillations could have an important bearing upon the analysis of simulating
molecular dynamics in the Nos\'e - Hoover thermostat.
","[{""version"":""v1"",""created"":""Thu, 29 Jan 2004 15:35:20 GMT""}]","2015-06-24"
"cond-mat/0401609","Robert J. Gooding","R.J. Gooding, F. Marsiglio, S. Verga, and K.S.D. Beach","Demonstration of a robust pseudogap in a three-dimensional correlated
  electronic system","28 pages, 9 figures",,"10.1023/B:JOLT.0000038522.13017.42",,"cond-mat.str-el cond-mat.supr-con",,"  We outline a partial-fractions decomposition method for determining the
one-particle spectral function and single-particle density of states of a
correlated electronic system on a finite lattice in the non self-consistent
T-matrix approximation to arbitrary numerical accuracy, and demonstrate the
application of these ideas to the attractive Hubbard model. We then demonstrate
the effectiveness of a finite-size scaling ansatz which allows for the
extraction of quantities of interest in the thermodynamic limit from this
method. In this approximation, in one or two dimensions, for any finite lattice
or in the thermodynamic limit, a pseudogap is present and its energy diverges
as Tc is approached from above; this is an unphysical manifestation of using an
approximation that predicts a spurious phase transition in one or two
dimensions. However, in three dimensions one expects the transition predicted
by this approximation to represent a true continuous phase transition, and in
the thermodynamic limit any pseudogap predicted by this formulation will remain
finite. We have applied our method to the attractive Hubbard model on a
three-dimensional simple cubic lattice, and find that for intermediate coupling
a prominent pseudogap is found in the single-particle density of states, and
this gap persists over a large temperature range. In addition, we also show
that for weak coupling a pseudogap is also present. The pseudogap energy at the
transition temperature is almost a factor of three larger than the T=0 BCS gap
for intermediate coupling, whereas for weak coupling the pseudogap and BCS gap
energies are essentially equal.
","[{""version"":""v1"",""created"":""Thu, 29 Jan 2004 15:23:14 GMT""}]","2009-11-10"
"cond-mat/0401611","Michael J. Naughton","J.I. Oh and M.J. Naughton","Magnetic Determination of $H_{c2}$ under Accurate Alignment in
  (TMTSF)$_2$ClO$_4$","Submitted July 1, 2003, Accepted December 9, 2003, Physical Review
  Letters",,"10.1103/PhysRevLett.92.067001",,"cond-mat.supr-con",,"  Cantilever magnetometry has been used to measure the upper critical magnetic
field $H_{c2}$ of the quasi-one dimensional molecular organic superconductor
(TMTSF)$_2$ClO$_4$. From simultaneous resistivity and torque magnetization
experiments conducted under precise field alignment, $H_{c2}$ at low
temperature is shown to reach 5T, nearly twice the Pauli paramagnetic limit
imposed on spin singlet superconductors. These results constitute the first
thermodynamic evidence for a large $H_{c2}$ in this system and provide support
for spin triplet pairing in this unconventional superconductor
","[{""version"":""v1"",""created"":""Thu, 29 Jan 2004 15:32:18 GMT""}]","2009-11-10"
"gr-qc/0401112","Miguel Sanchez","Antonio N. Bernal, Miguel S\'anchez","Smoothness of time functions and the metric splitting of globally
  hyperbolic spacetimes","9 pages, Latex, to appear in Commun. Math. Phys. Some comments on
  time functions and stably causal spacetimes are incorporated, and referred to
  gr-qc/0411143 for further details","Commun.Math.Phys. 257 (2005) 43-50","10.1007/s00220-005-1346-1",,"gr-qc math.DG",,"  The folk questions in Lorentzian Geometry, which concerns the smoothness of
time functions and slicings by Cauchy hypersurfaces, are solved by giving
simple proofs of: (a) any globally hyperbolic spacetime $(M,g)$ admits a smooth
time function $\tau$ whose levels are spacelike Cauchy hyperfurfaces and, thus,
also a smooth global splitting $M= \R \times {\cal S}$, $g= - \beta(\tau,x)
d\tau^2 + \bar g_\tau $, (b) if a spacetime $M$ admits a (continuous) time
function $t$ (i.e., it is stably causal) then it admits a smooth (time)
function $\tau$ with timelike gradient $\nabla \tau$ on all $M$.
","[{""version"":""v1"",""created"":""Wed, 28 Jan 2004 16:38:07 GMT""},{""version"":""v2"",""created"":""Thu, 4 Nov 2004 11:20:09 GMT""},{""version"":""v3"",""created"":""Tue, 15 Feb 2005 18:45:19 GMT""}]","2009-11-10"
"gr-qc/0401113","Jose A. Gonzalez","Miguel Alcubierre and Jose A. Gonzalez","Regularization of spherically symmetric evolution codes in numerical
  relativity","7 pages, 4 figures, submitted to Computer Physics Communications","Comput.Phys.Commun. 167 (2005) 76-84","10.1016/j.cpc.2005.01.008",,"gr-qc",,"  The lack of regularity of geometric variables at the origin is often a source
of serious problem for spherically symmetric evolution codes in numerical
relativity. One usually deals with this by restricting the gauge and solving
the hamiltonian constraint for the metric. Here we present a generic algorithm
for dealing with the regularization of the origin that can be used directly on
the evolution equations and that allows very general gauge choices. Our
approach is similar in spirit to the one introduced by Arbona and Bona for the
particular case of the Bona-Masso formulation. However, our algorithm is more
general and can be used with a wide variety of evolution systems.
","[{""version"":""v1"",""created"":""Wed, 28 Jan 2004 19:25:50 GMT""}]","2009-11-10"
"gr-qc/0401114","Chris Van Den Broeck","Abhay Ashtekar, Jonathan Engle, Tomasz Pawlowski, and Chris Van Den
  Broeck","Multipole Moments of Isolated Horizons","25 pages, 1 figure. Minor typos corrected, reference added","Class.Quant.Grav. 21 (2004) 2549-2570","10.1088/0264-9381/21/11/003","CGPG 2004-01/3","gr-qc hep-th",,"  To every axi-symmetric isolated horizon we associate two sets of numbers,
$M_n$ and $J_n$ with $n = 0, 1, 2, ...$, representing its mass and angular
momentum multipoles. They provide a diffeomorphism invariant characterization
of the horizon geometry. Physically, they can be thought of as the `source
multipoles' of black holes in equilibrium. These structures have a variety of
potential applications ranging from equations of motion of black holes and
numerical relativity to quantum gravity.
","[{""version"":""v1"",""created"":""Wed, 28 Jan 2004 19:21:13 GMT""},{""version"":""v2"",""created"":""Fri, 15 Oct 2004 18:19:40 GMT""}]","2009-11-10"
"gr-qc/0401115","Lars Samuelsson","Max Karlovini and Lars Samuelsson","Elastic Stars in General Relativity: III. Stiff ultrarigid exact
  solutions","20 pages, 6 figures. Added remarks on our numerical method as well as
  the relation to the Ernst equation","Class.Quant.Grav. 21 (2004) 4531-4548","10.1088/0264-9381/21/19/003","USITP 2004-2","gr-qc",,"  We present an equation of state for elastic matter which allows for purely
longitudinal elastic waves in all propagation directions, not just principal
directions. The speed of these waves is equal to the speed of light whereas the
transversal type speeds are also very high, comparable to but always strictly
less than that of light. Clearly such an equation of state does not give a
reasonable matter description for the crust of a neutron star, but it does
provide a nice causal toy model for an extremely rigid phase in a neutron star
core, should such a phase exist. Another reason for focusing on this particular
equation of state is simply that it leads to a very simple recipe for finding
stationary rigid motion exact solutions to the Einstein equations. In fact, we
show that a very large class of stationary spacetimes with constant Ricci
scalar can be interpreted as rigid motion solutions with this matter source. We
use the recipe to derive a static spherically symmetric exact solution with
constant energy density, regular centre and finite radius, having a nontrivial
parameter that can be varied to yield a mass-radius curve from which stability
can be read off. It turns out that the solution is stable down to a tenuity R/M
slightly less than 3. The result of this static approach to stability is
confirmed by a numerical determination of the fundamental radial oscillation
mode frequency. We also present another solution with outwards decreasing
energy density. Unfortunately, this solution only has a trivial scaling
parameter and is found to be unstable.
","[{""version"":""v1"",""created"":""Wed, 28 Jan 2004 20:54:37 GMT""},{""version"":""v2"",""created"":""Wed, 28 Jan 2004 22:34:18 GMT""},{""version"":""v3"",""created"":""Tue, 14 Sep 2004 11:12:56 GMT""}]","2009-11-10"
"gr-qc/0401116","Pierre Martinetti","P. Martinetti","A brief remark on Unruh effect and causality","One reference corrected","J.Phys.Conf.Ser.68:012027,2007","10.1088/1742-6596/68/1/012027",,"gr-qc",,"  Unruh effect states that the vacuum of a quantum field theory on Minkovski
space-time looks like a thermal state for an eternal uniformly accelerated
observer. Adaptation to the non eternal case causes a serious problem: if the
thermalization of the vacuum depends on the lifetime of the observer, then in
principle the latest is able to deduce its lifetime from the measurement of the
temperature. This short note aims at underlining that time-energy uncertainty
relation allows to adapt Unruh effect to non-eternal observers without breaking
causality. In particular we show that our adaptation - the diamonds's
temperature- of Bisognano-Wichman approach to Unruh effect is causally
acceptable. This note is self-contained but it is fully meaningful as a
complement to gr-qc/0212074 as well as a comment on gr-qc/0306022.
","[{""version"":""v1"",""created"":""Wed, 28 Jan 2004 22:36:50 GMT""},{""version"":""v2"",""created"":""Mon, 2 Feb 2004 12:33:51 GMT""}]","2008-11-26"
"gr-qc/0401117","John W. Moffat","J. W. Moffat","Quantum Gravity Momentum Representation and Maximum Invariant Energy","16 pages, LateX file, no figures","Int. J. Geometric Methods in Mod. Phys., 13(1), 1650005 (2016)","10.1142/S0219887816500055",,"gr-qc astro-ph hep-ph hep-th",,"  We use the idea of the symmetry between the spacetime coordinates x^\mu and
the energy-momentum p^\mu in quantum theory to construct a momentum space
quantum gravity geometry with a metric s_{\mu\nu} and a curvature
P^\lambda_{\mu\nu\rho}. For a closed maximally symmetric momentum space with a
constant 3-curvature, the volume of the p-space admits a cutoff with an
invariant maximum momentum a. A Wheeler-DeWitt-type wave equation is obtained
in the momentum space representation. The vacuum energy density and the
self-energy of a charged particle are shown to be finite, and modifications of
the electromagnetic radiation density and the entropy density of a system of
particles occur for high frequencies.
","[{""version"":""v1"",""created"":""Thu, 29 Jan 2004 00:57:21 GMT""}]","2016-03-08"
"gr-qc/0401118","Korotkin Dmitry","E.Ferapontov, D.Korotkin, V.Shramchenko","Boyer-Finley equation and systems of hydrodynamic type",,"Class.Quant.Grav. 19 (2002) L205-L210","10.1088/0264-9381/19/24/101",,"gr-qc",,"  We reduce Boyer-Finley equation to a family of compatible systems of
hydrodynamic type, with characteristic speeds expressed in terms of spaces of
rational functions. The systems of hydrodynamic type are then solved by the
generalized hodograph method, providing solutions of the Boyer-Finley equation
including functional parameters.
","[{""version"":""v1"",""created"":""Thu, 29 Jan 2004 03:32:04 GMT""}]","2022-05-04"
