"hep-th/0401230","Majid Monemzadeh Dr.","M.Monemzadeh and A. Shirzad","BFT Method for Mixed Constrained Systems and Chern-Simons Theory","13 pages, No figure. To appear in Phys. Rev. D DOI:","Phys.Rev.D72:045004,2005","10.1103/PhysRevD.72.045004",,"hep-th",,"  We show that the BFT embedding method is problematic for mixed systems
(systems possessing both first and second class constraints). The Chern-Simons
theory as an example is worked out in detail. We give two methods to solve the
problem leading to two different types of finite order BFT embedding for
Chern-Simons theory.
","[{""version"":""v1"",""created"":""Thu, 29 Jan 2004 11:09:59 GMT""},{""version"":""v2"",""created"":""Sat, 6 Nov 2004 05:54:09 GMT""},{""version"":""v3"",""created"":""Wed, 10 Aug 2005 05:18:18 GMT""}]","2011-07-19"
"hep-th/0401231","Gerhard Grensing","G. Grensing and M. Nitschmann","Berezin integration over anticommuting variables and cyclic cohomology","20 pages",,,,"hep-th",,"  Berezin integration over fermionic degrees of freedom as a standard tool of
quantum field theory is analysed from the viewpoint of noncommutative geometry.
It is shown that among the variety of contradictory integration prescriptions
existing in the current literature, there is only one unique minimal set of
consistent rules, which is compatible with Connes' normalized cyclic cohomology
of the Gra{\ss}mann algebra.
","[{""version"":""v1"",""created"":""Thu, 29 Jan 2004 12:37:47 GMT""}]","2007-05-23"
"math-ph/0401050","Armand Wirgin","Armand Wirgin","The inverse crime",,,,,"math-ph math.MP",,"  The inverse crime occurs when the same (or very nearly the same) theoretical
ingredients are employed to synthesize as well as to invert data in an inverse
problem. This act has been qualified as trivial and therefore to be avoided by
Colton and Kress.
","[{""version"":""v1"",""created"":""Wed, 28 Jan 2004 19:20:26 GMT""}]","2007-05-23"
"math-ph/0401051","Miguel Lorente","M. Lorente","Integrable systems on the lattice and orthogonal polynomials of discrete
  variable","LaTeX, 10 pages, Comunication presented to the 6th International
  Symposium on Orthogonal Polynomials, Special Functions and their
  Applications, Rome, June 2001 (late submission to arxiv.org)","J. Comp. Appl. Math 153 (2003) 321-330",,,"math-ph math.MP",,"  Some particular examples of classical and quantum systems on the lattice are
solved with the help of orthogonal polynomials and its connection to continuous
models are explored.
","[{""version"":""v1"",""created"":""Thu, 29 Jan 2004 15:50:51 GMT""}]","2007-05-23"
"math/0401388","Antar Bandyopadhyay","David J. Aldous and Antar Bandyopadhyay","A survey of max-type recursive distributional equations","Published at http://dx.doi.org/10.1214/105051605000000142 in the
  Annals of Applied Probability (http://www.imstat.org/aap/) by the Institute
  of Mathematical Statistics (http://www.imstat.org)","Annals of Applied Probability 2005, Vol. 15, No. 2, 1047-1110","10.1214/105051605000000142","IMS-AAP-AAP080","math.PR math.ST stat.TH",,"  In certain problems in a variety of applied probability settings (from
probabilistic analysis of algorithms to statistical physics), the central
requirement is to solve a recursive distributional equation of the form X =^d
g((\xi_i,X_i),i\geq 1). Here (\xi_i) and g(\cdot) are given and the X_i are
independent copies of the unknown distribution X. We survey this area,
emphasizing examples where the function g(\cdot) is essentially a ``maximum''
or ``minimum'' function. We draw attention to the theoretical question of
endogeny: in the associated recursive tree process X_i, are the X_i measurable
functions of the innovations process (\xi_i)?
","[{""version"":""v1"",""created"":""Wed, 28 Jan 2004 19:49:59 GMT""},{""version"":""v2"",""created"":""Sat, 10 Jul 2004 01:09:12 GMT""},{""version"":""v3"",""created"":""Fri, 20 May 2005 13:02:28 GMT""}]","2007-06-13"
"math/0401390","Uwe Franz","Uwe Franz and Naofumi Muraki","Markov property of monotone L\'evy processes","21 pages","Infinite Dimensional Harmonic Analysis III, pp. 37-57 (2005)","10.1142/9789812701503_0003","published in the Proceedings of the Third German-Japanese Symposium,
  University of T\""ubingen, Germany, 15-20 September 2003, H. Heyer, T. Hirai,
  T. Kawazoe, K. Saito (Eds.), p. 37-57, 2005","math.PR",,"  Monotone L\'evy processes with additive increments are defined and studied.
It is shown that these processes have a natural Markov structure and their
Markov transition semigroups are characterized using the monotone
L\'evy-Khintchine formula. Monotone L\'evy processes turn out to be related to
classical L\'evy processes via Attal's ``remarkable transformation.'' A
monotone analogue of the family of exponential martingales associated to a
classical L\'evy process is also defined.
","[{""version"":""v1"",""created"":""Wed, 28 Jan 2004 18:38:16 GMT""}]","2021-04-21"
"math/0401394","Marian Aprodu","Marian Aprodu","Green-Lazarsfeld's Gonality Conjecture for a Generic Curve of Odd Genus","7 pages, no figures","Int. Math. Res. Not. 2004, no. 63, 3409-3416","10.1155/S107379280414035X",,"math.AG",,"  The gonality conjecture predicts that the gonality of a curve can be read off
Koszul cohomology of line bundles of sufficiently large degree. We verify this
conjecture for generic curves of odd genus. The even-genus case was previously
solved in the joint work arXiv:math.AG/0301261.
","[{""version"":""v1"",""created"":""Wed, 28 Jan 2004 18:29:31 GMT""},{""version"":""v2"",""created"":""Wed, 11 Feb 2004 08:01:27 GMT""}]","2013-11-19"
"math/0401397","Claudia Garetto","Claudia Garetto and Guenther Hoermann","Microlocal analysis of generalized functions: pseudodifferential
  techniques and propagation of singularities",,,,,"math.AP",,"  We characterize microlocal regularity of Colombeau generalized functions by
an appropriate extension of the classical notion of micro-ellipticity to
pseudodifferential operators with slow scale generalized symbols. Thus we
obtain an alternative, yet equivalent, way to determine generalized wave front
sets, which is analogous to the original definition of the wave front set of
distributions via intersections over characteristic sets. The new methods are
then applied to regularity theory of generalized solutions of
(pseudo-)differential equations, where we extend the general noncharacteristic
regularity result for distributional solutions and consider propagation of
generalized singularities for homogeneous first-order hyperbolic equations.
","[{""version"":""v1"",""created"":""Wed, 28 Jan 2004 16:00:45 GMT""},{""version"":""v2"",""created"":""Fri, 20 Feb 2004 12:40:26 GMT""}]","2007-05-23"
"math/0401398","Raphael Yuster","Y. Caro and R. Yuster","A Tur\'{a}n Type Problem Concerning the Powers of the Degrees of a Graph
  (revised)","14 Pages","The Electronic Journal of Combinatorics 7 (2000), #R47",,,"math.CO",,"  For a graph $G$ whose degree sequence is $d_{1},..., d_{n}$, and for a
positive integer $p$, let $e_{p}(G)=\sum_{i=1}^{n}d_{i}^{p}$. For a fixed graph
$H$, let $t_{p}(n,H)$ denote the maximum value of $e_{p}(G)$ taken over all
graphs with $n$ vertices that do not contain $H$ as a subgraph. Clearly,
$t_{1}(n,H)$ is twice the Tur\'{a}n number of $H$. In this paper we consider
the case $p>1$. For some graphs $H$ we obtain exact results, for some others we
can obtain asymptotically tight upper and lower bounds, and many interesting
cases remain open.
","[{""version"":""v1"",""created"":""Wed, 28 Jan 2004 16:15:25 GMT""}]","2007-05-23"
"math/0401399","Saul Schleimer","Saul Schleimer","The disjoint curve property","Published by Geometry and Topology at
  http://www.maths.warwick.ac.uk/gt/GTVol8/paper3.abs.html","Geom. Topol. 8 (2004) 77-113","10.2140/gt.2004.8.77",,"math.GT",,"  A Heegaard splitting of a closed, orientable three-manifold satisfies the
disjoint curve property if the splitting surface contains an essential simple
closed curve and each handlebody contains an essential disk disjoint from this
curve [Thompson, 1999]. A splitting is full if it does not have the disjoint
curve property. This paper shows that in a closed, orientable three-manifold
all splittings of sufficiently large genus have the disjoint curve property.
  From this and a solution to the generalized Waldhausen conjecture it would
follow that any closed, orientable three manifold contains only finitely many
full splittings.
","[{""version"":""v1"",""created"":""Wed, 28 Jan 2004 16:20:48 GMT""}]","2014-11-11"
"math/0401400","Boris Shoikhet","Boris Feigin, Andrey Losev, and Boris Shoikhet","Riemann-Roch-Hirzebruch theorem and Topological Quantum Mechanics","24 pages, no figures, LaTeX",,,,"math.QA hep-th math.DG",,"  In the present paper we discuss an independent on the Grothendieck-Sato
isomorphism approach to the Riemann-Roch-Hirzebruch formula for an arbitrary
differential operator. Instead of the Grothendieck-Sato isomorphism, we use the
Topological Quantum Mechanics (more or less equivalent to the well-known
constructions with the Massey operations from [KS], [P], [Me]). The statement
that the Massey operations can ""produce"" the integral in some set-up, has an
independent from the RRH theorem interest.
  We finish the paper by some open questions arising when the main construction
is applied to the cyclic homology (instead of the Hochschild homology).
","[{""version"":""v1"",""created"":""Wed, 28 Jan 2004 16:26:56 GMT""}]","2007-05-23"
"math/0401401","Jaroslaw Wlodarczyk","Jaroslaw Wlodarczyk","Simple Hironaka resolution in characteristic zero","28 pages",,,,"math.AG math.CV",,"  Building upon work of Villamayor and Bierstone-Milman we give a proof of the
canonical Hironaka principalization and desingularization. The idea of
""homogenized ideals"" introduced in the paper gives {\it a priori} the
canonicity of algorithm and radically simplifies the proof.
","[{""version"":""v1"",""created"":""Wed, 28 Jan 2004 17:15:41 GMT""}]","2007-05-23"
"math/0401402","Hans-Otto Georgii","Hans-Otto Georgii, Hyun Jae Yoo","Conditional Intensity and Gibbsianness of Determinantal Point Processes","revised and extended","J. Statist. Phys. 118, 55-84 (2005)","10.1007/s10955-004-8777-5",,"math.PR math-ph math.MP",,"  The Papangelou intensities of determinantal (or fermion) point processes are
investigated. These exhibit a monotonicity property expressing the repulsive
nature of the interaction, and satisfy a bound implying stochastic domination
by a Poisson point process. We also show that determinantal point processes
satisfy the so-called condition $(\Sigma_{\lambda})$ which is a general form of
Gibbsianness. Under a continuity assumption, the Gibbsian conditional
probabilities can be identified explicitly.
","[{""version"":""v1"",""created"":""Wed, 28 Jan 2004 17:17:41 GMT""},{""version"":""v2"",""created"":""Tue, 14 Sep 2004 12:40:04 GMT""}]","2010-03-16"
"math/0401403","Amit Khetan","Amit Khetan, Carlos D'Andrea","Implicitization of rational surfaces using toric varieties","28 pages, 1 figure. Numerous major revisions. New proof of method of
  moving surfaces. Paper accepted and to appear in Journal of Algebra",,,,"math.AG math.AC",,"  A parameterized surface can be represented as a projection from a certain
toric surface. This generalizes the classical homogeneous and bihomogeneous
parameterizations. We extend to the toric case two methods for computing the
implicit equation of such a rational parameterized surface. The first approach
uses resultant matrices and gives an exact determinantal formula for the
implicit equation if the parameterization has no base points. In the case the
base points are isolated local complete intersections, we show that the
implicit equation can still be recovered by computing any non-zero maximal
minor of this matrix.
  The second method is the toric extension of the method of moving surfaces,
and involves finding linear and quadratic relations (syzygies) among the input
polynomials. When there are no base points, we show that these can be put
together into a square matrix whose determinant is the implicit equation. Its
extension to the case where there are base points is also explored.
","[{""version"":""v1"",""created"":""Wed, 28 Jan 2004 18:08:59 GMT""},{""version"":""v2"",""created"":""Mon, 16 May 2005 18:19:00 GMT""}]","2007-05-23"
"math/0401404","Nathan Reading","Nathan Reading","Lattice congruences of the weak order","26 pages, 4 figures","Order, 21 (2004) no.4, 315-344.",,,"math.CO",,"  We study the congruence lattice of the poset of regions of a hyperplane
arrangement, with particular emphasis on the weak order on a finite Coxeter
group. Our starting point is a theorem from a previous paper which gives a
geometric description of the poset of join-irreducibles of the congruence
lattice of the poset of regions in terms of certain polyhedral decompositions
of the hyperplanes. For a finite Coxeter system (W,S) and a subset K of S, let
\eta_K:w \mapsto w_K be the projection onto the parabolic subgroup W_K. We show
that the fibers of \eta_K constitute the smallest lattice congruence with
1\equiv s for every s\in(S-K). We give an algorithm for determining the
congruence lattice of the weak order for any finite Coxeter group and for a
finite Coxeter group of type A or B we define a directed graph on subsets or
signed subsets such that the transitive closure of the directed graph is the
poset of join-irreducibles of the congruence lattice of the weak order.
","[{""version"":""v1"",""created"":""Wed, 28 Jan 2004 19:15:03 GMT""}]","2009-09-29"
"math/0401405","Elena Rubei","Giorgio Ottaviani, Elena Rubei","Resolutions of homogeneous bundles on P^2","some minor changes; to appear in Annales de L'Institut Fourier",,,,"math.AG math.RT",,"  In this paper we characterize minimal free resolutions of homogeneous bundles
on P^2. Besides we study stability and simplicity of homogeneous bundles on P^2
by means of their minimal free resolutions; in particular we give a criterion
to see when a homogeneous bundle is simple by means of its minimal free
resolution in the case the first bundle of the resolution is irreducible.
","[{""version"":""v1"",""created"":""Wed, 28 Jan 2004 20:16:09 GMT""},{""version"":""v2"",""created"":""Fri, 22 Apr 2005 11:12:06 GMT""}]","2007-05-23"
"math/0401406","Jonathan Sondow","Jonathan Sondow","A Faster Product for Pi and a New Integral for ln(Pi/2)","7 pages, 1 figure, revision accepted for publication by Amer. Math.
  Monthly contains a product for e due to J. Guillera and two additional
  references, one by Hasse","Amer. Math. Monthly 112 (2005) 729-734",,,"math.NT math.CA math.GM",,"  From a global series for the alternating zeta function, we derive an infinite
product for pi that resembles the product for $e^\gamma$ ($\gamma$ is Euler's
constant) in math.CA/0306008. (An alternate derivation accelerates Wallis's
product by Euler's transformation.) We account for the resemblance via an
analytic continuation of the polylogarithm. An application is a 1-dim. analog
for ln(pi/2) of the 2-dim. integrals for ln(4/pi) and $\gamma$ in
math.CA/0211148.
","[{""version"":""v1"",""created"":""Wed, 28 Jan 2004 20:19:06 GMT""},{""version"":""v2"",""created"":""Tue, 13 Apr 2004 02:57:49 GMT""}]","2007-05-23"
"math/0401407","Martintxo Saralegi-Aranguren","M. Saralegi-Aranguren and R. Wolak","The BIC of a singular foliation defined by an abelian group of
  isometries",,"Ann. Polon. Math. 89(2006), 203-246",,,"math.DG math.AT",,"  We study the cohomology properties of the singular foliation $\F$ determined
by an action $\Phi \colon G \times M\to M$ where the abelian Lie group $G$
preserves a riemannian metric on the compact manifold $M$. More precisely, we
prove that the basic intersection cohomology $\lau{\IH}{*}{\per{p}}{\mf}$ is
finite dimensional and verifies the Poincar\'e Duality. This duality includes
two well-known situations:
  -- Poincar\'e Duality for basic cohomology (the action $\Phi$ is almost
free).
  -- Poincar\'e Duality for intersection cohomology (the group $G$ is compact
and connected).
","[{""version"":""v1"",""created"":""Wed, 28 Jan 2004 23:57:54 GMT""},{""version"":""v2"",""created"":""Thu, 15 Apr 2004 07:35:41 GMT""},{""version"":""v3"",""created"":""Tue, 25 May 2004 13:51:59 GMT""},{""version"":""v4"",""created"":""Tue, 24 May 2005 11:11:24 GMT""}]","2016-09-07"
"math/0401408","Marius Ionescu","Marius Ionescu","Operator Algebras and Mauldin Williams Graphs","14 pages, Latex; Rewrote parts of the introduction and the proof of
  the first main theorem",,,,"math.OA",,"  We describe a method for associating a $C^{*}$-correspondence to a
Mauldin-Williams graph and show that the Cuntz-Pimsner algebra of this
$C^{*}$-correspondence is isomorphic to the $C^{*}$-algebra of the underlying
graph. In addition, we analyze certain ideals of these $C^{*}$-algebras.
  We also investigate Mauldin-Williams graphs and fractal $C^{*}$-algebras in
the context of the Rieffel metric. This generalizes the work of Pinzari,
Watatani and Yonetani. Our main result here is a {}``no go'' theorem showing
that such algebras must come from the commutative setting.
","[{""version"":""v1"",""created"":""Thu, 29 Jan 2004 00:50:55 GMT""},{""version"":""v2"",""created"":""Fri, 16 Jul 2004 22:55:34 GMT""},{""version"":""v3"",""created"":""Wed, 11 Aug 2004 17:23:17 GMT""},{""version"":""v4"",""created"":""Fri, 22 Oct 2004 01:46:27 GMT""}]","2007-05-23"
"math/0401409","Alexander Braverman","Alexander Braverman","Instanton counting via affine Lie algebras I: Equivariant J-functions of
  (affine) flag manifolds and Whittaker vectors","To appear in the proceedings of the CRM workshop on algebraic
  structures and moduli spaces",,,,"math.AG hep-th math.RT",,"  For a semi-simple simply connected algebraic group G we introduce certain
parabolic analogues of the Nekrasov partition function (introduced by Nekrasov
and studied recently by Nekrasov-Okounkov and Nakajima-Yoshioka for G=SL(n)).
These functions count (roughly speaking) principal G-bundles on the projective
plane with a trivialization at infinity and with a parabolic structure at the
horizontal line. When the above parabolic subgroup is a Borel subgroup we show
that the corresponding partition function is basically equal to the Whittaker
matrix coefficient in the universal Verma module over certain affine Lie
algebra - namely, the one whose root system is dual to that of the affinization
of Lie(G). We explain how one can think about this result as the affine
analogue of the results of Givental and Kim about Gromov-Witten invariants
(more precisely, equivariant J-functions) of flag manifolds. Thus the main
result of the paper may considered as the computation of the equivariant
J-function of the affine flag manifold associated with G (in particular, we
reprove the corresponding results for the usual flag manifolds) via the
corresponding ""Langlands dual"" affine Lie algebra. As the main tool we use the
algebro-geometric version of the Uhlenbeck space introduced by Finkelberg,
Gaitsgory and the author. The connection of these results with the
Seiberg-Witten prepotential will be treated in a subsequent publication.
","[{""version"":""v1"",""created"":""Thu, 29 Jan 2004 00:55:46 GMT""},{""version"":""v2"",""created"":""Fri, 15 Oct 2004 16:51:01 GMT""}]","2007-05-23"
"math/0401410","Matti Lassas j","Kari Astala, Matti Lassas, Lassi Paivarinta","Calderon's inverse problem for anisotropic conductivity in the plane",,,,,"math.AP",,"  We study inverse conductivity problem for an anisotropic conductivity in
$L^\infty$ in bounded and unbounded domains. Also, we give applications of the
results in the case when Dirichlet-to-Neumann and Neumann-to-Dirichlet maps are
given only on a part of the boundary.
","[{""version"":""v1"",""created"":""Thu, 29 Jan 2004 08:03:32 GMT""}]","2007-05-23"
"math/0401411","Matthias Lesch","Matthias Lesch","The uniqueness of the spectral flow on spaces of unbounded self--adjoint
  Fredholm operators","32 pages, 2 figures; to appear in January 2005 in an AMS Contemporary
  Math Proceedings volume on 'Spectral Geometry of Manifolds with Boundary',
  edited by B. Booss--Bavnbek, G. Grubb and K.P. Wojciechowski","In: Spectral geometry of manifolds with boundary and decomposition
  of manifolds (B. Booss-Bavnbek and K. P. Wojciechowski Eds.), Contemp. Math.
  366, Amer. Math. Soc., Providence, 2005, pp. 193-224",,,"math.FA",,"  We discuss several natural metrics on spaces of unbounded self--adjoint
operators and their relations, among them the Riesz and the graph metric. We
show that the topologies of the spaces of Fredholm operators resp. invertible
operators depend heavily on the metric. Nevertheless we prove that in all cases
the spectral flow is up to a normalization the only integer invariant of
non-closed paths which is path additive and stable under homotopies with
endpoints varying in the space of invertible self-adjoint operators.
  Furthermore we show that for certain Riesz continuous paths of self--adjoint
Fredholm operators the spectral flow can be expressed in terms of the index of
the pair of positive spectral projections at the endpoints.
  Finally we review the Cordes--Labrousse theorem on the stability of the
Fredholm index with respect to the graph metric in a modern language and we
generalize it to the Clifford index and to the equivariant index.
","[{""version"":""v1"",""created"":""Thu, 29 Jan 2004 09:46:50 GMT""},{""version"":""v2"",""created"":""Tue, 27 Jul 2004 14:06:54 GMT""}]","2007-05-23"
"math/0401412","Iskander A. Taimanov","Iskander A. Taimanov","Surfaces in the four-space and the Davey--Stewartson equations","24 pages","J. of Geometry and Physics 56 (2006), 1235-1256","10.1016/j.geomphys.2005.06.013",,"math.DG math-ph math.MP",,"  We show that any equation from the Davey--Stewartson hierarchy induces an
infinite family of geometrically different deformations of tori in $\R^4$
preserving the Willmore functional. We expose a derivation of the Weierstrass
representation for surfaces in the four-space which is not unique in difference
from the case of surfaces in the three-space. This non-uniqueness implies that
the spectral curve of a torus in $\R^4$ is not uniquely defined as a complex
curve formed by the Floquet multipliers.
","[{""version"":""v1"",""created"":""Thu, 29 Jan 2004 11:35:58 GMT""}]","2009-11-10"
"math/0401413","Keizo Hasegawa","Keizo Hasegawa","Four-dimensional compact solvmanifolds with and without complex analytic
  structures","27 pages","Complex and Kaehler structures on compact solvmanifolds, J.
  Symplectic Geom., Vol. 3, No. 4, 2005.",,,"math.CV math.DG math.SG",,"  We classify four-dimensional compact solvmanifolds up to diffeomorphism,
while determining which of them have complex analytic structures. In
particular, we shall see that a four-dimensional compact solvmanifold S can be
written, up to double covering, as G/L where G is a simply connected solvable
Lie group and L is a lattice of G, and every complex structure J on S is the
canonical complex structure induced from a left-invariant complex structure on
G. We also give a complete list of all the complex structures on
four-dimensional compact homogeneous spaces, referring to their corresponding
complex surfaces.
","[{""version"":""v1"",""created"":""Thu, 29 Jan 2004 14:03:43 GMT""}]","2007-05-23"
"math/0401414","Martin Crossley","Francis Clarke, Martin Crossley, Sarah Whitehouse","Algebras of operations in K-theory","25 pages",,,,"math.KT math.AT",,"  We describe explicitly the algebras of degree zero operations in connective
and periodic p-local complex K-theory. Operations are written uniquely in terms
of certain infinite linear combinations of Adams operations, and we give
formulas for the product and coproduct structure maps. It is shown that these
rings of operations are not Noetherian. Versions of the results are provided
for the Adams summand and for real K-theory.
","[{""version"":""v1"",""created"":""Thu, 29 Jan 2004 14:35:42 GMT""}]","2007-05-23"
"nlin/0401043","Alexander Bershadskii","A. Bershadskii and K.R. Sreenivasan","Intermittency and the passive nature of the magnitude of the magnetic
  field",,"Physical Review Letters, 93 (2004) 064501","10.1103/PhysRevLett.93.064501",,"nlin.CD",,"  It is shown that the statistical properties of the magnitude of the magnetic
field in turbulent electrically conducting media resemble, in the inertial
range, those of passive scalars in fully developed three-dimensional fluid
turbulence. This conclusion, suggested by the data from Advanced Composition
Explorer, is supported by a brief analysis of the appropriate
magnetohydrodynamic equations.
","[{""version"":""v1"",""created"":""Thu, 29 Jan 2004 09:41:41 GMT""},{""version"":""v2"",""created"":""Mon, 2 Feb 2004 10:13:18 GMT""}]","2007-05-23"
"nlin/0401044","Alexander Bershadskii","A. Bershadskii, J.J. Niemela, A. Praskovsky and K.R. Sreenivasan","""Clusterization"" and intermittency of temperature fluctuations in
  turbulent convection",,"Physical Review E, 69 (2004) 056314","10.1103/PhysRevE.69.056314",,"nlin.CD",,"  Temperature time traces are obtained in turbulent thermal convection at high
Rayleigh numbers. Measurements are made in the midplane of the apparatus, near
the sidewall but outside the boundary layer. A telegraph approximation for
temperature traces is generated by setting the fluctuation amplitude to 1 or 0
depending on whether or not it exceeds the mean value. Unlike the standard
diagnostics of intermittency, the telegraph approximation allows one to
distinguish the tendency of events to cluster (""clusterization"") from their
large-scale variability in amplitude. A qualitative conclusion is that
amplitude intermittency might mitigate clusterization effects.
","[{""version"":""v1"",""created"":""Thu, 29 Jan 2004 10:23:42 GMT""}]","2007-05-23"
