"astro-ph/0401610","Steffen Mieske","S. Mieske, M. Hilker, L. Infante","Fornax compact object survey FCOS: On the nature of Ultra Compact Dwarf
  galaxies","15 pages, 11 figures, accepted for publication in A&A","Astron.Astrophys. 418 (2004) 445-458","10.1051/0004-6361:20035723",,"astro-ph",,"  The results of the Fornax Compact Object Survey (FCOS) are presented. The
FCOS aims at investigating the nature of the Ultra Compact Dwarf galaxies
(UCDs) recently discovered in the center of the Fornax cluster (Drinkwater et
al. 2000). 280 unresolved objects in the magnitude space covering UCDs and
bright globular clusters (18<V<21 mag) were observed spectroscopically. 54 new
Fornax members were discovered, plus five of the seven already known UCDs.
Their distribution in radial velocity, colour, magnitude and space was
investigated. It is found that bright compact objects (V<20 or M_V<-11.4 mag),
including the UCDs, have a higher mean velocity than faint compact objects
(V>20 mag) at 96% confidence. The mean velocity of the bright compact objects
is consistent with that of the dwarf galaxy population in Fornax, but
inconsistent with that of NGC 1399's globular cluster system at 93.5%
confidence. The compact objects follow a colour magnitude relation with a slope
very similar to that of normal dEs, but shifted about 0.2 mag redwards. The
magnitude distribution of compact objects shows a fluent transition between
UCDs and GCs with an overpopulation of 8 +/- 4 objects for V<20 mag with
respect to the extrapolation of NGC 1399's GC luminosity function. The spatial
distribution of bright compact objects is in comparison to the faint ones more
extended at 88% confidence. All our findings are consistent with the threshing
scenario (Bekki et al. 2003), suggesting that a substantial fraction of compact
Fornax members brighter than V~20 mag could be created by threshing dE,Ns.
Fainter than V~20 mag, the majority of the objects seem to be genuine GCs. Our
results are also consistent with merged stellar super-clusters (Fellhauer &
Kroupa 2002) as an alternative explanation for the bright compact objects.
","[{""version"":""v1"",""created"":""Thu, 29 Jan 2004 14:24:20 GMT""}]","2009-11-10"
"astro-ph/0401611","Antonino del Popolo","A. Del Popolo (1) and M. Gambera (2) ((1) Bergamo University, (2)
  Idem)","X-ray temperature distribution function of clusters in presence of large
  non-radial motions","14 pages, 2 encapsulated figures. In: Proceedings of "" The VII
  Conference on Theoretical Physics: General Relativity and Gravitation ""
  BISTRITZA - MAY 26-30, 1997 - Romania",,,,"astro-ph",,"  We consider the non-radial motions, originating in the outskirts of clusters
of galaxies and we show how it may reduce the discrepancy between Cold Dark
Matter (CDM) predicted X-ray temperature distribution function of clusters of
galaxies and that really observed, so resolving the problem of the X-ray
clusters abundance over-production predicted by the CDM model. We construct the
X-ray temperature distribution function using Press-Schechter's (1974) theory
and Evrard's (1990) prescriptions for the mass-temperature relation, taking
also account of the non-radial motions originating from the gravitational
interaction of the quadrupole moment of the protocluster. Then, we compare our
X-ray temperature distribution function with the tidal field of the matter of
the neighboring protostructures. We find that the model produces a reasonable
cluster temperature distribution.
","[{""version"":""v1"",""created"":""Thu, 29 Jan 2004 14:34:04 GMT""}]","2007-05-23"
"astro-ph/0401612","Tomasz Mizerski","Tomasz Mizerski","Multiperiodic RR Lyrae stars in the center of the Galaxy","13 pages, 6 figures","Acta Astronomica, Vol. 53 (2003), p. 307-320",,,"astro-ph",,"  This paper presents results of a fully automated search for multiperiodic RR
Lyrae stars in the center of the Galaxy. The search was carried out on OGLE-II
database created by means of image subtraction method. I found more than 2700
RR Lyrae stars with about 600 showing various kinds of multiperiodic behavior.
Previous OGLE-I database contained only about 200 RR Lyrae stars in the
Galactic Bulge, that is twelve times less than the current sample. There are
two most interesting outcomes for Bulge: very high percentage of Blazhko stars
and very low percentage of RRd stars. Blazhko effect was confirmed in about 25
percent of all RRab stars. This incidence rate is almost 2.5 times greater than
in the Large Magellanic Cloud. On the other hand I discovered only 3 RRd stars,
which implies that the incidence rate of this type of variables is much smaller
in Bulge than in the Magellanic Clouds.
","[{""version"":""v1"",""created"":""Thu, 29 Jan 2004 14:59:48 GMT""}]","2007-05-23"
"astro-ph/0401613","Manukovskij Konstantin Viktorovich","V.S. Imshennik (1), O.G. Ryazhskaya (2) ((1) ITEP Moscow, (2) INR RAS
  Moscow)","A Rotating Collapsar and Possible Interpretation of the LSD Neutrino
  Signal from SN 1987A","18 pages, 3 figures, 9 tables","Astron.Lett.30:14-31,2004","10.1134/1.1647473",,"astro-ph",,"  We consider an improved rotational mechanism of the explosion of a collapsing
supernova. We show that this mechanism leads to two-stage collapse with a phase
difference of \sim 5 h. Based on this model, we attempt a new interpretation of
the events in underground neutrino detectors on February 23, 1987, related to
the supernova SN 1987A.
","[{""version"":""v1"",""created"":""Thu, 29 Jan 2004 15:22:17 GMT""}]","2010-11-19"
"astro-ph/0401614","Victoria Kaspi","V. M. Kaspi (McGill), S. M. Ransom (McGill and MIT), D. C. Backer, R.
  Ramachandran, P. Demorest, J. Arons (UC Berkeley), A. Spitkovsky (UC Berkeley
  and KIPAC)","Green Bank Telescope Observations of the Eclipse of Pulsar ""A"" in the
  Double Pulsar Binary PSR J0737-3039","12 pages, 3 figures","Astrophys.J. 613 (2004) L137-L140","10.1086/425128",,"astro-ph",,"  We report on the first Green Bank Telescope observations at 427, 820 and 1400
MHz of the newly discovered, highly inclined and relativistic double pulsar
binary. We focus on the brief eclipse of PSR J0737-3039A, the faster pulsar,
when it passes behind PSR J0737-3039B. We measure a frequency-averaged eclipse
duration of 26.6 +/- 0.6 s, or 0.00301 +/- 0.00008 in orbital phase. The
eclipse duration is found to be significantly dependent on radio frequency,
with eclipses longer at lower frequencies. Specifically, eclipse duration is
well fit by a linear function having slope (-4.52 +/- 0.03) x 10^{-7}
orbits/MHz. We also detect significant asymmetry in the eclipse. Eclipse
ingress takes 3.51 +/- 0.99 times longer than egress, independent of radio
frequency. Additionally, the eclipse lasts (40 +/- 7) x 10^{-5} in orbital
phase longer after conjunction, also independent of frequency. We detect
significant emission from the pulsar on short time scales during eclipse in
some orbits. We discuss these results in the context of a model in which the
eclipsing material is a shock-heated plasma layer within the slower PSR
J0737-3039B's light cylinder, where the relativistic pressure of the faster
pulsar's wind confines the magnetosphere of the slower pulsar.
","[{""version"":""v1"",""created"":""Thu, 29 Jan 2004 15:43:06 GMT""},{""version"":""v2"",""created"":""Fri, 13 Aug 2004 21:19:24 GMT""},{""version"":""v3"",""created"":""Thu, 14 Oct 2004 18:03:52 GMT""}]","2009-11-10"
"astro-ph/0401615","Contini Thierry","F. Lamareille, M. Mouhcine, T. Contini, I. Lewis, S. Maddox","The Luminosity-Metallicity relation in the local universe from the 2dF
  Galaxy Redshift Survey","11 pages, 9 figures. Accepted for publication in MNRAS","Mon.Not.Roy.Astron.Soc. 350 (2004) 396","10.1111/j.1365-2966.2004.07697.x",,"astro-ph",,"  We investigate the Luminosity-Metallicity (L-Z) relation in the local
universe (z < 0.15) using spectra of 6387 star-forming galaxies extracted from
the 2dF Galaxy Redshift Survey. This sample is by far the largest to date used
to perform such a study. We distinguish star-forming galaxies from AGNs using
""standard"" diagnostic diagrams to build a homogeneous sample of starburst
galaxies for the L-Z study. We propose new diagnostic diagrams using ""blue""
emission lines ([OII]3727, [OIII]5007 and Hbeta) only to discriminate
starbursts from AGNs in intermediate-redshift (z > 0.3) galaxies.
Oxygen-to-hydrogen (O/H) abundance ratios are estimated using the ""strong-line""
method, which relates the strength of bright emission lines (parameters R23 and
O32) to O/H. We confirm the existence of the luminosity-metallicity relation
over a large range of abundances (~ 2 dex) and luminosities (~ 9 magnitudes).
We find a linear relation between the gas-phase oxygen abundance and both the
""raw"" and extinction-corrected absolute B-band magnitude with a rms of 0.27. A
similar relation, with nearly the same scatter, is found in the R band. This
relation is in good agreement with the one derived by Melbourne & Salzer (2002)
using the KISS data. However, our L-Z relation is much steeper than previous
determinations using samples of ""normal"" irregular and spiral galaxies. This
difference seems to be primarily due to the choice of the galaxy sample used to
investigate the L-Z relation rather than any systematic error affecting the O/H
determination. We anticipate that this luminosity-metallicity relation will be
used as the local ""reference"" for future studies of the evolution with cosmic
time of fundamental galaxy scaling relations. (Abridged version).
","[{""version"":""v1"",""created"":""Thu, 29 Jan 2004 15:59:02 GMT""}]","2009-11-10"
"cond-mat/0401568","Mikko Alava","M.J. Alava and S. Zapperi","Comment on: ""Roughness of Interfacial Crack Fronts: Stress-Weighted
  Percolation in the Damage Zone""","1 page, 1 figure","Physical Review Letters 92, 049601 (2004)","10.1103/PhysRevLett.92.049601",,"cond-mat.stat-mech",,"  This is a comment on J. Schmittbuhl, A. Hansen, and G. G. Batrouni, Phys.
Rev. Lett. 90, 045505 (2003). They offer a reply, in turn.
","[{""version"":""v1"",""created"":""Wed, 28 Jan 2004 17:44:10 GMT""}]","2009-11-10"
"cond-mat/0401578","Zeyher","A. Greco and R. Zeyher","C-Axis Tunneling Spectra in High-T$_c$ Superconductors in the Presence
  of a d Charge-Density Wave","12 pages, 16 figures","PRB 70, 024518 (2004)","10.1103/PhysRevB.70.024518",,"cond-mat.supr-con cond-mat.str-el",,"  The optimally doped and underdoped region of the $t-J$ model at large N (N is
the number of spin components) is governed by the competition of d-wave
superconductivity (SC) and a d Charge-Density Wave (d-CDW).The partial
destruction of the Fermi surface by the d-CDW and the resulting density of
states are discussed. Furthermore, c-axis conductances for incoherent and
coherent tunneling are calculated, considering both an isotropic and an
anisotropic in-plane momentum dependence of the hopping matrix element between
the planes. The influence of self-energy effects on the conductances is also
considered using a model where the electrons interact with a dispersionless,
low-lying branch of bosons. We show that available tunneling spectra from
break-junctions are best explained by assuming that they result from incoherent
tunneling with a strongly anisotropic hopping matrix element of the form
suggested by band structure calculations. The conductance spectra are then
characterized by one single peak which evolves continuously from the
superconducting to the d-CDW state with decreasing doping. The intrinsic c-axis
tunneling spectra are, on the other hand, best explained by coherent tunneling.
Calculated spectra show at low temperatures two peaks due to SC and d-CDW. With
increasing temperature the BCS-like peak moves to zero voltage and vanishes at
T$_c$,exactly as in experiment.Our results thus can explain why break junction
and intrinsic tunneling spectra are different from each other. Moreover, they
support a scenario of two competing order parameters in the underdoped region
of high-T$_c$ superconductors.
","[{""version"":""v1"",""created"":""Wed, 28 Jan 2004 20:18:13 GMT""}]","2010-06-16"
"cond-mat/0401585","Fabrice Gerbier","Fabrice Gerbier, Joseph H. Thywissen, Simon Richard, Mathilde Hugbart,
  Philippe Bouyer, Alain Aspect","Observation of deviations from ideal gas thermodynamics in a trapped
  Bose-Einstein condensed gas",,"Physical Review A 70 (2004) 013607","10.1103/PhysRevA.70.013607",,"cond-mat.other cond-mat.stat-mech",,"  We have investigated experimentally the finite-temperature properties of a
Bose-Einstein condensed cloud of $^{87}$Rb atoms in a harmonic trap. Focusing
primarily on condensed fraction and expansion energy, we measure unambiguous
deviations from ideal-gas thermodynamics, and obtain good agreement with a
Hartree-Fock description of the mixed cloud. Our results offer for the first
time clear evidence of the mutual interaction between the condensed and thermal
components. To probe the low-temperature region unaccessible to the usual
time-of-flight technique, we use coherent Bragg scattering as a filtering
technique for the condensate. This allows us to separate spatially the
condensed and normal components in time of flight, and to measure reliably
temperatures as low as $0.2 T_{\rm c}^0$ and thermal fractions as low as
10%.Finally, we observe evidence for the limitations of the usual image
analysis procedure, pointing out to the need for a more elaborate model of the
expansion of the mixed cloud.
","[{""version"":""v1"",""created"":""Wed, 28 Jan 2004 16:06:27 GMT""}]","2007-05-23"
"cond-mat/0401586","Yisroel Brumer","Yisroel Brumer and David R. Reichman","Numerical Investigation of the Entropy Crisis in Model Glass Formers","Submitted to J. Phys. Chem. B issue in honor of H.C. Andersen",,,,"cond-mat.soft cond-mat.stat-mech",,"  We investigate numerically the low temperature equilibration of glassy
systems via non-local Monte Carlo methods. We re-examine several systems that
have been studied previously and investigate new systems in order to test the
performance of such methods near the putative Kauzmann temperature, $T_K$,
where the configurational entropy is presumed to vanish. Our results suggest
that previous numerical claims in favor of and against a thermodynamic
transition at a finite $T_K$ must be re-evaluated. Our work provides some
guidelines and suggestions for future numerical investigations of disordered
systems at high densities and low temperatures.
","[{""version"":""v1"",""created"":""Wed, 28 Jan 2004 16:34:42 GMT""}]","2007-05-23"
"cond-mat/0401587","A. Smirnov","A. V. Smirnov, W. A. Shelton and D. D. Johnson","Importance of Thermal Disorder on the Properties of Alloys: Origin of
  Paramagnetism and Structural Anomalies in Iron-Aluminum","8 pages, 4 figures",,"10.1103/PhysRevB.71.064408",,"cond-mat.mtrl-sci",,"  The bcc-based Fe_{1-x}Al_{x} exhibit interesting magnetic and anomalous
structural properties as a function of composition and sample processing
conditions arising from thermal or off-stoichiometric chemical disorder, and,
although well studied, these properties are not understood. In stoichiometric
B2 FeAl, including the effects of partial long-range order (i.e., thermal
antisites), we find the observed paramagnetic response (with non-zero local
moments), in contrast to past investigations which find ferromagnetism based on
local density approximation (LDA) to density functional theory or which find a
non-magnetic state from LDA+U, both of which are inconsistent with experiment.
Moreover, from this magneto-chemical coupling, we are able to determine the
origins of the lattice constant anomalies found in Fe_{1-x}Al_{x} for x=25-50,
as observed from various processing conditions.
","[{""version"":""v1"",""created"":""Wed, 28 Jan 2004 19:17:35 GMT""}]","2009-11-10"
"cond-mat/0401588","Herv\'e Henry","Herve Henry","Spiral wave drift in an electric field and scroll wave instabilities","Phys Rev E accepted","Phys. Rev. E 70, 026204 (2004)","10.1103/PhysRevE.70.026204",,"cond-mat.soft nlin.PS physics.bio-ph",,"  I present the numerical computation of speed and direction of the drift of a
spiral wave in an excitable medium in the presence of an electric field. In
contrast to earlier results, the drift speed presents a strong variation close
to the parameter value where the drift speed component along the field changes
direction. Using a simple phenomenological model and results from a numerical
linear stability analysis of scroll waves, I show this behavior can be
attributed to a resonance of the meander modes with the translation modes of
the spiral wave. Extending this phenomenological model to scroll waves also
clarifies the link between the drift and long wavelength instabilities of
scroll waves.
","[{""version"":""v1"",""created"":""Wed, 28 Jan 2004 20:24:17 GMT""},{""version"":""v2"",""created"":""Thu, 3 Jun 2004 09:16:11 GMT""}]","2007-05-23"
"cond-mat/0401590","Vladimir L. Safonov","Vladimir L. Safonov","Microscopic mechanisms of magnetization reversal",,,"10.1063/1.1688681",,"cond-mat.other",,"  Two principal scenarios of magnetization reversal are considered. In the
first scenario all spins perform coherent motion and an excess of magnetic
energy directly goes to a nonmagnetic thermal bath. A general dynamic equation
is derived which includes a tensor damping term similar to the
Bloch-Bloembergen form but the magnetization magnitude remains constant for any
deviation from equilibrium. In the second reversal scenario, the absolute value
of the averaged sample magnetization is decreased by a rapid excitation of
nonlinear spin-wave resonances by uniform magnetization precession. We have
developed an analytic k-space micromagnetic approach that describes this entire
reversal process in an ultra-thin soft ferromagnetic film for up to 90^{o}
deviation from equilibrium. Conditions for the occurrence of the two scenarios
are discussed.
","[{""version"":""v1"",""created"":""Wed, 28 Jan 2004 21:23:02 GMT""}]","2009-11-10"
"cond-mat/0401591","Todd Brintlinger","B. M. Kim, T. Brintlinger, E. Cobas, Haimei Zheng, and M. S. Fuhrer
  (University of Maryland, College Park) Z. Yu, R. Droopad, J. Ramdani, and K.
  Eisenbeiser (Physical Sciences Research Laboratories, Motorola Labs, Tempe,
  Arizona)","High-Performance Carbon Nanotube Transistors on SrTiO3/Si Substrates","13 pages, 1 table, 3 figures, to appear in Appl. Phys. Lett","Applied Physics Letters 84, 1946 (2004)","10.1063/1.1682691",,"cond-mat.mes-hall",,"  Single-walled carbon nanotubes (SWNTs) have been grown via chemical vapor
deposition on high-kappa dielectric SrTiO3/Si substrates, and high-performance
semiconducting SWNT field-effect transistors have been fabricated using the
thin SrTiO3 as gate dielectric and Si as gate electrode. The transconductance
per channel width is 8900 S/m. The high transconductance cannot be explained by
the increased gate capacitance; it is proposed that the increased electric
field at the nanotube-electrode interface due to the high-kappa SrTiO3
decreases or eliminates the nanotube-electrode Schottky barrier.
","[{""version"":""v1"",""created"":""Wed, 28 Jan 2004 21:23:12 GMT""}]","2007-12-05"
"cond-mat/0401592","Mikko Alava","F. Reurings and M. J. Alava","Damage Growth in Random Fuse Networks",,,"10.1140/epjb/e2005-00292-2",,"cond-mat.stat-mech cond-mat.mtrl-sci",,"  The correlations among elements that break in random fuse network fracture
are studied, for disorder strong enough to allow for volume damage before final
failure. The growth of microfractures is found to be uncorrelated above a
lengthscale, that increases as the the final breakdown is approached. Since the
fuse network strength decreases with sample size, asymptotically the process
resembles more and more mean-field-like (``democratic fiber bundle'') fracture.
This is found from the microscopic dynamics of avalanches or microfractures,
from a study of damage localization via entropy, and from the final damage
profile. In particular, the last one is statistically constant, except exactly
at the final crack zone (in contrast to recent results by Hansen et al., Phys.
Rev. Lett. 90, 045504 (2003)), in spite of the fact that the fracture surfaces
are self-affine.
","[{""version"":""v1"",""created"":""Wed, 28 Jan 2004 21:25:25 GMT""}]","2009-11-10"
"cond-mat/0401593","Kazuto Ueno","K. Ueno","Pattern formation in crystal growth under parabolic shear flow II","18 pages","Phys. Rev. E. 69, 051604 (2004)","10.1103/PhysRevE.69.051604",,"cond-mat.mtrl-sci",,"  Wavy pattern of ice with a specific wavelength occurs during ice growth from
a thin layer of undercooled water flowing down the surface of icicles or
inclined plane. In the preceding paper [K. Ueno, Phys. Rev. E {\bf 68}, 021603
(2003)], we have found that restoring forces due to gravity and surface tension
is a factor for stabilization of morphological instability of the solid-liquid
interface. However, the mechanism for the morphological instability and
stability of the solid-liquid interface has not been well understood. In the
present paper, it is shown that a phase difference between fluctuation of the
solid-liquid interface and distribution of heat flux at the deformed
solid-liquid interface, which depends on the magnitude of the restoring forces,
is a cause of the instability and stability of the interface. This mechanism is
completely different from the usual Mullins-Sekerka instability due to
diffusion and stabilization due to the Gibbs-Thomson effect.
","[{""version"":""v1"",""created"":""Wed, 28 Jan 2004 22:01:17 GMT""}]","2009-11-10"
"cond-mat/0401594","Marcel Franz","T. Pereg-Barnea (KITP, UBC) and M. Franz (UBC)","Quasiparticle interference patterns as a test for the nature of the
  pseudogap phase in the cuprate superconductors","15 pages REVTeX + 9 ps figures. For related work and info visit
  http://www.physics.ubc.ca/~franz; version 2 to appear in IJMPB","International Journal of Modern Physics B, Vol. 19, No. 4 (2005)
  731-761","10.1142/S0217979205026658","NSF-KITP-04-11","cond-mat.supr-con cond-mat.str-el",,"  Electrons, when scattered by static random disorder, form standing waves that
can be imaged using scanning tunneling microscopy. Such interference patterns,
observable by the recently developed technique of Fourier transform scanning
tunneling spectroscopy (FT-STS), are shown to carry unique fingerprints
characteristic of the electronic order present in a material. We exploit this
feature of the FT-STS technique to propose a test for the nature of the
enigmatic pseudogap phase in the high-$T_c$ cuprate superconductors. Through
their sensitivity to the quasiparticle spectra and coherence factors, the
FT-STS patterns in principle carry enough information to unambiguously
determine the nature of the condensate responsible for the pseudogap
phenomenon. We argue that the next generation of FT-STS experiments, currently
underway, should be able to distinguish between the pseudogap dominated by the
remnants of superconducting order from the pseudogap dominated by some
competing order in the particle-hole channel. Using general arguments and
detailed numerical calculations, we point to certain fundamental differences
between the two scenarios and discuss the prospects for future experiments.
","[{""version"":""v1"",""created"":""Wed, 28 Jan 2004 22:20:59 GMT""},{""version"":""v2"",""created"":""Mon, 2 May 2005 21:47:43 GMT""}]","2007-05-23"
"cond-mat/0401595","Yunori Nisikawa","Yunori Nisikawa, Hiroaki Ikeda, Kosaku Yamada","Possible Pairing Symmetry of Superconductor Na_xCoO_2yH_2O","10 pages, 5 figures","J. Phys. Soc. Jpn. 73, 1127-1130 (2004)","10.1143/JPSJ.73.1127",,"cond-mat.supr-con cond-mat.mtrl-sci",,"  To discuss a possibility that the superconductivities in Na_xCoO_2yH_2O are
induced by the electron correlation, we investigate the possible pairing
symmetry based on the single-band Hubbard model whose dispersion of the bare
energy band is obtained by using FLAPW-LDA band structure calculation of
Na_xCoO_2yH_2O. The superconducting transition temperature is estimated by
solving the Eliashberg equation. In this equation, both normal and anomalous
self-energies are calculated up to the third-order terms with respect to the
Coulomb repulsion. In the case of spin-singlet pairing, the candidate of
pairing symmetry (the maximum eigen value \lambda_max^SS of Eliashberg's
equation) belongs to d-wave(E_2 representation of D_6 group). In the case of
spin-triplet pairing, the candidate of pairing symmetry (the maximum eigen
value \lambda_max^ST of Eliashberg's equation) belongs to
f_{y(y^{2}-3x^{2})}-wave (B_1 representation of D_6 group). It is found that
\lambda_max^SS\simeq\lambda_max^ST and the transition temperatures of
unconventional pairing state are estimated to be low compared with observed
temperature within our simple model.
","[{""version"":""v1"",""created"":""Thu, 29 Jan 2004 01:57:57 GMT""},{""version"":""v2"",""created"":""Sat, 31 Jan 2004 01:52:07 GMT""},{""version"":""v3"",""created"":""Wed, 21 Apr 2004 17:06:01 GMT""},{""version"":""v4"",""created"":""Wed, 21 Apr 2004 23:35:33 GMT""},{""version"":""v5"",""created"":""Tue, 18 Apr 2006 02:25:01 GMT""}]","2007-05-23"
