"astro-ph/0408011","William Frith","W.J. Frith, P.J. Outram & T. Shanks","The Large Local Hole in the Galaxy Distribution: The 2MASS Galaxy
  Angular Power Spectrum","10 pages, 5 figures to appear in proceedings of Nearby Large-Scale
  Structures and the Zone of Avoidance, ASP Conf. Ser., Eds. T. Fairall and P.
  Woudt",,,,"astro-ph",,"  We present new evidence for a large deficiency in the local galaxy
distribution situated in the 4000 sq.deg. APM survey area. We use models guided
by the 2dF Galaxy Redshift Survey (2dFGRS) n(z) as a probe of the underlying
LSS. We first check the usefulness of this technique by comparing the 2dFGRS
n(z) model prediction with the K-band and B-band number counts extracted from
the 2MASS and 2dFGRS parent catalogues over the 2dFGRS Northern and Southern
declination strips, before turning to a comparison with the APM counts. We find
that the APM counts in both the B and K-bands indicate a deficiency in the
local galaxy distribution of approx. 30% to z=0.1 over the entire APM survey
area. We examine the implied significance of such a large local hole,
considering several possible forms for the real-space correlation function. We
find that such a deficiency in the APM survey area indicates an excess of power
at large scales over what is expected from the correlation function observed in
the 2dFGRS correlation function or predicted from $\Lambda$CDM Hubble Volume
mock catalogues. In order to check further the clustering at large scales in
the 2MASS data, we have calculated the angular power spectrum for 2MASS
galaxies. Although in the linear regime (l<30), LCDM models can give a good fit
to the 2MASS angular power spectrum, over a wider range (l<100) the power
spectrum from Hubble Volume mock catalogues suggests that scale-dependent bias
may be needed for LCDM to fit. However, the modest increase in large-scale
power observed in the 2MASS angular power spectrum is still not enough to
explain the local hole.
","[{""version"":""v1"",""created"":""Sat, 31 Jul 2004 17:26:44 GMT""}]","2007-05-23"
"astro-ph/0408012","Marco Fatuzzo","M. Fatuzzo, F. C. Adams, and P. C. Myers","Generalized Collapse Solutions with Nonzero Initial Velocities for Star
  Formation in Molecular Cloud Cores","48 pages, 13 figures, accepted for publication to The Astrophysical
  Journal","Astrophys.J. 615 (2004) 813-831","10.1086/424656",,"astro-ph",,"  Motivated by recent observations that show starless molecular cloud cores
exhibit subsonic inward velocities, we revisit the collapse problem for
polytropic gaseous spheres. In particular, we provide a generalized treatment
of protostellar collapse in the spherical limit and find semi-analytic
(self-similar) solutions, corresponding numerical solutions, and purely
analytic calculations of the mass infall rates (the three approaches are in
good agreement). This study focuses on collapse solutions that exhibit nonzero
inward velocities at large radii, as observed in molecular cloud cores, and
extends previous work in four ways: (1) The initial conditions allow nonzero
initial inward velocity. (2) The starting states can exceed the density of
hydrostatic equilibrium so that the collapse itself can provide the observed
inward motions. (3) We consider different equations of state, especially those
that are softer than isothermal. (4) We consider dynamic equations of state
that are different from the effective equation of state that produces the
initial density distribution. This work determines the infall rates over a wide
range of parameter space, as characterized by four variables: the initial
inward velocity $\vin$, the overdensity $\overdense$ of the initial state, the
index $\Gamma$ of the static equation of state, and the index $\gamma$ of the
dynamic equation of state. For the range of parameter space applicable to
observed cores, the resulting infall rate is about a factor of two larger than
found in previous theoretical studies (those with hydrostatic initial
conditions and $\vin = 0$).
","[{""version"":""v1"",""created"":""Sat, 31 Jul 2004 20:15:59 GMT""},{""version"":""v2"",""created"":""Fri, 6 May 2005 16:58:42 GMT""}]","2009-11-10"
"astro-ph/0408013","Alberto Saa","Fabio C. Carvalho and Alberto Saa","Non-minimal coupling, exponential potentials and the $w<-1$ regime of
  dark energy","5 pages, 4 figures","Phys.Rev. D70 (2004) 087302","10.1103/PhysRevD.70.087302",,"astro-ph gr-qc",,"  Recent observations and theoretical considerations have motivated the study
of models for dark energy with equation of state characterized by a parameter
$w=p/\rho<-1$. Such models, however, are usually believed to be inviable due to
their instabilities against classical perturbations or potentially catastrophic
vacuum decays. In this paper, we show that a simple quintessential model with
potential $V(\phi)=Ae^{-\sigma\phi}$ and a gravitational coupling of the form
$(1+|\xi|\phi^2)R$ can exhibit, for large sets of initial conditions,
asymptotic de Sitter behavior with $w<-1$ regimes. Nevertheless, the model is
indeed stable at classical and quantum level.
","[{""version"":""v1"",""created"":""Sun, 1 Aug 2004 03:39:32 GMT""},{""version"":""v2"",""created"":""Fri, 17 Sep 2004 20:56:13 GMT""}]","2009-11-10"
"astro-ph/0408014","Paul Davies","P.C.W. Davies","Emergent biological principles and the computational properties of the
  universe","9 pages. no figures, research paper","Complexity 10 (2004) 1",,,"astro-ph",,"  The claim that life is an emergent phenomenon exhibiting novel properties and
principles is often criticized for being in conflict with causal closure at the
microscopic level. I argue that advances in cosmological theory suggesting an
upper bound on the information processing capacity of the universe may resolve
this conflict for systems exceeding a certain threshold of complexity. A
numerical estimate of the threshold places it at the level of a small protein.
The calculation supports the contention that life is an emergent phenomenon.
","[{""version"":""v1"",""created"":""Sun, 1 Aug 2004 05:40:21 GMT""}]","2007-05-23"
"cond-mat/0408009","Alexey N. Rubtsov","A.N. Rubtsov and A.I.Lichtenstein","Continuous Time Quantum Monte Carlo Method for Fermions: Beyond
  Auxiliary Field Framework",,"Pis'ma v JETP v.80 p.67-71 (2004)","10.1134/1.1800216",,"cond-mat.str-el",,"  Numerically exact continuous-time Quantum Monte Carlo algorithm for finite
fermionic systems with non-local interactions is proposed. The scheme is
particularly applicable for general multi-band time-dependent correlations
since it does not invoke Hubbard-Stratonovich transformation. The present
determinantal grand-canonical method is based on a stochastic series expansion
for the partition function in the interaction representation. The results for
the Green function and for the time-dependent susceptibility of multi-orbital
super-symmetric impurity model with a spin-flip interaction are presented.
","[{""version"":""v1"",""created"":""Sat, 31 Jul 2004 17:30:37 GMT""}]","2009-11-10"
"cond-mat/0408010","Nathan W. Mueggenburg","Nathan W. Mueggenburg","The Behavior of Granular Materials under Cyclic Shear","10 pages including 12 figures",,"10.1103/PhysRevE.71.031301",,"cond-mat.soft cond-mat.dis-nn",,"  The design and development of a parallel plate shear cell for the study of
large scale shear flows in granular materials is presented. The parallel plate
geometry allows for shear studies without the effects of curvature found in the
more common Couette experiments. A system of independently movable slats
creates a well with side walls that deform in response to the motions of grains
within the pack. This allows for true parallel plate shear with minimal
interference from the containing geometry. The motions of the side walls also
allow for a direct measurement of the velocity profile across the granular
pack. Results are presented for applying this system to the study of transients
in granular shear and for shear-induced crystallization. Initial shear profiles
are found to vary from packing to packing, ranging from a linear profile across
the entire system to an exponential decay with a width of approximately 6 bead
diameters. As the system is sheared, the velocity profile becomes much sharper,
resembling an exponential decay with a width of roughly 3 bead diameters.
Further shearing produces velocity profiles which can no longer be fit to an
exponential decay, but are better represented as a Gaussian decay or error
function profile. Cyclic shear is found to produce large scale ordering of the
granular pack, which has a profound impact on the shear profile. There exist
periods of time in which there is slipping between layers as well as periods of
time in which the layered particles lock together resulting in very little
relative motion.
","[{""version"":""v1"",""created"":""Sat, 31 Jul 2004 19:17:04 GMT""}]","2009-11-10"
"cond-mat/0408011","Bozidar Mitrovic","B. Mitrovic","On the rate of Tc suppression by the interband impurity scattering in
  MgB2","12 pages, 3 figures","J. Phys.: Condens. Matter 16 9013-9022 (2004)","10.1088/0953-8984/16/49/016",,"cond-mat.supr-con",,"  We calculate the change in the superconducting transition temperature Tc of
MgB2 caused by interband nonmagnetic impurity scattering using the Eliashberg
theory for the two-band model of this compound. Much slower rate of Tc
suppression is obtained compared to the prediction based on the BCS treatment
of the two-band model which ignores renormalization and damping associated with
the electron-phonon interaction. Hence, the interband impurity scattering rates
deduced from experiments on MgB2 using the formula which results from the BCS
approach to the two-band model are underestimated. We generalize the BCS
treatment of the two-band model to include renormalization effects of the
electron-phonon interaction and find an excellent agreement with the full
strong coupling calculation.
","[{""version"":""v1"",""created"":""Sat, 31 Jul 2004 21:04:54 GMT""},{""version"":""v2"",""created"":""Thu, 2 Dec 2004 16:19:54 GMT""}]","2009-09-29"
"cond-mat/0408012","Shin-Ichi Sasa","Shin-ichi Sasa","Long range spatial correlation between two Brownian particles under
  external driving","11 pages",,"10.1016/j.physd.2005.02.004",,"cond-mat.stat-mech",,"  We study the large distance behavior of a steady distribution of two Brownian
particles under external driving in a two-dimensional space. Employing a method
of perturbative system reduction, we analyze a Fokker-Planck equation that
describes the time evolution of the probability density for the two particles.
The expression we obtain shows that there exist a long range correlation
between the two particles, of $1/r^2$ type.
","[{""version"":""v1"",""created"":""Sun, 1 Aug 2004 13:40:36 GMT""}]","2009-11-10"
"cond-mat/0408013","Constantinos Vorlow","Constantinos E. Vorlow","Stock Price Clustering and Discreteness: The ""Compass Rose"" and
  Predictability","13 Pages, 2 Figures, 2 Tables",,,,"cond-mat.other q-fin.GN q-fin.PR",,"  In this letter we investigate the information provided by the ""compass rose""
(Crack, T.F. and Ledoit, O. (1996), Journal of Finance, 51(2), pg. 751-762)
patterns revealed in phase portraits of daily stock returns. It has been
initially suggested that the compass rose is just a manifestation of price
clustering and discreteness and the tick size, factors that can affect the
unbiasedness of an array of statistical tests based on stock returns. We show
that this may not entirely be the case.
","[{""version"":""v1"",""created"":""Sun, 1 Aug 2004 10:56:46 GMT""}]","2008-12-08"
"cond-mat/0408014","Takashi Kimura","Takashi Kimura, Shunji Tsuchiya, and Susumu Kurihara","First-order superfluid-Mott insulator transition of spinor bosons in an
  optical lattice",,"Phys. Rev. Lett. 94, 110403 (2005)","10.1103/PhysRevLett.94.110403",,"cond-mat.stat-mech",,"  We study the superfluid-Mott insulator transition of antiferromagnetic spin-1
bosons in an optical lattice described by a Bose-Hubbard model. Our variational
study with the Gutzwiller-type trial wave function determines that the
superfluid-Mott insulator transition is a first-order one at a part of the
phase boundary curve, contrary to the spinless case. This first-order
transition may be observed through an experiment, such as a Stern-Gerlach type,
under a magnetic field.
","[{""version"":""v1"",""created"":""Sun, 1 Aug 2004 10:47:26 GMT""}]","2009-11-10"
"cond-mat/0408015","Markus Kriener","M. Kriener, P. Steffens, J. Baier, O. Schumann, T. Zabel, T. Lorenz,
  O. Friedt, R. Mueller, A. Gukasov, P. Radaelli, P. Reutler, A. Revcolevschi,
  S. Nakatsuji, Y. Maeno and M. Braden","Structural aspects of metamagnetism in Ca_{2-x}Sr_{x}RuO_4 (0.2 < x <
  0.5): field tuning of orbital occupation","4 pages, 4 figures, submitted to Physical Review Letters","Phys. Rev. Lett. 95, 267403 (2005)","10.1103/PhysRevLett.95.267403",,"cond-mat.str-el",,"  The crystal structure of Ca_{2-x}Sr_xRuO_4 with 0.2 < x < 1.0 has been
studied by diffraction techniques and by high resolution capacitance
dilatometry as a function of temperature and magnetic field. Upon cooling in
zero magnetic field below about 25 K the structure shrinks along the
c-direction and elongates in the a, b planes (0.2 < x < 1.0), whereas the
opposite occurs upon cooling at high-field (x = 0.2 and 0.5). These findings
indicate an orbital rearrangement driven by temperature and magnetic field,
which accompanies the metamagnetic transition in these compounds.
","[{""version"":""v1"",""created"":""Sun, 1 Aug 2004 12:17:23 GMT""}]","2008-02-13"
"cond-mat/0408016","Mikhail Kiselev","M.N. Kiselev, D.N. Aristov, K.Kikoin","Spin Gap in Chains with Hidden Symmetries","4 pages, 2 EPS figures","Phys. Rev. B 71, 092404 (2005)","10.1103/PhysRevB.71.092404",,"cond-mat.str-el",,"  We investigate the formation of spin gap in one-dimensional models
characterized by the groups with hidden dynamical symmetries. A family of
two-parametric models of isotropic and anisotropic Spin-Rotator Chains
characterized by SU(2)x SU(2) and SO(2)x SO(2)x Z_2 x Z_2 symmetries is
introduced to describe the transition from SU(2) to SO(4) antiferromagnetic
Heisenberg chain. The excitation spectrum is studied with the use of the
Jordan-Wigner transformation generalized for o_4 algebra and by means of
bosonization approach. Hidden discrete symmetries associated with invariance
under various particle-hole transformations are discussed. We show that the
spin gap in SRC Hamiltonians is characterized by the scaling dimension 2/3 in
contrast to dimension 1 in conventional Haldane problem.
","[{""version"":""v1"",""created"":""Sun, 1 Aug 2004 12:38:29 GMT""}]","2009-11-10"
"cond-mat/0408017","Ingve Simonsen","Ingve Simonsen (NTNU, Trondheim, Norway)","A random walk through surface scattering phenomena: Theory and
  phenomenology","73 pages, Review paper",,,,"cond-mat.stat-mech physics.optics",,"  No surface is perfectly planar at all scales. The notion of flatness of a
surface therefore depends on the size of the probe used to observe it. As a
consequence rough interfaces are abundant in nature. Here the old, but still
active field of rough surface scattering of electromagnetic waves is addressed.
This topic has implications and practical applications in fields as diverse as
observational astronomy and the electronics industry. This article reviews the
theoretical and computational foundation and methods used in the study of rough
surface scattering. Furthermore, it presents and explains the physical origin
of a series of multiple scattering surface phenomena. In particular what is
discussed are: the enhanced backscattering and satellite peak phenomena,
coherent effects in angular intensity correlation functions and second harmonic
generated light (a non-linear effect).
","[{""version"":""v1"",""created"":""Sun, 1 Aug 2004 14:43:02 GMT""}]","2007-05-23"
"cs/0408004","Thomas Schmidt C.","Michael Engelhardt, Andreas K\'arp\'ati, Torsten Rack, Ivette Schmidt,
  Thomas C. Schmidt","Hypermedia Learning Objects System - On the Way to a Semantic
  Educational Web","11 pages, 7 figures","Proceedings of the International Workshop {""}Interactive Computer
  aided Learning{""} ICL 2003. Learning Objects and Reusability of Content,
  Kassel University Press 2003, ISBN 3-89958-029-X",,,"cs.IR cs.LG",,"  While eLearning systems become more and more popular in daily education,
available applications lack opportunities to structure, annotate and manage
their contents in a high-level fashion. General efforts to improve these
deficits are taken by initiatives to define rich meta data sets and a
semanticWeb layer. In the present paper we introduce Hylos, an online learning
system. Hylos is based on a cellular eLearning Object (ELO) information model
encapsulating meta data conforming to the LOM standard. Content management is
provisioned on this semantic meta data level and allows for variable,
dynamically adaptable access structures. Context aware multifunctional links
permit a systematic navigation depending on the learners and didactic needs,
thereby exploring the capabilities of the semantic web. Hylos is built upon the
more general Multimedia Information Repository (MIR) and the MIR adaptive
context linking environment (MIRaCLE), its linking extension. MIR is an open
system supporting the standards XML, Corba and JNDI. Hylos benefits from
manageable information structures, sophisticated access logic and high-level
authoring tools like the ELO editor responsible for the semi-manual creation of
meta data and WYSIWYG like content editing.
","[{""version"":""v1"",""created"":""Sat, 31 Jul 2004 22:16:37 GMT""}]","2007-05-23"
"cs/0408005","Thomas C. Schmidt","Michael Engelhardt, Arne Hildebrand, Andreas K\'arp\'ati, Torsten
  Rack, Thomas C. Schmidt","Educational Content Management - A Cellular Approach","9 pages, 6 figures","Proceedings of the International Workshop ""Interactive Computer
  aided Learning"" ICL 2002. Blended Learning. Kassel University Press 2002,
  ISBN 3-933146-83-6",,,"cs.CY cs.IR",,"  In recent times online educational applications more and more are requested
to provide self-consistent learning offers for students at the university
level. Consequently they need to cope with the wide range of complexity and
interrelations university course teaching brings along. An urgent need to
overcome simplistically linked HTMLc ontent pages becomes apparent. In the
present paper we discuss a schematic concept of educational content
construction from information cells and introduce its implementation on the
storage and runtime layer. Starting from cells content is annotated according
to didactic needs, structured for dynamic arrangement, dynamically decorated
with hyperlinks and, as all works are based on XML, open to any presentation
layer. Data can be variably accessed through URIs built on semantic path-names
and edited via an adaptive authoring toolbox. Our content management approach
is based on the more general Multimedia Information Repository MIR. and allows
for personalisation, as well. MIR is an open system supporting the standards
XML, Corba and JNDI.
","[{""version"":""v1"",""created"":""Sun, 1 Aug 2004 11:34:32 GMT""}]","2007-05-23"
"cs/0408006","Boris D. Lubachevsky","Vigen A. Geodakian","Why Two Sexes?","12 pages, 3 figures","Nauka i zhizn (Science and Life), 1965",,,"cs.NE cs.GL q-bio.PE",,"  Evolutionary role of the separation into two sexes from a cyberneticist's
point of view. [I translated this 1965 article from Russian ""Nauka i Zhizn""
(Science and Life) in 1988. In a popular form, the article puts forward several
useful ideas not all of which even today are necessarily well known or widely
accepted. Boris Lubachevsky, bdl@bell-labs.com ]
","[{""version"":""v1"",""created"":""Sun, 1 Aug 2004 15:04:53 GMT""}]","2007-05-23"
"gr-qc/0408003","Matthew Anderson","Richard A. Matzner","Hyperbolicity and Constrained Evolution in Linearized Gravity","18 pages","Phys.Rev. D71 (2005) 024011","10.1103/PhysRevD.71.024011",,"gr-qc",,"  Solving the 4-d Einstein equations as evolution in time requires solving
equations of two types: the four elliptic initial data (constraint) equations,
followed by the six second order evolution equations. Analytically the
constraint equations remain solved under the action of the evolution, and one
approach is to simply monitor them ({\it unconstrained} evolution). Since
computational solution of differential equations introduces almost inevitable
errors, it is clearly ""more correct"" to introduce a scheme which actively
maintains the constraints by solution ({\it constrained} evolution). This has
shown promise in computational settings, but the analysis of the resulting
mixed elliptic hyperbolic method has not been completely carried out. We
present such an analysis for one method of constrained evolution, applied to a
simple vacuum system, linearized gravitational waves.
  We begin with a study of the hyperbolicity of the unconstrained Einstein
equations. (Because the study of hyperbolicity deals only with the highest
derivative order in the equations, linearization loses no essential details.)
We then give explicit analytical construction of the effect of initial data
setting and constrained evolution for linearized gravitational waves. While
this is clearly a toy model with regard to constrained evolution, certain
interesting features are found which have relevance to the full nonlinear
Einstein equations.
","[{""version"":""v1"",""created"":""Sat, 31 Jul 2004 19:10:36 GMT""}]","2009-11-10"
"gr-qc/0408004","Hamid Reza Sepangi","S. Jalalzadeh and H. R. Sepangi","Classical and quantum dynamics of confined test particles in brane
  gravity","15 pages, no figures, extended, references added","Class.Quant.Grav. 22 (2005) 2035-2048","10.1088/0264-9381/22/11/008",,"gr-qc hep-th",,"  A model is constructed for the confinement of test particles moving on a
brane. Within the classical framework of this theory, confining a test particle
to the brane eliminates the effects of extra dimensions, rendering them
undetectable. However, in the quantized version of the theory, the effects of
the gauge fields and extrinsic curvature are pronounced and this might provide
a hint for detecting them. As a consequence of confinement the mass of the test
particle is shown to be quantized. The condition of stability against small
perturbations along extra dimensions is also studied and its relation to dark
matter is discussed.
","[{""version"":""v1"",""created"":""Sun, 1 Aug 2004 07:55:32 GMT""},{""version"":""v2"",""created"":""Sun, 19 Sep 2004 11:32:33 GMT""},{""version"":""v3"",""created"":""Tue, 22 Feb 2005 14:44:57 GMT""},{""version"":""v4"",""created"":""Wed, 11 May 2005 07:53:09 GMT""}]","2009-11-10"
"hep-ex/0408002","Elke-Caroline Aschenauer","HERMES Collaboration: E.Avetisyan, et al","Beam-Spin Azimuthal Asymmetries in Pion Electroproduction at HERMES","To appear in the proceedings of the 12th International Workshop on
  Deep Inelastic Scattering and QCD, Strbske Pleso, High Tatras, Slovakia, Apr
  14 - 18, 2004",,,,"hep-ex",,"  We present the measurement of Single Beam-Spin Azimuthal Asymmetries in pion
electroproduction off hydrogen in semi-inclusive deep inelastic scattering
(SIDIS). The measurement was made using the HERMES spectrometer with an
internal gas target and the polarized 27.6 GeV electron(positron) beam of HERA
using the data taken during the years 1996-2000. The $\sin\phi$ modulation of
the azimuthal asymmetry was measured for semi-inclusive $\pi^+,\pi^-$ and
$\pi^0$. The dependence of the asymmetry on the Bjorken $x$, pion relative
($z$) and transverse ($P_T$) momentum is presented. Results are compared to
theoretical model calculation.
","[{""version"":""v1"",""created"":""Sun, 1 Aug 2004 08:36:22 GMT""},{""version"":""v2"",""created"":""Fri, 6 Aug 2004 13:46:34 GMT""}]","2012-08-03"
"hep-lat/0408001","Sadataka Furui","Hideo Nakajima and Sadataka Furui","Numerical Study of Lattice Landau Gauge QCD and the Gribov Copy Problem","6pages, 4 figures, QCDDOWNUNDER conference (2004) proceedings",,"10.1016/j.nuclphysbps.2004.12.006",,"hep-lat",,"  The infrared properties of lattice Landau gauge QCD of SU(3) are studied by
measuring gluon propagator, ghost propagator, QCD running coupling and
Kugo-Ojima parameter of $\beta=6.0, 16^4,24^4,32^4$ and $\beta=6.4, 32^4, 48^4,
56^4$ lattices. By the larger lattice measurements, we observe that the
runnning coupling measured by the product of the gluon dressing function and
the ghost dressing function squared rescaled to the perturbative QCD results
near the highest lattice momentum has the maximum of about 2.2 at around
$q=0.5$ GeV/c, and behaves either approaching constant or even decreasing as
$q$ approaches zero. The magnitude of the Kugo-Ojima parameter is getting
larger but staying around -0.83 in contrast to the expected value -1 in the
continuum theory. We observe, however, there is an exceptional sample which has
larger magnitude of the Kugo-Ojima parameter and stronger infrared singularity
of the ghost propagator. The reflection positivity of the 1-d Fourier transform
of the gluon propagator of the exceptional sample is manifestly violated.
  Gribov noise problem was studied by performing the fundamental modular gauge
(FMG) fixing with use of the parallel tempering method of $\beta=2.2, 16^4$
SU(2) configurations. Findings are that the gluon propagator almost does not
suffer noises, but the Kugo-Ojima parameter and the ghost propagator in the FMG
becomes $\sim 5$% less in the infrared region than those suffering noises. It
is expected that these qualitative aspects seen in SU(2) will reflect in the
infrared properties of SU(3) QCD as well.
","[{""version"":""v1"",""created"":""Sun, 1 Aug 2004 06:21:52 GMT""}]","2009-11-10"
