"cond-mat/0408396","Hikaru Kawamura","Takahiro Mori and Hikaru Kawamura","Simulation study of spatio-temporal correlations of earthquakes as a
  stick-slip frictional instability",,"Phys. Rev. Letters 94, 058501 (2005).","10.1103/PhysRevLett.94.058501",,"cond-mat.other physics.geo-ph",,"  Spatio-temporal correlations of earthquakes are studied numerically on the
basis of the one-dimensional spring-block (Burridge-Knopoff) model. As large
events approach, the frequency of smaller events gradually increases, while,
just before the mainshock, it is dramatically suppressed in a close vicinity of
the epicenter of the upcoming mainshock, a phenomenon closely resembling the
``Mogi doughnut''
","[{""version"":""v1"",""created"":""Wed, 18 Aug 2004 10:02:30 GMT""},{""version"":""v2"",""created"":""Tue, 8 Feb 2005 02:29:09 GMT""}]","2009-11-10"
"cond-mat/0408397","Karlo Penc","K. Penc, N. Shannon, and H. Shiba","Half-magnetization plateau stabilized by structural distortion in the
  antiferromagnetic Heisenberg model on a pyrochlore lattice","4 pages, 4 figures","Phys. Rev. Lett. 93, 197203 (2004)","10.1103/PhysRevLett.93.197203",,"cond-mat.str-el cond-mat.mtrl-sci",,"  Magnetization plateaus, visible as anomalies in magnetic susceptibility at
low temperatures, are one of the hallmarks of frustrated magnetism. We show how
an extremely robust half-magnetization plateau can arise from coupling between
spin and lattice degrees of freedom in a pyrochlore antiferromagnet, and
develop a detailed symmetry of analysis of the simplest possible scenario for
such a plateau state. The application of this theory to the spinel oxides
CdCr2O4 and HgCr2O4, where a robust half magnetization plateau has been
observed, is discussed.
","[{""version"":""v1"",""created"":""Wed, 18 Aug 2004 10:48:57 GMT""}]","2009-11-10"
"cond-mat/0408398","Mathieu Morelle","M. Morelle, D.S. Golubovic, and V.V. Moshchalkov","Nucleation of superconductivity in a mesoscopic loop of varying width","12 pages, 9 figures, accpeted for publication in Phys. Rev. B","Phys. Rev. B 70, 144528 (2004)","10.1103/PhysRevB.70.144528",,"cond-mat.supr-con",,"  We study the evolution of the superconducting state in a perforated disk by
varying the size of the hole. The superconducting properties are investigated
by means of transport measurements around the superconducting/normal phase
boundary Tc(H). A transition from a one-dimensional to a two-dimensional regime
is seen when increasing the magnetic field for disks with small holes. A good
agreement is found between the measured Tc(H) line and the calculations
performed in the framework of the linearized Ginzburg-Landau theory. The effect
of breaking the axial symmetry of the structure by moving the hole away from
the center of the disk is also studied. An enhanced critical field is found for
the asymmetric structures, possibly due to the recovery of the singly connected
state.
","[{""version"":""v1"",""created"":""Wed, 18 Aug 2004 12:34:13 GMT""}]","2007-05-23"
"cond-mat/0408399","Joseph O. Indekeu","C.V. Giuraniuc, J.P.L. Hatchett, J.O. Indekeu, M. Leone, I. Perez
  Castillo, B. Van Schaeybroeck, C. Vanderzande","Trading interactions for topology in scale-free networks","4 pages, 5 figures","Physical Review Letters 95, 098701 (2005) (4pages),","10.1103/PhysRevLett.95.098701",,"cond-mat.dis-nn cond-mat.stat-mech",,"  Scale-free networks with topology-dependent interactions are studied. It is
shown that the universality classes of critical behavior, which conventionally
depend only on topology, can also be explored by tuning the interactions. A
mapping, $\gamma' = (\gamma - \mu)/(1-\mu)$, describes how a shift of the
standard exponent $\gamma$ of the degree distribution $P(q)$ can absorb the
effect of degree-dependent pair interactions $J_{ij} \propto (q_iq_j)^{-\mu}$.
Replica technique, cavity method and Monte Carlo simulation support the
physical picture suggested by Landau theory for the critical exponents and by
the Bethe-Peierls approximation for the critical temperature. The equivalence
of topology and interaction holds for equilibrium and non-equilibrium systems,
and is illustrated with interdisciplinary applications.
","[{""version"":""v1"",""created"":""Wed, 18 Aug 2004 14:48:40 GMT""},{""version"":""v2"",""created"":""Fri, 30 Sep 2005 11:58:21 GMT""}]","2009-11-10"
"cond-mat/0408400","Jim Freericks","A. M. Shvaika (Lviv), O. Vorobyov (Lviv), J. K. Freericks
  (Georgetown), and T. P. Devereaux (Waterloo)","Electronic Raman scattering in correlated materials: exact treatment of
  nonresonant, mixed, and resonant scattering with dynamical mean field theory","(20 pages, 13 figures)","Phys. Rev. B 71, 045120 (2005) (17 pages)","10.1103/PhysRevB.71.045120",,"cond-mat.str-el",,"  We solve for the electronic Raman scattering response functions on an
infinite-dimensional hypercubic lattice employing dynamical mean field theory.
This contribution extends previous work on the nonresonant response to include
the mixed and resonant contributions. We focus our attention on the spinless
Falicov-Kimball model, where the problem can be solved exactly, and the system
can be tuned to go through a Mott-Hubbard-like metal-insulator transition.
Resonant effects vary in different scattering geometries, corresponding to the
symmetries of the charge excitations scattered by the light. We do find that
the Raman response is large near the double resonance, where the transfered
frequency is close to the incident photon frequency. We also find a joint
resonance of both the charge-transfer peak and the low-energy peak when the
incident photon frequency is on the order of the interaction strength. In
general, the resonance effects can create order of magnitude (or more)
enhancements of features in the nonresonant response, especially when the
incident photon frequency is somewhat larger than the frequency of the
nonresonant feature. Finally, we find that the resonant effects also exhibit
isosbestic behavior, even in the A1g and B2g sectors, and it is most prominent
when the incident photon frequency is on the order of the interaction energy.
","[{""version"":""v1"",""created"":""Wed, 18 Aug 2004 14:48:56 GMT""}]","2007-05-23"
"cond-mat/0408401","Gordon Baym","Gordon Baym","Rapidly rotating Bose condensates","In Proceedings of Quantum Fluids and Solids 2004; to be published in
  JLTP",,"10.1007/s10909-005-2268-1",,"cond-mat.other",,"  How does a rapidly rotating condensed Bose gas carry extreme amounts of
angular momentum? The energetically favored state of a not-too-rapidly rotating
Bose condensed gas is, as observed, a triangular lattice of singly quantized
vortices. This paper describes the fates of the vortex lattice in both harmonic
and anharmonic traps when condensates are rotated extremely rapidly.
","[{""version"":""v1"",""created"":""Wed, 18 Aug 2004 15:25:21 GMT""}]","2009-11-10"
"cond-mat/0408402","Mariano Lopez de Haro","M. Lopez de Haro and C. F. Tejero","Rescaled density expansions and demixing in hard-sphere binary mixtures","5 pages, 1 figure; to be published in The Journal of Chemical Physics",,"10.1063/1.1791611",,"cond-mat.stat-mech cond-mat.soft",,"  The demixing transition of a binary fluid mixture of additive hard spheres is
analyzed for different size asymmetries by starting from the exact low-density
expansion of the pressure. Already within the second virial approximation the
fluid separates into two phases of different composition with a lower consolute
critical point. By successively incorporating the third, fourth, and fifth
virial coefficients, the critical consolute point moves to higher values of the
pressure and to lower values of the partial number fraction of the large
spheres. When the exact low-density expansion of the pressure is rescaled to
higher densities as in the Percus-Yevick theory, by adding more exact virial
coefficients a different qualitative movement of the critical consolute point
in the phase diagram is found. It is argued that the Percus-Yevick factor
appearing in many empirical equations of state for the mixture has a deep
influence on the location of the critical consolute point, so that the
resulting phase diagram for a prescribed equation has to be taken with caution.
","[{""version"":""v1"",""created"":""Wed, 18 Aug 2004 15:47:01 GMT""}]","2009-11-10"
"cond-mat/0408403","Sung Yong Park","Sung Yong Park and D. Stroud","Splitting of Surface Plasmon Frequencies of Metal Particles in a Nematic
  Liquid Crystal","11 pages, 2 figures. To be published in Appl. Phys. Lett",,"10.1063/1.1800278",,"cond-mat.mtrl-sci cond-mat.other",,"  We calculate the effective dielectric function for a suspension of small
metallic particles immersed in a nematic liquid crystal (NLC) host. For a
random suspension of such particles in the dilute limit, we calculate the
effective dielectric tensor exactly and show that the surface plasmon
(SP)resonance of such particles splits into two resonances, polarized parallel
and perpendicular to the NLC director. At higher concentrations, we calculate
this splitting using a generalized Maxwell-Garnett approximation, which can
also be applied to a small metal particle coated with NLC. To confirm the
accuracy of the MGA for NLC-coated spheres, we also use the Discrete Dipole
Approximation. The calculated splitting is comparable to that observed in
recent experiments on NLC-coated small metal particles
","[{""version"":""v1"",""created"":""Wed, 18 Aug 2004 15:49:25 GMT""},{""version"":""v2"",""created"":""Thu, 2 Sep 2004 16:09:58 GMT""}]","2009-11-10"
"cs/0408042","Sameer Tilak","Sameer Tilak, Vinay Kolar, Nael B. Abu-Ghazaleh and Kyoung-Don Kang","Dynamic Localization Protocols for Mobile Sensor Networks","10 Pages",,,"CS-TR-04-NA02","cs.NI",,"  The ability of a sensor node to determine its physical location within a
network (Localization) is of fundamental importance in sensor networks.
Interpretating data from sensors will not be possible unless the context of the
data is known; this is most often accomplished by tracking its physical
location. Existing research has focused on localization in static sensor
networks where localization is a one-time (or low frequency) activity. In
contrast, this paper considers localization for mobile sensors: when sensors
are mobile, localization must be invoked periodically to enable the sensors to
track their location. The higher the frequency of localization, the lower the
error introduced because of mobility. However, localization is a costly
operation since it involves both communication and computation. In this paper,
we propose and investigate adaptive and predictive protocols that control the
frequency of localization based on sensor mobility behavior to reduce the
energy requirements for localization while bounding the localization error. We
show that such protocols can significantly reduce the localization energy
without sacrificing accuracy (in fact, improving accuracy for most situations).
Using simulation and analysis we explore the tradeoff between energy efficiency
and localization error due to mobility for several protocols.
","[{""version"":""v1"",""created"":""Wed, 18 Aug 2004 14:07:20 GMT""}]","2007-05-23"
"gr-qc/0408054","Mauricio Bellini","Jose Edgar Madriz Aguilar (IFM, UMSNH) and Mauricio Bellini (Mar del
  Plata University & CONICET)","Extra force and extra mass from noncompact Kaluza-Klein theory in a
  cosmological model","final version to be published in EPJC","Eur.Phys.J.C42:349,2005","10.1140/epjc/s2005-02295-8",,"gr-qc astro-ph hep-ph hep-th",,"  Using the Hamilton-Jacobi formalism, we study extra force and extra mass in a
recently introduced noncompact Kaluza-Klein cosmological model. We examine the
inertial 4D mass $m_0$ of the inflaton field on a 4D FRW bulk in two examples.
We find that $m_0$ has a geometrical origin and antigravitational effects on a
non inertial 4D bulk should be a consequence of the motion of the fifth
coordinate with respect to the 4D bulk.
","[{""version"":""v1"",""created"":""Tue, 17 Aug 2004 18:31:27 GMT""},{""version"":""v2"",""created"":""Wed, 22 Sep 2004 19:41:50 GMT""},{""version"":""v3"",""created"":""Wed, 23 Feb 2005 22:56:05 GMT""},{""version"":""v4"",""created"":""Fri, 13 May 2005 14:07:51 GMT""},{""version"":""v5"",""created"":""Fri, 27 May 2005 15:09:47 GMT""}]","2008-11-26"
"gr-qc/0408055","Julien Sylvestre","Julien Sylvestre","Simulations of laser locking to a LISA arm","7 figures, 8 pages","Phys.Rev. D70 (2004) 102002","10.1103/PhysRevD.70.102002",,"gr-qc",,"  We present detailed numerical simulations of a laser phase stabilization
scheme for LISA, where both lasers emitting along one arm are locked to each
other. Including the standard secondary noises and spacecraft motions that
approximately mimic LISA's orbit, we verify that very stable laser phases can
be obtained, and that time delay interferometry can be used to remove the laser
phase noise from measurements of gravitational wave strains. Most importantly,
we show that this locking scheme can provide significant simplifications over
LISA's baseline design in the implementation of time delay interferometry.
","[{""version"":""v1"",""created"":""Wed, 18 Aug 2004 00:26:40 GMT""}]","2009-11-10"
"gr-qc/0408056","Panayotis Kevrekidis","F.L. Williams, P.G. Kevrekidis, T. Christodoulakis, C. Helias, G.O.
  Papadopoulos and Th. Grammenos","On 3+1 Dimensional Scalar Field Cosmologies","7 pages, no figures","Trends in General Relativity and Quantum Cosmology, Ch.V.Benton
  (ed.), 2006, Nova Science Publ., p. 37",,,"gr-qc",,"  In this communication, we analyze the case of 3+1 dimensional scalar field
cosmologies in the presence, as well as in the absence of spatial curvature, in
isotropic, as well as in anisotropic settings. Our results extend those of
Hawkins and Lidsey [Phys. Rev. D {\bf 66}, 023523 (2002)], by including the
non-flat case. The Ermakov-Pinney methodology is developed in a general form,
allowing through the converse results presented herein to use it as a tool for
constructing new solutions to the original equations. As an example of this
type a special blowup solution recently obtained in Christodoulakis {\it et
al.} [gr-qc/0302120] is retrieved. Additional solutions of the 3+1 dimensional
gravity coupled with the scalar field are also obtained. To illustrate the
generality of the approach, we extend it to the anisotropic case of Bianchi
types I and V and present some related open problems.
","[{""version"":""v1"",""created"":""Wed, 18 Aug 2004 01:36:52 GMT""}]","2008-08-19"
"gr-qc/0408057","Dr. Anirudh Pradhan","Anirudh Pradhan, Kashika Srivastava, Amrit Lal Ahuja","Nonsingular Spherical Models with a Variable Cosmological term","19 pages, 6 figures, submitted to Fizika B (Zagreb)","Fizika B16:141-158,2007",,,"gr-qc",,"  Exact solutions of the Einstein's field equations describing a spherically
symmetric cosmological model without a big bang or any other kind of
singularity recently obtained by Dadhich and Patel (2000) are revisited. The
matter content of the model is a shear-free perfect fluid with isotropic
pressure and a radial heat flux. Three different exact solutions are obtained
for both perfect fluid and fluid with bulk viscosity. It turns out that the
cosmological rerm $\Lambda(t)$ is a decreasing function of time, which is
consistent with recent observations of type Ia supernovae.
","[{""version"":""v1"",""created"":""Wed, 18 Aug 2004 10:07:45 GMT""},{""version"":""v2"",""created"":""Fri, 9 Mar 2007 07:00:28 GMT""}]","2010-11-19"
"gr-qc/0408058","Peng Wang","Peng Wang, Gilberto M. Kremer, Daniele S. M. Alves, Xin-He Meng","A Note on Energy-Momentum Conservation in Palatini Formulation of L(R)
  Gravity","7 pages","Gen.Rel.Grav. 38 (2006) 517-521","10.1007/s10714-006-0238-9",,"gr-qc",,"  By establishing that Palatini formulation of $L(R)$ gravity is equivalent to
$\omega=-3/2$ Brans-Dicke theory, we show that energy-momentum tensor is
covariantly conserved in this type of modified gravity theory.
","[{""version"":""v1"",""created"":""Wed, 18 Aug 2004 10:41:03 GMT""}]","2015-06-25"
"gr-qc/0408059","Jan Metzger","Jan Metzger","Numerical computation of constant mean curvature surfaces using finite
  elements","23 pagers, 16 figures, 5 tables. To appear in Classical and quantum
  Gravity. Version with full resolution graphics available at
  http://www.mathematik.uni-tuebingen.de/~jan/preprints/","Class.Quant.Grav. 21 (2004) 4625-4646","10.1088/0264-9381/21/19/010","AEI-2004-062","gr-qc",,"  This paper presents a method for computing two-dimensional constant mean
curvature surfaces. The method in question uses the variational aspect of the
problem to implement an efficient algorithm. In principle it is a flow like
method in that it is linked to the gradient flow for the area functional, which
gives reliable convergence properties. In the background a preconditioned
conjugate gradient method works, that gives the speed of a direct elliptic
multigrid method.
","[{""version"":""v1"",""created"":""Wed, 18 Aug 2004 12:37:58 GMT""}]","2009-11-10"
"gr-qc/0408060","Oksana Streltsova","O.I. Streltsova, E.E. Donets, E.A. Hayryan, D.A. Georgieva, and T.L.
  Boyadjiev","Unstable even-parity eigenmodes of the regular static SU(2)
  Yang-Mills-dilaton solutions","22 pages, 5 figures",,,,"gr-qc hep-th math-ph math.MP",,"  In this paper we obtain unstable even-parity eigenmodes to the static regular
spherically symmetric solutions of the SU(2) Yang-Mills-dilaton coupled system
of equations in 3+1 Minkowski space-time. The corresponding matrix
Sturm-Liouville problem is solved numerically by means of the continuous
analogue of Newton's method. The method, being the powerful tool for solving
both boundary-value and Sturm-Liouville problems, is described in details.
","[{""version"":""v1"",""created"":""Wed, 18 Aug 2004 13:33:55 GMT""}]","2007-05-23"
"gr-qc/0408061","Volodymyr Pelykh","V. Pelykh","Knot points of double--covariant system of elliptic equations and
  preferred frames in general relativity","10 pages","J.Phys.A35:8135-8144,2002","10.1088/0305-4470/35/38/313",,"gr-qc",,"  The elliptic system of equations, which is general-covariant and locally
SU(2)-covariant, is investigated. The new condition of the Dirichlet problem
solvability and the condition of zeros absence for solutions are obtained for
this system, which contains in particular case the Sen-Witten equation. On this
basis it is proved the existence of the wide class of hypersurfaces, in all
points of which there exists a correspondence between the Sen-Witten spinor
field and three-frame, which generalizes the Nester orthoframe. The Nester
special orthoframe also exists on a certain subclass containing not only the
maximal hypersurfaces.
","[{""version"":""v1"",""created"":""Wed, 18 Aug 2004 13:40:21 GMT""}]","2008-11-26"
"gr-qc/0408062","Juan A. Valiente-Kroon","J. A. Valiente Kroon","Time asymmetric spacetimes near null and spatial infinity. I. Expansions
  of developments of conformally flat data","32 pages. First part of a series of 2 papers. Typos corrected","Class.Quant.Grav. 21 (2004) 5457-5492","10.1088/0264-9381/21/23/011",,"gr-qc",,"  The Conformal Einstein equations and the representation of spatial infinity
as a cylinder introduced by Friedrich are used to analyse the behaviour of the
gravitational field near null and spatial infinity for the development of data
which are asymptotically Euclidean, conformally flat and time asymmetric. Our
analysis allows for initial data whose second fundamental form is more general
than the one given by the standard Bowen-York Ansatz. The Conformal Einstein
equations imply upon evaluation on the cylinder at spatial infinity a hierarchy
of transport equations which can be used to calculate in a recursive way
asymptotic expansions for the gravitational field. It is found that the the
solutions to these transport equations develop logarithmic divergences at
certain critical sets where null infinity meets spatial infinity. Associated to
these, there is a series of quantities expressible in terms of the initial data
(obstructions), which if zero, preclude the appearance of some of the
logarithmic divergences. The obstructions are, in general, time asymmetric.
That is, the obstructions at the intersection of future null infinity with
spatial infinity are different, and do not generically imply those obtained at
the intersection of past null infinity with spatial infinity. The latter allows
for the possibility of having spacetimes where future and past null infinity
have different degrees of smoothness. Finally, it is shown that if both sets of
obstructions vanish up to a certain order, then the initial data has to be
asymptotically Schwarzschildean to some degree.
","[{""version"":""v1"",""created"":""Wed, 18 Aug 2004 13:48:56 GMT""},{""version"":""v2"",""created"":""Thu, 26 Aug 2004 12:48:22 GMT""}]","2009-11-10"
"gr-qc/0408063","Volodymyr Pelykh","V. Pelykh","Sen-Witten orthonormal three-frame and gravitational energy
  quasilocalization","9 pages","Class.Quant.Grav. 20 (2003) 1115-1123","10.1088/0264-9381/20/6/306",,"gr-qc",,"  Expression for the Witten-Nester 4-spinor 3-form of the Hamiltonian density
of gravitational field in the asymptotically flat space-time in terms of the
Sommers-Sen spinors, direct with a certain orthonormal three-frame connect, is
obtained. A direct connection between the one and the ADM Hamiltonian density
in the Sen-Witten frame is established on this basis.
","[{""version"":""v1"",""created"":""Wed, 18 Aug 2004 13:49:28 GMT""}]","2017-08-23"
"gr-qc/0408064","David Garfinkle","David Garfinkle","Gravitational collapse in anti de Sitter space","9 pages, 13 figures","Phys.Rev. D70 (2004) 104015","10.1103/PhysRevD.70.104015",,"gr-qc",,"  A numerical and analytic treatment is presented here of the evolution of
initial data of the kind that was conjectured by Hertog, Horowitz and Maeda to
lead to a violation of cosmic censorship. That initial data is essentially a
thick domain wall connecting two regions of anti de Sitter space. The evolution
results in no violation of cosmic censorship, but rather the formation of a
small black hole.
","[{""version"":""v1"",""created"":""Wed, 18 Aug 2004 15:52:14 GMT""}]","2009-11-10"
"hep-ex/0408085","Hanna Mahlke","Hanna Mahlke","Puzzle Pieces: Results on bbbar and ccbar Spectroscopy and Decay","Invited Talk at Daphne 2004, Frascati, Italy, 7-11 June 2004. 8pp",,,"CLEO TALK 04-5","hep-ex",,"  Recent results in the field of Heavy Quarkonia are reviewed, with results
either providing new precision measurements or addressing key unanswered
questions.
","[{""version"":""v1"",""created"":""Tue, 17 Aug 2004 17:05:14 GMT""}]","2007-05-23"
"hep-ex/0408086","Steven H. Robertson","B. Aubert, et al, BABAR Collaboration","A search for the decay B+ -> K+ nu nubar","13 pages, 8 figures, submitted to ICHEP 04 (16-22 Aug, 2004, Beijing
  China)",,,"SLAC-PUB-10646","hep-ex",,"  We present a search for the rare flavor-changing neutral-current decay $B^+
\to K^+ \nu \bar{\nu}$ based on data sample of 82 fb$^{-1}$ collected with the
BABAR detector at the PEP-II B-factory. Signal events are selected by examining
the properties of the system recoiling against either a reconstructed hadronic
or semileptonic charged B decay. Using these two independent samples, a
combined limit of ${\mathcal B}(B^+ \to K^+ \nu\bar{\nu})<5.2 \times 10^{-5}$
is obtained at the 90% confidence level. In addition, by modifying the particle
identification criteria, a limit of ${\mathcal B} (B^+\to\pi^+\nu\bar{\nu})<1.0
\times 10^{-4}$ is obtained using hadronic $B$ reconstruction. All results are
preliminary.
","[{""version"":""v1"",""created"":""Tue, 17 Aug 2004 17:14:35 GMT""}]","2016-04-26"
"hep-ex/0408087","David C. Williams","The BABAR Collaboration, B. Aubert, et al","Search for the D_(sJ)(2632)^+ at BaBar","Submitted to the 32nd International Conference on High-Energy Physics
  Added C. Chen to author list",,,"BABAR-CONF-04/045, SLAC-PUB-10633","hep-ex",,"  We have performed a search for the $D^*_{sJ}(2632)^+$ state recently reported
by the SELEX Collaboration at FNAL. This preliminary analysis makes use of an
integrated luminosity of 125 ${\rm fb}^{-1}$ collected by the BaBar detector at
the PEP-II asymmetric-energy $e^+e^-$ collider. The resulting $D_s \eta$ and
$D^0 K^+$ mass spectra show no evidence for the $D^*_{sJ}(2632)^+$ state. In
addition, no signal is observed in the $D^{*+} K_S$ mass spectrum.
","[{""version"":""v1"",""created"":""Tue, 17 Aug 2004 17:18:55 GMT""},{""version"":""v2"",""created"":""Thu, 19 Aug 2004 21:12:59 GMT""}]","2007-05-23"
