"astro-ph/0408310","Arnon Dar","Arnon Dar","The Origin of Cosmic Rays - A 96-Year-Old Puzzle Solved?","Invited talks to be published in the proceedings of the 2004 La
  Thuile Workshop on Perspectives In High energy Physics, La Thuile, Aosta
  Valley, Italy, February 29-March 6, 2004 and of the 2004 Vulcano Workshop on
  Frontier Objects in Particle Physics and Astro Physics, Vulcano, Italy, May
  24-29, 2004","Nuovo Cim.B120:767-781,2005; Nuovo Cim.120B:767-781,2005","10.1393/ncb/i2005-10119-y",,"astro-ph hep-ph",,"  There is mounting evidence that long duration gamma ray bursts (GRBs) are
produced by ultra-relativistic jets of ordinary matter which are ejected in
core collapse supernova (SN) explosions. Such jets are extremely efficient
cosmic ray (CR) accelerators which can accelerate the swept up ambient
particles on their way to the highest observed CR energies. The bulk of the jet
kinetic energy is used to accelerate CRs while only a tiny fraction is used to
produce the GRB and its afterglow. Here we use the remarkably successful
cannonball (CB) model of GRBs to show that the bipolar jets from SN explosions,
which produce GRBs most of which are not beamed towards Earth, can be the main
origin of cosmic rays at all energies. The model explains very simply the
elemental composition of CRs and their observed spectra at all energies. In
particular it explains the origin of the CR knees and ankle. Above the CR
ankle, the Galactic magnetic fields can no longer delay the free escape of
ultra-high energies CRs (UHECR) from the Galaxy, and the CRs from the
intergalactic medium (IGM), which were injected there by SN jets from all the
galaxies and isotropized there by the IGM magnetic fields, dominate the
Galactic CR spectrum. A Greisen-Zatsepin-Kuzmin (GZK) effect due to the
interaction of UHECRs with the microwave background radiation is expected. The
CR nuclei which diffuse out of galaxies, or are directly deposited in the IGM
by the relativistic SN jets, may be the origin of the IGM magnetic fields.
Inverse Compton scattering of the cosmic microwave background radiation (MBR)
by the CR electrons in the IGM produces the diffuse extragalactic gamma-ray
background radiation (GBR).
","[{""version"":""v1"",""created"":""Tue, 17 Aug 2004 16:22:37 GMT""}]","2010-11-15"
"astro-ph/0408311","Ac Fabian","A.C. Fabian, R.R. Ross and J.M. Miller","On the observed disc temperature of accreting intermediate mass black
  holes","4 pages, 2 figs, to appear in MNRAS",,"10.1111/j.1365-2966.2004.08322.x",,"astro-ph",,"  Some ultraluminous X-ray sources in nearby galaxies show soft components
resembling thermal disc emission. Calculations based on blackbody emission then
indicate that the accreting black holes at the centres of these discs have
masses of 100s to 1000s Msun. Establishing the existence of such intermediate
mass black holes is of considerable importance so the assumptions and
approximations lying behind blackbody spectral fits must be examined. We study
here the basic assumption that the thermal emission is well-characterised by a
multi-temperature blackbody spectrum. Since the opacity in the surface layers
of a disc decreases at high energies the emergent spectrum is hardened. We
compute the observed spectra from discs around a non-spinning 1000 Msun black
hole and fit them over the XMM-Newton pn band with multi-colour disc models.
The typical overall spectra hardening factor usually adopted for discs around
stellar mass black hole (assuming an inclination of 60 deg and including
relativistic effects for a non-spinning black hole) is found to be appropriate.
","[{""version"":""v1"",""created"":""Tue, 17 Aug 2004 17:16:27 GMT""}]","2009-11-10"
"astro-ph/0408312","Ari Brynjolfsson","Ari Brynjolfsson","Weightlessness of photons: A quantum effect","Only minor editorial changes from v2. This is reference [107] of
  arXiv:astro-ph/0401420 v3 7 Oct 2005: Redshift of photons penetrating a hot
  plasma",,,,"astro-ph",,"  Contrary to general belief, the Fraunhofer lines have been found to be plasma
redshifted and not gravitationally redshifted, when observed on Earth. Quantum
mechanical effects cause the photons' gravitational redshift to be reversed as
the photons move from the Sun to the Earth. The designs of the experiments,
which were thought to have proven the gravitational redshift of photons, are
all in the domain of classical physics, and make it impossible to detect the
reversal of the gravitational redshifts. The solar redshift experiments,
however, are in the domain of quantum mechanics; and the reversal of the
redshift is easily detected, when the plasma redshift is taken into account.
The photons are found to be weightless relative to a local observer, but
repelled relative to a distant observer. The weightlessness of the photons in
the gravitational field relative to a local observer is inconsistent with
Einstein's equivalence principle. This together with the plasma redshift has
profound consequences for the cosmological perspectives. This article gives a
theoretical explanation of the observed phenomena, proper interpretation of the
many gravitational redshift experiments, and an understanding of how we missed
observing the reversal of photons' gravitational redshift. The present analysis
indicates that although the photons are weightless in a local system of
reference, the experimental evidence indicates that quasi-static
electromagnetic fields are not weightless, but adhere to the principle of
equivalence.
","[{""version"":""v1"",""created"":""Tue, 17 Aug 2004 19:16:41 GMT""},{""version"":""v2"",""created"":""Thu, 26 Aug 2004 17:09:16 GMT""},{""version"":""v3"",""created"":""Fri, 17 Feb 2006 19:38:58 GMT""}]","2007-05-23"
"astro-ph/0408313","Andres Jordan","Andres Jordan (Rutgers & Oxford)","A Possible Explanation for the Size Difference of Red and Blue Globular
  Clusters","5 pages, 3 figures. Accepted for publication in ApJ Letters","Astrophys.J. 613 (2004) L117-L120","10.1086/425147",,"astro-ph",,"  Most observations of the projected half-light radii of metal-rich globular
clusters in a variety of galaxies have shown them to be ~20% smaller than those
of their metal-poor counterparts. We show using multi-mass isotropic
Michie-King models that the combined effects of mass segregation and the
dependence of main sequence lifetimes on metallicity can account for this
difference, under the assumption that clusters with similar central potentials
have the same distribution of half mass radii. If confirmed, this would
represent a new constraint on theories of globular cluster formation and
evolution.
","[{""version"":""v1"",""created"":""Tue, 17 Aug 2004 20:20:24 GMT""}]","2009-11-10"
"astro-ph/0408314","Asantha R. Cooray","Asantha Cooray, Steven Furlanetto (Caltech)","Polarization Signals of the 21 cm Background from the Era of
  Reionization","6 pages, 2 figures, submitted to MNRAS","Mon.Not.Roy.Astron.Soc. 359 (2005) L47-L52","10.1111/j.1745-3933.2005.00035.x",,"astro-ph",,"  While emission and absorption lines of the 21 cm spin-flip transition of
neutral Hydrogen are intrinsically unpolarized, a magnetic field creates left-
and right-handed polarized components through the Zeeman effect. Here we
consider the resulting polarization of the redshifted 21 cm background from the
intergalactic medium before reionization. The polarization is detectable in
regions with a strong gradient in the mean brightness temperature. In
principle, this can open a new window on the evolution of intergalactic
magnetic fields. One possible approach is an extended integration of an
individual target during this era, such as the Mpc-scale HII regions inferred
to surround quasars at z ~ 6.5. The differential intensity between the two
polarization states can be used as a probe of the magnetic field at the edge of
the HII region. We estimate that the SKA could (ignoring systematics) detect B
\~ 200 (10) \muG coherent over several kiloparsecs with an observational
bandwidth of 100 (2) kHz. Beyond individual sources, the statistical properties
of wide-field 21 cm polarization maps, such as the angular power spectrum, can
be used to constrain the large-scale magnetic field. In this case, the SKA can
detect $B \sim 100 \mu$G fields coherent over many megaparsecs. The magnetic
field can be measured in any epoch over which the 21 cm background changes
rapidly (for example because the ionized fraction or spin temperature change).
Although the resulting constraints with SKA are relatively weak compared to
theoretical expectations, they nevertheless offer a unique direct probe of
magnetic fields in the high-redshift universe.
","[{""version"":""v1"",""created"":""Tue, 17 Aug 2004 20:09:52 GMT""}]","2016-08-30"
"astro-ph/0408315","Paul Nulsen","P. E. J. Nulsen (1, 2), B. R. McNamara (3), M. W. Wise (4) and L. P.
  David (1) ((1) Harvard-Smithsonian Center for Astrophysics, (2) On leave from
  University of Wollongong, (3) Department of Physics and Astronomy, Ohio
  University, (3) MIT Center for Space Research)","The cluster-scale AGN outburst in Hydra A","7 pages, 6 figures, submitted to ApJ","Astrophys.J.628:629-636,2005","10.1086/430845",,"astro-ph",,"  Deep Chandra observations of the Hydra A Cluster reveal a feature in the
X-ray surface brightness that surrounds the 330 MHz radio lobes of the AGN at
the cluster center. Surface brightness profiles of this feature and its close
association with the radio lobes argue strongly that it is a shock front driven
by the expanding radio lobes. The Chandra image also reveals other new
structure on smaller scales that is associated with the radio source, including
a large cavity and filament. The shock front extends 200 - 300 kpc from the AGN
at the cluster center and its strength varies along the front, with Mach
numbers in the range ~ 1.2 - 1.4. It is stronger where it is more distant from
the cluster center, as expected for a shock driven by expanding radio lobes.
Simple modeling gives an age for the shock front ~ 1.4\times10^8 y and a total
energy driving it of ~ 10^{61} erg. The mean mechanical power driving the shock
is comparable to quasar luminosities, well in excess of that needed to regulate
the cooling core in Hydra A. This suggests that the feedback regulating cooling
cores is inefficient, in that the bulk of the energy is deposited beyond the
cooling core. In that case, a significant part of cluster ""preheating"" is a
byproduct of the regulation of cooling cores.
","[{""version"":""v1"",""created"":""Tue, 17 Aug 2004 20:39:30 GMT""}]","2008-11-26"
"astro-ph/0408316","Marcelo B. Ribeiro","Marcelo B. Ribeiro (Physics Institute, University of Brazil-UFRJ, Rio
  de Janeiro)","Cosmological Distances and Fractal Statistics of Galaxy Distribution","14 pages, 4 figures, A&A LaTeX macro. Minor linguistic changes to
  match the version sent to the publisher. Accepted for publication in
  ""Astronomy and Astrophysics""","Astron.Astrophys.429:65-74,2005","10.1051/0004-6361:20041469",,"astro-ph gr-qc",,"  This paper studies the effect of the distance choice in radial (non-average)
statistical tools used for fractal characterization of galaxy distribution.
After reviewing the basics of measuring distances of cosmological sources,
various distance definitions are used to calculate the differential density
$\gamma$ and the integral differential density $\gamma^\ast$} of the dust
distribution in the Einstein-de Sitter cosmology. The main results are as
follows: (1) the choice of distance plays a crucial role in determining the
scale where relativistic corrections must be taken into account, as both
$\gamma$ and $\gamma^\ast$ are strongly affected by such a choice; (2)
inappropriate distance choices may lead to failure to find evidence of a galaxy
fractal structure when one calculates those quantities, even if such a
structure does occur in the galaxy distribution; (3) the comoving distance and
the distance given by Mattig's formula are unsuitable to probe for a possible
fractal pattern as they render $\gamma$ and $\gamma^\ast$ constant for all
redshifts; (4) a possible galaxy fractal system at scales larger than 100Mpc (z
\~ 0.03) may only be found if those statistics are calculated with the
luminosity or redshift distances, as they are the ones where $\gamma$ and
$\gamma^\ast$ decrease at higher redshifts; (5) C\'el\'erier and Thieberger's
(2001) critique of Ribeiro's (1995: astro-ph/9910145) earlier study are
rendered impaired as their objections were based on misconceptions regarding
relativistic distance definitions.
","[{""version"":""v1"",""created"":""Tue, 17 Aug 2004 21:07:46 GMT""},{""version"":""v2"",""created"":""Thu, 9 Sep 2004 22:11:04 GMT""}]","2014-10-13"
"astro-ph/0408317","Vahe' Petrosian","Vahe' Petrosian (Stanford University)","Nonthermal Activity and Particle Acceleration in Clusters of Galaxies","5 pages. Presented at IAU General Assembly, Sydney, Australia",,,,"astro-ph",,"  Evidence for nonthermal activity in clusters of galaxies is well established
from radio observations of synchrotron emission by relativistic electrons, and
new windows (in EUV and Hard X-ray ranges) have provided more powerful tools
for its investigation. The hard X-ray observations, notably from Coma, are
summarized and results of a new RXTE observations of a high redshift cluster
are presented. It is shown that the most likely emission mechanisms for these
radiations is the inverse Compton scattering of the cosmic microwave background
photons by the same electrons responsible for the radio radiation. Various
scenarios for acceleration of the electrons are considered and it is shown that
the most likely model is episodic acceleration by shocks or turbulence,
presumably induced by merger activity, of high energy electrons injected into
the intercluster medium by galaxies or active galactic nuclei.
","[{""version"":""v1"",""created"":""Tue, 17 Aug 2004 23:49:17 GMT""}]","2007-05-23"
"astro-ph/0408318","Jungyeon Cho","Jungyeon Cho","Simulation of Relativistic Force-free Magnetohydrodynamic Turbulence","4 pages; 3 figures; APJL, submitted","Astrophys.J. 621 (2005) 324","10.1086/427493",,"astro-ph",,"  We present numerical studies of 3-dimensional magnetohydrodynamic (MHD)
turbulence in a strongly magnetized medium in the extremely relativistic limit,
in which the inertia of the charge carriers can be neglected. We have focused
on strong Alfvenic turbulence in the limit. We have found the following
results. First, the energy spectrum is consistent with a Kolmogorov spectrum:
$E(k)\sim k^{-5/3}$. Second, turbulence shows a Goldreich-Sridhar type
anisotropy: $k_{\|} \propto k_{\perp}^{2/3}$, where $k_{\|}$ and $k_{\perp}$
are wavenumbers along and perpendicular to the local mean magnetic field
directions, respectively. These scalings are in agreement with earlier
theoretical predictions by Thompson & Blaes.
","[{""version"":""v1"",""created"":""Wed, 18 Aug 2004 00:27:00 GMT""}]","2009-11-10"
"astro-ph/0408319","Georges Meynet","G. Meynet, A. Maeder","Stellar evolution with rotation XI: Wolf-Rayet star populations at
  different metallicities","20 pages, 16 figure, Astronomy and Astrophysics, in press",,"10.1051/0004-6361:20047106",,"astro-ph",,"  Grids of models of massive stars ($M \ge$ 20 $M_\odot$) with rotation are
computed for metallicities $Z$ ranging from that of the Small Magellanic Cloud
(SMC) to that of the Galactic Centre. The hydrostatic effects of rotation, the
rotational mixing and the enhancements of the mass loss rates by rotation are
included. The evolution of the surface rotational velocities of the most
massive O--stars mainly depends on the mass loss rates and thus on the initial
$Z$ value. The minimum initial mass for a star for entering the Wolf--Rayet
(WR) phase is lowered by rotation. For all metallicities, rotating stars enter
the WR phase at an earlier stage of evolution and the WR lifetimes are
increased, mainly as a result of the increased duration of the eWNL phase.
Models of WR stars predict in general rather low rotation velocities ($ < 50$
km s$^{-1}$) with a few possible exceptions, particularly at metallicities
lower than solar where WR star models have in general faster rotation and more
chance to reach the break--up limit.The properties of the WR populations as
predicted by the rotating models are in general in much better agreement with
the observations in nearby galaxies. The observed variation with metallicity of
the fractions of type Ib/Ic supernovae with respect to type II supernovae as
found by Prantzos & Boissier (\cite{Pr03}) is very well reproduced by the
rotating models, while non--rotating models predict much too low ratios.
","[{""version"":""v1"",""created"":""Wed, 18 Aug 2004 07:26:12 GMT""}]","2009-11-10"
"astro-ph/0408320","Georges Meynet","Andr\'e Maeder, Georges Meynet & Raphael Hirschi","Evolution of the Most Massive Stars","10 pages, 8 figures, in ``The Fate of the Most Massive Stars'', ASP
  Conf. Series",,,,"astro-ph",,"  We discuss the physics of the $\Omega \Gamma$-- Limit, i.e. when the star is
unbound as a result of {\emph{both}} rotation and radiation pressure. We
suggest that the $\Omega \Gamma$-- Limit is what makes the Humphreys--Davidson
Limit. Stellar filiations are discussed, with an emphasis on the final stages,
in particular on the final masses, their angular momentum and the chemical
yields with account of rotation. A possible relation between WO stars and GRB
is emphasized.
","[{""version"":""v1"",""created"":""Wed, 18 Aug 2004 08:15:37 GMT""}]","2007-05-23"
"astro-ph/0408321","Mika Juvela","M. Juvela (1), P. Padoan (2) ((1) Helsinki University Observatory, (2)
  University of California San Diego)","Multi-Resolution Radiative Transfer for Line Emission","Submitted to ApJ, 34 pages, 14 figures","Astrophys.J. 618 (2005) 744-756","10.1086/426112",,"astro-ph",,"  We present describe a new computer code that solves the radiative transfer
problem on multi-resolution grids. If the cloud model is from an MHD simulation
on a regular cartesian grid, criteria based for example on local density or
velocity gradients are used to refine the grid by dividing selected cells into
sub-cells. Division can be repeated hierarchically. Alternatively, if the cloud
model is from an MHD simulations with adaptive mesh refinement, the same
multi-resolution grid used for the MHD simulation is adopted in the radiative
transfer calculations. High discretization is often needed only in a small
fraction of the total volume. This makes it possible to simulate spectral line
maps with good accuracy, also minimizing the total number of cells and the
computational cost (time and memory). Multi-resolution models are compared with
models on regular grids. In the case of moderate optical depths (tau ~ a few)
an accuracy of 10% can be reached with multi-resolution models where only 10%
of the cells of the full grid are used. For optically thick species (tau~100),
the same accuracy is achieved using 15% of the cells. The relation between
accuracy and number of cells is not found to be significantly different in the
two MHD models we have studied. The new code is used to study differences
between LTE and non-LTE spectra and between isothermal and non-isothermal cloud
models. We find significant differences in line ratios and individual spectral
line profiles of the isothermal and LTE models relative to the more realistic
non-isothermal case. The slope of the power spectrum of integrated intensity is
instead very similar in all models.
","[{""version"":""v1"",""created"":""Wed, 18 Aug 2004 08:17:16 GMT""}]","2009-11-10"
"astro-ph/0408322","Georges Meynet","Georges Meynet, Andr\'e Maeder and Sylvia Ekstr\""om","Evolution at very low and zero Z","10 pages, 5 figures, in ``The Fate of the Most Massive Stars'', ASP
  Conf. Series",,,,"astro-ph",,"  Rotation deeply affects the evolution of very metal poor massive stars.
Indeed, even moderately rotating stars reach the break--up limit during the
Main--Sequence (MS) phase, they evolve rapidly to the red after the core
H--burning phase and important surface enrichment in CNO elements occurs at the
supergiant stage. High rotation and the self enrichment in heavy elements $Z$
tend to enhance the quantity of mass lost by stellar winds. As a numerical
example, we obtain that a 60 M$_\odot$ at $Z=0.00001$, with an initial rotation
corresponding to 0.7 of the critical velocity, loses half of its initial mass
during its lifetime. The ejected material, enriched in helium and CNO elements,
has interesting consequences for the early chemical evolution of galaxies.
","[{""version"":""v1"",""created"":""Wed, 18 Aug 2004 08:20:24 GMT""}]","2007-05-23"
"astro-ph/0408323","Abhas Mitra","Abhas Mitra","A new proof for non-occurrence of trapped surfaces and information
  paradox","Typos removed, minor changes, 10 pages",,,,"astro-ph",,"  We present here a very simple, short and new proof which shows that no
trapped surface is ever formed in spherical gravitational collapse of isolated
bodies. Although this derivation is of purely mathematical nature and without
any assumption, it is shown, in the Appendix, that, physically, trapped
surfaces do not form in order that the 3 speed of the fluid as measured by an
observer at a fixed circumference coordinate $R$ (a scalar), is less than the
speed of light $c$. The consequence of this result is that, mathematically,
even if there would be Schwarzschild Black Holes, they would have unique
gravitational mass M=0. Recall that Schwazschild BHs may be considered as a
special case of rotating Kerr BHs with rotation parameter a=0. If one would
derive the Boyer-Lindquist metric [1] in a straight forward manner by using the
Backlund transformation[2], one would obtain a= M sin phi where phi is the
azimuth angle. This relation demands that BHs have unique mass M=0 (along with
a=0) which in turn confirms that there cannot be any trapped surface in
realistic gravitational collapse where the fluid has real pressure and density.
Since there is no trapped surface and no horizon there is no Information
Paradox in the first place.
","[{""version"":""v1"",""created"":""Wed, 18 Aug 2004 10:20:11 GMT""},{""version"":""v2"",""created"":""Thu, 19 Aug 2004 06:52:02 GMT""}]","2007-05-23"
"astro-ph/0408324","Alexander Potekhin","P. Haensel (CAMK, Warsaw), A. Y. Potekhin (Ioffe Institute, St.
  Petersburg)","Analytical representations of unified equations of state of neutron-star
  matter","7 pages, 5 figures, 3 tables, accepted by A&A. In v.2, auxiliary fits
  (15) and (16) are corrected","Astron.Astrophys. 428 (2004) 191-197","10.1051/0004-6361:20041722",,"astro-ph",,"  Analytical representations are derived for two equations of state (EOSs) of
neutron-star matter: FPS and SLy. Each of these EOSs is unified, that is, it
describes the crust and the core of a neutron star using the same physical
model. Two versions of the EOS parametrization are considered. In the first
one, pressure and mass density are given as functions of the baryon density. In
the second version, pressure, mass density, and baryon density are given as
functions of the pseudo-enthalpy, which makes this representation particularly
useful for 2-D calculations of stationary rotating configurations of neutron
stars.
","[{""version"":""v1"",""created"":""Wed, 18 Aug 2004 10:49:48 GMT""},{""version"":""v2"",""created"":""Tue, 7 Sep 2004 15:46:04 GMT""}]","2007-05-23"
"astro-ph/0408325","Frederic Boone","F. Boone (1), N. Brouillet (2), S. Huettemeister (1), C. Henkel (3),
  J. Braine (2), D. J. Bomans (1), F. Herpin (2), Z. Banhidi (1), M. Albrecht
  (1) ((1) AIRUB, (2) Observatoire de Bordeaux, (3) MPIfR)","Properties and environment of the molecular complex near Holmberg IX","13 pages, 11 figures, accepted for publication in A&A","Astron.Astrophys. 429 (2005) 129-140","10.1051/0004-6361:20041200",,"astro-ph",,"  This paper is aimed at providing new insight into the nature and origin of
the molecular complex situated near the line of sight toward Holmberg IX in the
M81 group of galaxies. The first high resolution CO maps of the complex as well
as single dish 13CO(1-0), 12CO(3-2) and millimeter continuum observations and
the results of a survey of 12CO in the region are presented. These data
together with the available HI, optical and X-ray observations are analyzed to
study the properties and environment of the complex. We confirm there is no
unobscured massive star formation inside the complex and from the millimeter
constraint on the extinction it must have a low star formation rate or be
forming only low mass stars. According to the CO line ratios the abundances and
physical conditions could be similar to that of cold gas in spirals. We find
from its dynamics (no rotation) and its mass (2--6 million solar masses) that
it resembles a massive GMC. Also, re-inspecting N-body simulations of the M81
group and the HI data we find that it might be located inside the extreme outer
disk of M81 and be cospatial with the HI feature known as Concentration I. The
negative result of the CO survey suggests that the complex is unique in this
region and calls for a peculiar local formation process. We find that the
distribution of the CO emission in the data cube is asymmetrical in a way
similar to a cometary object. The optical observations of the nearby supershell
MH9/10 suggest the existence of an outflow toward the complex. We consider the
possibility that the molecular complex is related to this hypothetical outflow.
","[{""version"":""v1"",""created"":""Wed, 18 Aug 2004 11:24:17 GMT""}]","2009-11-10"
