"hep-ex/0408119","Masako Iwasaki","The Belle Collaboration","Improved Measurement of the Electroweak Penguin Process B->Xsll","22 pages, 5 figures, submitted to ICHEP2004, Beijing, China",,,"BELLE-CONF-0414","hep-ex",,"  We present an improved measurement of the branching fraction for the
electroweak penguin process B->Xsl+l-, where l is an electron or a muon and Xs
is a hadronic system containing an s-quark. The measurement is based on a
sample of 152 * 10^6 ~ Upsilon(4S) -> BB-bar events collected with the Belle
detector at the KEKB e+e- asymmetric-energy collider. The Xs hadronic system is
reconstructed from one K+- or K0s and up to four pions, where at most one pion
can be neutral. Summing over both lepton flavors, the inclusive branching
fraction is measured to be Br(B->Xsll)=(4.11 +- 0.83(stat.) +0.74 -0.70 (syst.)
)*10^{-6} for m(ll) > 0.2GeV.
","[{""version"":""v1"",""created"":""Tue, 24 Aug 2004 08:23:23 GMT""}]","2012-08-27"
"hep-ex/0408120","Shohei Nishida","K. Abe, et al. (for the Belle Collaboration)","Observation of B -> K eta gamma","9 pages, 2 figures, submitted to ICHEP2004, Beijing, China",,,"BELLE-CONF-0412","hep-ex",,"  We report measurements of radiative B decays with K eta gamma final states,
using a data sample of 140 /fb recorded at the Upsilon(4S) resonance with the
Belle detector at the KEKB e+e- asymmetric energy collider. We observe B -> K
eta gamma for the first time with a branching fraction of (6.9 +1.7-1.6 (stat)
+1.3-1.0 (syst)) X 10^{-6} for M(Keta) < 2.4 GeV/c2. We also set an upper limit
on B -> K3*(1780) gamma.
","[{""version"":""v1"",""created"":""Tue, 24 Aug 2004 11:49:00 GMT""}]","2019-08-14"
"hep-ex/0408121","Adam Para","L. Bartoszek, et al","FLARE, Fermilab Liquid Argon Experiments","Letter of Intent",,,,"hep-ex",,"  Mature technology of Liquid Argon Time Projection Chambers in conjunction
with intense neutrino beams constructed at Fermilab offer a broad program of
neutrino physics for the next decade.
","[{""version"":""v1"",""created"":""Tue, 24 Aug 2004 12:53:36 GMT""}]","2009-09-29"
"hep-ex/0408122","Stefan Kluth","J. Schieck, S. Kluth, S. Bethke, P.A. Movilla Fernandez, C. Pahl, and
  the JADE Collaboration","Measurement of the Strong Coupling Constant alpha_S from the Four-Jet
  Rate in e+e- Annihilation using JADE data","JADE note 146 submitted as contributed paper to ICHEP 2004",,,"MPP-2004-99","hep-ex",,"  Data from e+e- annihilation into hadrons collected by the JADE experiment at
centre-of-mass energies between 14 GeV and 44 GeV were used to study the
four-jet rate as a function of the Durham algorithm's resolution parameter
y_cut. The four-jet rate was compared to a QCD NLO order calculations including
NLLA resummation of large logarithms. The strong coupling constant measured
from the four-jet rate is alpha_S(M_Z) = 0.1169 +/- 0.0004 (stat) +/- 0.0012
(expt) +/- 0.0021 (had) +/- 0.0007 (theo), alpha_S(M_Z) = 0.1169 +/- 0.0026
(total error) in agreement with the world average.
","[{""version"":""v1"",""created"":""Tue, 24 Aug 2004 13:14:47 GMT""}]","2007-05-23"
"hep-ex/0408123","Stefan Kluth","C. Pahl, S. Kluth, S. Bethke, P.A. Movilla Fernandez, J. Schieck, and
  the JADE Collaboration","Study of moments of event shapes in e+e- annihilation using JADE data","JADE note 147 submitted as contributed paper to ICHEP 2004, corrected
  statistical error of 6 observable average and several typos",,,"MPP-2004-100","hep-ex",,"  Data from e+e- annihilation into hadrons collected by the JADE experiment at
centre-of-mass energies between 14 GeV and 44 GeV were used to study moments of
event shape distributions. The data were compared with Monte Carlo models and
with predictions from QCD NLO order calculations. The strong coupling constant
measured from the moments is alpha_S(M_Z) = 0.1286 +/- 0.0007 (stat) +/- 0.0011
(expt) +/- 0.0022 (had) +/- 0.0068 (theo), alpha_S(M_Z) = 0.1286 +/- 0.0072
(total error), consistent with the world average. However, systematic
deficiencies in the QCD NLO order predictions are visible for some of the
higher moments.
","[{""version"":""v1"",""created"":""Tue, 24 Aug 2004 13:20:03 GMT""},{""version"":""v2"",""created"":""Mon, 6 Sep 2004 15:15:31 GMT""}]","2007-05-23"
"hep-ex/0408124","Harold Jackson Dr","H. E. Jackson","Transversity and Spin Structure Functions","Invited talk at the XXIV Physics in Collision Conference (PIC04)
  Boston, USA, June 2004, 15 pages, LaTex, 9 eps figures. PSN MONT03",,,,"hep-ex",,"  Measurements of single-spin asymmetries for semi-inclusive electro-production
of pions and kaons in deep-inelastic scattering with transverse target
polarization open a new window on the transverse quark and gluon structure of
the nucleon. The first experimental results from such measurements as well as
experiments in progress are discussed. Properties of the spin-dependent Collins
fragmentation function and prospects for extracting the transversity are
reviewed and evidence for nonzero Sivers asymmetries as manifestations of quark
orbital angular momentum is evaluated.
","[{""version"":""v1"",""created"":""Tue, 24 Aug 2004 15:30:10 GMT""}]","2007-05-23"
"hep-lat/0408033","Abdou M. Abdel-Rehim","Abdou M. Abdel-Rehim and Randy Lewis","Pion form factor with twisted mass QCD","Talk presented at Lattice2004(spectrum), 3 pages, one reference added
  and one typo fixed",,"10.1016/j.nuclphysbps.2004.11.380",,"hep-lat",,"  The pion form factor is calculated using quenched twisted mass QCD with
beta=6.0 and maximal twisting angle omega=pi/2. Two pion masses and several
values of momentum transfer are considered. The momentum averaging procedure of
Frezzotti and Rossi is used to reduce lattice spacing errors, and numerical
results are consistent with the expected O(a) improvement.
","[{""version"":""v1"",""created"":""Mon, 23 Aug 2004 20:47:31 GMT""},{""version"":""v2"",""created"":""Fri, 10 Sep 2004 21:54:36 GMT""}]","2009-11-10"
"hep-lat/0408034","Attilio Cucchieri","A.Cucchieri, T.Mendes and A.Mihara","Numerical Study of the Ghost-Gluon Vertex in Landau gauge","19 pages, 6 figures, 9 tables, using axodraw.sty; minor modifications
  in the abstract, introduction and conclusions","JHEP0412:012,2004","10.1088/1126-6708/2004/12/012",,"hep-lat hep-ph",,"  We present a numerical study of the ghost-gluon vertex and of the
corresponding renormalization function \widetilde{Z}_1(p^2) in minimal Landau
gauge for SU(2) lattice gauge theory. Data were obtained for three different
lattice volumes (V = 4^4, 8^4, 16^4) and for three lattice couplings \beta =
2.2, 2.3, 2.4. Gribov-copy effects have been analyzed using the so-called
smeared gauge fixing. We also consider two different sets of momenta (orbits)
in order to check for possible effects due to the breaking of rotational
symmetry. The vertex has been evaluated at the asymmetric point (0;p,-p) in
momentum-subtraction scheme. We find that \widetilde{Z}_1(p^2) is approximately
constant and equal to 1, at least for momenta p > ~ 1 GeV. This constitutes a
nonperturbative verification of the so-called nonrenormalization of the Landau
ghost-gluon vertex. Finally, we use our data to evaluate the running coupling
constant \alpha_s(p^2).
","[{""version"":""v1"",""created"":""Tue, 24 Aug 2004 12:42:41 GMT""},{""version"":""v2"",""created"":""Mon, 17 Jan 2005 11:49:24 GMT""}]","2008-11-26"
"hep-ph/0408245","Steffen Schumann","T. Gleisberg, S. Hoeche, F. Krauss, A. Schaelicke, S. Schumann, J.
  Winter and G. Soff","Towards a fragmentation model for Sherpa","4 pages, 2 figures. Talk given by S. Schumann at the International
  Conference on Linear Colliders, 19-23 April 2004, Paris, France",,,,"hep-ph",,"  Some results highlighting the status of a new version of a cluster
fragmentation model for the Monte Carlo event generator Sherpa are presented.
In its present version this model is capable of simulating e+e- annihilation
events into light-quark and gluon jets. We compare results for different
multiplicity and momentum distributions to available SLD and LEP data as well
as to results obtained with Herwig and Pythia.
","[{""version"":""v1"",""created"":""Mon, 23 Aug 2004 16:00:16 GMT""}]","2007-05-23"
"hep-ph/0408246","Andre de Gouvea","Andre de Gouvea (Northwestern U.)","Neutrino Properties and Tests of Symmetries","8 pages, 3 eps figures. Talk at Neutrino 2004",,"10.1016/j.nuclphysbps.2005.01.102",,"hep-ph",,"  The fact that neutrinos have mass allows them to possess many other
properties, like a magnetic dipole moment and a finite decay width. Theoretical
expectations for these are, however, well beyond current experimental bounds,
and the discovery of new exotic neutrino properties would indicate the presence
of (more) new physics. Here, I review some of the current bounds on exotic
neutrino properties. Neutrino experiments are unique probes of several
fundamental space-time symmetries, including invariance under CP and Lorentz
transformations. I discuss how precision neutrino experiments are used to test
some of the most fundamental principles of physics at unprecedented levels.
","[{""version"":""v1"",""created"":""Mon, 23 Aug 2004 16:06:19 GMT""}]","2009-11-10"
"hep-ph/0408247","Thomas Hahn","T. Hahn","New Developments for Automatic Loop Calculations","3 pages, contribution to the Linear Collider Workshop, Paris, April
  19-23, 2004",,,"MPP-2004-97","hep-ph",,"  Two methods to reduce the CPU time needed for the numerical evaluation of
cross-sections and similar quantities are discussed.
","[{""version"":""v1"",""created"":""Mon, 23 Aug 2004 16:20:39 GMT""}]","2007-05-23"
"hep-ph/0408248","Ben Lillie","JoAnne L. Hewett, Ben Lillie, Manuel Masip and Thomas G. Rizzo","Signatures of long-lived gluinos in split supersymmetry","18 pages, 7 figures","JHEP 0409:070,2004","10.1088/1126-6708/2004/09/070","SLAC-PUB-10630, UG-FT-166-04","hep-ph astro-ph hep-ex",,"  We examine the experimental signatures for the production of gluinos at
colliders and in cosmic rays within the split supersymmetry scenario. Unlike in
the MSSM, the gluinos in this model are relatively long-lived due to the large
value of the squark masses which mediate their decay. Searches at colliders are
found to be sensitive to the nature of gluino fragmentation as well as the
gluino-hadron interactions with nuclei and energy deposition as it traverses
the detector. We find that the worst-case scenario, where a neutral
gluino-hadron passes through the detector with little energy deposition, is
well described by a monojet signature. For this case, using Run I data we
obtain a bound of $m_{\tilde g} > 170$ GeV; this will increase to 210(1100) GeV
at Run II(LHC) if no excess events are observed. In the opposite case, where a
charged gluino-hadron travels through the detector, a significantly greater
reach is obtained via stable charged particle search techniques. We also
examine the production of gluino pairs in the atmosphere by cosmic rays and
show they are potentially observable at IceCube; this would provide a
cross-check for observations at hadron colliders.
","[{""version"":""v1"",""created"":""Mon, 23 Aug 2004 18:40:59 GMT""}]","2010-02-03"
"hep-ph/0408249","John Collins","John C. Collins, Andreas Metz","Universality of soft and collinear factors in hard-scattering
  factorization","4 pages. Extra references. Text and references as in published
  version","Phys.Rev.Lett. 93 (2004) 252001","10.1103/PhysRevLett.93.252001",,"hep-ph",,"  Universality in QCD factorization of parton densities, fragmentation
functions, and soft factors is endangered by the process dependence of the
directions of Wilson lines in their definitions. We find a choice of directions
that is consistent with factorization and that gives universality between
e^+e^- annihilation, semi-inclusive deep-inelastic scattering, and the
Drell-Yan process. Universality is only modified by a time-reversal
transformation of the soft function and parton densities between Drell-Yan and
the other processes, whose only effect is the known reversal of sign for T-odd
parton densities like the Sivers function. The modifications of the definitions
needed to remove rapidity divergences with light-like Wilson lines do not
affect the results.
","[{""version"":""v1"",""created"":""Mon, 23 Aug 2004 19:52:36 GMT""},{""version"":""v2"",""created"":""Mon, 23 Aug 2004 20:40:21 GMT""},{""version"":""v3"",""created"":""Fri, 10 Dec 2004 21:50:16 GMT""}]","2009-11-10"
"hep-ph/0408250","Nobuhito Maru","K. Hasegawa, C.S. Lim and Nobuhito Maru","Towards Gravity-Gauge-Higgs Unification","2 pages, Talk presented by N.M. at YITP workshop on ``Quantum Field
  Theory 2004'', Yukawa Institute for Theoretical Physics at Kyoto University,
  Japan, July 13-16, 2004",,,,"hep-ph",,"  We discuss a possibility to solve the gauge hierarchy problem in the
framework of Gravity-Gauge-Higgs Unification scenario. We have calculated
1-loop correction to the mass of the scalar field, which is originated from
55-component of the metric, in five dimensional gravity theory with the bulk
scalar field compactified on S^1. It is shown that the quadratic divergences
are canceled and the finite mass is generated by explicit diagrammatic
calculations and the effective potential calculations.
","[{""version"":""v1"",""created"":""Tue, 24 Aug 2004 03:27:28 GMT""}]","2007-05-23"
"hep-ph/0408251","Peter Ouyang","Igor R. Klebanov and Peter Ouyang","Do Chiral Soliton Models Predict Pentaquarks?","Contribution to proceedings of QCD 2004",,"10.1142/9789812702326_0019","PUPT-2133","hep-ph",,"  We reconsider the relationship between the bound state and the SU(3) rigid
rotator approaches to strangeness in chiral soliton models. For non-exotic
$S=-1$ baryons the bound state approach matches for small $m_K$ onto the rigid
rotator approach, and the bound state mode turns into the rotator zero-mode.
However, for small $m_K$, there are no $S=+1$ kaon bound states or resonances
in the spectrum. This shows that for large $N$ and small $m_K$ the exotic state
is an artifact of the rigid rotator approach. An $S=+1$ near-threshold state
with the quantum numbers of the $\Theta^+$ pentaquark comes into existence only
when sufficiently strong SU(3) breaking is introduced into the chiral
lagrangian. Therefore, pentaquarks are not generic predictions of the chiral
soliton models.
","[{""version"":""v1"",""created"":""Tue, 24 Aug 2004 03:36:55 GMT""}]","2017-08-23"
"hep-ph/0408252","Xing Gang Wu","Tao Huang and Xing-Gang Wu","A Model for the Twist-3 Wave Function of the Pion and Its Contribution
  to the Pion Form Factor","22pages,4 figures. Phys.Rev. D70, 093013(2004) (in press)","Phys.Rev. D70 (2004) 093013","10.1103/PhysRevD.70.093013",,"hep-ph",,"  A model for the twist-3 wave function $\psi_p(x,\mathbf{k_\perp})$ of the
pion has been constructed based on the moment calculation by applying the QCD
sum rules, whose distribution amplitude has a better end-point behavior than
that of the asymptotic one. With this model wave function, the twist-3
contributions including both the usual helicity components
($\lambda_1+\lambda_2=0$) and the higher helicity components
($\lambda_1+\lambda_2=\pm 1$) to the pion form factor have been studied within
the modified pQCD approach. Our results show that the twist-3 contribution
drops fast and it becomes less than the twist-2 contribution at $Q^2\sim
10GeV^2$. The higher helicity components in the twist-3 wave function will give
an extra suppression to the pion form factor. The model dependence of the
twist-3 contribution to the pion form factor has been studied by comparing
three different models. When all the power contributions, which include higher
order in $\alpha_s$, higher helicities, higher twists in DA and etc., have been
taken into account, it is expected that the hard contributions will fit the
present experimental data well at the energy region where pQCD is applicable.
","[{""version"":""v1"",""created"":""Tue, 24 Aug 2004 03:34:54 GMT""},{""version"":""v2"",""created"":""Thu, 7 Oct 2004 04:35:48 GMT""},{""version"":""v3"",""created"":""Fri, 26 Nov 2004 00:07:44 GMT""}]","2009-11-10"
"hep-ph/0408253","Chang-Hwan Lee","G.E. Brown, C.-H. Lee, M. Rho","What Hath RHIC Wrought ? : The Chiral Restoration Phase Transition Found
  at RHIC","5 pages, 1 figure, contribution to INPC2004",,,,"hep-ph",,"  Given Brown/Rho scaling we thought of the mesons which are observed in
Nambu-Jona Lasinio theory as collective modes. The pi, sigma, rho and A_1,
should go smoothly through T_c as the temperature rose, going massless as T
comes to T_c.
","[{""version"":""v1"",""created"":""Tue, 24 Aug 2004 07:19:44 GMT""}]","2007-05-23"
"hep-ph/0408254","Arlene Cristina Aguilar","A. C. Aguilar and A. A. Natale","A dynamical gluon mass solution in a coupled system of the
  Schwinger-Dyson equations","17 pages, 7 figures - Revised version to be consistent with erratum
  to appear in JHEP","JHEP0408:057,2004","10.1088/1126-6708/2004/08/057",,"hep-ph",,"  We study numerically the Schwinger-Dyson equations for the coupled system of
gluon and ghost propagators in the Landau gauge and in the case of pure gauge
QCD. We show that a dynamical mass for the gluon propagator arises as a
solution while the ghost propagator develops an enhanced behavior in the
infrared regime of QCD. Simple analytical expressions are proposed for the
propagators, and the mass dependency on the $\Lambda_{QCD}$ scale and its
perturbative scaling are studied. We discuss the implications of our results
for the infrared behavior of the coupling constant, which, according to fits
for the propagators infrared behavior, seems to indicate that $\alpha_s (q^2)
\to 0$ as $q^2 \to 0$.
","[{""version"":""v1"",""created"":""Tue, 24 Aug 2004 08:49:56 GMT""},{""version"":""v2"",""created"":""Tue, 11 Jan 2005 16:44:42 GMT""}]","2008-11-26"
"hep-ph/0408255","Krzysztof Golec-Biernat","K. Golec-Biernat","Saturation scale from the Balitsky-Kovchegov equation","4 pages, 2 figures, presented at the DIS 2004 Workshop, Strbske
  Pleso, Slovakia, 14-18 April 2004",,,,"hep-ph",,"  Recently Munier and Peschanski presented an analysis of the
Balitsky--Kovchegov (BK) equation concerning the extraction of the saturation
scale, using a simpler equation. We numerically analyze the full BK equation
confirming the universality of their analysis.
","[{""version"":""v1"",""created"":""Tue, 24 Aug 2004 09:59:45 GMT""}]","2007-05-23"
"hep-ph/0408256","Kingman Cheung","Kingman Cheung (NTHU)","Light Strange-beauty Squarks","3 pages, 1 figure. Parallel talk given in the SUSY session at the
  International Conference on Linear Colliders, LCWS04, 19-23 April 2004,
  Paris, France, and in the Flavor and CP session at SUSY 2004, June 17-23,
  2004, Tsukuba, Japan",,,,"hep-ph",,"  We summarize a study on the production, decay, and detection of the
strange-beauty squark as light as 200 GeV at hadronic and $e^+ e^-$ colliders.
It was motivated by nearly maximal mixing between strange and beauty squarks.
","[{""version"":""v1"",""created"":""Tue, 24 Aug 2004 10:01:00 GMT""}]","2007-05-23"
"hep-ph/0408257","Harmen J. Warringa","Harmen J. Warringa","Thermodynamics of the 1+1-dimensional nonlinear sigma model through
  next-to-leading order in 1/N","5 pages, 2 figures. Talk given at the 6th conference on Strong and
  Electroweak Matter 2004, Helsinki, Finland, 16-19 Jun 2004",,"10.1142/9789812702159_0024",,"hep-ph",,"  We discuss the thermodynamics of the O(N) nonlinear sigma model in 1+1
dimensions. In particular we investigate the NLO 1/N correction to the 1PI
finite temperature effective potential expressed in terms of an auxiliary
field. The effective potential contains temperature-dependent divergences which
cannot be renormalized properly. We argue that this problem vanishes at the
minimum of the effective potential. Therefore physical quantities like the
pressure are well defined and can be renormalized in a temperature-independent
way. We give a general argument for the occurrence of temperature-dependent
divergences outside the minimum. We present calculations of the pressure and
show that 1/N is a good expansion. It turns out that the pressure normalized to
that at infinite temperature is N-independent like the flavor independence of
the same quantity in QCD.
","[{""version"":""v1"",""created"":""Tue, 24 Aug 2004 11:35:08 GMT""}]","2017-08-23"
"hep-ph/0408258","Damijan Janc","A. Del Fabbro, D. Janc, M. Rosina, D. Treleani","Production and detection of doubly charmed tetraquarks","6 pages, 5 figures","Phys.Rev. D71 (2005) 014008","10.1103/PhysRevD.71.014008",,"hep-ph",,"  The feasibility of tetraquark detection is studied. For the cc\bar{u}\bar{d}
tetraquark we show that in present (SELEX, Tevatron, RHIC) and future
facilities (LHCb, ALICE) the production rate is promising and we propose some
detectable decay channels.
","[{""version"":""v1"",""created"":""Tue, 24 Aug 2004 12:40:45 GMT""}]","2009-11-10"
"hep-th/0408164","Andrei Linde","Andrei Linde","Creation of a Compact Topologically Nontrivial Inflationary Universe","9 pages 2 figures, new materials and references added","JCAP 0410:004,2004","10.1088/1475-7516/2004/10/004",,"hep-th astro-ph gr-qc hep-ph",,"  If inflation can occur only at the energy density V much smaller than the
Planck density, which is the case for many inflationary models based on string
theory, then the probability of quantum creation of a closed or an infinitely
large open inflationary universe is exponentially suppressed for all known
choices of the wave function of the universe. Meanwhile under certain
conditions there is no exponential suppression for creation of topologically
nontrivial compact flat or open inflationary universes. This suggests, contrary
to the standard textbook lore, that compact flat or open universes with
nontrivial topology should be considered a rule rather than an exception.
","[{""version"":""v1"",""created"":""Mon, 23 Aug 2004 19:00:30 GMT""},{""version"":""v2"",""created"":""Sat, 11 Sep 2004 03:30:28 GMT""}]","2009-09-29"
"hep-th/0408176","Richard Shurtleff","Richard Shurtleff","Spin 1/2 and Invariant Coefficients II. Massless","31 pages, Latex, no figures, 7 problems, download associated
  Mathematica notebook at http://ox.wit.edu/~shurtleffr/",,,,"hep-th",,"  A `covariant' field that transforms like a relativistic field operator is
required to be a linear combination of `canonical' fields that transform like
annihilation and creation operators and with invariant coefficients. The
Invariant Coefficient Hypothesis contends that this familiar construction by
itself yields useful results. Thus, just the transformation properties are
considered here, not the specific properties of annihilation or creation
operators. The results include Weyl wave equations for some massless fields
and, for other fields, Weyl-like noncovariant wave equations that are allowed
here because no assumptions are made to exclude them. The hypothesis produces
wave equations for translation-matrix-invariant fields while
translation-matrix-dependent coefficient functions have currents that are the
vector potentials of the coefficient functions of those
translation-matrix-invariant fields. The statement is proven by showing that
Maxwell equations are satisfied, though in keeping with the hypothesis they are
not assumed to hold. The underlying mechanism is the same for the massless
class here as it is for the massive class in a previous paper, suggesting that
spin 1/2 particles may have a universal electromagnetic-type charge whether
they are massive or massless.
  Keywords: Relativistic quantum fields; neutrino; Poincare transformations
","[{""version"":""v1"",""created"":""Mon, 23 Aug 2004 18:25:32 GMT""}]","2007-05-23"
"hep-th/0408177","P. S. Howe","P.S. Howe","$R^4$ terms in supergravity and M-theory","Contribution to Deserfest: A celebration of the life and work of
  Stanley Deser, Ann Arbor, Michigan, April 3-5 2004. 12 pages",,,"KCL-MTH-04-12","hep-th",,"  Higher-order invariants and their role as possible counterterms for
supergravity theories are reviewed. It is argued that N=8 supergravity will
diverge at 5 loops. The construction of $R^4$ superinvariants in string and
M-theory is discussed.
","[{""version"":""v1"",""created"":""Mon, 23 Aug 2004 16:05:41 GMT""}]","2007-05-23"
"hep-th/0408178","Marcus Spradlin","Marcus Spradlin, Anastasia Volovich","A Pendant for Polya: The One-Loop Partition Function of N=4 SYM on R x
  S^3","39 pages, harvmac. v2: references and some clarifications added, v3:
  proof of (3.28) corrected","Nucl.Phys. B711 (2005) 199-230","10.1016/j.nuclphysb.2005.01.007","NSF-KITP-04-99","hep-th",,"  We study weakly coupled SU(N) N = 4 super Yang-Mills theory on R x S^3 at
infinite N, which has interesting thermodynamics, including a Hagedorn
transition, even at zero Yang-Mills coupling. We calculate the exact one-loop
partition function below the Hagedorn temperature. Our calculation employs the
representation of the one-loop dilatation operator as a spin chain Hamiltonian
acting on neighboring sites and a generalization of Polya's counting of
`necklaces' (gauge-invariant operators) to include necklaces with a `pendant'
(an operator which acts on neighboring beads). We find that the one-loop
correction to the Hagedorn temperature is delta ln T_H = + lambda/8 pi^2.
","[{""version"":""v1"",""created"":""Mon, 23 Aug 2004 19:20:03 GMT""},{""version"":""v2"",""created"":""Thu, 26 Aug 2004 16:25:04 GMT""},{""version"":""v3"",""created"":""Mon, 20 Sep 2004 00:08:23 GMT""}]","2009-11-10"
